"1107.1101","Steven Meyer","Steven Meyer","Misbehavior in Mobile Application Markets","December 2010",,,,"cs.CR","http://arxiv.org/licenses/nonexclusive-distrib/1.0/","  Mobile application markets facilitate the distribution of applications and
thus help developers advertise their work and customers find useful
applications. In addition, the operators of mobile application markets can
control the quality and the content of the applications. These markets are
growing rapidly with more than 300'000 application in the App Store of Apple
and more than 100'000 in the Android Market of Google. This is not only a great
opportunity for phone manufacturers to earn money but also for indie developers
(single or small teams of developers with small financial support) who can thus
have a great distribution channel. Steve Demeter, the Trim game developer for
iPhone, became millionaire with a single puzzle game . Obviously, as new
markets generate a lot of money, the temptation of misbehavior to steal part of
the benefits is big. The first famous case was the one of Molinker who
self-rated his applications with 5 stars to pump up his ranking in order to
increase its revenue stream. In this report, we will consider the problem of
misbehavior in mobile application markets. We will investigate multiple attacks
by misbehaving developers, users or network operators that aim at breaking
rules for their own benefit, managing to outwit the operators' control on which
applications can be installed. We notably suggest novel attacks that may affect
mobile markets in the future: in particular, we show that it is possible to get
revenue for applications created by someone else, trick a user to download and
buy an application and new ways to pump up an application's ranking. We will
also discuss possible solutions against spyware applications and cheating
developer
","[{""version"":""v1"",""created"":""Wed, 6 Jul 2011 11:30:13 GMT""}]","2011-07-07"
"1107.1102","Hsiu-Hau Lin","Wen-Min Huang, Yen-Chen Lee, Toshiya Hikihara and Hsiu-Hau Lin","Edge magnetism of Heisenberg model on honeycomb lattice","4 pages, 3 figures",,,,"cond-mat.mes-hall","http://arxiv.org/licenses/nonexclusive-distrib/1.0/","  In our previous study, a single-branch of ferromagnetic magnon with linear
dispersion is shown to exist near the (uncompensated) zigzag edge for
Heisenberg model on honeycomb lattice. Here we develop a field-theory
description for the edge magnon and find its dynamics is captured by the
one-dimensional relativistic Klein-Gordon equation. It is intriguing that the
boundary field theory for the edge magnon is tied up with its bulk counterpart,
described by the two-dimensional Klein-Gordon equation. Furthermore, we also
reveal how the parity symmetry relates evanescent modes on opposite edges in a
honeycomb nanoribbon. By employing alternative methods, including Schwinger
bosons and density-matrix renormalization group, we also demonstrate that the
relativistic edge magnon is robust even when the Neel order in the bulk is
destroyed by quantum fluctuations. The edge magnon is a direct consequence of
uncompensated edge and may be verified in realistic materials by experimental
probes.
","[{""version"":""v1"",""created"":""Wed, 6 Jul 2011 11:48:06 GMT""},{""version"":""v2"",""created"":""Thu, 7 Jul 2011 21:37:49 GMT""}]","2011-07-11"
"1107.1103","Jakub Zakrzewski","Michal Maik, Pierfrancesco Buonsante, Alessandro Vezzani and Jakub
  Zakrzewski","Dipolar bosons on an optical lattice ring","decompressed version now reaching 6 pages",,"10.1103/PhysRevA.84.053615",,"cond-mat.quant-gas quant-ph","http://arxiv.org/licenses/nonexclusive-distrib/1.0/","  We consider an ultra-small system of polarized bosons on an optical lattice
with a ring topology interacting via long range dipole-dipole interactions.
Dipoles polarized perpendicular to the plane of the ring reveal sharp
transitions between different density wave phases. As the strength of the
dipolar interactions is varied the behavior of the transitions is first-order
like. For dipoles polarized in the plane of the ring the transitions between
possible phases show pronounced sensitivity to the lattice depth. The abundance
of possible configurations may be useful for quantum information applications.
","[{""version"":""v1"",""created"":""Wed, 6 Jul 2011 11:55:43 GMT""},{""version"":""v2"",""created"":""Mon, 17 Oct 2011 14:50:58 GMT""}]","2013-05-29"
"1107.1104","Samur Araujo","Samur Araujo, Jan Hidders, Daniel Schwabe and Arjen P. de Vries","SERIMI - Resource Description Similarity, RDF Instance Matching and
  Interlinking",,,,,"cs.DB","http://arxiv.org/licenses/nonexclusive-distrib/1.0/","  The interlinking of datasets published in the Linked Data Cloud is a
challenging problem and a key factor for the success of the Semantic Web.
Manual rule-based methods are the most effective solution for the problem, but
they require skilled human data publishers going through a laborious, error
prone and time-consuming process for manually describing rules mapping
instances between two datasets. Thus, an automatic approach for solving this
problem is more than welcome. In this paper, we propose a novel interlinking
method, SERIMI, for solving this problem automatically. SERIMI matches
instances between a source and a target datasets, without prior knowledge of
the data, domain or schema of these datasets. Experiments conducted with
benchmark collections demonstrate that our approach considerably outperforms
state-of-the-art automatic approaches for solving the interlinking problem on
the Linked Data Cloud.
","[{""version"":""v1"",""created"":""Wed, 6 Jul 2011 11:56:34 GMT""}]","2011-07-07"
"1107.1105","Ross McKenzie","Laura K. McKemmish, Ross H. McKenzie, Noel S. Hush, Jeffrey R. Reimers","Quantum entanglement between electronic and vibrational degrees of
  freedom in molecules",,"Journal of Chemical Physics 135, 244110 (2011)","10.1063/1.3671386",,"quant-ph cond-mat.mes-hall physics.chem-ph","http://arxiv.org/licenses/nonexclusive-distrib/1.0/","  We consider the quantum entanglement of the electronic and vibrational
degrees of freedom in molecules with a tendency towards double welled
potentials using model coupled harmonic diabatic potential-energy surfaces. The
von Neumann entropy of the reduced density matrix is used to quantify the
electron-vibration entanglement for the lowest two vibronic wavefunctions in
such a bipartite system. Significant entanglement is found only in the region
in which the ground vibronic state contains a density profile that is bimodal
(i.e., contains two separate local minima). However, in this region two
distinct types of entanglement are found: (1) entanglement that arises purely
from the degeneracy of energy levels in the two potential wells and which is
destroyed by slight asymmetry, and (2) entanglement that involves strongly
interacting states in each well that is relatively insensitive to asymmetry.
These two distinct regions are termed fragile degeneracy-induced entanglement
and persistent entanglement, respectively. Six classic molecular systems
describable by two diabatic states are considered: ammonia, benzene,
semibullvalene, pyridine excited triplet states, the Creutz-Taube ion, and the
radical cation of the ""special pair"" of chlorophylls involved in
photosynthesis. These chemically diverse systems are all treated using the same
general formalism and the nature of the entanglement that they embody is
elucidated.
","[{""version"":""v1"",""created"":""Wed, 6 Jul 2011 12:13:15 GMT""}]","2012-02-24"
"1107.1106","Hubert Lacoin","Hubert Lacoin","Superdiffusivity for Brownian motion in a Poissonian potential with long
  range correlation II: upper bound on the volume exponent","28 page 4 figures, to appear in AIHP",,"10.1214/11-AIHP457",,"math.PR","http://arxiv.org/licenses/nonexclusive-distrib/1.0/","  This paper continues a study on trajectories of Brownian Motion in a field of
soft trap whose radius distribution is unbounded. We show here for both
point-to-point and point-to-plane model the volume exponent (the exponent
associated to transversal fluctuation of the trajectories) is strictly less
than one and give an explicit upper bound that depends on the parameters of the
problem. In some specific cases, this upper bound matches the lower bound
proved in the first part of this work and we get the exact value of the volume
exponent.
","[{""version"":""v1"",""created"":""Wed, 6 Jul 2011 12:17:00 GMT""},{""version"":""v2"",""created"":""Mon, 11 Jul 2011 12:01:44 GMT""},{""version"":""v3"",""created"":""Tue, 13 Dec 2011 20:21:42 GMT""}]","2015-05-28"
"1107.1107","Costantino Sigismondi","Costantino Sigismondi","Delta Scorpii 2011 periastron: worldwide observational campaign and
  preliminary photometric analysis","9 pages, 3 figures. Proc. of the XII Italo-Korean meeting of
  Relativistic Astrophysics, 4-8 July, 2011, Pescara -Italy",,,,"astro-ph.SR astro-ph.IM","http://arxiv.org/licenses/nonexclusive-distrib/1.0/","  Delta Scorpii is a double giant Be star in the forefront of the Scorpio, well
visible to the naked eye, being normally of magnitude 2.3. In the year 2000 its
luminosity rose up suddenly to the magnitude 1.6, changing the usual aspect of
the constellation of Scorpio. This phenomenon has been associated to the close
periastron of the companion, orbiting on a elongate ellipse with a period of
about 11 years. The periastron, on basis of high precision astrometry, is
expected to occur in the first decade of July 2011, and the second star of the
system is approaching the atmosphere of the primary, whose circumstellar disk
has a H-alpha diameter of 5 milliarcsec, comparable with the periastron
distance. The preliminary results of a photometric campaign, here presented in
the very days of the periastron, show an irregular behavior of the star's
luminosity, which can reflect some shocks between material around the two
stars. The small luminosity increasement detected in the observation of 5 of
July 2011 at 20 UT may suggest that the periastron phenomena are now going to
start.
","[{""version"":""v1"",""created"":""Wed, 6 Jul 2011 12:23:13 GMT""}]","2011-07-07"
"1107.1108","Antonio Rodriguez","Antonio Rodr\'iguez and Constantino Tsallis","A scale-invariant probabilistic model based on Leibniz-like pyramids",,,"10.1063/1.3688312",,"cond-mat.stat-mech math-ph math.MP","http://arxiv.org/licenses/nonexclusive-distrib/1.0/","  We introduce a family of probabilistic {\it scale-invariant} Leibniz-like
pyramids and $(d+1)$-dimensional hyperpyramids ($d=1,2,3,...$), characterized
by a parameter $\nu>0$, whose value determines the degree of correlation
between $N$ $(d+1)$-valued random variables. There are $(d+1)^N$ different
events, and the limit $\nu\to\infty$ corresponds to independent random
variables, in which case each event has a probability $1/(d+1)^N$ to occur. The
sums of these $N$ $\,(d+1)$-valued random variables correspond to a
$d-$dimensional probabilistic model, and generalizes a recently proposed
one-dimensional ($d=1$) model having $q-$Gaussians (with $q=(\nu-2)/(\nu-1)$
for $\nu \in [1,\infty)$) as $N\to\infty$ limit probability distributions for
the sum of the $N$ binary variables [A. Rodr\'{\i}guez {\em et al}, J. Stat.
Mech. (2008) P09006; R. Hanel {\em et al}, Eur. Phys. J. B {\bf 72}, 263
(2009)]. In the $\nu\to\infty$ limit the $d-$dimensional multinomial
distribution is recovered for the sums, which approach a $d-$dimensional
Gaussian distribution for $N\to\infty$. For any $\nu$, the conditional
distributions of the $d-$dimensional model are shown to yield the corresponding
joint distribution of the $(d-1)$-dimensional model with the same $\nu$. For
the $d=2$ case, we study the joint probability distribution, and identify two
classes of marginal distributions, one of them being asymmetric and
scale-invariant, while the other one is symmetric and only asymptotically
scale-invariant. The present probabilistic model is proposed as a testing
ground for a deeper understanding of the necessary and sufficient conditions
for having $q$-Gaussian attractors in the $N\to\infty$ limit, the ultimate goal
being a neat mathematical view of the causes clarifying the ubiquitous
emergence of $q$-statistics verified in many natural, artificial and social
systems.
","[{""version"":""v1"",""created"":""Wed, 6 Jul 2011 12:30:15 GMT""}]","2015-05-28"
"1107.1109","Leonid E. Golub","L.E. Golub and E.L. Ivchenko","Spin orientation by electric current in (110) quantum wells","8 pages, 2 figures",,"10.1103/PhysRevB.84.115303",,"cond-mat.mes-hall","http://arxiv.org/licenses/nonexclusive-distrib/1.0/","  We develop a theory of spin orientation by electric current in (110)-grown
semiconductor quantum wells. The controversy in the factor of two from two
existed approaches is resolved by pointing out the importance of energy
relaxation in this problem. The limiting cases of fast and slow energy
relaxation relative to spin relaxation are considered for asymmetric (110)
quantum wells. For symmetricly-doped structures the effect of spin orientation
is shown to exist due to spatial fluctuations of the Rashba spin-orbit
splitting. We demonstrate that the spin orientation depends strongly on the
correlation length of these fluctuations as well as on the ratio of the energy
and spin relaxation rates. The time-resolved kinetics of spin polarization by
electric current is also governed by the correlation length being not purely
exponential at slow energy relaxation. Electrical spin orientation in
two-dimensional topological insulators is calculated and compared with the spin
polarization induced by the magnetic field.
","[{""version"":""v1"",""created"":""Wed, 6 Jul 2011 12:35:21 GMT""}]","2015-05-28"
"1107.1110","Thomas Bloom","Thomas Bloom","Translation invariant equations and the method of Sanders",,,"10.1112/blms/bds045",,"math.NT math.CO","http://arxiv.org/licenses/nonexclusive-distrib/1.0/","  We extend the recent improvement of Roth's theorem on three term arithmetic
progressions by Sanders to obtain similar results for the problem of locating
non-trivial solutions to translation invariant linear equations in many
variables in both $\bbz/N\bbz$ and $\bbf_q[t]$.
","[{""version"":""v1"",""created"":""Wed, 6 Jul 2011 12:43:20 GMT""},{""version"":""v2"",""created"":""Mon, 30 Jan 2012 11:14:55 GMT""}]","2012-11-26"
"1107.1113","Hyun Min Lee","Yeong Gyun Kim, Hyun Min Lee, Wan-Il Park","The mu problem and sneutrino inflation","27 pages, no figures, To appear in JHEP","JHEP 1108:126,2011","10.1007/JHEP08(2011)126",,"hep-ph","http://arxiv.org/licenses/nonexclusive-distrib/1.0/","  We consider sneutrino inflation and post-inflation cosmology in the singlet
extension of the MSSM with approximate Peccei-Quinn(PQ) symmetry, assuming that
supersymmetry breaking is mediated by gauge interaction. The PQ symmetry is
broken by the intermediate-scale VEVs of two flaton fields, which are
determined by the interplay between radiative flaton soft masses and higher
order terms. Then, from the flaton VEVs, we obtain the correct mu term and the
right-handed(RH) neutrino masses for see-saw mechanism. We show that the RH
sneutrino with non-minimal gravity coupling drives inflation, thanks to the
same flaton coupling giving rise to the RH neutrino mass. After inflation,
extra vector-like states, that are responsible for the radiative breaking of
the PQ symmetry, results in thermal inflation with the flaton field, solving
the gravitino problem caused by high reheating temperature. Our model predicts
the spectral index to be n_s\simeq 0.96 due to the additional efoldings from
thermal inflation. We show that a right dark matter abundance comes from the
gravitino of 100 keV mass and a successful baryogenesis is possible via
Affleck-Dine leptogenesis.
","[{""version"":""v1"",""created"":""Wed, 6 Jul 2011 12:49:01 GMT""},{""version"":""v2"",""created"":""Wed, 24 Aug 2011 09:50:10 GMT""}]","2011-09-09"
"1107.1114","Tsampikos Kottos","Tsampikos Kottos and Boris Shapiro","Thermalization of Strongly Disordered Nonlinear Chains","4 pages, 3 figures","Physical Review E 83, 062103 (2011)","10.1103/PhysRevE.83.062103",,"cond-mat.dis-nn nlin.CD","http://arxiv.org/licenses/nonexclusive-distrib/1.0/","  Thermalization of systems described by the discrete non-linear Schr\""odinger
equation, in the strong disorder limit, is investigated both theoretically and
numerically. We show that introducing correlations in the disorder potential,
while keeping the ""effective"" disorder fixed (as measured by the localization
properties of wavepacket dynamics), strongly facilitate the thermalization
process and lead to a standard grand canonical distribution of the probability
norms associated to each site
","[{""version"":""v1"",""created"":""Wed, 6 Jul 2011 12:52:22 GMT""}]","2011-07-07"
"1107.1115","Yucai Su","Yucai Su","Poisson algebras, Weyl algebras and Jacobi pairs","arXiv admin note: substantial text overlap with arXiv:math/0512268",,,,"math.QA math-ph math.AC math.AG math.MP math.RA","http://arxiv.org/licenses/nonexclusive-distrib/1.0/","  We study Jacobi pairs in details and obtained some properties. We also study
the natural Poisson algebra structure $(\PP,[...,...],...)$ on the space
$\PP:=\C[y]((x^{-\frac1N}))$ for some sufficient large $N$, and introduce some
automorphisms of $(\PP,[...,...],...)$ which are (possibly infinite but
well-defined) products of the automorphisms of forms $e^{\ad_H}$ for $H\in
x^{1-\frac1N}\C[y][[x^{-\frac1N}]]$ and $\tau_c:(x,y)\mapsto(x,y-cx^{-1})$ for
some $c\in\C$. These automorphisms are used as tools to study Jacobi pairs in
$\PP$. In particular, starting from a Jacobi pair $(F,G)$ in $\C[x,y]$ which
violates the two-dimensional Jacobian conjecture, by applying some variable
change $(x,y)\mapsto\big(x^{b},x^{1-b}(y+a_1 x^{-b_1}+...+a_kx^{-b_k})\big)$
for some $b,b_i\in\Q_+,a_i\in\C$ with $b_i<1<b$, we obtain a \QJ pair still
denoted by $(F,G)$ in $\C[x^{\pm\frac1N},y]$ with the form
$F=x^{\frac{m}{m+n}}(f+F_0)$, $G=x^{\frac{n}{m+n}}(g+G_0)$ for some positive
integers $m,n$, and $f,g\in\C[y]$, $F_0,G_0\in x^{-\frac1N}\C[x^{-\frac1N},y]$,
such that $F,G$ satisfy some additional conditions. Then we generalize the
results to the Weyl algebra $\WW=\C[v]((u^{-\frac1N}))$ with relation
$[u,v]=1$, and obtain some properties of pairs $(F,G)$ satisfying $[F,G]=1$,
referred to as Dixmier pairs.
","[{""version"":""v1"",""created"":""Wed, 6 Jul 2011 12:55:42 GMT""},{""version"":""v2"",""created"":""Thu, 7 Jul 2011 16:08:25 GMT""},{""version"":""v3"",""created"":""Wed, 27 Jul 2011 19:38:19 GMT""},{""version"":""v4"",""created"":""Wed, 3 Aug 2011 16:55:44 GMT""},{""version"":""v5"",""created"":""Fri, 19 Aug 2011 09:12:55 GMT""},{""version"":""v6"",""created"":""Tue, 30 Aug 2011 15:33:59 GMT""},{""version"":""v7"",""created"":""Tue, 27 Sep 2011 07:39:11 GMT""},{""version"":""v8"",""created"":""Wed, 12 Oct 2011 17:40:30 GMT""},{""version"":""v9"",""created"":""Mon, 31 Oct 2011 07:24:41 GMT""}]","2011-12-24"
"1107.1116","Sushant Gupta Mr.","Sushant Gupta, R.S. Yadav and B.Das","Flux Pinning by Nano Particles Embedded in Polycrystalline Y-123
  Superconductors","Accepted for Publication in ISST Journal of Applied Physics (IJAP)","ISST Journal of Applied Physics, Vol. 2 No.2, (July-December 2011)
  pp. 1-5",,,"cond-mat.supr-con","http://arxiv.org/licenses/nonexclusive-distrib/1.0/","  Bulk superconductor samples of YBa2Cu3-xZnxO7-{\delta} with x = 0, 0.01, 0.03
are synthesized by solid-state reaction route. The structural characterisation
of all samples has been carried out by x-ray-diffraction (XRD) and transmission
electron microscopy (TEM) techniques. The x-ray diffraction patterns indicate
that the gross structure/phase of YBa2Cu3-xZnxO7-{\delta} do not change with
the substitution of Zn up to x=0.03. In TEM investigations of Zn-doped Y-based
cuprates a number of ZnO nano-flower and nano-rod of Y-211 phase are found
dispersed in regular YBa2Cu3-xZnxO7 matrix. These dispersed nano-flowers of ZnO
and nano-rods of Y-211 phase may serve as flux-pinning centers. These pinning
centers enhance critical current density (Jc) value of these HTSC samples.
","[{""version"":""v1"",""created"":""Wed, 6 Jul 2011 13:01:22 GMT""}]","2012-07-27"
"1107.1117","Elisabeth Vangioni van","Alain Coc (CSNSM, Orsay, France), Stephane Goriely and Yi Xu (ULB
  Bruxelles, Belgique), Matthias Saimpert and Elisabeth Vangioni (IAP, Paris,
  France)","Standard Big-Bang Nucleosynthesis up to CNO with an improved extended
  nuclear network","32 pages, 22 figures, 4 tables, submitted to ApJ Supplement",,"10.1088/0004-637X/744/2/158",,"astro-ph.CO astro-ph.HE nucl-ex","http://arxiv.org/licenses/nonexclusive-distrib/1.0/","  Primordial or Big Bang nucleosynthesis (BBN) is one of the three strong
evidences for the Big- Bang model together with the expansion of the Universe
and the Cosmic Microwave Background radiation. In this study, we improve the
standard BBN calculations taking into account new nuclear physics analyses and
we enlarge the nuclear network until Sodium. This is, in particular, important
to evaluate the primitive value of CNO mass fraction that could affect
Population III stellar evolution. For the first time we list the complete
network of more than 400 reactions with references to the origin of the rates,
including \approx 270 reaction rates calculated using the TALYS code. Together
with the cosmological light elements, we calculate the primordial Beryllium,
Boron, Carbon, Nitrogen and Oxygen nuclei. We performed a sensitivity study to
identify the important reactions for CNO, 9Be and Boron nucleosynthesis. We
reevaluated those important reaction rates using experimental data and/or
theoretical evaluations. The results are compared with precedent calculations:
a primordial Beryllium abundance increase by a factor of 4 compared to its
previous evaluation, but we note a stability for B/H and for the CNO/H
abundance ratio that remains close to its previous value of 0.7 \times 10-15.
On the other hand, the extension of the nuclear network has not changed the 7Li
value, so its abundance is still 3-4 times greater than its observed
spectroscopic value.
","[{""version"":""v1"",""created"":""Wed, 6 Jul 2011 13:03:36 GMT""}]","2015-05-28"
"1107.1118","Davide Vasco Davide Vasco","D. Vasco, D. Klochkov, R. Staubert","Her X-1: the positive cyclotron line energy / luminosity correlation","5 pages, 5 figures, accepted by A&A on 23.06.2011",,"10.1051/0004-6361/201116863",,"astro-ph.HE","http://arxiv.org/licenses/nonexclusive-distrib/1.0/","  Studies of some bright, super-Eddington transient pulsars show a negative
correlation between the energy of the cyclotron resonance scattering feature
(CRSF) and the bolometric luminosity. For Her X-1, using repeated RXTE
observations during 1996-2005, the inverse dependence was found: the energy of
the cyclotron line increases as the luminosity increases. The X-ray flux
measured by the RXTE/ASM (2-10 keV) has been assumed to represent the
luminosity - more precisely: the maximum X-ray flux reached during the
respective 35 d Main-On. Here, we question whether the ASM flux is really an
accurate measure of the bolometric luminosity of the source. We redetermined
the energy of the cyclotron line and performed spectral fits using the combined
data from the PCA (3.5-60 keV) and HEXTE (20-75 keV) instruments on RXTE of the
same 35 d cycles as used in the original work to determine the bolometric flux
from those spectra. We confirm the result of the original analysis that the
cyclotron line energy changes by ~7% for a change in flux by a factor of two.
","[{""version"":""v1"",""created"":""Wed, 6 Jul 2011 13:03:45 GMT""}]","2015-05-28"
"1107.1119","Christoph Hertzberg","Christoph Hertzberg, Ren\'e Wagner, Udo Frese, Lutz Schr\""oder","Integrating Generic Sensor Fusion Algorithms with Sound State
  Representations through Encapsulation of Manifolds",,,,,"cs.RO cs.CV cs.MS","http://arxiv.org/licenses/nonexclusive-distrib/1.0/","  Common estimation algorithms, such as least squares estimation or the Kalman
filter, operate on a state in a state space S that is represented as a
real-valued vector. However, for many quantities, most notably orientations in
3D, S is not a vector space, but a so-called manifold, i.e. it behaves like a
vector space locally but has a more complex global topological structure. For
integrating these quantities, several ad-hoc approaches have been proposed.
  Here, we present a principled solution to this problem where the structure of
the manifold S is encapsulated by two operators, state displacement [+]:S x R^n
--> S and its inverse [-]: S x S --> R^n. These operators provide a local
vector-space view \delta; --> x [+] \delta; around a given state x. Generic
estimation algorithms can then work on the manifold S mainly by replacing +/-
with [+]/[-] where appropriate. We analyze these operators axiomatically, and
demonstrate their use in least-squares estimation and the Unscented Kalman
Filter. Moreover, we exploit the idea of encapsulation from a software
engineering perspective in the Manifold Toolkit, where the [+]/[-] operators
mediate between a ""flat-vector"" view for the generic algorithm and a
""named-members"" view for the problem specific functions.
","[{""version"":""v1"",""created"":""Wed, 6 Jul 2011 13:04:47 GMT""}]","2011-07-07"
