"1107.0965","E. Freeland","E. Freeland, E. Wilcots","Intergalactic Gas in Groups of Galaxies: Implications for Dwarf
  Spheroidal Formation and The Missing Baryons Problem","9 pages, 7 figures, accepted for publication in ApJ",,"10.1088/0004-637X/738/2/145",,"astro-ph.CO","http://arxiv.org/licenses/nonexclusive-distrib/1.0/","  Radio galaxies with bent jets are predominantly located in groups and
clusters of galaxies. We use bent-double radio sources, under the assumption
that their jets are bent by ram-pressure, to probe intragroup medium (IGM) gas
densities in galaxy groups. This method provides a direct measurement of the
intergalactic gas density and allows us to probe IGM gas at large radii and in
systems whose IGM is too cool to be detected by the current generation of X-ray
telescopes. We find gas with densities of 10^(-3)-10^(-4) per cubic centimeter
at group radii from 15-700 kpc. A rough estimate of the total baryonic mass in
intergalactic gas is consistent with the missing baryons being located in the
IGM of galaxy groups. The neutral gas will be easily stripped from dwarf
galaxies with total masses of 10^6-10^7 solar masses in the groups studied
here. Indications are that IGM gas densities in less-massive systems like the
Local Group should be high enough to strip gas from dwarfs like Leo T and, in
combination with tides, produce dwarf spheroidals.
","[{""version"":""v1"",""created"":""Tue, 5 Jul 2011 19:57:04 GMT""}]","2015-05-28"
"1107.0966","Robert Gutermuth","R. A. Gutermuth, J. L. Pipher, S. T. Megeath, P. C. Myers, L. E.
  Allen, and T. S. Allen","A Correlation Between Surface Densities of Young Stellar Objects and Gas
  in Eight Nearby Molecular Clouds","28 pages, 18 figures, Accepted to ApJ",,"10.1088/0004-637X/739/2/84",,"astro-ph.SR","http://arxiv.org/licenses/nonexclusive-distrib/1.0/","  We report the discovery and characterization of a power law correlation
between the local surface densities of Spitzer-identified, dusty young stellar
objects and the column density of gas (as traced by near-IR extinction) in
eight molecular clouds within 1 kpc and with 100 or more known YSOs. This
correlation, which appears in data smoothed over size scales of ~1 pc, varies
in quality from cloud to cloud; those clouds with tight correlations, MonR2 and
Ophiuchus, are fit with power laws of slope 2.67 and 1.87, respectively. The
spread in the correlation is attributed primarily to local gas disruption by
stars that formed there or to the presence of very young sub-regions at the
onset of star formation. We explore the ratio of the number of Class II to
Class I sources, a proxy for the star formation age of a region, as a function
of gas column density; this analysis reveals a declining Class II to Class I
ratio with increasing column density. We show that the observed star-gas
correlation is consistent with a star formation law where the star formation
rate per area varies with the gas column density squared. We also propose a
simple picture of thermal fragmentation of dense gas in an isothermal,
self-gravitating layer as an explanation for the power law. Finally, we briefly
compare the star gas correlation and its implied star formation law with other
recent proposed of star formation laws at similar and larger size scales from
nearby star forming regions.
","[{""version"":""v1"",""created"":""Tue, 5 Jul 2011 19:59:35 GMT""}]","2015-05-28"
"1107.0967","Raphael Galicher Dr.","Raphael Galicher, Christian Marois, Bruce Macintosh, Travis Barman and
  Quinn Konopacky","M-band Imaging of the HR 8799 Planetary System Using an Innovative
  LOCI-based Background Subtraction Technique","10 pages, 4 figures, 1 table, accepted in ApJL",,"10.1088/2041-8205/739/2/L41",,"astro-ph.EP astro-ph.IM","http://arxiv.org/licenses/nonexclusive-distrib/1.0/","  Multi-wavelength observations/spectroscopy of exoplanetary atmospheres are
the basis of the emerging exciting field of comparative exoplanetology. The HR
8799 planetary system is an ideal laboratory to study our current knowledge gap
between massive field brown dwarfs and the cold 5-Gyr old Solar system planets.
The HR 8799 planets have so far been imaged at J- to L-band, with only upper
limits available at M-band. We present here deep high-contrast Keck II adaptive
optics M-band observations that show the imaging detection of 3 of the 4
currently known HR 8799 planets. Such detections were made possible due to the
development of an innovative LOCI-based background subtraction scheme that is 3
times more efficient than a classical median background subtraction for Keck II
AO data, representing a gain in telescope time of up to a factor of 9. These
M-band detections extend the broad band photometric coverage out to about 5
microns and provide access to the strong CO fundamental absorption band at
4.5microns. The new M-band photometry shows that the HR 8799 planets are
located near the L/T-type dwarf transition, similar to what was found by other
studies. We also confirm that the best atmospheric fits are consistent with low
surface gravity, dusty and non-equilibrium CO/CH4 chemistry models.
","[{""version"":""v1"",""created"":""Tue, 5 Jul 2011 20:00:00 GMT""}]","2015-05-28"
"1107.0968","Annalisa Bonafede","A. Bonafede, K. Dolag, F. Stasyszyn, G. Murante, S. Borgani","A non-ideal MHD Gadget: Simulating massive galaxy clusters","19 pages, 11 figures. Resubmitted to MNRAS after referee report",,"10.1111/j.1365-2966.2011.19523.x",,"astro-ph.CO","http://arxiv.org/licenses/nonexclusive-distrib/1.0/","  Magnetic fields in the intra-cluster medium of galaxy clusters have been
studied in the past years through different methods. In the next years the
up-coming generation of radio telescopes is going to provide new data that have
the potential of setting constraints on the properties of magnetic fields in
galaxy clusters. Here we present zoomed-in simulations for a set of massive
galaxy clusters (M_v > 10^15 M_sun/h). This is an ideal sample to study the
evolution of magnetic field during the process of structure formation in
detail. Turbulent motions of the gas within the ICM will manifest themselves in
a macroscopic magnetic resistivity eta_m, which has to be taken explicitly into
account, especially at scales below the resolution limit. We have adapted the
MHD GADGET code by Dolag & Stasyszyn (2009) to include the treatment of the
magnetic resistivity and for the first time we have included non-ideal MHD
equations to better follow the evolution of the magnetic field within galaxy
clusters. We investigate which value of the magnetic resistivity eta_m is
required to match the magnetic field profile derived from radio observations.
We find that a value of eta_m ~ 6 10^27 cm^2/s is necessary to recover the
shape of the magnetic field profile inferred from radio observations of the
Coma cluster. This value agrees well with the expected level of turbulent
motions within the ICM at our resolution limit. The magnetic field profiles can
be fitted by a beta-model like profile (Cavaliere & Fusco-Femiano 1976), with
small dispersion of the parameters. We find also that that the temperature,
density and entropy profiles of the clusters depend on the magnetic resistivity
constant, having flatter profiles in the inner regions when the magnetic
resistivity increases.
","[{""version"":""v1"",""created"":""Tue, 5 Jul 2011 20:00:00 GMT""}]","2015-05-28"
"1107.0969","M\'ed\'eric Boquien","M\'ed\'eric Boquien, Ute Lisenfeld, Pierre-Alain Duc, Jonathan Braine,
  Fr\'ed\'eric Bournaud, Elias Brinks, and Vassilis Charmandaris","Studying the spatially resolved Schmidt-Kennicutt law in interacting
  galaxies: the case of Arp 158","12 pages, 6 figures, accepted for publication in A&A",,"10.1051/0004-6361/201117004",,"astro-ph.CO astro-ph.GA","http://arxiv.org/licenses/nonexclusive-distrib/1.0/","  Recent studies have shown that star formation in mergers does not seem to
follow the same Schmidt-Kennicutt (KS) relation as in spiral disks, presenting
a higher star formation rate (SFR) for a given gas column density. In this
paper we study why and how different models of star formation arise. To do so
we examine the process of star formation in the interacting system Arp 158 and
its tidal debris. We perform an analysis of the properties of specific regions
of interest in Arp 158 using observations tracing the atomic and the molecular
gas, star formation, the stellar populations as well as optical spectroscopy to
determine their exact nature. We also fit their spectral energy distribution
with an evolutionary synthesis code. Finally, we compare star formation in
these objects to star formation in the disks of spiral galaxies and mergers.
Abundant molecular gas is found throughout the system and the tidal tails
appear to have many young stars compared to their old stellar content. One of
the nuclei is dominated by a starburst whereas the other is an active nucleus.
We estimate the SFR throughout the system and find that most regions follow
closely the KS relation seen in spiral galaxies with the exception of the
nuclear starburst and the tip of one of the tails. We examine whether this
diversity is due to uncertainties in the manner the SFR is determined or
whether the conditions in the nuclear starburst region are such that it does
not follow the same KS law as other regions. Observations of the interacting
system Arp 158 provide the first evidence in a resolved fashion that different
star-forming regions in a merger may be following different KS laws. This
suggests that the physics of the interstellar medium at a scale no larger than
1 kpc, the size of the largest gravitational instabilities and the injection
scale of turbulence, determines the origin of these laws.
","[{""version"":""v1"",""created"":""Tue, 5 Jul 2011 20:00:00 GMT""}]","2015-05-28"
"1107.0970","Jean-Francois Lestrade","Jean-Francois Lestrade (Observatoire de Paris), Etienne Morey
  (Observatoire de Paris), Antoine Lassus (UPMC), Naron Phou (UPMC)","Stripping a debris disk by close stellar encounters in an open stellar
  cluster","7 pages, 4 figures, accepted for publication in Astronomy and
  Astrophysics ; v2 abstract complemented",,"10.1051/0004-6361/201014730",,"astro-ph.SR astro-ph.EP","http://arxiv.org/licenses/nonexclusive-distrib/1.0/","  A debris disk is a constituent of any planetary system surrounding a main
sequence star. We study whether close stellar encounters can disrupt and strip
a debris disk of its planetesimals in the expanding open cluster of its birth
with a decreasing star number density over 100 Myrs. Such stripping would
affect the dust production and hence detectability of the disk. We tabulated
the fractions of planetesimals stripped off during stellar flybys of miss
distances between 100 and 1000 AU and for several mass ratios of the central to
passing stars. We then estimated the numbers of close stellar encounters over
the lifetime of several expanding open clusters characterized by their initial
star densities. We found that a standard disk, with inner and outer radii of 40
and 100 AU, suffers no loss of planetesimals over 100 Myrs around a star born
in a common embedded cluster with star density <1000 pc^-3. In contrast, we
found that such a disk is severely depleted of its planetesimals over this
timescale around a star born in an Orion-type cluster where the star density is
>20 000 pc^-3. In this environment, a disk loses >97% of its planetesimals
around an M-dwarf, >63% around a solar-type star, and >42% around an A-dwarf,
over 100 Myrs. We roughly estimate that two-thirds of the stars may be born in
such high star density clusters. This might explain in part why fewer debris
disks are observed around lower mass stars.
","[{""version"":""v1"",""created"":""Tue, 5 Jul 2011 20:00:01 GMT""},{""version"":""v2"",""created"":""Fri, 8 Jul 2011 13:20:08 GMT""}]","2015-05-28"
"1107.0971","Alvaro Hacar","A. Hacar and M. Tafalla (Observatorio Astronomico Nacional - IGN -
  Spain)","Dense core formation by fragmentation of velocity-coherent filaments in
  L1517","18 pages, 12 figures, minor changes, updated to match the version
  accepted for publication in Astronomy and Astrophysics",,"10.1051/0004-6361/201117039",,"astro-ph.GA","http://arxiv.org/licenses/nonexclusive-distrib/1.0/","  Context. Low-mass star-forming cores differ from their surrounding molecular
cloud in turbulence, shape, and density structure. Aims. We aim to understand
how dense cores form out of the less dense cloud material by studying the
connection between these two regimes. Methods. We observed the L1517 dark cloud
in C18O(1-0), N2H+(1-0), and SO(JN=32-21) with the FCRAO 14m telescope, and in
the 1.2mm dust continuum with the IRAM 30m telescope. Results. Most of the gas
in the cloud lies in four filaments that have typical lengths of 0.5 pc. Five
starless cores are embedded in these filaments and have chemical compositions
indicative of different evolutionary stages. The filaments have radial profiles
of C18O(1-0) emission with a central flattened region and a power-law tail, and
can be fitted approximately as isothermal, pressure-supported cylinders. The
filaments, in addition, are extremely quiescent. They have subsonic internal
motions and are coherent in velocity over their whole length. The large-scale
motions in the filaments can be used to predict the velocity inside the cores,
indicating that core formation has not decoupled the dense gas kinematically
from its parental material. In two filaments, these large-scale motions consist
of oscillations in the velocity centroid, and a simple kinematic model suggests
that they may be related to core-forming flows. Conclusions. Core formation in
L1517 seems to have occurred in two steps. First, the subsonic,
velocity-coherent filaments have condensed out of the more turbulent ambient
cloud. Then, the cores fragmented quasi-statically and inherited the kinematics
of the filaments. Turbulence dissipation has therefore occurred mostly on
scales on the order of 0.5 pc or larger, and seems to have played a small role
in the formation of the individual cores.
","[{""version"":""v1"",""created"":""Tue, 5 Jul 2011 20:00:01 GMT""},{""version"":""v2"",""created"":""Fri, 15 Jul 2011 14:43:37 GMT""}]","2015-05-28"
"1107.0972","Rachel Bezanson","Rachel Bezanson, Pieter G. van Dokkum, Marijn Franx, Gabriel B.
  Brammer, Jarle Brinchmann, Mariska Kriek, Ivo Labb\'e, Ryan F. Quadri,
  Hans-Walter Rix, Jesse van de Sande, Katherine E. Whitaker and Rik J.
  Williams","Redshift Evolution of the Galaxy Velocity Dispersion Function","6 pages, 4 figures, Accepted for publication in ApJ Letters",,"10.1088/2041-8205/737/2/L31",,"astro-ph.CO","http://arxiv.org/licenses/nonexclusive-distrib/1.0/","  We present a study of the evolution of the galaxy Velocity Dispersion
Function (VDF) from z=0 to z=1.5 using photometric data from the UKIDSS Ultra
Deep Survey (UDS) and Newfirm Medium Band Survey (NMBS) COSMOS surveys. The VDF
has been measured locally using direct kinematic measurements from the Sloan
Digital Sky Survey, but direct studies of the VDF at high redshift are
difficult as they require velocity dispersion measurements of many thousands of
galaxies. Taylor et al. (2010) demonstrated that dynamical and stellar mass are
linearly related when the structure of the galaxy is accounted for. We show
that the stellar mass, size and S\'ersic index can reliably predict the
velocity dispersions of SDSS galaxies. We apply this relation to galaxies at
high redshift and determine the evolution of the inferred VDF. We find that the
VDF at z~0.5 is very similar to the VDF at z=0. At higher redshifts, we find
that the number density of galaxies with dispersions <~200 km/s is lower, but
the number of high dispersion galaxies is constant or even higher. At fixed
cumulative number density, the velocity dispersions of galaxies with
logN[Mpc^{-3}]<-3.5 increase with time by a factor of ~1.4 from z~1.5-0,
whereas the dispersions of galaxies with lower number density are approximately
constant or decrease with time. The VDF appears to show less evolution than the
stellar mass function, particularly at the lowest number densities. We note
that these results are still somewhat uncertain and we suggest several avenues
for further calibrating the inferred velocity dispersions.
","[{""version"":""v1"",""created"":""Tue, 5 Jul 2011 20:00:04 GMT""}]","2015-05-28"
"1107.0973","Lotte Hollands","Lotte Hollands, Christoph A. Keller, Jaewon Song","Towards a 4d/2d correspondence for Sicilian quivers","39 pages, 11 figures",,"10.1007/JHEP10(2011)100","CALT-68-2843","hep-th","http://arxiv.org/licenses/nonexclusive-distrib/1.0/","  We study the 4d/2d AGT correspondence between four-dimensional instanton
counting and two-dimensional conformal blocks for generalized SU(2) quiver
gauge theories coming from punctured Gaiotto curves of arbitrary genus. We
propose a conformal block description that corresponds to the elementary SU(2)
trifundamental half-hypermultiplet, and check it against Sp(1)-SO(4) instanton
counting.
","[{""version"":""v1"",""created"":""Tue, 5 Jul 2011 20:00:04 GMT""}]","2015-05-28"
"1107.0974","Noelia Jimenez","Noelia Jim\'enez, Sof\'ia A. Cora, Anal\'ia Smith Castelli, and Lilia
  P. Bassino","Development of the Red Sequence in Galaxy Clusters","Proceedings IAU Symposium No. 267, 2009. Co-Evolution of Central
  Black Holes and Galaxies","2010 IAUS 267, p. 406J","10.1017/S1743921310007027",,"astro-ph.CO","http://arxiv.org/licenses/nonexclusive-distrib/1.0/","  We investigate the origin of the color-magnitude relation (CMR) observed in
cluster galaxies by using a combination of a cosmological N-body simulation of
a cluster of galaxies and a semi-analytic model of galaxy formation. The
departure of galaxies in the bright end of the CMR with respect to the trend
defined by less luminous galaxies could be explained by the influence of minor
mergers.
","[{""version"":""v1"",""created"":""Tue, 5 Jul 2011 20:00:04 GMT""}]","2020-04-15"
"1107.0975","Andreas Hoecker","M. Baak, M. Goebel, J. Haller, A. Hoecker, D. Kennedy, K. Moenig, M.
  Schott, J. Stelzer","Updated Status of the Global Electroweak Fit and Constraints on New
  Physics","58 pages, 27 figures, published version","Eur.Phys.J. C72 (2012) 2003","10.1140/epjc/s10052-012-2003-4","CERN-OPEN-2011-033, DESY-11-107","hep-ph","http://arxiv.org/licenses/nonexclusive-distrib/1.0/","  We present an update of the Standard Model fit to electroweak precision data.
We include newest experimental results on the top quark mass, the W mass and
width, and the Higgs boson mass bounds from LEP, Tevatron and the LHC. We also
include a new determination of the electromagnetic coupling strength at the Z
pole. We find for the Higgs boson mass (91 +30 -23) GeV and (120 +12 -5) GeV
when not including and including the direct Higgs searches, respectively. From
the latter fit we indirectly determine the W mass to be (80.360 +0.014 -0.013)
GeV. We exploit the data to determine experimental constraints on the oblique
vacuum polarisation parameters, and confront these with predictions from the
Standard Model (SM) and selected SM extensions. By fitting the oblique
parameters to the electroweak data we derive allowed regions in the BSM
parameter spaces. We revisit and consistently update these constraints for a
fourth fourth fermion generation, two Higgs doublet, inert Higgs and littlest
Higgs models, models with large, universal or warped extra dimensions and
technicolour. In most of the models studied a heavy Higgs boson can be made
compatible with the electroweak precision data.
","[{""version"":""v1"",""created"":""Tue, 5 Jul 2011 20:00:05 GMT""},{""version"":""v2"",""created"":""Tue, 11 Sep 2012 14:18:50 GMT""}]","2022-07-25"
"1107.0976","Jie Xu","Jie Xu, Chia-Chen Chang, Eric J. Walter, Shiwei Zhang","Spin- and charge-density waves in the Hartree-Fock ground state of the
  two-dimensional Hubbard model","13 pages, 17 figure, 0 tables","J. Phys.: Condens. Matter 23 (2011) 505601","10.1088/0953-8984/23/50/505601",,"cond-mat.str-el","http://arxiv.org/licenses/nonexclusive-distrib/1.0/","  The ground states of the two-dimensional repulsive Hubbard model are studied
within the unrestricted Hartree-Fock (UHF) theory. Magnetic and charge
properties are determined by systematic, large-scale, exact numerical
calculations, and quantified as a function of electron doping $h$. In the
solution of the self-consistent UHF equations, multiple initial configurations
and simulated annealing are used to facilitate convergence to the global
minimum. New approaches are employed to minimize finite-size effects in order
to reach the thermodynamic limit. At low to moderate interacting strengths and
low doping, the UHF ground state is a linear spin-density wave (l-SDW), with
antiferromagnetic order and a modulating wave. The wavelength of the modulating
wave is $2/h$. Corresponding charge order exists but is substantially weaker
than the spin order, hence holes are mobile. As the interaction is increased,
the l-SDW states evolves into several different phases, with the holes
eventually becoming localized. A simple pairing model is presented with
analytic calculations for low interaction strength and small doping, to help
understand the numerical results and provide a physical picture for the
properties of the SDW ground state. By comparison with recent many-body
calculations, it is shown that, for intermediate interactions, the UHF solution
provides a good description of the magnetic correlations in the true ground
state of the Hubbard model.
","[{""version"":""v1"",""created"":""Tue, 5 Jul 2011 20:01:41 GMT""},{""version"":""v2"",""created"":""Mon, 18 Jul 2011 16:31:10 GMT""},{""version"":""v3"",""created"":""Thu, 1 Dec 2011 02:08:31 GMT""}]","2013-09-20"
"1107.0977","Lorenzo Sironi","Lorenzo Sironi and Anatoly Spitkovsky (Princeton University)","Acceleration of Particles at the Termination Shock of a Relativistic
  Striped Wind","23 pages, 16 figures, submitted to ApJ",,"10.1088/0004-637X/741/1/39",,"astro-ph.HE","http://arxiv.org/licenses/nonexclusive-distrib/1.0/","  The relativistic wind of obliquely-rotating pulsars consists of toroidal
stripes of opposite magnetic field polarity, separated by current sheets of hot
plasma. By means of two- and three-dimensional particle-in-cell simulations, we
investigate particle acceleration and magnetic field dissipation at the
termination shock of a relativistic striped wind. At the shock, the flow
compresses and the alternating fields annihilate by driven magnetic
reconnection. Irrespective of the stripe wavelength ""lambda"" or the wind
magnetization ""sigma"" (in the regime sigma>>1 of magnetically-dominated flows),
shock-driven reconnection transfers all the magnetic energy of alternating
fields to the particles, whose average Lorentz factor increases by a factor of
sigma with respect to the pre-shock value. The shape of the post-shock spectrum
depends primarily on the ratio lambda/(r_L*sigma), where r_L is the
relativistic Larmor radius in the wind. The spectrum becomes broader as the
value of lambda/(r_L*sigma) increases, passing from a relativistic Maxwellian
to a flat power-law tail with slope around -1.5, populated by particles
accelerated by the reconnection electric field. Close to the equatorial plane
of the wind, where the stripes are symmetric, the highest energy particles
resulting from magnetic reconnection can escape ahead of the shock, and be
injected into a Fermi-like acceleration process. In the post-shock spectrum,
they populate a power-law tail with slope around -2.5, that extends beyond the
flat component produced by reconnection. Our study suggests that the spectral
break between the radio and the optical band in Pulsar Wind Nebulae can be a
natural consequence of particle acceleration at the termination shock of
striped pulsar winds.
","[{""version"":""v1"",""created"":""Tue, 5 Jul 2011 20:04:13 GMT""}]","2015-05-28"
"1107.0978","Martin Schmaltz","Gustavo Marques Tavares and Martin Schmaltz","Explaining the t-tbar asymmetry with a light axigluon","references added",,"10.1103/PhysRevD.84.054008",,"hep-ph hep-ex","http://arxiv.org/licenses/nonexclusive-distrib/1.0/","  We propose an axigluon with mass between 400 and 450 GeV and flavor universal
couplings to quarks to explain the Tevatron t-tbar forward-backward asymmetry.
The model predicts a small negative asymmetry for t-tbar pairs with invariant
mass below 450 GeV and a large positive asymmetry above 450 GeV. The asymmetry
arises from interference between s-channel gluon and axigluon diagrams and
requires a relatively weakly coupled axigluon ($g_{a} = g_{qcd}/3$).
Axigluon-gluon interference does not contribute to the t-tbar cross section.
New contributions to the cross section arise only at fourth order in the
axigluon coupling and are very small for a sufficiently broad axigluon. Dijet
measurements do not significantly constrain the axigluon couplings. We propose
several possible UV completions of the phenomenological axigluon which explain
the required small couplings and large width. Such UV completions necessarily
contain new colored fermions or scalars below the axigluon mass and predict
multi-jet events with large cross sections at the Tevatron and LHC.
","[{""version"":""v1"",""created"":""Tue, 5 Jul 2011 20:07:18 GMT""},{""version"":""v2"",""created"":""Thu, 14 Jul 2011 19:44:10 GMT""}]","2013-05-29"
