"1107.1018","Takaaki Monnai","Takaaki Monnai","Relaxation to equilibrium of expectation values in macroscopic quantum
  systems","accepted to Physical Review E",,"10.1103/PhysRevE.84.011126",,"cond-mat.stat-mech","http://arxiv.org/licenses/nonexclusive-distrib/1.0/","  A quantum mechanical explanation of the relaxation to equilibrium is shown
for macroscopic systems for nonintegrable cases and numerically verified. The
macroscopic system is initially in an equilibrium state, subsequently
externally perturbed during a finite time, and then isolated for a sufficiently
long time. We show a quantitative explanation that the initial microcanonical
state typically reaches to a state whose expectation values are
well-approximated by the average over another microcanonical ensemble.
","[{""version"":""v1"",""created"":""Wed, 6 Jul 2011 03:09:43 GMT""}]","2015-05-28"
"1107.1019","Astrid an Huef","Astrid an Huef and Iain Raeburn","Exel and Stacey crossed products, and Cuntz-Pimsner algebras",,,,,"math.OA","http://arxiv.org/licenses/nonexclusive-distrib/1.0/","  There are many different crossed products by an endomorphism of a C*-algebra,
and constructions by Exel and Stacey have proved particularly useful. Here we
show that every Exel crossed product is isomorphic to a Stacey crossed product
(though by a different endomorphism of a different C*-algebra), that every
Stacey crossed product is an Exel crossed product, and answer some questions
raised by Ionescu and Muhly. While this manuscript is not yet in its final
form(s) several people have already used our results, so we are posting it now.
","[{""version"":""v1"",""created"":""Wed, 6 Jul 2011 03:26:08 GMT""}]","2011-07-07"
"1107.1020","Jun-Yi Chai","Junyi Chai, James N.K. Liu","A Novel Multicriteria Group Decision Making Approach With Intuitionistic
  Fuzzy SIR Method","Paper presented at the 2010 World Automation Congress",,,,"cs.AI","http://arxiv.org/licenses/nonexclusive-distrib/1.0/","  The superiority and inferiority ranking (SIR) method is a generation of the
well-known PROMETHEE method, which can be more efficient to deal with
multi-criterion decision making (MCDM) problem. Intuitionistic fuzzy sets
(IFSs), as an important extension of fuzzy sets (IFs), include both membership
functions and non-membership functions and can be used to, more precisely
describe uncertain information. In real world, decision situations are usually
under uncertain environment and involve multiple individuals who have their own
points of view on handing of decision problems. In order to solve uncertainty
group MCDM problem, we propose a novel intuitionistic fuzzy SIR method in this
paper. This approach uses intuitionistic fuzzy aggregation operators and SIR
ranking methods to handle uncertain information; integrate individual opinions
into group opinions; make decisions on multiple-criterion; and finally
structure a specific decision map. The proposed approach is illustrated in a
simulation of group decision making problem related to supply chain management.
","[{""version"":""v1"",""created"":""Wed, 6 Jul 2011 03:32:21 GMT""}]","2011-07-07"
"1107.1021","Matthew Petrasiunas","M. J. Petrasiunas, E. W. Streed, T. J. Weinhold, B. G. Norton and D.
  Kielpinski","Optogalvanic Spectroscopy of Metastable States in Yb^{+}","8 pages, 5 figures",,"10.1007/s00340-011-4791-x",,"physics.atom-ph quant-ph","http://arxiv.org/licenses/nonexclusive-distrib/1.0/","  The metastable ^{2}F_{7/2} and ^{2}D_{3/2} states of Yb^{+} are of interest
for applications in metrology and quantum information and also act as dark
states in laser cooling. These metastable states are commonly repumped to the
ground state via the 638.6 nm ^{2}F_{7/2} -- ^{1}D[5/2]_{5/2} and 935.2 nm
^{2}D_{3/2} -- ^{3}D[3/2]_{1/2} transitions. We have performed optogalvanic
spectroscopy of these transitions in Yb^{+} ions generated in a discharge. We
measure the pressure broadening coefficient for the 638.6 nm transition to be
70 \pm 10 MHz mbar^{-1}. We place an upper bound of 375 MHz/nucleon on the
638.6 nm isotope splitting and show that our observations are consistent with
theory for the hyperfine splitting. Our measurements of the 935.2 nm transition
extend those made by Sugiyama et al, showing well-resolved isotope and
hyperfine splitting. We obtain high signal to noise, sufficient for laser
stabilisation applications.
","[{""version"":""v1"",""created"":""Wed, 6 Jul 2011 04:22:20 GMT""}]","2015-05-28"
"1107.1022","Don Marolf","Donald Marolf","Black holes and branes in supergravity","55 pgs. Chapter of the book `Black Holes in Higher Dimensions' to be
  published by Cambridge University Press (editor: G. Horowitz)",,,,"hep-th","http://arxiv.org/licenses/nonexclusive-distrib/1.0/","  This book chapter presents a brief introduction to black holes and branes in
supergravity, focussing on 11-dimensional supergravity and type II
supergravities in 10-dimension. The chapter is aimed at graduate students who
have completed a standard course in general relativity. It is an ammended and
slightly updated version of arXiv:gr-qc/9908045. In addition to describing
specific solutions, brief discussions of p-form gauge fields, Kaluza-Klein
reduction, (local) supersymmetry, T- and S-dualities in supergravity, and
string perturbation theory are included to provide context.
","[{""version"":""v1"",""created"":""Wed, 6 Jul 2011 04:29:28 GMT""},{""version"":""v2"",""created"":""Wed, 17 Aug 2011 23:29:21 GMT""}]","2011-08-19"
"1107.1023","Seung-Hyeok Kye","Young-Hoon Kiem, Seung-Hyeok Kye and Jungseob Lee","Existence of product vectors and their partial conjugates in a pair of
  spaces","15 pages, to correct a technical problem in V2","J. Math. Phys. 52, 122201 (2011)","10.1063/1.3663835",,"quant-ph math.OA","http://arxiv.org/licenses/nonexclusive-distrib/1.0/","  Let $D$ and $E$ be subspaces of the tensor product of the $m$ and $n$
dimensional complex spaces, with codimensions $k$ and \ell$, respectively. We
show that if $k+\ell<m+n-2$ then there must exist a product vector in $D$ whose
partial conjugate lies in $E$. If $k+\ell >m+n-2$ then there may not exist such
a product vector. If $k+\ell=m+n-2$ then both cases may occur depending on $k$
and $\ell$.
","[{""version"":""v1"",""created"":""Wed, 6 Jul 2011 04:32:09 GMT""},{""version"":""v2"",""created"":""Wed, 2 Nov 2011 00:25:20 GMT""},{""version"":""v3"",""created"":""Tue, 22 Nov 2011 11:24:43 GMT""}]","2015-05-28"
"1107.1024","Suryadi Siregar","Suryadi Siregar","Will 3552 Don Quixote Escape from the Solar System?","12 pages,7 figures","ITB J.Sci.,Vol.43A,No.3,2011,187-198",,"Vol.43A, No.3,2011, 187-198","astro-ph.EP","http://arxiv.org/licenses/nonexclusive-distrib/1.0/","  Asteroid 1983 SA, well known as 3552 Don Quixote, is one of Near Earth
Asteroids (NEAs) which is the most probable candidate for the cometary origin,
or otherwise as Jupiter-Family-Comets (JFCs). The aim of this study is to
investigate the possibility of 3552 Don Quixote to be ejected from the Solar
System. This paper presents an orbital evolution of 100 hypothetical asteroids
generated by cloning 3552 Don Quixote. Investigation of its orbital evolution
is conducted by using the SWIFT subroutine package, where the gravitational
perturbations of eight major planets in the Solar System are considered. Over
very short time scales (~220 kyr) relative to the Solar System life time (~10
Gyr), the asteroid 3552 Don Quixote gave an example of chaotic motion that can
cause asteroid to move outward and may be followed by escaping from the Solar
System. Probability of ejection within the 220 kyr time scale is 50%.
","[{""version"":""v1"",""created"":""Wed, 6 Jul 2011 04:39:15 GMT""}]","2011-07-07"
"1107.1025","Laurence Ramsey","Laurence Thomas Ramsey","Maximum-Likelihood Non-Decreasing Response Estimates","22 pages, 1 figure",,,,"math.ST stat.TH","http://arxiv.org/licenses/nonexclusive-distrib/1.0/","  Let $x_{i,j}$, $1 \le i \le m$, $1 \le j \le n_i$, be observations from a
doubly-indexed sequence $\{X_{i,j}\}$ of independent random variables (all of
them discrete, or all of them absolutely continuous). Suppose that each
$X_{i,j}$ has the PDF $f(x\mid\theta_i)$ from a one-parameter family of PDFs
$f(x\mid \theta)$. Mild assumptions are described under which there is a
unique, non-decreasing compound response estimate of $\mathbf \theta=<\theta_1,
\hdots \theta_m>$ that maximizes the compound likelihood function among all
non-decreasing response estimates. An efficient algorithm is described to
compute this unique estimate.
  The same theory and algorithm also give the unique non-increasing compound
response estimate that maximizes likelihood among all non-increasing response
estimates. One simply reverses the order represented by the index $i$.
","[{""version"":""v1"",""created"":""Wed, 6 Jul 2011 05:02:58 GMT""}]","2011-07-07"
"1107.1026","Kotaro Tamai Mr.","Takuya Morozumi, Hiroyuki Takata and Kotaro Tamai","Quantum correction to tiny vacuum expectation value in two Higgs doublet
  model for Dirac neutrino mass","27 pages,5 figures. The version corresponds to the revised one
  accepted in PRD. In version 4, we have corrected errors of Fig.5 which
  reflects the errata of PRD version",,"10.1103/PhysRevD.85.055002","HUPD1101","hep-ph","http://arxiv.org/licenses/nonexclusive-distrib/1.0/","  We study a Dirac neutrino mass model of Davidson and Logan. In the model, the
smallness of the neutrino mass is originated from the small vacuum expectation
value of the second Higgs of two Higgs doublets. We study the one loop
effective potential of the Higgs sector and examine how the small vacuum
expectation is stable under the radiative correction. By deriving formulae of
the radiative correction, we numerically study how large the one loop
correction is and show how it depends on the quadratic mass terms and quartic
couplings of the Higgs potential. The correction changes depending on the
various scenarios for extra Higgs mass spectrum.
","[{""version"":""v1"",""created"":""Wed, 6 Jul 2011 05:15:00 GMT""},{""version"":""v2"",""created"":""Fri, 8 Jul 2011 06:40:24 GMT""},{""version"":""v3"",""created"":""Fri, 16 Dec 2011 09:46:30 GMT""},{""version"":""v4"",""created"":""Thu, 3 Apr 2014 05:42:16 GMT""}]","2014-04-04"
"1107.1027","Abdelwahed Barkaoui","Abdelwahed Barkaoui (Prisme), Awad Bettamer (Prisme), Ridha Hambli
  (Prisme)","Failure of Mineralized Collagen Microfibrils Using Finite Element
  Simulation Coupled to Mechanical Quasi-brittle Damage","6; http://www.sciencedirect.com/science/article/pii/S1877705811007144","Procedia engineering 10 (2011) 3193-3198","10.1016/j.proeng.2011.04.526",,"q-bio.TO physics.med-ph","http://arxiv.org/licenses/nonexclusive-distrib/1.0/","  Bone is a multiscale heterogeneous materiel of which principal function is to
support the body structure and to resist mechanical loading and fractures. Bone
strength does not depend only on the quantity and quality of bone which is
characterized by the geometry and the shape of bones but also on the mechanical
proprieties of its compounds, which have a significant influence on its
deformation and failure. This work aim to use a 3D nano-scale finite element
model coupled to the concept of quasi-brittle damage with the behaviour law
isotropic elasticity to investigate the fracture behaviour of composite
materiel collagen-mineral (mineralized collagen microfibril). Fracture
stress-number of cross-links and damping capacity-number of cross-links curves
were obtained under tensile loading conditions at different densities of the
mineral phase. The obtained results show that number of cross-links as well as
the density of mineral has an important influence on the strength of
microfibrils which in turn clarify the bone fracture at macro-scale.
","[{""version"":""v1"",""created"":""Wed, 6 Jul 2011 05:45:39 GMT""}]","2011-07-07"
"1107.1028","Matthieu Hillairet","Matthieu Hillairet (CEREMADE), Peter Wittwer","Asymptotic description of solutions of the exterior Navier Stokes
  problem in a half space",,,"10.1007/s00205-012-0515-6",,"math.AP math-ph math.MP","http://arxiv.org/licenses/nonexclusive-distrib/1.0/","  We consider the problem of a body moving within an incompressible fluid at
constant speed parallel to a wall, in an otherwise unbounded domain. This
situation is modeled by the incompressible Navier-Stokes equations in an
exterior domain in a half space, with appropriate boundary conditions on the
wall, the body, and at infinity. We focus on the case where the size of the
body is small. We prove in a very general setup that the solution of this
problem is unique and we compute a sharp decay rate of the solution far from
the moving body and the wall.
","[{""version"":""v1"",""created"":""Wed, 6 Jul 2011 05:50:01 GMT""}]","2015-05-28"
"1107.1029","Christophe Krzeminski","Christophe Krzeminski (IEMN), Quentin Brulin (IEMN), V. Cuny (IEMN),
  Emmanuel Lecat (IEMN), Evelyne Lampin (IEMN), Fabrizio Cleri (IEMN)","Molecular dynamics simulation of the recrystallization of amorphous Si
  layers: Comprehensive study of the dependence of the recrystallization
  velocity on the interatomic potential",,"Journal of Applied Physics 101, 12 (2007) 123506","10.1063/1.2743089",,"physics.comp-ph cond-mat.mtrl-sci","http://arxiv.org/licenses/nonexclusive-distrib/1.0/","  The molecular dynamics method is applied to simulate the recrystallization of
an amorphous/crystalline silicon interface. The atomic structure of the
amorphous material is constructed with the method of Wooten, Winer, and Weaire.
The amorphous on crystalline stack is annealed afterward on a wide range of
temperature and time using five different interatomic potentials:
Stillinger-Weber, Tersoff, EDIP, SW115, and Lenosky. The simulations are
exploited to systematically extract the recrystallization velocity. A strong
dependency of the results on the interatomic potential is evidenced and
explained by the capability of some potentials (Tersoff and SW115) to correctly
handle the amorphous structure, while other potentials (Stillinger-Weber, EDIP,
and Lenosky) lead to the melting of the amorphous. Consequently, the
interatomic potentials are classified according to their ability to simulate
the solid or the liquid phase epitaxy.
","[{""version"":""v1"",""created"":""Wed, 6 Jul 2011 05:50:44 GMT""}]","2011-07-07"
"1107.1030","Henry Segerman","Henry Segerman and Stephan Tillmann","Pseudo-Developing Maps for Ideal Triangulations I: Essential Edges and
  Generalised Hyperbolic Gluing Equations","19 pages, 8 figures, to appear in the proceedings of Jacofest",,,,"math.GT","http://arxiv.org/licenses/nonexclusive-distrib/1.0/","  Let N be a topologically finite, orientable 3-manifold with ideal
triangulation. We show that if there is a solution to the hyperbolic gluing
equations, then all edges in the triangulation are essential. This result is
extended to a generalisation of the hyperbolic gluing equations, which enables
the construction of hyperbolic cone-manifold structures on N with singular
locus contained in the 1-skeleton of the triangulation.
","[{""version"":""v1"",""created"":""Wed, 6 Jul 2011 06:01:27 GMT""}]","2011-07-07"
"1107.1031","Pabitra Pal Choudhury","Sk. S. Hassan, A. Roy, P. Pal. Choudhury, B. K. Nayak","Integral Value Transformations: A Class of Discrete Dynamical Systems",,,,,"cs.DM math.DS","http://creativecommons.org/licenses/publicdomain/","  Here the Integral Value Transformations (IVTs) are considered to be Discrete
Dynamical System map in the space\mathbb{N}_(0). In this paper, the dynamics of
IVTs is deciphered through the light of Topological Dynamics.
","[{""version"":""v1"",""created"":""Wed, 6 Jul 2011 06:16:13 GMT""}]","2011-07-07"
"1107.1032","Amir Leshem","Amir Leshem and Omri Gat","Entanglement generation by interaction with semiclassical radiation","6 pages, 4 figures","Phys. Rev. A 84, 052303 (2011)","10.1103/PhysRevA.84.052303",,"quant-ph","http://arxiv.org/licenses/nonexclusive-distrib/1.0/","  We address a fundamental issue in quantum mechanics and quantum information
theory, the generation of an entangled pair of qubits that interact solely
through a third, semiclassical degree of freedom, in the framework of cavity
quantum electrodynamics. We show that finite, though not maximal, entanglement
is obtainable in the classical limit, at the price of a diverging effective
interaction time. The optimal atomic entanglement derives from a trade-off
between the atomic entanglement in a sub-wave packet and the purity of the
atomic state. Decoherence by photon loss sets an upper limit on the degree of
excitation of the cavity mode, beyond which the achievable entanglement
decreases as the inverse mean photon number to the sixth power.
","[{""version"":""v1"",""created"":""Wed, 6 Jul 2011 06:37:00 GMT""},{""version"":""v2"",""created"":""Tue, 11 Oct 2011 15:18:39 GMT""}]","2015-05-28"
"1107.1033","Arman Shafieloo","Arman Shafieloo and Eric V. Linder","Cosmographic Degeneracy","6 pages, 3 figures, minor changes, results unchanged, matched Phys.
  Rev. D published version","Phys.Rev.D84:063519,2011","10.1103/PhysRevD.84.063519",,"astro-ph.CO","http://arxiv.org/licenses/nonexclusive-distrib/1.0/","  We examine the dark energy and matter densities allowed by precision
measurements of distances out to various redshifts, in the presence of spatial
curvature and (near) arbitrary behavior of the dark energy equation of state.
Degeneracies among the parameters permit a remarkably large variation in their
values when using only distance measurements of the late time universe and
making no assumptions about the dark energy or curvature. Going beyond distance
measurements to a lower limit on the growth of structure bounds the allowed
region significantly but still leaves considerable freedom to match a flat LCDM
model with dark energy very different from a cosmological constant. The
combination of distances with Hubble parameter, gravitational lensing or other
large scale structure data is essential to determining robustly the
cosmological model.
","[{""version"":""v1"",""created"":""Wed, 6 Jul 2011 06:38:46 GMT""},{""version"":""v2"",""created"":""Wed, 21 Sep 2011 13:28:45 GMT""}]","2011-09-22"
"1107.1034","Mehrdad Farhoudi Prof.","Mehrdad Farhoudi","Third Order Lagrangians, Weyl Invariants & Classical Trace Anomaly in
  Six Dimensions","26 pages, appendix and references added","Inter. J. Theor. Phys. Vol. 52, 4110-4138 (2013)","10.1007/s10773-013-1725-x",,"gr-qc hep-th math-ph math.MP","http://arxiv.org/licenses/nonexclusive-distrib/1.0/","  We have proceeded analogy of Einstein tensor and alternative form of Einstein
field equations for generic coeffcients of eight terms in third order of
Lovelock Lagrangian. We have found constraint between the coeffcients into two
forms, an independent and a dimensional dependent versions. Each form has three
degrees of freedom, and not only the exact coeffcients of third order Lovelock
Lagrangian satisfy the two forms of constraints, also the two independent cubic
of Weyl tensor satisfy the independent constraint in six dimensions and yield
the dimensional dependent version identically independent of dimension. We have
introduced most general effective expression for a total third order type
Lagrangian with the homogeneity degree number three which includes the previous
eight terms plus new three ones among all seventeen independent terms. We have
proceeded analogy for this combination, and have achieved relevant constraint.
We have shown that expressions given in literature as third Weyl invariant
combination in six dimensions satisfy this constraint. Thus, we suggest that
these constraint relations to be considered as the necessary consistency
conditions on the numerical coeffcients that a Weyl invariant in six dimensions
should satisfy. We have calculated the ""classical"" trace anomaly (an approach
that was presented in our previous works) for introduced total third order type
Lagrangian and have achieved general expression with four degrees of freedom in
more than six dimensions. We have demonstrated that resulted expression
contains exactly relevant coeffcient of Schwinger-DeWitt proper time method
(linked with relevant heat kernel coeffcient) in six dimensions, as a
particular case. Our approach can be regarded as alternative derivation of
trace anomaly which also gives general expression with the relevant degrees of
freedom.
","[{""version"":""v1"",""created"":""Wed, 6 Jul 2011 06:42:21 GMT""},{""version"":""v2"",""created"":""Sun, 14 Aug 2011 15:09:56 GMT""},{""version"":""v3"",""created"":""Mon, 19 Aug 2013 13:46:01 GMT""}]","2013-10-04"
"1107.1035","Toshiaki Tanaka","Toshiaki Tanaka","On General Form of N-fold Supersymmetry","19 pages, no figures; Lengthy formulas summarized in Appendix, to
  appear in Journal of Physics A","J.Phys.A:Math.Theor. 44 (2011) 465301","10.1088/1751-8113/44/46/465301","TH-1472","math-ph hep-th math.MP nlin.SI","http://arxiv.org/licenses/nonexclusive-distrib/1.0/","  We analyze general structure of N-fold supersymmetry which provides a
systematic framework to construct weakly quasi-solvable quantum mechanical
systems. Main ingredients of our analysis are dimensional analysis and
introduction of an equivalent class of linear differential operators associated
with N-fold supersymmetry for each N. To illustrate how they work, we construct
the most general form of N-fold supersymmetric systems for N=2, 3, and 4.
","[{""version"":""v1"",""created"":""Wed, 6 Jul 2011 06:48:38 GMT""},{""version"":""v2"",""created"":""Fri, 23 Sep 2011 09:00:12 GMT""}]","2011-11-03"
"1107.1036","M. V. Libanov","M.Libanov and V.Rubakov","Dynamical vs spectator models of (pseudo-)conformal Universe","13 pages",,"10.1007/s11232-012-0126-2","INR-TH-2011-14","hep-th astro-ph.CO gr-qc","http://arxiv.org/licenses/nonexclusive-distrib/1.0/","  We discuss two versions of the conformal scenario for generating scalar
cosmological perturbations: a spectator version with a scalar field conformally
coupled to gravity and carrying negligible energy density, and a dynamical
version with a scalar field minimally coupled to gravity and dominating the
cosmological evolution. By making use of the Newtonian gauge, we show that (i)
no UV strong coupling scale is generated below $M_{Pl}$ due to mixing with
metric perturbations in the dynamical scenario, and (ii) the dynamical and
spectator models yield identical results to the leading non-linear order. We
argue that these results, which include potentially observable effects like
statistical anisotropy and non-Gaussianity, are characteristic of the entire
class of conformal models. As an example, we reproduce, within the dynamical
scenario and working in comoving gauge, our earlier result on the statistical
anisotropy, which was originally obtained within the spectator approach.
","[{""version"":""v1"",""created"":""Wed, 6 Jul 2011 06:53:30 GMT""}]","2015-05-28"
"1107.1037","Matthew D. Lehnert","M. D. Lehnert, C. Tasse, N. P. H. Nesvadba, P. N. Best, and W. van
  Driel","The Na D profiles of nearby low-power radio sources: Jets powering
  outflows","To appear in A&A letters. Fig. 3 to appear online only",,"10.1051/0004-6361/201117323",,"astro-ph.CO","http://arxiv.org/licenses/nonexclusive-distrib/1.0/","  (abridged) We have analyzed the properties of the Na D doublet lines in a
large sample of 691 radio galaxies using the Sloan Digital Sky Survey (SDSS).
These radio galaxies are resolved in the FIRST survey, have redshifts less that
0.2 and radio flux densities at 1.4 GHz higher than 40 mJy. Approximately 1/3
of the sources show a significant excess (above that contributed by their
stellar populations) of Na D absorption that can be robustly fitted with two
Voigt profiles representing the Na D doublet. A further 1/6 of the sources show
residual absorption, for which the fits were not well constrained though while
~50% of the sample show no significant residual absorption. The residual
absorption is modestly blueshifted, typically by ~50 km/s, but the velocity
dispersions are high, generally ~500 km/s. Assuming that the size of the
absorbing region is consistent with ~1 kpc for dust lanes in a sample of
generally more powerful radio sources and a continuous constant velocity flow
(continuity equation), we estimate mass and energy outflow rates of about 10
Msun/yr and few x e42 erg/s. These rates are consistent with those in the
literature based on HI absorption line observations of radio galaxies. The
energy required to power these outflows is on the order of 1-10% of the jet
mechanical power and we conclude that the radio jet alone is sufficient. The
mass and energy outflow rates are consistent with what is needed to heat/expel
the mass returned by the stellar populations as well as the likely amount of
gas from a cooling halo. This suggests that radio-loud AGN play a key role in
energizing the outflow/heating phase of the feedback cycle. The deposition of
the jet mechanical energy could be important for explaining the ensemble
characteristics of massive early type galaxies in the local universe.
","[{""version"":""v1"",""created"":""Wed, 6 Jul 2011 06:53:53 GMT""}]","2015-05-28"
