"1107.2188","Yajun Wang","Tengyu Ma, Bo Tang, Yajun Wang","The Simulated Greedy Algorithm for Several Submodular Matroid Secretary
  Problems","preliminary version appeared in STACS 2013",,,,"cs.DS","http://arxiv.org/licenses/nonexclusive-distrib/1.0/","  We study the matroid secretary problems with submodular valuation functions.
In these problems, the elements arrive in random order. When one element
arrives, we have to make an immediate and irrevocable decision on whether to
accept it or not. The set of accepted elements must form an {\em independent
set} in a predefined matroid. Our objective is to maximize the value of the
accepted elements. In this paper, we focus on the case that the valuation
function is a non-negative and monotonically non-decreasing submodular
function.
  We introduce a general algorithm for such {\em submodular matroid secretary
problems}. In particular, we obtain constant competitive algorithms for the
cases of laminar matroids and transversal matroids. Our algorithms can be
further applied to any independent set system defined by the intersection of a
{\em constant} number of laminar matroids, while still achieving constant
competitive ratios. Notice that laminar matroids generalize uniform matroids
and partition matroids.
  On the other hand, when the underlying valuation function is linear, our
algorithm achieves a competitive ratio of 9.6 for laminar matroids, which
significantly improves the previous result.
","[{""version"":""v1"",""created"":""Tue, 12 Jul 2011 04:35:02 GMT""},{""version"":""v2"",""created"":""Fri, 21 Sep 2012 20:35:31 GMT""},{""version"":""v3"",""created"":""Tue, 26 Feb 2013 05:49:05 GMT""}]","2013-02-27"
"1107.2189","Thomas Decker","Thomas Decker, G\'abor Ivanyos, Miklos Santha, Pawel Wocjan","Hidden Symmetry Subgroup Problems","21 pages, slightly improved and slightly extended version","SIAM Journal on Computing 42:5 (2013)","10.1137/120864416",,"quant-ph","http://arxiv.org/licenses/nonexclusive-distrib/1.0/","  We advocate a new approach of addressing hidden structure problems and
finding efficient quantum algorithms. We introduce and investigate the Hidden
Symmetry Subgroup Problem (HSSP), which is a generalization of the well-studied
Hidden Subgroup Problem (HSP). Given a group acting on a set and an oracle
whose level sets define a partition of the set, the task is to recover the
subgroup of symmetries of this partition inside the group. The HSSP provides a
unifying framework that, besides the HSP, encompasses a wide range of algebraic
oracle problems, including quadratic hidden polynomial problems. While the HSSP
can have provably exponential quantum query complexity, we obtain efficient
quantum algorithms for various interesting cases. To achieve this, we present a
general method for reducing the HSSP to the HSP, which works efficiently in
several cases related to symmetries of polynomials. The HSSP therefore connects
in a rather surprising way certain hidden polynomial problems with the HSP.
Using this connection, we obtain the first efficient quantum algorithm for the
hidden polynomial problem for multivariate quadratic polynomials over fields of
constant characteristic. We also apply the new methods to polynomial function
graph problems and present an efficient quantum procedure for constant degree
multivariate polynomials over any field. This result improves in several ways
the currently known algorithms.
","[{""version"":""v1"",""created"":""Tue, 12 Jul 2011 05:24:55 GMT""},{""version"":""v2"",""created"":""Wed, 18 Jan 2012 08:49:11 GMT""}]","2014-07-11"
"1107.2190","Massoud Akbari-Moghanjoughi","M. Akbari-Moghanjoughi","Comment on ""Interaction of two solitary waves in quantum
  electron-positron-ion plasma"" [Phys. Plasmas \textbf{18}, 052301 (2011)]","Accepted Journal Physics of Plasmas",,"10.1063/1.3622320",,"physics.plasm-ph","http://arxiv.org/licenses/nonexclusive-distrib/1.0/","  Recently, Yan-Xia Xu, et al. in the article Ref. [Phys. Plasmas \textbf{18},
052301 (2011)] have studied the effects of various plasma parameters on
interaction of two ion-acoustic solitary waves in an unmagnetized
three-dimensional electron-positron-ion quantum plasma. They have used the
extended reductive perturbation technique, the so-called, extended
Poincare'-Lighthill-Kuo (PLK) technique, to deduce from the model governing the
quantum hydrodynamics (QHD) differential equations leading to the soliton
dynamical properties, namely, Korteweg-de Vries evolution equations (one for
each wave) and coupled differential equations describing the phase-shift in
trajectories of solitons due to the two dimensional collision. The variation of
the calculated collision phase-shifts are then numerically inspected in terms
of numerous plasma fractional parameters. In this comment we give some notes
specific to the validity of the results of above-mentioned article and refer to
important misconceptions about the use of the Fermi-temperature in quantum
plasmas, appearing in this article and many other recently published ones.
","[{""version"":""v1"",""created"":""Tue, 12 Jul 2011 05:45:15 GMT""},{""version"":""v2"",""created"":""Thu, 28 Jul 2011 14:27:18 GMT""}]","2015-05-28"
"1107.2191","Snigdhayan Mahanta","Snigdhayan Mahanta","Assembly maps with coefficients in topological algebras and the integral
  K-theoretic Novikov conjecture","v2 Exposition improved; one lemma and grant acknowledgement added; v3
  some terminology changed and details added, Theorems 4.5 and 4.7 in v3 need
  an extra hypothesis; v4 abridged version accepted for publication in JHRS","J. Homotopy Relat. Struct., 9 (2), 299-315, 2014","10.1007/s40062-013-0027-6",,"math.KT math.AT math.GT math.OA","http://arxiv.org/licenses/nonexclusive-distrib/1.0/","  We prove that any countable discrete and torsion free subgroup of a general
linear group over an arbitrary field or a similar subgroup of an almost
connected Lie group satisfies the integral algebraic K-theoretic (split)
Novikov conjecture over \cpt and \S, where \cpt denotes the C^*-algebra of
compact operators and \S denotes the algebra of Schatten class operators. We
introduce assembly maps with finite coefficients and under an additional
hypothesis, we prove that such a group also satisfies the algebraic K-theoretic
Novikov conjecture over \bar{\mathbb{Q}} and \mathbb{C} with finite
coefficients. For all torsion free Gromov hyperbolic groups G, we demonstrate
that the canonical algebra homomorphism \cpt[G]\map C^*_r(G)\hat{\otimes}\cpt
induces an isomorphism between their algebraic K-theory groups.
","[{""version"":""v1"",""created"":""Tue, 12 Jul 2011 05:53:38 GMT""},{""version"":""v2"",""created"":""Tue, 2 Aug 2011 07:40:13 GMT""},{""version"":""v3"",""created"":""Fri, 20 Jan 2012 04:14:12 GMT""},{""version"":""v4"",""created"":""Thu, 20 Jun 2013 15:59:55 GMT""}]","2015-08-05"
"1107.2192","Shihoko Ishii","Lawrence Ein, Shihoko Ishii and Mircea Mustata","Multiplier ideals via Mather discrepancy","17 pages, no figure",,,,"math.AG","http://arxiv.org/licenses/nonexclusive-distrib/1.0/","  We define a version of multiplier ideals, the Mather multiplier ideals, on a
variety with arbitrary singularities, using the Mather discrepancy and the
Jacobian ideal. In this context we prove a relative vanishing theorem, thus
obtaining restriction theorems and a subadditivity and summation theorems. The
Mather multiplier ideals also satisfy a Skoda type result. As an application,
we obtain a Briancon-Skoda type formula for the integral closures of ideals on
a variety with arbitrary singularities.
","[{""version"":""v1"",""created"":""Tue, 12 Jul 2011 06:01:28 GMT""}]","2011-07-13"
"1107.2193","Clement Dombry","Youri Davydov (LPP), Cl\'ement Dombry (LMA)","On the convergence of Le Page series in Skohorod space","9 pages",,,,"math.PR","http://arxiv.org/licenses/nonexclusive-distrib/1.0/","  We consider the problem of the convergence of the so-called Le Page series in
the Skohorod space $\bbD^d=\bbD([0,1],\bbR^d)$ and provide a simple criterion
based on the moments of the increments of the random process involved in the
series. This provides a simple sufficient condition for the existence of an
$\alpha$-stable distribution on $\bbD^d$ with given spectral measure.
","[{""version"":""v1"",""created"":""Tue, 12 Jul 2011 06:17:55 GMT""}]","2011-07-13"
"1107.2194","David Maxwell","David Maxwell","Kozlov-Maz'ya iteration as a form of Landweber iteration","28 pages, 4 figures",,,,"math.AP","http://arxiv.org/licenses/nonexclusive-distrib/1.0/","  We consider the alternating method of Kozlov and Maz'ya for solving the
Cauchy problem for elliptic boundary-value problems. Considering the case of
the Laplacian, we show that this method can be recast as a form of Landweber
iteration. In addition to conceptual advantages, this observation leads to some
practical improvements. We show how to accelerate Kozlov-Maz'ya iteration using
the conjugate gradient algorithm, and we show how to modify the method to
obtain a more practical stopping criterion.
","[{""version"":""v1"",""created"":""Tue, 12 Jul 2011 06:19:07 GMT""}]","2011-07-13"
"1107.2195","Chung-Hou Chung","Chung-Hou Chung and Kenneth Yi-Jie Zhang","Quantum criticality out of equilibrium in the pseudogap Kondo model","4.1 pages, 2 figures","Phys. Rev. B 85, 195106 (2012)","10.1103/PhysRevB.85.195106",,"cond-mat.str-el","http://arxiv.org/licenses/nonexclusive-distrib/1.0/","  We theoretically investigate the non-equilibrium quantum phase transition in
a generic setup: the pseudogap Kondo model where a quantum dot couples to
two-left (L) and right (R)-voltage-biased fermionic leads with power-law
density of states (DOS) with respect to their Fermi levels {\mu}_L/R,
{\rho}_c,L(R) ({\omega}) \propto |{\omega} - {\mu}_L(R) |r, and 0 < r < 1. In
equilibrium (zero bias voltage) and for 0 < r < 1/2, with increasing Kondo
correlations, in the presence of particle-hole symmetry this model exhibits a
quantum phase transition from a unscreened local moment (LM) phase to the Kondo
phase. Via a controlled frequency-dependent renormalization group (RG)
approach, we compute analytically and numerically the non-equilibrium
conductance, conduction electron T-matrix and local spin susceptibility at
finite bias voltages near criticality. The current-induced decoherence shows
distinct nonequilibrium scaling, leading to new universal non-equilibrium
quantum critical behaviors in the above observables. Relevance of our results
for the experiments is discussed.
","[{""version"":""v1"",""created"":""Tue, 12 Jul 2011 06:26:47 GMT""}]","2015-05-28"
"1107.2196","Dragos Velicanu","Dragos Velicanu (for the CMS collaboration)","Ridge correlation structure in high multiplicity pp collisions with CMS",,,"10.1088/0954-3899/38/12/124051",,"nucl-ex","http://arxiv.org/licenses/nonexclusive-distrib/1.0/","  Results on two-particle angular correlations are presented in proton-proton
collisions at center of mass energies of 7 TeV, over a broad range of
pseudorapidity and azimuthal angle. In very high multiplicity events at 7 TeV,
a pronounced structure emerges in the two-dimensional correlation function for
particle pairs with intermediate $p_{\mathrm{T}}$ of 1--3 GeV/c, in the
kinematic region $2.0 < |\Delta\eta| < 4.8$ and small $\Delta\phi$. This
structure, which has not been observed in pp collisions before, is similar to
what is known as the ""ridge"" in heavy ion collisions. It is not predicted by
commonly used proton-proton Monte Carlo models and is not seen in lower
multiplicity pp collisions. Updated studies of this new effect as a function of
particle transverse momentum, rapidity and event characteristics are shown.
","[{""version"":""v1"",""created"":""Tue, 12 Jul 2011 06:35:10 GMT""}]","2019-08-14"
"1107.2197","Shachar Lerer","S. Lerer, M. Ben-Shalom, G. Deutscher, Y. Dagan","Low-temperature dependence of the thermo-magnetic transport properties
  of the SrTiO3/LaAlO3 interface","6 pages, 7 figures",,"10.1103/PhysRevB.84.075423",,"cond-mat.str-el cond-mat.mes-hall","http://creativecommons.org/licenses/by-nc-sa/3.0/","  We report transport measurements, including: Hall, Seebeck and Nernst Effect.
All these transport properties exhibit anomalous field and temperature
dependences, with a change of behavior observed at about H 1.5T and T 15K. We
were able to reconcile the low-temperature-low-field behavior of all transport
properties using a simple two band analysis. A more detailed model is required
in order to explain the high magnetic field regime.
","[{""version"":""v1"",""created"":""Tue, 12 Jul 2011 06:37:06 GMT""}]","2012-05-24"
"1107.2198","Venturi Tiziana","T. Venturi, S. Giacintucci, D. Dallacasa","A hidden radio halo in A1682?","4 pages, 1 figure, to be published on the Journal of Astrophysics and
  Astronomy",,,,"astro-ph.CO","http://arxiv.org/licenses/nonexclusive-distrib/1.0/","  High sensitivity observations of radio halos in galaxy clusters at
frequencies lower than 330 MHz are still relatively rare, and very little is
known compared to the classical 1.4 GHz images. The few radio halos imaged down
to 150-240 MHz show a considerable spread in size, morphology and spectral
properties. All clusters belonging to the GMRT Radio Halo Survey with detected
or candidate cluster-scale diffuse emission have been imaged at 325 MHz with
the GMRT. Few of them were also observed with the GMRT at 240 MHz and 150 MHz.
For A1682, imaging is particularly challenging due to the presence of strong
and extended radio galaxies at the center. Our data analysis suggests that the
radio galaxies are superposed to very low surface brightness radio emission
extended on the cluster scale, which we present here.
","[{""version"":""v1"",""created"":""Tue, 12 Jul 2011 06:45:10 GMT""}]","2011-07-13"
"1107.2199","Soloman Thokala","Thokala Soloman Raju","Nonlinear compression of autonomous similaritons in the cubic-quintic
  nonlinear Schr\""odinger equation model with nonlinear gain",,,,,"nlin.PS","http://arxiv.org/licenses/nonexclusive-distrib/1.0/","  We describe similariton pulse propagation in double-doped optical fibers with
the aid of self-similarity analysis of the cubic-quintic nonlinear
Schr\""odinger equation with varying dispersion, nonlinearity, gain or
absorption, and nonlinear gain. Exact similariton pulses that can propagate
self similarly subject to simple scaling rules of this model have been found
using a fractional transform. By appropriately tailoring the dispersion profile
and nonlinearity, the condition for optimal pulse compression has been
obtained. Also, nonlinear chirping of the trigonometric solution has been
demonstrated.
","[{""version"":""v1"",""created"":""Tue, 12 Jul 2011 06:50:55 GMT""}]","2011-07-13"
"1107.2200","Giovanni Marchiori","Giovanni Marchiori (for the ATLAS Collaboration)","Measurements of isolated prompt photons in pp collisions at 7 TeV in
  ATLAS","4 pages, 4 figures. To appear in the proceedings of DIS2011",,,"ATL-PHYS-PROC-2011-082","hep-ex","http://arxiv.org/licenses/nonexclusive-distrib/1.0/","  Two recent measurements of the cross section for the inclusive production of
isolated prompt photons in pp collisions at a center-of-mass energy sqrt(s) = 7
TeV are presented. The results are based on data collected in 2010 with the
ATLAS detector at the Large Hadron Collider. The measurements cover the
pseudorapidity ranges |eta(gamma)|<1.37 and 1.52<|eta(gamma)|<2.37 and the
transverse energy range 15 < ET(gamma) < 400 GeV. The measured cross sections
are compared to predictions from next-to-leading-order perturbative QCD
calculations.
","[{""version"":""v1"",""created"":""Tue, 12 Jul 2011 06:59:48 GMT""}]","2019-08-13"
"1107.2201","Zhora Nikoghosyan","Zh.G. Nikoghosyan","A Size Bound for Hamilton Cycles","3 pages",,,,"math.CO","http://arxiv.org/licenses/nonexclusive-distrib/1.0/","  Every graph of size $q$ (the number of edges) and minimum degree $\delta$ is
hamiltonian if $q\le\delta^2+\delta-1$. The result is sharp.
","[{""version"":""v1"",""created"":""Tue, 12 Jul 2011 07:18:55 GMT""}]","2011-07-13"
"1107.2202","Dmitry Klochkov","D. Klochkov, R. Staubert, A. Santangelo, R. E. Rothschild, C. Ferrigno","Pulse-amplitude-resolved spectroscopy of bright accreting pulsars:
  indication of two accretion regimes","10 pages, 6 figures, accepted for publication in A&A",,"10.1051/0004-6361/201116800",,"astro-ph.HE","http://arxiv.org/licenses/nonexclusive-distrib/1.0/","  Context: In addition to coherent pulsation, many accreting neutron stars
exhibit flaring activity and strong aperiodic variability on time scales
comparable to or shorter than their pulsation period. Such a behavior shows
that the accretion flow in the vicinity of the accretor must be highly
non-stationary. Observational study of this phenomenon is often problematic as
it requires very high statistics of X-ray data and a specific analysis
technique. Aims: In our research we used high-resolution data taken with RXTE
and INTEGRAL on a sample of bright transient and persistent pulsars, to perform
an in-depth study of their variability on time scales comparable to the
pulsation period - ""pulse-to-pulse variability"". Methods: The high-quality data
allowed us to collect individual pulses of different amplitude and explore
their X-ray spectrum as a function of pulse amplitude. The described approach
allowed us for the first time to study the luminosity-dependence of pulsars'
X-ray spectra in observations where the averaged (over many pulse cycles)
luminosity of the source remains constant. Results: In all studied pulsars we
revealed significant spectral changes as a function of the pulse height both in
the continuum and in the cyclotron absorption features. The sources appear to
form two groups showing different dependencies of the spectrum on pulse height.
We interpret such a division as a manifestation of two distinct accretion
regimes that are at work in different pulsars.
","[{""version"":""v1"",""created"":""Tue, 12 Jul 2011 07:22:23 GMT""}]","2015-05-28"
"1107.2203","Jonathan Reynolds","Gunther Cornelissen and Jonathan Reynolds","Matrix divisibility sequences","10 pages",,,,"math.NT","http://arxiv.org/licenses/nonexclusive-distrib/1.0/","  We show that many existing divisibility sequences can be seen as sequences of
determinants of matrix divisibility sequences, which arise naturally as
Jacobian matrices associated to groups of maps on affine spaces.
","[{""version"":""v1"",""created"":""Tue, 12 Jul 2011 07:36:53 GMT""},{""version"":""v2"",""created"":""Sun, 4 Sep 2011 15:49:39 GMT""}]","2011-09-06"
"1107.2204","Naveen Bijalwan Dr.","Naveen Bijalwan","Anisotropic Spheres with Barotropic Equation of State in Bimetric Theory
  of Relativity","4 pages",,,,"physics.gen-ph","http://arxiv.org/licenses/nonexclusive-distrib/1.0/","  Recently, Khadekar (2007) presented the solutions with uniform energy density
for anisotropic spheres in bimetric theory. We present here a general analytic
solution to the field equations in bimetric theory for anisotropic fluids for a
general barotropic equation of state by representing equations in terms for
effective radial pressure . We list and discuss some old and new solutions
which fall in this category.
","[{""version"":""v1"",""created"":""Tue, 12 Jul 2011 07:39:50 GMT""},{""version"":""v2"",""created"":""Wed, 13 Jul 2011 08:54:26 GMT""}]","2011-09-26"
"1107.2205","Giusi Moffa","Giusi Moffa and Jack Kuipers","Sequential Monte Carlo EM for multivariate probit models","26 pages, 2 figures. In press, Computational Statistics & Data
  Analysis",,"10.1016/j.csda.2013.10.019",,"stat.ME stat.CO","http://arxiv.org/licenses/nonexclusive-distrib/1.0/","  Multivariate probit models (MPM) have the appealing feature of capturing some
of the dependence structure between the components of multidimensional binary
responses. The key for the dependence modelling is the covariance matrix of an
underlying latent multivariate Gaussian. Most approaches to MLE in multivariate
probit regression rely on MCEM algorithms to avoid computationally intensive
evaluations of multivariate normal orthant probabilities. As an alternative to
the much used Gibbs sampler a new SMC sampler for truncated multivariate
normals is proposed. The algorithm proceeds in two stages where samples are
first drawn from truncated multivariate Student $t$ distributions and then
further evolved towards a Gaussian. The sampler is then embedded in a MCEM
algorithm. The sequential nature of SMC methods can be exploited to design a
fully sequential version of the EM, where the samples are simply updated from
one iteration to the next rather than resampled from scratch. Recycling the
samples in this manner significantly reduces the computational cost. An
alternative view of the standard conditional maximisation step provides the
basis for an iterative procedure to fully perform the maximisation needed in
the EM algorithm. The identifiability of MPM is also thoroughly discussed. In
particular, the likelihood invariance can be embedded in the EM algorithm to
ensure that constrained and unconstrained maximisation are equivalent. A simple
iterative procedure is then derived for either maximisation which takes
effectively no computational time. The method is validated by applying it to
the widely analysed Six Cities dataset and on a higher dimensional simulated
example. Previous approaches to the Six Cities overly restrict the parameter
space but, by considering the correct invariance, the maximum likelihood is
quite naturally improved when treating the full unrestricted model.
","[{""version"":""v1"",""created"":""Tue, 12 Jul 2011 07:54:26 GMT""},{""version"":""v2"",""created"":""Thu, 14 Nov 2013 20:52:58 GMT""}]","2013-11-15"
"1107.2206","Li Kang","Kang Li, Shuming Long, Jianhua Wang and Yi Yuan","Non interacting electron gas model of quantum Hall effect","Revtex, 4 pages",,,,"cond-mat.quant-gas hep-th","http://arxiv.org/licenses/nonexclusive-distrib/1.0/","  On the basis of our previous studies on energy levels and wave functions of
single electrons in a strong magnetic field, the energy levels and wave
functions of non-interacting electron gas system, electron gas Hall surface
density and Hall resistance of electron gas system are calculated. Then, a
comparison is made between non-interaction electron gas model and Laughlin's
interaction two dimensional electron gas system. It is found that the former
can more quickly and unified the explain the integer and the fractional quantum
Hall effects without the help of concepts proposed by Laughlin, such as
fractionally charged quasi-particles and quasi-holes which obey fractional
statistics. After explicit calculation, it is also discovered that quantum Hall
effect has the same physical nature as superconducting state.
","[{""version"":""v1"",""created"":""Tue, 12 Jul 2011 08:06:13 GMT""},{""version"":""v2"",""created"":""Mon, 18 Jul 2011 09:31:50 GMT""}]","2011-07-19"
"1107.2207","Matteo Guzzo","Matteo Guzzo, Giovanna Lani, Francesco Sottile, Pina Romaniello,
  Matteo Gatti, Joshua J. Kas, John J. Rehr, Mathieu G. Silly, Fausto Sirotti,
  Lucia Reining","The valence electron photoemission spectrum of semiconductors: ab initio
  description of multiple satellites","4 pages, 2 figures, accepted for publication on Physical Review
  Letters on Sept 2, 2011",,"10.1103/PhysRevLett.107.166401",,"cond-mat.str-el cond-mat.other quant-ph","http://arxiv.org/licenses/nonexclusive-distrib/1.0/","  The experimental valence band photoemission spectrum of semiconductors
exhibits multiple satellites that cannot be described by the GW approximation
for the self-energy in the framework of many-body perturbation theory. Taking
silicon as a prototypical example, we compare experimental high energy
photoemission spectra with GW calculations and analyze the origin of the GW
failure. We then propose an approximation to the functional differential
equation that determines the exact one-body Green's function, whose solution
has an exponential form. This yields a calculated spectrum, including cross
sections, secondary electrons, and an estimate for extrinsic and interference
effects, in excellent agreement with experiment. Our result can be recast as a
dynamical vertex correction beyond GW, giving hints for further developments.
","[{""version"":""v1"",""created"":""Tue, 12 Jul 2011 08:18:36 GMT""},{""version"":""v2"",""created"":""Tue, 20 Sep 2011 16:41:03 GMT""}]","2015-05-28"
