"1107.2245","Aranya Bhattacherjee Dr.","Aranya B Bhattacherjee","Opto-mechanical effects in superradiant light scattering by
  Bose-Einstein condensate in a cavity","8 fugures",,,,"cond-mat.quant-gas","http://arxiv.org/licenses/nonexclusive-distrib/1.0/","  We investigate the effects of a movable mirror (cantilever) of an optical
cavity on the superradiant light scattering from a Bose-Einstein condensate
(BEC) in an optical lattice. We show that the mirror motion has a dynamic
dispersive effect on the cavity-pump detuning. Varying the intensity of the
pump beam, one can switch between the pure superradiant regime and the Bragg
scattering regime. The mechanical frequency of the mirror strongly influences
the time interval between two Bragg peaks. We found that when the system is in
the resolved side band regime for mirror cooling, the superradiant scattering
is enhanced due to coherent energy transfer from the mechanical mirror mode to
the cavity field mode.
","[{""version"":""v1"",""created"":""Tue, 12 Jul 2011 11:09:33 GMT""}]","2011-07-13"
"1107.2246","Mingjun Shi","Mingjun Shi, Wei Yang, Fengjian Jiang and Jiangfeng Du","Quantum discord of two-qubit rank-two states","21 pages, 5 figures, revised version","Journal of Physics A: Mathematical and Theoretical 44, 415304
  (2011)","10.1088/1751-8113/44/41/415304",,"quant-ph","http://arxiv.org/licenses/nonexclusive-distrib/1.0/","  Among various definitions of quantum correlations, quantum discord has
attracted considerable attention. To find analytical expression of quantum
discord is an intractable task. In this paper, we discuss thoroughly the case
of two-qubit rank-two states. An analytical expression for the quantum discord
is obtained by means of Koashi-Winter relation. A geometric picture is
demonstrated by means of quantum steering ellipsoid. We point out that in this
case the optimal measurement is indeed the von Neumann measurement, which is
usually used in the study of quantum discord. However, for some two-qubit
states with the rank larger than two, we find that three-element POVM
measurement is more optimal. It means that more careful attention should be
paid in the discussion of quantum discord.
","[{""version"":""v1"",""created"":""Tue, 12 Jul 2011 11:09:37 GMT""},{""version"":""v2"",""created"":""Mon, 15 Aug 2011 17:42:08 GMT""}]","2015-05-28"
"1107.2247","Alexander Razborov","Alexander Razborov","On the Caccetta-Haggkvist conjecture with forbidden subgraphs","Referees' comments (the paper has been accepted to ""Journal of Graph
  Theory"") have been taken into account. Most notably, an annoying misprint in
  the proof of Claim 5.6 (K_{1,2} should everywhere read K_{2,1}) has been
  fixed",,,,"math.CO","http://arxiv.org/licenses/nonexclusive-distrib/1.0/","  The Caccetta-Haggkvist conjecture made in 1978 asserts that every orgraph on
n vertices without oriented cycles of length <= l must contain a vertex of
outdegree at most (n-1)/l. It has a rather elaborate set of (conjectured)
extremal configurations.
  In this paper we consider the case l=3 that received quite a significant
attention in the literature. We identify three orgraphs on four vertices each
that are missing as an induced subgraph in all known extremal examples and
prove the Caccetta-Haggkvist conjecture for orgraphs missing as induced
subgraphs any of these orgraphs, along with cycles of length 3. Using a
standard trick, we can also lift the restriction of being induced, although
this makes graphs in our list slightly more complicated.
","[{""version"":""v1"",""created"":""Tue, 12 Jul 2011 11:18:27 GMT""},{""version"":""v2"",""created"":""Fri, 17 Aug 2012 13:14:53 GMT""}]","2012-08-20"
"1107.2248","Ioannis Caragiannis","Ioannis Caragiannis, Angelo Fanelli, Nick Gravin, Alexander Skopalik","Approximate Pure Nash Equilibria in Weighted Congestion Games:
  Existence, Efficient Computation, and Structure","31 pages",,,,"cs.GT","http://arxiv.org/licenses/nonexclusive-distrib/1.0/","  We consider structural and algorithmic questions related to the Nash dynamics
of weighted congestion games. In weighted congestion games with linear latency
functions, the existence of (pure Nash) equilibria is guaranteed by potential
function arguments. Unfortunately, this proof of existence is inefficient and
computing equilibria is such games is a {\sf PLS}-hard problem. The situation
gets worse when superlinear latency functions come into play; in this case, the
Nash dynamics of the game may contain cycles and equilibria may not even exist.
Given these obstacles, we consider approximate equilibria as alternative
solution concepts. Do such equilibria exist? And if so, can we compute them
efficiently?
  We provide positive answers to both questions for weighted congestion games
with polynomial latency functions by exploiting an ""approximation"" of such
games by a new class of potential games that we call $\Psi$-games. This allows
us to show that these games have $d!$-approximate equilibria, where $d$ is the
maximum degree of the latency functions. Our main technical contribution is an
efficient algorithm for computing O(1)-approximate equilibria when $d$ is a
constant. For games with linear latency functions, the approximation guarantee
is $\frac{3+\sqrt{5}}{2}+O(\gamma)$ for arbitrarily small $\gamma>0$; for
latency functions with maximum degree $d\geq 2$, it is $d^{2d+o(d)}$. The
running time is polynomial in the number of bits in the representation of the
game and $1/\gamma$. As a byproduct of our techniques, we also show the
following structural statement for weighted congestion games with polynomial
latency functions of maximum degree $d\geq 2$: polynomially-long sequences of
best-response moves from any initial state to a $d^{O(d^2)}$-approximate
equilibrium exist and can be efficiently identified in such games as long as
$d$ is constant.
","[{""version"":""v1"",""created"":""Tue, 12 Jul 2011 11:21:16 GMT""},{""version"":""v2"",""created"":""Fri, 11 Nov 2011 08:15:52 GMT""}]","2011-11-14"
"1107.2249","Ovidiu Vaduvescu","O. Vaduvescu, A. Tudorica, M. Birlan, R. Toma, M. Badea, D. Dumitru,
  C. Opriseanu and D. Vidican","Mining the CFHT Legacy Survey for known Near Earth Asteroids","Accepted in Astron. Nachr. (10 pags)","Astron. Nachr. / AN 332, No. 6, 580 - 587 (2011)","10.1002/asna.201011550",,"astro-ph.EP astro-ph.IM","http://arxiv.org/licenses/nonexclusive-distrib/1.0/","  The Canada-France-Hawaii Legacy Survey (CFHTLS) comprising about 25 000
MegaCam images was data mined to search for serendipitous encounters of known
Near Earth Asteroids (NEAs) and Potentially Hazardous Asteroids (PHAs). A total
of 143 asteroids (109 NEAs and 34 PHAs) were found on 508 candidate images
which were field corrected and measured carefully, and their astrometry was
reported to Minor Planet Centre. Both recoveries and precoveries (apparitions
before discovery) were reported, including data for 27 precovered asteroids (20
NEAs and 7 PHAs) and 116 recovered asteroids (89 NEAs and 27 PHAs). Our data
prolonged arcs for 41 orbits at first or last opposition, refined 35 orbits by
fitting data taken at one new opposition, recovered 6 NEAs at their second
opposition and allowed us to ameliorate most orbits and their Minimal Orbital
Intersection Distance (MOID), an important parameter to monitor for potential
Earth impact hazard in the future.
","[{""version"":""v1"",""created"":""Tue, 12 Jul 2011 11:22:36 GMT""}]","2011-07-13"
"1107.2250","Vladimir Kalevich","V. K. Kalevich, M. M. Afanasiev, A. Yu. Shiryaev and A. Yu. Egorov","Amplification of spin-filtering effect by magnetic field in GaAsN alloys","8 pages, 6 figures, Submitted to Physical Review B",,"10.1103/PhysRevB.85.035205",,"cond-mat.mes-hall","http://arxiv.org/licenses/nonexclusive-distrib/1.0/","  We have found that intensity $I$ and circular polarization degree $\rho$ of
the edge photoluminescence, excited in GaAsN alloys by circularly polarized
light at room temperature, grow substantially in the longitudinal magnetic
field $B$ of the order of 1\,kG. This increase depends on the intensity of
pumping and, in the region of weak or moderate intensities, may reach a twofold
value. In two-charge-state model, which considers spin-dependent recombination
of spin-oriented free electrons on deep paramagnetic centers, we included the
magnetic-field suppression of spin relaxation of the electrons bound on
centers. The model describes qualitatively the rise of $\rho$ and $I$ in a
magnetic field under different pump intensities. Experimental dependences
$\rho(B)$ and $I(B)$ are shifted with respect to zero of the magnetic field by
a value of $\sim$170\,Gauss, while the direction of the shift reverses with
change of the sign of circular polarization of pumping. As a possible cause of
the discovered shift we consider the Overhauser field, arising due to the
hyperfine interaction of an electron bound on a center with nuclei of the
crystal lattice in the vicinity of the center.
","[{""version"":""v1"",""created"":""Tue, 12 Jul 2011 11:28:54 GMT""}]","2015-05-28"
"1107.2251","Fabien Lacasa","F. Lacasa, N. Aghanim, M. Kunz, and M. Frommert","Characterisation of the non-Gaussianity of radio and IR point-sources at
  CMB frequencies","16 pages, 14 figures, 2 tables. match version accepted by MNRAS.
  Added error bars on bispectrum and Dfnl. Minor text changes. References added",,"10.1111/j.1365-2966.2012.20415.x",,"astro-ph.CO","http://arxiv.org/licenses/nonexclusive-distrib/1.0/","  This study, using publicly available simulations, focuses on the
characterisation of the non-Gaussianity produced by radio point sources and by
infrared (IR) sources in the frequency range of the cosmic microwave background
from 30 to 350 GHz. We propose a simple prescription to infer the angular
bispectrum from the power spectrum of point sources considering independent
populations of sources, with or without clustering. We test the accuracy of our
prediction using publicly available all-sky simulations of radio and IR sources
and find very good agreement. We further characterise the configuration
dependence and the frequency behaviour of the IR and radio bispectra. We show
that the IR angular bispectrum peaks for squeezed triangles and that the
clustering of IR sources enhances the bispectrum values by several orders of
magnitude at scales l \sim 100. At 150 GHz the bispectrum of IR sources starts
to dominate that of radio sources on large angular scales, and it dominates
over the whole multipole range at 350 GHz. Finally, we compute the bias on f_NL
induced by radio and IR sources. We show that the positive bias induced by
radio sources is significantly reduced by masking the sources. We also show,
for the first time, that the form of the IR bispectrum mimics a primordial
'local' bispectrum f_NL. The IR sources produce a negative bias which becomes
important for Planck-like resolution and at high frequencies (Delta f_NL ~ -6
at 277 GHz and Delta f_NL \sim -60-70 at 350 GHz). Most of the signal being due
to the clustering of faint IR sources, the bias Delta f_NL^IR is not reduced by
masking sources above a flux limit and may, in some cases, even be increased
due to the reduction of the shot-noise term.
","[{""version"":""v1"",""created"":""Tue, 12 Jul 2011 11:46:17 GMT""},{""version"":""v2"",""created"":""Thu, 29 Mar 2012 12:52:05 GMT""}]","2012-03-30"
"1107.2252","Shay Hacohen-Gourgy","Shay Hacohen-Gourgy, Boaz Almog, Guy Deutscher","Coexistence of a triplet nodal order-parameter and a singlet
  order-parameter at the interfaces of ferromagnet-superconductor Co/CoO/In
  junctions","5 pages, Accepted to Phys. Rev. B","Phys. Rev. B 84, 014532 (2011)","10.1103/PhysRevB.84.014532",,"cond-mat.supr-con","http://arxiv.org/licenses/nonexclusive-distrib/1.0/","  We present differential conductance measurements of Cobalt / Cobalt-Oxide /
Indium planar junctions, 500nm x 500nm in size. The junctions span a wide range
of barriers, from very low to a tunnel barrier. The characteristic conductance
of all the junctions show a V-shape structure at low bias instead of the
U-shape characteristic of a s-wave order parameter. The bias of the conductance
peaks is, for all junctions, larger than the gap of indium. Both properties
exclude pure s-wave pairing. The data is well fitted by a model that assumes
the coexistence of s-wave singlet and equal spin p-wave triplet fluids. We find
that the values of the s-wave and p-wave gaps follow the BCS temperature
dependance and that the amplitude of the s-wave fluid increases with the
barrier strength.
","[{""version"":""v1"",""created"":""Tue, 12 Jul 2011 11:46:39 GMT""}]","2011-09-06"
"1107.2253","Eberhard Mayerhofer","Eberhard Mayerhofer","How singular are moment generating functions?",,,,,"math.PR","http://arxiv.org/licenses/nonexclusive-distrib/1.0/","  This short note concerns the possible singular behaviour of moment generating
functions of finite measures at the boundary of their domain of existence. We
look closer at Example 7.3 in O. Barndorff-Nielsen's book ""Information and
Exponential Families in Statistical Theory (1978)"" and elaborate on the type of
exhibited singularity. Finally, another regularity problem is discussed and it
is solved through tensorizing two Barndorff- Nielsen's distributions.
","[{""version"":""v1"",""created"":""Tue, 12 Jul 2011 11:47:56 GMT""}]","2011-07-13"
"1107.2254","Nikolay L Chuprikov","N. L. Chuprikov","Scattering of TE- and TM-polarized wave packets on a dielectric layer:
  true and false group-delay times","9 pages, 1 figure",,,,"physics.optics quant-ph","http://arxiv.org/licenses/nonexclusive-distrib/1.0/","  We consider an oblique incidence on a uniform dielectric layer of the plane
monochromatic TE- and TM-waves, as well as TE- and TM-polarized wave packets
consisting of waves with the same angle of incidence. For each polarization the
stationary model is presented, which allows one to uniquely restore the
dynamics of the transmitted and reflected components of the incident wave
packet at all stages of scattering. On this basis we introduce the concepts of
``true group-delay time""\/ and ``false group-delay time""\/ (the corresponding
quantities for transmission and reflection are the same). The former is defined
as the difference of two instants in the evolution of the same wave packet, one
of which cannot be measured directly. Conversely, the latter is defined as the
difference of two instants in the evolution of different wave packets, both can
be measured directly. The false group-delay time does not in itself have a
physical sense, but plays a key role for an indirect measurement of the true
group-delay times of both polarizations.
","[{""version"":""v1"",""created"":""Tue, 12 Jul 2011 11:50:29 GMT""},{""version"":""v2"",""created"":""Wed, 11 Apr 2012 11:01:43 GMT""},{""version"":""v3"",""created"":""Tue, 18 Jun 2013 12:38:57 GMT""},{""version"":""v4"",""created"":""Sat, 13 Jul 2019 09:35:42 GMT""}]","2019-07-16"
"1107.2255","Fran\c{c}ois Arnault","Fran\c{c}ois Arnault","A complete set of multidimensional Bell inequalities","14 pages, 1 figure. Plain TeX file This version 2 adds Section 7
  about violations. Section 8 (the case d=3) and bibliography have been
  extended accordingly",,"10.1088/1751-8113/45/25/255304",,"quant-ph math-ph math.MP","http://arxiv.org/licenses/nonexclusive-distrib/1.0/","  We give a multidimensional generalisation of the complete set of
Bell-correlation inequalities given by Werner and Wolf, and by Zukowski and
Brukner, for the two-dimensional case. Our construction applies for the n
parties, two-observables case, where each observable is d-valued. The d^{d^n}
inequalities obtained involve homogeneous polynomials. They define the facets
of a polytope in a complex vector space of dimension d^n. We also show that
these inequalities are violated by Quantum Mechanics. We exhibit examples in
the three-dimensional case.
","[{""version"":""v1"",""created"":""Tue, 12 Jul 2011 12:02:14 GMT""},{""version"":""v2"",""created"":""Mon, 24 Oct 2011 14:34:44 GMT""}]","2015-05-28"
"1107.2256","Erik Jan van Leeuwen","Josep Diaz and Olli Pottonen and Maria Serna and Erik Jan van Leeuwen","Complexity of Metric Dimension on Planar Graphs","v5: minor modifications. to appear in JCSS",,,,"cs.CC","http://arxiv.org/licenses/nonexclusive-distrib/1.0/","  The metric dimension of a graph $G$ is the size of a smallest subset $L
\subseteq V(G)$ such that for any $x,y \in V(G)$ with $x\not= y$ there is a $z
\in L$ such that the graph distance between $x$ and $z$ differs from the graph
distance between $y$ and $z$. Even though this notion has been part of the
literature for almost 40 years, prior to our work the computational complexity
of determining the metric dimension of a graph was still very unclear. In this
paper, we show tight complexity boundaries for the Metric Dimension problem. We
achieve this by giving two complementary results. First, we show that the
Metric Dimension problem on planar graphs of maximum degree $6$ is NP-complete.
Then, we give a polynomial-time algorithm for determining the metric dimension
of outerplanar graphs.
","[{""version"":""v1"",""created"":""Tue, 12 Jul 2011 12:07:33 GMT""},{""version"":""v2"",""created"":""Mon, 27 Feb 2012 17:00:40 GMT""},{""version"":""v3"",""created"":""Tue, 28 Feb 2012 09:55:50 GMT""},{""version"":""v4"",""created"":""Tue, 18 Feb 2014 09:14:48 GMT""},{""version"":""v5"",""created"":""Tue, 12 Jul 2016 16:39:44 GMT""}]","2016-07-13"
"1107.2257","Lidija Zivkovic","L. Zivkovic","SUSY Searches at the Tevatron","13 pages, 11 figures, The Ninth International Conference on Flavor
  Physics and CP Violation, (FPCP 2011), Maale Hachamisha, Israel, May 23--27,
  2011",,,"FERMILAB-CONF-11-317-E","hep-ex","http://arxiv.org/licenses/nonexclusive-distrib/1.0/","  In this article results from supersymmetry searches at D0 and CDF are
reported. Searches for third generation squarks, searches for gauginos, and
searches for models with R-parity violation are described. As no signs of
supersymmetry for these models are observed, the most stringent limits to date
are presented.
","[{""version"":""v1"",""created"":""Tue, 12 Jul 2011 12:07:44 GMT""}]","2011-07-13"
"1107.2258","Daniel B. Thomas","D.B. Thomas","Beyond Einstein: Cosmological Tests of Model Independent Modified
  Gravity","Proceedings of 46th Rencontres de Moriond and GPhyS Colloquium on
  Gravitational Waves and Experimental Gravity",,,,"astro-ph.CO gr-qc","http://arxiv.org/licenses/nonexclusive-distrib/1.0/","  Model-independent parametrisations of modified gravity have attracted a lot
of attention over the past few years; numerous combinations of experiments and
observables have been suggested to constrain these parameterisations, and
future surveys look very promising. Galaxy Clusters have been mentioned, but
not looked at as extensively in the literature as some other probes. Here we
look at adding Galaxy Clusters into the mix of observables and examine whether
they could improve the constraints on the modified gravity parameters. In
particular, we forecast the constraints from combining the Planck CMB spectrum
and SZ cluster catalogue and a DES-like Weak Lensing survey. We've found that
adding cluster counts improves the constraints obtained from combining CMB and
WL data.
","[{""version"":""v1"",""created"":""Tue, 12 Jul 2011 12:16:31 GMT""}]","2011-07-13"
"1107.2259","Massimo Ortolano","Massimo Ortolano and Luca Callegaro","Matrix method analysis of quantum Hall effect device connections",,,"10.1088/0026-1394/49/1/001",,"physics.ins-det cond-mat.mes-hall","http://arxiv.org/licenses/nonexclusive-distrib/1.0/","  The modelling of electrical connections of single, or several, multiterminal
quantum Hall effect (QHE) devices is relevant for electrical metrology: it is
known, in fact, that certain particular connections allow i) the realization of
multiples or fractions of the quantised resistance, or ii) the rejection of
stray impedances, so that the configuration maintains the status of quantum
standard. Ricketts-Kemeny and Delahaye equivalent circuits are known to be
accurate models of the QHE: however, the numerical or analytical solution of
electrical networks including these equivalent circuits can be difficult. In
this paper, we introduce a method of analysis based on the representation of a
QHE device by means of the \emph{indefinite admittance matrix}: external
connections are then represented with another matrix, easily written by
inspection. Some examples, including the solution of double- and triple-series
connections, are shown.
","[{""version"":""v1"",""created"":""Tue, 12 Jul 2011 12:18:10 GMT""}]","2015-05-28"
"1107.2260","Jose Maria Martell","Frederic Bernicot (LPP), Jos\'e Maria Martell","Self-improving properties for abstract Poincar\'e type inequalities","42 pages","Trans. Amer. Math. 367, no. 7, (2015), 4793-4835",,,"math.CA","http://arxiv.org/licenses/nonexclusive-distrib/1.0/","  We study self-improving properties in the scale of Lebesgue spaces of
generalized Poincar\'e inequalities in the Euclidean space. We present an
abstract setting where oscillations are given by certain operators (e.g.,
approximations of the identity, semigroups or mean value operators) that have
off-diagonal decay in some range. Our results provide a unified theory that is
applicable to the classical Poincar\'e inequalities and furthermore it includes
oscillations defined in terms of semigroups associated with second order
elliptic operators as those in the Kato conjecture. In this latter situation we
obtain a direct proof of the John-Nirenberg inequality for the associated BMO
and Lipschitz spaces of [HMay,HMM].
","[{""version"":""v1"",""created"":""Tue, 12 Jul 2011 12:19:40 GMT""},{""version"":""v2"",""created"":""Wed, 8 Jul 2015 06:13:04 GMT""}]","2015-07-09"
"1107.2261","Laurent Gardes","Laurent Gardes (IRMA), St\'ephane Girard (INRIA Grenoble Rh\^one-Alpes
  / LJK Laboratoire Jean Kuntzmann)","Functional kernel estimators of large conditional quantiles",,"Electronic Journal of Statistics 6 (2012) 1715-1744",,,"math.ST stat.TH","http://arxiv.org/licenses/nonexclusive-distrib/1.0/","  We address the estimation of conditional quantiles when the covariate is
functional and when the order of the quantiles converges to one as the sample
size increases. In a first time, we investigate to what extent these large
conditional quantiles can still be estimated through a functional kernel
estimator of the conditional survival function. Sufficient conditions on the
rate of convergence of their order to one are provided to obtain asymptotically
Gaussian distributed estimators. In a second time, basing on these result, a
functional Weissman estimator is derived, permitting to estimate large
conditional quantiles of arbitrary large order. These results are illustrated
on finite sample situations.
","[{""version"":""v1"",""created"":""Tue, 12 Jul 2011 12:20:41 GMT""},{""version"":""v2"",""created"":""Fri, 20 Jan 2012 08:42:34 GMT""},{""version"":""v3"",""created"":""Tue, 21 Aug 2012 08:04:26 GMT""},{""version"":""v4"",""created"":""Thu, 25 Apr 2013 19:52:35 GMT""}]","2013-04-26"
"1107.2262","Ilya Lvovich Shapiro","Flavia Sobreira, Baltazar J. Ribeiro and Ilya L. Shapiro","Effective Potential in Curved Space and Cut-Off Regularizations","Several misprints in signs corrected. Added related thanks, also more
  comments and a few references. Fits the version to be published in Physics
  Letters B. 16 pages, no figures, LaTeX",,"10.1016/j.physletb.2011.10.016",,"gr-qc hep-ph hep-th","http://arxiv.org/licenses/nonexclusive-distrib/1.0/","  We consider derivation of the effective potential for a scalar field in
curved space-time within the physical regularization scheme, using two sorts of
covariant cut-off regularizations. The first one is based on the local momentum
representation and Riemann normal coordinates and the second is operatorial
regularization, based on the Fock-Schwinger-DeWitt proper-time representation.
We show, on the example of a self-interacting scalar field, that these two
methods produce equal results for divergences, but the first one gives more
detailed information about the finite part. Furthermore, we calculate the
contribution from a massive fermion loop and discuss renormalization group
equations and their interpretation for the multi-mass theories.
","[{""version"":""v1"",""created"":""Tue, 12 Jul 2011 12:28:06 GMT""},{""version"":""v2"",""created"":""Tue, 11 Oct 2011 13:37:28 GMT""}]","2015-05-28"
