"1107.2137","Susha Parameswaran","Tatsuo Kobayashi, Susha L. Parameswaran, Saul Ramos-Sanchez and Ivonne
  Zavala","Revisiting Coupling Selection Rules in Heterotic Orbifold Models","27 pages, v2: several clarifications, matches JHEP version. v3:
  supercedes journal version, erratum to appear in JHEP; correction to ""rule 5""
  equations, main ideas unchanged",,"10.1007/JHEP05(2012)008","KUNS-2341, UUITP-18/11","hep-th hep-ph","http://arxiv.org/licenses/nonexclusive-distrib/1.0/","  We study L-point couplings between twisted sector fields in heterotic
orbifold compactifications, using conformal field theory. Selection rules
provide an easy way to identify which couplings are non-vanishing. Those used
in the current literature are gauge invariance, R-charge conservation and the
space group selection rule, but they are not the whole story. We revive and
refine a fourth selection rule, due to symmetries in the underlying torus
lattice, and introduce a fifth one, due to the existence or not of classical
worldsheet instanton solutions to mediate the couplings. We consider briefly
the phenomenological consequences of the additional rules, in particular for
recent orbifold constructions whose field content correspond to that of the
MSSM. The structure of the exotic mass matrices is unaltered and many
dimension-5 proton-decay operators vanish.
","[{""version"":""v1"",""created"":""Mon, 11 Jul 2011 20:37:10 GMT""},{""version"":""v2"",""created"":""Tue, 3 Apr 2012 13:47:30 GMT""},{""version"":""v3"",""created"":""Tue, 27 Nov 2012 08:31:52 GMT""}]","2015-05-28"
"1107.2138","Th. M. Nieuwenhuizen","Armen E. Allahverdyan, Roger Balian and Theo M. Nieuwenhuizen","Understanding quantum measurement from the solution of dynamical models","Minor changes, matches published version. 201 pages Latex, 377
  references, 15 figures","Phys. Rep. 525 (2013) 1-166","10.1016/j.physrep.2012.11.001",,"quant-ph cond-mat.stat-mech hep-th","http://arxiv.org/licenses/nonexclusive-distrib/1.0/","  The quantum measurement problem, understanding why a unique outcome is
obtained in each individual experiment, is tackled by solving models. After an
introduction we review the many dynamical models proposed over the years. A
flexible and rather realistic model is introduced, describing the measurement
of the $z$-component of a spin through interaction with a magnetic memory
simulated by a Curie--Weiss magnet, including $N \gg1$ spins weakly coupled to
a phonon bath. Initially prepared in a metastable paramagnetic state, it may
transit to its up or down ferromagnetic state, triggered by its coupling with
the tested spin, so that its magnetization acts as a pointer.
  A detailed solution of the dynamical equations is worked out. Conditions are
found, which ensure that the process satisfies the features of ideal
measurements. Various imperfections are discussed, as well as attempts of
incompatible measurements. The first steps consist in the solution of the
Hamiltonian dynamics for the spin-apparatus density matrix $D(t)$. On a longer
time scale, the trend towards equilibrium of the magnet produces a final state
$D(t_{\rm f})$ that involves correlations between the system and the
indications of the pointer, thus ensuring registration. A difficulty lies in a
quantum ambiguity: There exist many incompatible decompositions of the density
matrix $\scriptD(t_{\rm f})$. This difficulty is overcome by dynamics due to
suitable interactions within the apparatus.
  Any subset of runs thus reaches over a brief delay a stable state which
satisfies the same hierarchic property as in classical probability theory.
Standard quantum statistical mechanics alone appears sufficient to explain the
occurrence of a unique answer in each run. Finally, pedagogical exercises are
proposed while the statistical interpretation is promoted for teaching.
[Abridged]
","[{""version"":""v1"",""created"":""Mon, 11 Jul 2011 20:37:59 GMT""},{""version"":""v2"",""created"":""Wed, 2 May 2012 15:24:55 GMT""},{""version"":""v3"",""created"":""Thu, 18 Oct 2012 16:30:52 GMT""},{""version"":""v4"",""created"":""Fri, 1 Feb 2013 10:57:11 GMT""}]","2015-05-28"
"1107.2139","Julio Bernues","David Alonso-Guti\'errez, Jes\'us Bastero and Julio Bernu\'es","Factoring Sobolev inequalities through classes of functions",,,,,"math.FA","http://arxiv.org/licenses/nonexclusive-distrib/1.0/","  We recall two approaches to recent improvements of the classical Sobolev
inequality. The first one follows the point of view of Real Analysis, while the
second one relies on tools from Convex Geometry. In this paper we prove a
(sharp) connection between them.
","[{""version"":""v1"",""created"":""Mon, 11 Jul 2011 20:38:39 GMT""}]","2011-07-13"
"1107.2140","Nate Bastian","Nate Bastian (Excellence Cluster, Garching)","Cluster Disruption: From infant mortality to long term survival","18 pages, 6 Figures, invited review for the proceedings of ""Stellar
  Clusters and Associations - A RIA workshop on GAIA"", 23-27 May 2011, Granada,
  Spain",,,,"astro-ph.CO","http://arxiv.org/licenses/nonexclusive-distrib/1.0/","  How stellar clusters disrupt, and over what timescales, is intimately linked
with how they form. Here, we review the theory and observations of cluster
disruption, both the suggested initial rapid dissolution phase (infant
mortality) and the longer timescale processes that affect clusters after they
emerge from their progenitor GMCs. Over the past decade, the standard paradigm
that has developed is that all/most stars are formed in clusters and that the
vast majority of these groups are disrupted over short timescales (< 10 Myr).
This is thought to be due to the removal of the left over gas from the
star-formation process, known as infant mortality. However, recent results have
suggested that the fraction of stars that form in clusters has been
overestimated, with the majority being formed in unbound groups (i.e.
associations) which expand and disrupt without the need of invoking gas
removal. Dynamical measurements of young massive clusters in the Galaxy suggest
that clusters reach a stable equilibrium at very young (<3 Myr) ages,
suggesting that gas expulsion has little effect on the cluster. After the early
dynamical phase, clusters appear to be long lived and stable objects. We use
the recent WFC3 image of the cluster population in M83 to test empirical
disruption laws and find that the lifetime of clusters strongly depends on
their ambient environment. While the role of cluster mass is less well
constrained (due to the added parameter of the form of the cluster mass
function), we find evidence suggesting that higher mass clusters survive
longer, and that the cluster mass function (at least in M83, outside the
nuclear region) is truncated above ~10^5Msun.
","[{""version"":""v1"",""created"":""Mon, 11 Jul 2011 20:44:48 GMT""}]","2011-07-13"
"1107.2141","Krishnendu Chatterjee","Krishnendu Chatterjee and Laurent Doyen","Partial-Observation Stochastic Games: How to Win when Belief Fails",,,,,"cs.GT","http://arxiv.org/licenses/nonexclusive-distrib/1.0/","  In two-player finite-state stochastic games of partial observation on graphs,
in every state of the graph, the players simultaneously choose an action, and
their joint actions determine a probability distribution over the successor
states. We consider reachability objectives where player 1 tries to ensure a
target state to be visited almost-surely or positively. On the basis of
information, the game can be one-sided with either (a)player 1 or (b)player 2
having partial observation, or two-sided with both players having partial
observation. On the basis of randomization (a)players may not be allowed to use
randomization (pure strategies), or (b)may choose a probability distribution
over actions but the actual random choice is not visible (actions invisible),
or (c)may use full randomization. Our results for pure strategies are as
follows: (1)For one-sided games with player 2 perfect observation we show that
belief-based strategies are not sufficient, and present an exponential upper
bound on memory both for almost-sure and positive winning strategies; we show
that the problem of deciding the existence of almost-sure and positive winning
strategies for player 1 is EXPTIME-complete and present symbolic algorithms
that avoid the explicit exponential construction. (2)For one-sided games with
player 1 perfect observation we show that non-elementary memory is both
necessary and sufficient for both almost-sure and positive winning strategies.
(3)We show that for the two-sided case finite memory strategies are sufficient
for both positive and almost-sure winning. We establish the equivalence of the
almost-sure winning problem for pure strategies with randomized strategies with
actions invisible. Our equivalence result exhibit serious flaws in previous
results in the literature: we show a non-elementary memory lower bound for
almost-sure winning whereas an exponential upper bound was claimed.
","[{""version"":""v1"",""created"":""Mon, 11 Jul 2011 20:46:07 GMT""}]","2011-07-13"
"1107.2142","Mark Voit","G. M. Voit","Quasisteady Configurations of Conductive Intracluster Media","ApJ in press, 13 pages, 5 figures",,"10.1088/0004-637X/740/1/28","NSF-KITP-11-080","astro-ph.CO","http://arxiv.org/licenses/nonexclusive-distrib/1.0/","  The radial distributions of temperature, density, and gas entropy among
cool-core clusters tend to be quite similar, suggesting that they have entered
a quasi-steady state. If that state is regulated by a combination of thermal
conduction and feedback from a central AGN, then the characteristics of those
radial profiles ought to contain information about the spatial distribution of
AGN heat input and the relative importance of thermal conduction. This paper
addresses those topics by deriving steady-state solutions for clusters in which
radiative cooling, electron thermal conduction, and thermal feedback fueled by
accretion are all present, with the aim of interpreting the configurations of
cool-core clusters in terms of steady-state models. It finds that the core
configurations of many cool-core clusters have entropy levels just below those
of conductively balanced solutions in which magnetic fields have suppressed
electron thermal conduction to ~1/3 of the full Spitzer value, suggesting that
AGN feedback is triggered when conduction can no longer compensate for
radiative cooling. And even when feedback is necessary to heat the central ~30
kpc, conduction may still be the most important heating mechanism within a
cluster's central ~100 kpc.
","[{""version"":""v1"",""created"":""Mon, 11 Jul 2011 20:47:27 GMT""}]","2015-05-28"
"1107.2143","Yunrong Zhu","Michael Holst, Ryan Szypowski, Yunrong Zhu","Adaptive Finite Element Methods with Inexact Solvers for the Nonlinear
  Poisson-Boltzmann Equation","Submitted to DD20 Proceedings",,"10.4208/cicp.081009.130611a",,"math.NA","http://arxiv.org/licenses/nonexclusive-distrib/1.0/","  In this article we study adaptive finite element methods (AFEM) with inexact
solvers for a class of semilinear elliptic interface problems. We are
particularly interested in nonlinear problems with discontinuous diffusion
coefficients, such as the nonlinear Poisson-Boltzmann equation and its
regularizations. The algorithm we study consists of the standard
SOLVE-ESTIMATE-MARK-REFINE procedure common to many adaptive finite element
algorithms, but where the SOLVE step involves only a full solve on the coarsest
level, and the remaining levels involve only single Newton updates to the
previous approximate solution. We summarize a recently developed AFEM
convergence theory for inexact solvers, and present a sequence of numerical
experiments that give evidence that the theory does in fact predict the
contraction properties of AFEM with inexact solvers. The various routines used
are all designed to maintain a linear-time computational complexity.
","[{""version"":""v1"",""created"":""Mon, 11 Jul 2011 20:49:07 GMT""}]","2016-08-24"
"1107.2144","Ben Weinkove","Jian Song, G\'abor Sz\'ekelyhidi, Ben Weinkove","The K\""ahler-Ricci flow on projective bundles","11 pages","Int. Math. Res. Not. IMRN 2013, no. 2, 243-257",,,"math.DG","http://arxiv.org/licenses/nonexclusive-distrib/1.0/","  We study the behaviour of the K\""ahler-Ricci flow on projective bundles. We
show that if the initial metric is in a suitable K\""ahler class, then the
fibers collapse in finite time and the metrics converge subsequentially in the
Gromov-Hausdorff sense to a metric on the base.
","[{""version"":""v1"",""created"":""Mon, 11 Jul 2011 20:49:45 GMT""}]","2018-12-14"
"1107.2145","Victor Utrobin P.","V.P. Utrobin (1 and 2), N.N. Chugai (3) ((1) MPA, Garching, (2) ITEP,
  Moscow, (3) Institute of Astronomy, RAS, Moscow)","Supernova 2000cb: high-energy version of SN 1987A","one change made and one reference replaced",,"10.1051/0004-6361/201117137",,"astro-ph.SR","http://arxiv.org/licenses/nonexclusive-distrib/1.0/","  Among type IIP supernovae there are a few events that resemble the
well-studied supernova 1987A produced by the blue supergiant in the Large
Magellanic Cloud. We study a peculiar supernova 2000cb and compare it with the
supernova 1987A. We carried out hydrodynamic simulations of the supernova in an
extended parameter space to describe its light curve and spectroscopic data.
The hydrogen H-alpha and H-beta lines are modeled using a time-dependent
approach. We constructed the hydrodynamic model by fitting the photometric and
spectroscopic observations. We infer a presupernova radius of 35 Rsun, an
ejecta mass of 22.3 Msun, an explosion energy of 4.4x10^{51} erg, and a
radioactive Ni-56 mass of 0.083 Msun. The estimated progenitor mass on the main
sequence lies in the range of 24-28 Msun. The early H-alpha profile on day 7 is
consistent with the density distribution found from hydrodynamic modeling,
while the H-alpha line on day 40 indicates an extended Ni-56 mixing up to a
velocity of 8400 km/s. We emphasize that the dome-like light curves of both
supernova 2000cb and supernova 1987A are entirely powered by radioactive decay.
This is unlike normal type IIP supernovae, the plateau of which is dominated by
the internal energy deposited after the shock wave propagation through the
presupernova. We find signatures of the explosion asymmetry in the photospheric
and nebular spectra. The explosion energy of supernova 2000cb is higher by a
factor of three compared to supernova 1987A, which poses a serious problem for
explosion mechanisms of type IIP supernovae.
","[{""version"":""v1"",""created"":""Mon, 11 Jul 2011 20:54:23 GMT""},{""version"":""v2"",""created"":""Tue, 2 Aug 2011 08:36:57 GMT""}]","2015-05-28"
"1107.2146","Krishnendu Chatterjee","Krishnendu Chatterjee","Bounded Rationality in Concurrent Parity Games",,,,,"cs.GT","http://arxiv.org/licenses/nonexclusive-distrib/1.0/","  We consider 2-player games played on a finite state space for infinite
rounds. The games are concurrent: in each round, the two players choose their
moves simultaneously; the current state and the moves determine the successor.
We consider omega-regular winning conditions given as parity objectives. We
consider the qualitative analysis problems: the computation of the almost-sure
and limit-sure winning set of states, where player 1 can ensure to win with
probability 1 and with probability arbitrarily close to 1, respectively. In
general the almost-sure and limit-sure winning strategies require both
infinite-memory and infinite-precision. We study the bounded-rationality
problem for qualitative analysis of concurrent parity games, where the strategy
set player 1 is restricted to bounded-resource strategies. In terms of
precision, strategies can be deterministic, uniform, finite-precision or
infinite-precision; and in terms of memory, strategies can be memoryless,
finite-memory or infinite-memory. We present a precise and complete
characterization of the qualitative winning sets for all combinations of
classes of strategies. In particular, we show that uniform memoryless
strategies are as powerful as finite-precision infinite-memory strategies, and
infinite-precision memoryless strategies are as powerful as infinite-precision
finite-memory strategies. We show that the winning sets can be computed in
O(n^{2d+3}) time, where n is the size of the game and 2d is the number of
priorities, and our algorithms are symbolic. The membership problem of whether
a state belongs to a winning set can be decided in NP cap coNP. While this
complexity is the same as for the simpler class of turn-based games, where in
each state only one of the players has a choice of moves, our algorithms, that
are obtained by characterization of the winning sets as mu-calculus formulas,
are considerably more involved.
","[{""version"":""v1"",""created"":""Mon, 11 Jul 2011 21:03:13 GMT""},{""version"":""v2"",""created"":""Thu, 11 Oct 2012 06:55:28 GMT""},{""version"":""v3"",""created"":""Wed, 19 Jun 2013 11:07:46 GMT""},{""version"":""v4"",""created"":""Thu, 20 Jun 2013 07:49:15 GMT""}]","2013-06-21"
"1107.2147","S. Mark Ammons","S. Mark Ammons (University of Arizona), David J. V. Rosario (MPE),
  David C. Koo (UCSC), Aaron A. Dutton (University of Victoria), Jason
  Melbourne (Caltech), Claire E. Max (UCSC), Mark Mozena (UCSC), Dale D.
  Kocevski (UCSC), Elizabeth J. McGrath (UCSC), Rychard J. Bouwens (Leiden
  Observatory), and Daniel K. Magee (UCSC)","AGN Unification at z ~ 1: u - R Colors and Gradients in X-ray AGN Hosts","34 pages, 9 figures, accepted to ApJ",,"10.1088/0004-637X/740/1/3",,"astro-ph.CO","http://creativecommons.org/licenses/publicdomain/","  We present uncontaminated rest-frame u - R colors of 78 X-ray-selected AGN
hosts at 0.5 < z < 1.5 in the Chandra Deep Fields measured with HST/ACS/NICMOS
and VLT/ISAAC imaging. We also present spatially-resolved NUV - R color
gradients for a subsample of AGN hosts imaged by HST/WFC3. Integrated,
uncorrected photometry is not reliable for comparing the mean properties of
soft and hard AGN host galaxies at z ~ 1 due to color contamination from
point-source AGN emission. We use a cloning simulation to develop a calibration
between concentration and this color contamination and use this to correct host
galaxy colors.
  The mean u - R color of the unobscured/soft hosts beyond ~6 kpc is
statistically equivalent to that of the obscured/hard hosts (the soft sources
are 0.09 +/- 0.16 magnitudes bluer). Furthermore, the rest-frame V - J colors
of the obscured and unobscured hosts beyond ~6 kpc are statistically
equivalent, suggesting that the two populations have similar distributions of
dust extinction. For the WFC3/IR sample, the mean NUV - R color gradients of
unobscured and obscured sources differ by less than ~0.5 magnitudes for r > 1.1
kpc. These three observations imply that AGN obscuration is uncorrelated with
the star formation rate beyond ~1 kpc.
  These observations favor a unification scenario for intermediate-luminosity
AGNs in which obscuration is determined geometrically. Scenarios in which the
majority of intermediate-luminosity AGN at z ~ 1 are undergoing rapid,
galaxy-wide quenching due to AGN-driven feedback processes are disfavored.
","[{""version"":""v1"",""created"":""Mon, 11 Jul 2011 21:04:39 GMT""}]","2015-05-28"
"1107.2148","Panos Aliferis","Panos Aliferis","An introduction to reliable quantum computation","34 pages, 25 jpeg figures, uses cupbook.sty and fncychap.sty; chapter
  5 in ""Quantum Error Correction,"" edited by Daniel A. Lidar and Todd A. Brun,
  (Cambridge University Press, 2013)","In ""Quantum Error Correction"", edited by Daniel A. Lidar and Todd
  A. Brun, (Cambridge University Press, 2013)",,,"quant-ph","http://arxiv.org/licenses/nonexclusive-distrib/1.0/","  This is an introduction to software methods of quantum fault tolerance.
Broadly speaking, these methods describe strategies for using the noisy
hardware components of a quantum computer to perform computations while
continually monitoring and actively correcting the hardware faults. We discuss
parallels and differences with similar methods for ordinary digital
computation, we discuss some of the noise models used in designing and
analyzing noisy quantum circuits, and we sketch the logic of some of the
central results in this area of research.
","[{""version"":""v1"",""created"":""Mon, 11 Jul 2011 21:04:48 GMT""},{""version"":""v2"",""created"":""Fri, 15 Jul 2011 11:48:52 GMT""},{""version"":""v3"",""created"":""Thu, 5 Dec 2013 11:03:32 GMT""}]","2013-12-06"
"1107.2149","J. Marvin Herndon","J. Marvin Herndon","New Indivisible Geoscience Paradigm",,,,,"physics.gen-ph physics.geo-ph","http://arxiv.org/licenses/nonexclusive-distrib/1.0/","  Earth's interior, I posit, is like one of the rare, oxygen-starved ""enstatite
chondrite"" meteorites (and unlike a more-oxidized ""ordinary chondrite"" as has
been believed for seventy years). Laboratory-analyzed enstatite-chondrite
samples are comparable to having-in-hand impossibleto- gather deep-Earth
samples. Enstatite-chondrite formation in oxygen-starved conditions caused
oxygen-loving elements to occur, in part, as non-oxides in their iron-alloy.
Observations, consistent with solar abundance and behavior of chemical
elements, lead me to a new interpretation of: (1) Earth's early formation as a
Jupiter-like gas-giant, (2) its decompressionpowered surface geology, (3)
Earth's internal composition, and (4) a natural, planetocentric nuclear-fission
reactor as source of both the geomagnetic field and energy channeled to surface
""hot-spots"". I present a unified vision of Earth formation and concomitant
dynamics that explains in a logical and causally related way: (1) fluid
Earth-core formation without wholeplanet melting, and (2) the myriad
measurements and observations, previously attributed to ""plate tectonics"", but
without necessitating mantle convection.
","[{""version"":""v1"",""created"":""Mon, 11 Jul 2011 21:11:55 GMT""}]","2011-07-13"
"1107.2150","Paul Grabowski","Paul E. Grabowski and David F. Chernoff","Pseudospectral Calculation of Helium Wave Functions, Expectation Values,
  and Oscillator Strength","24 pages, 12 figures, 6 tables. To be submitted to Physical Review A.
  LANL identifier 'LA-UR-11-10986'",,"10.1103/PhysRevA.84.042505",,"physics.atom-ph physics.comp-ph quant-ph","http://arxiv.org/licenses/nonexclusive-distrib/1.0/","  The pseudospectral method is a powerful tool for finding highly precise
solutions of Schr\""{o}dinger's equation for few-electron problems. We extend
the method's scope to wave functions with non-zero angular momentum and test it
on several challenging problems. One group of tests involves the determination
of the nonrelativistic electric dipole oscillator strength for the helium
$1^1$S $\to 2^1$P transition. The result achieved, $0.27616499(27)$, is
comparable to the best in the literature.
  Another group of test applications is comprised of well-studied leading order
finite nuclear mass and relativistic corrections for the helium ground state. A
straightforward computation reaches near state-of-the-art accuracy without
requiring the implementation of any special-purpose numerics.
  All the relevant quantities tested in this paper -- energy eigenvalues,
S-state expectation values and bound-bound dipole transitions for S and P
states -- converge exponentially with increasing resolution and do so at
roughly the same rate. Each individual calculation samples and weights the
configuration space wave function uniquely but all behave in a qualitatively
similar manner. Quantum mechanical matrix elements are directly and reliably
calculable with pseudospectral methods.
  The technical discussion includes a prescription for choosing coordinates and
subdomains to achieve exponential convergence when two-particle Coulomb
singularities are present. The prescription does not account for the wave
function's non-analytic behavior near the three-particle coalescence which
should eventually hinder the rate of the convergence. Nonetheless the effect is
small in the sense that ignoring the higher-order coalescence does not appear
to affect adversely the accuracy of any of the quantities reported nor the rate
at which errors diminish.
","[{""version"":""v1"",""created"":""Mon, 11 Jul 2011 21:16:16 GMT""}]","2013-05-29"
