"1107.2065","Giorgio Giardina","Orest Povoroznyk (1), Olga K. Gorpinich (1), Olexiy O. Jachmenjov (1),
  Hanna V.Mokhnach (1), Oleg Ponkratenko (1), Giuseppe Mandaglio (2 and 3),
  Francesca Curciarello (2 and 3), Veronica De Leo (2 and 3), Giovanni Fazio (2
  and 3), Giorgio Giardina (2 and 3) ((1) Institute for Nuclear Research,
  National Academy of Science of Ukraine, Kiev, Ukraine (2) Dipartimento di
  Fisica dell'Universit\`a di Messina, Italy, (3) Istituto Nazionale di Fisica
  Nucleare, Sezione di Catania, Italy)","The high-lying $^6$Li levels at excitation energy around 21 MeV","12 pages, 6 figures. Accepted for publication in J. Phys. Soc. Jpn",,"10.1143/JPSJ.80.094204",,"nucl-ex","http://arxiv.org/licenses/nonexclusive-distrib/1.0/","  The $^3$H+$^3$He cluster structure in $^6$Li was investigated by the
$^3$H($\alpha$,$^3$H $^3$He)n kinematically complete experiment at the incident
energy $E_\alpha$ = 67.2 MeV. We have observed two resonances at $E_x^*$ =
21.30 and 21.90 MeV which are consistent with the $^3$He($^3$H, $\gamma$)$^6$Li
analysis in the Ajzenberg-Selove compilation. Our data are compared with the
previous experimental data and the RGM and CSRGM calculations.
","[{""version"":""v1"",""created"":""Mon, 11 Jul 2011 16:01:50 GMT""}]","2015-05-28"
"1107.2066","Igor Rubinskiy","Igor Rubinskiy","Hadronic Final States and Diffraction at HERA","Moriond QCD 2011 proceeding paper, 5 pages, 6 figures",,,,"hep-ex","http://arxiv.org/licenses/nonexclusive-distrib/1.0/","  Recent results from the ep (electron-proton) collider HERA are presented. Jet
production and diffraction type reactions allow tests of predictions of Quantum
Chromodynamics (QCD). Jet measurements are used to improve the combined H1-ZEUS
parton density fits by adding an additional constraint on the gluon
distribution in the proton and, at the same time, providing information on
strong coupling constant. Measurements of inclusive diffraction and diffractive
dijet data are discussed in the context of factorisation in diffraction.
Diffractive Upsilon(1S) production was studied to extract the t-slope of the
process, which was found to be consistent with the other exclusive vector meson
data and can be interpreted in terms of the gluonic radius of the proton.
","[{""version"":""v1"",""created"":""Mon, 11 Jul 2011 16:08:25 GMT""}]","2011-07-12"
"1107.2067","Izaskun Jimenez-Serra","I. Jimenez-Serra (1), J. Martin-Pintado (2), J.M. Winters (3), A.
  Rodriguez-Franco (2), and P. Caselli (4) ((1) Harvard-Smithsonian CfA, USA,
  (2) Centro de Astrobiologia (INTA-CSIC), Spain, (3) IRAM, France, (4)
  University of Leeds, UK)","Variability of the SiO thermal line emission toward the young L1448-mm
  outflow","10 pages, 6 figures, 2 tables, accepted for publication in
  Astrophysical Journal",,"10.1088/0004-637X/739/2/80",,"astro-ph.SR astro-ph.GA","http://arxiv.org/licenses/nonexclusive-distrib/1.0/","  The detection of narrow SiO thermal emission toward young outflows has been
proposed to be a signature of the magnetic precursor of C-shocks. Recent
modeling of the SiO emission across C-shocks predicts variations in the SiO
line intensity and line shape at the precursor and intermediate-velocity
regimes in only few years. We present high-angular resolution (3.8""x3.3"")
images of the thermal SiO J=2-1 emission toward the L1448-mm outflow in two
epochs (November 2004-February 2005, March-April 2009). Several SiO
condensations have appeared at intermediate velocities (20-50 km/s) toward the
red-shifted lobe of the outflow since 2005. Toward one of the condensations
(clump D), systematic differences of the dirty beams between 2005 and 2009
could be responsible for the SiO variability. At higher velocities (50-80
km/s), SiO could also have experienced changes in its intensity. We propose
that the SiO variability toward L1448-mm is due to a real SiO enhancement by
young C-shocks at the internal working surface between the jet and the ambient
gas. For the precursor regime (5.2-9.2 km/s), several narrow and faint SiO
components are detected. Narrow SiO tends to be compact, transient and shows
elongated (bow-shock) morphologies perpendicular to the jet. We speculate that
these features are associated with the precursor of C-shocks appearing at the
interface of the new SiO components seen at intermediate velocities.
","[{""version"":""v1"",""created"":""Mon, 11 Jul 2011 16:13:52 GMT""}]","2015-05-28"
"1107.2068","Jorge Casanova","J. Casanova, C. E. Lopez, J. J. Garcia-Ripoll, C. F. Roos, E. Solano","Quantum tomography in position and momentum space","5 pages, 2 figures. To be published in EPJD","Eur. Phys. J. D. 66, 222 (2012)","10.1140/epjd/e2012-30016-6",,"quant-ph cond-mat.mes-hall cond-mat.supr-con","http://arxiv.org/licenses/nonexclusive-distrib/1.0/","  We introduce a method of quantum tomography for a continuous variable system
in position and momentum space. We consider a single two-level probe
interacting with a quantum harmonic oscillator by means of a class of
Hamiltonians, linear in position and momentum variables, during a tunable time
span. We study two cases: the reconstruction of the wavefunctions of pure
states and the direct measurement of the density matrix of mixed states. We
show that our method can be applied to several physical systems where high
quantum control can be experimentally achieved.
","[{""version"":""v1"",""created"":""Mon, 11 Jul 2011 16:20:50 GMT""},{""version"":""v2"",""created"":""Wed, 23 May 2012 15:00:59 GMT""}]","2015-03-19"
"1107.2069","Mohammad Reza Shaebani","M. Reza Shaebani, Mahyar Madadi, Stefan Luding, Dietrich E. Wolf","Influence of polydispersity on micromechanics of granular materials","13 pages, 13 figures, 2 tables","Phys. Rev. E 85, 011301 (2012)","10.1103/PhysRevE.85.011301",,"cond-mat.soft cond-mat.stat-mech","http://arxiv.org/licenses/nonexclusive-distrib/1.0/","  We study the effect of polydispersity on the macroscopic physical properties
of granular packings in two and three dimensions. A mean-field approach is
developed to approximate the macroscale quantities as functions of the
microscopic ones. We show that the trace of the fabric and stress tensors are
proportional to the mean packing properties (e.g. packing fraction, average
coordination number, and average normal force) and dimensionless correction
factors, which depend only on the moments of the particle-size distribution.
Similar results are obtained for the elements of the stiffness tensor of
isotropic packings in the linear affine response regime. Our theoretical
predictions are in good agreement with the simulation results.
","[{""version"":""v1"",""created"":""Mon, 11 Jul 2011 16:23:35 GMT""},{""version"":""v2"",""created"":""Fri, 10 Feb 2012 14:42:12 GMT""}]","2013-12-04"
"1107.2070","Leanne Duffy","Leanne D. Duffy, Kip A. Bishofberger, Bruce C. Carlsten, Alex Dragt,
  Quinn R. Marksteiner, Steven J. Russell, Robert D. Ryne, Nikolai A. Yampolsky","Exploring Minimal Scenarios to Produce Transversely Bright Electron
  Beams Using the Eigen-Emittance Concept","7 pages, 2 figures, to appear in NIM A",,"10.1016/j.nima.2011.06.096","LA-UR-11-10664","physics.acc-ph","http://arxiv.org/licenses/nonexclusive-distrib/1.0/","  Next generation hard X-ray free electron lasers require electron beams with
low transverse emittance. One proposal to achieve these low emittances is to
exploit the eigen-emittance values of the beam. The eigen-emittances are
invariant under linear beam transport and equivalent to the emittances in an
uncorrelated beam. If a correlated beam with two small eigen-emittances can be
produced, removal of the correlations via appropriate optics will lead to two
small emittance values, provided non-linear effects are not too large. We study
how such a beam may be produced using minimal linear correlations. We find it
is theoretically possible to produce such a beam, however it may be more
difficult to realize in practice. We identify linear correlations that may lead
to physically realizable emittance schemes and discuss promising future
avenues.
","[{""version"":""v1"",""created"":""Mon, 11 Jul 2011 16:30:30 GMT""}]","2011-07-12"
"1107.2071","Michael Sitko","Michael L. Sitko, Carey M. Lisse, Michael S. Kelley, Elisha F.
  Polomski, David K. Lynch, Ray W. Russell, Robin L. Kimes, Barbara A. Whitney,
  Michael J. Wolff, David E. Harker","Infrared Spectroscopy of Comet 73P/Schwassmann-Wachmann 3 using the
  Spitzer Space Telescope","70 pages, 21 figures, accepted for publication in AJ",,"10.1088/0004-6256/142/3/80",,"astro-ph.EP","http://arxiv.org/licenses/nonexclusive-distrib/1.0/","  We have used the Spitzer Space Telescope Infrared Spectrograph (IRS) to
observe the 5-37 micron thermal emission of comet 73P/Schwassmann-Wachmann 3
(SW3), components B and C. We obtained low spectral resolution (R ~ 100) data
over the entire wavelength interval, along with images at 16 and 22 micron.
These observations provided an unprecedented opportunity to study nearly
pristine material from the surface and what was until recently the interior of
an ecliptic comet - cometary surface having experienced only two prior
perihelion passages, and including material that was totally fresh. The spectra
were modeled using a variety of mineral types including both amorphous and
crystalline components. We find that the degree of silicate crystallinity, ~
35%, is somewhat lower than most other comets with strong emission features,
while its abundance of amorphous carbon is higher. Both suggest that SW3 is
among the most chemically primitive solar system objects yet studied in detail,
and that it formed earlier or farther from the sun than the bulk of the comets
studied so far. The similar dust compositions of the two fragments suggests
that these are not mineralogically heterogeneous, but rather uniform throughout
their volumes. Atomic abundances derived from the spectral models indicates a
depletion of O compared to solar photospheric values, despite the inclusion of
water ice and gas in the models. Atomic C may be solar or slightly sub-solar,
but its abundance is complicated by the potential contribution of spectrally
featureless mineral species to the portion of the spectra most sensitive to the
derication of the C abundance. We find a relatively high bolometric albedo, ~
0.13 for the dust, considering the large amount of dark carbonaceous material,
but consistent with the presence of abundant small particles and strong
emission features.
","[{""version"":""v1"",""created"":""Mon, 11 Jul 2011 16:35:06 GMT""}]","2015-05-28"
"1107.2072","Xiangjun Xing","Xiangjun Xing (a)(c), Zhenli Xu (b)(c), Hongru Ma (a) ((a) Department
  of Physics, Shanghai Jiao Tong University, Shanghai, China (b) Department of
  Mathematics, Shanghai Jiao Tong University, Shanghai, China (c) Institute of
  Natural Sciences, Shanghai Jiao Tong University, Shanghai, China)","From Over-charging to Like-charge Attraction in the Weak Coupling Regime","5 pages, 3 eps figures",,,,"cond-mat.soft cond-mat.stat-mech","http://arxiv.org/licenses/nonexclusive-distrib/1.0/","  Despite decades of intensive studies, the effective interactions between
strongly charged colloids still remain elusive. Here we show that a strongly
charged surface with a layer of condensed counter- ions behaves effectively as
a conductor, due to the mobile nature of the condensed ions. An external source
charge in its vicinity is therefore attracted towards the surface, due to the
image charge effect. This mechanism leads to correlational energies for
counter-ions condensed on two distinct surfaces, as well as for free ions in
the bulk. Generalizing Debye-Huckel theory and image charge methods, we
analytically calculate these correlation energies for the two-plates problem,
at the iso-electric point, where condensed counterions precisely balance the
bare surface charges. At this point, the effective interaction between two
plates is always attractive at small separation and repulsive at large
separation.
","[{""version"":""v1"",""created"":""Mon, 11 Jul 2011 16:37:26 GMT""}]","2011-07-12"
"1107.2073","John J. Rehr","Towfiq Ahmed, J. J. Kas, and J. J. Rehr","GW+U real-space Green's function calculations of x-ray spectra",,,,,"cond-mat.str-el","http://arxiv.org/licenses/nonexclusive-distrib/1.0/","  The Hubbard model is implemented in real-space Green's function calculations
of x-ray spectra using an effective self-energy adapted from the LSDA+U method
of Anisimov et al. This self-energy consists of an energy-dependent many-pole
approximation to the GW self-energy with an additive correction due to on-site
Coulomb repulsion among the partially filled localized-electron states. This
leads to a GW+U approach which provides an efficient procedure to account for
local correlation effects on x-ray spectra. Results are presented for the spin
and angular momentum projected density of states of MnO, NiO, and
La_(2-x)Sr_xCuO_4 (LSCO), for the K-edge x-ray spectra of O atoms in MnO and
NiO, and the unoccupied electronic states and O K-edge spectra of undoped LSCO.
The method is found to yield reasonable agreement with experiment.
","[{""version"":""v1"",""created"":""Mon, 11 Jul 2011 16:38:56 GMT""}]","2011-07-12"
"1107.2074","Sherri Honza","Jie Kong, Truell Hyde, Lorin Matthews, Ke Qiao, Zhuanhao Zhang, Angela
  Douglass","One-dimensional vertical dust strings in a glass box",,,"10.1103/PhysRevE.84.016411","CASPER-11-06","physics.plasm-ph","http://arxiv.org/licenses/nonexclusive-distrib/1.0/","  The oscillation spectrum of a one-dimensional vertical dust string formed
inside a glass box on top of the lower electrode in a GEC reference cell was
studied. A mechanism for creating a single vertical dust string is described.
It is shown that the oscillation amplitudes, resonance frequencies, damping
coefficients, and oscillation phases of the dust particles separate into two
distinct groups. One group exhibits low damping coefficients, increasing
amplitudes and decreasing resonance frequencies for dust particles closer to
the lower electrode. The other group shows high damping coefficients but
anomalous resonance frequencies and amplitudes. At low oscillation frequencies,
the two groups are also separated by a {\pi}-phase difference. One possible
cause for the difference in behavior between the two groups is discussed.
","[{""version"":""v1"",""created"":""Mon, 11 Jul 2011 16:44:20 GMT""}]","2015-05-28"
"1107.2075","Ruud Visser","Ruud Visser (1 and 2), Ewine F. van Dishoeck (2 and 3), Steven D. Doty
  (4) ((1) Univ. of Michigan, (2) Leiden Observatory, (3) MPE Garching, (4)
  Denison Univ.)","Chemical history of molecules in circumstellar disks","10 pages, 5 figures, to appear in the proceedings of IAU Symposium
  280: ""The Molecular Universe""",,"10.1017/S1743921311024938",,"astro-ph.GA","http://arxiv.org/licenses/nonexclusive-distrib/1.0/","  The chemical composition of a protoplanetary disk is determined not only by
in situ chemical processes during the disk phase, but also by the history of
the gas and dust before it accreted from the natal envelope. In order to
understand the disk's chemical composition at the time of planet formation,
especially in the midplane, one has to go back in time and retrace the
chemistry to the molecular cloud that collapsed to form the disk and the
central star. Here we present a new astrochemical model that aims to do just
that. The model follows the core collapse and disk formation in two dimensions,
which turns out to be a critical upgrade over older collapse models. We predict
chemical stratification in the disk due to different physical conditions
encountered along different streamlines. We argue that the disk-envelope
accretion shock does not play a significant role for the material in the disk
at the end of the collapse phase. Finally, our model suggests that complex
organic species are formed on the grain surfaces at temperatures of 20 to 40 K,
rather than in the gas phase in the T>100 K hot corino.
","[{""version"":""v1"",""created"":""Mon, 11 Jul 2011 16:52:15 GMT""}]","2015-05-28"
"1107.2076","Xiang-dong Hou","Xiang-dong Hou","Finite Modules over $\Bbb Z[t,t^{-1}]$","24 pages",,,,"math.RA math.AT","http://arxiv.org/licenses/nonexclusive-distrib/1.0/","  Let $\Lambda=\Bbb Z[t,t^{-1}]$ be the ring of Laurent polynomials over $\Bbb
Z$. We classify all $\Lambda$-modules $M$ with $|M|=p^n$, where $p$ is a primes
and $n\le 4$. Consequently, we have a classification of Alexander quandles of
order $p^n$ for $n\le 4$.
","[{""version"":""v1"",""created"":""Mon, 11 Jul 2011 17:24:44 GMT""}]","2011-07-12"
"1107.2077","Alberto Saa","Carlos J. A. Pires, Alberto Saa, and Roberto Venegeroles","Lyapunov statistics and mixing rates for intermittent systems","7 pages, 5 figures, to appear in PRE","Phys. Rev. E84, 066210 (2011)","10.1103/PhysRevE.84.066210",,"cond-mat.stat-mech","http://arxiv.org/licenses/nonexclusive-distrib/1.0/","  We consider here a recent conjecture stating that correlation functions and
tail probabilities of finite time Lyapunov exponents would have the same power
law decay in weakly chaotic systems. We demonstrate that this conjecture fails
for a generic class of maps of the Pomeau-Manneville type. We show further
that, typically, the decay properties of such tail probabilities do not provide
significant information on key aspects of weakly chaotic dynamics such as
ergodicity and instability regimes. Our approaches are firmly based on rigorous
results, particularly the Aaronson-Darling-Kac theorem, and are also confirmed
by exhaustive numerical simulations.
","[{""version"":""v1"",""created"":""Mon, 11 Jul 2011 17:41:11 GMT""},{""version"":""v2"",""created"":""Wed, 14 Dec 2011 15:03:59 GMT""}]","2012-01-12"
"1107.2078","Stefan Filipp","S. Filipp, A. F. van Loo, M. Baur, L. Steffen, A. Wallraff","Preparation of Subradiant States using Local Qubit Control in Circuit
  QED","5 pages, 4 figures","Phys. Rev A. 84, 061805(R) (2011)","10.1103/PhysRevA.84.061805",,"quant-ph cond-mat.mes-hall","http://arxiv.org/licenses/nonexclusive-distrib/1.0/","  Transitions between quantum states by photon absorption or emission are
intimately related to symmetries of the system which lead to selection rules
and the formation of dark states. In a circuit quantum electrodynamics setup,
in which two resonant superconducting qubits are coupled through an on-chip
cavity and driven via the common cavity field, one single-excitation state
remains dark. Here, we demonstrate that this dark state can be excited using
local phase control of individual qubit drives to change the symmetry of the
driving field. We observe that the dark state decay via spontaneous emission
into the cavity is suppressed, a characteristic signature of subradiance. This
local control technique could be used to prepare and study highly correlated
quantum states of cavity-coupled qubits.
","[{""version"":""v1"",""created"":""Mon, 11 Jul 2011 17:46:26 GMT""}]","2012-01-17"
"1107.2079","Masatoshi Sato","Kenta Esaki, Masatoshi Sato, Kazuki Hasebe, Mahito Kohmoto","Edge states and topological phases in non-Hermitian systems","29 pages, 19 figures, typos fixed","Phys. Rev. B 84, 205128 (2011)","10.1103/PhysRevB.84.205128",,"cond-mat.mes-hall cond-mat.other math-ph math.MP quant-ph","http://arxiv.org/licenses/nonexclusive-distrib/1.0/","  Topological stability of the edge states is investigated for non-Hermitian
systems. We examine two classes of non-Hermitian Hamiltonians supporting real
bulk eigenenergies in weak non-Hermiticity: SU(1,1) and SO(3,2) Hamiltonians.
As an SU(1,1) Hamiltonian, the tight-binding model on the honeycomb lattice
with imaginary on-site potentials is examined. Edge states with ReE=0 and their
topological stability are discussed by the winding number and the index
theorem, based on the pseudo-anti-Hermiticity of the system. As a higher
symmetric generalization of SU(1,1) Hamiltonians, we also consider SO(3,2)
models. We investigate non-Hermitian generalization of the Luttinger
Hamiltonian on the square lattice, and that of the Kane-Mele model on the
honeycomb lattice, respectively. Using the generalized Kramers theorem for the
time-reversal operator Theta with Theta^2=+1 [M. Sato et al., arXiv:1106.1806],
we introduce a time-reversal invariant Chern number from which topological
stability of gapless edge modes is argued.
","[{""version"":""v1"",""created"":""Mon, 11 Jul 2011 17:47:55 GMT""},{""version"":""v2"",""created"":""Wed, 20 Jul 2011 07:21:23 GMT""}]","2012-01-04"
"1107.2080","Martin Schuele","Martin Schuele, Ruedi Stoop","A Full Computation-relevant Topological Dynamics Classification of
  Elementary Cellular Automata",,"Chaos 22, 043143 (2012)","10.1063/1.4771662",,"nlin.CG","http://arxiv.org/licenses/nonexclusive-distrib/1.0/","  Cellular automata are both computational and dynamical systems. We give a
complete classification of the dynamic behaviour of elementary cellular
automata (ECA) in terms of fundamental dynamic system notions such as
sensitivity and chaoticity. The ""complex"" ECA emerge to be sensitive, but not
chaotic and not eventually weakly periodic. Based on this classification, we
conjecture that elementary cellular automata capable of carrying out complex
computations, such as needed for Turing-universality, are at the ""edge of
chaos"".
","[{""version"":""v1"",""created"":""Mon, 11 Jul 2011 17:57:34 GMT""},{""version"":""v2"",""created"":""Tue, 19 Jul 2011 17:40:25 GMT""},{""version"":""v3"",""created"":""Sun, 4 Sep 2011 06:37:05 GMT""},{""version"":""v4"",""created"":""Fri, 21 Oct 2011 09:10:29 GMT""},{""version"":""v5"",""created"":""Wed, 18 Jan 2012 20:39:50 GMT""},{""version"":""v6"",""created"":""Thu, 12 Apr 2012 08:35:27 GMT""},{""version"":""v7"",""created"":""Fri, 22 Jun 2012 15:28:46 GMT""},{""version"":""v8"",""created"":""Wed, 20 Feb 2013 17:23:07 GMT""}]","2013-02-21"
"1107.2081","Todd Hunter","Todd R. Hunter, Frederic R. Schwab, Steven D. White, John M. Ford,
  Frank D. Ghigo, Ronald J. Maddalena, Brian S. Mason, Jack D. Nelson, Richard
  M. Prestage, Jason Ray, Paul Ries, Robert Simon, Sivasankaran Srikanth, Peter
  Whiteis","Holographic Measurement and Improvement of the Green Bank Telescope
  Surface","Accepted for publication in PASP. Contains 28 pages with 2 tables and
  9 figures (several at reduced quality). The full resolution version is
  available at http://wwwlocal.gb.nrao.edu/ptcs/papers/Hunter2011/gbtholo.ps.gz
  (34MB gzip file unpacks to 134MB postscript)","Publications of the Astronomical Society of the Pacific, Volume
  123, issue 907, pp.1087-1099, September 2011","10.1086/661950",,"astro-ph.IM","http://arxiv.org/licenses/nonexclusive-distrib/1.0/","  We describe the successful design, implementation, and operation of a 12 GHz
holography system installed on the Robert C. Byrd Green Bank Telescope (GBT).
We have used a geostationary satellite beacon to construct high-resolution
holographic images of the telescope mirror surface irregularities. These images
have allowed us to infer and apply improved position offsets for the 2209
actuators which control the active surface of the primary mirror, thereby
achieving a dramatic reduction in the total surface error (from 390 microns to
~240 microns, rms). We have also performed manual adjustments of the corner
offsets for a few panels. The expected improvement in the radiometric aperture
efficiency has been rigorously modeled and confirmed at 43 GHz and 90 GHz. The
improvement in the telescope beam pattern has also been measured at 11.7 GHz
with greater than 60 dB of dynamic range. Symmetric features in the beam
pattern have emerged which are consistent with a repetitive pattern in the
aperture due to systematic panel distortions. By computing average images for
each tier of panels from the holography images, we confirm that the magnitude
and direction of the panel distortions, in response to the combination of
gravity and thermal gradients, are in general agreement with finite-element
model predictions. The holography system is now fully integrated into the GBT
control system, and by enabling the telescope staff to monitor the health of
the individual actuators, it continues to be an essential tool to support
high-frequency observations.
","[{""version"":""v1"",""created"":""Mon, 11 Jul 2011 18:09:56 GMT""}]","2015-03-30"
"1107.2082","Kenji Iohara","Kenji Iohara and Olivier Mathieu","Classification of Simple Lie Algebras on a Lattice",,,"10.1112/plms/pds042",,"math.RT math-ph math.MP","http://arxiv.org/licenses/nonexclusive-distrib/1.0/","  Let $\Lambda$ be a lattice of rank $n$. A Lie algebra on the lattice
$\Lambda$ is a Lie algebra ${\cal L}=\oplus_{\lambda\in\Lambda}\,{\cal
L}_{\lambda}$ such that $\dim\,{\cal L}_\lambda=1$ for all $\lambda$. In this
article, we classify all simple graded Lie algebras on a lattice.
","[{""version"":""v1"",""created"":""Mon, 11 Jul 2011 18:22:19 GMT""},{""version"":""v2"",""created"":""Tue, 3 Apr 2012 14:11:32 GMT""}]","2014-02-26"
