"1107.4733","Richard Woodard","S. P. Miao (Utrecht University), N. C. Tsamis (University of Crete)
  and R. P. Woodard (University of Florida)","Gauging away Physics","20 pages, no figures, uses LaTeX2e","Class.Quant.Grav.28:245013,2011","10.1088/0264-9381/28/24/245013","UFIFT-QG-11-06","gr-qc astro-ph.CO hep-th","http://arxiv.org/licenses/nonexclusive-distrib/1.0/","  We consider the recent argument by Higuchi, Marolf and Morrison [1] that a
nonlocal gauge transformation can be used to eliminate the infrared divergence
of the graviton propagator, when evaluated in Bunch-Davies vacuum on the open
coordinate submanifold of de Sitter space in transverse-traceless-synchronous
gauge. Because the transformation is not local, the equal time commutator of
undifferentiated fields no longer vanishes. From explicit examination of the
Wightman function we demonstrate that the transformation adds anti-sources in
the far future which cancel the bad infrared behavior but also change the
propagator equation. The same problem exists in the localized version of the
recent argument. Adding such anti-sources does not seem to be legitimate and
could be used to eliminate the infrared divergence of the massless, minimally
coupled scalar. The addition of such anti-sources in flat space QED could be
effected by an almost identical gauge transformation, and would seem to
eliminate the well known infrared divergences which occur in loop corrections
to exclusive amplitudes.
","[{""version"":""v1"",""created"":""Sun, 24 Jul 2011 08:18:46 GMT""}]","2011-12-30"
"1107.4734","Hssini Mohamed Mr.","Mohamed Hssini and Azzeddine Lazrek","Design of Arabic Diacritical Marks","10 pages, 24 figures; ISSN (Online): 1694-0814 http://www.IJCSI.org","IJCSI International Journal of Computer Science Issues, Vol. 8,
  Issue 3, May 2011",,,"cs.CL","http://arxiv.org/licenses/nonexclusive-distrib/1.0/","  Diacritical marks play a crucial role in meeting the criteria of usability of
typographic text, such as: homogeneity, clarity and legibility. To change the
diacritic of a letter in a word could completely change its semantic. The
situation is very complicated with multilingual text. Indeed, the problem of
design becomes more difficult by the presence of diacritics that come from
various scripts; they are used for different purposes, and are controlled by
various typographic rules. It is quite challenging to adapt rules from one
script to another. This paper aims to study the placement and sizing of
diacritical marks in Arabic script, with a comparison with the Latin's case.
The Arabic script is cursive and runs from right-to-left; its criteria and
rules are quite distinct from those of the Latin script. In the beginning, we
compare the difficulty of processing diacritics in both scripts. After, we will
study the limits of Latin resolution strategies when applied to Arabic. At the
end, we propose an approach to resolve the problem for positioning and resizing
diacritics. This strategy includes creating an Arabic font, designed in
OpenType format, along with suitable justification in TEX.
","[{""version"":""v1"",""created"":""Sun, 24 Jul 2011 08:35:12 GMT""}]","2011-07-26"
"1107.4735","Marco Barbieri","Holger F. Hofmann, Michael E. Goggin, Marcelo P. Almeida, and Marco
  Barbieri","Estimation of a quantum interaction parameter using weak measurements:
  Theory and experiment","Replace with the published version. Comments still welcome","Phys. Rev. A 86, 040102(R) (2012)","10.1103/PhysRevA.86.040102",,"quant-ph","http://arxiv.org/licenses/nonexclusive-distrib/1.0/","  We investigate the estimation of a small interaction parameter from the
outcomes of weak quantum measurements implemented by the interaction. The
relation of weak values and sensitivity is explained and the different
contributions of postselected results are identified using experimental data.
The results show how weak values can be used to control the distribution of
input state sensitivity between different postselected outcomes.
","[{""version"":""v1"",""created"":""Sun, 24 Jul 2011 08:52:05 GMT""},{""version"":""v2"",""created"":""Mon, 22 Oct 2012 15:51:57 GMT""}]","2012-10-23"
"1107.4736","Henry WJ Reeve","Henry WJ Reeve","Shrinking Targets for Countable Markov Maps","25 pages",,,,"math.DS","http://arxiv.org/licenses/nonexclusive-distrib/1.0/","  Let $T$ be an expanding Markov map with a countable number of inverse
branches and a repeller $\Lambda$ contained within the unit interval. Given
$\alpha \in \R_+$ we consider the set of points $x \in \Lambda$ for which
$T^n(x)$ hits a shrinking ball of radius $e^{-n\alpha}$ around $y$ for
infinitely many iterates $n$. Let $s(\alpha)$ denote the infimal value of $s$
for which the pressure of the potential $-s\log|T'|$ is below $s \alpha$.
Building on previous work of Hill, Velani and Urba\'{n}ski we show that for all
points $y$ contained within the limit set of the associated iterated function
system the Hausdorff dimension of the shrinking target set is given by
$s(\alpha)$. Moreover, when $\bar{\Lambda}=[0,1]$ the same holds true for all
$y \in [0,1]$. However, given $\beta \in (0,1)$ we provide an example of an
expanding Markov map $T$ with a repeller $\Lambda$ of Hausdorff dimension
$\beta$ with a point $y\in \bar{\Lambda}$ such that for all $\alpha \in \R_+$
the dimension of the shrinking target set is zero.
","[{""version"":""v1"",""created"":""Sun, 24 Jul 2011 08:52:07 GMT""},{""version"":""v2"",""created"":""Mon, 12 Sep 2011 22:05:33 GMT""}]","2011-09-14"
"1107.4737","Sergei Nedelko","Bogdan V. Galilo, Sergei N. Nedelko","Impact of the strong electromagnetic field on the QCD effective
  potential for homogeneous Abelian gluon field configurations","9 pages, 4 figures",,"10.1103/PhysRevD.84.094017",,"hep-ph","http://arxiv.org/licenses/nonexclusive-distrib/1.0/","  The one-loop quark contribution to the QCD effective potential for the
homogeneous Abelian gluon field in the presence of external strong
electromagnetic field is evaluated. The structure of extrema of the potential
as a function of the angles between chromoelectric, chromomagnetic and
electromagnetic fields is analyzed. In this setup, the electromagnetic field is
considered as an external one while the gluon field represents domain
structured nonperturbative gluon configurations related to the QCD vacuum in
the confinement phase. Two particularly interesting gluon configurations,
(anti-)self-dual and crossed orthogonal chromomagnetic and chromoelectric
fields, are discussed specifically. Within this simplified framework it is
shown that the strong electromagnetic fields can play a catalysing role for a
deconfinement transition. At the qualitative level, the present consideration
can be seen as a highly simplified study of an impact of the electromagnetic
fields generated in relativistic heavy ion collisions on the strongly
interacting hadronic matter.
","[{""version"":""v1"",""created"":""Sun, 24 Jul 2011 09:09:49 GMT""}]","2015-05-28"
"1107.4738","Vladimir Falko","Nathan Davies, Aavishkar A. Patel, Alberto Cortijo, Vadim Cheianov,
  Francisco Guinea, Vladimir I. Fal'ko","Skipping and snake orbits of electrons: singularities and catastrophes","4 pages, 3 figures",,"10.1103/PhysRevB.85.155433",,"cond-mat.mes-hall","http://arxiv.org/licenses/nonexclusive-distrib/1.0/","  Near the sample edge, or a sharp magnetic field step the drift of
two-dimensional electrons in a magnetic field has the form of skipping/snake
orbits. We show that families of skipping/snake orbits of electrons injected at
one point inside a 2D metal generically exhibit caustics folds, cusps and cusp
triplets, and, in one extreme case, a section of the batterfly bifurcation.
Periodic appearance of singularities along the $\pm B$-interface leads to the
magneto-oscillations of nonlocal conductance in multi-terminal electronic
devices.
","[{""version"":""v1"",""created"":""Sun, 24 Jul 2011 09:14:58 GMT""}]","2015-05-28"
"1107.4739","Stefano Orani","David Mulryne, Stefano Orani, Arttu Rajantie","Non-Gaussianity from the hybrid potential","9 pages, 7 figures",,"10.1103/PhysRevD.84.123527","Imperial/TP/2011/SO/1","hep-th astro-ph.CO gr-qc","http://arxiv.org/licenses/nonexclusive-distrib/1.0/","  We study the hybrid inflationary potential in a regime where the defect field
is light, and more than 60 e-folds of accelerated expansion occur after the
symmetry breaking transition. Using analytic and numerical techniques, we then
identify parameter values within this regime for which the statistics of the
primordial curvature perturbation are significantly non-Gaussian. Focusing on
this range of parameters, we provide a specific example which leads to an
observationally consistent power spectrum, and a level of non-Gaussianity
within current WMAP bounds and in reach of the Planck satellite. An interesting
feature of this example is that the initial conditions at horizon crossing
appear quite natural.
","[{""version"":""v1"",""created"":""Sun, 24 Jul 2011 09:15:22 GMT""}]","2013-05-29"
"1107.4740","Chunbin Yang","C. B. Yang and X. Wang","Baryon production and net-proton distributions in relativistic heavy ion
  collisions","5 pages in RevTex, 8 eps figures, to be appeared in PRC",,"10.1103/PhysRevC.84.064908",,"nucl-th nucl-ex","http://creativecommons.org/licenses/by/3.0/","  The higher order moments of the net-baryon distributions in relativistic
heavy ion collisions are useful probes for the QCD critical point and
fluctuations. We study the net-proton distributions and their moments in a
simple model which considers the baryon stopping and pair production effects in
the processes. It is shown that a single emission source model can explain the
experimental data well. Centrality and energy dependence of the distributions
and higher moments is discussed.
","[{""version"":""v1"",""created"":""Sun, 24 Jul 2011 09:32:32 GMT""},{""version"":""v2"",""created"":""Mon, 28 Nov 2011 06:29:42 GMT""}]","2013-05-29"
"1107.4741","Alessandro Giuliani","Alessandro Giuliani, Vieri Mastropietro, Marcello Porta","Lattice quantum electrodynamics for graphene","44 pages, 6 figures","Annals of Phys. 327, 461-511 (2012)","10.1016/j.aop.2011.10.007",,"cond-mat.str-el cond-mat.stat-mech math-ph math.MP","http://arxiv.org/licenses/nonexclusive-distrib/1.0/","  The effects of gauge interactions in graphene have been analyzed up to now in
terms of effective models of Dirac fermions. However, in several cases lattice
effects play an important role and need to be taken consistently into account.
In this paper we introduce and analyze a lattice gauge theory model for
graphene, which describes tight binding electrons hopping on the honeycomb
lattice and interacting with a three-dimensional quantum U(1) gauge field. We
perform an exact Renormalization Group analysis, which leads to a renormalized
expansion that is finite at all orders. The flow of the effective parameters is
controlled thanks to Ward Identities and a careful analysis of the discrete
lattice symmetry properties of the model. We show that the Fermi velocity
increases up to the speed of light and Lorentz invariance spontaneously emerges
in the infrared. The interaction produces critical exponents in the response
functions; this removes the degeneracy present in the non interacting case and
allow us to identify the dominant excitations. Finally we add mass terms to the
Hamiltonian and derive by a variational argument the correspondent gap
equations, which have an anomalous non-BCS form, due to the non trivial effects
of the interaction.
","[{""version"":""v1"",""created"":""Sun, 24 Jul 2011 09:54:10 GMT""}]","2012-09-19"
"1107.4742","Ananda Hota","Ananda Hota (1), S.K. Sirothia (2), Youichi Ohyama (1), C. Konar (1),
  Suk Kim (3), Soo-Chang Rey (3), D.J. Saikia (2), J.H. Croston (4), and Satoki
  Matsushita (1) ((1) ASIAA, Taiwan, (2) NCRA-TIFR, India, (3) DASS, CNU,
  Korea, (4) SPA, Univ. of Southampton, UK)","Discovery of a spiral-host episodic radio-galaxy","Accepted for publication in MNRAS Letters",,"10.1111/j.1745-3933.2011.01115.x",,"astro-ph.CO astro-ph.HE","http://arxiv.org/licenses/nonexclusive-distrib/1.0/","  We report the discovery of a unique radio galaxy at z=0.137, which could
possibly be the second spiral-host large radio galaxy and also the second
triple-double episodic radio galaxy. The host galaxy shows signs of recent star
formation in the UV but is optically red and is the brightest galaxy of a
possible cluster. The outer relic radio lobes of this galaxy, separated by ~1
Mpc, show evidence of spectral flattening and a high fraction of linear
polarisation. We interpret that these relic lobes have experienced
re-acceleration of particles and compression of the magnetic field due to
shocks in the cluster outskirts. From the morphology of the relics and galaxy
distribution, we argue that re-acceleration is unlikely to be due to a
cluster-cluster merger and suggest the possibility of accretion shocks. The
source was identified from SDSS, GALEX, NVSS and FIRST survey data but we also
present follow up optical observations with the Lulin telescope and 325 MHz low
frequency radio observations with the GMRT. We briefly discuss the scientific
potential of this example in understanding the evolution of galaxies and
clusters by accretion, mergers, star formation, and AGN feedback.
","[{""version"":""v1"",""created"":""Sun, 24 Jul 2011 10:22:47 GMT""}]","2015-05-28"
"1107.4743","Alexandre Zenchuk","A.I. Zenchuk","Unitary invariant discord as a measure of bipartite quantum correlations
  in an $N$-qubit quantum system","18 pages, 2 figures",,,,"quant-ph","http://arxiv.org/licenses/nonexclusive-distrib/1.0/","  We introduce a measure of quantum correlations in the $N$-qubit quantum
system which is invariant with respect to the $SU(2^N)$ group of
transformations of this system. This measure is a modification of the quantum
discord introduced earlier and is referred to as the unitary or
$SU(2^N)$-invariant discord. Since the evolution of a quantum system is
equivalent to the proper unitary transformation, the introduced measure is an
integral of motion and is completely defined by eigenvalues of the density
matrix. As far as the calculation of the unitary invariant discord is rather
complicated computational problem, we propose its modification which may be
found in a simpler way. The case N=2 is considered in details. In particular,
it is shown that the modified SU(4)-invariant discord reaches the maximum value
for a pure state.
  {A geometric measure of the unitary invariant discord of an $N$-qubit state
is introduced and a simple formula for this measure is derived, which allows
one to consider this measure as a witness of quantum correlations.} The
relation of the unitary invariant discord with the quantum state transfer along
the spin chain is considered. We also compare the modified SU(4)-invariant
discord with the geometric measure of SU(4)-invariant discord of the two-qubit
systems in the thermal equilibrium states governed by the different
Hamiltonians.
","[{""version"":""v1"",""created"":""Sun, 24 Jul 2011 11:08:17 GMT""},{""version"":""v2"",""created"":""Thu, 13 Oct 2011 06:27:43 GMT""},{""version"":""v3"",""created"":""Sat, 15 Oct 2011 06:00:39 GMT""}]","2011-10-18"
"1107.4744","Li Changzheng","Naichung Conan Leung, Changzheng Li","Classical aspects of quantum cohomology of generalized flag varieties","13 pages. To appear in International Mathematics Research Notices",,,,"math.AG math.CO","http://arxiv.org/licenses/nonexclusive-distrib/1.0/","  We show that various genus zero Gromov-Witten invariants for flag varieties
representing different homology classes are indeed the same. In particular,
many of them are classical intersection numbers of Schubert cycles.
","[{""version"":""v1"",""created"":""Sun, 24 Jul 2011 11:12:06 GMT""}]","2011-07-26"
"1107.4745","Valery V. Ryzhikov","V.V.Ryzhikov","Simple Spectrum for Tensor Products of Mixing Map Powers","7 pages",,,,"math.DS","http://arxiv.org/licenses/nonexclusive-distrib/1.0/","  We prove the existence of a mixing rank one map $T$ such that the product
$T\otimes T^2\otimes T^3\otimes...$ has simple spectrum. This result is used in
S.V. Thikhonov's proof of the existence of mixing transformation with
homogeneous spectrum of multiplicity $m>2$.
","[{""version"":""v1"",""created"":""Sun, 24 Jul 2011 11:17:04 GMT""}]","2011-07-26"
"1107.4746","Jerome Poulin","Jerome Poulin, Philip S. Light, Raman Kashyap and Andre N. Luiten","Optimized coupling of cold atoms into a fiber using a blue-detuned
  hollow-beam funnel","11 pages, 12 figures, 1 table",,"10.1103/PhysRevA.84.053812",,"physics.atom-ph physics.optics quant-ph","http://arxiv.org/licenses/nonexclusive-distrib/1.0/","  We theoretically investigate the process of coupling cold atoms into the core
of a hollow-core photonic-crystal optical fiber using a blue-detuned
Laguerre-Gaussian beam. In contrast to the use of a red-detuned Gaussian beam
to couple the atoms, the blue-detuned hollow-beam can confine cold atoms to the
darkest regions of the beam thereby minimizing shifts in the internal states
and making the guide highly robust to heating effects. This single optical beam
is used as both a funnel and guide to maximize the number of atoms into the
fiber. In the proposed experiment, Rb atoms are loaded into a magneto-optical
trap (MOT) above a vertically-oriented optical fiber. We observe a
gravito-optical trapping effect for atoms with high orbital momentum around the
trap axis, which prevents atoms from coupling to the fiber: these atoms lack
the kinetic energy to escape the potential and are thus trapped in the laser
funnel indefinitely. We find that by reducing the dipolar force to the point at
which the trapping effect just vanishes, it is possible to optimize the
coupling of atoms into the fiber. Our simulations predict that by using a
low-power (2.5 mW) and far-detuned (300 GHz) Laguerre-Gaussian beam with a
20-{\mu}m radius core hollow-fiber it is possible to couple 11% of the atoms
from a MOT 9 mm away from the fiber. When MOT is positioned further away,
coupling efficiencies over 50% can be achieved with larger core fibers.
","[{""version"":""v1"",""created"":""Sun, 24 Jul 2011 11:19:36 GMT""}]","2015-05-28"
"1107.4747","Fabrizio Riguzzi PhD","Fabrizio Riguzzi and Terrance Swift","The PITA System: Tabling and Answer Subsumption for Reasoning under
  Uncertainty",,"Theory and Practice of Logic Programming, 27th International
  Conference on Logic Programming (ICLP'11) Special Issue, 11(4-5), 433-449,
  2011","10.1017/S147106841100010X",,"cs.AI cs.LO cs.PL","http://arxiv.org/licenses/nonexclusive-distrib/1.0/","  Many real world domains require the representation of a measure of
uncertainty. The most common such representation is probability, and the
combination of probability with logic programs has given rise to the field of
Probabilistic Logic Programming (PLP), leading to languages such as the
Independent Choice Logic, Logic Programs with Annotated Disjunctions (LPADs),
Problog, PRISM and others. These languages share a similar distribution
semantics, and methods have been devised to translate programs between these
languages. The complexity of computing the probability of queries to these
general PLP programs is very high due to the need to combine the probabilities
of explanations that may not be exclusive. As one alternative, the PRISM system
reduces the complexity of query answering by restricting the form of programs
it can evaluate. As an entirely different alternative, Possibilistic Logic
Programs adopt a simpler metric of uncertainty than probability. Each of these
approaches -- general PLP, restricted PLP, and Possibilistic Logic Programming
-- can be useful in different domains depending on the form of uncertainty to
be represented, on the form of programs needed to model problems, and on the
scale of the problems to be solved. In this paper, we show how the PITA system,
which originally supported the general PLP language of LPADs, can also
efficiently support restricted PLP and Possibilistic Logic Programs. PITA
relies on tabling with answer subsumption and consists of a transformation
along with an API for library functions that interface with answer subsumption.
","[{""version"":""v1"",""created"":""Sun, 24 Jul 2011 11:22:41 GMT""}]","2011-07-26"
"1107.4748","Zeynep Gurel","Atilla G\""urel and Zeynep G\""urel","On the Lorentzian route to Relativity","20 pages",,,,"physics.hist-ph physics.ed-ph","http://arxiv.org/licenses/nonexclusive-distrib/1.0/","  We discuss pedagogical problems associated with the conventional approach in
teaching relativity and the potential value of ""Lorentzian route to relativity""
for addressing these pedagogical problems. We think that Lorentzian approach
may be valuable part of an introduction to relativity but the historical route
should be followed up to its end. It must namely include Einstein's application
of Occam's razor in reinterpreting Lorentz transformations kinematically and
the discussion of the central role of the evolution from Lorentz's ""local time""
to relativity of simultaneity. We discuss also what Occam's razor is not and
why it should not cut ""too deeply or too permanently"". Some misleading remarks
in relativity text books concerning for example Kennedy Thorndike experiment
and Trouton-Noble experiment indicate the not uncommon lack of awareness about
the degree observational equivalence between prerelativistic (Lorentzian) and
relativistic viewpoints as far as special relativistic experiments are
considered.
  Keywords: neo-Lorentzian interpretation relativity simultaneity didactic
teaching education Kennedy Thorndike Trouton Noble experiment
","[{""version"":""v1"",""created"":""Sun, 24 Jul 2011 11:44:13 GMT""}]","2011-07-26"
"1107.4749","Arnab Ganguly","Arnab Ganguly, Debasish Chatterjee, John Lygeros, Heinz Koeppl","Uniform moment bounds of multi-dimensional functions of discrete-time
  stochastic processes","26 pages",,,,"math.PR","http://arxiv.org/licenses/nonexclusive-distrib/1.0/","  We establish conditions for uniform $r$-th moment bound of certain
$\R^d$-valued functions of a discrete-time stochastic process taking values in
a general metric space. The conditions include an appropriate negative drift
together with a uniform $L_p$ bound on the jumps of the process for $p > r +
1$. Applications of the result are given in connection to iterated function
systems and biochemical reaction networks.
","[{""version"":""v1"",""created"":""Sun, 24 Jul 2011 11:59:35 GMT""}]","2011-07-26"
"1107.4750","Igor Aleiner","V.V. Cheianov, I.L. Aleiner, and V.I. Fal'ko","Tunable Strongly Correlated Band Insulator","4 pages, 4 figures","Phys. Rev. Lett. 109, 106801 (2012)","10.1103/PhysRevLett.109.106801",,"cond-mat.str-el cond-mat.mes-hall","http://arxiv.org/licenses/nonexclusive-distrib/1.0/","  We introduce the notion of the strongly correlated band insulator (SCI),
where the lowest energy excitations are collective modes (excitons) rather than
the single particles. We construct controllable 1/N expansion for SCI to
describe their observables properties. A remarkable example of the SCI is
bilayer graphene which is shown to be tunable between the SCI and usual weak
coupling regime.
","[{""version"":""v1"",""created"":""Sun, 24 Jul 2011 12:15:11 GMT""}]","2018-01-01"
"1107.4751","Benedikt Ahrens","Benedikt Ahrens (University of Nice Sophia-Antipolis)","Extended Initiality for Typed Abstract Syntax",,"Logical Methods in Computer Science, Volume 8, Issue 2 (April 6,
  2012) lmcs:1193","10.2168/LMCS-8(2:1)2012",,"cs.LO cs.PL","http://arxiv.org/licenses/nonexclusive-distrib/1.0/","  Initial Semantics aims at interpreting the syntax associated to a signature
as the initial object of some category of 'models', yielding induction and
recursion principles for abstract syntax. Zsid\'o proves an initiality result
for simply-typed syntax: given a signature S, the abstract syntax associated to
S constitutes the initial object in a category of models of S in monads.
However, the iteration principle her theorem provides only accounts for
translations between two languages over a fixed set of object types. We
generalize Zsid\'o's notion of model such that object types may vary, yielding
a larger category, while preserving initiality of the syntax therein. Thus we
obtain an extended initiality theorem for typed abstract syntax, in which
translations between terms over different types can be specified via the
associated category-theoretic iteration operator as an initial morphism. Our
definitions ensure that translations specified via initiality are type-safe,
i.e. compatible with the typing in the source and target language in the
obvious sense. Our main example is given via the propositions-as-types
paradigm: we specify propositions and inference rules of classical and
intuitionistic propositional logics through their respective typed signatures.
Afterwards we use the category--theoretic iteration operator to specify a
double negation translation from the former to the latter. A second example is
given by the signature of PCF. For this particular case, we formalize the
theorem in the proof assistant Coq. Afterwards we specify, via the
category-theoretic iteration operator, translations from PCF to the untyped
lambda calculus.
","[{""version"":""v1"",""created"":""Sun, 24 Jul 2011 12:32:49 GMT""},{""version"":""v2"",""created"":""Wed, 28 Mar 2012 15:38:05 GMT""},{""version"":""v3"",""created"":""Thu, 5 Apr 2012 07:04:45 GMT""}]","2015-07-01"
