"1107.4714","Peter Kazinski","P.O. Kazinski","Gravitational mass-shift effect in the Standard Model","29 pp., 4 figs; textual misprints corrected, references added","Phys. Rev. D 85, 044008 (2012)","10.1103/PhysRevD.85.044008",,"gr-qc hep-th","http://arxiv.org/licenses/nonexclusive-distrib/1.0/","  The gravitational mass-shift effect is investigated in the framework of the
standard model with the energy cutoff regularization both for stationary and
non-stationary backgrounds at the one-loop level. The problem concerning
singularity of the effective potential for the Higgs field on the horizon of a
black hole, which was reported earlier, is resolved. The equations
characterizing the properties of the vacuum state are derived and solved in a
certain approximation for the Schwarzschild black hole. The gravitational
mass-shift effect is completely described in this case. The masses of the
massive particles in the standard model are shown to depend on the value of the
Higgs boson mass in the flat spacetime. If the Higgs boson mass in the flat
spacetime is less than 263.6 GeV, then the mass of any massive particle
approaching a gravitating object grows. If the Higgs boson mass in the flat
spacetime is greater than or equal to 278.2 GeV, the masses of all the massive
particles decrease in a strong gravitational field. The Higgs boson masses
lying in between these two values prove to lead to instability, at least at the
one-loop level, and so they are excluded. It turns out that the vacuum
possesses the same properties as an ultrarelativistic fluid in a certain
approximation. The expression for the pressure, the entropy and enthalpy
densities of this fluid are obtained. The sound speed in this fluid is also
derived.
","[{""version"":""v1"",""created"":""Sat, 23 Jul 2011 22:14:22 GMT""},{""version"":""v2"",""created"":""Sat, 21 Jan 2012 14:48:38 GMT""}]","2012-02-21"
"1107.4715","Jacques Verstraete","Peter Keevash, Benny Sudakov, Jacques Verstraete","On a conjecture of Erdos and Simonovits: Even Cycles",,,"10.1112/S0025579311008205",,"math.CO","http://arxiv.org/licenses/nonexclusive-distrib/1.0/","  Let $\mc{F}$ be a family of graphs. A graph is {\em $\mc{F}$-free} if it
contains no copy of a graph in $\mc{F}$ as a subgraph. A cornerstone of
extremal graph theory is the study of the {\em Tur\'an number} $ex(n,\mc{F})$,
the maximum number of edges in an $\mc{F}$-free graph on $n$ vertices. Define
the {\em Zarankiewicz number} $z(n,\mc{F})$ to be the maximum number of edges
in an $\mc{F}$-free {\em bipartite} graph on $n$ vertices. Let $C_k$ denote a
cycle of length $k$, and let $\mc{C}_k$ denote the set of cycles $C_{\ell}$,
where $3 \le \ell \leq k$ and $\ell$ and $k$ have the same parity. Erd\H{o}s
and Simonovits conjectured that for any family $\mc{F}$ consisting of bipartite
graphs there exists an odd integer $k$ such that $ex(n,\mc{F} \cup \mc{C}_k)
\sim z(n,\mc{F})$. They proved this when $\mc{F}={C_4}$ by showing that
$ex(n,\{C_4,C_5\}) \sim z(n,C_4)$. In this paper, we extend this result by
showing that if $\ell \in \{2,3,5\}$ and $k > 2\ell$ is odd, then
${ex(n,\mc{C}_{2\ell} \cup {C_k}) \sim z(n,\mc{C}_{2\ell})$. Furthermore, if $k
> 2\ell + 2$ is odd, then for infinitely many $n$ we show that the extremal
$\mc{C}_{2\ell} \cup \{C_k\}$-free graphs are bipartite incidence graphs of
generalized polygons. We observe that this exact result does not hold for any
odd $k < 2\ell$, and furthermore the asymptotic result does not hold when
$(\ell,k)$ is $(3,3)$, $(5,3)$ or $(5,5)$. Our proofs make use of
pseudorandomness properties of nearly extremal graphs that are of independent
interest.
","[{""version"":""v1"",""created"":""Sat, 23 Jul 2011 22:42:15 GMT""}]","2014-01-14"
"1107.4716","George Yanev","M. Ahsanullah, V.B. Nevzorov and George P. Yanev","Characterizations of distributions via order statistics with random
  exponential shifts",,"Jornal of Applied Statistical Science, 2011 (18), 3:1-18",,,"math.PR math.ST stat.TH","http://arxiv.org/licenses/nonexclusive-distrib/1.0/","  A class of probability distributions is characterized via equalities in law
between two order statistics shifted by independent exponential variables. An
explicit formula for the quintile function of the identified family of
distributions is obtained. The results extend some known characterizations of
exponential and logistic distributions.
","[{""version"":""v1"",""created"":""Sat, 23 Jul 2011 22:51:52 GMT""}]","2011-07-26"
"1107.4717","Chad Giusti","Chad Giusti","Unstable Vassiliev Theory","13 pages, 4 figures",,,,"math.AT math.GT","http://arxiv.org/licenses/nonexclusive-distrib/1.0/","  We construct an inverse system of unstable Vassiliev spectral sequences on
the spaces of plumbers' knots, which model the homotopy type of the space of
long knots, and show that the limit of these sequences contains the finite type
invariants in their usual complexity. Utilizing the cell structure on the
discriminant of the spaces of plumbers curves, we extend the notion of
Vassiliev derivative to all singularity types of plumbers' curves.
","[{""version"":""v1"",""created"":""Sat, 23 Jul 2011 23:08:13 GMT""}]","2011-07-26"
"1107.4718","Patricia Cahn","Patricia Cahn","A Generalization of Turaev's Virtual String Cobracket","30 pages, 12 figures",,,,"math.GT","http://arxiv.org/licenses/nonexclusive-distrib/1.0/","  In a previous paper, we defined an operation $\mu$ that generalizes Turaev's
cobracket for loops on a surface. We showed that, in contrast to the cobracket,
this operation gives a formula for the minimum number of self-intersections of
a loop in a given free homotopy class. In this paper we consider the
corresponding question for virtual strings. We show that $\mu$ gives a bound on
the minimal self-intersection number of a virtual string which is stronger than
a bound given by Turaev's virtual string cobracket. We use Turaev's based
matrices to describe strings $\alpha$ such that $\mu$ gives a formula for the
minimal self-intersection number $\alpha$. We also construct an example that
shows the bound on the minimal self-intersection number given by $\mu$ is
sometimes stronger than the bound $\rho$ given by Turaev's based matrix
invariant.
","[{""version"":""v1"",""created"":""Sun, 24 Jul 2011 00:09:25 GMT""},{""version"":""v2"",""created"":""Fri, 9 May 2014 11:14:39 GMT""}]","2014-05-12"
"1107.4719","Liling Sun","Dachun Gu, Liling Sun, Qi Wu, Chao Zhang, Jing Guo, Peiwen Gao, Yue
  Wu, Xiaoli Dong, Xi Dai and Zhongxian Zhao","Correlation between superconductivity and antiferromagnetism in
  Rb0.8Fe2Se2-xTex single crystals","19 pages and 7 figures","Phys. Rev. B 85, 174523 (2012)",,,"cond-mat.supr-con","http://creativecommons.org/licenses/by/3.0/","  We report the first experimental evidence for the intimate connection between
superconductivity and antiferromagnetism in Rb0.8Fe2Se2-xTex single crystal
under negative chemical pressure by substituting Se with isovalent Te atoms.
Electrical resistance measurements in the temperature range from 4 K to 550 K
demonstrate that both superconducting transition temperature (Tc) and Neel
temperature (TN) were suppressed continuously with the lattice expansion. When
the Te concentration x in Rb0.8Fe2Se2-xTex approaches 0.3, the superconducting
transition temperature Tc is completely suppressed and the sample behaves like
a semiconductor, meanwhile the characteristic peak of antiferromagnetic
transition on resistance curve disappears. Our observation suggests that the
pressure-induced lattice expansion can be used to tune the correlativity of
superconductivity and antiferromagnetism.
","[{""version"":""v1"",""created"":""Sun, 24 Jul 2011 01:30:34 GMT""}]","2012-05-25"
"1107.4720","Ji Wang","Ji Wang and Jian Ge","How Close Are We To Detecting Earth-like Planets in the Habitable Zone
  Using the Radial Velocity Technique?","38 pages, 11 figures, 10 tables, submitted to ApJ, comments are
  welcome",,,,"astro-ph.EP","http://arxiv.org/licenses/nonexclusive-distrib/1.0/","  Discovering an Earth-like exoplanet in habitable zone is an important
milestone for astronomers in search of extra-terrestrial life. While the radial
velocity (RV) technique remains one the most powerful tools in detecting and
characterizing exo-planetary sys- tems, we calculate the uncertainties in
precision RV measurements considering stellar spectral quality factors, RV
calibration sources, stellar noise and telluric contamination in different
observational bandpasses and for different spectral types. We predict the
optimal observational bandpass for different spectral types using the RV
technique un- der a variety of conditions. We compare the RV signal of an
Earth-like planet in the habitable zone (HZ) to the near future state of the
art RV precision and attempt to answer the question: How close are we to
detecting Earth-like planet in the HZ using the RV technique?
","[{""version"":""v1"",""created"":""Sun, 24 Jul 2011 03:34:22 GMT""}]","2011-07-26"
"1107.4721","Jesse Alama","Jesse Alama","mizar-items: Exploring fine-grained dependencies in the Mizar
  Mathematical Library","Accepted at CICM 2011: Conferences in Intelligent Computer
  Mathematics, Track C: Systems and Projects","Intelligent Computer Mathematics, Lecture Notes in Computer
  Science 6824, pp. 276-7, 2011","10.1007/978-3-642-22673-1_19",,"cs.DL math.LO","http://arxiv.org/licenses/nonexclusive-distrib/1.0/","  The Mizar Mathematical Library (MML) is a rich database of formalized
mathematical proofs (see http://mizar.org). Owing to its large size (it
contains more than 1100 ""articles"" summing to nearly 2.5 million lines of text,
expressing more than 50000 theorems and 10000 definitions using more than 7000
symbols), the nature of its contents (the MML is slanted toward pure
mathematics), and its classical foundations (first-order logic, set theory,
natural deduction), the MML is an especially attractive target for research on
foundations of mathematics. We have implemented a system, mizar-items, on which
a variety of such foundational experiements can be based. The heart of
mizar-items is a method for decomposing the contents of the MML into
fine-grained ""items"" (e.g., theorem, definition, notation, etc.) and computing
dependency relations among these items. mizar-items also comes equipped with a
website for exploring these dependencies and interacting with them.
","[{""version"":""v1"",""created"":""Sun, 24 Jul 2011 04:25:44 GMT""},{""version"":""v2"",""created"":""Mon, 19 Sep 2011 15:50:13 GMT""}]","2011-09-20"
"1107.4722","Anand Bhalgat","Anand Bhalgat, Tanmoy Chakraborty, Sanjeev Khanna","Mechanism Design and Risk Aversion",,,,,"cs.GT","http://arxiv.org/licenses/nonexclusive-distrib/1.0/","  We develop efficient algorithms to construct utility maximizing mechanisms in
the presence of risk averse players (buyers and sellers) in Bayesian settings.
We model risk aversion by a concave utility function, and players play
strategically to maximize their expected utility. Bayesian mechanism design has
usually focused on maximizing expected revenue in a {\em risk neutral}
environment, and no succinct characterization of expected utility maximizing
mechanisms is known even for single-parameter multi-unit auctions.
  We first consider the problem of designing optimal DSIC mechanism for a risk
averse seller in the case of multi-unit auctions, and we give a poly-time
computable SPM that is $(1-1/e-\eps)$-approximation to the expected utility of
the seller in an optimal DSIC mechanism. Our result is based on a novel
application of a correlation gap bound, along with {\em splitting} and {\em
merging} of random variables to redistribute probability mass across buyers.
This allows us to reduce our problem to that of checking feasibility of a small
number of distinct configurations, each of which corresponds to a covering LP.
A feasible solution to the LP gives us the distribution on prices for each
buyer to use in a randomized SPM.
  We next consider the setting when buyers as well as the seller are risk
averse, and the objective is to maximize the seller's expected utility. We
design a truthful-in-expectation mechanism whose utility is a $(1-1/e
-\eps)^3$-approximation to the optimal BIC mechanism under two mild
assumptions. Our mechanism consists of multiple rounds that processes each
buyer in a round with small probability. Lastly, we consider the problem of
revenue maximization for a risk neutral seller in presence of risk averse
buyers, and give a poly-time algorithm to design an optimal mechanism for the
seller.
","[{""version"":""v1"",""created"":""Sun, 24 Jul 2011 04:38:20 GMT""},{""version"":""v2"",""created"":""Tue, 1 Nov 2011 22:41:09 GMT""},{""version"":""v3"",""created"":""Wed, 27 Jun 2012 04:04:52 GMT""}]","2012-06-28"
"1107.4723","Yannis Haralambous","Yannis Haralambous, Vitaly Klyuev","A Semantic Relatedness Measure Based on Combined Encyclopedic,
  Ontological and Collocational Knowledge","6 pages, 6 figures, accepted for publication at IJCNLP2011 Conference","Proceedings of the 5th International Joint Conference on Natural
  Language Processing, Chiang-Mai, Thailand, November 8-13, 2011",,,"cs.CL","http://arxiv.org/licenses/nonexclusive-distrib/1.0/","  We describe a new semantic relatedness measure combining the Wikipedia-based
Explicit Semantic Analysis measure, the WordNet path measure and the mixed
collocation index. Our measure achieves the currently highest results on the
WS-353 test: a Spearman rho coefficient of 0.79 (vs. 0.75 in (Gabrilovich and
Markovitch, 2007)) when applying the measure directly, and a value of 0.87 (vs.
0.78 in (Agirre et al., 2009)) when using the prediction of a polynomial SVM
classifier trained on our measure.
  In the appendix we discuss the adaptation of ESA to 2011 Wikipedia data, as
well as various unsuccessful attempts to enhance ESA by filtering at word,
sentence, and section level.
","[{""version"":""v1"",""created"":""Sun, 24 Jul 2011 06:27:56 GMT""},{""version"":""v2"",""created"":""Fri, 19 Aug 2011 21:35:23 GMT""}]","2011-08-23"
"1107.4724","Pablo Chico de Guzman Huerta","Pablo Chico de Guzm\'an, Amadeo Casas, Manuel Carro and Manuel V.
  Hermenegildo","Parallel Backtracking with Answer Memoing for Independent
  And-Parallelism","19 pages, 15 figures, uses tlp style","Theory and Practice of Logic Programming (2011) volume 11, issue
  4-5, pages 555-574",,,"cs.PL cs.DC","http://arxiv.org/licenses/nonexclusive-distrib/1.0/","  Goal-level Independent and-parallelism (IAP) is exploited by scheduling for
simultaneous execution two or more goals which will not interfere with each
other at run time. This can be done safely even if such goals can produce
multiple answers. The most successful IAP implementations to date have used
recomputation of answers and sequentially ordered backtracking. While in
principle simplifying the implementation, recomputation can be very inefficient
if the granularity of the parallel goals is large enough and they produce
several answers, while sequentially ordered backtracking limits parallelism.
And, despite the expected simplification, the implementation of the classic
schemes has proved to involve complex engineering, with the consequent
difficulty for system maintenance and extension, while still frequently running
into the well-known trapped goal and garbage slot problems. This work presents
an alternative parallel backtracking model for IAP and its implementation. The
model features parallel out-of-order (i.e., non-chronological) backtracking and
relies on answer memoization to reuse and combine answers. We show that this
approach can bring significant performance advantages. Also, it can bring some
simplification to the important engineering task involved in implementing the
backtracking mechanism of previous approaches.
","[{""version"":""v1"",""created"":""Sun, 24 Jul 2011 06:28:05 GMT""}]","2011-07-26"
"1107.4725","Huili (Grace)  Xing","Berardi Sensale-Rodriguez, Tian Fang, Rusen Yan, Michelle M. Kelly,
  Debdeep Jena, Lei Liu, and Huili (Grace) Xing","Unique prospects of graphene-based THz modulators","15 pages, 3 figures, 1 table","Appl. Phys. Lett. 99, 113104 (2011)","10.1063/1.3636435",,"cond-mat.mtrl-sci","http://arxiv.org/licenses/nonexclusive-distrib/1.0/","  The modulation depth of 2-D electron gas (2DEG) based THz modulators using
AlGaAs/GaAs heterostructures with metal gates is inherently limited to < 30%.
The metal gate not only attenuates the THz signal (> 90%) but also severely
degrades the modulation depth. The metal losses can be significantly reduced
with an alternative material with tunable conductivity. Graphene presents a
unique solution to this problem due to its symmetric band structure and
extraordinarily high mobility of holes that is comparable to electron mobility
in conventional semiconductors. The hole conductivity in graphene can be
electrostatically tuned in the graphene-2DEG parallel capacitor configuration,
thus more efficiently tuning the THz transmission. In this work, we show that
it is possible to achieve a modulation depth of > 90% while simultaneously
minimizing signal attenuation to < 5% by tuning the Fermi level at the Dirac
point in graphene.
","[{""version"":""v1"",""created"":""Sun, 24 Jul 2011 06:40:52 GMT""}]","2015-05-19"
"1107.4726","Tiexin Guo","Tiexin Guo and Yujie Yang","Ekeland's Variational Principle for An $\bar{L}^{0}-$Valued Function on
  A Complete Random Metric Space","26 pages",,,,"math.FA","http://arxiv.org/licenses/nonexclusive-distrib/1.0/","  Motivated by the recent work on conditional risk measures, this paper studies
the Ekeland's variational principle for a proper, lower semicontinuous and
lower bounded $\bar{L}^{0}-$valued function, where $\bar{L}^{0}$ is the set of
equivalence classes of extended real-valued random variables on a probability
space. First, we prove a general form of Ekeland's variational principle for
such a function defined on a complete random metric space. Then, we give a more
precise form of Ekeland's variational principle for such a local function on a
complete random normed module. Finally, as applications, we establish the
Bishop-Phelps theorem in a complete random normed module under the framework of
random conjugate spaces.
","[{""version"":""v1"",""created"":""Sun, 24 Jul 2011 06:51:56 GMT""},{""version"":""v2"",""created"":""Tue, 20 Sep 2011 08:03:22 GMT""}]","2011-09-21"
"1107.4727","Fan Zhang","Fan Zhang and Allan H. MacDonald","Distinguishing Spontaneous Quantum Hall States in Graphene Bilayers","4 pages 3 figures and 1 table, submitted and to appear","Phys. Rev. Lett. 108, 186804 (2012)","10.1103/PhysRevLett.108.186804",,"cond-mat.str-el cond-mat.mtrl-sci","http://arxiv.org/licenses/nonexclusive-distrib/1.0/","  Chirally stacked N-layer graphene with N>=2 is susceptible to a variety of
distinct broken symmetry states in which each spin-valley flavor spontaneously
transfers charge between layers. In mean-field theory the neutral bilayer
ground state is a layer antiferromagnet (LAF) state that has opposite
spin-polarizations in opposite layers. In this Letter we analyze how the LAF
and other competing states are influenced by Zeeman fields that couple to spin
and by interlayer electric fields that couple to layer pseudospin, and comment
on the possibility of using response and edge state signatures to identify the
character of the bilayer ground state experimentally.
","[{""version"":""v1"",""created"":""Sun, 24 Jul 2011 07:39:55 GMT""}]","2013-07-02"
"1107.4728","Jerzy Kowalski-Glikman","R. Durka, J. Kowalski-Glikman, and M. Szczachor","Gauged AdS-Maxwell algebra and gravity","8 pages; in version 2 references added; in version 3, two more
  references and comment added",,"10.1142/S0217732311037078",,"hep-th","http://arxiv.org/licenses/nonexclusive-distrib/1.0/","  We deform the anti-de Sitter algebra by adding additional generators
$\mathcal{Z}_{ab}$, forming in this way the negative cosmological constant
counterpart of the Maxwell algebra. We gauge this algebra and construct a
dynamical model with the help of a constrained the BF theory. It turns out that
the resulting theory is described by the Einstein-Cartan action with Holst
term, and the gauge fields associated with the Maxwell generators
$\mathcal{Z}_{ab}$ appear only in topological terms that do not influence
dynamical field equations. We briefly comment on the extension of this
construction, which would lead to a nontrivial Maxwell fields dynamics.
","[{""version"":""v1"",""created"":""Sun, 24 Jul 2011 07:41:59 GMT""},{""version"":""v2"",""created"":""Thu, 28 Jul 2011 07:32:04 GMT""},{""version"":""v3"",""created"":""Fri, 5 Aug 2011 14:27:56 GMT""}]","2015-05-28"
"1107.4729","Eberhard Bodenschatz","Eberhard Bodenschatz and Michael Eckert","Prandtl and the G\""ottingen School","Draft of our Chapter for ""A Voyage Through Turbulence"", edited by, P.
  A. Davidson, Y Kaneda, H.K. Moffatt \& K.R. Sreenivasan, Cambridge University
  Press, Oct. 2011, ISBN-13: 9780521149310",,,,"physics.flu-dyn cond-mat.stat-mech nlin.PS physics.hist-ph","http://creativecommons.org/licenses/by-nc-sa/3.0/","  This is a historical review of ""Prandtl and the G\""ottingen School"" from his
first work in 1898 to after WWII. We report the development of the boundary
layer theory and the investigations that lead Ludwig Prandtl in the spring of
1945 to use a energy cascade model to derive for fully developed turbulence the
Kolmogrov length scale. Working at the end of WWII he was not aware of the work
by Kolmogorov. Thus Ludwig Prandtl was before Onsager, von Weiz\""acker, and
Heisenberg in rederiving parts of K41 theory. In our historical analysis we
rely heavily on exchanges between Ludwig Prandtl with Theodore von K\'arm\'an
and Goeffrey Ingram Taylor and on the original notes by Ludwig Prandtl and
others.
","[{""version"":""v1"",""created"":""Sun, 24 Jul 2011 07:54:54 GMT""}]","2011-07-27"
"1107.4730","Yukie Sano","Yukie Sano, Kenta Yamada, Hayafumi Watanabe, Hideki Takayasu, and
  Misako Takayasu","Empirical analysis of collective human behavior for extraordinary events
  in blogosphere","10 pages, 19 figures",,"10.1103/PhysRevE.87.012805",,"physics.soc-ph cs.SI physics.data-an","http://arxiv.org/licenses/nonexclusive-distrib/1.0/","  To uncover underlying mechanism of collective human dynamics, we survey more
than 1.8 billion blog entries and observe the statistical properties of word
appearances. We focus on words that show dynamic growth and decay with a
tendency to diverge on a certain day. After careful pretreatment and fitting
method, we found power laws generally approximate the functional forms of
growth and decay with various exponents values between -0.1 and -2.5. We also
observe news words whose frequency increase suddenly and decay following power
laws. In order to explain these dynamics, we propose a simple model of posting
blogs involving a keyword, and its validity is checked directly from the data.
The model suggests that bloggers are not only responding to the latest number
of blogs but also suffering deadline pressure from the divergence day. Our
empirical results can be used for predicting the number of blogs in advance and
for estimating the period to return to the normal fluctuation level.
","[{""version"":""v1"",""created"":""Sun, 24 Jul 2011 08:01:33 GMT""},{""version"":""v2"",""created"":""Tue, 26 Jul 2011 02:23:28 GMT""},{""version"":""v3"",""created"":""Tue, 22 May 2012 07:01:11 GMT""},{""version"":""v4"",""created"":""Wed, 26 Dec 2012 02:23:57 GMT""}]","2015-03-19"
"1107.4731","Shahar Nevo","Shahar Nevo","A New Formula for the Natural Logarithm of a Natural Number","4 pages",,,,"math.CA","http://creativecommons.org/licenses/by/3.0/","  For every natural number $T,$ we write $\Ln T$ as a series, generalizing the
known series for $\Ln 2.$
","[{""version"":""v1"",""created"":""Sun, 24 Jul 2011 08:03:51 GMT""}]","2011-07-26"
"1107.4732","Sundararajan Natarajan","Sundararajan Natarajan, D. Roy Mahapatra and Stephane PA Bordas","Integrating strong and weak discontinuities without integration subcells
  and example applications in an XFEM/GFEM framework","37 pages, 23 figures","International Journal for Numerical Methods in Engineering, v83
  (3), 269-294, 2010","10.1002/nme.2798",,"math.NA","http://arxiv.org/licenses/nonexclusive-distrib/1.0/","  Partition of unity methods, such as the extended finite element method (XFEM)
allow discontinuities to be simulated independently of the mesh [1]. This
eliminates the need for the mesh to be aligned with the discontinuity or
cumbersome re-meshing, as the discontinuity evolves. However, to compute the
stiffness matrix of the elements intersected by the discontinuity, a
subdivision of the elements into quadrature subcells aligned with the
discontinuity is commonly adopted. In this paper, we use a simple integration
technique, proposed for polygonal domains [2] to suppress the need for element
subdivision. Numerical results presented for a few benchmark problems in the
context of linear elastic fracture mechanics and a multi-material problem, show
that the proposed method yields accurate results. Owing to its simplicity, the
proposed integration technique can be easily integrated in any existing code.
","[{""version"":""v1"",""created"":""Sun, 24 Jul 2011 08:04:26 GMT""}]","2011-07-26"
