"1107.4752","Marton Balazs","M\'arton Bal\'azs (1), J\'ulia Komj\'athy (1), Timo Sepp\""al\""ainen
  (2) ((1) Budapest Univ. of Techn. and Econ., (2) University of
  Wisconsin-Madison)","Fluctuation bounds in the exponential bricklayers process","34 pages, revised version after referees comments, accepted at JSP. A
  few explanations added, some proofs shortened in the Appendix","Journal of Statistical Physics; Volume 147, Number 1 (2012), 35-62","10.1007/s10955-012-0470-5",,"math.PR","http://arxiv.org/licenses/nonexclusive-distrib/1.0/","  This paper is the continuation of our earlier paper, where we proved
t^{1/3}-order of current fluctuations across the characteristics in a class of
one dimensional interacting systems with one conserved quantity. We also
claimed two models with concave hydrodynamic flux which satisfied the
assumptions which made our proof work. In the present note we show that the
totally asymmetric exponential bricklayers process also satisfies these
assumptions. Hence this is the first example with convex hydrodynamics of a
model with t^{1/3}-order current fluctuations across the characteristics. As
such, it further supports the idea of universality regarding this scaling.
","[{""version"":""v1"",""created"":""Sun, 24 Jul 2011 12:38:18 GMT""},{""version"":""v2"",""created"":""Sat, 7 Apr 2012 07:37:55 GMT""}]","2012-05-01"
"1107.4753","James Rustad","James R. Rustad","Peak Nothing: Recent Trends in Mineral Resource Production","4 pages, 1 figure",,,,"physics.geo-ph","http://arxiv.org/licenses/nonexclusive-distrib/1.0/","  The production histories of seventeen raw materials are analyzed with the
logistic model. Although many of these resources have exhibited logistic
behavior in the past, they now show exponential or super-exponential growth. In
most cases, the transition has occurred in the last ten to twenty years.
","[{""version"":""v1"",""created"":""Sun, 24 Jul 2011 12:54:46 GMT""}]","2011-07-26"
"1107.4754","Ljuben Mutafchiev R.","Ljuben Mutafchiev","The Size of the Largest Part of Random Weighted Partitions of Large
  Integers",,,,,"math.PR","http://arxiv.org/licenses/nonexclusive-distrib/1.0/","  For a given sequence of weights (non-negative numbers), we consider
partitions of the positive integer n. Each n-partition is selected uniformly at
random from the set of all such partitions. Under a classical scheme of
assumptions on the weight sequence, which are due to Meinardus (1954), we show
that the largest part in a random weighted partition, appropriately normalized,
converges weakly, as n tends to infinity, to a random variable having the
extreme value (Gumbel's) distribution. This limit theorem extends some known
results on particular types of integer partitions and on the Bose-Einstein
model of ideal gas.
","[{""version"":""v1"",""created"":""Sun, 24 Jul 2011 13:17:37 GMT""},{""version"":""v2"",""created"":""Thu, 24 Jan 2013 16:45:51 GMT""}]","2013-01-25"
"1107.4755","Christiane Koch","Leonid Rybak, Saieswari Amaran, Liat Levin, Michal Tomza, Robert
  Moszynski, Ronnie Kosloff, Christiane P. Koch, Zohar Amitay","Generating Molecular Rovibrational Coherence by Two-Photon Femtosecond
  Photoassociation of Thermally Hot Atoms","final version, accepted for publication in Phys Rev Lett","Phys. Rev. Lett. 107, 273001 (2011)","10.1103/PhysRevLett.107.273001",,"quant-ph physics.atom-ph","http://arxiv.org/licenses/nonexclusive-distrib/1.0/","  The formation of diatomic molecules with rotational and vibrational coherence
is demonstrated experimentally in free-to-bound two-photon femtosecond
photoassociation of hot atoms. In a thermal gas at a temperature of 1000 K,
pairs of magnesium atoms, colliding in their electronic ground state, are
excited into coherent superpositions of bound rovibrational levels in an
electronically excited state. The rovibrational coherence is probed by a
time-delayed third photon, resulting in quantum beats in the UV fluorescence. A
comprehensive theoretical model based on ab initio calculations rationalizes
the generation of coherence by Franck-Condon filtering of collision energies
and partial waves, quantifying it in terms of an increase in quantum purity of
the thermal ensemble. Our results open the way to coherent control of a binary
reaction.
","[{""version"":""v1"",""created"":""Sun, 24 Jul 2011 13:28:19 GMT""},{""version"":""v2"",""created"":""Wed, 16 Nov 2011 14:46:16 GMT""}]","2012-01-10"
"1107.4756","Yijian Ouyang","Yijian Ouyang, Stefano Sanvito, Jing Guo","Effects of edge chemistry doping on graphene nanoribbon mobility","15 pages, 7 figures","Surface Science 605 (2011), pp. 1643-1648","10.1016/j.susc.2010.10.030",,"cond-mat.mes-hall","http://arxiv.org/licenses/nonexclusive-distrib/1.0/","  Doping of semiconductor is necessary for various device applications.
Exploiting chemistry at its reactive edges was shown to be an effective way to
dope an atomically thin graphene nanoribbon (GNR) for realizing new devices in
recent experiments. The carrier mobility limited by edge doping is studied as a
function of the GNR width, doping density, and carrier density by using ab
initio density functional and parameterized tight binding simulations combined
with the non-equilibrium Green's function formalism for quantum transport. The
results indicate that for GNRs wider than about 4nm, the mobility scales
approximately linearly with the GNR width, inversely proportional to the edge
doping concentration and decreases for an increasing carrier density. For
narrower GNRs, dependence of the mobility on the GNR width and carrier density
can be qualitatively different.
","[{""version"":""v1"",""created"":""Sun, 24 Jul 2011 13:35:30 GMT""}]","2011-07-26"
"1107.4757","Norbert Hoffmann","Norbert Hoffmann","Independent parameters for special instanton bundles on P^{2n+1}","16 pages. v2: minor changes","Journal of Geometry and Physics 61 (2011), pp. 2321-2330","10.1016/j.geomphys.2011.07.006",,"math.AG","http://arxiv.org/licenses/nonexclusive-distrib/1.0/","  Motivated by Yang-Mills theory in 4n dimensions, and generalizing the notion
due to Atiyah, Drinfeld, Hitchin and Manin for n=1, Okonek, Spindler and
Trautmann introduced instanton bundles and special instanton bundles as certain
algebraic vector bundles of rank 2n on the complex projective space P^{2n+1}.
The moduli space of special instanton bundles is shown to be rational.
","[{""version"":""v1"",""created"":""Sun, 24 Jul 2011 13:42:21 GMT""},{""version"":""v2"",""created"":""Mon, 22 Aug 2011 14:03:57 GMT""}]","2011-08-23"
"1107.4758","Arka Majumdar","Arka Majumdar, Erik D. Kim, Jelena Vuckovic","The effect of photo-generated carriers on the spectral diffusion of a
  quantum dot coupled to a photonic crystal cavity",,,"10.1103/PhysRevB.84.195304",,"cond-mat.mes-hall quant-ph","http://arxiv.org/licenses/nonexclusive-distrib/1.0/","  We experimentally observe the effect of photo-generated carriers on the
spectral diffusion of a quantum dot (QD) coupled to a photonic crystal (PC)
cavity. In this system, spectral diffusion arises in part from charge
fluctuations on the etched surfaces of the PC. We find that these fluctuations
may be suppressed by photo-generated carriers, leading to a reduction of the
measured QD linewidth by a factor of ~2 compared to the case where the
photo-generated carriers are not present. This result demonstrates a possible
means of countering the effects of spectral diffusion in QD-PC cavity systems
and thus may be useful for quantum information applications where narrow QD
linewidths are desired.
","[{""version"":""v1"",""created"":""Sun, 24 Jul 2011 14:59:45 GMT""}]","2012-03-09"
"1107.4759","Tristan Meunier","Sylvain Hermelin, Shintaro Takada, Michihisa Yamamoto, Seigo Tarucha,
  Andreas D. Wieck, Laurent Saminadayar, Christopher B\""auerle and Tristan
  Meunier","Electrons surfing on a sound wave as a platform for quantum optics with
  flying electrons","Total 25 pages. 12 pages main text, 4 figures, 5 pages supplementary
  material",,"10.1038/nature10416",,"cond-mat.mes-hall","http://arxiv.org/licenses/nonexclusive-distrib/1.0/","  Electrons in a metal are indistinguishable particles that strongly interact
with other electrons and their environment. Isolating and detecting a single
flying electron after propagation to perform quantum optics like experiments at
the single electron level is therefore a challenging task. Up to date, only few
experiments have been performed in a high mobility two-dimensional electron gas
where the electron propagates almost ballistically. Flying electrons were
detected via the current generated by an ensemble of electrons and electron
correlations were encrypted in the current noise. Here we demonstrate the
experimental realisation of high efficiency single electron source and single
electron detector for a quantum medium where a single electron is propagating
isolated from the other electrons through a one-dimensional channel. The moving
potential is excited by a surface acoustic wave, which carries the single
electron along the 1D-channel at a speed of 3\mum/ns. When such a quantum
channel is placed between two quantum dots, a single electron can be
transported from one quantum dot to the other, which is several micrometres
apart, with a quantum efficiency of emission and detection of 96% and 92%,
respectively. Furthermore, the transfer of the electron can be triggered on a
timescale shorter than the coherence time T2* of GaAs spin qubits6. Our work
opens new avenues to study the teleportation of a single electron spin and the
distant interaction between spatially separated qubits in a condensed matter
system.
","[{""version"":""v1"",""created"":""Sun, 24 Jul 2011 15:10:26 GMT""}]","2015-05-28"
"1107.4760","Norimi Yokozaki","Koichi Hamaguchi, Kazunori Nakayama, Norimi Yokozaki","NMSSM in gauge-mediated SUSY breaking without domain wall problem","15 pages; the version to be published in PLB",,"10.1016/j.physletb.2012.01.027",,"hep-ph","http://arxiv.org/licenses/nonexclusive-distrib/1.0/","  A problem of the gauge-mediated SUSY breaking model is its difficulty to
generate a natural value of mu/Bmu, while the NMSSM is a natural framework to
solve the mu/Bmu problem. The NMSSM in gauge-mediated SUSY breaking in its
original form does not work well since the singlet field cannot develop a
desired vacuum expectation value. It also suffers from the cosmological domain
wall problem. We study an extension of the model to include additional
vector-like matter, which is charged under the hidden QCD. It is shown that
this simple extension solves both the problems. We study phenomenological and
cosmological implications of this extended models. The lightest Higgs mass can
be as large as 130-140 GeV for some model points.
","[{""version"":""v1"",""created"":""Sun, 24 Jul 2011 15:10:33 GMT""},{""version"":""v2"",""created"":""Wed, 11 Jan 2012 06:33:37 GMT""}]","2015-05-28"
"1107.4761","Hisashi Kasuya","Hisashi Kasuya","Techniques of computations of Dolbeault cohomology of solvmanifolds","9 pages, to appear in Math. Z",,,,"math.DG math.CV","http://arxiv.org/licenses/nonexclusive-distrib/1.0/","  We consider semi-direct products $\C^{n}\ltimes_{\phi}N$ of Lie groups with
lattices $\Gamma$ such that $N$ are nilpotent Lie groups with left-invariant
complex structures. We compute the Dolbeault cohomology of direct sums of
holomorphic line bundles over $G/\Gamma$ by using the Dolbeaut cohomology of
the Lie algebras of the direct product $\C^{n}\times N$. As a corollary of this
computation, we can compute the Dolbeault cohomology $H^{p,q}(G/\Gamma)$ of
$G/\Gamma$ by using a finite dimensional cochain complexes. Computing some
examples, we observe that the Dolbeault cohomology varies for choices of
lattices $\Gamma$.
","[{""version"":""v1"",""created"":""Sun, 24 Jul 2011 15:10:57 GMT""},{""version"":""v2"",""created"":""Tue, 27 Sep 2011 14:50:24 GMT""},{""version"":""v3"",""created"":""Wed, 7 Mar 2012 16:22:06 GMT""}]","2012-03-08"
"1107.4762","Takahiro Nishinaka","Takahiro Nishinaka and Satoshi Yamaguchi","Affine SU(N) algebra from wall-crossings","34 pages, 14 figures",,,"KEK-TH 1476, OU-HET 717","hep-th math.AG","http://arxiv.org/licenses/nonexclusive-distrib/1.0/","  We study the relation between the instanton counting on ALE spaces and the
BPS state counting on a toric Calabi-Yau three-fold. We put a single D4-brane
on a divisor isomorphic to A_{N-1}-ALE space in the Calabi-Yau three-fold, and
evaluate the discrete changes of BPS partition function of D4-D2-D0 states in
the wall-crossing phenomena. In particular, we find that the character of
affine SU(N) algebra naturally arises in wall-crossings of D4-D2-D0 states. Our
analysis is completely based on the wall-crossing formula for the d=4, N=2
supersymmetric theory obtained by dimensionally reducing the Calabi-Yau
three-fold.
","[{""version"":""v1"",""created"":""Sun, 24 Jul 2011 15:21:04 GMT""}]","2011-07-26"
"1107.4763","ANqi Qiu DR","Jia Du, Alvina Goh, Anqi Qiu","Diffeomorphic Metric Mapping of High Angular Resolution Diffusion
  Imaging based on Riemannian Structure of Orientation Distribution Functions",,,,,"cs.CV","http://arxiv.org/licenses/nonexclusive-distrib/1.0/","  In this paper, we propose a novel large deformation diffeomorphic
registration algorithm to align high angular resolution diffusion images
(HARDI) characterized by orientation distribution functions (ODFs). Our
proposed algorithm seeks an optimal diffeomorphism of large deformation between
two ODF fields in a spatial volume domain and at the same time, locally
reorients an ODF in a manner such that it remains consistent with the
surrounding anatomical structure. To this end, we first review the Riemannian
manifold of ODFs. We then define the reorientation of an ODF when an affine
transformation is applied and subsequently, define the diffeomorphic group
action to be applied on the ODF based on this reorientation. We incorporate the
Riemannian metric of ODFs for quantifying the similarity of two HARDI images
into a variational problem defined under the large deformation diffeomorphic
metric mapping (LDDMM) framework. We finally derive the gradient of the cost
function in both Riemannian spaces of diffeomorphisms and the ODFs, and present
its numerical implementation. Both synthetic and real brain HARDI data are used
to illustrate the performance of our registration algorithm.
","[{""version"":""v1"",""created"":""Sun, 24 Jul 2011 15:34:27 GMT""}]","2011-07-26"
"1107.4764","Ivo Dell'Ambrogio","Ivo Dell'Ambrogio and Greg Stevenson","On the derived category of a graded commutative noetherian ring","19 pages; minor corrections, added a few details","J. Algebra 373 (2013) 356-376","10.1016/j.jalgebra.2012.09.038",,"math.CT math.AC","http://arxiv.org/licenses/nonexclusive-distrib/1.0/","  For any graded commutative noetherian ring, where the grading group is
abelian and where commutativity is allowed to hold in a quite general sense, we
establish an inclusion-preserving bijection between, on the one hand, the
twist-closed localizing subcategories of the derived category, and, on the
other hand, subsets of the homogeneous spectrum of prime ideals of the ring. We
provide an application to weighted projective schemes.
","[{""version"":""v1"",""created"":""Sun, 24 Jul 2011 15:42:13 GMT""},{""version"":""v2"",""created"":""Wed, 14 Sep 2011 09:57:22 GMT""}]","2012-11-07"
"1107.4765","Henning Krause","Dave Benson, Srikanth B. Iyengar, Henning Krause","Localising subcategories for cochains on the classifying space of a
  finite group","5 pages, minor changes, accepted for publication in C. R. Math. Acad.
  Sci. Paris",,,,"math.RT math.AT","http://arxiv.org/licenses/nonexclusive-distrib/1.0/","  The localising subcategories of the derived category of the cochains on the
classifying space of a finite group are classified. They are in one to one
correspondence with the subsets of the set of homogeneous prime ideals of the
cohomology ring $H^*(G,k)$.
","[{""version"":""v1"",""created"":""Sun, 24 Jul 2011 15:46:59 GMT""},{""version"":""v2"",""created"":""Fri, 26 Aug 2011 17:20:51 GMT""}]","2011-08-29"
"1107.4766","Osamu Yasuda","Osamu Yasuda","Search for sterile neutrinos at reactors","uses revtex4, 18 pages, 6 figures. Several references added and minor
  modifications were made","JHEP 1109:036,2011","10.1007/JHEP09(2011)036",,"hep-ph","http://arxiv.org/licenses/nonexclusive-distrib/1.0/","  The sensitivity to the sterile neutrino mixing at very short baseline reactor
neutrino experiments is investigated. In the case of conventional (thermal
neutron) reactors it is found that the sensitivity is lost for $\Delta m^2
\gtrsim$ 1 eV$^2$ due to smearing of the reactor core size. On the other hand,
in the case of an experimental fast neutron reactor Joyo, because of its small
size, sensitivity to $\sin^22\theta_{14}$ can be as good as 0.03 for $\Delta
m^2 \sim$ several eV$^2$ with the Bugey-like detector setup.
","[{""version"":""v1"",""created"":""Sun, 24 Jul 2011 15:54:03 GMT""},{""version"":""v2"",""created"":""Thu, 1 Sep 2011 03:19:16 GMT""}]","2011-09-13"
"1107.5036","Dan Solomon","Dan Solomon","Comparing two methods of regularization of the kinetic energy density","Added an extra section. 15 pages",,,,"gr-qc hep-th quant-ph","http://arxiv.org/licenses/nonexclusive-distrib/1.0/","  In this paper we will compare two different methods of regularizing the
kinetic energy density for a massless scalar field in the presence of a static
scalar potential. One method of regularization is to subtract the cosmological
constant from the ""naive"" expression for the kinetic energy density. The other
method is to use point split regularization. It is found that the two methods
yield different results. The result obtained using point split regularization
includes an extra ambiguous term.
","[{""version"":""v1"",""created"":""Sun, 24 Jul 2011 12:58:41 GMT""},{""version"":""v2"",""created"":""Wed, 10 Aug 2011 00:52:02 GMT""}]","2011-08-11"
