"1107.4767","Shinsuke Kawai","Masato Arai, Shinsuke Kawai, Nobuchika Okada","Higgs inflation in minimal supersymmetric SU(5) GUT","5 pages, 4 figures, essentially the published version",,"10.1103/PhysRevD.84.123515",,"hep-ph astro-ph.CO","http://arxiv.org/licenses/nonexclusive-distrib/1.0/","  The Standard Model Higgs boson with large nonminimal coupling to the
gravitational curvature can drive cosmological inflation. We study this type of
inflationary scenario in the context of supersymmetric grand unification and
point out that it is naturally implemented in the {\em minimal} supersymmetric
SU(5) model, and hence virtually in any GUT models. It is shown that with an
appropriate K\""{a}hler potential the inflaton trajectory settles down to the
Standard Model vacuum at the end of the slow roll. The predicted cosmological
parameters are also consistent with the 7-year WMAP data.
","[{""version"":""v1"",""created"":""Sun, 24 Jul 2011 16:07:15 GMT""},{""version"":""v2"",""created"":""Thu, 4 Aug 2011 01:07:13 GMT""},{""version"":""v3"",""created"":""Wed, 14 Dec 2011 13:44:13 GMT""}]","2013-05-29"
"1107.4768","Punit Boolchand","S.Bhosle, K. Gunasekera, P.Boolchand and M.Micoulaut","Melt homogenization and self-organization of chalcogenides glasses:
  evidence of sharp rigidity, stress and nanoscale phase separation transitions
  in the GexSe100-x binary",,,"10.1111/j.2041-1294.2012.00092.x",,"cond-mat.dis-nn","http://arxiv.org/licenses/nonexclusive-distrib/1.0/","  A Raman profiling method is used to monitor growth of GexSe100-x melts and
reveals a two step process of homogenization. Resulting homogeneous glasses
show the non-reversing enthalpy at Tg, {\Delta}Hnr(x), to show a square-well
like variation with x, with a rigidity transition near xc(1) = 19.5(5)% and
stress transition near xc(2) = 26.0(5)%) representing the boundaries of the
rigid but stress-free Intermediate Phase (IP). The square-well like variation
of {\Delta}Hnr(x) develops sloping walls, a triangular shape and eventually
disappears in glasses having an increasing heterogeneity. The {\Delta}Hnr term
ages over weeks outside the IP but not inside the IP. An optical analogue of
the reversibility window is observed with Raman spectra of as-quenched melts
and Tg cycled glasses being the same for glass compositions in the IP but
different for compositions outside the IP. Variations of Molar volumes, display
three regimes of behavior with a global minimum in the IP and a pronounced
increase outside that phase. The intrinsic physical behavior of dry and
homogeneous chalcogenides glasses can vary sharply with composition near
elastic and chemical phase transitions, showing that the physics of network
glasses requires homogeneous samples, and may be far more interesting than
hitherto recognized.
","[{""version"":""v1"",""created"":""Sun, 24 Jul 2011 16:19:50 GMT""}]","2012-07-16"
"1107.4769","Sergey Kopylov","S. Kopylov, V. I. Fal'ko, Th. Seyller","Doping of epitaxial graphene on SiC intercalated with hydrogen and its
  magneto-oscillations","2.5 pages",,,,"cond-mat.mtrl-sci","http://arxiv.org/licenses/nonexclusive-distrib/1.0/","  We study the charge transfer between a quasi-free-standing monolayer
graphene, produced by hydrogen intercalation, and surface acceptor states. We
consider two models of acceptor density of states to explain the high hole
densities observed in graphene and find the density responsivity to the gate
voltage. By studying magneto-oscillations of the carrier density we provide an
experimental way to determine the relevant model.
","[{""version"":""v1"",""created"":""Sun, 24 Jul 2011 16:36:40 GMT""}]","2011-07-26"
"1107.4770","Sebastian Cassel","S. Cassel","Naturalness of electroweak physics within minimal supergravity","148 pages, D. Phil. Thesis, Oxford University",,,,"hep-ph","http://arxiv.org/licenses/nonexclusive-distrib/1.0/","  Low energy supersymmetry is motivated by its use as a solution to the
hierarchy problem of the electroweak scale. Having motivated this model with
naturalness arguments, it is then necessary to check whether the experimentally
allowed parameter space permits realisations of the model with low fine tuning.
The scope of this thesis is a study of naturalness of the electroweak physics
in the minimal supergravity model. The latest experimental constraints are
applied, and the fine tuning is quantitatively evaluated for a scan across the
parameter space. The fine tuning of the electroweak scale is evaluated at
2-loop order, and the fine tuning of the neutralino dark matter thermal relic
energy density is also determined. The natural regions of the parameter space
are identified and the associated phenomenology relevant for detection
discussed. Naturalness limits are also found for the parameter space and
spectrum. The minimum fine tuning found is 1 part in 9 when dark matter
constraints are neglected, and 1 part in 15 when dark matter constraints are
satisfied. For both cases, the minimum fine tuning is found for a Higgs mass of
115 GeV irrespective of whether the Higgs mass constraint is applied or not.
The most natural spectrum includes light superpartner fermions, and heavy
superpartner scalars. Minimal supergravity currently remains viable with
respect to naturalness and a natural realisation may be discovered within the
next couple of years.
","[{""version"":""v1"",""created"":""Sun, 24 Jul 2011 16:45:25 GMT""}]","2011-07-26"
"1107.4771","Cms Collaboration","CMS Collaboration","Search for Resonances in the Dijet Mass Spectrum from 7 TeV pp
  Collisions at CMS",,"Phys. Lett. B 704 (2011) 123","10.1016/j.physletb.2011.09.015","CMS-EXO-11-015, CERN-PH-EP-2011-119","hep-ex","http://arxiv.org/licenses/nonexclusive-distrib/1.0/","  A search for narrow resonances with a mass of at least 1 TeV in the dijet
mass spectrum is performed using pp collisions at sqrt(s)=7 TeV corresponding
to an integrated luminosity of 1 inverse femtobarn, collected by the CMS
experiment at the LHC. No resonances are observed. Upper limits at the 95%
confidence level are presented on the product of the resonance cross section,
branching fraction into dijets, and acceptance, separately for decays into
quark-quark, quark-gluon, and gluon-gluon pairs. The data exclude new particles
predicted in the following models at the 95% confidence level: string
resonances with mass less than 4.00 TeV, E6 diquarks with mass less than 3.52
TeV, excited quarks with mass less than 2.49 TeV, axigluons and colorons with
mass less than 2.47 TeV, and W' bosons with mass less than 1.51 TeV.
","[{""version"":""v1"",""created"":""Sun, 24 Jul 2011 16:58:01 GMT""}]","2012-08-27"
"1107.4772","Ilian Iliev","Ilian T. Iliev (University of Sussex), Garrelt Mellema (Stockholm
  University), Paul R. Shapiro (University of Texas), Ue-Li Pen (CITA), Yi Mao,
  Jun Koda (University of Texas), Kyungjin Ahn (Chosun University)","Can 21-cm observations discriminate between high-mass and low-mass
  galaxies as reionization sources?","33 pages, 38 figures, mostly in color. Comments welcome",,"10.1111/j.1365-2966.2012.21032.x",,"astro-ph.CO","http://arxiv.org/licenses/nonexclusive-distrib/1.0/","  The prospect of detecting the first galaxies by observing their impact on the
intergalactic medium as they reionized it during the first billion years leads
us to ask whether such indirect observations are capable of diagnosing which
types of galaxies were most responsible for reionization. We attempt to answer
this by considering a set of large-scale radiative transfer simulations of
reionization in sufficiently large volumes to make statistically meaningful
predictions of observable signatures, while also directly resolving all
atomically-cooling halos down to 10^8 M_solar. We focus here on predictions of
the 21-cm background, to see if upcoming observations are capable of
distinguishing a universe ionized primarily by high-mass halos from one in
which both high-mass and low-mass halos are responsible, and to see how these
results depend upon the uncertain source efficiencies. We find that 21-cm
fluctuation power spectra observed by the first generation EoR/21-cm radio
interferometer arrays should be able to distinguish the case of reionization by
high-mass halos alone from that by both high- and low-mass halos, together.
Some reionization scenarios yield very similar power spectra and rms evolution
and thus can only be discriminated by their different mean reionization history
and 21-cm PDF distributions. We find that the skewness of the 21-cm PDF
distribution smoothed over LOFAR-like window shows a clear feature correlated
with the rise of the rms due to patchiness. Measurements of the mean
photoionization rates are sensitive to the average density of the regions being
studied and therefore could be strongly skewed in certain cases. (abridged)
","[{""version"":""v1"",""created"":""Sun, 24 Jul 2011 17:00:44 GMT""}]","2015-05-28"
"1107.4773","Haret Rosu","H. C. Rosu, O. Cornejo-Perez, P. Ojeda-May","Traveling kinks in cubic nonlinear Ginzburg-Landau equations","11 pages, 4 figures, final version","Phys. Rev. E 85, 037102 (2012)","10.1103/PhysRevE.85.037102",,"math-ph math.MP","http://arxiv.org/licenses/nonexclusive-distrib/1.0/","  Nonlinear cubic Euler-Lagrange equations of motion in the traveling variable
are usually derived from Ginzburg-Landau free energy functionals frequently
encountered in several fields of physics. Many authors considered in the past
damped versions of such equations with the damping term added by hand
simulating the friction due to the environment. It is known that even in this
damped case kink solutions can exist. By means of a factorization method, we
provide analytic formulas for several possible kink solutions of such equations
of motion in the undriven and constant field driven cases, including the
recently introduced Riccati parameter kinks which were not considered
previously in such a context. The latter parameter controls the delay of the
switching stage of the kinks
","[{""version"":""v1"",""created"":""Sun, 24 Jul 2011 17:16:20 GMT""},{""version"":""v2"",""created"":""Mon, 3 Oct 2011 16:34:40 GMT""},{""version"":""v3"",""created"":""Wed, 25 Jan 2012 18:07:11 GMT""},{""version"":""v4"",""created"":""Tue, 13 Mar 2012 15:35:03 GMT""}]","2012-03-14"
"1107.4774","Matthias Baur","M. Baur, A. Fedorov, L. Steffen, S. Filipp, M. P. da Silva, A.
  Wallraff","Benchmarking a Teleportation Protocol realized in Superconducting
  Circuits","4 pages, 4 figures","Phys. Rev. Lett. 108, 040502 (2012)","10.1103/PhysRevLett.108.040502",,"quant-ph cond-mat.supr-con","http://arxiv.org/licenses/nonexclusive-distrib/1.0/","  Teleportation of a quantum state may be used for distributing entanglement
between distant qubits in quantum communication and for quantum computation.
Here we demonstrate the implementation of a teleportation protocol, up to the
single-shot measurement step, with superconducting qubits coupled to a
microwave resonator. Using full quantum state tomography and evaluating an
entanglement witness, we show that the protocol generates a genuine tripartite
entangled state of all three-qubits. Calculating the projection of the measured
density matrix onto the basis states of two qubits allows us to reconstruct the
teleported state. Repeating this procedure for a complete set of input states
we find an average output state fidelity of 88%.
","[{""version"":""v1"",""created"":""Sun, 24 Jul 2011 17:24:36 GMT""}]","2012-08-20"
"1107.4775","Omer Bobrowski","Omer Bobrowski, Robert J. Adler","Distance Functions, Critical Points, and the Topology of Random \v{C}ech
  Complexes",,,,,"math.PR math.AT","http://arxiv.org/licenses/nonexclusive-distrib/1.0/","  For a finite set of points $P$ in $R^d$, the function $d_P: R^d \to R^+$
measures Euclidean distance to the set $P$. We study the number of critical
points of $d_P$ when $P$ is a Poisson process. In particular, we study the
limit behavior of $N_k$ - the number of critical points of $d_P$ with Morse
index $k$ - as the density of points grows. We present explicit computations
for the normalized, limiting, expectations and variances of the $N_k$, as well
as distributional limit theorems. We link these results to recent results in
which the Betti numbers of the random \v{C}ech complex based on $P$ were
studied.
","[{""version"":""v1"",""created"":""Sun, 24 Jul 2011 17:39:13 GMT""},{""version"":""v2"",""created"":""Mon, 11 Aug 2014 19:19:02 GMT""}]","2014-08-12"
"1107.4776","Joel David Hamkins","Gunter Fuchs, Joel David Hamkins, Jonas Reitz","Set-Theoretic Geology","44 pages; commentary concerning this article can be made at
  http://jdh.hamkins.org/set-theoreticgeology/",,,,"math.LO","http://arxiv.org/licenses/nonexclusive-distrib/1.0/","  A ground of the universe V is a transitive proper class W subset V, such that
W is a model of ZFC and V is obtained by set forcing over W, so that V = W[G]
for some W-generic filter G subset P in W . The model V satisfies the ground
axiom GA if there are no such W properly contained in V . The model W is a
bedrock of V if W is a ground of V and satisfies the ground axiom. The mantle
of V is the intersection of all grounds of V . The generic mantle of V is the
intersection of all grounds of all set-forcing extensions of V . The generic
HOD, written gHOD, is the intersection of all HODs of all set-forcing
extensions. The generic HOD is always a model of ZFC, and the generic mantle is
always a model of ZF. Every model of ZFC is the mantle and generic mantle of
another model of ZFC. We prove this theorem while also controlling the HOD of
the final model, as well as the generic HOD. Iteratively taking the mantle
penetrates down through the inner mantles to what we call the outer core, what
remains when all outer layers of forcing have been stripped away. Many
fundamental questions remain open.
","[{""version"":""v1"",""created"":""Sun, 24 Jul 2011 17:55:27 GMT""},{""version"":""v2"",""created"":""Tue, 18 Nov 2014 23:03:02 GMT""}]","2014-11-20"
"1107.4777","Inbal Hecht","Inbal Hecht, Herbert Levine, Wouter-Jan Rappel and Eshel Ben-Jacob","Self-assisted Amoeboid Navigation in Complex Environments",,,"10.1371/journal.pone.0021955",,"q-bio.CB physics.bio-ph","http://arxiv.org/licenses/nonexclusive-distrib/1.0/","  Background: Living cells of many types need to move in response to external
stimuli in order to accomplish their functional tasks; these tasks range from
wound healing to immune response to fertilization. While the directional motion
is typically dictated by an external signal, the actual motility is also
restricted by physical constraints, such as the presence of other cells and the
extracellular matrix. The ability to successfully navigate in the presence of
obstacles is not only essential for organisms, but might prove relevant in the
study of autonomous robotic motion.
  Methodology/principal findings: We study a computational model of amoeboid
chemotactic navigation under differing conditions, from motion in an
obstacle-free environment to navigation between obstacles and finally to moving
in a maze. We use the maze as a simple stand-in for a motion task with severe
constraints, as might be expected in dense extracellular matrix. Whereas agents
using simple chemotaxis can successfully navigate around small obstacles, the
presence of large barriers can often lead to agent trapping. We further show
that employing a simple memory mechanism, namely secretion of a repulsive
chemical by the agent, helps the agent escape from such trapping.
  Conclusions/significance: Our main conclusion is that cells employing simple
chemotactic strategies will often be unable to navigate through maze-like
geometries, but a simple chemical marker mechanism (which we refer to as
""self-assistance"") significantly improves success rates. This realization
provides important insights into mechanisms that might be employed by real
cells migrating in complex environments as well as clues for the design of
robotic navigation strategies. The results can be extended to more complicated
multi-cellular systems and can be used in the study of mammalian cell migration
and cancer metastasis.
","[{""version"":""v1"",""created"":""Sun, 24 Jul 2011 18:00:02 GMT""}]","2015-05-28"
"1107.4778","Bernhard Irrgang","Bernhard Irrgang","Constructing new higher-gap morasses","accepted for the Far East Journal of Mathematical Sciences",,,,"math.LO","http://arxiv.org/licenses/nonexclusive-distrib/1.0/","  In a previous paper I proposed a notion of $(\omega_1,\beta)$-morasses for
$\omega_1 \leq \beta$. In the present paper such morasses are constructed in an
inner model which satisfies amenability, coherence and condensation.
","[{""version"":""v1"",""created"":""Sun, 24 Jul 2011 18:04:16 GMT""}]","2011-07-26"
"1107.4779","Nuno Peres","J. N. B. Rodrigues, P. A. D. Gon\c{c}alves, N. F. G. Rodrigues, R. M.
  Ribeiro, J. M. B. Lopes dos Santos, N. M. R. Peres","Zigzag graphene nanoribbon edge reconstruction with Stone-Wales defects","15 pages","Phys. Rev. B 84, 155435 (2011)","10.1103/PhysRevB.84.155435",,"cond-mat.mes-hall cond-mat.dis-nn cond-mat.mtrl-sci","http://arxiv.org/licenses/nonexclusive-distrib/1.0/","  In this article, we study zigzag graphene nanoribbons with edges
reconstructed with Stone-Wales defects, by means of an empirical
(first-neighbor) tight-binding method, with parameters determined by ab-initio
calculations of very narrow ribbons. We explore the characteristics of the
electronic band structure with a focus on the nature of edge states. Edge
reconstruction allows the appearance of a new type of edge states. They are
dispersive, with non-zero amplitudes in both sub-lattices; furthermore, the
amplitudes have two components that decrease with different decay lengths with
the distance from the edge; at the Dirac points one of these lengths diverges,
whereas the other remains finite, of the order of the lattice parameter. We
trace this curious effect to the doubling of the unit cell along the edge,
brought about by the edge reconstruction. In the presence of a magnetic field,
the zero-energy Landau level is no longer degenerate with edge states as in the
case of pristine zigzag ribbon.
","[{""version"":""v1"",""created"":""Sun, 24 Jul 2011 18:05:10 GMT""}]","2011-11-22"
"1107.4780","Peter E. Bloechl","Peter E. Bloechl, Christian F. J. Walther, Thomas Pruschke","Is reduced-density-matrix functional theory a suitable vehicle to import
  explicit correlations into density-functional calculations?","13 pages, 8 figures",,"10.1103/PhysRevB.84.205101",,"cond-mat.str-el","http://arxiv.org/licenses/nonexclusive-distrib/1.0/","  A variational formulation for the calculation of interacting fermion systems
based on the density-matrix functional theory is presented. Our formalism
provides for a natural integration of explicit many-particle effects into
standard density-functional-theory based calculations and it avoids ambiguities
of double-counting terms inherent to other approaches. Like the dynamical
mean-field theory, we employ a local approximation for explicit correlations.
Aiming at the ground state only, trade some of the complexity of Green's
function based many-particle methods against efficiency. Using short Hubbard
chains as test systems we demonstrate that the method captures ground state
properties, such as left-right-correlation, beyond those accessible by
mean-field theories.
","[{""version"":""v1"",""created"":""Sun, 24 Jul 2011 18:05:13 GMT""}]","2013-05-29"
"1107.4781","Bernhard Irrgang","Bernhard Irrgang","Proposing new higher-gap morasses","accepted for Far East Journal of Mathematical Sciences",,,,"math.LO","http://arxiv.org/licenses/nonexclusive-distrib/1.0/","  I propose a notion of $(\omega_1,\beta)$-morass for the case $\omega_1 \leq
\beta$.
","[{""version"":""v1"",""created"":""Sun, 24 Jul 2011 18:10:09 GMT""}]","2011-07-26"
"1107.4782","Reinel Sospedra-Alfonso","Reinel Sospedra-Alfonso and Martial Agueh","Uniqueness of the compactly supported weak solutions of the relativistic
  Vlasov-Darwin system","AMS-LaTeX, 21 pages",,"10.1007/s00205-012-0518-3",,"math-ph math.AP math.MP","http://arxiv.org/licenses/nonexclusive-distrib/1.0/","  We use optimal transportation techniques to show uniqueness of the compactly
supported weak solutions of the relativistic Vlasov-Darwin system. Our proof
extends the method used by Loeper in J. Math. Pures Appl. 86, 68-79 (2006) to
obtain uniqueness results for the Vlasov-Poisson system.
","[{""version"":""v1"",""created"":""Sun, 24 Jul 2011 18:16:24 GMT""},{""version"":""v2"",""created"":""Sat, 1 Sep 2012 19:59:51 GMT""}]","2012-09-04"
"1107.4783","Eilon Poem","E. Poem, O. Kenneth, Y. Kodriano, Y. Benny, S. Khatsevich, J. E.
  Avron, and D. Gershoni","Optically induced rotation of a quantum dot exciton spin","4 pages, 4 figures, accepted for publication in Physical Review
  Letters",,"10.1103/PhysRevLett.107.087401",,"quant-ph cond-mat.mes-hall","http://arxiv.org/licenses/nonexclusive-distrib/1.0/","  We demonstrate control over the spin state of a semiconductor quantum dot
exciton using a polarized picosecond laser pulse slightly detuned from a
biexciton resonance. The control pulse follows an earlier pulse, which
generates an exciton and initializes its spin state as a coherent superposition
of its two non-degenerate eigenstates. The control pulse preferentially couples
one component of the exciton state to the biexciton state, thereby rotating the
exciton's spin direction. We detect the rotation by measuring the polarization
of the exciton spectral line as a function of the time-difference between the
two pulses. We show experimentally and theoretically how the angle of rotation
depends on the detuning of the second pulse from the biexciton resonance.
","[{""version"":""v1"",""created"":""Sun, 24 Jul 2011 18:23:00 GMT""}]","2012-03-14"
"1107.4784","Ming Yu","Bao Shou, Jian-Feng Wu, Ming Yu","AGT conjecture and AFLT states: a complete construction","Latex, 23 pages, 1 figure, typo corrected, english improved, one more
  reference added",,,,"hep-th math-ph math.MP","http://creativecommons.org/licenses/by/3.0/","  A complete construction of the AFLT states is proposed. With this
construction and for all the cases we have checked, the AGT conjecture on the
equivalence of Nekrasov Instanton Counting (NIC) to the $Vir\oplus u(1)$
conformal block has been verified to be true.
","[{""version"":""v1"",""created"":""Sun, 24 Jul 2011 18:26:03 GMT""},{""version"":""v2"",""created"":""Mon, 1 Aug 2011 16:21:20 GMT""}]","2011-08-02"
"1107.4785","Ranjan Pal","Ranjan Pal, Leana Golubchik, Konstantinos Psounis","A Novel Cyber-Insurance for Internet Security",,,,,"cs.CR","http://arxiv.org/licenses/nonexclusive-distrib/1.0/","  Internet users such as individuals and organizations are subject to different
types of epidemic risks such as worms, viruses, and botnets. To reduce the
probability of risk, an Internet user generally invests in self-defense
mechanisms like antivirus and antispam software. However, such software does
not completely eliminate risk. Recent works have considered the problem of
residual risk elimination by proposing the idea of cyber-insurance. In reality,
an Internet user faces risks due to security attacks as well as risks due to
non-security related failures (e.g., reliability faults in the form of hardware
crash, buffer overflow, etc.) . These risk types are often indistinguishable by
a naive user. However, a cyber-insurance agency would most likely insure risks
only due to security attacks. In this case, it becomes a challenge for an
Internet user to choose the right type of cyber-insurance contract as standard
optimal contracts, i.e., contracts under security attacks only, might prove to
be sub-optimal for himself. In this paper, we address the problem of analyzing
cyber-insurance solutions when a user faces risks due to both, security as well
as non-security related failures. We propose \emph{Aegis}, a novel
cyber-insurance model in which the user accepts a fraction \emph{(strictly
positive)} of loss recovery on himself and transfers rest of the loss recovery
on the cyber-insurance agency. We mathematically show that given an option,
Internet users would prefer Aegis contracts to traditional cyber-insurance
contracts, under all premium types. This result firmly establishes the
non-existence of traditional cyber-insurance markets when Aegis contracts are
offered to users.
","[{""version"":""v1"",""created"":""Sun, 24 Jul 2011 18:46:54 GMT""}]","2011-07-26"
