"1107.4854","Michela Redivo-Zaglia","Claude Brezinski and Michela Redivo-Zaglia","Pad\'e-type rational and barycentric interpolation",,,,,"math.NA","http://arxiv.org/licenses/nonexclusive-distrib/1.0/","  In this paper, we consider the particular case of the general rational
Hermite interpolation problem where only the value of the function is
interpolated at some points, and where the function and its first derivatives
agree at the origin. Thus, the interpolants constructed in this way possess a
Pad\'e--type property at 0. Numerical examples show the interest of the
procedure. The interpolation procedure can be easily modified to introduce a
partial knowledge on the poles and the zeros of the function to approximated. A
strategy for removing the spurious poles is explained. A formula for the error
is proved in the real case. Applications are given.
","[{""version"":""v1"",""created"":""Mon, 25 Jul 2011 07:35:12 GMT""},{""version"":""v2"",""created"":""Sat, 29 Oct 2011 09:12:58 GMT""},{""version"":""v3"",""created"":""Mon, 24 Sep 2012 08:25:18 GMT""}]","2012-09-25"
"1107.4855","Vishesh Karwa","Vishesh Karwa, Aleksandra B. Slavkovi\'c, Eric T. Donnell","Causal inference in transportation safety studies: Comparison of
  potential outcomes and causal diagrams","Published in at http://dx.doi.org/10.1214/10-AOAS440 the Annals of
  Applied Statistics (http://www.imstat.org/aoas/) by the Institute of
  Mathematical Statistics (http://www.imstat.org)","Annals of Applied Statistics 2011, Vol. 5, No. 2B, 1428-1455","10.1214/10-AOAS440","IMS-AOAS-AOAS440","stat.AP","http://arxiv.org/licenses/nonexclusive-distrib/1.0/","  The research questions that motivate transportation safety studies are causal
in nature. Safety researchers typically use observational data to answer such
questions, but often without appropriate causal inference methodology. The
field of causal inference presents several modeling frameworks for probing
empirical data to assess causal relations. This paper focuses on exploring the
applicability of two such modeling frameworks---Causal Diagrams and Potential
Outcomes---for a specific transportation safety problem. The causal effects of
pavement marking retroreflectivity on safety of a road segment were estimated.
More specifically, the results based on three different implementations of
these frameworks on a real data set were compared: Inverse Propensity Score
Weighting with regression adjustment and Propensity Score Matching with
regression adjustment versus Causal Bayesian Network. The effect of increased
pavement marking retroreflectivity was generally found to reduce the
probability of target nighttime crashes. However, we found that the magnitude
of the causal effects estimated are sensitive to the method used and to the
assumptions being violated.
","[{""version"":""v1"",""created"":""Mon, 25 Jul 2011 07:36:41 GMT""}]","2011-07-26"
"1107.4856","Asli Elmasli","A. Elmasl{\i}, L. Fossati, C. P. Folsom, B. Albayrak, and H.Izumiura","A Spectroscopic Study of DD UMa: Ursa Major Group Member and Candidate
  for BRITE","6 pages, 4 figures",,"10.1016/j.newast.2011.07.006",,"astro-ph.SR","http://arxiv.org/licenses/nonexclusive-distrib/1.0/","  The Ursa Major group is a nearby stellar supercluster which, while not
gravitationally bound, is defined by co-moving members. DD UMa is a $\delta$
Scuti star whose membership in the Ursa Major group is unclear.
  The objective of this study is to confirm the membership of DD UMa in the
Ursa Major group, as well as perform a detailed spectral analysis of the star.
Since DD UMa is a low-amplitude $\delta$ Scuti star, we performed a frequency
analysis. We determined fundamental parameters, chemical abundances, and derive
a mass and age for the star.
  For this study we observed DD UMa at the Okayama Astrophysical Observatory
with the high-resolution spectrograph HIDES, between the $27^{th}$ of February
and the $4^{th}$ March, 2009. Additional observations were extracted from the
ELODIE archive in order to expand our abundance analysis. Group membership of
DD UMa was assessed by examining the velocity of the star in Galactic
coordinates. Pulsational frequencies were determined by examining line profile
variability in the HIDES spectra. Stellar fundamental parameters and chemical
abundances were derived by fitting synthetic spectra to both the HIDES and
ELODIE observations.
  DD UMa is found to be a member of the extended stream of the Ursa Major
group, based on the space motion of the star. This is supported by the chemical
abundances of the star being consistent with those of Ursa Major group members.
The star is found to be chemically solar, with $T_{eff}=7450\pm150$ K and $\log
g=3.98\pm0.2$. We found pulsational frequencies of 9.4 c/d and 15.0 c/d. While
these frequencies are insufficient to perform an asteroseismic study, DD UMa is
a good bright star candidate for future study by the BRITE-constellation.
","[{""version"":""v1"",""created"":""Mon, 25 Jul 2011 07:39:31 GMT""}]","2016-08-14"
"1107.4857","Shin'ya Yamada","Shin'ya Yamada, Kazuo Makishima, Kazuhiro Nakazawa, Motohide Kokubun,
  Madoka Kawaharada, Takao Kitaguchi, Shin Watanabe, Hiromitsu Takahashi,
  Hirofumi Noda, Hiroyuki Nishioka, Kazuyoshi Hiragi, Katsuhiro Hayashi, Kenta
  Nakajima, Makoto Tashiro, Makoto Sasano, Sho Nishino, Shunsuke Torii, Soki
  Sakurai, Tadayuki Takahashi, Tsunefumi Mizuno, Teruaki Enoto, Takayuki Yuasa,
  Takaaki Tanaka, Tomomi Kouzu, Toshio Nakano, Yasushi Fukazawa, Yukikatsu
  Terada, Yasunobu Uchiyama, Wataru Iwakiri, and the HXD Collaboration","Improvements in calibration of GSO scintillators in the Suzaku Hard
  X-ray Detector","Suzaku HXD-GSO detector, calibration update; PASJ, May 2011",,"10.1093/pasj/63.sp3.S645",,"astro-ph.IM astro-ph.HE","http://arxiv.org/licenses/nonexclusive-distrib/1.0/","  Improvements of in-orbit calibration of GSO scintillators in the Hard X-ray
Detector on board Suzaku are reported. To resolve an apparent change of the
energy scale of GSO which appeared across the launch for unknown reasons,
consistent and thorough re-analyses of both pre-launch and in-orbit data have
been performed. With laboratory experiments using spare hardware, the pulse
height offset, corresponding to zero energy input, was found to change by ~0.5
of the full analog voltage scale, depending on the power supply. Furthermore,
by carefully calculating all the light outputs of secondaries from activation
lines used in the in-orbit gain determination, their energy deposits in GSO
were found to be effectively lower, by several percent, than their nominal
energies. Taking both these effects into account, the in-orbit data agrees with
the on-ground measurements within ~5%, without employing the artificial
correction introduced in the previous work (Kokubun et al. 2007). With this
knowledge, we updated the data processing, the response, and the auxiliary
files of GSO, and reproduced the HXD-PIN and HXD-GSO spectra of the Crab Nebula
over 12-300 keV by a broken powerlaw with a break energy of ~110 keV.
","[{""version"":""v1"",""created"":""Mon, 25 Jul 2011 07:43:50 GMT""}]","2015-05-28"
"1107.4858","Antonio Bianconi","A. Bianconi, D. Di Castro, N. L. Saini, G. Bianconi","SUPERSTRIPES Self organization of quantum wires in high Tc
  superconductors","19 pages, 9 figures","""Phase Transitions and Self-Organization in Electronic and
  Molecular Networks"", edited by Thorpe, M. F. & Phillips, J. C. (Kluwer
  Academic Publishers, Boston, 2002) Fundamental Materials Research, chap. 24,
  pp. 375-388","10.1007/0-306-47113-2_24",,"cond-mat.supr-con","http://arxiv.org/licenses/nonexclusive-distrib/1.0/","  We report experimental evidence for the phase diagram of doped cuprate
superconductors as a function of the micro-strain (e) of the Cu-O bond length,
measured by Cu K-edge EXAFS, and hole doping (d). This phase diagram shows a
QCP at P(e*,d*) where for the micro-strain e larger than the critical value e*
charge-orbital-spin stripes and free carriers co-exist. The superconducting
phase occurs in the region of critical fluctuations around this QCP. The
critical temperature is function of two variables and Tc shows its maximum at
the strain driven QCP. The critical fluctuations near this strain QCP give the
self-organization of a metallic superlattice of quantum wires ""superstripes""
that favors the amplification of the critical temperature.
","[{""version"":""v1"",""created"":""Mon, 25 Jul 2011 07:45:40 GMT""}]","2011-07-26"
"1107.4859","Joachim  Kaldasch","Joachim Kaldasch, Bernhard Senge, Jozua Laven","The Impact of non-DLVO Forces on the Onset of Shear Thickening of
  Concentrated Electrically Stabilized Suspensions",,"Rheologica Acta (2009) Volume 48, Number 6, 665-672",,,"cond-mat.soft","http://arxiv.org/licenses/nonexclusive-distrib/1.0/","  This paper exposes an extension of an activation model previously published
by the authors. When particles arranged along the compression axis of a sheared
suspension, they may overcome the electrostatic repulsion and form force chains
associated with shear thickening. A percolation based consideration, allows an
estimation of the impact of the force chains on a flowing suspension. It
suggests that, similar to mode-coupling models, the suspension becomes unstable
before the critical stress evaluated from the activation model is reached. The
theory is applicable only to discontinuous shear thickening, and the
predictions are compared with results from two experimental studies on aqueous
suspensions of inorganic oxides; in one of them hydration repulsion and in the
other hydrophobic attraction can be expected. It is shown that the
incorporation of non-DLVO forces greatly improve predictions of the shear
thickening instability.
","[{""version"":""v1"",""created"":""Mon, 25 Jul 2011 07:46:22 GMT""}]","2011-07-26"
"1107.4860","Jesse Elliott","Jesse Elliott","Factoring formal power series over principal ideal domains","23 pages. Final version",,,,"math.AC math.NT","http://arxiv.org/licenses/nonexclusive-distrib/1.0/","  We provide an irreducibility test and factoring algorithm (with some
qualifications) for formal power series in the unique factorization domain
$R[[X]]$, where $R$ is any principal ideal domain. We also classify all
integral domains arising as quotient rings of $R[[X]]$. Our main tool is a
generalization of the $p$-adic Weierstrass preparation theorem to the context
of complete filtered commutative rings.
","[{""version"":""v1"",""created"":""Mon, 25 Jul 2011 07:52:59 GMT""},{""version"":""v2"",""created"":""Tue, 16 Aug 2011 09:29:11 GMT""},{""version"":""v3"",""created"":""Thu, 25 Aug 2011 00:25:18 GMT""},{""version"":""v4"",""created"":""Tue, 26 Jun 2012 20:19:19 GMT""}]","2012-06-28"
"1107.4861","Heng Lian","Heng Lian","Semiparametric Bayesian Information Criterion for Model Selection in
  Ultra-high Dimensional Additive Models",,,,,"stat.ME","http://arxiv.org/licenses/nonexclusive-distrib/1.0/","  For linear models with a diverging number of parameters, it has recently been
shown that modified versions of Bayesian information criterion (BIC) can
identify the true model consistently. However, in many cases there is little
justification that the effects of the covariates are actually linear. Thus a
semiparametric model such as the additive model studied here, is a viable
alternative. We demonstrate that theoretical results on the consistency of
BIC-type criterion can be extended to this more challenging situation, with
dimension diverging exponentially fast with sample size. Besides, the noise
assumptions are relaxed in our theoretical studies. These efforts significantly
enlarge the applicability of the criterion to a more general class of models.
","[{""version"":""v1"",""created"":""Mon, 25 Jul 2011 08:00:13 GMT""}]","2011-07-26"
"1107.4862","Akihiro Higashitani","Akihiro Higashitani","Ehrhart polynomials of integral simplices with prime volumes","11 pages",,,,"math.CO","http://arxiv.org/licenses/nonexclusive-distrib/1.0/","  For an integral convex polytope $\Pc \subset \RR^N$ of dimension $d$, we call
$\delta(\Pc)=(\delta_0, \delta_1,..., \delta_d)$ the $\delta$-vector of $\Pc$
and $\vol(\Pc)=\sum_{i=0}^d\delta_i$ its normalized volume. In this paper, we
will establish the new equalities and inequalities on $\delta$-vectors for
integral simplices whose normalized volumes are prime. Moreover, by using
those, we will classify all the possible $\delta$-vectors of integral simplices
with normalized volume 5 and 7.
","[{""version"":""v1"",""created"":""Mon, 25 Jul 2011 08:05:48 GMT""},{""version"":""v2"",""created"":""Thu, 11 Oct 2012 08:27:46 GMT""}]","2012-10-12"
"1107.4863","Otfried Guehne","Otfried G\""uhne, Bastian Jungnitsch, Tobias Moroder, Yaakov S.
  Weinstein","Multiparticle entanglement in graph-diagonal states: Necessary and
  sufficient conditions for four qubits","11 pages, 2 figures, v2: small changes","Phys. Rev. A 84, 052319 (2011)","10.1103/PhysRevA.84.052319",,"quant-ph","http://arxiv.org/licenses/nonexclusive-distrib/1.0/","  The characterization of genuine multiparticle entanglement is important for
entanglement theory as well as experimental studies related to quantum
information theory. Here, we completely characterize genuine multiparticle
entanglement for four-qubit states diagonal in the cluster-state basis. In
addition, we give a complete characterization of multiparticle entanglement for
all five-qubit graph states mixed with white noise, for states diagonal in the
basis corresponding to the five-qubit Y-shaped graph, and for a family of graph
states with an arbitrary number of qubits.
","[{""version"":""v1"",""created"":""Mon, 25 Jul 2011 08:13:53 GMT""},{""version"":""v2"",""created"":""Thu, 24 Nov 2011 10:06:13 GMT""}]","2011-11-28"
"1107.4864","Antonino Francesco Lanza","A. F. Lanza, I. Boisse, F. Bouchy, A. S. Bonomo, C. Moutou","Deriving the radial-velocity variations induced by stellar activity from
  high-precision photometry - Test on HD189733 with simultaneous MOST/SOPHIE
  data","13 pages, 7 figures, accepted to Astronomy and Astrophysics",,"10.1051/0004-6361/201117270",,"astro-ph.SR astro-ph.EP","http://arxiv.org/licenses/nonexclusive-distrib/1.0/","  Stellar activity induces apparent radial velocity (RV) variations in
late-type main-sequence stars that may hamper the detection of low-mass planets
and the measurement of their mass. We use simultaneous measurements of the
active planet host star HD189733 with high-precision optical photometry by the
MOST satellite and high-resolution spectra by SOPHIE. We apply on this unique
dataset a spot model to predict the activity-induced RV variations and compare
them with the observed ones. The model is based on the rotational modulation of
the stellar flux. A maximum entropy regularization is applied to find a unique
and stable solution for the distribution of the active regions versus stellar
longitude. The RV variations are synthesized considering the effects on the
line profiles of the brightness perturbations due to dark spots and bright
faculae and the reduction of the convective blueshifts in the active regions.
The synthesized RV time series shows a remarkably good agreement with the
observed one although variations on timescales shorter than 4-5 days cannot be
reproduced by our model. Persistent active longitudes are revealed by the spot
modelling. They rotate with slightly different periods yielding a minimum
relative amplitude of the differential rotation of \Delta \Omega / \Omega =
0.23 \pm 0.10. The method proves capable of reducing the power of the
activity-induced RV variations by a factor from 2 to 10 at the rotation
frequency and its harmonics up to the third. Thanks to the high-precision
space-borne photometry delivered by CoRoT, Kepler, or later PLATO, it is
possible to map the longitudinal distribution of active regions in late-type
stars and apply the method presented in this paper to reduce remarkably the
impact of stellar activity on their RV jitter allowing us to confirm the
detection of low-mass planets or refine the measurement of their mass.
","[{""version"":""v1"",""created"":""Mon, 25 Jul 2011 08:19:43 GMT""}]","2015-05-28"
"1107.4865","Joost Vennekens","Joost Vennekens","Actual Causation in CP-logic",,"Theory and Practice of Logic Programming, 27th Int'l. Conference
  on Logic Programming (ICLP'11) Special Issue, volume 11, issue 4-5,
  p.647-662, 2011","10.1017/S1471068411000226",,"cs.AI","http://arxiv.org/licenses/nonexclusive-distrib/1.0/","  Given a causal model of some domain and a particular story that has taken
place in this domain, the problem of actual causation is deciding which of the
possible causes for some effect actually caused it. One of the most influential
approaches to this problem has been developed by Halpern and Pearl in the
context of structural models. In this paper, I argue that this is actually not
the best setting for studying this problem. As an alternative, I offer the
probabilistic logic programming language of CP-logic. Unlike structural models,
CP-logic incorporates the deviant/default distinction that is generally
considered an important aspect of actual causation, and it has an explicitly
dynamic semantics, which helps to formalize the stories that serve as input to
an actual causation problem.
","[{""version"":""v1"",""created"":""Mon, 25 Jul 2011 08:24:50 GMT""}]","2011-07-26"
"1107.4866","Alexandre Boritchev","Alexandre Boritchev","Estimates for Solutions of a Low-Viscosity Kick-Forced Generalised
  Burgers Equation",,,,,"math.AP math-ph math.MP","http://arxiv.org/licenses/nonexclusive-distrib/1.0/","  We consider a non-homogeneous generalised Burgers equation: $$ \frac{\partial
u}{\partial t} + f'(u)\frac{\partial u}{\partial x} - \nu \frac{\partial^2
u}{\partial x^2} = \eta^{\omega},\quad t \in \R,\ x \in S^1. $$ Here, \nu is
small and positive, f is strongly convex and satisfies a growth assumption,
while \eta^{\omega} is a space-smooth random ""kicked"" forcing term. For any
solution $u$ of this equation, we consider the quasi-stationary regime,
corresponding to t>=2. After taking the ensemble average, we obtain upper
estimates as well as time-averaged lower estimates for a class of Sobolev norms
of $u$. These estimates are of the form C \nu^{-\beta} with the same values of
$\beta$ for bounds from above and from below. They depend on \eta and f, but do
not depend on the time t or the initial condition.
","[{""version"":""v1"",""created"":""Mon, 25 Jul 2011 08:40:01 GMT""},{""version"":""v2"",""created"":""Sun, 17 Mar 2013 08:04:19 GMT""},{""version"":""v3"",""created"":""Sat, 29 Jun 2013 20:52:53 GMT""}]","2013-07-02"
"1107.4867","Ana Caramete","D. Tonoiu, A.Caramete, L.A. Popa","Lookback time and Chandra constrains on cosmological parameters","10 pages, 2 figures; Romanian Reports in Physics, Volume 63, Number
  3, 2011",,,,"astro-ph.CO","http://arxiv.org/licenses/nonexclusive-distrib/1.0/","  In this paper we combine the WMAP7 with lookback time and Chandra gas
fraction data to constrain the main cosmological parameters and the equation of
state for the dark energy. We find that the lookback time is a good measurement
that can improve the determination of the equation of state for the dark energy
with regard to other external data sets. We conclude that larger lookback time
data set will further improve our determination of the cosmological parameters.
","[{""version"":""v1"",""created"":""Mon, 25 Jul 2011 08:47:03 GMT""}]","2011-07-26"
"1107.4868","Saijuan Zhang","Saijuan Zhang, Raymond J. Carroll, Douglas Midthune, Patricia M.
  Guenther, Susan M. Krebs-Smith, Victor Kipnis, Kevin W. Dodd, Dennis W.
  Buckman, Janet A. Tooze, Laurence Freedman","A new multivariate measurement error model with zero-inflated dietary
  data, and its application to dietary assessment","Published in at http://dx.doi.org/10.1214/10-AOAS446 the Annals of
  Applied Statistics (http://www.imstat.org/aoas/) by the Institute of
  Mathematical Statistics (http://www.imstat.org)","Annals of Applied Statistics 2011, Vol. 5, No. 2B, 1456-1487","10.1214/10-AOAS446","IMS-AOAS-AOAS446","stat.AP","http://arxiv.org/licenses/nonexclusive-distrib/1.0/","  In the United States the preferred method of obtaining dietary intake data is
the 24-hour dietary recall, yet the measure of most interest is usual or
long-term average daily intake, which is impossible to measure. Thus, usual
dietary intake is assessed with considerable measurement error. Also, diet
represents numerous foods, nutrients and other components, each of which have
distinctive attributes. Sometimes, it is useful to examine intake of these
components separately, but increasingly nutritionists are interested in
exploring them collectively to capture overall dietary patterns. Consumption of
these components varies widely: some are consumed daily by almost everyone on
every day, while others are episodically consumed so that 24-hour recall data
are zero-inflated. In addition, they are often correlated with each other.
Finally, it is often preferable to analyze the amount of a dietary component
relative to the amount of energy (calories) in a diet because dietary
recommendations often vary with energy level. The quest to understand overall
dietary patterns of usual intake has to this point reached a standstill. There
are no statistical methods or models available to model such complex
multivariate data with its measurement error and zero inflation. This paper
proposes the first such model, and it proposes the first workable solution to
fit such a model. After describing the model, we use survey-weighted MCMC
computations to fit the model, with uncertainty estimation coming from balanced
repeated replication.
","[{""version"":""v1"",""created"":""Mon, 25 Jul 2011 09:08:23 GMT""}]","2011-07-26"
"1107.4869","Stefan M\""uller","Stefan M\""uller","A note on the volume flux of smooth and continuous strictly contact
  isotopies","8 pages",,,,"math.SG","http://arxiv.org/licenses/nonexclusive-distrib/1.0/","  This note on the flux homomorphism for strictly contact isotopies complements
the recent paper [MS11a] by P. Spaeth and the author. We determine the volume
flux restricted to symplectic and volume-preserving contact isotopies and their
C^0-limits for some classes of symplectic and contact manifolds and for a
number of examples. In particular, we see that the restriction of the flux may
fail to be surjective. It vanishes for an isotopy preserving a regular contact
form, but can be nontrivial for non-regular contact forms. Applications are
discussed in the article cited above. We also find obstructions to regularizing
a strictly contact isotopy that are not present for Hamiltonian isotopies
[Pol01, Section 5.2] or contact isotopies [MS11b].
","[{""version"":""v1"",""created"":""Mon, 25 Jul 2011 09:20:27 GMT""}]","2011-07-26"
"1107.4870","Christoph Kloeffel","Christoph Kloeffel, Mircea Trif, Daniel Loss","Strong Spin-Orbit Interaction and Helical Hole States in Ge/Si Nanowires","8 pages, 6 figures","Phys. Rev. B 84, 195314 (2011)","10.1103/PhysRevB.84.195314",,"cond-mat.mes-hall","http://arxiv.org/licenses/nonexclusive-distrib/1.0/","  We study theoretically the low-energy hole states of Ge/Si core/shell
nanowires. The low-energy valence band is quasidegenerate, formed by two
doublets of different orbital angular momenta, and can be controlled via the
relative shell thickness and via external fields. We find that direct (dipolar)
coupling to a moderate electric field leads to an unusually large spin-orbit
interaction of Rashba type on the order of meV which gives rise to pronounced
helical states enabling electrical spin control. The system allows for quantum
dots and spin qubits with energy levels that can vary from nearly zero to
several meV, depending on the relative shell thickness.
","[{""version"":""v1"",""created"":""Mon, 25 Jul 2011 09:20:32 GMT""},{""version"":""v2"",""created"":""Mon, 5 Dec 2011 09:33:09 GMT""}]","2011-12-06"
"1107.4871","Peter Collas","Peter Collas and David Klein","Embeddings and time evolution of the Schwarzschild wormhole","Amplified exposition and added some references","Am. J. Phys. 80 (2012) 203-210","10.1119/1.3672848",,"gr-qc math-ph math.MP","http://arxiv.org/licenses/nonexclusive-distrib/1.0/","  We show how to embed spacelike slices of the Schwarzschild wormhole (or
Einstein-Rosen bridge) in R3. Graphical images of embeddings are given,
including depictions of the dynamics of this nontraversable wormhole at
constant Kruskal times up to, and beyond, the ""pinching off"" at Kruskal times
\pm1.
","[{""version"":""v1"",""created"":""Mon, 25 Jul 2011 09:27:05 GMT""},{""version"":""v2"",""created"":""Fri, 18 Nov 2011 20:01:28 GMT""}]","2015-05-28"
