"1107.4807","Piera L. Ghia","The Pierre Auger Collaboration: P. Abreu, M. Aglietta, E.J. Ahn,
  I.F.M. Albuquerque, D. Allard, I. Allekotte, J. Allen, P. Allison, J. Alvarez
  Castillo, J. Alvarez-Mu\~niz, M. Ambrosio, A. Aminaei, L. Anchordoqui, S.
  Andringa, T. Anti\v{c}i\'c, A. Anzalone, C. Aramo, E. Arganda, F. Arqueros,
  H. Asorey, P. Assis, J. Aublin, M. Ave, M. Avenier, G. Avila, T. B\""acker, M.
  Balzer, K.B. Barber, A.F. Barbosa, R. Bardenet, S.L.C. Barroso, B. Baughman,
  J. B\""auml, J.J. Beatty, B.R. Becker, K.H. Becker, A. Bell\'etoile, J.A.
  Bellido, S. BenZvi, C. Berat, X. Bertou, P.L. Biermann, P. Billoir, F.
  Blanco, M. Blanco, C. Bleve, H. Bl\""umer, M. Boh\'a\v{c}ov\'a, D. Boncioli,
  C. Bonifazi, R. Bonino, N. Borodai, J. Brack, P. Brogueira, W.C. Brown, R.
  Bruijn, P. Buchholz, A. Bueno, R.E. Burton, K.S. Caballero-Mora, L. Caramete,
  R. Caruso, A. Castellina, O. Catalano, G. Cataldi, L. Cazon, R. Cester, J.
  Chauvin, S.H. Cheng, A. Chiavassa, J.A. Chinellato, A. Chou, J. Chudoba, R.W.
  Clay, M.R. Coluccia, R. Concei\c{c}\~ao, F. Contreras, H. Cook, M.J. Cooper,
  J. Coppens, A. Cordier, U. Cotti, S. Coutu, C.E. Covault, A. Creusot, A.
  Criss, J. Cronin, A. Curutiu, S. Dagoret-Campagne, R. Dallier, S. Dasso, K.
  Daumiller, B.R. Dawson, R.M. de Almeida, M. De Domenico, C. De Donato, S.J.
  de Jong, G. De La Vega, W.J.M. de Mello Junior, J.R.T. de Mello Neto, I. De
  Mitri, V. de Souza, K.D. de Vries, G. Decerprit, L. del Peral, O. Deligny, H.
  Dembinski, N. Dhital, C. Di Giulio, J.C. Diaz, M.L. D\'iaz Castro, P.N. Diep,
  C. Dobrigkeit, W. Docters, J.C. D'Olivo, P.N. Dong, A. Dorofeev, J.C. dos
  Anjos, M.T. Dova, D. D'Urso, I. Dutan, J. Ebr, R. Engel, M. Erdmann, C.O.
  Escobar, A. Etchegoyen, P. Facal San Luis, I. Fajardo Tapia, H. Falcke, G.
  Farrar, A.C. Fauth, N. Fazzini, A.P. Ferguson, A. Ferrero, B. Fick, A.
  Filevich, A. Filip\v{c}i\v{c}, S. Fliescher, C.E. Fracchiolla, E.D. Fraenkel,
  U. Fr\""ohlich, B. Fuchs, R. Gaior, R.F. Gamarra, S. Gambetta, B. Garc\'ia, D.
  Garc\'ia G\'amez, D. Garcia-Pinto, A. Gascon, H. Gemmeke, K. Gesterling, P.L.
  Ghia, U. Giaccari, M. Giller, H. Glass, M.S. Gold, G. Golup, F. Gomez
  Albarracin, M. G\'omez Berisso, P. Gon\c{c}alves, D. Gonzalez, J.G. Gonzalez,
  B. Gookin, D. G\'ora, A. Gorgi, P. Gouffon, S.R. Gozzini, E. Grashorn, S.
  Grebe, N. Griffith, M. Grigat, A.F. Grillo, Y. Guardincerri, F. Guarino, G.P.
  Guedes, A. Guzman, J.D. Hague, P. Hansen, D. Harari, S. Harmsma, J.L. Harton,
  A. Haungs, T. Hebbeker, D. Heck, A.E. Herve, C. Hojvat, N. Hollon, V.C.
  Holmes, P. Homola, J.R. H\""orandel, A. Horneffer, M. Hrabovsk\'y, T. Huege,
  A. Insolia, F. Ionita, A. Italiano, C. Jarne, S. Jiraskova, M. Josebachuili,
  K. Kadija, K.-H. Kampert, P. Karhan, P. Kasper, B. K\'egl, B. Keilhauer, A.
  Keivani, J.L. Kelley, E. Kemp, R.M. Kieckhafer, H.O. Klages, M. Kleifges, J.
  Kleinfeller, J. Knapp, D.-H. Koang, K. Kotera, N. Krohm, O. Kr\""omer, D.
  Kruppke-Hansen, F. Kuehn, D. Kuempel, J.K. Kulbartz, N. Kunka, G. La Rosa, C.
  Lachaud, P. Lautridou, M.S.A.B. Le\~ao, D. Lebrun, P. Lebrun, M.A. Leigui de
  Oliveira, A. Lemiere, A. Letessier-Selvon, I. Lhenry-Yvon, K. Link, R.
  L\'opez, A. Lopez Ag\""uera, K. Louedec, J. Lozano Bahilo, A. Lucero, M.
  Ludwig, H. Lyberis, M.C. Maccarone, C. Macolino, S. Maldera, D. Mandat, P.
  Mantsch, A.G. Mariazzi, J. Marin, V. Marin, I.C. Maris, H.R. Marquez Falcon,
  G. Marsella, D. Martello, L. Martin, H. Martinez, O. Mart\'inez Bravo, H.J.
  Mathes, J. Matthews, J.A.J. Matthews, G. Matthiae, D. Maurizio, P.O. Mazur,
  G. Medina-Tanco, M. Melissas, D. Melo, E. Menichetti, A. Menshikov, P.
  Mertsch, C. Meurer, S. Mi\'canovi\'c, M.I. Micheletti, W. Miller, L.
  Miramonti, S. Mollerach, M. Monasor, D. Monnier Ragaigne, F. Montanet, B.
  Morales, C. Morello, E. Moreno, J.C. Moreno, C. Morris, M. Mostaf\'a, C.A.
  Moura, S. Mueller, M.A. Muller, G. M\""uller, M. M\""unchmeyer, R. Mussa, G.
  Navarra, J.L. Navarro, S. Navas, P. Necesal, L. Nellen, A. Nelles, J. Neuser,
  P.T. Nhung, L. Niemietz, N. Nierstenhoefer, D. Nitz, D. Nosek, L. No\v{z}ka,
  M. Nyklicek, J. Oehlschl\""ager, A. Olinto, V.M. Olmos-Gilbaja, M. Ortiz, N.
  Pacheco, D. Pakk Selmi-Dei, M. Palatka, J. Pallotta, N. Palmieri, G. Parente,
  E. Parizot, A. Parra, R.D. Parsons, S. Pastor, T. Paul, M. Pech, J.
  P\c{e}kala, R. Pelayo, I.M. Pepe, L. Perrone, R. Pesce, E. Petermann, S.
  Petrera, P. Petrinca, A. Petrolini, Y. Petrov, J. Petrovic, C. Pfendner, N.
  Phan, R. Piegaia, T. Pierog, P. Pieroni, M. Pimenta, V. Pirronello, M.
  Platino, V.H. Ponce, M. Pontz, P. Privitera, M. Prouza, E.J. Quel, S.
  Querchfeld, J. Rautenberg, O. Ravel, D. Ravignani, B. Revenu, J. Ridky, S.
  Riggi, M. Risse, P. Ristori, H. Rivera, V. Rizi, J. Roberts, C. Robledo, W.
  Rodrigues de Carvalho, G. Rodriguez, J. Rodriguez Martino, J. Rodriguez Rojo,
  I. Rodriguez-Cabo, M.D. Rodr\'iguez-Fr\'ias, G. Ros, J. Rosado, T. Rossler,
  M. Roth, B. Rouill\'e-d'Orfeuil, E. Roulet, A.C. Rovero, C. R\""uhle, F.
  Salamida, H. Salazar, G. Salina, F. S\'anchez, M. Santander, C.E. Santo, E.
  Santos, E.M. Santos, F. Sarazin, B. Sarkar, S. Sarkar, R. Sato, N. Scharf, V.
  Scherini, H. Schieler, P. Schiffer, A. Schmidt, F. Schmidt, O. Scholten, H.
  Schoorlemmer, J. Schovancova, P. Schov\'anek, F. Schr\""oder, S. Schulte, D.
  Schuster, S.J. Sciutto, M. Scuderi, A. Segreto, M. Settimo, A. Shadkam, R.C.
  Shellard, I. Sidelnik, G. Sigl, H.H. Silva Lopez, A. \'Smia{\l} kowski, R.
  \v{S}m\'ida, G.R. Snow, P. Sommers, J. Sorokin, H. Spinka, R. Squartini, S.
  Stanic, J. Stapleton, J. Stasielak, M. Stephan, E. Strazzeri, A. Stutz, F.
  Suarez, T. Suomij\""arvi, A.D. Supanitsky, T. \v{S}u\v{s}a, M.S. Sutherland,
  J. Swain, Z. Szadkowski, M. Szuba, A. Tamashiro, A. Tapia, M. Tartare, O.
  Ta\c{s}c\u{a}u, C.G. Tavera Ruiz, R. Tcaciuc, D. Tegolo, N.T. Thao, D.
  Thomas, J. Tiffenberg, C. Timmermans D.K. Tiwari, W. Tkaczyk, C.J. Todero
  Peixoto, B. Tom\'e, A. Tonachini, P. Travnicek, D.B. Tridapalli, G. Tristram,
  E. Trovato, M. Tueros, R. Ulrich, M. Unger, M. Urban, J.F. Vald\'es Galicia,
  I. Vali\~no, L. Valore, A.M. van den Berg, E. Varela, B. Vargas C\'ardenas,
  J.R. V\'azquez, R.A. V\'azquez, D. Veberi\v{c}, V. Verzi, J. Vicha, M.
  Videla, L. Villase\~nor, H. Wahlberg, P. Wahrlich, O. Wainberg, D. Walz, D.
  Warner, A.A. Watson, M. Weber, K. Weidenhaupt, A. Weindl, S. Westerhoff, B.J.
  Whelan, G. Wieczorek, L. Wiencke, B. Wilczy\'nska, H. Wilczy\'nski, M. Will,
  C. Williams, T. Winchen, L. Winders, M.G. Winnick, M. Wommer, B. Wundheiler,
  T. Yamamoto, T. Yapici, P. Younk, G. Yuan, A. Yushkov, B. Zamorano, E. Zas,
  D. Zavrtanik, M. Zavrtnik, I. Zaw, A. Zepeda, M. Zimbres-Silva, M. Ziolkowski","The Pierre Auger Observatory V: Enhancements","Contributions to 32nd International Cosmic Ray Conference, Beijing,
  China, August 2011",,"10.1088/1742-6596/375/1/052006",,"astro-ph.IM astro-ph.HE hep-ex physics.ins-det","http://arxiv.org/licenses/nonexclusive-distrib/1.0/","  Ongoing and planned enhancements of the Pierre Auger Observatory
","[{""version"":""v1"",""created"":""Sun, 24 Jul 2011 22:00:22 GMT""}]","2015-05-28"
"1107.4808","Sergey Balashev","S. A. Balashev, P. Petitjean, A. V. Ivanchik, C. Ledoux, R. Srianand,
  P. Noterdaeme, D. A. Varshalovich","Partial coverage of the Broad Line Region of Q1232+082 by an intervening
  H2-bearing cloud","15 pages, 15 figures, Accepted for publication in MNRAS",,"10.1111/j.1365-2966.2011.19489.x",,"astro-ph.CO","http://arxiv.org/licenses/nonexclusive-distrib/1.0/","  We present a detailed analysis of the partial coverage of the Q1232+082 (z_em
=2.57) broad line region by an intervening H_2-bearing cloud at z_abs=2.3377.
Using curve of growth analysis and line profile fitting, we demonstrate that
the H_2-bearing component of the cloud covers the QSO intrinsic continuum
source completely but only part of the Broad Line Region (BLR). We find that
only 48\pm6 % of the C IV BLR emission is covered by the C I absorbing gas. We
observe residual light (~6 %) as well in the bottom of the O I {\lambda}1302
absorption from the cloud, redshifted on top of the QSO Lyman-{\alpha} emission
line. Therefore the extent of the neutral phase of the absorbing cloud is not
large enough to cover all of the background source. The most likely explanation
for this partial coverage is the small size of the intervening cloud, which is
comparable to the BLR size. We estimate the number densities in the cloud:
n_H2~110 cm^{-3} for the H_2-bearing core and n_H ~30 cm^{-3} for the neutral
envelope. Given the column densities, N(H2)=(3.71\pm0.97)\times10^19 cm^{-2}
and N(H I)=(7.94\pm1.6)\times10^20 cm^{-2}, we derive the linear size of the
H_2-bearing core and the neutral envelope along the line of sight to be
l_H2~0.15^{+0.05}_{-0.05} pc and l_HI~8.2^{+6.5}_{-4.1} pc, respectively. We
estimate the size of the C IV BLR by two ways (i) extrapolating size-luminosity
relations derived from reverberation observations and (ii) assuming that the
H_2-bearing core and the BLR are spherical in shape and the results are ~0.26
and ~0.18 pc, respectively. The large size we derive for the extent of the
neutral phase of the absorbing cloud together with a covering factor of ~0.94
of the Lyman-{\alpha} emission means that the Lyman-{\alpha} BLR is probably
fully covered but that the Lyman-{\alpha} emission extends well beyond the
limits of the BLR.
","[{""version"":""v1"",""created"":""Sun, 24 Jul 2011 22:01:24 GMT""}]","2015-05-28"
"1107.4809","Piera L. Ghia","The Pierre Auger Collaboration: P. Abreu, M. Aglietta, E.J. Ahn,
  I.F.M. Albuquerque, D. Allard, I. Allekotte, J. Allen, P. Allison, J. Alvarez
  Castillo, J. Alvarez-Mu\~niz, M. Ambrosio, A. Aminaei, L. Anchordoqui, S.
  Andringa, T. Anti\v{c}i\'c, A. Anzalone, C. Aramo, E. Arganda, F. Arqueros,
  H. Asorey, P. Assis, J. Aublin, M. Ave, M. Avenier, G. Avila, T. B\""acker, M.
  Balzer, K.B. Barber, A.F. Barbosa, R. Bardenet, S.L.C. Barroso, B. Baughman,
  J. B\""auml, J.J. Beatty, B.R. Becker, K.H. Becker, A. Bell\'etoile, J.A.
  Bellido, S. BenZvi, C. Berat, X. Bertou, P.L. Biermann, P. Billoir, F.
  Blanco, M. Blanco, C. Bleve, H. Bl\""umer, M. Boh\'a\v{c}ov\'a, D. Boncioli,
  C. Bonifazi, R. Bonino, N. Borodai, J. Brack, P. Brogueira, W.C. Brown, R.
  Bruijn, P. Buchholz, A. Bueno, R.E. Burton, K.S. Caballero-Mora, L. Caramete,
  R. Caruso, A. Castellina, O. Catalano, G. Cataldi, L. Cazon, R. Cester, J.
  Chauvin, S.H. Cheng, A. Chiavassa, J.A. Chinellato, A. Chou, J. Chudoba, R.W.
  Clay, M.R. Coluccia, R. Concei\c{c}\~ao, F. Contreras, H. Cook, M.J. Cooper,
  J. Coppens, A. Cordier, U. Cotti, S. Coutu, C.E. Covault, A. Creusot, A.
  Criss, J. Cronin, A. Curutiu, S. Dagoret-Campagne, R. Dallier, S. Dasso, K.
  Daumiller, B.R. Dawson, R.M. de Almeida, M. De Domenico, C. De Donato, S.J.
  de Jong, G. De La Vega, W.J.M. de Mello Junior, J.R.T. de Mello Neto, I. De
  Mitri, V. de Souza, K.D. de Vries, G. Decerprit, L. del Peral, O. Deligny, H.
  Dembinski, N. Dhital, C. Di Giulio, J.C. Diaz, M.L. D\'iaz Castro, P.N. Diep,
  C. Dobrigkeit, W. Docters, J.C. D'Olivo, P.N. Dong, A. Dorofeev, J.C. dos
  Anjos, M.T. Dova, D. D'Urso, I. Dutan, J. Ebr, R. Engel, M. Erdmann, C.O.
  Escobar, A. Etchegoyen, P. Facal San Luis, I. Fajardo Tapia, H. Falcke, G.
  Farrar, A.C. Fauth, N. Fazzini, A.P. Ferguson, A. Ferrero, B. Fick, A.
  Filevich, A. Filip\v{c}i\v{c}, S. Fliescher, C.E. Fracchiolla, E.D. Fraenkel,
  U. Fr\""ohlich, B. Fuchs, R. Gaior, R.F. Gamarra, S. Gambetta, B. Garc\'ia, D.
  Garc\'ia G\'amez, D. Garcia-Pinto, A. Gascon, H. Gemmeke, K. Gesterling, P.L.
  Ghia, U. Giaccari, M. Giller, H. Glass, M.S. Gold, G. Golup, F. Gomez
  Albarracin, M. G\'omez Berisso, P. Gon\c{c}alves, D. Gonzalez, J.G. Gonzalez,
  B. Gookin, D. G\'ora, A. Gorgi, P. Gouffon, S.R. Gozzini, E. Grashorn, S.
  Grebe, N. Griffith, M. Grigat, A.F. Grillo, Y. Guardincerri, F. Guarino, G.P.
  Guedes, A. Guzman, J.D. Hague, P. Hansen, D. Harari, S. Harmsma, J.L. Harton,
  A. Haungs, T. Hebbeker, D. Heck, A.E. Herve, C. Hojvat, N. Hollon, V.C.
  Holmes, P. Homola, J.R. H\""orandel, A. Horneffer, M. Hrabovsk\'y, T. Huege,
  A. Insolia, F. Ionita, A. Italiano, C. Jarne, S. Jiraskova, M. Josebachuili,
  K. Kadija, K.-H. Kampert, P. Karhan, P. Kasper, B. K\'egl, B. Keilhauer, A.
  Keivani, J.L. Kelley, E. Kemp, R.M. Kieckhafer, H.O. Klages, M. Kleifges, J.
  Kleinfeller, J. Knapp, D.-H. Koang, K. Kotera, N. Krohm, O. Kr\""omer, D.
  Kruppke-Hansen, F. Kuehn, D. Kuempel, J.K. Kulbartz, N. Kunka, G. La Rosa, C.
  Lachaud, P. Lautridou, M.S.A.B. Le\~ao, D. Lebrun, P. Lebrun, M.A. Leigui de
  Oliveira, A. Lemiere, A. Letessier-Selvon, I. Lhenry-Yvon, K. Link, R.
  L\'opez, A. Lopez Ag\""uera, K. Louedec, J. Lozano Bahilo, A. Lucero, M.
  Ludwig, H. Lyberis, M.C. Maccarone, C. Macolino, S. Maldera, D. Mandat, P.
  Mantsch, A.G. Mariazzi, J. Marin, V. Marin, I.C. Maris, H.R. Marquez Falcon,
  G. Marsella, D. Martello, L. Martin, H. Martinez, O. Mart\'inez Bravo, H.J.
  Mathes, J. Matthews, J.A.J. Matthews, G. Matthiae, D. Maurizio, P.O. Mazur,
  G. Medina-Tanco, M. Melissas, D. Melo, E. Menichetti, A. Menshikov, P.
  Mertsch, C. Meurer, S. Mi\'canovi\'c, M.I. Micheletti, W. Miller, L.
  Miramonti, S. Mollerach, M. Monasor, D. Monnier Ragaigne, F. Montanet, B.
  Morales, C. Morello, E. Moreno, J.C. Moreno, C. Morris, M. Mostaf\'a, C.A.
  Moura, S. Mueller, M.A. Muller, G. M\""uller, M. M\""unchmeyer, R. Mussa, G.
  Navarra, J.L. Navarro, S. Navas, P. Necesal, L. Nellen, A. Nelles, J. Neuser,
  P.T. Nhung, L. Niemietz, N. Nierstenhoefer, D. Nitz, D. Nosek, L. No\v{z}ka,
  M. Nyklicek, J. Oehlschl\""ager, A. Olinto, V.M. Olmos-Gilbaja, M. Ortiz, N.
  Pacheco, D. Pakk Selmi-Dei, M. Palatka, J. Pallotta, N. Palmieri, G. Parente,
  E. Parizot, A. Parra, R.D. Parsons, S. Pastor, T. Paul, M. Pech, J.
  P\c{e}kala, R. Pelayo, I.M. Pepe, L. Perrone, R. Pesce, E. Petermann, S.
  Petrera, P. Petrinca, A. Petrolini, Y. Petrov, J. Petrovic, C. Pfendner, N.
  Phan, R. Piegaia, T. Pierog, P. Pieroni, M. Pimenta, V. Pirronello, M.
  Platino, V.H. Ponce, M. Pontz, P. Privitera, M. Prouza, E.J. Quel, S.
  Querchfeld, J. Rautenberg, O. Ravel, D. Ravignani, B. Revenu, J. Ridky, S.
  Riggi, M. Risse, P. Ristori, H. Rivera, V. Rizi, J. Roberts, C. Robledo, W.
  Rodrigues de Carvalho, G. Rodriguez, J. Rodriguez Martino, J. Rodriguez Rojo,
  I. Rodriguez-Cabo, M.D. Rodr\'iguez-Fr\'ias, G. Ros, J. Rosado, T. Rossler,
  M. Roth, B. Rouill\'e-d'Orfeuil, E. Roulet, A.C. Rovero, C. R\""uhle, F.
  Salamida, H. Salazar, G. Salina, F. S\'anchez, M. Santander, C.E. Santo, E.
  Santos, E.M. Santos, F. Sarazin, B. Sarkar, S. Sarkar, R. Sato, N. Scharf, V.
  Scherini, H. Schieler, P. Schiffer, A. Schmidt, F. Schmidt, O. Scholten, H.
  Schoorlemmer, J. Schovancova, P. Schov\'anek, F. Schr\""oder, S. Schulte, D.
  Schuster, S.J. Sciutto, M. Scuderi, A. Segreto, M. Settimo, A. Shadkam, R.C.
  Shellard, I. Sidelnik, G. Sigl, H.H. Silva Lopez, A. \'Smia{\l} kowski, R.
  \v{S}m\'ida, G.R. Snow, P. Sommers, J. Sorokin, H. Spinka, R. Squartini, S.
  Stanic, J. Stapleton, J. Stasielak, M. Stephan, E. Strazzeri, A. Stutz, F.
  Suarez, T. Suomij\""arvi, A.D. Supanitsky, T. \v{S}u\v{s}a, M.S. Sutherland,
  J. Swain, Z. Szadkowski, M. Szuba, A. Tamashiro, A. Tapia, M. Tartare, O.
  Ta\c{s}c\u{a}u, C.G. Tavera Ruiz, R. Tcaciuc, D. Tegolo, N.T. Thao, D.
  Thomas, J. Tiffenberg, C. Timmermans D.K. Tiwari, W. Tkaczyk, C.J. Todero
  Peixoto, B. Tom\'e, A. Tonachini, P. Travnicek, D.B. Tridapalli, G. Tristram,
  E. Trovato, M. Tueros, R. Ulrich, M. Unger, M. Urban, J.F. Vald\'es Galicia,
  I. Vali\~no, L. Valore, A.M. van den Berg, E. Varela, B. Vargas C\'ardenas,
  J.R. V\'azquez, R.A. V\'azquez, D. Veberi\v{c}, V. Verzi, J. Vicha, M.
  Videla, L. Villase\~nor, H. Wahlberg, P. Wahrlich, O. Wainberg, D. Walz, D.
  Warner, A.A. Watson, M. Weber, K. Weidenhaupt, A. Weindl, S. Westerhoff, B.J.
  Whelan, G. Wieczorek, L. Wiencke, B. Wilczy\'nska, H. Wilczy\'nski, M. Will,
  C. Williams, T. Winchen, L. Winders, M.G. Winnick, M. Wommer, B. Wundheiler,
  T. Yamamoto, T. Yapici, P. Younk, G. Yuan, A. Yushkov, B. Zamorano, E. Zas,
  D. Zavrtanik, M. Zavrtnik, I. Zaw, A. Zepeda, M. Zimbres-Silva, M. Ziolkowski","The Pierre Auger Observatory I: The Cosmic Ray Energy Spectrum and
  Related Measurements","Contributions to the 32nd International Cosmic Ray Conference,
  Beijing, China, August 2011",,,,"astro-ph.HE hep-ex","http://arxiv.org/licenses/nonexclusive-distrib/1.0/","  Studies of the cosmic ray energy spectrum at the highest energies with the
Pierre Auger Observatory
","[{""version"":""v1"",""created"":""Sun, 24 Jul 2011 22:01:57 GMT""}]","2011-07-26"
"1107.4810","Ronald Caplan","Ronald M. Caplan and Ricardo Carretero-Gonz\'alez","Numerical Stability of Explicit Runge-Kutta Finite-Difference Schemes
  for the Nonlinear Schr\""odinger Equation","21 pages, 6 figures",,,,"cs.NA","http://arxiv.org/licenses/nonexclusive-distrib/1.0/","  Linearized numerical stability bounds for solving the nonlinear
time-dependent Schr\""odinger equation (NLSE) using explicit finite-differencing
are shown. The bounds are computed for the fourth-order Runge-Kutta scheme in
time and both second-order and fourth-order central differencing in space.
Results are given for Dirichlet, modulus-squared Dirichlet, Laplacian-zero, and
periodic boundary conditions for one, two, and three dimensions. Our approach
is to use standard Runge-Kutta linear stability theory, treating the
nonlinearity of the NLSE as a constant. The required bounds on the eigenvalues
of the scheme matrices are found analytically when possible, and otherwise
estimated using the Gershgorin circle theorem.
","[{""version"":""v1"",""created"":""Sun, 24 Jul 2011 22:08:52 GMT""},{""version"":""v2"",""created"":""Thu, 25 Aug 2011 19:12:54 GMT""},{""version"":""v3"",""created"":""Sun, 1 Jul 2012 20:58:31 GMT""},{""version"":""v4"",""created"":""Tue, 1 Jan 2013 07:52:08 GMT""}]","2013-01-03"
"1107.4811","Andres Larrain-Hubach","Andres Larrain-Hubach","K-Theories for Certain Infinite Rank Bundles",,,,,"math.KT","http://arxiv.org/licenses/nonexclusive-distrib/1.0/","  Several authors have recently constructed characteristic classes for classes
of infinite rank vector bundles appearing in topology and physics. These
include the tangent bundle to the space of maps between closed manifolds, the
infinite rank bundles in the families index theorem, and bundles with
pseudodifferential operators as structure group. In this paper, we construct
the corresponding K-theories for these types of bundles. We develop the
formalism of these theories and use their Chern character to detect a large
class of nontrivial elements.
","[{""version"":""v1"",""created"":""Sun, 24 Jul 2011 22:29:22 GMT""}]","2011-07-26"
"1107.4812","Alexander Woo","Christopher Conklin and Alexander Woo","Bruhat graphs and pattern avoidance","8 pages; new version adds torus characterization and deletes section
  on length whose results had previously appeared in literature","Journal of Combinatorics 6 (2015), 91--102",,,"math.CO","http://arxiv.org/licenses/nonexclusive-distrib/1.0/","  We characterize permutations whose Bruhat graphs can be drawn in the plane
and those whose Bruhat graphs can be drawn in the torus. In particular, we show
these properties are characterized by avoiding finitely many permutations.
","[{""version"":""v1"",""created"":""Sun, 24 Jul 2011 22:42:19 GMT""},{""version"":""v2"",""created"":""Fri, 19 Jul 2013 00:49:22 GMT""}]","2017-01-13"
"1107.4813","Thierry Botter","Thierry Botter, Daniel W. C. Brooks, Nathan Brahms, Sydney Schreppler,
  and Dan M. Stamper-Kurn","Linear Amplifier Model for Optomechanical Systems","10 pages, 8 figures","Phys. Rev. A 85, 013812 (2012)","10.1103/PhysRevA.85.013812",,"quant-ph","http://arxiv.org/licenses/nonexclusive-distrib/1.0/","  We model optomechanical systems as linear optical amplifiers. This provides a
unified treatment of diverse optomechanical phenomena. We emphasize, in
particular, the relationship between ponderomotive squeezing and
optomechanically induced transparency, two foci of current research. We
characterize the amplifier response to quantum and deliberately applied
fluctuations, both optical and mechanical. Further, we apply these results to
establish quantum limits on external force sensing both on and off cavity
resonance. We find that the maximum sensitivity attained on resonance
constitutes an absolute upper limit, not surpassed when detuning off cavity
resonance. The theory can be extended to a two-sided cavity with losses and
limited detection efficiency.
","[{""version"":""v1"",""created"":""Sun, 24 Jul 2011 23:04:26 GMT""},{""version"":""v2"",""created"":""Tue, 29 Nov 2011 21:56:00 GMT""},{""version"":""v3"",""created"":""Thu, 19 Jan 2012 03:05:43 GMT""}]","2013-01-22"
"1107.4814","Daniel M. Pellegrino","G. A. Mu\~noz-Fern\'andez, D. Pellegrino and J. B. Seoane-Sep\'ulveda","Estimates for the asymptotic behavior of the constants in the
  Bohnenblust--Hille inequality","7 pages","Linear and Multilinear Algebra 60 (2012) 573-582",,,"math.FA","http://arxiv.org/licenses/nonexclusive-distrib/1.0/","  A classical inequality due to H.F. Bohnenblust and E. Hille states that for
every positive integer $n$ there is a constant $C_{n}>0$ so that
$$(\sum\limits_{i_{1},...,i_{n}=1}^{N}|U(e_{i_{^{1}}},...,e_{i_{n}})|^{\frac{2n}{n+1}})^{\frac{n+1}{2n}}\leq
C_{n}||U||$$ for every positive integer $N$ and every $n$-linear mapping
$U:\ell_{\infty}^{N}\times...\times\ell_{\infty}^{N}\rightarrow\mathbb{C}$. The
original estimates for those constants from Bohnenblust and Hille are
$$C_{n}=n^{\frac{n+1}{2n}}2^{\frac{n-1}{2}}.$$ In this note we present explicit
formulae for quite better constants, and calculate the asymptotic behavior of
these estimates, completing recent results of the second and third authors. For
example, we show that, if $C_{\mathbb{R},n}$ and $C_{\mathbb{C},n}$ denote
(respectively) these estimates for the real and complex Bohnenblust--Hille
inequality then, for every even positive integer $n$,
$$\frac{C_{\mathbb{R},n}}{\sqrt{\pi}} = \frac{C_{\mathbb{C},n}}{\sqrt{2}} =
2^{\frac{n+2}{8}}\cdot r_n$$ for a certain sequence $\{r_n\}$ which we estimate
numerically to belong to the interval $(1,3/2)$ (the case $n$ odd is similar).
Simultaneously, assuming that $\{r_n\}$ is in fact convergent, we also conclude
that $$\displaystyle \lim_{n \rightarrow \infty}
\frac{C_{\mathbb{R},n}}{C_{\mathbb{R},n-1}} = \displaystyle \lim_{n \rightarrow
\infty} \frac{C_{\mathbb{C},n}}{C_{\mathbb{C},n-1}}= 2^{1/8}.$$
","[{""version"":""v1"",""created"":""Sun, 24 Jul 2011 23:52:30 GMT""}]","2012-08-30"
"1107.4815","Srikanth Iyengar","Dave Benson, Srikanth B. Iyengar, Henning Krause","Representations of finite groups: Local cohomology and support","112 pages. To appear in the Oberwolfach Seminar series, published by
  Birkhauser. Comments welcome",,,,"math.RT math.AC","http://arxiv.org/licenses/nonexclusive-distrib/1.0/","  These are the notes from an Oberwolfach Seminar which we ran from 23--29 May
2010.
","[{""version"":""v1"",""created"":""Sun, 24 Jul 2011 23:58:20 GMT""}]","2011-07-26"
"1107.4816","Martin Richarte MR","Luis P. Chimento and Mart\'in G. Richarte","Interacting dark matter and modified holographic Ricci dark energy
  induce a relaxed Chaplygin gas","8 pages, 7 figures. Revtex4 Style. Accepted for its publication in
  PRD","Phys. Rev. D 84, 123507 (2011) [8 pages]","10.1103/PhysRevD.84.123507",,"astro-ph.CO gr-qc hep-th","http://arxiv.org/licenses/nonexclusive-distrib/1.0/","  We investigate a model of interacting dark matter and dark energy given by a
modified holographic Ricci cutoff in a spatially flat
Friedmann-Robertson-Walker (FRW) space-time. We consider a nonlinear
interaction consisting of a significant rational function of the total energy
density and its first derivative homogeneous of degree one and show that the
effective one-fluid obeys the equation of state of a relaxed Chaplygin gas. So
that, the universe is dominated by pressureless dark matter at early times and
undergoes an accelerated expansion in the far future driven by a strong
negative pressure. We apply the $\chi^{2}$-statistical method to the
observational Hubble data and the Union2 compilation of SNe Ia for constraining
the cosmological parameters and analyze the feasibility of the modified
holographic Ricci cutoff. By using the new $Om$ diagnostic method, we find that
the effective model differs substantially from the $\Lambda$--CDM one, because
it gets the accelerated expansion faster than the $\Lambda$--CDM model.
Finally, a new model with a third component decoupled from the interacting dark
sector is presented for studying bounds on the dark energy at early times.
","[{""version"":""v1"",""created"":""Mon, 25 Jul 2011 00:08:44 GMT""},{""version"":""v2"",""created"":""Wed, 10 Aug 2011 13:10:58 GMT""},{""version"":""v3"",""created"":""Sat, 24 Dec 2011 22:17:35 GMT""}]","2011-12-30"
