"1107.4931","Can Ba\c{s}kent","Can Baskent","A Logic for Strategy Updates",,,,,"cs.GT cs.LO","http://creativecommons.org/licenses/by-nc-sa/3.0/","  Notion of strategy in game theory is static and presumably constructed before
the game play. The static, pre-determined notion of strategies falls short
analyzing perfect information games. Because, we, people, do not strategize as
such even in perfect information games - largely because we are not logically
omniscient, and we have limited computational power and bounded memory. In this
paper, we focus on what we call move updates where some moves become
unavailable during the game. Our goal here is to present a formal framework for
move based strategy restrictions extending strategy logic which was introduced
by Ramanujam and Simon. In this paper, we present a dynamic version of strategy
logic, prove its completeness and decidability along with the decidability of
the strategy logic which was an open problem so far. We also present an
analysis of centipede by using our logic.
","[{""version"":""v1"",""created"":""Mon, 25 Jul 2011 13:02:43 GMT""}]","2011-07-26"
"1107.4932","Can Ba\c{s}kent","Can Baskent","Homotopies in Classical and Paraconsistent Modal Logics",,,,,"math.LO cs.LO","http://creativecommons.org/licenses/by-nc-sa/3.0/","  Topological semantics for modal logics has recently gained new momentum in
many different branches of logic. In this paper, we will consider the
topological semantics of both classical and paraconsistent modal logics.
  This work is a new step in the research program that focuses on
paraconsistent systems from geometric and topological point of view. Here, we
discuss the functional transformations in paraconsistent and classical modal
cases: how to transform one classical or paraconsistent topological model to
another, how to transform one transformation to another in a validity
preserving way. Furthermore, we also suggest a measure to keep track of such
change.
","[{""version"":""v1"",""created"":""Mon, 25 Jul 2011 13:06:33 GMT""}]","2011-08-19"
"1107.4933","Tomoya Machide","T. Machide","An Elliptic Analogue Of Generalized Cotangent Dirichlet Series And Its
  Transformation Formulae At Some Integer Arguments","34pages",,,,"math.NT","http://arxiv.org/licenses/nonexclusive-distrib/1.0/","  B.C. Berndt evaluated special values of the cotangent Dirichlet series. T.
Arakawa studied a generalization of the series, or generalized cotangent
Dirichlet series, and gave its transformation formulae. In this paper, we
establish an elliptic analogue of the generalized cotangent Dirichlet series
and give its transformation formulae at some integer arguments. As a corollary,
we obtain the transformation formulae of the generalized cotangent Dirichlet
series at some integer arguments which are the part of Arakawa's transformation
formulae. Those transformation formulae give the special values of the
cotangent Dirichlet series evaluated by B.C. Berndt.
","[{""version"":""v1"",""created"":""Mon, 25 Jul 2011 13:08:01 GMT""}]","2011-07-26"
"1107.4934","Robert Filter","Robert Filter, Jing Qi, Carsten Rockstuhl, Falk Lederer","Circular Optical Nanoantennas: An Analytical Theory",,"Physical Review B 85, 125429 (2012)","10.1103/PhysRevB.85.125429",,"physics.optics","http://arxiv.org/licenses/nonexclusive-distrib/1.0/","  An entirely analytical theory is provided for describing the resonance
properties of optical nanoantennas made of a stack of homogeneous discs, i.e.
circular patch nanoantennas. It consists in analytically calculating the phase
accumulation of surface plasmon polaritons across the resonator and an
additional contribution from the complex reflection coefficient at the antenna
termination. This makes the theory self-contained with no need for fitting
parameters. The very antenna resonances are then explained by a simple
Fabry-Perot resonator model. Predictions are compared to rigorous simulations
and show excellent agreement. Using this analytical model, circular antennas
can be tuned by varying the composition of the stack.
","[{""version"":""v1"",""created"":""Mon, 25 Jul 2011 13:11:01 GMT""},{""version"":""v2"",""created"":""Thu, 22 Mar 2012 13:58:47 GMT""},{""version"":""v3"",""created"":""Thu, 14 Jun 2012 21:10:03 GMT""}]","2012-06-18"
"1107.4935","Can Ba\c{s}kent","Can Baskent","Public Announcement Logic in Geometric Frameworks",,,,,"cs.LO cs.GT cs.MA","http://creativecommons.org/licenses/by-nc-sa/3.0/","  In this paper we introduce public announcement logic in different geometric
frameworks. First, we consider topological models, and then extend our
discussion to a more expressive model, namely, subset space models.
Furthermore, we prove the completeness of public announcement logic in those
frameworks. Moreover, we apply our results to different issues: announcement
stabilization, backward induction and persistence.
","[{""version"":""v1"",""created"":""Mon, 25 Jul 2011 13:11:42 GMT""},{""version"":""v2"",""created"":""Thu, 18 Aug 2011 07:44:19 GMT""}]","2011-08-19"
"1107.4936","Martin Horsch","Jonathan Walter and Stephan Deublein and Steffen Reiser and Martin
  Horsch and Jadran Vrabec and Hans Hasse","Atomistic simulations of electrolyte solutions and hydrogels with
  explicit solvent models",,,,,"physics.chem-ph cond-mat.soft","http://arxiv.org/licenses/nonexclusive-distrib/1.0/","  Two of the most challenging tasks in molecular simulation consist in
capturing the properties of systems with long-range interactions (e.g.
electrolyte solutions) as well as systems containing large molecules such as
hydrogels. For the development and optimization of molecular force fields and
models, a large number of simulation runs have to be evaluated to obtain the
sensitivity of the target properties with respect to the model parameters. The
present work discusses force field development for electrolytes regarding
thermodynamic properties of their aqueous solutions. Furthermore, simulations
are conducted for the volume transition of hydrogels in the presence of
electrolytes. It is shown that the properties of these complex systems can be
captured by molecular simulation.
","[{""version"":""v1"",""created"":""Mon, 25 Jul 2011 13:13:31 GMT""}]","2011-07-26"
"1107.4937","Nicolas Peltier","Mnacho Echenim and Nicolas Peltier","Instantiation Schemes for Nested Theories",,,,,"cs.AI","http://arxiv.org/licenses/nonexclusive-distrib/1.0/","  This paper investigates under which conditions instantiation-based proof
procedures can be combined in a nested way, in order to mechanically construct
new instantiation procedures for richer theories. Interesting applications in
the field of verification are emphasized, particularly for handling extensions
of the theory of arrays.
","[{""version"":""v1"",""created"":""Mon, 25 Jul 2011 13:14:54 GMT""}]","2011-07-26"
"1107.4938","Bruno Kahn","Bruno Kahn (IMJ)","Algebraic tori as Nisnevich sheaves with transfers","Reorganised and compacted; some proofs have been simplified","Ann. fac. sci. Toulouse 23 (2014), 699-715",,,"math.AG","http://arxiv.org/licenses/nonexclusive-distrib/1.0/","  We relate R-equivalence on tori with Voevodsky's theory of homotopy invariant
Nisnevich sheaves with transfers and effective motivic complexes.
","[{""version"":""v1"",""created"":""Mon, 25 Jul 2011 13:15:02 GMT""},{""version"":""v2"",""created"":""Tue, 13 Mar 2012 13:47:39 GMT""}]","2015-02-03"
"1107.4939","Can Ba\c{s}kent","Can Baskent","Paraconsistency and Topological Semantics","arXiv admin note: substantial text overlap with arXiv:1107.4932",,,,"cs.LO","http://creativecommons.org/licenses/by-nc-sa/3.0/","  The well-studied notion of deductive explosion describes the situation where
any formula can be deduced from an inconsistent set of formulas. Paraconsistent
logic, on the other hand, is the umbrella term for logical systems where the
logical consequence relation is not explosive. In this work, we investigate the
relationship between some different topological spaces and paraconsistency.
","[{""version"":""v1"",""created"":""Mon, 25 Jul 2011 13:15:07 GMT""},{""version"":""v2"",""created"":""Thu, 10 Nov 2011 22:17:02 GMT""}]","2011-11-14"
"1107.4940","Dejan Kovachev","Dejan Kovachev, Yiwei Cao and Ralf Klamma","Mobile Cloud Computing: A Comparison of Application Models",,,,,"cs.NI cs.DC cs.MM","http://creativecommons.org/licenses/by/3.0/","  Cloud computing is an emerging concept combining many fields of computing.
The foundation of cloud computing is the delivery of services, software and
processing capacity over the Internet, reducing cost, increasing storage,
automating systems, decoupling of service delivery from underlying technology,
and providing flexibility and mobility of information. However, the actual
realization of these benefits is far from being achieved for mobile
applications and open many new research questions. In order to better
understand how to facilitate the building of mobile cloud-based applications,
we have surveyed existing work in mobile computing through the prism of cloud
computing principles. We give a definition of mobile cloud coputing and provide
an overview of the results from this review, in particular, models of mobile
cloud applications. We also highlight research challenges in the area of mobile
cloud computing. We conclude with recommendations for how this better
understanding of mobile cloud computing can help building more powerful mobile
applications.
","[{""version"":""v1"",""created"":""Mon, 25 Jul 2011 13:17:13 GMT""}]","2011-07-26"
"1107.4941","Yanqi Qiu","Yanqi Qiu","On the $\text{OUMD}$ property for the column Hilbert space $C$","Last version for publication",,,,"math.FA math.OA","http://creativecommons.org/licenses/publicdomain/","  The operator space $\text{OUMD}$ property was introduced by Pisier in the
context of vector-valued noncommutative $L_p$-spaces. It is an open problem
whether the column Hilbert space has this property. Based on some complex
interpolation techniques, we are able to relate this problem to the study of
the $\text{OUMD}_q$ property for non-commutative $L_p$-spaces.
","[{""version"":""v1"",""created"":""Mon, 25 Jul 2011 13:18:48 GMT""},{""version"":""v2"",""created"":""Mon, 1 Aug 2011 02:48:53 GMT""},{""version"":""v3"",""created"":""Wed, 3 Aug 2011 05:25:51 GMT""},{""version"":""v4"",""created"":""Wed, 5 Oct 2011 05:36:12 GMT""},{""version"":""v5"",""created"":""Mon, 19 Nov 2012 12:04:31 GMT""},{""version"":""v6"",""created"":""Sat, 5 Jan 2013 15:10:19 GMT""}]","2015-03-12"
"1107.4942","Jaemo Park","Chiung Hwang, Hyungchul Kim, Kyung-Jae Park, Jaemo Park","Index computation for 3d Chern-Simons matter theory: test of
  Seiberg-like duality","References added",,"10.1007/JHEP09(2011)037",,"hep-th","http://arxiv.org/licenses/nonexclusive-distrib/1.0/","  We work out the superconformal index for N=2 supersymmetric Chern-Simons
matter theories exhibiting Seiberg-like dualities proposed by Giveon and
Kutasov. We consider $U(N)/Sp(2N)/O(N)$ gauge theories of QCD type and find the
perfect agreements for proposed dual pairs.
","[{""version"":""v1"",""created"":""Mon, 25 Jul 2011 13:19:13 GMT""},{""version"":""v2"",""created"":""Mon, 1 Aug 2011 08:38:42 GMT""}]","2015-05-28"
"1107.4943","Vladislav Vysotsky","Vladislav Vysotsky","Positivity of integrated random walks",,,,,"math.PR","http://arxiv.org/licenses/nonexclusive-distrib/1.0/","  Take a centered random walk S_n and consider the sequence of its partial sums
A_n = S_1 + ... + S_n. Suppose S_1 is in the domain of normal attraction of an
\alpha-stable law with 1 < \alpha <= 2. Assuming that S_1 is either
right-exponential (that is P(S > x | S > 0)=e^{-ax} for some a > 0 and all x >
0) or right-continuous (skip free), we prove that p_N = P(A_1 > 0, ..., A_N >
0) ~ C_\alpha N^{1/(2\alpha) - 1/2} as N tends to infinity, where C_\alpha > 0
depends on the distribution of the walk. We also consider a conditional version
of this problem and study positivity of integrated discrete bridges.
","[{""version"":""v1"",""created"":""Mon, 25 Jul 2011 13:23:01 GMT""},{""version"":""v2"",""created"":""Fri, 16 Mar 2012 08:56:58 GMT""}]","2012-03-19"
"1107.4944","Alan Frieze","Alan Frieze, Boris Pittel","On a sparse random graph with minimum degree {three}: Likely Posa's sets
  are large","Companion to paper ""On a Greedy 2-Matching Algorithm and Hamilton
  Cycles in Random Graphs with Minimum Degree at Least Three""",,,,"math.CO","http://arxiv.org/licenses/nonexclusive-distrib/1.0/","  We consider the likely size of the endpoint sets produced by Posa rotations,
when applied to a longest path in a random graph with $cn,\,c\geq 2.7$ edges
that is conditioned to have minimum degree at least three.
","[{""version"":""v1"",""created"":""Mon, 25 Jul 2011 13:25:02 GMT""}]","2011-07-26"
"1107.4945","Alexander Kasprzyk","Alexander M Kasprzyk and Benjamin Nill","Reflexive polytopes of higher index and the number 12","Dedicated to the memory of Maximilian Kreuzer. 23 pages, 4 figures, 4
  tables, an appendix containing Magma source code","Electronic Journal of Combinatorics, 19 (2012), no. 3, P9","10.37236/2366",,"math.AG math.CO","http://arxiv.org/licenses/nonexclusive-distrib/1.0/","  We introduce reflexive polytopes of index l as a natural generalisation of
the notion of a reflexive polytope of index 1. These l-reflexive polytopes also
appear as dual pairs. In dimension two we show that they arise from reflexive
polygons via a change of the underlying lattice. This allows us to efficiently
classify all isomorphism classes of l-reflexive polygons up to index 200. As
another application, we show that any reflexive polygon of arbitrary index
satisfies the famous ""number 12"" property. This is a new, infinite class of
lattice polygons possessing this property, and extends the previously known
sixteen instances. The number 12 property also holds more generally for
l-reflexive non-convex or self-intersecting polygonal loops. We conclude by
discussing higher-dimensional examples and open questions.
","[{""version"":""v1"",""created"":""Mon, 25 Jul 2011 13:26:47 GMT""}]","2022-10-28"
"1107.4946","Amelia Carolina Sparavigna","Amelia Carolina Sparavigna","The architect Kha's protractor","Ancient Egyptian instruments",,,,"physics.pop-ph","http://arxiv.org/licenses/nonexclusive-distrib/1.0/","  Kha was an architect at Deir El-Medina, Egypt, supervisor of some projects
completed during the reigns of three kings of the 18th Dynasty (approximately
1440-1350 BC). Buried with his wife Merit, the items of their tomb are exposed
at the Egyptian Museum, Torino. After a description of some devices of the
ancient Egypt masonry (cubits, cords, plumb, levels and squares), that Kha used
during his activity, I discuss an object among those found in his tomb, which,
in my opinion, could be used a protractor.
","[{""version"":""v1"",""created"":""Mon, 25 Jul 2011 13:26:49 GMT""}]","2011-07-26"
"1107.4947","Alan Frieze","Alan Frieze","On a Greedy 2-Matching Algorithm and Hamilton Cycles in Random Graphs
  with Minimum Degree at Least Three","Companion paper to ""On a sparse random graph with minimum degree
  {three}: Likely Posa's sets are large""",,,,"math.CO","http://arxiv.org/licenses/nonexclusive-distrib/1.0/","  We describe and analyse a simple greedy algorithm \2G\ that finds a good
2-matching $M$ in the random graph $G=G_{n,cn}^{\d\geq 3}$ when $c\geq 15$. A
2-matching is a spanning subgraph of maximum degree two and $G$ is drawn
uniformly from graphs with vertex set $[n]$, $cn$ edges and minimum degree at
least three. By good we mean that $M$ has $O(\log n)$ components. We then use
this 2-matching to build a Hamilton cycle in $O(n^{1.5+o(1)})$ time \whp.
","[{""version"":""v1"",""created"":""Mon, 25 Jul 2011 13:27:39 GMT""},{""version"":""v2"",""created"":""Fri, 5 Aug 2011 19:07:27 GMT""},{""version"":""v3"",""created"":""Mon, 8 Aug 2011 00:51:57 GMT""}]","2011-08-09"
"1107.4948","H. Geiges","Fan Ding and Hansj\""org Geiges","Contact structures on principal circle bundles","14 pages, 1 figure; v2: changes to exposition, Sections 5.2, 5.3 and
  6 are new","Bull. London Math. Soc. 44 (2012), 1189-1202","10.1112/blms/bds042",,"math.SG math.DG","http://arxiv.org/licenses/nonexclusive-distrib/1.0/","  We describe a necessary and sufficient condition for a principal circle
bundle over an even-dimensional manifold to carry an invariant contact
structure. As a corollary it is shown that all circle bundles over a given base
manifold carry an invariant contact structure, only provided the trivial bundle
does. In particular, all circle bundles over 4-manifolds admit invariant
contact structures. We also discuss the Bourgeois construction of contact
structures on odd-dimensional tori in this context, and we relate our results
to recent work of Massot, Niederkrueger and Wendl on weak symplectic fillings
in higher dimensions.
","[{""version"":""v1"",""created"":""Mon, 25 Jul 2011 13:32:32 GMT""},{""version"":""v2"",""created"":""Wed, 21 Dec 2011 15:26:10 GMT""}]","2014-02-26"
"1107.4949","Wei Chen","Wei Chen, Zi-Xing Cai and Shi-Lin Zhu","Masses of the tensor mesons with $J^{P}=2^{-}$","12 pages, 16 figures and 1 table. Accepted by Nuclear Physics B","Nucl.Phys.B 887 (2014) 201","10.1016/j.nuclphysb.2014.08.006",,"hep-ph","http://arxiv.org/licenses/nonexclusive-distrib/1.0/","  We calculate the two-point correlation function using the interpolating
current with $J^{PC}=2^{-}$. After performing the Borel sum rule analysis, the
extracted masses of the $2^{--}$ tensor charmonium and bottomonium are
$3.97\pm0.25$ GeV and $10.13\pm0.34$ GeV respectively. For comparison, we also
perform the moment sum rule analysis for the charmonium and bottomonium
systems. We extend the same analysis to study the $\bar qq, \bar qs, \bar ss,
\bar qc, \bar sc, \bar qb, \bar sb$ and $\bar cb$ systems. Their masses are
$1.78\pm 0.12, 1.85\pm 0.14, 2.00\pm 0.16, 2.86\pm 0.14, 3.01\pm 0.21,
5.66\pm0.33, 6.40\pm 0.25$, and $7.08\pm 0.34$ GeV respectively.
","[{""version"":""v1"",""created"":""Mon, 25 Jul 2011 13:43:49 GMT""},{""version"":""v2"",""created"":""Sun, 24 Aug 2014 23:18:57 GMT""}]","2014-08-29"
"1107.4950","Mubashir Husain Rehmani","Mubashir Husain Rehmani","Data Dissemination in Cognitive Radio Networks",,,,,"cs.NI","http://arxiv.org/licenses/nonexclusive-distrib/1.0/","  In this report, we first describe the problem that we are dealing with i.e.
data dissemination in multi-hop cognitive radio networks. To address this
problem, we propose a channel selection strategy named 'SURF'. We evaluate the
proposed channel selection strategy in both single-hop and multi-hop scenarios
and compared it with relevant approaches. So far, one technical report and a
poster is published as part of this work, while two publications are under
review; one is in IEEE Communications Letters and the second one is in IEEE
WoWMoM conference. In on-going works sections, we first mention some possible
directions in the context of SURF. In addition to that, we mention different
research problems that we are planning to deal during the course of this PhD
dissertation.
","[{""version"":""v1"",""created"":""Mon, 25 Jul 2011 13:46:25 GMT""}]","2011-07-26"
"1107.4951","Sanjib Kumar Agarwalla","Sanjib Kumar Agarwalla","New approach to anti-neutrino from muon decay at rest","6 pages, 3 pdf figures, 2 tables, contribution to the Proceedings of
  the 46th Rencontres de Moriond, Electroweak Session, March 13th - 20th, 2011
  in La Thuile, Italy; based on work done in collaboration with Patrick Huber,
  Jonathan M. Link and Debabrata Mohapatra, see arXiv:1005.4055 and
  arXiv:1007.3228",,,,"hep-ph hep-ex","http://arxiv.org/licenses/nonexclusive-distrib/1.0/","  Neutrino physics is going through a very exciting phase. In last one and half
years, crucial informations have been provided by both short and long baseline
neutrino oscillation experiments. At short-baseline, recent neutrino
oscillation studies seem to point towards the existence of active-sterile
mixing. On the other hand at long-basline, recent T2K and MINOS data are in
favor of non-zero theta13 opening up the possibility of observing CP-violation
in the lepton sector. A stopped pion source provides neutrino beams with energy
of a few tens of MeV from pion and muon decay-at-rest. A rich physics program
can be accomplished with such a neutrino source. We discuss the role of such a
neutrino facility to test short-baseline anomalies and to study CP violation in
active neutrinos.
","[{""version"":""v1"",""created"":""Mon, 25 Jul 2011 13:48:16 GMT""}]","2011-07-26"
"1107.4952","Hyun-Chul Kim","Tim Ledwig and Hyun-Chul Kim","Transverse strange quark spin structure of the nucleon","10 pages. 16 figures. Submitted to Physical Review D",,"10.1103/PhysRevD.85.034041","INHA-NTG-09/2011","hep-ph hep-lat nucl-th","http://arxiv.org/licenses/nonexclusive-distrib/1.0/","  We investigate the transverse quark spin densities of the nucleon with the
lowest moment within the framework of the SU(3) chiral quark-soliton model,
emphasizing the strange quark spin density. Based on previous results of the
vector and tensor form factors, we are able to determine the impact-parameter
dependent probability densities of transversely polarized quarks in an
unpolarized nucleon as well as those of unpolarized quarks in a transversely
polarized nucleon. We find that the present numerical results for the
transverse spin densities of the up and down quarks are in good agreement with
those of the lattice calculation. We predict the transvere spin densities of
the strange quark. It turns out that the polarized strange quark is noticeably
distorted in an unpolarized proton.
","[{""version"":""v1"",""created"":""Mon, 25 Jul 2011 13:49:45 GMT""},{""version"":""v2"",""created"":""Fri, 14 Oct 2011 08:22:10 GMT""}]","2015-05-28"
"1107.4953","R. H. Sanders","R.H. Sanders","NGC 2419 does not challenge MOND","3 pages, 2 figrues, minor revisions, programming error corrected,
  accepted MNRAS",,"10.1111/j.1745-3933.2011.01160.x",,"astro-ph.GA","http://arxiv.org/licenses/nonexclusive-distrib/1.0/","  I show that, in the context of MOND, non-isothermal models, approximated by
high order polytropic spheres, are consistent with the observations of the
radial distribution of the line-of-sight velocity dispersion in the distant
globular cluster, NGC 2419. This calls into question the claim by Ibata et al.
that the object constitutes a severe challenge for MOND. In general, the
existence and properties of globular clusters are more problematic for LCDM
than for MOND.
","[{""version"":""v1"",""created"":""Mon, 25 Jul 2011 13:58:36 GMT""},{""version"":""v2"",""created"":""Sun, 11 Sep 2011 20:24:01 GMT""}]","2015-05-28"
"1107.4954","Scipio Cuccagna","Scipio Cuccagna","On asymptotic stability of moving ground states of the nonlinear
  Schrodinger equation","This is the revised version. To appear in the Transactions of the
  Amer. Math. Soc",,,,"math.AP","http://arxiv.org/licenses/nonexclusive-distrib/1.0/","  We extend to the case of moving solitons, the result on asymptotic stability
of ground states of the NLS with a short range linear potential obtained by the
author in a previous paper. Now we drop the potential and allow moving
solitons. For technical reasons we consider only smooth solutions. The proof is
similar to the earlier paper. However now the flows required for the Darboux
Theorem and the Birkhoff normal forms, instead of falling within the framework
of standard theory of ODE's, are related to quasilinear hyperbolic symmetric
systems. So there is an issue about well posedness and regularity with respect
of the initial data of the flows. It is also not obvious that Darboux Theorem
can be applied, since we need to compare two symplectic forms in a neighborhood
of the ground states not in in energy space, but rather in a smaller space
where also the variance is bounded. Then the validity of Darboux Theorem is not
obvious because, since the NLS does not preserve small neighborhoods of the
ground states in this smaller space, we are comparing the to symplectic forms
in a set which, in some respects, is large.
","[{""version"":""v1"",""created"":""Mon, 25 Jul 2011 14:00:24 GMT""},{""version"":""v2"",""created"":""Tue, 29 Nov 2011 11:07:26 GMT""},{""version"":""v3"",""created"":""Thu, 15 Dec 2011 15:49:19 GMT""},{""version"":""v4"",""created"":""Wed, 22 Feb 2012 09:57:11 GMT""}]","2012-02-23"
"1107.4955","Nicolas I. Grigorchuk Dr.","Nicolas I. Grigorchuk and Petro M. Tomchuk","Theory for absorption of ultrashort laser pulses by spheroidal metallic
  nanoparticles","16 pages, 8 figures","Physical Review B 80, 155456 (2009)","10.1103/PhysRevB.80.155456",,"cond-mat.mes-hall physics.optics","http://arxiv.org/licenses/nonexclusive-distrib/1.0/","  The theory for the electric and magnetic fields energy absorption by small
metallic particles subjected to the irradiation by ultrashort laser pulses of
different duration in the region of surface plasmon excitation is developed.
For the particles of the oblate or prolate spheroidal shape there has been
found the dependence of the absorbed energy on a number of factors, including a
particle radius, a degree of the shape deviation from a spherical one, a pulse
duration, the orientation of the magnetic field upon particle, the magnitude of
carrier frequency, and the value of a shift of the carrier frequency of a laser
ray from the frequency of the surface plasmon excitation in a spherical
particle. An appreciable absorption grows at the length of free electron pass
large compared to the particle size is established. The phenomenological and
kinetic approach is compared each with other.
","[{""version"":""v1"",""created"":""Mon, 25 Jul 2011 14:03:07 GMT""}]","2011-07-26"
