"1112.0348","Hassan Halabian","Hassan Halabian, Ioannis Lambadaris, Chung-Horng Lung","Explicit Characterization of Stability Region for Stationary Multi-Queue
  Multi-Server Systems","35 pages, 16 figures",,,,"math.OC cs.IT cs.SY math.IT","http://arxiv.org/licenses/nonexclusive-distrib/1.0/","  In this paper, we characterize the network stability region (capacity region)
of multi-queue multi-server (MQMS) queueing systems with stationary channel
distribution and stationary arrival processes. The stability region is
specified by a finite set of linear inequalities. We first show that the
stability region is a polytope characterized by the finite set of its facet
defining hyperplanes. We explicitly determine the coefficients of the linear
inequalities describing the facet defining hyperplanes of the stability region
polytope. We further derive the necessary and sufficient conditions for the
stability of the system for general arrival processes with finite first and
second moments. For the case of stationary arrival processes, the derived
conditions characterize the system stability region. Furthermore, we obtain an
upper bound for the average queueing delay of Maximum Weight (MW) server
allocation policy which has been shown in the literature to be a throughput
optimal policy for MQMS systems. Using a similar approach, we can characterize
the stability region for a fluid model MQMS system. However, the stability
region of the fluid model system is described by an infinite number of linear
inequalities since in this case the stability region is a convex surface. We
present an example where we show that in some cases depending on the channel
distribution, the stability region can be characterized by a finite set of
non-linear inequalities instead of an infinite number of linear inequalities.
","[{""version"":""v1"",""created"":""Thu, 1 Dec 2011 22:31:44 GMT""}]","2011-12-05"
"1112.0349","Luca Motto Ros","Luca Motto Ros","On the complexity of the relations of isomorphism and bi-embeddability","15 pages","Proceedings of the American Mathematical Society 140 (2012), no.
  1, 309-323",,,"math.LO","http://arxiv.org/licenses/nonexclusive-distrib/1.0/","  Given an L_{\omega_1 \omega}-elementary class C, that is the collection of
the countable models of some L_{\omega_1 \omega}-sentence, denote by \cong_C
and \equiv_C the analytic equivalence relations of, respectively, isomorphism
and bi-embeddability on C. Generalizing some questions of Louveau and Rosendal
[LR05], in [FMR09] it was proposed the problem of determining which pairs of
analytic equivalence relations (E,F) can be realized (up to Borel
bireducibility) as pairs of the form (\cong_C,\equiv_C), C some L_{\omega_1
\omega}-elementary class (together with a partial answer for some specific
cases). Here we will provide an almost complete solution to such problem: under
very mild conditions on E and F, it is always possible to find such an
L_{\omega_1 \omega}-elementary class C.
","[{""version"":""v1"",""created"":""Thu, 1 Dec 2011 22:34:45 GMT""}]","2011-12-05"
"1112.0350","Luca Motto Ros","Miroslav Ka\v{c}ena, Luca Motto Ros and Brian Semmes","Some observations on ""A new proof of a theorem of Jayne and Rogers""","revised version, 12 pages, to appear on the Real Analysis Exchange",,,,"math.LO math.GN","http://arxiv.org/licenses/nonexclusive-distrib/1.0/","  We adapt a construction taken from `L. Motto Ros and B. Semmes, A new proof
of a theorem of Jayne and Rogers, Real Anal. Exchange 35(1) (2009/2010),
195-204' in order to correct a mistake contained in the first part of the same
paper. As a byproduct of the new construction, the Jayne-Rogers theorem is
extended to functions whose range is a regular topological space, and a theorem
of Solecki which sharpens the Jayne-Rogers theorem for separable metric spaces
is extended to the non-separable context.
","[{""version"":""v1"",""created"":""Thu, 1 Dec 2011 22:45:02 GMT""},{""version"":""v2"",""created"":""Tue, 24 Apr 2012 11:15:27 GMT""}]","2012-04-25"
"1112.0351","Michael Holst","Michael Holst and Caleb Meier","Generalized Solutions to Semilinear Elliptic PDE with Applications to
  the Lichnerowicz Equation","38 pages, no figures. Version 3 contains minor corrections/updates to
  reflect external comments",,,,"math.AP gr-qc math-ph math.MP","http://arxiv.org/licenses/nonexclusive-distrib/1.0/","  In this article we investigate the existence of a solution to a semilinear,
elliptic, partial differential equation with distributional coefficients and
data. The problem we consider is a generalization of the Lichnerowicz equation
that one encounters in studying the constraint equations in general relativity.
Our method for solving this problem consists of solving a net of regularized,
semilinear problems with data obtained by smoothing the original,
distributional coefficients. In order to solve these regularized problems, we
develop a priori pointwise bounds and sub- and super-solutions and then apply a
fixed-point argument for order-preserving maps. We then show that the net of
solutions obtained through this process satisfies certain decay estimates by
determining estimates for the sub- and super-solutions and by utilizing
classical, a priori elliptic estimates. The estimates for this net of solutions
allow us to regard this collection of functions as a solution in a
Colombeau-type algebra. We motivate this Colombeau algebra framework by first
solving an ill-posed critical exponent problem. To solve this ill-posed
problem, we use a collection of smooth, ""approximating"" problems and then use
the resulting sequence of solutions and a compactness argument to obtain a
solution to the original problem. This approach is modeled after the more
general Colombeau framework that we develop, and it conveys the potential that
solutions in these abstract spaces have for obtaining classical solutions to
ill-posed nonlinear problems with irregular data.
","[{""version"":""v1"",""created"":""Thu, 1 Dec 2011 22:45:50 GMT""},{""version"":""v2"",""created"":""Mon, 2 Apr 2012 21:57:36 GMT""},{""version"":""v3"",""created"":""Mon, 18 Mar 2013 20:18:39 GMT""}]","2013-03-20"
"1112.0352","Jakub Byszewski","Jakub Byszewski","Deformation functors of local actions","23 pages",,,,"math.AG math.NT","http://arxiv.org/licenses/nonexclusive-distrib/1.0/","  We study the behaviour of infinitesimal deformation functors of local group
actions with regard to passing to subgroups and quotient groups. Inspired by
the cohomological information, we conjecture the existence of a decomposition
of a deformation functor of a local $G$-action as a smooth extension of a
fibered product of functors related to a subgroup and a quotient group of $G$.
","[{""version"":""v1"",""created"":""Thu, 1 Dec 2011 22:46:14 GMT""}]","2011-12-05"
"1112.0353","Heribert Genreith","H. Genreith","Superluminal neutrino speeds from SN 1987A and from OPERA experiment do
  agree very well",,,,,"physics.gen-ph","http://creativecommons.org/licenses/by-nc-sa/3.0/","  We give an explanation on the effect of superluminal neutrinos in the OPERA
experiment and show that the SN 1987A data and the recent OPERA data do agree
well by the use of common known physics. The data in addition can give a good
number for the matter-antimatter asymmetry at big bang time.
","[{""version"":""v1"",""created"":""Thu, 1 Dec 2011 22:54:25 GMT""}]","2011-12-05"
"1112.0354","Luca Motto Ros","Luca Motto Ros","The descriptive set-theoretical complexity of the embeddability relation
  on models of large size","41 pages, revised version, accepted for publication on the Annals of
  Pure and Applied Logic. Corrected an inaccuracy in the definition of analytic
  subsets of standard Borel kappa-spaces (thanks to P. Luecke and P. Schlicht
  for pointing it out)",,,,"math.LO","http://arxiv.org/licenses/nonexclusive-distrib/1.0/","  We show that if \kappa\ is a weakly compact cardinal then the embeddability
relation on (generalized) trees of size \kappa\ is invariantly universal. This
means that for every analytic quasi-order R on the generalized Cantor space
2^\kappa\ there is an L_{\kappa^+ \kappa}-sentence \phi\ such that the
embeddability relation on its models of size \kappa, which are all trees, is
Borel bireducible (and, in fact, classwise Borel isomorphic) to R. In
particular, this implies that the relation of embeddability on trees of size
\kappa\ is complete for analytic quasi-orders. These facts generalize analogous
results for \kappa=\omega\ obtained in [LR05, FMR11], and it also partially
extends a result from [Bau76] concerning the structure of the embeddability
relation on linear orders of size \kappa.
","[{""version"":""v1"",""created"":""Thu, 1 Dec 2011 22:55:49 GMT""},{""version"":""v2"",""created"":""Thu, 11 Oct 2012 16:29:46 GMT""},{""version"":""v3"",""created"":""Thu, 27 Jun 2013 07:49:31 GMT""}]","2013-06-28"
"1112.0355","Wei-Min Gu","Da-Bin Lin, Wei-Min Gu, Tong Liu, and Ju-Fu Lu","The influence of outflows on the 1/f-like luminosity fluctuations","6 pages, 1 figure, accepted for publication in MNRAS","MNRAS, 421, 308-313 (2012)","10.1111/j.1365-2966.2011.20305.x",,"astro-ph.HE","http://arxiv.org/licenses/nonexclusive-distrib/1.0/","  In accretion systems, outflows may have significant influence on the
luminosity fluctuations. In this paper, following the Lyubarskii's general
scheme, we revisit the power spectral density of luminosity fluctuations by
taking into account the role of outflows. Our analysis is based on the
assumption that the coupling between the local outflow and inflow is weak on
the accretion rate fluctuations. We find that, for the inflow mass accretion
rate $\dot M \propto r^{s}$, the power spectrum of flicker noise component will
present a power-law distribution $p(f) \propto f^{-(1+4s/3)}$ for
advection-dominated flows. We also obtain descriptions of $p(f)$ for both
standard thin discs and neutrino-cooled discs, which show that the power-law
index of a neutrino-cooled disc is generally larger than that of a
photon-cooled disc. Furthermore, the obtained relationship between $p(f)$ and
$s$ indicates the possibility of evaluating the strength of outflows by the
power spectrum in X-ray binaries and gamma-ray bursts. In addition, we discuss
the possible influence of the outflow-inflow coupling on our results.
","[{""version"":""v1"",""created"":""Thu, 1 Dec 2011 22:57:47 GMT""}]","2012-07-31"
"1112.0356","B J Hazarika","C. Thakuria, K. Boruah","Simulation of Proton and Iron Induced Extensive Air Showers",,,,,"hep-ph astro-ph.HE","http://arxiv.org/licenses/nonexclusive-distrib/1.0/","  The reliable simulation of extensive air showers induced by different primary
particles (e. g. proton, iron, gamma etc.) is of great importance in high
energy cosmic ray research. The CORSIKA is a standard Monte-Carlo simulation
package to simulate the four dimensional evolution of Extensive Air Shower
(EAS) in the atmosphere initiated by gamma, hadrons and nuclei. CORSIKA has
different high energy interaction models like DPMJET, QGSJET, NEXUS, SIBYLL,
VENUS and EPOS which are based on different theoretical frameworks. The
influence of different hadronic interaction models, viz., QGSJET and DPMJET on
the lateral distribution functions (LDF) and muon to electron ratio of cosmic
ray EAS induced by 10^17 eV to 10^20 eV proton and iron primaries are explored
in this work.
","[{""version"":""v1"",""created"":""Thu, 1 Dec 2011 23:04:38 GMT""}]","2011-12-05"
"1112.0357","Gennady Berman","G.P. Berman, D.I. Kamenev, D. Kinion, and V.I. Tsifrinovich","Non-Demolition Dispersive Measurement of a Superconducting Qubit with a
  Microstrip SQUID Amplifier","15 pages, 8 figures",,,"LA-UR-11-12163","quant-ph cond-mat.supr-con physics.ins-det","http://arxiv.org/licenses/nonexclusive-distrib/1.0/","  We have studied the possibility of a single-shot non-demolition measurement
of a superconducting qubit using a microstrip SQUID amplifier (MSA). The
Johnson noise generated by all resistors in the MSA is taken into
consideration. We show that a single-shot non-demolition measurement is
possible with six photons in the measurement resonator. For a phase qubit
inductively coupled to a measurement resonator we have obtained the expression
for the mutual inductance required for measurement of the qubit state.
","[{""version"":""v1"",""created"":""Thu, 1 Dec 2011 23:24:25 GMT""}]","2011-12-05"
"1112.0358","Trevor Wooley","Trevor D. Wooley","Vinogradov's mean value theorem via efficient congruencing, II",,"Duke Math. J. 162, no. 4 (2013), 673-730","10.1215/00127094-2079905",,"math.NT","http://arxiv.org/licenses/nonexclusive-distrib/1.0/","  We apply the efficient congruencing method to estimate Vinogradov's integral
for moments of order 2s, with 1<=s<=k^2-1. Thereby, we show that quasi-diagonal
behaviour holds when s=o(k^2), we obtain near-optimal estimates for
1<=s<=(1/4)k^2+k, and optimal estimates for s>=k^2-1. In this way we come half
way to proving the main conjecture in two different directions. There are
consequences for estimates of Weyl type, and in several allied applications.
Thus, for example, the anticipated asymptotic formula in Waring's problem is
established for sums of s kth powers of natural numbers whenever s>=2k^2-2k-8
(k>=6).
","[{""version"":""v1"",""created"":""Thu, 1 Dec 2011 23:40:58 GMT""}]","2019-12-19"
"1112.0359","Daniel Bayliss","Daniel Bayliss and Penny Sackett","The Frequency of Hot Jupiters in the Galaxy: Results from the SuperLupus
  Survey","Accepted for publication in ApJ",,"10.1088/0004-637X/743/2/103",,"astro-ph.EP","http://arxiv.org/licenses/nonexclusive-distrib/1.0/","  We present the results of the SuperLupus Survey for transiting hot Jupiter
planets, which monitored a single Galactic disk field spanning 0.66 sq. deg for
108 nights over three years. Ten candidates were detected: one is a transiting
planet, two remain candidates, and seven have been subsequently identified as
false positives. We construct a new image quality metric, S_j, based on the
behaviour of 26,859 light curves, which allows us to discard poor images in an
objective and quantitative manner. Furthermore, in some cases we are able to
identify statistical false positives by analysing temporal correlations between
S_j and transit signatures. We use Monte Carlo simulations to measure our
detection efficiency by injecting artificial transits onto real light curves
and applying identical selection criteria as used in our survey. We find at 90%
confidence level that 0.10 (+0.27/-0.08)% of dwarf stars host a hot Jupiter
with a period of 1-10 days. Our results are consistent with other transit
surveys, but appear consistently lower than the hot Jupiter frequencies
reported from radial velocity surveys, a difference we attribute, at least in
part, to the difference in stellar populations probed. In light of our
determination of the frequency of hot Jupiters in Galactic field stars,
previous null results for transiting planets in open cluster and globular
cluster surveys no longer appear anomalously low.
","[{""version"":""v1"",""created"":""Thu, 1 Dec 2011 23:42:05 GMT""}]","2015-06-03"
"1112.0360","Tomasz Pawlowski","Tomasz Pawlowski, Abhay Ashtekar","Positive cosmological constant in loop quantum cosmology","36 pages, 6 figures, RevTex4","Phys. Rev. D 85, 064001 (2012)","10.1103/PhysRevD.85.064001","IGC-11/11-5","gr-qc astro-ph.CO hep-th","http://arxiv.org/licenses/nonexclusive-distrib/1.0/","  The k=0 Friedmann Lemaitre Robertson Walker model with a positive
cosmological constant and a massless scalar field is analyzed in detail. If one
uses the scalar field as relational time, new features arise already in the
Hamiltonian framework of classical general relativity: In a finite interval of
relational time, the universe expands out to infinite proper time and zero
matter density. In the deparameterized quantum theory, the true Hamiltonian now
fails to be essentially self-adjoint both in the Wheeler DeWitt (WDW) approach
and in LQC. Irrespective of the choice of the self-adjoint extension, the big
bang singularity persists in the WDW theory while it is resolved and replaced
by a big bounce in loop quantum cosmology (LQC). Furthermore, the quantum
evolution is surprisingly insensitive to the choice of the self-adjoint
extension. This may be a special case of an yet to be discovered general
property of a certain class of symmetric operators that fail to be essentially
self-adjoint.
","[{""version"":""v1"",""created"":""Thu, 1 Dec 2011 23:52:07 GMT""}]","2015-06-03"
"1112.0361","Bruno Tomasello BT","Bruno Tomasello, Davide Rossini, Alioscia Hamma and Luigi Amico","Quantum discord in a spin system with symmetry breaking","9 pages, 9 figure, Contribution to the Festschrift volume in honour
  of Vladimir Korepin","Int. J. Mod. Phys. B 26, 1243002 (2012)","10.1142/S0217979212430023",,"cond-mat.stat-mech quant-ph","http://arxiv.org/licenses/nonexclusive-distrib/1.0/","  We analyze the quantum discord Q throughout the low-temperature phase diagram
of the quantum XY model in transverse field. We first focus on the T=0
order-disorder quantum phase transition both in the symmetric ground state and
in the symmetry broken one. Besides it, we highlight how Q displays clear
anomalies also at a non critical value of the control parameter inside the
ordered phase, where the ground state is completely factorized. We evidence how
the phenomenon is in fact of collective nature and displays universal features.
We also study Q at finite temperature. We show that, close to the quantum phase
transition, Q exhibits quantum-classical crossover of the system with universal
scaling behavior. We evidence a non trivial pattern of thermal correlations
resulting from the factorization phenomenon.
","[{""version"":""v1"",""created"":""Thu, 1 Dec 2011 23:54:49 GMT""}]","2012-09-24"
"1112.0362","Philip Makotyn","R. J. Wild, P. Makotyn, J. M. Pino, E. A. Cornell, and D. S. Jin","Contact Measurements on Atomic BEC","5 pages, 4 figures","Phys. Rev. Lett. 108, 145305 (2012)","10.1103/PhysRevLett.108.145305",,"cond-mat.quant-gas","http://arxiv.org/licenses/nonexclusive-distrib/1.0/","  A powerful set of universal relations, centered on a quantity called the
contact, connects the strength of short-range two-body correlations to the
thermodynamics of a many-body system with delta-function interactions. We
report on measurements of the contact, using RF spectroscopy, for an $^{85}$Rb
atomic Bose-Einstein condensate (BEC). For bosons, the fact that contact
spectroscopy can be used to probe the gas on short timescales is useful given
the decreasing stability of BECs with increasing interactions. A complication
is the added possibility, for bosons, of three-body interactions. In
investigating this issue, we have located an Efimov resonance for $^{85}$Rb
atoms with loss measurements and thus determined the three-body interaction
parameter. In our contact spectroscopy, in a region of observable
beyond-mean-field effects, we find no measurable contribution from three-body
physics.
","[{""version"":""v1"",""created"":""Thu, 1 Dec 2011 23:55:55 GMT""}]","2012-04-30"
"1112.0363","Young S Kim","Y. S. Kim","Einstein's Hydrogen Atom","LaTex 15 pages, 5 figures, presented at the International Workshop on
  Physics and Mathematics (Hangzhou, China, July 2011), to be published in the
  proceddings",,,,"quant-ph physics.hist-ph","http://arxiv.org/licenses/nonexclusive-distrib/1.0/","  In 1905, Einstein formulated his special relativity for point particles. For
those particles, his Lorentz covariance and energy-momentum relation are by now
firmly established. How about the hydrogen atom? It is possible to perform
Lorentz boosts on the proton assuming that it is a point particle. Then what
happens to the electron orbit? The orbit could go through an elliptic
deformation, but it is not possible to understand this problem without quantum
mechanics, where the orbit is a standing wave leading to a localized
probability distribution. Is this concept consistent with Einstein's Lorentz
covariance? Dirac, Wigner, and Feynman contributed important building blocks
for understanding this problem. The remaining problem is to assemble those
blocks to construct a Lorentz-covariant picture of quantum bound states based
on standing waves. It is shown possible to assemble those building blocks using
harmonic oscillators.
","[{""version"":""v1"",""created"":""Fri, 2 Dec 2011 00:17:40 GMT""}]","2011-12-05"
"1112.0364","Prasad Hegde","Prasad Hegde","Looking for $U(1)_A$ Restoration in Hot QCD with Domain Wall Fermions","13 pages, 8 figures. Proceedings for The XXIX International Symposium
  on Lattice Field Theory - Lattice 2011, July 10-16, 2011, Squaw Valley, Lake
  Tahoe, California",,,,"hep-lat hep-ph","http://arxiv.org/licenses/nonexclusive-distrib/1.0/","  The effects of the axial anomaly are suppressed at high temperatures due to
screening effects in the quark-gluon plasma. If the suppression is nearly
complete close to the chiral transition temperature, this can have consequences
for the nature of the phase transition. The use of a chiral action such as
Domain Wall Fermions allows us to gain a deeper insight into the issue. Our
lattice sizes were $16^3\times 8\times L_s$, with $L_s=32$ or 48, and our pion
mass was approximately 200 MeV. We found that $U(1)_A$ stayed broken above the
chiral transition. However the breaking was found to be due to topologically
nontrivial configurations which raises the question as to whether it persists
in the thermodynamic limit. We also present results for the eigenvalue density
of the Dirac operator. It is seen that although the density decreases
dramatically across the chiral transition temperature, $U(1)_A$ still remains
broken at our current volume and quark mass due to the presence of zero modes.
","[{""version"":""v1"",""created"":""Fri, 2 Dec 2011 00:25:33 GMT""}]","2011-12-05"
"1112.0365","Richard Gonzales","Richard Gonzales","Rational smoothness, cellular decompositions and GKM theory","27 pages, minor changes in the exposition","Geom. Topol. 18 (2014) 291-326","10.2140/gt.2014.18.291",,"math.AG math.AT","http://arxiv.org/licenses/nonexclusive-distrib/1.0/","  We introduce the notion of Q-filtrable varieties: projective varieties with a
torus action and a finite number of fixed points, such that the cells of the
associated Bialynicki-Birula decomposition are all rationally smooth. Our main
results develop GKM theory in this setting. We also supply a method for
building nice combinatorial bases on the equivariant cohomology of any
Q-filtrable GKM variety. Applications to the theory of group embeddings are
provided.
","[{""version"":""v1"",""created"":""Fri, 2 Dec 2011 00:44:56 GMT""},{""version"":""v2"",""created"":""Fri, 13 Jul 2012 15:13:10 GMT""}]","2014-11-11"
"1112.0366","Michael K\""ohl","Hendrik M. Meyer, Matthias Steiner, Lothar Ratschbacher, Christoph
  Zipkes, Michael K\""ohl","Laser spectroscopy and cooling of Yb+ ions on a deep-UV transition",,"Phys. Rev. A 85, 012502 (2012)","10.1103/PhysRevA.85.012502",,"physics.atom-ph quant-ph","http://arxiv.org/licenses/nonexclusive-distrib/1.0/","  We perform laser spectroscopy of Yb+ ions on the 4f14 6s 2S_{1/2} - 4f13 5d
6s 3D[3/2]_{1/2} transition at 297 nm. The frequency measurements for 170Yb+,
172Yb+, 174Yb+, and 176Yb+ reveal the specific mass shift as well as the field
shifts. In addition, we demonstrate laser cooling of Yb+ ions using this
transition and show that light at 297 nm can be used as the second step in the
photoionization of neutral Yb atoms.
","[{""version"":""v1"",""created"":""Fri, 2 Dec 2011 01:00:46 GMT""}]","2012-02-10"
"1112.0367","Ralph Strebel","J. R. J. Groves and Ralph Strebel","Fitting quotients of finitely presented abelian-by-nilpotent groups","This second version takes into account the suggestions by the
  referee; 11 pages","J. Group Theory 17 (2014), 1-12","10.1515/jgt-2013-0040",,"math.GR","http://arxiv.org/licenses/nonexclusive-distrib/1.0/","  We show that every finitely generated nilpotent group of class 2 occurs as
the quotient of a finitely presented abelian-by-nilpotent group by its largest
nilpotent normal subgroup.
","[{""version"":""v1"",""created"":""Fri, 2 Dec 2011 01:07:52 GMT""},{""version"":""v2"",""created"":""Fri, 16 Aug 2013 13:38:39 GMT""}]","2014-11-12"
