"1112.0297","Sergii Piskun Mr","Sergii Piskun, Oleksandr Piskun, Dmitry Chabanenko","RQA Application for the Monitoring of Financial and Commodity markets
  state","22 pages, 14 figures",,,,"q-fin.ST nlin.CD q-fin.GN","http://arxiv.org/licenses/nonexclusive-distrib/1.0/","  Nowadays, when crashes and crises are rather frequent events, an effective
monitoring system for the international financial market is needed. Modern
nonlinear methods, such as Recurrence Quantification Analysis (RQA),
demonstrate the ability to reveal the regularities of the system behavior.
Thus, they can be useful for the analysis of the market state in real time. In
present paper we did an effort to apply the RQA for the purpose of economic
time series monitoring. 12 stock indexes, 6 currency pairs and 4 commodities
were taken for the study.
","[{""version"":""v1"",""created"":""Thu, 1 Dec 2011 20:35:00 GMT""}]","2011-12-02"
"1112.0298","Murray Bremner","Murray R. Bremner, Stavros G. Stavrou","Ranks of 0-1 arrays of size 2 x 2 x 2 and 2 x 2 x 2 x 2","11 pages",,,,"math.CO math.GR","http://arxiv.org/licenses/nonexclusive-distrib/1.0/","  We use computer algebra to determine the ranks of arrays of size 2 x 2 x 2
and 2 x 2 x 2 x 2 with entries in the set {0, 1} regarded as a field with two
elements, as a Boolean algebra, and as non-negative integers. In the field case
we also determine the canonical forms of the arrays with respect to the action
of the direct product of the general linear groups.
","[{""version"":""v1"",""created"":""Thu, 1 Dec 2011 20:36:24 GMT""}]","2011-12-02"
"1112.0299","Schuyler D. van Dyk","Schuyler D. Van Dyk (Spitzer Science Center/Caltech) and Thomas
  Matheson (NOAO)","It's Alive! The Supernova Impostor 1961V","15 pages, 6 figures; corrected use of tau in DUSTY and updated Fig 4
  (thanks, CS Kochanek). Conclusions unchanged. In ApJ",,"10.1088/0004-637X/746/2/179",,"astro-ph.SR astro-ph.CO","http://arxiv.org/licenses/nonexclusive-distrib/1.0/","  Reports of the death of the precursor of Supernova (SN) 1961V in NGC 1058 are
exaggerated. Consideration of the best astrometric data shows that the star,
known as ""Object 7,"" lies at the greatest proximity to SN 1961V and is the
likely survivor of the ""SN impostor"" super-outburst. SN 1961V does not coincide
with a neighboring radio source and is therefore not a radio SN. Additionally,
the current properties of Object 7, based on data obtained with the Hubble
Space Telescope, are consistent with it being a quiescent Luminous Blue
Variable (LBV). Furthermore, post-explosion non-detections by the Spitzer Space
Telescope do not necessarily and sufficiently rule out a surviving LBV. We
therefore consider, based on the available evidence, that it is yet a bit
premature to reclassify SN 1961V as a bona fide SN. The inevitable demise of
this star, though, may not be too far off.
","[{""version"":""v1"",""created"":""Thu, 1 Dec 2011 20:38:31 GMT""},{""version"":""v2"",""created"":""Mon, 19 Dec 2011 13:38:38 GMT""}]","2015-06-03"
"1112.0300","Francisco A. Brito","C. A. G. Almeida, M. A. Anacleto, F. A. Brito, E. Passos","Inflationary Cosmology and Superluminal Neutrinos","Latex, 4 pages, 3 figures",,,,"hep-ph","http://arxiv.org/licenses/nonexclusive-distrib/1.0/","  We show that in the presence of a distance dependent Lorentz-violating
time-like background one may find superluminal neutrinos at some high energy
such as OPERA's scale. The similar behavior but approaching the subluminal
branch is found to appear for inflaton field in the low energy scale. Thus this
scenario seems to be suitable to acomplish both superluminal neutrinos and dark
energy.
","[{""version"":""v1"",""created"":""Thu, 1 Dec 2011 20:39:45 GMT""}]","2011-12-02"
"1112.0301","Chavent Marie","M. Chavent, K. Vanessa and J. Saracco","Orthogonal rotation in PCAMIX",,"Adv Data Anal Classif (2012) 6:131-146","10.1007/s11634-012-0105-3",,"stat.CO","http://arxiv.org/licenses/nonexclusive-distrib/1.0/","  Kiers (1991) considered the orthogonal rotation in PCAMIX, a principal
component method for a mixture of qualitative and quantitative variables.
PCAMIX includes the ordinary principal component analysis (PCA) and multiple
correspondence analysis (MCA) as special cases. In this paper, we give a new
presentation of PCAMIX where the principal components and the squared loadings
are obtained from a Singular Value Decomposition. The loadings of the
quantitative variables and the principal coordinates of the categories of the
qualitative variables are also obtained directly. In this context, we propose a
computationaly efficient procedure for varimax rotation in PCAMIX and a direct
solution for the optimal angle of rotation. A simulation study shows the good
computational behavior of the proposed algorithm. An application on a real data
set illustrates the interest of using rotation in MCA. All source codes are
available in the R package ""PCAmixdata"".
","[{""version"":""v1"",""created"":""Thu, 1 Dec 2011 20:41:01 GMT""}]","2012-12-11"
"1112.0302","Sichun Sun","David B. Kaplan and Sichun Sun","Spacetime as a topological insulator: Mechanism for the origin of the
  fermion generations","Substantially revised version, to appear in Phys. Rev. Lett",,"10.1103/PhysRevLett.108.181807","INT-PUB-11-061","hep-ph cond-mat.mes-hall hep-th","http://arxiv.org/licenses/nonexclusive-distrib/1.0/","  We suggest a mechanism whereby the three generations of quarks and leptons
correspond to surface modes in a five-dimensional theory. These modes arise
from a nonlinear fermion dispersion relation in the extra dimension, much in
the same manner as fermion surface modes in a topological insulator or lattice
implementation of domain wall fermions. We also show that the topological
properties can persist in a deconstructed version of the model in four
dimensions.
","[{""version"":""v1"",""created"":""Thu, 1 Dec 2011 20:41:50 GMT""},{""version"":""v2"",""created"":""Thu, 8 Dec 2011 20:56:57 GMT""},{""version"":""v3"",""created"":""Fri, 13 Apr 2012 19:24:32 GMT""}]","2013-05-30"
"1112.0303","Jolyon Bloomfield","Jolyon K. Bloomfield, Eanna E. Flanagan (Cornell University)","A Class of Effective Field Theory Models of Cosmic Acceleration","43 pages, 2 figures; Version 3 publication version","JCAP 10 (2012) 039","10.1088/1475-7516/2012/10/039",,"gr-qc astro-ph.CO hep-th","http://arxiv.org/licenses/nonexclusive-distrib/1.0/","  We explore a class of effective field theory models of cosmic acceleration
involving a metric and a single scalar field. These models can be obtained by
starting with a set of ultralight pseudo-Nambu-Goldstone bosons whose couplings
to matter satisfy the weak equivalence principle, assuming that one boson is
lighter than all the others, and integrating out the heavier fields. The result
is a quintessence model with matter coupling, together with a series of
correction terms in the action in a covariant derivative expansion, with
specific scalings for the coefficients. After eliminating higher derivative
terms and exploiting the field redefinition freedom, we show that the resulting
theory contains nine independent free functions of the scalar field when
truncated at four derivatives. This is in contrast to the four free functions
found in similar theories of single-field inflation, where matter is not
present. We discuss several different representations of the theory that can be
obtained using the field redefinition freedom. For perturbations to the
quintessence field today on subhorizon lengthscales larger than the Compton
wavelength of the heavy fields, the theory is weakly coupled and natural in the
sense of t'Hooft. The theory admits a regime where the perturbations become
modestly nonlinear, but very strong nonlinearities lie outside its domain of
validity.
","[{""version"":""v1"",""created"":""Thu, 1 Dec 2011 20:42:09 GMT""},{""version"":""v2"",""created"":""Fri, 27 Jan 2012 19:41:31 GMT""},{""version"":""v3"",""created"":""Thu, 15 Nov 2012 03:36:59 GMT""}]","2012-11-16"
"1112.0304","Jacques Soffer","Jacques Soffer","Statistical parton distributions, TMD, positivity and all that","11 pages, 6 figures, Invited talk at the XIV Advanced Research
  Workshop on High Energy Spin Physics, ""`DSPIN-2011""', JINR, Dubna, Russia,
  September 20 - 24, 2011, to appear in the Proceedings",,,,"hep-ph","http://arxiv.org/licenses/nonexclusive-distrib/1.0/","  We briefly recall the main physical features of the parton distributions in
the quantum statistical picture of the nucleon. Some predictions from a
next-to-leading order QCD analysis are successfully compared to recent
unpolarized and polarized experimental results. We will discuss the extension
to the transverse momentum dependence of the parton distributions and its
relevance for semiinclusive deep inelastic scattering. Finally, we will present
some new positivity constraints for spin observables and their implications for
parton distributions.
","[{""version"":""v1"",""created"":""Thu, 1 Dec 2011 20:45:44 GMT""}]","2011-12-02"
"1112.0305","Dhritiman Nandan","Dhritiman Nandan, Anastasia Volovich, Congkao Wen","On Feynman rules for Mellin amplitudes in AdS/CFT","minor corrections, published version",,"10.1007/JHEP05(2012)129",,"hep-th","http://arxiv.org/licenses/nonexclusive-distrib/1.0/","  The computation of CFT correlation functions via Witten diagrams in AdS space
can be simplified via the Mellin transform. Recently a set of Feynman rules for
tree-level Mellin space amplitudes has been proposed for scalar theories. In
this note we derive these rules by explicitly evaluating all of the relevant
Witten diagram integrals for the scalar phi^n theory. We also check that the
rules reduce to the usual Feynman rules in the flat space limit.
","[{""version"":""v1"",""created"":""Thu, 1 Dec 2011 20:47:23 GMT""},{""version"":""v2"",""created"":""Tue, 12 Jun 2012 22:44:48 GMT""}]","2015-06-03"
"1112.0306","R. Michael Rich","R. Michael Rich, Livia Origlia, and Elena Valenti","Detailed abundances for M giants in two inner bulge fields from Infrared
  Spectroscopy","Accepted for publication in the Astrophysical Journal. 27 pages
  manuscript format, 6 figures",,"10.1088/0004-637X/746/1/59",,"astro-ph.GA","http://arxiv.org/licenses/nonexclusive-distrib/1.0/","  We report abundance analysis for 30 M giant stars in two inner Galactic bulge
fields at (l,b)=(0,-1.75) deg and at (l,b)=(1,-2.65) deg, based on R=25,000
infrared spectroscopy from 1.5-1.8um using NIRSPEC at the Keck II telescope. We
find iron abundances of <[Fe/H]>=-0.16 +/- 0.03 dex with a 1-sigma dispersion
of 0.12 +/- 0.02 and <[Fe/H]>=-0.21 +/- 0.02 dex, with a 1-sigma dispersion of
0.09+/- 0.016 for the (l,b)=(0,-1.75) and (l,b)=(1,-2.65) deg fields,
respectively. In agreement with all prior studies, we find enhanced [alpha/Fe]
of +0.3 dex. We confirm the lack of any major vertical abundance or composition
gradient in the innermost ~600 pc between Baade's window and 150 pc from the
Galactic plane. We also confirm that the known enhancement of alpha elements
observed between 500 and 1000 pc from the nucleus is also present over the
volume of the inner bulge and may therefore be presumed to be a general
characteristic of bulge/bar stars within 1 kpc of the Galactic Center.
","[{""version"":""v1"",""created"":""Thu, 1 Dec 2011 20:47:27 GMT""}]","2015-06-03"
"1112.0307","Li Yu","Li Yu","Fast controlled unitary protocols using group or quasigroup structures","Many corrections including a change in the main result in Theorem 3.
  The results in Sec. IV will be improved with a different method in a later
  version",,,,"quant-ph","http://arxiv.org/licenses/nonexclusive-distrib/1.0/","  A nonlocal bipartite unitary gate can sometimes be implemented using prior
entanglement and only one round of classical communication in which the two
parties send messages to each other simultaneously. This cuts the classical
communication time by a half compared to the usual protocols, which require
back-and-forth classical communication. We introduce such a ""fast"" protocol
that can implement a class of controlled unitaries exactly, where the
controlled operators form a subset of a projective representation of a finite
group, which may be Abelian or non-Abelian. The entanglement cost is only
related to the size of the group and is independent of the dimension of the
systems. We also introduce a second fast protocol that can implement any given
controlled unitary approximately. This protocol uses the algebraic structure of
right quasigroups, which are generalizations of quasigroups, the latter being
equivalent to Latin squares. This second protocol could optionally use shared
classical randomness as a resource, in addition to using entanglement. When
compared with other known fast unitary protocols, the entanglement cost of this
second protocol is lower for general controlled unitaries except for some rare
cases.
","[{""version"":""v1"",""created"":""Thu, 1 Dec 2011 20:52:32 GMT""},{""version"":""v2"",""created"":""Tue, 6 Dec 2011 03:43:14 GMT""},{""version"":""v3"",""created"":""Tue, 12 Mar 2013 08:11:55 GMT""}]","2013-03-13"
"1112.0308","Casey Law","Casey J. Law and Geoffrey C. Bower (UC Berkeley)","All Transients, All the Time: Real-Time Radio Transient Detection with
  Interferometric Closure Quantities","Accepted to ApJ. 8 pages, 5 figures, 2 tables. Revised to include
  discussion of non-Gaussian statistics of technique",,"10.1088/0004-637X/749/2/143",,"astro-ph.IM","http://arxiv.org/licenses/nonexclusive-distrib/1.0/","  We demonstrate a new technique for detecting radio transients based on
interferometric closure quantities. The technique uses the bispectrum, the
product of visibilities around a closed-loop of baselines of an interferometer.
The bispectrum is calibration independent, resistant to interference, and
computationally efficient, so it can be built into correlators for real-time
transient detection. Our technique could find celestial transients anywhere in
the field of view and localize them to arcsecond precision. At the Karl G.
Jansky Very Large Array (VLA), such a system would have a high survey speed and
a 5-sigma sensitivity of 38 mJy on 10 ms timescales with 1 GHz of bandwidth.
The ability to localize dispersed millisecond pulses to arcsecond precision in
large volumes of interferometer data has several unique science applications.
Localizing individual pulses from Galactic pulsars will help find X-ray
counterparts that define their physical properties, while finding host galaxies
of extragalactic transients will measure the electron density of the
intergalactic medium with a single dispersed pulse. Exoplanets and active stars
have distinct millisecond variability that can be used to identify them and
probe their magnetospheres. We use millisecond time scale visibilities from the
Allen Telescope Array (ATA) and VLA to show that the bispectrum can detect
dispersed pulses and reject local interference. The computational and data
efficiency of the bispectrum will help find transients on a range of time
scales with next-generation radio interferometers.
","[{""version"":""v1"",""created"":""Thu, 1 Dec 2011 20:55:39 GMT""},{""version"":""v2"",""created"":""Tue, 14 Feb 2012 23:42:04 GMT""}]","2015-06-03"
"1112.0309","Clementina Sasso","C. Sasso, V. Andretta, D. Spadaro and R. Susino","Solar low-lying cool loops and their contribution to the transition
  region EUV output","Accepted for publication in A&A on Nov 25th 2011",,"10.1051/0004-6361/201117580",,"astro-ph.SR","http://arxiv.org/licenses/nonexclusive-distrib/1.0/","  In the last 30 years, the existence of small and cool magnetic loops (height
< 8 Mm, T < 10^5 K) has been proposed and debated to explain the increase of
the DEM (differential emission measure) towards the chromosphere. We present
hydrodynamic simulations of low-lying cool loops to study their conditions of
existence and stability, and their contribution to the transition region EUV
output. We find that stable, quasi-static cool loops (with velocities < 1 km/s)
can be obtained under different and more realistic assumptions on the radiative
losses function with respect to previous works. A mixture of the DEMs of these
cool loops plus intermediate loops with temperatures between 10^5 and 10^6 K
can reproduce the observed emission of the lower transition region at the
critical turn-up temperature point (T ~ 2x10^5 K) and below T = 10^5 K.
","[{""version"":""v1"",""created"":""Thu, 1 Dec 2011 20:56:38 GMT""}]","2015-06-03"
"1112.0310","Denitsa Staicova","Denitsa Staicova and Plamen Fiziev","New results for electromagnetic quasinormal modes of black holes","19 pages, 16 figures. Typos corrected. New references, figures and
  comments added",,,"SU-TH-01-12-2011","astro-ph.HE gr-qc","http://arxiv.org/licenses/nonexclusive-distrib/1.0/","  The differential equations governing the late-time ring-down of the
perturbations of the Kerr metric, the Teukolsky Angular Equation and the
Teukolsky Radial Equation, can be solved analytically in terms of confluent
Heun functions. In this article, for the first time, we use those exact
solutions to obtain the electromagnetic (EM) quasinormal spectra of the Kerr
black hole . This is done by imposing the appropriate boundary conditions on
the solutions and solving numerically the so-obtained two-dimensional
transcendental system.
  The EM QNM spectra are compared with already published results, evaluated
through the continued fraction method. The comparison shows that the modes with
lower $n$ coincide for both methods, while those with higher $n$ may
demonstrate significant deviations. To study those deviations, we employ the
$\epsilon$-method which introduces small variations in the argument of the
complex radial variable. Using the $\epsilon$-method one can move in the
complex $r-$plane the branch cuts of the solutions of the radial equation and
examine the dependence of the spectrum on their position.
  For different values of $\epsilon$, one can obtain both the frequencies
evaluated through the well-established continued fraction method or somewhat
different spectra calculated here for the first time. This result raises the
question what spectrum should be compared with the observational data and why.
This choice should come from better understanding of the physics of the problem
and it may become particularly important considering the recent interest in the
spectra of the electromagnetic counterparts of events producing gravitational
waves.
","[{""version"":""v1"",""created"":""Thu, 1 Dec 2011 20:56:47 GMT""},{""version"":""v2"",""created"":""Wed, 28 Dec 2011 20:06:03 GMT""},{""version"":""v3"",""created"":""Fri, 21 Dec 2012 03:24:45 GMT""}]","2012-12-24"
"1112.0312","Michael Cooper","Michael C. Cooper (UC Irvine), R. Yan, M. Dickinson, S. Juneau, J. M.
  Lotz, J. A. Newman, C. Papovich, S. Salim, G. Walth, B. J. Weiner, C. N. A.
  Willmer","The Arizona CDFS Environment Survey (ACES): A Magellan/IMACS
  Spectroscopic Survey of the Chandra Deep Field South","resubmitted to MNRAS; 12 pages, 12 figures, and 3 tables; updated
  redshift catalog available at http://mur.ps.uci.edu/~cooper/ACES/",,"10.1111/j.1365-2966.2012.21524.x",,"astro-ph.CO astro-ph.GA","http://arxiv.org/licenses/nonexclusive-distrib/1.0/","  We present the Arizona CDFS Environment Survey (ACES), a recently-completed
spectroscopic redshift survey of the Chandra Deep Field South (CDFS) conducted
using IMACS on the Magellan-Baade telescope. In total, the survey targeted 7277
unique sources down to a limiting magnitude of R = 24.1, yielding 5080 secure
redshifts across the ~30' x 30' extended CDFS region. The ACES dataset delivers
a significant increase to both the spatial coverage and the sampling density of
the spectroscopic observations in the field. Combined with
previously-published, spectroscopic redshifts, ACES now creates a
highly-complete survey of the galaxy population at R < 23, enabling the local
galaxy density (or environment) on relatively small scales (~1 Mpc) to be
measured at z < 1 in one of the most heavily-studied and data-rich fields in
the sky. Here, we describe the motivation, design, and implementation of the
survey and present a preliminary redshift and environment catalog. In addition,
we utilize the ACES spectroscopic redshift catalog to assess the quality of
photometric redshifts from both the COMBO-17 and MUSYC imaging surveys of the
CDFS.
","[{""version"":""v1"",""created"":""Thu, 1 Dec 2011 21:00:01 GMT""},{""version"":""v2"",""created"":""Mon, 4 Jun 2012 16:05:09 GMT""}]","2015-06-03"
"1112.0313","Katherine Whitaker","Katherine E. Whitaker, Mariska Kriek, Pieter G. van Dokkum, Rachel
  Bezanson, Gabriel Brammer, Marijn Franx, Ivo Labbe","A Large Population of Massive Compact Post-Starburst Galaxies at z>1:
  Implications for the Size Evolution and Quenching Mechanism of Quiescent
  Galaxies","Accepted for publication in ApJ, 8 pages, 7 figures, 1 table",,"10.1088/0004-637X/745/2/179",,"astro-ph.CO astro-ph.GA","http://arxiv.org/licenses/nonexclusive-distrib/1.0/","  We study the growth of the red sequence through the number density and
structural evolution of a sample of young and old quiescent galaxies at 0<z<2.
The galaxies are selected from the NEWFIRM Medium-Band Survey (NMBS) in the
Cosmic Evolution Survey (COSMOS) field. We find a large population of massive
young recently quenched (""post-starburst"") galaxies at z>1 that are almost
non-existent at z<1; their number density is 5 x 10^{-5} Mpc^{-3} at z=2,
whereas it is a factor of 10 less at z=0.5. The observed number densities of
young and old quiescent galaxies at z>1 are consistent with a simple model in
which all old quiescent galaxies were once identified as post-starburst
galaxies. We find that the overall population of quiescent galaxies have
smaller sizes and slightly more elongated shapes at higher redshift, in
agreement with other recent studies. Interestingly, the most recently quenched
galaxies at 1<z<2 are not larger, and possibly even smaller, than older
galaxies at those redshifts. This result is inconsistent with the idea that the
evolution of the average size of quiescent galaxies is largely driven by
continuous transformations of larger, star-forming galaxies: in that case, the
youngest quiescent galaxies would also be the largest. Instead, mergers or
other mechanisms appear to be required to explain the size growth of quiescent
galaxies from z=2 to the present.
","[{""version"":""v1"",""created"":""Thu, 1 Dec 2011 21:00:01 GMT""},{""version"":""v2"",""created"":""Thu, 8 Dec 2011 17:00:15 GMT""}]","2015-06-03"
"1112.0314","Veronica Biffi","Veronica Biffi, Klaus Dolag, Hans Boehringer, Gerard Lemson","Observing simulated galaxy clusters with PHOX: a novel X-ray photon
  simulator","13 pages, 4 figures, 2 tables. Accepted for publication in MNRAS",,"10.1111/j.1365-2966.2011.20278.x",,"astro-ph.CO astro-ph.HE","http://arxiv.org/licenses/nonexclusive-distrib/1.0/","  We present a novel, virtual X-ray observatory designed to obtain synthetic
observations from hydro-numerical simulations, named PHOX. In particular, we
provide a description of the code constituting the photon simulator and of the
new approach implemented. We apply PHOX to simulated galaxy clusters in order
to demonstrate its capabilities. In fact, X-ray observations of clusters of
galaxies continue to provide us with an increasingly detailed picture of their
structure and of the underlying physical phenomena governing the gaseous
component, which dominates their baryonic content. Therefore, it is fundamental
to find the most direct and faithful way to compare such observational data
with hydrodynamical simulations of cluster-like objects, which can currently
include various complex physical processes. Here, we present and analyse
synthetic Suzaku observations of two cluster-size haloes obtained by processing
with PHOX the hydrodynamical simulation of the large-scale, filament-like
region in which they reside. Taking advantage of the simulated data, we test
the results inferred from the X-ray analysis of the mock observations against
the underlying, known solution. Remarkably, we are able to recover the
theoretical temperature distribution of the two haloes by means of the
multi-temperature fitting of the synthetic spectra. Moreover, the shapes of the
reconstructed distributions allow us to trace the different thermal structure
that distinguishes the dynamical state of the two haloes.
","[{""version"":""v1"",""created"":""Thu, 1 Dec 2011 21:00:01 GMT""}]","2015-06-03"
