"1112.0220","Svante Janson","Svante Janson","Stable distributions","37 pages. Further results and examples added. Still a survey without
  new results",,,,"math.PR","http://arxiv.org/licenses/nonexclusive-distrib/1.0/","  We give some explicit calculations for stable distributions and convergence
to them, mainly based on less explicit results in Feller (1971). The main
purpose is to provide ourselves with easy reference to explicit formulas and
examples. (There are probably no new results.)
","[{""version"":""v1"",""created"":""Thu, 1 Dec 2011 16:04:23 GMT""},{""version"":""v2"",""created"":""Wed, 21 Dec 2011 19:31:00 GMT""},{""version"":""v3"",""created"":""Thu, 24 Feb 2022 15:09:22 GMT""}]","2022-02-25"
"1112.0221","John Fearnley","John Fearnley (University of Liverpool), Sven Schewe (University of
  Liverpool)","Time and Parallelizability Results for Parity Games with Bounded Tree
  and DAG Width",,"Logical Methods in Computer Science, Volume 9, Issue 2 (June 18,
  2013) lmcs:791","10.2168/LMCS-9(2:6)2013",,"cs.GT","http://arxiv.org/licenses/nonexclusive-distrib/1.0/","  Parity games are a much researched class of games in NP intersect CoNP that
are not known to be in P. Consequently, researchers have considered specialised
algorithms for the case where certain graph parameters are small. In this
paper, we study parity games on graphs with bounded treewidth, and graphs with
bounded DAG width. We show that parity games with bounded DAG width can be
solved in O(n^(k+3) k^(k + 2) (d + 1)^(3k + 2)) time, where n, k, and d are the
size, treewidth, and number of priorities in the parity game. This is an
improvement over the previous best algorithm, given by Berwanger et al., which
runs in n^O(k^2) time. We also show that, if a tree decomposition is provided,
then parity games with bounded treewidth can be solved in O(n k^(k + 5) (d +
1)^(3k + 5)) time. This improves over previous best algorithm, given by
Obdrzalek, which runs in O(n d^(2(k+1)^2)) time. Our techniques can also be
adapted to show that the problem of solving parity games with bounded treewidth
lies in the complexity class NC^2, which is the class of problems that can be
efficiently parallelized. This is in stark contrast to the general parity game
problem, which is known to be P-hard, and thus unlikely to be contained in NC.
","[{""version"":""v1"",""created"":""Thu, 1 Dec 2011 16:05:26 GMT""},{""version"":""v2"",""created"":""Thu, 9 Feb 2012 15:42:30 GMT""},{""version"":""v3"",""created"":""Mon, 10 Sep 2012 15:43:53 GMT""},{""version"":""v4"",""created"":""Tue, 16 Apr 2013 15:52:27 GMT""},{""version"":""v5"",""created"":""Thu, 13 Jun 2013 12:30:42 GMT""},{""version"":""v6"",""created"":""Mon, 17 Jun 2013 19:58:44 GMT""}]","2015-07-01"
"1112.0222","Jean Schneider","Jean Schneider","Philosophy and problems of the definition of Extraterrestrial Life","Contribution to the Conference ""Philosophy and History of
  Astrobiology"" Pufendorf Institute, 27-28 Seeptember 2011 - submitted to
  Astrobiology",,,,"physics.hist-ph astro-ph.EP physics.pop-ph","http://arxiv.org/licenses/nonexclusive-distrib/1.0/","  When we try to search for extraterrestrial life and intelligence, we have to
follow some guidelines. The first step is to clarify what is to be meant by
""Life"" and ""intelligence"", i.e. an attempt to define these words. The word
""definition"" refers to two different situations. First, it means an arbitrary
convention. On the other hand it also often designates an attempt to clarify
the content of a pre-existing word for which we have some spontaneous
preconceptions, whatever their grounds, and to catch an (illusory) ""essence"" of
what is defined. It is then made use of pre-existing plain language words which
carry an a priori pre-scientific content likely to introduce some confusion in
the reader's mind. The complexity of the problem will be analyzed and we will
show that some philosophical prejudice is unavoidable. There are two types of
philosophy: ""Natural Philosophy"", seeking for some essence of things, and
""Critical (or analytical) Philosophy"", devoted to the analysis of the
procedures by which we claim to construct a reality. An extension of Critical
Philosophy, Epistemo-Analysis (i.e. the Psycho-Analysis of concepts) is
presented and applied to the defintion of Life and to Astrobiology.
","[{""version"":""v1"",""created"":""Thu, 1 Dec 2011 16:06:13 GMT""},{""version"":""v2"",""created"":""Sat, 3 Dec 2011 10:36:29 GMT""}]","2011-12-06"
"1112.0223","Cristian Andr\'es Giuppone","C. A. Giuppone, P. Benitez-Llambay and C. Beauge","Origin and Detectability of coorbital planets from radial velocity data","14 pages, 16 figures.2012. MNRAS, 421, 356",,"10.1111/j.1365-2966.2011.20310.x",,"astro-ph.EP","http://arxiv.org/licenses/nonexclusive-distrib/1.0/","  We analyze the possibilities of detection of hypothetical exoplanets in
coorbital motion from synthetic radial velocity (RV) signals, taking into
account different types of stable planar configurations, orbital eccentricities
and mass ratios. For each nominal solution corresponding to small-amplitude
oscillations around the periodic solution, we generate a series of synthetic RV
curves mimicking the stellar motion around the barycenter of the system. We
then fit the data sets obtained assuming three possible different orbital
architectures: (a) two planets in coorbital motion, (b) two planets in a 2/1
mean-motion resonance, and (c) a single planet. We compare the resulting
residuals and the estimated orbital parameters.
  For synthetic data sets covering only a few orbital periods, we find that the
discrete radial velocity signal generated by a coorbital configuration could be
easily confused with other configurations/systems, and in many cases the best
orbital fit corresponds to either a single planet or two bodies in a 2/1
resonance. However, most of the incorrect identifications are associated to
dynamically unstable solutions.
  We also compare the orbital parameters obtained with two different fitting
strategies: a simultaneous fit of two planets and a nested multi-Keplerian
model. We find that the nested models can yield incorrect orbital
configurations (sometimes close to fictitious mean-motion resonances) that are
nevertheless dynamically stable and with orbital eccentricities lower than the
correct nominal solutions.
  Finally, we discuss plausible mechanisms for the formation of coorbital
configurations, by the interaction between two giant planets and an inner
cavity in the gas disk. For equal mass planets, both Lagrangian and
anti-Lagrangian configurations can be obtained from same initial condition
depending on final time of integration.
","[{""version"":""v1"",""created"":""Thu, 1 Dec 2011 16:08:13 GMT""},{""version"":""v2"",""created"":""Fri, 16 Mar 2012 18:01:48 GMT""}]","2015-06-03"
"1112.0224","Guenter Grindhammer","Guenter Grindhammer","Determination of PDFs and $\alpha_{S}(M_{Z})$ from Inclusive and Jet
  Measurements in DIS @ HERA","3 pages, 2 figures, to appear in the proceedings of the PANIC'11
  conference, Cambridge, MA, USA, July 24-29, 2011",,"10.1063/1.3700518",,"hep-ex","http://arxiv.org/licenses/nonexclusive-distrib/1.0/","  A simultaneous NLO QCD fit of the parton density functions (PDFs) of the
proton and of the strong coupling $\alpha_{S}(M_{Z})$ is presented. The
analysis is based on combined H1 and ZEUS inclusive DIS cross section
measurements together with inclusive jet cross section measurements provided by
both H1 and ZEUS collaborations. The inclusion of the jet data significantly
reduces the correlation between the gluon PDF and the strong coupling,
improving the precision of the gluon PDF and providing an accurate
determination of $\alpha_{S}(M_{Z})$ using DIS data from HERA only.
","[{""version"":""v1"",""created"":""Thu, 1 Dec 2011 16:09:55 GMT""}]","2015-06-03"
"1112.0226","Giovanni Salvi","Guglielmo D'Amico, Raimondo Manca and Giovanni Salvi","Bivariate Semi-Markov Process for Counterparty Credit Risk",,,,,"math.PR q-fin.CP q-fin.RM","http://arxiv.org/licenses/nonexclusive-distrib/1.0/","  We consider the problem of constructing an appropriate multivariate model for
the study of the counterparty credit risk in credit rating migration problem.
For this financial problem different multivariate Markov chain models were
proposed. However the markovian assumption may be inappropriate for the study
of the dynamic of credit ratings which typically show non markovian like
behaviour. In this paper we develop a semi-Markov approach to the study of the
counterparty credit risk by defining a new multivariate semi-Markov chain
model. Methods are given for computing the transition probabilities,
reliability functions and the price of a risky Credit Default Swap.
","[{""version"":""v1"",""created"":""Thu, 1 Dec 2011 16:11:57 GMT""},{""version"":""v2"",""created"":""Fri, 5 Oct 2012 08:53:13 GMT""}]","2012-10-08"
"1112.0227","Erika Meucci","Erika Meucci","Boundary of the Relative Outer Space","13 pages, 1 figure",,,,"math.GT math.GR","http://arxiv.org/licenses/nonexclusive-distrib/1.0/","  Let $\mathcal{A} = {A_1, ..., A_k}$ be a system of free factors of $F_n$. The
group of relative automorphisms $\mathrm{Aut}(F_n; \mathcal{A})$ is the group
given by the automorphisms of $F_n$ that restricted to each $A_i$ are
conjugations by elements in $F_n$. The group of relative outer automorphisms is
defined as $\mathrm{Out}(F_n; \mathcal{A}) = \mathrm{Aut}(F_n; \mathcal{A}) /
\mathrm{Inn}(F_n)$, where $\mathrm{Inn (F_n)$ is the normal subgroup of
$\mathrm{Aut}(F_n)$ given by all the inner automorphisms. This group acts on
the relative outer space $\mathrm{CV}_n(\mathcal{A})$. We prove that the
dimension of the boundary of the relative outer space is
$\mathrm{dim}(\mathrm{CV}_n(\mathcal{A}))-1$.
","[{""version"":""v1"",""created"":""Thu, 1 Dec 2011 16:17:42 GMT""}]","2011-12-02"
"1112.0228","Matias Dahl F.","Ioan Bucataru and Matias F. Dahl","k-Parameter geodesic variations",,"Journal of Geometry and Physics 62 (2012) 2121-2132","10.1016/j.geomphys.2012.06.006",,"math.DG","http://arxiv.org/licenses/nonexclusive-distrib/1.0/","  Suppose $S$ is a semispray on a manifold $M$. We know that the complete lift
$S^c$ of $S$ is a semispray on $TM$ with the property that geodesics of $S^c$
correspond to Jacobi fields of $S$. In this note we generalize this result and
show how geodesic variations of $k$-variables are related to geodesics of the
$k$th iterated complete lift of $S$. Moreover, for sprays (that is, homogeneous
semisprays) we show how geodesic variations of $(n-1)$-variables are related to
a natural generalisation of Jacobi tensors.
","[{""version"":""v1"",""created"":""Thu, 1 Dec 2011 16:17:51 GMT""}]","2012-07-17"
"1112.0229","Stefan A. Maier","Stefan A. Maier and Carsten Honerkamp","Effective three-particle interactions in low-energy models for multiband
  systems","revised version, 16 pages, 13 figures","Phys. Rev. B 85, 064520 (2012)","10.1103/PhysRevB.85.064520",,"cond-mat.str-el cond-mat.supr-con","http://arxiv.org/licenses/nonexclusive-distrib/1.0/","  We discuss different approximations for effective low-energy interactions in
multi-band models for weakly correlated electrons. In the study of Fermi
surface instabilities of the conduction band(s), the standard approximation
consists only keeping those terms in the bare interactions that couple only to
the conduction band(s), while corrections due to virtual excitations into bands
away from the Fermi surface are typically neglected. Here, using a functional
renormalization group approach, we present an improved truncation for the
treatment of the effective interactions in the conduction band that keeps track
of the generated three-particle interactions (six-point term) and hence allows
one to include important aspects of these virtual interband excitations. Within
a simplified two-patch treatment of the conduction band, we demonstrate that
these corrections can have a rather strong effect in parts of the phase diagram
by changing the critical scales for various orderings and the phase boundaries.
","[{""version"":""v1"",""created"":""Thu, 1 Dec 2011 16:23:18 GMT""},{""version"":""v2"",""created"":""Fri, 24 Feb 2012 12:17:03 GMT""}]","2012-02-29"
"1112.0230","R. James Shank","H. E. A. Campbell, R. J. Shank, D. L. Wehlau","Rings of invariants for modular representations of elementary abelian
  p-groups","We have corrected the statement of Theorem 5.4 and the proofs of
  Theorems 7.4, 8.6, and 8.10",,,,"math.AC math.AG math.RT","http://arxiv.org/licenses/nonexclusive-distrib/1.0/","  We initiate a study of the rings of invariants of modular representations of
elementary abelian p-groups. With a few notable exceptions, the modular
representation theory of an elementary abelian p-group is wild. However, for a
given dimension, it is possible to parameterise the representations. We
describe parameterisations for modular representations of dimension two and of
dimension three. We compute the ring of invariants for all two dimensional
representations; these rings are generated by two algebraically independent
elements. We compute the ring of invariants of the symmetric square of a two
dimensional representation; these rings are hypersurfaces. We compute the ring
of invariants for all three dimensional representations of rank at most three;
these rings are complete intersections with embedding dimension at most five.
We conjecture that the ring of invariants for any three dimensional
representation of an elementary abelian p-group is a complete intersection.
","[{""version"":""v1"",""created"":""Thu, 1 Dec 2011 16:26:59 GMT""},{""version"":""v2"",""created"":""Thu, 10 May 2012 11:47:26 GMT""}]","2012-05-11"
"1112.0231","Changqing Jin","K. Zhao, Q. Q. Liu, X. C. Wang, Z. Deng, Y. X. Lv, J. L. Zhu, F. Y.
  Li, C. Q.Jin","The doping dependence of superconductivity of (Ca1-xNax)Fe2As2",,"Phys. Rev B 84, 184534(2011)",,,"cond-mat.supr-con cond-mat.mtrl-sci cond-mat.str-el","http://arxiv.org/licenses/nonexclusive-distrib/1.0/","  Single crystalline CaFe2As2 and (Ca1-xNax)Fe2As2 polycrystals (0 < x < 0.66)
are synthesized and characterized using structural, magnetic, electronic
transport, and heat capacity measurements. These measurements show that the
structural/magnetic phase transition in CaFe2As2 at 165 K is monotonically
suppressed by the Na doping and that superconductivity can be realized over a
wide doping region. For 0.3 < x < 0.36, the magnetic susceptibilities indicate
the possible coexistence of the spin density wave (SDW) and superconductivity.
Superconducting phases corresponding to the Na doping level in (Ca1-xNax)Fe2As2
for nominal x = 0.36, 0.4, 0.5, 0.6, and 0.66, with Tc = 17 K, 19 K, 22 K, 33
K, and 33 K, respectively, are identified. The effects of the magnetic field on
the superconductivity transitions for x = 0.66 samples with high upper critical
fields Hc2 \approx 103 T are studied, and a phase diagram of the SDW and
superconductivity as a function of the doping level is thus presented.
","[{""version"":""v1"",""created"":""Thu, 1 Dec 2011 16:30:48 GMT""}]","2011-12-02"
"1112.0232","David Jensen","Noah Giansiracusa, David Jensen, and Han-Bom Moon","GIT Compactifications of M_{0,n} and Flips","Final version to appear in Advances",,,,"math.AG","http://arxiv.org/licenses/nonexclusive-distrib/1.0/","  We use geometric invariant theory (GIT) to construct a large class of
compactifications of the moduli space M_{0,n}. These compactifications include
many previously known examples, as well as many new ones. As a consequence of
our GIT approach, we exhibit explicit flips and divisorial contractions between
these spaces.
","[{""version"":""v1"",""created"":""Thu, 1 Dec 2011 16:31:19 GMT""},{""version"":""v2"",""created"":""Fri, 5 Feb 2016 18:24:38 GMT""}]","2016-02-08"
"1112.0233","Goetz Seibold","Michael Pickhardt and Goetz Seibold","Income Tax Evasion Dynamics: Evidence from an Agent-based Econophysics
  Model","24 pages, 8 figures",,,,"physics.soc-ph q-fin.ST","http://arxiv.org/licenses/nonexclusive-distrib/1.0/","  We analyze income tax evasion dynamics in a standard model of statistical
mechanics, the Ising model of ferromagnetism. However, in contrast to previous
research, we use an inhomogeneous multi-dimensional Ising model where the local
degrees of freedom (agents) are subject to a specific social temperature and
coupled to external fields which govern their social behavior. This new
modeling frame allows for analyzing large societies of four different and
interacting agent types. As a second novelty, our model may reproduce results
from agent-based models that incorporate standard Allingham and Sandmo tax
evasion features as well as results from existing two-dimensional Ising based
tax evasion models. We then use our model for analyzing income tax evasion
dynamics under different enforcement scenarios and point to some policy
implications.
","[{""version"":""v1"",""created"":""Thu, 1 Dec 2011 16:36:42 GMT""}]","2011-12-02"
"1112.0234","Simon Weissenborn","Simon Weissenborn, Debarati Chatterjee, Juergen Schaffner-Bielich","Hyperons and massive neutron stars: vector repulsion and SU(3) symmetry","13 pages, 10 figures","Phys. Rev. C 85, 065802 (2012)","10.1103/PhysRevC.85.065802",,"astro-ph.HE nucl-th","http://arxiv.org/licenses/nonexclusive-distrib/1.0/","  With the discovery of massive neutron stars such as PSR J1614-2230, the
question has arisen whether exotic matter such as hyperons can exist in the
neutron star core. We examine the conditions under which hyperons can exist in
massive neutron stars. We consistently investigate the vector meson-hyperon
coupling, going from SU(6) quark model to a broader SU(3) symmetry. We propose
that the maximum neutron star mass decreases linearly with the strangeness
content f_s of the neutron star core as M_max(f_s) = M_max(0) - 0.6 M_solar
(f_s/0.1), which seems to be independent of the underlying nuclear equation of
state and the vector baryon-meson coupling scheme. Thus, pulsar mass
measurements can be used to constrain the hyperon fraction in neutron stars.
","[{""version"":""v1"",""created"":""Thu, 1 Dec 2011 16:37:04 GMT""},{""version"":""v2"",""created"":""Mon, 18 Jun 2012 11:40:15 GMT""}]","2012-06-19"
"1112.0235","Sergey Khrapak","Sergey A. Khrapak and Gregor E. Morfill","Ionization enhanced ion collection by a small floating grain in plasmas","7 pages, 1 figure, submitted to Physics of Plasmas","Phys. Plasmas 19, 024510 (2012)","10.1063/1.3685756",,"physics.plasm-ph","http://arxiv.org/licenses/nonexclusive-distrib/1.0/","  It is demonstrated that the ionization events in the vicinity of a small
floating grain can increase the ion flux to its surface. In this respect the
effect of electron impact ionization is fully analogous to that of the
ion-neutral resonant charge exchange collisions. Both processes create slow ion
which cannot overcome grain' electrical attraction and eventually fall onto its
surface. The relative importance of ionization and ion-neutral collisions is
roughly given by the ratio of the corresponding frequencies. We have evaluated
this ratio for neon and argon plasmas to demonstrate that ionization enhanced
ion collection can indeed be an important factor affecting grain charging in
realistic experimental conditions.
","[{""version"":""v1"",""created"":""Thu, 1 Dec 2011 16:37:58 GMT""}]","2012-03-13"
"1112.0236","Cecilia Fari\~na","Cecilia Farina, Guillermo L. Bosch, and Rodolfo H. Barba","Unveiling the new generation of stars in NGC 604 with Gemini-NIRI","Article accepted for publication in The Astronomical Journal. 19
  pages, 12 figures, 5 tables",,"10.1088/0004-6256/143/2/43",,"astro-ph.CO","http://arxiv.org/licenses/nonexclusive-distrib/1.0/","  We present a near infrared study focused on the detection and
characterization of the youngest stellar component of the NGC 604 giant
star-forming region, in the Triangulum galaxy (M 33). By means of color-color
diagrams derived from the photometry of JHKs images taken with Gemini-NIRI, we
have found 68 candidate massive young stellar objects. The spatial distribution
of these sources matches the areas where previous studies suggested that star
formation might be taking place, and the high spatial resolution of our deep
NIRI imaging allows to pinpoint the star-forming knots. An analysis of the
fraction of objects that show infrared excess suggests that the star formation
is still active, supporting the presence of a second generation of stars being
born, although the evidence for or against sequential star formation does not
seem to be conclusive.
","[{""version"":""v1"",""created"":""Thu, 1 Dec 2011 16:40:46 GMT""}]","2015-06-03"
"1112.0237","Wei Wang","Wei Wang","Factorization of Heavy-to-Light Baryonic Transitions in SCET","18 pages, 2 figures, references and more discussions added; journal
  version","Physics Letters B 708 (2012) 119--126","10.1016/j.physletb.2012.01.036","DESY 11-228","hep-ph","http://arxiv.org/licenses/nonexclusive-distrib/1.0/","  In the framework of the soft-collinear effective theory, we demonstrate that
the leading-power heavy-to-light baryonic form factors at large recoil obey the
heavy quark and large energy symmetries. Symmetry breaking effects are
suppressed by ${\Lambda}/m_{b}$ or $\Lambda/E$, where $\Lambda$ is the hadronic
scale, $m_b$ is the $b$ quark mass and $E\sim m_b$ is the energy of light
baryon in the final state. At leading order, the leading power baryonic form
factor $\xi_{\Lambda,p}(E)$, in which two hard-collinear gluons are exchanged
in the baryon constituents, can factorize into the soft and collinear matrix
elements convoluted with a hard-kernel of order $\alpha_s^2$. Including the
energy release dependence, we derive the scaling law $\xi_{\Lambda,p}(E)\sim
\Lambda^2 /E^2$. We also find that this form factor $\xi_{\Lambda}(E)$ is
numerically smaller than the form factor governed by soft processes, although
the latter is formally power-suppressed.
","[{""version"":""v1"",""created"":""Thu, 1 Dec 2011 16:46:19 GMT""},{""version"":""v2"",""created"":""Tue, 6 Dec 2011 11:46:13 GMT""},{""version"":""v3"",""created"":""Wed, 8 Feb 2012 16:07:29 GMT""}]","2015-06-03"
"1112.0238","Tommaso Spadaro","Tommaso Spadaro, Albert Young","V_ud and V_us: CKM 2010 working group I summary","Proceedings of CKM2010, the 6th International Workshop on the CKM
  Unitarity Triangle, University of Warwick, UK, 6-10 September 2010.
  Corresponding authors: A. Young (aryoung@ncsu.edu) and T. Spadaro
  (tommaso.spadaro@lnf.infn.it). 25 pages, 12 figures",,,,"hep-ex","http://arxiv.org/licenses/nonexclusive-distrib/1.0/","  The present status of universality tests of the weak couplings for quarks and
leptons is reviewed, with updated information for the muon lifetime and for
first-row inputs in the CKM matrix. We discuss the impact of this
high-precision SM test in constraining new physics models. We also discuss a
precise lepton flavor-violation test from leptonic K decays and recent progress
in K-Kbar mixing.
","[{""version"":""v1"",""created"":""Thu, 1 Dec 2011 16:50:41 GMT""}]","2011-12-02"
"1112.0239","Maxim Dvornikov","Maxim Dvornikov (University of S\~ao Paulo, IZMIRAN)","Quantum exchange interaction of spherically symmetric plasmoids","11 pages in LaTeX2e, two columns, 2 eps figures; paper was
  significantly revised, more realistic values for plasma parameters are used,
  several references were added; matches version to be published in J. Atm.
  Solar-Terr. Phys","J. Atm. Solar-Terr. Phys. vol. 89, pp. 62-66 (2012)","10.1016/j.jastp.2012.08.005",,"physics.plasm-ph cond-mat.soft physics.ao-ph","http://arxiv.org/licenses/nonexclusive-distrib/1.0/","  We study nano-sized spherically symmetric plasma structures which are radial
nonlinear oscillations of electrons in plasma. The effective interaction of
these plasmoids via quantum exchange forces between ions is described. We
calculate the energy of this interaction for the case of a dense plasma. The
conditions when the exchange interaction is attractive are examined and it is
shown that separate plasmoids can form a single object. The application of our
results to the theoretical description of stable atmospheric plasma structures
is considered.
","[{""version"":""v1"",""created"":""Thu, 1 Dec 2011 16:53:52 GMT""},{""version"":""v2"",""created"":""Fri, 24 Aug 2012 16:00:38 GMT""}]","2012-09-11"
"1112.0240","Oleksandr Kyriienko","Oleksandr Kyriienko and Ivan A. Shelykh","Intersubband polaritonics revisited",,"J. Nanophoton. 6, 061804 (2012)","10.1117/1.JNP.6.061804",,"cond-mat.mtrl-sci cond-mat.mes-hall physics.optics","http://arxiv.org/licenses/nonexclusive-distrib/1.0/","  We revisited the intersubband polaritonics - the branch of mesoscopic physics
having a huge potential for optoelectronic applications in the infrared and
terahertz domains - and found that, contrary to the general opinion, the
Coulomb interactions play crucial role in the processes of light-matter
coupling in the considered systems. Electron-electron and electron-hole
interactions radically change the nature of the elementary excitations in these
systems. We show that intersubband polaritons represent the result of the
coupling of a photonic mode with collective excitations, and not
non-interacting electron-hole pairs as it was supposed in the previous works on
the subject.
","[{""version"":""v1"",""created"":""Thu, 1 Dec 2011 16:54:02 GMT""},{""version"":""v2"",""created"":""Mon, 4 Mar 2013 07:55:25 GMT""}]","2013-03-05"
