"1112.0407","Vincenzo Galdi","Giuseppe Castaldi, Vincenzo Galdi, Andrea Alu', and Nader Engheta","Nonlocal transformation optics","6 pages, 3 figures; supplementary material available online",,"10.1103/PhysRevLett.108.063902",,"physics.optics cond-mat.mtrl-sci","http://arxiv.org/licenses/nonexclusive-distrib/1.0/","  We show that the powerful framework of transformation optics may be exploited
for engineering the nonlocal response of artificial electromagnetic materials.
Relying on the form-invariant properties of coordinate-transformed Maxwell's
equations in the spectral domain, we derive the general constitutive
""blueprints"" of transformation media yielding prescribed nonlocal
field-manipulation effects, and provide a physically-incisive and powerful
geometrical interpretation in terms of deformation of the equi-frequency
contours. In order to illustrate the potentials of our approach, we present an
example of application to a wave-splitting refraction scenario, which may be
implemented via a simple class of artificial materials. Our results provide a
systematic and versatile framework which may open intriguing venues in
dispersion engineering of artificial materials.
","[{""version"":""v1"",""created"":""Fri, 2 Dec 2011 09:19:10 GMT""}]","2015-06-03"
"1112.0408","Kentaro Tanabe","Kentaro Tanabe, Tetsuya Shiromizu, Shunichiro Kinoshita","Late-time symmetry near black hole horizons","12 pages, published version in PRD","Phys.Rev.D85:024048,2012","10.1103/PhysRevD.85.024048","YITP-11-99","gr-qc astro-ph.CO","http://creativecommons.org/licenses/publicdomain/","  It is expected that black holes are formed dynamically under the
gravitational collapses and approach to the stationary states. In this paper,
we show that the asymptotic Killing vector at late time should exist on the
horizon and then that it can be extended to the out of black holes under the
assumption of the analyticity of spacetimes. This fact implies that if there is
another asymptotic Killing vector which becomes stationary Killing at far
region and spacelike in ""ergoregion"", the rotating black holes may have the
asymptotically axisymmetric Killing vector at late time. Thus, we may expect
that the asymptotic rigidity of the black holes holds.
","[{""version"":""v1"",""created"":""Fri, 2 Dec 2011 09:30:17 GMT""},{""version"":""v2"",""created"":""Wed, 25 Jan 2012 00:32:38 GMT""}]","2012-02-01"
"1112.0409","Peter Horvathy","P-M. Zhang and P. A. Horvathy","Chiral decomposition in the non-commutative Landau problem","23 pages, 22 figures, in press in Annals of Physics",,"10.1016/j.aop.2012.02.014",,"hep-th cond-mat.str-el math-ph math.MP","http://arxiv.org/licenses/nonexclusive-distrib/1.0/","  The decomposition of the non-commutative Landau (NCL) system into two
uncoupled one-dimensional chiral components, advocated by Alvarez, Gomis,
Kamimura and Plyushchay [1], is generalized to nonvanishing electric fields.
This allows us to discuss the main properties of the NCL problem including its
exotic Newton-Hooke symmetry and its relation to the Hall effect. The ""phase
transition"" when the magnetic field crosses a critical value determined by the
non-commutative parameter is studied in detail.
","[{""version"":""v1"",""created"":""Fri, 2 Dec 2011 09:34:12 GMT""},{""version"":""v2"",""created"":""Tue, 13 Mar 2012 10:29:30 GMT""}]","2012-03-14"
"1112.0410","Kaishun  Wang","Qian Kong, Benjian Lv and Kaishun Wang","Terwilliger algebra of Odd graphs","7 pages",,,,"math.CO","http://arxiv.org/licenses/nonexclusive-distrib/1.0/","  In [The Terwilliger algebra of the Johnson schemes, Discrete Mathematics 307
(2007) 1621--1635], Levstein and Maldonado computed the Terwilliger algebra of
the Johnson scheme $J(n,m)$ when $3m\leq n$. The distance-$m$ graph of
$J(2m+1,m)$ is the Odd graph $O_{m+1}$. In this paper, we determine the
Terwilliger algebra of $O_{m+1}$ and give its basis.
","[{""version"":""v1"",""created"":""Fri, 2 Dec 2011 09:34:16 GMT""}]","2011-12-05"
"1112.0411","Richard J.A.M. Stevens","Richard J. A. M. Stevens, Herman J. H. Clercx, Detlef Lohse","Breakdown of the large-scale wind in \Gamma=1/2 rotating
  Rayleigh-B\'enard flow","10 pages, 6 figures","Phys. Rev. E 86, 056311 (2012)","10.1103/PhysRevE.86.056311",,"physics.flu-dyn","http://arxiv.org/licenses/nonexclusive-distrib/1.0/","  Experiments and simulations of rotating Rayleigh-B\'enard convection in
cylindrical samples have revealed an increase in heat transport with increasing
rotation rate. This heat transport enhancement is intimately related to a
transition in the turbulent flow structure from a regime dominated by a
large-scale circulation (LSC), consisting of a single convection roll, at no or
weak rotation to a regime dominated by vertically-aligned vortices at strong
rotation. For a sample with an aspect ratio \Gamma = D/L = 1 (D is the sample
diameter and L its height) the transition between the two regimes is indicated
by a strong decrease in the LSC strength. In contrast, for \Gamma = 1/2 Weiss
and Ahlers [J. Fluid Mech. {\bf{688}}, 461 (2011)] revealed the presence of a
LSC-like sidewall temperature signature beyond the critical rotation rate. They
suggested that this might be due to the formation of a two-vortex state, in
which one vortex extends vertically from the bottom into the sample interior
and brings up warm fluid, while another vortex brings down cold fluid from the
top; this flow field would yield a sidewall temperature signature similar to
that of the LSC. Here we show by direct numerical simulations for \Gamma= 1/2
and parameters that allow direct comparison with experiment that the spatial
organization of the vertically-aligned vortical structures in the convection
cell do indeed yield (for the time average) a sinusoidal variation of the
temperature near the sidewall, as found in the experiment. This is also the
essential and non-trivial difference with the \Gamma=1 sample, where the
vertically-aligned vortices are distributed randomly.
","[{""version"":""v1"",""created"":""Fri, 2 Dec 2011 09:45:05 GMT""},{""version"":""v2"",""created"":""Mon, 20 Feb 2012 13:00:13 GMT""},{""version"":""v3"",""created"":""Mon, 25 Jun 2012 23:14:55 GMT""},{""version"":""v4"",""created"":""Thu, 15 Nov 2012 17:25:40 GMT""}]","2012-11-26"
"1112.0412","Benedikt Biedermann","Simon Badger, Benedikt Biedermann and Peter Uwer","Numerical evaluation of one-loop QCD amplitudes","Talk given at ACAT 2011 conference in London, 5-9 September","Journal of Physics: Conference Series 368 (2012) 012055","10.1088/1742-6596/368/1/012055","HU-EP-11/56, SFB/CPP-11-74","hep-ph","http://arxiv.org/licenses/nonexclusive-distrib/1.0/","  We present the publicly available program NGluon allowing the numerical
evaluation of primitive amplitudes at one-loop order in massless QCD. The
program allows the computation of one-loop amplitudes for an arbitrary number
of gluons. The focus of the present article is the extension to one-loop
amplitudes including an arbitrary number of massless quark pairs. We discuss in
detail the algorithmic differences to the pure gluonic case and present cross
checks to validate our implementation. The numerical accuracy is investigated
in detail.
","[{""version"":""v1"",""created"":""Fri, 2 Dec 2011 09:50:00 GMT""}]","2012-08-02"
"1112.0413","Jeremy Faupin","Laurent Amour and J\'er\'emy Faupin","Hyperfine splitting in non-relativistic QED: uniqueness of the dressed
  hydrogen atom ground state","22 pages, 3 figures",,"10.1007/s00220-012-1625-6",,"math-ph math.MP math.SP","http://arxiv.org/licenses/nonexclusive-distrib/1.0/","  We consider a free hydrogen atom composed of a spin-1/2 nucleus and a
spin-1/2 electron in the standard model of non-relativistic QED. We study the
Pauli-Fierz Hamiltonian associated with this system at a fixed total momentum.
For small enough values of the fine-structure constant, we prove that the
ground state is unique. This result reflects the hyperfine structure of the
hydrogen atom ground state.
","[{""version"":""v1"",""created"":""Fri, 2 Dec 2011 09:51:58 GMT""}]","2015-06-03"
"1112.0414","Ignacio Negueruela","Ignacio Negueruela and Amparo Marco (Alicante)","The young open cluster Berkeley 55","Accepted for publication in the Astronomical Journal. Tables 3, 6 and
  7 are published electronically, and only the first few rows are shown here","The Astronomical Journal, 143, 46 (2012)","10.1088/0004-6256/143/2/46",,"astro-ph.GA astro-ph.SR","http://arxiv.org/licenses/nonexclusive-distrib/1.0/","  We present UBV photometry of the highly reddened and poorly studied open
cluster Berkeley 55, revealing an important population of B-type stars and
several evolved stars of high luminosity. Intermediate resolution far-red
spectra of several candidate members confirm the presence of one F-type
supergiant and six late supergiants or bright giants. The brightest blue stars
are mid-B giants. Spectroscopic and photometric analyses indicate an age 50+-10
Myr. The cluster is located at a distance d~4kpc, consistent with other tracers
of the Perseus Arm in this direction. Berkeley 55 is thus a moderately young
open cluster with a sizable population of candidate red (super)giant members,
which can provide valuable information about the evolution of intermediate-mass
stars.
","[{""version"":""v1"",""created"":""Fri, 2 Dec 2011 10:05:17 GMT""}]","2013-03-11"
"1112.0415","Delio Mugnolo","Delio Mugnolo and Serge Nicaise","Well-posedness and spectral properties of heat and wave equations with
  non-local conditions","23 pages",,"10.1016/j.jde.2013.12.016",,"math.AP math-ph math.FA math.MP","http://arxiv.org/licenses/nonexclusive-distrib/1.0/","  We consider the one-dimensional heat and wave equations but -- instead of
boundary conditions-- we impose on the solution certain non-local, integral
constraints. An appropriate Hilbert setting leads to an integration-by-parts
formula in Sobolev spaces of negative order and eventually allows us to use
semigroup theory leading to analytic well-posedness, hence sharpening
regularity results previously obtained by other authors. In doing so we
introduce a parametrization of such integral conditions that includes known
cases but also shows the connection with more usual boundary conditions, like
periodic ones. In the self-adjoint case, we even obtain eigenvalue asymptotics
of so-called Weyl's type.
","[{""version"":""v1"",""created"":""Fri, 2 Dec 2011 10:09:42 GMT""},{""version"":""v2"",""created"":""Thu, 10 May 2012 14:58:20 GMT""},{""version"":""v3"",""created"":""Tue, 22 Oct 2013 20:12:17 GMT""},{""version"":""v4"",""created"":""Fri, 3 Jan 2014 21:37:16 GMT""}]","2018-12-21"
"1112.0416","Stefano Ferretti Stefano Ferretti","Stefano Ferretti","Publish-Subscribe Systems via Gossip: a Study based on Complex Networks","To appear in: Proc. of the 4th International Workshop on Simplifying
  Complex Networks for Pratictioners (SIMPLEX 2012) - World Wide Web Conference
  (WWW 2012), ACM, Lyon (France), April 2012",,,,"cs.DC cs.NI","http://arxiv.org/licenses/nonexclusive-distrib/1.0/","  This paper analyzes the adoption of unstructured P2P overlay networks to
build publish-subscribe systems. We consider a very simple distributed
communication protocol, based on gossip and on the local knowledge each node
has about subscriptions made by its neighbours. In particular, upon reception
(or generation) of a novel event, a node sends it to those neighbours whose
subscriptions match that event. Moreover, the node gossips the event to its
""non-interested"" neighbours, so that the event can be spread through the
overlay. A mathematical analysis is provided to estimate the number of nodes
receiving the event, based on the network topology, the amount of subscribers
and the gossip probability. These outcomes are compared to those obtained via
simulation. Results show even when the amount of subscribers represents a very
small (yet non-negligible) portion of network nodes, by tuning the gossip
probability the event can percolate through the overlay. Hence, the use of
unstructured networks. coupled with simple dissemination protocols, represents
a viable approach to build peer-to-peer publish-subscribe applications.
","[{""version"":""v1"",""created"":""Fri, 2 Dec 2011 10:15:56 GMT""},{""version"":""v2"",""created"":""Wed, 20 Jun 2012 11:46:19 GMT""}]","2012-06-21"
"1112.0417","Pedro Pina Avelino","P. P. Avelino, A. Barreira","Layzer-Irvine equation: new perspectives and the role of interacting
  dark energy","4 pages","Phys.Rev.D85:063504,2012","10.1103/PhysRevD.85.063504",,"astro-ph.CO gr-qc hep-ph","http://arxiv.org/licenses/nonexclusive-distrib/1.0/","  We derive the Layzer-Irvine equation in the presence of a homogeneous (or
quasi-homogeneous) dark energy component with an arbitrary equation of state.
We extend the Layzer-Irvine equation to homogeneous and isotropic universes
with an arbitrary number of dimensions and obtain the corresponding virial
relation for sufficiently relaxed objects. We find analogous equations
describing the dynamics of cosmic string loops and other p-branes of arbitrary
dimensionality, discussing the corresponding relativistic and non-relativistic
limits. Finally, we generalize the Layzer-Irvine equation to account for a
non-minimal interaction between dark matter and dark energy, discussing its
practical use as a signature of such an interaction.
","[{""version"":""v1"",""created"":""Fri, 2 Dec 2011 10:22:01 GMT""}]","2012-10-16"
"1112.0418","Kazunori Nakayama","Kazunori Nakayama, Fuminobu Takahashi, Tsutomu T. Yanagida","Cosmological Moduli Problem in Low Cutoff Theory","5 pages, 2 figures; minor corrections; to appear in PRD",,"10.1103/PhysRevD.86.043507","UT-11-41, TU-896","hep-ph astro-ph.CO hep-th","http://arxiv.org/licenses/nonexclusive-distrib/1.0/","  We show that the cosmological moduli problem is solved, without relying on
huge late-time entropy production, if the universal cutoff scale of the theory
is a few orders of magnitude smaller than the Planck scale. We obtain a general
estimate of the modulus abundance in terms of the inflationary scale and the
reheating temperature, and find in particular that the reheating temperature
can be high enough for the non-thermal leptogenesis to work.
","[{""version"":""v1"",""created"":""Fri, 2 Dec 2011 10:35:26 GMT""},{""version"":""v2"",""created"":""Wed, 18 Jul 2012 13:22:12 GMT""}]","2013-05-30"
"1112.0419","Tom Lancaster","J.D. Wright, T. Lancaster, I. Franke, A. J. Steele, J.S. M\""oller,
  M.J. Pitcher, A.J. Corkett, D.R. Parker, D.G. Free, F.L. Pratt, P.J. Baker,
  S.J. Clarke, S.J. Blundell","The gradual destruction of magnetism in the superconducting family
  NaFe(1-x)CoxAs","7 pages, 7 figures",,"10.1103/PhysRevB.85.054503",,"cond-mat.supr-con","http://arxiv.org/licenses/nonexclusive-distrib/1.0/","  The interplay and coexistence of superconducting, magnetic and structural
order parameters in NaFe{1-x}Co{x}As has been studied using SQUID magnetometry,
muon-spin rotation and synchrotron x-ray powder diffraction. Substituting Fe by
Co weakens the ordered magnetic state through both a suppression of T_N and a
reduction in the size of the ordered moment. Upon further substitution of Fe by
Co the high sensitivity of the muon as a local magnetic probe reveals a
magnetically disordered phase, in which the size of the moment continues to
decrease and falls to zero around the same point at which the
magnetically-driven structural distortion is no longer resolvable. Both
magnetism and the structural distortion are weakened as the robust
superconducting state is established.
","[{""version"":""v1"",""created"":""Fri, 2 Dec 2011 10:35:41 GMT""}]","2016-08-14"
"1112.0420","Chris Ling","Wojciech Miiller, Maxim Avdeev, Qingdi Zhou, Andrew J. Studer, Brendan
  J. Kennedy, Gordon J. Kearley, Chris D. Ling","Spin-gap opening accompanied by a strong magnetoelastic response in the
  S=1 magnetic dimer system Ba3BiRu2O9","5 pages, 5 figures, accepted by Physical Review B",,"10.1103/PhysRevB.84.220406",,"cond-mat.str-el","http://arxiv.org/licenses/nonexclusive-distrib/1.0/","  Neutron diffraction, magnetization, resistivity, and heat capacity
measurements on the 6H-perovskite Ba3BiRu2O9 reveal simultaneous magnetic and
structural dimerization driven by strong magnetoelastic coupling. An
isostructural but strongly displacive first-order transition on cooling through
T*=176 K is associated with a change in the nature of direct Ru-Ru bonds within
Ru2O9 face-sharing octahedra. Above T*, Ba3BiRu2O9 is an S=1 magnetic dimer
system with intradimer exchange interactions J0/kB=320 K and interdimer
exchange interactions J'/kB=-160 K. Below T*, a spin-gapped state emerges with
\Delta\approx220 K. Ab initio calculations confirm antiferromagnetic exchange
within dimers, but the transition is not accompanied by long range-magnetic
order.
","[{""version"":""v1"",""created"":""Fri, 2 Dec 2011 10:37:14 GMT""}]","2015-06-03"
"1112.0421","Li Yang","Li Yang, Biyao Yang, and Chong Xiang","Quantum Public-Key Encryption Schemes Based on Conjugate Coding","22 pages",,,,"quant-ph","http://arxiv.org/licenses/nonexclusive-distrib/1.0/","  We present several quantum public-key encryption (QPKE) protocols designed
with conjugate coding single-photon string, thus may be realized in laboratory
with nowadays techniques. Two of these schemes are orienting one-bit message,
and are extended to two kinds of QPKE schemes orienting multi-bits. The novel
structure of these protocols ensures they are information-theoretically secure
with, probably, a bound greater than any given polynomial of $n$. Finally, we
describe a way to conceal the classical part of the public key with quantum
state, this idea is expected to enhance a scheme to be
information-theoretically secure.
","[{""version"":""v1"",""created"":""Fri, 2 Dec 2011 10:49:29 GMT""},{""version"":""v2"",""created"":""Thu, 3 May 2012 14:16:28 GMT""},{""version"":""v3"",""created"":""Wed, 9 May 2012 12:47:16 GMT""},{""version"":""v4"",""created"":""Fri, 19 Apr 2013 12:45:46 GMT""}]","2013-04-22"
"1112.0422","Bhabani Prasad Mandal Dr","Sudhaker Upadhyay and Bhabani Prasad Mandal (Banaras Hindu University,
  Varanasi, India)","Relating Gribov-Zwanziger theory and Yang-Mills theory in
  Batalin-Vilkovisky formalism","8 pages, Revtex, Talk delivered in ""8th International conference on
  progress in theoretical Physics"", held at Constantine, Algeria","AIP Conf. Proc. 1444, 213 (2012)","10.1063/1.4715422",,"hep-th","http://arxiv.org/licenses/nonexclusive-distrib/1.0/","  We consider the BRST invariant Gribov-Zwanziger theory with appropriate
horizon term in Batalin-Vilkovisky formalism. The usual infinitesimal BRST
transformation is generalized by considering the parameter finite and field
dependent. We show that such finite field dependent BRST transformation with
suitable choice of finite parameter relates the generating functional of
Gribov-Zwanziger theory to that of the Yang-Mills theory.
","[{""version"":""v1"",""created"":""Fri, 2 Dec 2011 10:50:26 GMT""}]","2012-07-30"
"1112.0423","Marko Horvat","Marko Horvat, Anamari Naki\'c, Ivana Oto\v{c}an","Impact of technological synchronicity on prospects for CETI","15 pages, 7 figures, 1 table, accepted for publication in the
  International Journal of Astrobiology",,"10.1017/S1473550411000322",,"physics.pop-ph astro-ph.EP","http://arxiv.org/licenses/nonexclusive-distrib/1.0/","  For over 50 years, astronomers have searched the skies for evidence of
electromagnetic signals from extraterrestrial civilizations that have reached
or surpassed our level of technological development. Although often overlooked
or given as granted, the parallel use of an equivalent communication technology
is a necessary prerequisite for establishing contact in both leakage and
deliberate messaging strategies. Civilization advancements, especially
accelerating change and exponential growth, lessen the perspective for a
simultaneous technological status of civilizations thus putting hard
constraints on the likelihood of a dialogue. In this paper we consider the
mathematical probability of technological synchronicity of our own and a number
of other hypothetical extraterrestrial civilizations and explore the most
likely scenarios for their concurrency. If SETI projects rely on a fortuitous
detection of leaked interstellar signals (so called ""eavesdropping"") then
without any prior assumptions N \geq 138-4991 Earth-like civilizations have to
exist at this moment in the Galaxy for the technological usage synchronicity
probability p \geq 0.95 in the next 20 years. We also show that since the
emergence of complex life, coherent with the hypothesis of the Galactic
habitable zone, N \geq 1497 extraterrestrial civilizations had to be created in
the Galaxy in order to achieve the same estimated probability in the
technological possession synchronicity which corresponds to the deliberate
signaling scenario.
","[{""version"":""v1"",""created"":""Fri, 2 Dec 2011 10:52:24 GMT""}]","2011-12-05"
"1112.0424","Kensuke Onda","Kensuke Onda","Examples of algebraic Ricci solitons in the Pseudo-Riemannian case","18 pages",,,,"math.DG","http://arxiv.org/licenses/nonexclusive-distrib/1.0/","  This paper provides a study of algebraic Ricci solitons in the
pseudo-Riemannian case. In the Riemannian case, all nontrivial homogeneous
algebraic Ricci solitons are expanding algebraic Ricci solitons. In this paper,
we obtain a steady algebraic Ricci soliton and a shrinking algebraic Ricci
soliton in the Lorentzian setting.
","[{""version"":""v1"",""created"":""Fri, 2 Dec 2011 10:56:44 GMT""},{""version"":""v2"",""created"":""Tue, 6 Dec 2011 05:23:38 GMT""},{""version"":""v3"",""created"":""Tue, 20 Mar 2012 21:16:37 GMT""}]","2012-03-22"
"1112.0425","Marco Manetti","Donatella Iacono, Marco Manetti","Semiregularity and obstructions of complete intersections","V2 typos corrected, 30 pages. V3 typos and references updated","Advances in Mathematics 235 (2013) pag. 92-125","10.1016/j.aim.2012.11.011","Roma01.math.AG","math.AG math.QA","http://arxiv.org/licenses/nonexclusive-distrib/1.0/","  We prove that, on a smooth projective variety over an algebraically closed
field of characteristic 0, the semiregularity map annihilates every obstruction
to embedded deformations of a local complete intersection subvariety with
extendable normal bundle. The proof is based on the theory of L-infinity
algebras and Tamarkin-Tsigan calculus on the de Rham complex of DG-schemes.
","[{""version"":""v1"",""created"":""Fri, 2 Dec 2011 10:58:33 GMT""},{""version"":""v2"",""created"":""Fri, 16 Dec 2011 09:22:05 GMT""},{""version"":""v3"",""created"":""Fri, 6 Jan 2012 13:03:57 GMT""},{""version"":""v4"",""created"":""Fri, 9 Nov 2012 11:12:22 GMT""}]","2013-11-11"
"1112.0426","Xiao-Ke Xu","Xiao-Ke Xu, Graciano Dieck Kattas, Michael Small","Reciprocal relationships in collective flights of homing pigeons","7 pages, 5 figures",,"10.1103/PhysRevE.85.026120",,"physics.soc-ph physics.bio-ph","http://arxiv.org/licenses/nonexclusive-distrib/1.0/","  Collective motion of bird flocks can be explained via the hypothesis of many
wrongs, and/or, a structured leadership mechanism. In pigeons, previous studies
have shown that there is a well-defined hierarchical structure and certain
specific individuals occupy more dominant positions --- suggesting that
leadership by the few individuals drives the behavior of the collective.
Conversely, by analyzing the same data-sets, we uncover a more egalitarian
mechanism. We show that both reciprocal relationships and a stratified
hierarchical leadership are important and necessary in the collective movements
of pigeon flocks. Rather than birds adopting either exclusive averaging or
leadership strategies, our experimental results show that it is an integrated
combination of both compromise and leadership which drives the group's movement
decisions.
","[{""version"":""v1"",""created"":""Fri, 2 Dec 2011 11:23:06 GMT""}]","2015-06-03"
"1112.0427","Samson Abramsky","Samson Abramsky","A Generalized Kahn Principle for Abstract Asynchronous Networks","25 pages. Published in the Proceedings of the Symposium on
  Mathematical Foundations of Programming Language Semantics, Springer Lecture
  Notes in Computer Science vol. 442, pp. 1--21",,"10.1007/BFb0040252",,"cs.LO math.CT quant-ph","http://arxiv.org/licenses/nonexclusive-distrib/1.0/","  Our general motivation is to answer the question: ""What is a model of
concurrent computation?"". As a preliminary exercise, we study dataflow
networks. We develop a very general notion of model for asynchronous networks.
The ""Kahn Principle"", which states that a network built from functional nodes
is the least fixpoint of a system of equations associated with the network, has
become a benchmark for the formal study of dataflow networks. We formulate a
generalized version of the Kahn Principle, which applies to a large class of
non-deterministic systems, in the setting of abstract asynchronous networks;
and prove that the Kahn Principle holds under certain natural assumptions on
the model. We also show that a class of models, which represent networks that
compute over arbitrary event structures, generalizing dataflow networks which
compute over streams, satisfy these assumptions.
","[{""version"":""v1"",""created"":""Fri, 2 Dec 2011 11:23:38 GMT""}]","2011-12-05"
