"1112.0871","Arunava Chakrabarti","Arunava Chakrabarti and Samar Chattopadhyay","A Fibonacci atomic chain with side coupled quantum dots: crossover from
  a singular continuous to a continuous spectrum and related issues","Revtex4, 9 pages, 6 eps figures",,,,"cond-mat.dis-nn cond-mat.mes-hall","http://arxiv.org/licenses/nonexclusive-distrib/1.0/","  Interaction of bound states with a singular continuous spectrum is studied
using a one dimensional Fibonacci quasicrystal as a prototype example. Single
level quantum dots are attached from a side to a subset of atomic sites of the
quasiperiodic chain. The proximity of the dots to the chain is modeled by
introducing a tunnel hopping between a dot and the backbone. It is shown that,
depending upon the proximity of the side coupled dot, the spectrum of an
infinite quasiperiodic chain can display radical changes from its purely one
dimensional characteristics. Absolutely continuous parts in the spectrum can be
generated as well as isolated resonant eigenstates whose positions in the
spectrum are sensitive to the proximity of the quantum dots. The cycles of the
matrix map and the two terminal transport are discussed in details.
","[{""version"":""v1"",""created"":""Mon, 5 Dec 2011 10:00:29 GMT""}]","2011-12-06"
"1112.0872","Martin Magnuson","M. Magnuson, N. Wassdahl, A. Nilsson, A. F\""ohlisch, J. Nordgren and
  N. M{\aa}rtensson","Resonant Auger spectroscopy at the L2,3 shake-up thresholds as a probe
  of electron correlation effects in nickel","8 pages, 4 figures; http://prb.aps.org/abstract/PRB/v58/i7/p3677_1","Phys. Rev. B 58, 3677-3681 (1998)","10.1103/PhysRevB.58.3677",,"cond-mat.mtrl-sci cond-mat.str-el physics.atom-ph physics.comp-ph","http://arxiv.org/licenses/nonexclusive-distrib/1.0/","  The excitation energy dependence of the three-hole satellites in the
L3-M4,5M4,5 and L2-M4,5M4,5 Auger spectra of nickel metal has been measured
using synchrotron radiation. The satellite behavior in the non-radiative
emission spectra at the L3 and L2 thresholds is compared and the influence of
the Coster-Kronig channel explored. The three-hole satellite intensity at the
L3 Auger emission line reveals a peak structure at 5 eV above the L3 threshold
attributed to resonant processes at the 2p53d9 shake-up threshold. This is
discussed in connection with the 6-eV feature in the x-ray absorption spectrum.
","[{""version"":""v1"",""created"":""Mon, 5 Dec 2011 10:04:15 GMT""},{""version"":""v2"",""created"":""Thu, 29 Dec 2011 18:41:11 GMT""}]","2011-12-30"
"1112.0873","Tobias Galla","Tobias Galla","Fluctuations in meta-population exclusion processes","17 pages, 6 figures; accepted by J. Stat. Mech","J. Stat. Mech. (2012) P03008","10.1088/1742-5468/2012/03/P03008",,"cond-mat.stat-mech","http://arxiv.org/licenses/nonexclusive-distrib/1.0/","  We introduce a meta-population version of models of asymmetric exclusion
models, consisting of a spatial arrangement of patches. Patches are of a
specific size, indicating the maximal number of particles they can hold. We use
an expansion in the inverse patch size to calculate the spectral properties of
fluctuations in such systems. This provides a systematic derivation from first
principles of effective Langevin descriptions discussed in the literature. We
apply our approach to the totally asymmetric simple exclusion process, to
variants with an overall constraint on the total particle number and to a
two-species exclusion model. The theory provides semi-analytical results, these
are confirmed in numerical simulations, and give good approximations to
conventional exclusion models. These are recovered when the patch size is set
to unity.
","[{""version"":""v1"",""created"":""Mon, 5 Dec 2011 10:08:54 GMT""},{""version"":""v2"",""created"":""Wed, 15 Feb 2012 08:46:42 GMT""}]","2012-04-20"
"1112.0874","David Reguera","D. Reguera, A. Luque, P. S. Burada, G. Schmid, J. M. Rub\'i, and P.
  H\""anggi","Entropic Splitter for Particle Separation","5 pages, 4 figures. Accepted for publication in Phys. Rev. Lett","Phys. Rev. Lett. 108, 020604 (2012)","10.1103/PhysRevLett.108.020604",,"cond-mat.stat-mech cond-mat.soft","http://arxiv.org/licenses/nonexclusive-distrib/1.0/","  We present a particle separation mechanism which induces motion of particles
of different sizes in opposite directions. The mechanism is based on the
combined action of a driving force and an entropic rectification of the
Brownian fluctuations caused by the asymmetric form of the channel along which
particles proceed. The entropic splitting effect shown could be controlled upon
variation of the geometrical parameters of the channel and could be implemented
in narrow channels and microfluidic devices.
","[{""version"":""v1"",""created"":""Mon, 5 Dec 2011 10:09:45 GMT""}]","2012-02-10"
"1112.0875","Merlin Cooper","Merlin Cooper, Christoph S\""oller, Brian J. Smith","High-stability time-domain balanced homodyne detector for ultrafast
  optical pulse applications","6 pages, 4 figures","Journal of Modern Optics, Volume: 60, Issue: 08, pages 611 - 616,
  2013","10.1080/09500340.2013.797612",,"quant-ph","http://arxiv.org/licenses/nonexclusive-distrib/1.0/","  Low-noise, efficient, phase-sensitive time-domain optical detection is
essential for foundational tests of quantum physics based on optical quantum
states and the realization of numerous applications ranging from quantum key
distribution to coherent classical telecommunications. Stability, bandwidth,
efficiency, and signal-to-noise ratio are crucial performance parameters for
effective detector operation. Here we present a high-bandwidth, low-noise,
ultra-stable time-domain coherent measurement scheme based on balanced homodyne
detection ideally suited to characterization of quantum and classical light
fields in well-defined ultrashort optical pulse modes.
","[{""version"":""v1"",""created"":""Mon, 5 Dec 2011 10:10:39 GMT""},{""version"":""v2"",""created"":""Wed, 26 Dec 2012 18:47:46 GMT""},{""version"":""v3"",""created"":""Mon, 25 Mar 2013 12:05:24 GMT""}]","2013-07-18"
"1112.0876","Debasish Chaudhuri","Debasish Chaudhuri and Bela M. Mulder","Spontaneous helicity of a polymer with side-loops confined to a cylinder","paper and supplementary; 7 pages, 8 figures","Phys. Rev. Lett. 108, 268305 (2012)","10.1103/PhysRevLett.108.268305",,"physics.bio-ph cond-mat.soft","http://arxiv.org/licenses/nonexclusive-distrib/1.0/","  Inspired by recent experiments on the spatial organization of bacterial
chromosomes, we consider a type of ""bottle brush"" polymer consisting of a
flexible backbone chain, to which flexible side loops are connected. We show
that such a model with an open linear backbone spontaneously adopts a helical
structure with a well-defined pitch when confined to small cylindrical volume.
This helicity persists over a range of sizes and aspect-ratios of the cylinder,
provided the packing fraction of the chain is suitably large. We analyze this
results in terms of the interplay between the effective stiffness and actual
intra-chain packing effects caused by the side-loops in response to the
confinement. For the case of a circular backbone, mimicking e.g. the E. coli
chromosome, the polymer adopts a linearized configuration of two parallel
helices connected at the cylinder poles.
","[{""version"":""v1"",""created"":""Mon, 5 Dec 2011 10:10:47 GMT""}]","2012-07-10"
"1112.0877","Tim Gledhill","T. M. Gledhill, K. P.Forde","A Fast bipolar H2 outflow from IRAS 16342-3814: an old star reliving its
  youth","Accepted for publication in Monthly Notices of the Royal Astronomical
  Society",,"10.1111/j.1365-2966.2011.20309.x",,"astro-ph.SR","http://arxiv.org/licenses/nonexclusive-distrib/1.0/","  Some evolved stars in the pre-planetary nebula phase produce
highly-collimated molecular outflows that resemble the accretion-driven jets
and outflows from pre-main sequence stars. We show that IRAS 16342-3814 (the
Water Fountain Nebula) is such an object and present K-band integral field
spectroscopy revealing a fast (> 150 km/s) bipolar H2 outflow. The H2 emission
is shock excited and may arise in fast-moving clumps, accelerated by the
previously observed precessing jet. The total luminosity in H2 is 0.37
L$_{\odot}$ which is comparable with that of accretion-powered outflows from
Class 0 protostars. We also detect CO overtone bandhead emission in the
scattered continuum, indicating hot molecular gas close to the centre, a
feature also observed in a number of protostars with active jets. It seems
likely that the jet and outflow in IRAS 16342-3814 are powered by accretion
onto a binary companion.
","[{""version"":""v1"",""created"":""Mon, 5 Dec 2011 10:11:16 GMT""}]","2015-06-03"
"1112.0878","Jose Espinar","Jose M. Espinar","On the structure of complete 3-manifolds with nonnegative scalar
  curvature","We found a gap in the main Theorem we can not solve",,,,"math.DG","http://arxiv.org/licenses/nonexclusive-distrib/1.0/","  In this paper we will show the following result: Let $\mathcal{N} $ be a
complete (noncompact) connected orientable Riemannian three-manifold with
nonnegative scalar curvature $S \geq 0$ and bounded sectional curvature $ K_{s}
\leq K $. Suposse that $\Sigma \subset \mathcal{N} $ is a complete orientable
connected area-minimizing cylinder so that $\pi_1 (\Sigma) \in \pi_1
(\mathcal{N})$. Then $\mathcal{N}$ is locally isometric either to $\mathbb{S}
^1 \times \mathbb{R} ^2 $ or $\mathbb{S}^1 \times \mathbb{S}^1 \times
\mathbb{R}$ (with the standard product metric).
  As a corollary, we will obtain: Let $\mathcal{N} $ be a complete (noncompact)
connected orientable Riemannian three-manifold with nonnegative scalar
curvature $S \geq 0$ and bounded sectional curvature $ K_{s} \leq K $. Assume
that $\pi_1 (\mathcal{N})$ contains a subgroup which is isomorphic to the
fundamental group of a compact surface of positive genus. Then, $\mathcal{N}$
is locally isometric to $\mathbb{S}^1 \times \mathbb{S}^1 \times \mathbb{R}$
(with the standard product metric).
","[{""version"":""v1"",""created"":""Mon, 5 Dec 2011 10:33:21 GMT""},{""version"":""v2"",""created"":""Sun, 26 Mar 2017 22:45:20 GMT""}]","2017-03-28"
"1112.0879","Giuseppe Notarstefano","Giuseppe Notarstefano and John Hauser","Computing feasible trajectories for constrained maneuvering systems: the
  PVTOL example",,,,,"math.OC math.DS","http://arxiv.org/licenses/nonexclusive-distrib/1.0/","  In this paper we provide an optimal control based strategy to explore
feasible trajectories of nonlinear systems, that is to find curves that satisfy
the dynamics as well as point-wise state-input constraints. The strategy is
interesting itself in understanding the capabilities of the system in its
operating region, and represents a preliminary tool to perform trajectory
tracking in presence of constraints. The strategy relies on three main tools:
dynamic embedding, constraints relaxation and novel optimization techniques,
introduced in [10,12], to find regularized solutions for point-wise constrained
optimal control problems. The strategy is applied to the PVTOL, a simplified
model of a real aircraft that captures the main features and challenges of
several ""maneuvering systems"".
","[{""version"":""v1"",""created"":""Mon, 5 Dec 2011 10:33:46 GMT""}]","2011-12-06"
"1112.0880","Claes Uggla","Claes Uggla and John Wainwright","Scalar Cosmological Perturbations",,,"10.1088/0264-9381/29/10/105002",,"gr-qc astro-ph.CO","http://arxiv.org/licenses/nonexclusive-distrib/1.0/","  Scalar perturbations of Friedmann-Lemaitre cosmologies can be analyzed in a
variety of ways using Einstein's field equations, the Ricci and Bianchi
identities, or the conservation equations for the stress-energy tensor, and
possibly introducing a timelike reference congruence. The common ground is the
use of gauge invariants derived from the metric tensor, the stress-energy
tensor, or from vectors associated with a reference congruence, as basic
variables. Although there is a complication in that there is no unique choice
of gauge invariants, we will show that this can be used to advantage.
  With this in mind our first goal is to present an efficient way of
constructing dimensionless gauge invariants associated with the tensors that
are involved, and of determining their inter-relationships. Our second goal is
to give a unified treatment of the various ways of writing the governing
equations in dimensionless form using gauge-invariant variables, showing how
simplicity can be achieved by a suitable choice of variables and normalization
factors. Our third goal is to elucidate the connection between the metric-based
approach and the so-called 1+3 gauge-invariant approach to cosmological
perturbations. We restrict our considerations to linear perturbations, but our
intent is to set the stage for the extension to second order perturbations.
","[{""version"":""v1"",""created"":""Mon, 5 Dec 2011 10:34:13 GMT""}]","2015-06-03"
"1112.0881","Daniele Funaro","Daniele Funaro","Exact Solutions on Twisted Rings for the 3D Navier-Stokes Equations","14 pages, 3 figures",,,,"physics.flu-dyn","http://arxiv.org/licenses/nonexclusive-distrib/1.0/","  The problem of describing the behavior of the solutions to the Navier-Stokes
equations in three space dimensions has always been borderline. From one side,
due to the viscosity term, smooth data seem to produce solutions with an
everlasting regular behavior. On the other hand, the lack of a convincing
theoretical analysis suggests the existence of possible counterexamples. In
particular, one cannot exclude the blowing up of solutions in finite time even
in presence of smooth data. Here we give examples of explicit solutions of the
non-homogeneous equations. These are defined on a Hill's type vortex where the
flow is rotating and swirling at the same time, inducing the flux to spiraling
at a central node. Despite the appearance, the solution still remains very
regular at the agglomeration point. The analysis may lead to a better
understanding of the subtle problem of characterizing the solution space of the
3D Navier-Stokes equations. For instance, this result makes more narrow the
path to the search of counterexamples built on the stretching and twisting of
vortex tubes.
","[{""version"":""v1"",""created"":""Mon, 5 Dec 2011 10:48:43 GMT""}]","2011-12-06"
"1112.0882","Naoki Ogawa","Naoki Ogawa, Yasushi Ogimoto, Yoshiaki Ida, Yusuke Nomura, Ryotaro
  Arita, and Kenjiro Miyano","Polar Antiferromagnets Produced with Orbital-Order","5 pages, 4 figures",,"10.1103/PhysRevLett.108.157603",,"cond-mat.str-el","http://arxiv.org/licenses/nonexclusive-distrib/1.0/","  Polar magnetic states are realized in pseudocubic manganite thin films
fabricated on high-index substrates, in which a Jahn-Teller (JT) distortion
remains an active variable. Several types of orbital-orders were found to
develop large optical second harmonic generation, signaling
broken-inversion-symmetry distinct from their bulk forms and films on (100)
substrates. The observed symmetry-lifting and first-principles calculation both
indicate that the modified JT q2 mode drives Mn-site off-centering upon orbital
order, leading to the possible cooperation of ""Mn-site polarization"" and
magnetism.
","[{""version"":""v1"",""created"":""Mon, 5 Dec 2011 10:52:21 GMT""},{""version"":""v2"",""created"":""Tue, 6 Dec 2011 04:15:44 GMT""}]","2015-06-03"
"1112.0883","Desiree Basile","D. Basile, A. Bella, and G. J. Ridderbos","Weak extent, submetrizability and diagonal degrees","10 pages",,,,"math.GN","http://arxiv.org/licenses/nonexclusive-distrib/1.0/","  We show that if $X$ has a zero-set diagonal and $X^2$ has countable weak
extent, then $X$ is submetrizable. This generalizes earlier results from Martin
and Buzyakova. Furthermore we show that if $X$ has a regular
$G_\delta$-diagonal and $X^2$ has countable weak extent, then $X$ condenses
onto a second countable Hausdorff space. We also prove several cardinality
bounds involving various types of diagonal degree.
","[{""version"":""v1"",""created"":""Mon, 5 Dec 2011 10:55:20 GMT""}]","2011-12-06"
"1112.0884","Jo\~ao Moreira","Joao Moreira, Piotr Bozek, Wojciech Broniowski","Forward-backward rapidity correlations in relativistic heavy ion
  collisions : torqued fireball","6 pages, 13 figures, prepared for the Strangeness in Quark Matter
  2011 conference proceedings. Grant reference added","Acta Phys.Polon.Supp. 5 (2012) 433","10.5506/APhysPolBSupp.5.433",,"nucl-th","http://arxiv.org/licenses/nonexclusive-distrib/1.0/","  Statistical fluctuations in the transverse distribution of sources in
relativistic heavy ion collisions and an asymmetric emission profile associated
with the wounded nucleons lead to rapidity dependence of the reaction plane.
The size of this effect is estimated for the gold-gold collisions at the
highest RHIC energy ($\sqrt{s_{NN}}=200 \mathrm{GeV}$) in the Glauber model
using GLISSANDO. The hydrodynamical evolution of the resulting torqued fireball
is carried out in 3+1 dimensions considering a perfect fluid. Hadronization is
simulated using THERMINATOR including non-flow contribution coming from
resonance decays. Some experimental measures that can be used to detect the
torque effect are proposed.
","[{""version"":""v1"",""created"":""Mon, 5 Dec 2011 11:02:00 GMT""},{""version"":""v2"",""created"":""Thu, 29 Mar 2012 19:25:39 GMT""}]","2012-04-24"
"1112.0885","Sang Pyo Kim","Sang Pyo Kim (Kunsan Natl. U. and Natl. Taiwan U. and YITP, Kyoto U.),
  W-Y.Pauchy Hwang (Natl. Taiwan U.), Tse-Chun Wang (Natl. Taiwan U.)","Schwinger mechanism in dS_2 and AdS_2 revisited","RevTex 6 pages; 2 figures",,,,"hep-th astro-ph.CO gr-qc","http://arxiv.org/licenses/nonexclusive-distrib/1.0/","  Recalculating the Bogoliubov coefficients from the solutions in Phys. Rev. D
78, 103517 (2008), we obtain the mean number of boson pairs in a uniform
electric field in the global coordinates dS_2 and AdS_2, which have the correct
zero-field and zero-curvature limits, and study the vacuum persistence at
one-loop. The mean number in AdS_2 gives the lowest limit to the
Breitenloher-Freedman bound in the uniform electric field, and the mean numbers
in dS_2 and AdS_2 satisfy the reciprocal relation N_{dS} (R, E) N_{AdS} (R, E)
= 1 under the analytical continuation of the scalar curvature R.
","[{""version"":""v1"",""created"":""Mon, 5 Dec 2011 11:03:57 GMT""}]","2011-12-06"
"1112.0886","Gijs Verdoes Kleijn","Gijs Verdoes Kleijn, Jelte T. A. de Jong, E. A. Valentijn, K. Kuijken
  (for the KiDS Collaboration, and for the Astro-WISE Consortiums)","Astro-WISE for KiDS survey production and quality control","Proceedings ADASS XXI, 2011, ASP Conference Series",,,,"astro-ph.IM astro-ph.CO","http://arxiv.org/licenses/nonexclusive-distrib/1.0/","  The Kilo Degree Survey (KiDS) is a 1500 square degree optical imaging survey
with the recently commissioned OmegaCAM wide-field imager on the VLT Survey
Telescope (VST). A suite of data products will be delivered to ESO and the
community by the KiDS survey team. Spread over Europe, the KiDS team uses
Astro-WISE to collaborate efficiently and pool hardware resources. In
Astro-WISE the team shares, calibrates and archives all survey data. The
data-centric architectural design realizes a dynamic 'live archive' in which
new KiDS survey products of improved quality can be shared with the team and
eventually the full astronomical community in a flexible and controllable
manner
","[{""version"":""v1"",""created"":""Mon, 5 Dec 2011 11:07:22 GMT""}]","2019-08-15"
"1112.0887","Sudhakar  Panda","Anindita Bhattacharjee, Ashok Das, Levi Greenwood and Sudhakar Panda","Motion of a Test Particle in the Transverse space of Dp-Branes","18+1 pages, latex,Title changed, Abstract modified, References added,
  Matching published version","Int Journal of Mod Physics D21 (2012)1250056","10.1142/S0218271812500563",,"hep-th gr-qc","http://arxiv.org/licenses/nonexclusive-distrib/1.0/","  We investigate the motion of a test particle in higher dimensions due to the
presence of extended sources like D$p$-branes by studying the motion in the
transverse space of the brane. This is contrasted with the motion of a point
particle in the Schwarzschild background in higher dimensions. Since
D$p$-branes are specific to 10-dimensional space time and exact solutions of
geodesic equations for this particular space time has not been possible so far
for the Schwarzschild background, we focus here to find the leading order
solution of the geodesic equation (for motion of light rays). This enables us
to compute the bending of light in both the backgrounds. We show that contrary
to the well known result of no noncircular bound orbits for a massive particle,
in Schwarzschild background, for $d\geq 5$, the $Dp$-brane background does
allow bound elliptic motion only for $p = 6$ and the perihelion of the ellipse
regresses instead of advancement. We also find that circular orbits for photon
are allowed only for $p\le 3$.
","[{""version"":""v1"",""created"":""Mon, 5 Dec 2011 11:08:37 GMT""},{""version"":""v2"",""created"":""Thu, 21 Jun 2012 05:44:34 GMT""}]","2012-06-22"
"1112.0888","Petro Lutsyk","Juliusz Sworakowski and Petro Lutsyk","Bistable organic materials in optoelectrical switches: Two-electrode
  devices vs. organic field effect transistors",,"Ukrainian Journal of Physics, 2009, Vol. 54, no. 1-2, pp. 207-215
  (www.ujp.bitp.kiev.ua)",,,"physics.chem-ph","http://arxiv.org/licenses/nonexclusive-distrib/1.0/","  The paper presents a short overview of research into properties of organic
materials and structures that could be used in optoelectrical switches, i.e.,
switches in which changes in electrical properties are triggered by light of
appropriate wavelengths. In particular, described are the structures acting by
virtue of reversible photochemical reactions occurring in photochromic
molecular materials.
","[{""version"":""v1"",""created"":""Mon, 5 Dec 2011 11:13:51 GMT""}]","2011-12-06"
"1112.0889","Norma Susana Mankoc Borstnik","Norma Susana Mankoc Borstnik","What at all is the Higgs of the Standard model and what is the origin of
  families?","12 pages, no figures",,,,"hep-ph","http://arxiv.org/licenses/nonexclusive-distrib/1.0/","  The standard model of the elementary particles is built on several
assumptions. The Higgs is assumed to be a scalar, a boson, with the charges of
a fermion (in the fundamental representations of the charge groups). No
explanation is offered for the existence of families of fermions -- quarks and
leptons-- for the charges of these family members, for the appearance of the
Yukawas which take care of fermion properties. The theory explaining the origin
of families predicts that several scalar fields with the boson kind of the
charges (in the adjoint representations of the charge groups) manifest
effectively at low energies as the Higgs and the Yukawas.
","[{""version"":""v1"",""created"":""Mon, 5 Dec 2011 11:15:12 GMT""},{""version"":""v2"",""created"":""Mon, 19 Dec 2011 14:06:54 GMT""}]","2011-12-20"
"1112.0890","Gianni Pagnini","Gianni Pagnini","Erd\'elyi-Kober Fractional Diffusion","Accepted for publication in Fractional Calculus and Applied Analysis","Fractional Calculus and Applied Analysis 15, 117--127 (2012)",,,"math-ph math.MP","http://arxiv.org/licenses/nonexclusive-distrib/1.0/","  The aim of this Short Note is to highlight that the {\it generalized grey
Brownian motion} (ggBm) is an anomalous diffusion process driven by a
fractional integral equation in the sense of Erd\'elyi-Kober, and for this
reason here it is proposed to call such family of diffusive processes as {\it
Erd\'elyi-Kober fractional diffusion}. The ggBm is a parametric class of
stochastic processes that provides models for both fast and slow anomalous
diffusion. This class is made up of self-similar processes with stationary
increments and it depends on two real parameters: $0 < \alpha \le 2$ and $0 <
\beta \le 1$. It includes the fractional Brownian motion when $0 < \alpha \le
2$ and $\beta=1$, the time-fractional diffusion stochastic processes when $0 <
\alpha=\beta <1$, and the standard Brownian motion when $\alpha=\beta=1$. In
the ggBm framework, the Mainardi function emerges as a natural generalization
of the Gaussian distribution recovering the same key role of the Gaussian
density for the standard and the fractional Brownian motion.
","[{""version"":""v1"",""created"":""Mon, 5 Dec 2011 11:21:59 GMT""}]","2012-01-04"
"1112.0891","Evgeny Lakshtanov L","Evgeny Lakshtanov, Boris Vainberg","Remarks on interior transmission eigenvalues, Weyl formula and branching
  billiards","two misprints (in (13) and (14)) are corrected","J. Phys. A: Math. Theor. 45 (2012) 125202","10.1088/1751-8113/45/12/125202",,"math-ph math.DS math.MP","http://arxiv.org/licenses/nonexclusive-distrib/1.0/","  The paper contains the Weyl formula for the counting function of the interior
transmission problem when the latter is parameter-elliptic. Branching billiard
trajectories are constructed, and the second term of the Weyl asymptotics is
estimated from above under some conditions on the set of periodic billiard
trajectories.
","[{""version"":""v1"",""created"":""Mon, 5 Dec 2011 11:24:15 GMT""},{""version"":""v2"",""created"":""Fri, 13 Jan 2012 13:43:18 GMT""},{""version"":""v3"",""created"":""Wed, 21 Mar 2012 10:31:13 GMT""}]","2015-06-03"
"1112.0892","Romi Shamoyan F.","Romi Shamoyan, Ali Abkar","On multipliers of spaces of harmonic functions of the unit ball in R^n",,"Journal of Inequalities and Special Functions ,3,(2012),no.1,1-11",,,"math.FA","http://arxiv.org/licenses/nonexclusive-distrib/1.0/","  We completely describe spaces of multipliers of certain harmonic function
spaces of Bergman type in R^n.This is the first sharp result of this kind for
Bergman type mixed norm spaces of harmonic functions in the unit ball of R^n
","[{""version"":""v1"",""created"":""Mon, 5 Dec 2011 11:29:35 GMT""}]","2012-01-26"
