"1112.0933","Ben Moonen","Ben Moonen and Frans Oort","The Torelli locus and special subvarieties","To appear in the Handbook of Moduli (G. Farkas, I. Morrison, eds.)",,,,"math.AG","http://arxiv.org/licenses/nonexclusive-distrib/1.0/","  We study the Torelli locus T_g in the moduli space A_g of abelian varieties.
We consider special subvarieties (Shimura subvarieties) contained in the
Torelli locus. We review the construction of some non-trivial examples, and we
discuss some conjectures, techniques and recent progress.
","[{""version"":""v1"",""created"":""Mon, 5 Dec 2011 14:22:47 GMT""}]","2011-12-06"
"1112.0934","Stanislav Volkov","Gopal Basak and Stanislav Volkov","Snakes and perturbed random walks",,,,,"math.PR","http://arxiv.org/licenses/nonexclusive-distrib/1.0/","  In this paper we study some properties of random walks perturbed at extrema,
which are generalizations of the walks considered e.g., in Davis (1999). This
process can also be viewed as a version of {\em excited random walk}, studied
recently by many authors. We obtain a few properties related to the range of
the process with infinite memory. We also prove the Strong law, Central Limit
Theorem, and the criterion for the recurrence of the perturbed walk with finite
memory.
","[{""version"":""v1"",""created"":""Mon, 5 Dec 2011 14:26:23 GMT""}]","2011-12-06"
"1112.0935","Herve Bergeron","H. Bergeron, P. Siegl and A. Youssef","New SUSYQM coherent states for Poschl-Teller potentials: a detailed
  mathematical analysis",,"J. Phys. A: Math. Theor. 45(2012)244028","10.1088/1751-8113/45/24/244028","MaPhy-AvH/2012-02","math-ph math.MP quant-ph","http://arxiv.org/licenses/nonexclusive-distrib/1.0/","  In a recent short note [Bergeron H, Gazeau J P, Siegl P and Youssef A 2010
EPL 92 60003], we have presented the nice properties of a new family of
semi-classical states for P\""oschl-Teller potentials. These states are built
from a supersymmetric quantum mechanics approach and the parameters of these
""coherent"" states are points in the classical phase space. In this article we
develop all the mathematical aspects that have been left apart in the previous
article (proof of the resolution of unity, detailed calculations of quantized
version of classical observables and mathematical study of the resulting
operators: problems of domains, self- adjointness or self-adjoint extensions).
Some additional questions as asymptotic behavior are also studied. Moreover,
the framework is extended to a larger class of P\""oschl-Teller potentials.
","[{""version"":""v1"",""created"":""Mon, 5 Dec 2011 14:28:00 GMT""},{""version"":""v2"",""created"":""Thu, 2 Feb 2012 18:19:57 GMT""}]","2012-06-18"
"1112.0936","Jorick S. Vink","Jorick S. Vink (Armagh Observatory), J. M. Bestenlehner (Armagh), G.
  Graefener (Armagh), A. de Koter (Amsterdam), and N. Langer (Bonn)","Wind Models for Very Massive Stars in the Local Universe","To appear in Four Decades of Research on Massive Stars, ASP Conf.
  Ser. 5 pages, 2 figures",,,,"astro-ph.SR astro-ph.CO astro-ph.GA","http://arxiv.org/licenses/nonexclusive-distrib/1.0/","  Some studies have claimed the existence of a stellar upper-mass limit of 150
Msun. A factor that is often overlooked concerns the issue that there might be
a significant difference between the present-day and the initial mass of the
most massive stars - as a result of mass loss. The upper-mass limit may be
substantially higher, possibly exceeding 200 Msun. The issue of the upper
mass-limit will however remain uncertain as long as there is only limited
quantitative knowledge of mass loss in close proximity to the Eddington (=
Gamma) limit. For this reason, we present mass-loss predictions from Monte
Carlo radiative transfer models for very massive stars up to 300 Msun. Using
our new dynamical approach, we find an upturn or ""kink"" in the mass-loss versus
Gamma dependence, at the point where our model winds become optically thick.
These are the first mass-loss predictions where the transition from optically
thin O-star winds to optically thick Wolf-Rayet winds has been resolved.
","[{""version"":""v1"",""created"":""Mon, 5 Dec 2011 14:28:13 GMT""}]","2011-12-06"
"1112.0937","Ya-Zheng Chen","Ya-Zheng Chen, Jun-Mou Chen, Yan-An Luo, Hong Shen, Xue-Qian Li","Effects of nuclear deformation on the form factor for direct dark matter
  detection","15pages, 10figures","Chin. Phys. C (HEP & NP) 36(6):505,(2012)","10.1088/1674-1137/36/6/005",,"hep-ph","http://arxiv.org/licenses/nonexclusive-distrib/1.0/","  For direct dark matter detections, to extract useful information about the
fundamental interaction from data, it is crucial to properly determine the
nuclear form factor. The form factor for spin-independent cross section of
collisions between dark matter particle and nucleus is thoroughly studied by
many authors. When the analysis was carried out, the nuclei are always supposed
to be spherically symmetric. In this work, we investigate the effects of
deformation of nuclei from a spherical shape to an elliptical shape on the form
factor. Our results indicate that as long as the ellipticity is not too large,
such effects cannot cause any substantial effects, especially as the nuclei are
randomly orientated in a room temperature circumstance one can completely
neglect them.
","[{""version"":""v1"",""created"":""Mon, 5 Dec 2011 14:28:41 GMT""},{""version"":""v2"",""created"":""Mon, 28 May 2012 03:53:31 GMT""}]","2015-06-03"
"1112.0938","Vincenzo Maria Vagnoni","LHCb Collaboration: R. Aaij, C. Abellan Beteta, B. Adeva, M. Adinolfi,
  C. Adrover, A. Affolder, Z. Ajaltouni, J. Albrecht, F. Alessio, M. Alexander,
  G. Alkhazov, P. Alvarez Cartelle, A. A. Alves Jr, S. Amato, Y. Amhis, J.
  Anderson, R. B. Appleby, O. Aquines Gutierrez, F. Archilli, L. Arrabito, A.
  Artamonov, M. Artuso, E. Aslanides, G. Auriemma, S. Bachmann, J. J. Back, D.
  S. Bailey, V. Balagura, W. Baldini, R. J. Barlow, C. Barschel, S. Barsuk, W.
  Barter, A. Bates, C. Bauer, Th. Bauer, A. Bay, I. Bediaga, S. Belogurov, K.
  Belous, I. Belyaev, E. Ben-Haim, M. Benayoun, G. Bencivenni, S. Benson, J.
  Benton, R. Bernet, M.-O. Bettler, M. van Beuzekom, A. Bien, S. Bifani, T.
  Bird, A. Bizzeti, P. M. Bj{\o}rnstad, T. Blake, F. Blanc, C. Blanks, J.
  Blouw, S. Blusk, A. Bobrov, V. Bocci, A. Bondar, N. Bondar, W. Bonivento, S.
  Borghi, A. Borgia, T. J. V. Bowcock, C. Bozzi, T. Brambach, J. van den Brand,
  J. Bressieux, D. Brett, M. Britsch, T. Britton, N. H. Brook, H. Brown, A.
  B\""uchler-Germann, I. Burducea, A. Bursche, J. Buytaert, S. Cadeddu, O.
  Callot, M. Calvi, M. Calvo Gomez, A. Camboni, P. Campana, A. Carbone, G.
  Carboni, R. Cardinale, A. Cardini, L. Carson, K. Carvalho Akiba, G. Casse, M.
  Cattaneo, Ch. Cauet, M. Charles, Ph. Charpentier, N. Chiapolini, K. Ciba, X.
  Cid Vidal, G. Ciezarek, P. E. L. Clarke, M. Clemencic, H. V. Cliff, J.
  Closier, C. Coca, V. Coco, J. Cogan, P. Collins, A. Comerma-Montells, F.
  Constantin, A. Contu, A. Cook, M. Coombes, G. Corti, G. A. Cowan, R. Currie,
  C. D'Ambrosio, P. David, P. N. Y. David, I. De Bonis, S. De Capua, M. De
  Cian, F. De Lorenzi, J. M. De Miranda, L. De Paula, P. De Simone, D. Decamp,
  M. Deckenhoff, H. Degaudenzi, L. Del Buono, C. Deplano, D. Derkach, O.
  Deschamps, F. Dettori, J. Dickens, H. Dijkstra, P. Diniz Batista, F. Domingo
  Bonal, S. Donleavy, F. Dordei, A. Dosil Su\'arez, D. Dossett, A. Dovbnya, F.
  Dupertuis, R. Dzhelyadin, A. Dziurda, S. Easo, U. Egede, V. Egorychev, S.
  Eidelman, D. van Eijk, F. Eisele, S. Eisenhardt, R. Ekelhof, L. Eklund, Ch.
  Elsasser, D. Elsby, D. Esperante Pereira, L. Est\`eve, A. Falabella, E.
  Fanchini, C. F\""arber, G. Fardell, C. Farinelli, S. Farry, V. Fave, V.
  Fernandez Albor, M. Ferro-Luzzi, S. Filippov, C. Fitzpatrick, M. Fontana, F.
  Fontanelli, R. Forty, M. Frank, C. Frei, M. Frosini, S. Furcas, A. Gallas
  Torreira, D. Galli, M. Gandelman, P. Gandini, Y. Gao, J-C. Garnier, J.
  Garofoli, J. Garra Tico, L. Garrido, D. Gascon, C. Gaspar, N. Gauvin, M.
  Gersabeck, T. Gershon, Ph. Ghez, V. Gibson, V.V. Gligorov, C. G\""obel, D.
  Golubkov, A. Golutvin, A. Gomes, H. Gordon, M. Grabalosa G\'andara, R.
  Graciani Diaz, L. A. Granado Cardoso, E. Graug\'es, G. Graziani, A. Grecu, E.
  Greening, S. Gregson, B. Gui, E. Gushchin, Yu. Guz, T. Gys, G. Haefeli, C.
  Haen, S. C. Haines, T. Hampson, S. Hansmann-Menzemer, R. Harji, N. Harnew, J.
  Harrison, P. F. Harrison, T. Hartmann, J. He, V. Heijne, K. Hennessy, P.
  Henrard, J. A. Hernando Morata, E. van Herwijnen, E. Hicks, K. Holubyev, P.
  Hopchev, W. Hulsbergen, P. Hunt, T. Huse, R. S. Huston, D. Hutchcroft, D.
  Hynds, V. Iakovenko, P. Ilten, J. Imong, R. Jacobsson, A. Jaeger, M. Jahjah
  Hussein, E. Jans, F. Jansen, P. Jaton, B. Jean-Marie, F. Jing, M. John, D.
  Johnson, C. R. Jones, B. Jost, M. Kaballo, S. Kandybei, M. Karacson, T. M.
  Karbach, J. Keaveney, I. R. Kenyon, U. Kerzel, T. Ketel, A. Keune, B. Khanji,
  Y. M. Kim, M. Knecht, R. Koopman, P. Koppenburg, A. Kozlinskiy, L. Kravchuk,
  K. Kreplin, M. Kreps, G. Krocker, P. Krokovny, F. Kruse, K. Kruzelecki, M.
  Kucharczyk, T. Kvaratskheliya, V. N. La Thi, D. Lacarrere, G. Lafferty, A.
  Lai, D. Lambert, R. W. Lambert, E. Lanciotti, G. Lanfranchi, C. Langenbruch,
  T. Latham, C. Lazzeroni, R. Le Gac, J. van Leerdam, J.-P. Lees, R. Lef\`evre,
  A. Leflat, J. Lefran\c{c}ois, O. Leroy, T. Lesiak, L. Li, L. Li Gioi, M.
  Lieng, M. Liles, R. Lindner, C. Linn, B. Liu, G. Liu, J. von Loeben, J. H.
  Lopes, E. Lopez Asamar, N. Lopez-March, H. Lu, J. Luisier, A. Mac Raighne, F.
  Machefert, I. V. Machikhiliyan, F. Maciuc, O. Maev, J. Magnin, S. Malde, R.
  M. D. Mamunur, G. Manca, G. Mancinelli, N. Mangiafave, U. Marconi, R.
  M\""arki, J. Marks, G. Martellotti, A. Martens, L. Martin, A. Mart\'in
  S\'anchez, D. Martinez Santos, A. Massafferri, Z. Mathe, C. Matteuzzi, M.
  Matveev, E. Maurice, B. Maynard, A. Mazurov, G. McGregor, R. McNulty, M.
  Meissner, M. Merk, J. Merkel, R. Messi, S. Miglioranzi, D. A. Milanes, M.-N.
  Minard, J. Molina Rodriguez, S. Monteil, D. Moran, P. Morawski, R. Mountain,
  I. Mous, F. Muheim, K. M\""uller, R. Muresan, B. Muryn, B. Muster, M. Musy, J.
  Mylroie-Smith, P. Naik, T. Nakada, R. Nandakumar, I. Nasteva, M. Nedos, M.
  Needham, N. Neufeld, C. Nguyen-Mau, M. Nicol, V. Niess, N. Nikitin, A.
  Nomerotski, A. Novoselov, A. Oblakowska-Mucha, V. Obraztsov, S. Oggero, S.
  Ogilvy, O. Okhrimenko, R. Oldeman, M. Orlandea, J. M. Otalora Goicochea, P.
  Owen, K. Pal, J. Palacios, A. Palano, M. Palutan, J. Panman, A. Papanestis,
  M. Pappagallo, C. Parkes, C. J. Parkinson, G. Passaleva, G. D. Patel, M.
  Patel, S. K. Paterson, G. N. Patrick, C. Patrignani, C. Pavel-Nicorescu, A.
  Pazos Alvarez, A. Pellegrino, G. Penso, M. Pepe Altarelli, S. Perazzini, D.
  L. Perego, E. Perez Trigo, A. P\'erez-Calero Yzquierdo, P. Perret, M.
  Perrin-Terrin, G. Pessina, A. Petrella, A. Petrolini, A. Phan, E. Picatoste
  Olloqui, B. Pie Valls, B. Pietrzyk, T. Pila\v{r}, D. Pinci, R. Plackett, S.
  Playfer, M. Plo Casasus, G. Polok, A. Poluektov, E. Polycarpo, D. Popov, B.
  Popovici, C. Potterat, A. Powell, J. Prisciandaro, V. Pugatch, A. Puig
  Navarro, W. Qian, J. H. Rademacker, B. Rakotomiaramanana, M. S. Rangel, I.
  Raniuk, G. Raven, S. Redford, M. M. Reid, A. C. dos Reis, S. Ricciardi, K.
  Rinnert, D. A. Roa Romero, P. Robbe, E. Rodrigues, F. Rodrigues, P. Rodriguez
  Perez, G. J. Rogers, S. Roiser, V. Romanovsky, M. Rosello, J. Rouvinet, T.
  Ruf, H. Ruiz, G. Sabatino, J. J. Saborido Silva, N. Sagidova, P. Sail, B.
  Saitta, C. Salzmann, M. Sannino, R. Santacesaria, C. Santamarina Rios, R.
  Santinelli, E. Santovetti, M. Sapunov, A. Sarti, C. Satriano, A. Satta, M.
  Savrie, D. Savrina, P. Schaack, M. Schiller, S. Schleich, M. Schlupp, M.
  Schmelling, B. Schmidt, O. Schneider, A. Schopper, M.-H. Schune, R.
  Schwemmer, B. Sciascia, A. Sciubba, M. Seco, A. Semennikov, K. Senderowska,
  I. Sepp, N. Serra, J. Serrano, P. Seyfert, M. Shapkin, I. Shapoval, P.
  Shatalov, Y. Shcheglov, T. Shears, L. Shekhtman, O. Shevchenko, V.
  Shevchenko, A. Shires, R. Silva Coutinho, T. Skwarnicki, A. C. Smith, N. A.
  Smith, E. Smith, K. Sobczak, F. J. P. Soler, A. Solomin, F. Soomro, B. Souza
  De Paula, B. Spaan, A. Sparkes, P. Spradlin, F. Stagni, S. Stahl, O.
  Steinkamp, S. Stoica, S. Stone, B. Storaci, M. Straticiuc, U. Straumann, V.
  K. Subbiah, S. Swientek, M. Szczekowski, P. Szczypka, T. Szumlak, S.
  T'Jampens, E. Teodorescu, F. Teubert, C. Thomas, E. Thomas, J. van Tilburg,
  V. Tisserand, M. Tobin, S. Topp-Joergensen, N. Torr, E. Tournefier, M. T.
  Tran, A. Tsaregorodtsev, N. Tuning, M. Ubeda Garcia, A. Ukleja, P. Urquijo,
  U. Uwer, V. Vagnoni, G. Valenti, R. Vazquez Gomez, P. Vazquez Regueiro, S.
  Vecchi, J. J. Velthuis, M. Veltri, B. Viaud, I. Videau, X. Vilasis-Cardona,
  J. Visniakov, A. Vollhardt, D. Volyanskyy, D. Voong, A. Vorobyev, H. Voss, S.
  Wandernoth, J. Wang, D. R. Ward, N. K. Watson, A. D. Webber, D. Websdale, M.
  Whitehead, D. Wiedner, L. Wiggers, G. Wilkinson, M. P. Williams, M. Williams,
  F. F. Wilson, J. Wishahi, M. Witek, W. Witzeling, S. A. Wotton, K. Wyllie, Y.
  Xie, F. Xing, Z. Xing, Z. Yang, R. Young, O. Yushchenko, M. Zavertyaev, F.
  Zhang, L. Zhang, W. C. Zhang, Y. Zhang, A. Zhelezov, L. Zhong, E. Zverev, A.
  Zvyagin","Evidence for CP violation in time-integrated D0 -> h-h+ decay rates","8 pages, 3 figures, 2 tables; v2 minor updates after journal review","Phys. Rev. Lett. 108 (2012) 111602","10.1103/PhysRevLett.108.111602","LHCb-PAPER-2011-023; CERN-PH-EP-2011-208","hep-ex","http://creativecommons.org/licenses/by/3.0/","  A search for time-integrated CP violation in D0 -> h-h+ (h=K, pi) decays is
presented using 0.62 fb^-1 of data collected by LHCb in 2011. The flavor of the
charm meson is determined by the charge of the slow pion in the D*+ -> D0 pi+
and D*- -> D0bar pi- decay chains. The difference in CP asymmetry between D0 ->
K-K+ and D0 -> pi-pi+, Delta ACP = ACP(K-K+) - ACP(pi-pi+), is measured to be
[-0.82 \pm 0.21(stat.) \pm 0.11(syst.)]%. This differs from the hypothesis of
CP conservation by 3.5 standard deviations.
","[{""version"":""v1"",""created"":""Mon, 5 Dec 2011 14:30:17 GMT""},{""version"":""v2"",""created"":""Fri, 16 Mar 2012 18:02:40 GMT""}]","2012-03-19"
"1112.0939","Markus Bibinger","Markus Bibinger and Markus Rei{\ss}","Spectral covolatility estimation from noisy observations using local
  weights",,,,,"math.ST stat.TH","http://arxiv.org/licenses/nonexclusive-distrib/1.0/","  We propose localized spectral estimators for the quadratic covariation and
the spot covolatility of diffusion processes which are observed discretely with
additive observation noise. The eligibility of this approach to lead to an
appropriate estimation for time-varying volatilities stems from an asymptotic
equivalence of the underlying statistical model to a white noise model with
correlation and volatility processes being constant over small intervals. The
asymptotic equivalence of the continuous-time and the discrete-time experiments
are proved by a construction with linear interpolation in one direction and
local means for the other. The new estimator outperforms earlier nonparametric
approaches in the considered model. We investigate its finite sample size
characteristics in simulations and draw a comparison between the various
proposed methods.
","[{""version"":""v1"",""created"":""Mon, 5 Dec 2011 14:33:27 GMT""},{""version"":""v2"",""created"":""Fri, 30 Dec 2011 15:03:21 GMT""},{""version"":""v3"",""created"":""Thu, 23 May 2013 13:14:39 GMT""}]","2015-03-19"
"1112.0940","Jonathan Spreer","Jonathan Spreer","Combinatorial 3-manifolds with transitive cyclic symmetry","24 pages, 5 figures. Journal-ref: Discrete and Computational
  Geometry, 51(2):394-426, 2014","Discrete and Computational Geometry, 51(2):394-426, 2014","10.1007/s00454-013-9560-7",,"math.CO math.GT","http://arxiv.org/licenses/nonexclusive-distrib/1.0/","  In this article we give combinatorial criteria to decide whether a transitive
cyclic combinatorial d-manifold can be generalized to an infinite family of
such complexes, together with an explicit construction in the case that such a
family exists. In addition, we substantially extend the classification of
combinatorial 3-manifolds with transitive cyclic symmetry up to 22 vertices.
Finally, a combination of these results is used to describe new infinite
families of transitive cyclic combinatorial manifolds and in particular a
family of neighborly combinatorial lens spaces of infinitely many distinct
topological types.
","[{""version"":""v1"",""created"":""Mon, 5 Dec 2011 14:35:28 GMT""},{""version"":""v2"",""created"":""Thu, 15 Mar 2012 05:08:05 GMT""},{""version"":""v3"",""created"":""Fri, 10 Jul 2015 04:43:52 GMT""}]","2019-10-24"
"1112.0941","Qianxue Wang","Jacques M. Bahi, Xiaole Fang, Christophe Guyeux and Qianxue Wang","Randomness Quality of CI Chaotic Generators: Applications to Internet
  Security","6 pages,6 figures, In INTERNET'2010. The 2nd Int. Conf. on Evolving
  Internet, Valencia, Spain, pages 125-130, September 2010. IEEE Computer
  Society Press Note: Best Paper award",,"10.1109/INTERNET.2010.30",,"cs.CR","http://arxiv.org/licenses/nonexclusive-distrib/1.0/","  Due to the rapid development of the Internet in recent years, the need to
find new tools to reinforce trust and security through the Internet has became
a major concern. The discovery of new pseudo-random number generators with a
strong level of security is thus becoming a hot topic, because numerous
cryptosystems and data hiding schemes are directly dependent on the quality of
these generators. At the conference Internet`09, we have described a generator
based on chaotic iterations, which behaves chaotically as defined by Devaney.
In this paper, the proposal is to improve the speed and the security of this
generator, to make its use more relevant in the Internet security context. To
do so, a comparative study between various generators is carried out and
statistical results are given. Finally, an application in the information
hiding framework is presented, to give an illustrative example of the use of
such a generator in the Internet security field.
","[{""version"":""v1"",""created"":""Mon, 5 Dec 2011 14:35:53 GMT""}]","2016-11-17"
"1112.0942","Yanping Huang","BESIII Collaboration","Spin-Parity Analysis of ppbar Mass Threshold Structure in J/psi and psi'
  Radiative Decays","5 pages, 3 figures, submitted to Phys. Rev. Lett",,"10.1103/PhysRevLett.108.112003",,"hep-ex","http://arxiv.org/licenses/nonexclusive-distrib/1.0/","  A partial wave analysis of the $p \bar{p}$ mass-threshold enhancement in the
reaction $J/\psi\rightarrow\gamma p\bar{p}$ is used to determine: its $J^{PC}$
quantum numbers to be $0^{-+}$; its peak mass to be below threshold at
$M=1832^{+19}_{-5} {\rm(stat.)}^{+18}_{-17} {\rm (syst.)}\pm19 {\rm (model)}
{\rm MeV}/c^2$; and its total width to be $\Gamma<76 {\rm MeV}/c^2$ at the 90%
C.L. The product branching ratio is measured to be $B(J/\psi\rightarrow\gamma
X(p\bar{p}))B(X(p\bar{p})\rightarrow p\bar{p})=(9.0^{+0.4}_{-1.1} {\rm
(stat.)}^{+1.5}_{-5.0} {\rm (syst.)}\pm2.3 {\rm (model)})\times10^{-5}$. A
similar analysis performed on $\psi^\prime\rightarrow\gamma p\bar{p}$ decays
shows, for the first time, the presence of a corresponding enhancement with a
production rate relative to that for $J/\psi$ decays of
$R=(5.08^{+0.71}_{-0.45} {\rm (stat.)}^{+0.67}_{-3.58} {\rm (syst.)}\pm0.12
{\rm (model)})%$.
","[{""version"":""v1"",""created"":""Mon, 5 Dec 2011 14:37:05 GMT""}]","2013-05-30"
"1112.0943","Prasanta Das Kumar","Prasanta Kumar Das and Abhishodh Prakash","Laboratory frame analysis of $e^+ e^- \to \mu^+ \mu^-$ scattering in the
  Noncommutative Standard Model","16 pages, 10 eps figures. Earlier version is replaced. Text has been
  rewritten.Conclusion is unchanged","Int. J. Mod. Phys. A 27, 1250141 (2012)","10.1142/S0217751X12501412",,"hep-ph","http://arxiv.org/licenses/nonexclusive-distrib/1.0/","  We study the muon pair production $ e^+ e^- \to \mu^+ \mu^-$ in the framework
of the non-minimal noncommutative(NC) standard model to the second order of the
NC parameter $\Theta_{\mu\nu}$. The $\mathcal{O}(\Theta^2)$ momentum dependent
NC interaction significantly modifies the cross section and angular
distributions which are different from the standard model. After including the
effects of earth's rotation we analyse the time-averaged and time dependent
observables in detail. The time-averaged azimuthal distribution of the cross
section shows siginificant departure from the standard model. We find strong
dependence of the total cross section(time- averaged) and their distributions
on the orientation of the noncommutative electric vector (${\vec{\Theta}}_E$).
The periodic variation of the total cross-section with time over a day seems to
be startling and can be thoroughly probed at the upcoming Linear Collider(LC).
","[{""version"":""v1"",""created"":""Mon, 5 Dec 2011 14:41:10 GMT""},{""version"":""v2"",""created"":""Sun, 4 Mar 2012 09:22:50 GMT""}]","2014-11-18"
"1112.0944","Jorick S. Vink","L. E. Muijres (Amsterdam), Jorick S. Vink (Armagh), A. de Koter
  (Amsterdam), P.E. Mueller (Keele), N. Langer (Bonn)","Predictions for mass-loss rates and terminal wind velocities of massive
  O-type stars","10 pages, 10 figures, Astronomy & Astrophysics (in press)",,"10.1051/0004-6361/201015818",,"astro-ph.SR astro-ph.GA","http://arxiv.org/licenses/nonexclusive-distrib/1.0/","  Mass loss forms an important aspect of the evolution of massive stars, as
well as for the enrichment of the surrounding ISM. Our goal is to predict
accurate mass-loss rates and terminal wind velocities. These quantities can be
compared to empirical values, thereby testing radiation-driven wind models. One
specific issue is that of the ""weak-wind problem"", where empirically derived
mass-loss rates fall orders of magnitude short of predicted values. We employ
an established Monte Carlo model and a recently suggested new line acceleration
formalism to solve the wind dynamics consistently. We provide a new grid of
mass-loss rates and terminal wind velocities of O stars, and compare the values
to empirical results. Our models fail to provide mass-loss rates for
main-sequence stars below a luminosity of log(L/Lsun) = 5.2, where we run into
a fundamental limit. At luminosities below this critical value there is
insufficient momentum transferred in the region below the sonic point to
kick-start the acceleration. This problem occurs at the location of the onset
of the weak-wind problem. For O dwarfs, the boundary between being able to
start a wind, and failing to do so, is at spectral type O6/O6.5. The direct
cause of this failure is a combination of the lower luminosity and a lack of Fe
V lines at the wind base. This might indicate that another mechanism is
required to provide the necessary driving to initiate the wind. For stars more
luminous than log(L/Lsun) = 5.2, our new mass-loss rates are in excellent
agreement with the mass-loss prescription by Vink et al. 2000. This implies
that the main assumption entering the method of the Vink et al. prescriptions -
i.e. that the momentum equation is not explicitly solved for - does not
compromise the reliability of the Vink et al. results for this part of
parameter space (Abridged).
","[{""version"":""v1"",""created"":""Mon, 5 Dec 2011 14:42:31 GMT""}]","2015-06-03"
"1112.0945","Marco Baldi","Marco Baldi, Giovanni Cancellieri, Franco Chiaraluce","Interleaved Product LDPC Codes","11 pages, 5 figures, accepted for publication in IEEE Transactions on
  Communications","IEEE Transactions on Communications, Vol. 60, No. 4, pp. 895-901,
  Apr. 2012","10.1109/TCOMM.2012.030712.100173",,"cs.IT math.IT","http://arxiv.org/licenses/nonexclusive-distrib/1.0/","  Product LDPC codes take advantage of LDPC decoding algorithms and the high
minimum distance of product codes. We propose to add suitable interleavers to
improve the waterfall performance of LDPC decoding. Interleaving also reduces
the number of low weight codewords, that gives a further advantage in the error
floor region.
","[{""version"":""v1"",""created"":""Mon, 5 Dec 2011 14:44:02 GMT""}]","2012-12-21"
"1112.0946","Kruchinin Dmitry","Dmitry Kruchinin","On a property of superposition of the generating functions
  ln(1/(1-F(x)))","5 pages",,,,"math.CO math.NT","http://arxiv.org/licenses/nonexclusive-distrib/1.0/","  Obtained a new property of superposition of the generating functions
ln(1/(1-F(x))), where F(x) - generating function with integer coefficients,
which allows the construction a primality tests. The theorem which is based on
compositions of positive numbers and its corollary are proved. Examples are
given. Key words: Generating functions, superposition of generating functions,
composition of a natural number.
","[{""version"":""v1"",""created"":""Mon, 5 Dec 2011 14:44:02 GMT""}]","2011-12-06"
