"1112.0809","Angel Rivas Vargas","Alfredo Luis and \'Angel Rivas","Angular-momentum nonclassicality by breaking classical bounds on
  statistics","8 pages, 5 figures","Phys. Rev. A 84, 042111 (2011)","10.1103/PhysRevA.84.042111",,"quant-ph","http://arxiv.org/licenses/nonexclusive-distrib/1.0/","  We derive simple practical procedures revealing the quantum behavior of
angular momentum variables by the violation of classical upper bounds on the
statistics. Data analysis is minimum and definite conclusions are obtained
without evaluation of moments, or any other more sophisticated procedures.
These nonclassical tests are very general and independent of other typical
quantum signatures of nonclassical behavior such as sub-Poissonian statistics,
squeezing, or oscillatory statistics, being insensitive to the nonclassical
behavior displayed by other variables.
","[{""version"":""v1"",""created"":""Sun, 4 Dec 2011 23:31:54 GMT""}]","2011-12-06"
"1112.0810","P. Wiegmann","P. Wiegmann","Non-Linear hydrodynamics and Fractionally Quantized Solitons at
  Fractional Quantum Hall Edge","6 pages, 2 Figures","Phys. Rev. Lett. 108, 206810 (2012)","10.1103/PhysRevLett.108.206810",,"cond-mat.mes-hall","http://arxiv.org/licenses/nonexclusive-distrib/1.0/","  We argue that dynamics of gapless Fractional Quantum Hall Edge states is
essentially non-linear and that it features fractionally quantized solitons
propagating along the edge. Observation of solitons would be a direct evidence
of fractional charges. We show that the non-linear dynamics of the Laughlin's
FQH state is governed by the quantum Benjamin-Ono equation. Non-linear dynamics
of gapless edge states is determined by gapped modes in the bulk of FQH liquid.
The dispersion of edge modes is traced to the double boundary layer of FQH
states.
","[{""version"":""v1"",""created"":""Sun, 4 Dec 2011 23:50:24 GMT""},{""version"":""v2"",""created"":""Sat, 14 Jan 2012 01:21:59 GMT""}]","2012-10-02"
"1112.0811","Hartmut Schmieden","R. Ewald, A. V. Anisovich, B. Bantes, O. Bartholomy, D. Bayadilov, R.
  Beck, Y. A. Beloglazov, K.-T. Brinkmann, V. Crede, H. Dutz, D. Elsner, K.
  Fornet-Ponse, F. Frommberger, Ch. Funke, A. B. Gridnev, E. Gutz, W. Hillert,
  J. Hannappel, P. Hoffmeister, I. Jaegle, O. Jahn, T. Jude, J. Junkersfeld, H.
  Kalinowsky, S. Kammer, V. Kleber, Frank Klein, Friedrich Klein, E. Klempt, B.
  Krusche, M. Lang, H. L\""ohner, I. V. Lopatin, D. Menze, T. Mertens, J. G.
  Messchendorp, V. Metag, M. Nanova, V. A. Nikonov, D. Novinski, R. Novotny, M.
  Ostrick, L. Pant, H. van Pee, A. Roy, A. V. Sarantsev, S. Schadmand, Ch.
  Schmidt, H. Schmieden, B. Schoch, S. Shende, V. Sokhoyan, A. S\""ule, V. V.
  Sumachev, T. Szczepanek, U. Thoma, D. Trnka, R. Varma, D. Walther, Ch. Wendel","Anomaly in the K^0_S Sigma^+ photoproduction cross section off the
  proton at the K* threshold","14 pages, 7 figures",,"10.1016/j.physletb.2012.05.066",,"nucl-ex","http://arxiv.org/licenses/nonexclusive-distrib/1.0/","  The $\gamma + p \rightarrow K^0 + \Sigma^+$ photoproduction reaction is
investigated in the energy region from threshold to $E_\gamma = 2250$\,MeV. The
differential cross section exhibits increasing forward-peaking with energy, but
only up to the $K^*$ threshold. Beyond, it suddenly returns to a flat
distribution with the forward cross section dropping by a factor of four. In
the total cross section a pronounced structure is observed between the
$K^*\Lambda$ and $K^*\Sigma$ thresholds. It is speculated whether this signals
the turnover of the reaction mechanism from t-channel exchange below the $K^*$
production threshold to an s-channel mechanism associated with the formation of
a dynamically generated $K^*$-hyperon intermediate state.
","[{""version"":""v1"",""created"":""Sun, 4 Dec 2011 23:56:40 GMT""}]","2015-06-03"
"1112.0812","Manuel Amann","Manuel Amann","Computational complexity of topological invariants",,,,,"math.AT math.GN","http://arxiv.org/licenses/nonexclusive-distrib/1.0/","  We answer the following question posed by Lechuga: Given a simply-connected
space $X$ with both $H_*(X,\qq)$ and $\pi_*(X)\otimes \qq$ being
finite-dimensional, what is the computational complexity of an algorithm
computing the cup-length and the rational Lusternik--Schnirelmann category of
$X$?
  Basically, by a reduction from the decision problem whether a given graph is
$k$-colourable (for $k\geq 3$) we show that (even stricter versions of the)
problems above are $\mathbf{NP}$-hard.
","[{""version"":""v1"",""created"":""Mon, 5 Dec 2011 00:00:33 GMT""}]","2011-12-06"
"1112.0813","Mihaela Ifrim","John Hunter and Mihaela Ifrim","Enhanced Lifespan of Smooth Solutions of a Burgers-Hilbert Equation","13 pages, 1 figure",,,,"math.AP","http://arxiv.org/licenses/nonexclusive-distrib/1.0/","  We consider an initial value problem for a quadratically nonlinear inviscid
Burgers-Hilbert equation that models the motion of vorticity discontinuities.
We use a normal form transformation, which is implemented by means of a
near-identity coordinate change of the independent spatial variable, to prove
the existence of small, smooth solutions over cubically nonlinear time-scales.
For vorticity discontinuities, this result means that there is a cubically
nonlinear time-scale before the onset of filamentation.
","[{""version"":""v1"",""created"":""Mon, 5 Dec 2011 00:02:05 GMT""}]","2011-12-06"
"1112.0814","Abhishek Agarwal","Abhishek Agarwal and Ansar Fayyazuddin","Non-local symmetries for Yang-Mills theories and their massive
  counterparts in two and three dimensions","18 Pages",,"10.1007/JHEP05(2012)153",,"hep-th","http://arxiv.org/licenses/nonexclusive-distrib/1.0/","  We identify a non-local symmetry for Yang-Mills theories in 1+1 and 2+1
spacetime dimensions. The symmetry mixes a vector current with the gauge field.
The current involved in the symmetry is required to satisfy certain
constraints. The explicit solution for the current obeying these constraints,
is obtained in two spacetime dimensions and in the abelian case in three
dimensions. We conjecture that the current is generated from a non-local gauge
and Lorentz invariant mass term in three dimensions and provide some evidence
for it.
  We also posit a conserved current associated with the symmetry generators and
derive some of its properties. In the Abelian case, we compute the symmetry
algebra and show that additional symmetry generators have to be included for
the algebra to close. The algebra contains an SO(2,1) subalgebra. We also
comment on the implications of this symmetry for N=1 supersymmetry.
","[{""version"":""v1"",""created"":""Mon, 5 Dec 2011 00:10:12 GMT""}]","2015-06-03"
"1112.0815","Rafael Torrealba","Rafael Torrealba","""OPERA superluminal neutrinos explained by spontaneous emission and
  stimulated absorption""","6 pages, 2 fig",,,,"hep-ph hep-ex","http://arxiv.org/licenses/nonexclusive-distrib/1.0/","  In this work it is shown, that for short 3ns neutrino pulses reported by
OPERA, a relativistic shape deforming effect of the neutrino distribution
function due to spontaneous emission, produces an earlier arrival of 65.8ns in
agreement with the reported 62.1ns\pm 3.7ns, with a RMS of 16.4ns explaining
the apparent superluminal effect. It is also shown, that early arrival of long
10500ns neutrinos pulse to Gran Sasso, by 57.8ns with respect to the speed of
light, could be explained by a shape deforming effect due to a combination of
stimulated absorption and spontaneous emission, while traveling by the decay
tunnel that acts as a LASER tube.
","[{""version"":""v1"",""created"":""Mon, 5 Dec 2011 00:12:53 GMT""}]","2011-12-06"
"1112.0816","Kevin Costello","Kevin J. Costello","A geometric construction of the Witten genus, II","91 pages. Version 2: typos corrected",,,,"math.QA math.AT","http://arxiv.org/licenses/nonexclusive-distrib/1.0/","  I give a rigorous construction of a 2-dimensional quantum field theory of
maps from an elliptic curve to a compact complex manifold X, and I show that
the partition function of this theory is the Witten genus of X. The results
proved here were announced (in a slightly different form) in arXiv:1006.5422.
","[{""version"":""v1"",""created"":""Mon, 5 Dec 2011 01:11:20 GMT""},{""version"":""v2"",""created"":""Thu, 15 Dec 2011 23:47:52 GMT""}]","2011-12-19"
"1112.0817","Martin Kovar","Martin Maria Kov\'ar","A New Causal Topology and Why the Universe is Co-compact","15 pages, AMS LaTeX. Some additional typos corrected",,,,"math-ph gr-qc math.GN math.MP","http://arxiv.org/licenses/nonexclusive-distrib/1.0/","  We show that there exists a canonical topology, naturally connected with the
causal site of J. D. Christensen and L. Crane, a pointless algebraic structure
motivated by quantum gravity. Taking a causal site compatible with Minkowski
space, on every compact subset our topology became a reconstruction of the
original topology of the spacetime (only from its causal structure). From the
global point of view, the reconstructed topology is the de Groot dual or
co-compact with respect to the original, Euclidean topology. The result
indicates that the causality is the primary structure of the spacetime,
carrying also its topological information.
","[{""version"":""v1"",""created"":""Mon, 5 Dec 2011 01:27:50 GMT""},{""version"":""v2"",""created"":""Tue, 6 Dec 2011 23:11:06 GMT""},{""version"":""v3"",""created"":""Thu, 1 Aug 2013 23:49:13 GMT""}]","2013-08-05"
"1112.0818","Fumiyasu Komaki","Fumiyasu Komaki","Asymptotically minimax Bayesian predictive densities for multinomial
  models",,"Electron. J. Statist. 6: 934-957 (2012)","10.1214/12-EJS700",,"math.ST stat.TH","http://arxiv.org/licenses/nonexclusive-distrib/1.0/","  One-step ahead prediction for the multinomial model is considered. The
performance of a predictive density is evaluated by the average
Kullback-Leibler divergence from the true density to the predictive density.
Asymptotic approximations of risk functions of Bayesian predictive densities
based on Dirichlet priors are obtained. It is shown that a Bayesian predictive
density based on a specific Dirichlet prior is asymptotically minimax. The
asymptotically minimax prior is different from known objective priors such as
the Jeffreys prior or the uniform prior.
","[{""version"":""v1"",""created"":""Mon, 5 Dec 2011 01:30:15 GMT""}]","2021-05-27"
"1112.0819","Saharon Shelah","Saharon Shelah","Nice aleph_1 generated non-P-points, I",,,,"Shelah [Sh:980]","math.LO","http://arxiv.org/licenses/nonexclusive-distrib/1.0/","  We define a family of a (non-principal) ultrafilters on N which are, in a
sense, far from P-points. We first under reasonable conditions, prove its
existence. In a continuation we shall prove that such a point may exist while
no P-point exists.
","[{""version"":""v1"",""created"":""Mon, 5 Dec 2011 01:42:36 GMT""},{""version"":""v2"",""created"":""Sun, 9 Jun 2013 14:02:54 GMT""},{""version"":""v3"",""created"":""Sun, 4 Sep 2022 13:17:58 GMT""},{""version"":""v4"",""created"":""Fri, 14 Oct 2022 19:34:12 GMT""}]","2022-10-18"
"1112.0820","Timothy C. Ralph","T. C. Ralph and C. R. Myers","Reply to comment on ""Information Flow of quantum states interacting with
  closed timelike curves""",,"Phys Rev A 84 056302 (2011)","10.1103/PhysRevA.84.056302",,"quant-ph","http://arxiv.org/licenses/nonexclusive-distrib/1.0/","  We respond to the comment by Klobus, et al by emphasizing that the equivalent
circuit, once constructed, obeys the standard rules of quantum mechanics -
hence there is no ambiguity in how to choose initial states in our model. We
discuss the distinction between correlated ensembles produced non-locally via
measurements on entangled states and those produced via local preparation.
","[{""version"":""v1"",""created"":""Mon, 5 Dec 2011 02:04:14 GMT""}]","2015-06-03"
"1112.0821","Kouji Nakamura","Kouji Nakamura","Short note on construction of gauge-invariant variables of linear metric
  perturbations on an arbitrary background spacetime","4 pages, no figures, jgrg21.sty is used. Prepared for the proceedings
  of the International Conference JGRG21 (2011, Sendai, Japan)",,,,"gr-qc astro-ph.CO hep-th math-ph math.MP","http://arxiv.org/licenses/nonexclusive-distrib/1.0/","  An outline of a proof of the decomposition of linear metric perturbations
into gauge-invariant and gauge-variant parts on an arbitrary background
spacetime which admits ADM decomposition is briefly discussed. We explicitly
construct the gauge-invariant and gauge-variant parts of the linear metric
perturbations based on some assumptions. This implies that we can develop the
higher-order gauge-invariant perturbation theory on an arbitrary background
spacetime.
","[{""version"":""v1"",""created"":""Mon, 5 Dec 2011 02:05:54 GMT""}]","2011-12-06"
"1112.0822","Aya Bamba","Ryoko Nakamura (1,2), Aya Bamba (3,1,4), Tadayasu Dotani (1), Manabu
  Ishida (1), Ryo Yamazaki (4), Kazunori Kohri (5) ((1) ISAS/JAXA, (2) Tokyo
  Inst. of Tech., (3) DIAS, (4) Aoyama Gakuin U., (5) KEK)","Evolution of Synchrotron X-rays in Supernova Remnants","6 pages, 2 figures, ApJ, in press",,"10.1088/0004-637X/746/2/134",,"astro-ph.HE hep-ex","http://arxiv.org/licenses/nonexclusive-distrib/1.0/","  A systematic study of the synchrotron X-ray emission from supernova remnants
(SNRs) has been conducted. We selected a total of 12 SNRs whose synchrotron
X-ray spectral parameters are available in the literature with reasonable
accuracy, and studied how their luminosities change as a function of radius. It
is found that the synchrotron X-ray luminosity tends to drop especially when
the SNRs become larger than ~5 pc, despite large scatter. This may be explained
by the change of spectral shape caused by the decrease of the synchrotron
roll-off energy. A simple evolutionary model of the X-ray luminosity is
proposed and is found to reproduce the observed data approximately, with
reasonable model parameters. According to the model, the total energy of
accelerated electrons is estimated to be 10^(47-48) ergs, which is well below
the supernova explosion energy. The maximum energies of accelerated electrons
and protons are also discussed.
","[{""version"":""v1"",""created"":""Mon, 5 Dec 2011 03:01:22 GMT""}]","2015-06-03"
"1112.0823","The Anh Bui","The Anh Bui and Xuan Thinh Duong","Weighted norm inequalities for multilinear operators and applications to
  multilinear Fourier multipliers","to appear in Bulletin des Sc. Math",,,,"math.CA","http://arxiv.org/licenses/nonexclusive-distrib/1.0/","  Let $T$ be a multilinear operator which is bounded on certain products of
unweighted Lebesgue spaces of $\mathbb R^n$. We assume that the associated
kernel of $T$ satisfies some mild regularity condition which is weaker than the
usual H\""older continuity of those in the class of multilinear
Calder\'on-Zygmund singular integral operators. We then show the boundedness
for $T$ and the boundedness of the commutator of $T$ with BMO functions on
products of weighted Lebesgue spaces of $\mathbb R^n$. As an application, we
obtain the weighted norm inequalities of multilinear Fourier multipliers and of
their commutators with BMO functions on the products of weighted Lebesgue
spaces when the number of derivatives of the symbols is the same as the best
known result for the multilinear Fourier multipliers to be bounded on the
products of unweighted Lebesgue spaces.
","[{""version"":""v1"",""created"":""Mon, 5 Dec 2011 03:13:19 GMT""},{""version"":""v2"",""created"":""Sat, 14 Apr 2012 07:17:51 GMT""}]","2012-04-17"
"1112.0824","Xuhua He","Xuhua He and Sian Nie","Minimal length elements of extended affine Coxeter groups, II","32 pages","Compositio Math. 150 (2014) 1903-1927","10.1112/S0010437X14007349",,"math.RT","http://arxiv.org/licenses/nonexclusive-distrib/1.0/","  Let $W$ be an extended affine Weyl group. We prove that minimal length
elements $w_{\co}$ of any conjugacy class $\co$ of $W$ satisfy some special
properties, generalizing results of Geck and Pfeiffer \cite{GP} on finite Weyl
groups. We then introduce the ""class polynomials"" for affine Hecke algebra $H$
and prove that $T_{w_\co}$, where $\co$ runs over all the conjugacy classes of
$W$, forms a basis of the cocenter $H/[H, H]$. We also classify the conjugacy
classes satisfying a generalization of Lusztig's conjecture \cite{L4}.
","[{""version"":""v1"",""created"":""Mon, 5 Dec 2011 03:21:51 GMT""}]","2019-02-20"
"1112.0825","Seung-Woo Lee","Seung-Woo Lee, Hyunseok Jeong","Near-deterministic quantum teleportation and resource-efficient quantum
  computation using linear optics and hybrid qubits","10 pages, 5 figures; extended version, title, abstract and figures
  changed, details added, to be published in Phys. Rev. A","Phys. Rev. A 87, 022326 (2013)","10.1103/PhysRevA.87.022326",,"quant-ph","http://arxiv.org/licenses/nonexclusive-distrib/1.0/","  We propose a scheme to realize deterministic quantum teleportation using
linear optics and hybrid qubits. It enables one to efficiently perform
teleportation and universal linear-optical gate operations in a simple and
near-deterministic manner using all-optical hybrid entanglement as off-line
resources. Our analysis shows that our new approach can outperforms major
previous ones when considering both the resource requirements and fault
tolerance limits.
","[{""version"":""v1"",""created"":""Mon, 5 Dec 2011 03:37:20 GMT""},{""version"":""v2"",""created"":""Sat, 2 Feb 2013 18:56:20 GMT""}]","2013-02-21"
"1112.0826","Yingyu Liang","Maria Florina Balcan, Yingyu Liang","Clustering under Perturbation Resilience","54 pages. Appears in SIAM Journal on Computing (SICOMP), 2016",,,,"cs.LG cs.DS","http://arxiv.org/licenses/nonexclusive-distrib/1.0/","  Motivated by the fact that distances between data points in many real-world
clustering instances are often based on heuristic measures, Bilu and
Linial~\cite{BL} proposed analyzing objective based clustering problems under
the assumption that the optimum clustering to the objective is preserved under
small multiplicative perturbations to distances between points. The hope is
that by exploiting the structure in such instances, one can overcome worst case
hardness results.
  In this paper, we provide several results within this framework. For
center-based objectives, we present an algorithm that can optimally cluster
instances resilient to perturbations of factor $(1 + \sqrt{2})$, solving an
open problem of Awasthi et al.~\cite{ABS10}. For $k$-median, a center-based
objective of special interest, we additionally give algorithms for a more
relaxed assumption in which we allow the optimal solution to change in a small
$\epsilon$ fraction of the points after perturbation. We give the first bounds
known for $k$-median under this more realistic and more general assumption. We
also provide positive results for min-sum clustering which is typically a
harder objective than center-based objectives from approximability standpoint.
Our algorithms are based on new linkage criteria that may be of independent
interest.
  Additionally, we give sublinear-time algorithms, showing algorithms that can
return an implicit clustering from only access to a small random sample.
","[{""version"":""v1"",""created"":""Mon, 5 Dec 2011 03:42:07 GMT""},{""version"":""v2"",""created"":""Tue, 27 Dec 2011 19:49:32 GMT""},{""version"":""v3"",""created"":""Fri, 30 Dec 2011 03:37:24 GMT""},{""version"":""v4"",""created"":""Fri, 8 Aug 2014 02:27:56 GMT""},{""version"":""v5"",""created"":""Sun, 11 Dec 2016 21:41:33 GMT""}]","2016-12-13"
"1112.0827","Robert Seaman","Rob Seaman","Systems Engineering for Civil Timekeeping","Contribution to the Colloquium on Decoupling Civil Timekeeping from
  Earth Rotation: http://futureofutc.org, 11 pages",,,,"astro-ph.IM physics.soc-ph","http://arxiv.org/licenses/nonexclusive-distrib/1.0/","  The future of Coordinated Universal Time has been a topic of energetic
discussions for more than a dozen years. Different communities view the issue
in different ways. Diametrically opposed visions exist for the range of
appropriate solutions that should be entertained. Rather than an insoluble
quandary, we suggest that well-known systems engineering best practices would
provide a framework for reaching consensus. This starts with the coherent
collection of project requirements.
","[{""version"":""v1"",""created"":""Mon, 5 Dec 2011 03:49:16 GMT""}]","2011-12-06"
"1112.0828","Haizhong Li","Haizhong Li and Yong Wei","Lower volume growth estimates for Self-shrinkers of mean curvature flow","14 pages, we change the title of the paper, delete a theorem about
  Ricci soliton which has been proved by Ovidiu Munteanu and Jiaping Wang, and
  correct a gap in the proof of our theorem in the previous version",,,,"math.DG math.AP","http://arxiv.org/licenses/nonexclusive-distrib/1.0/","  We obtain a Calabi-Yau type lower volume growth estimates for complete
noncompact self-shrinkers of the mean curvature flow, more precisely, every
complete noncompact properly immersed self-shrinker has at least linear volume
growth.
","[{""version"":""v1"",""created"":""Mon, 5 Dec 2011 03:55:33 GMT""},{""version"":""v2"",""created"":""Thu, 15 Dec 2011 08:47:14 GMT""},{""version"":""v3"",""created"":""Mon, 23 Jan 2012 02:47:46 GMT""}]","2012-01-24"
"1112.0829","Thomas Hayes","Thomas P. Hayes","How Not to Win a Million Dollars: A Counterexample to a Conjecture of L.
  Breiman","6 pages, 1 figure",,,,"math.PR cs.GT","http://arxiv.org/licenses/nonexclusive-distrib/1.0/","  Consider a gambling game in which we are allowed to repeatedly bet a portion
of our bankroll at favorable odds. We investigate the question of how to
minimize the expected number of rounds needed to increase our bankroll to a
given target amount.
  Specifically, we disprove a 50-year old conjecture of L. Breiman, that there
exists a threshold strategy that optimizes the expected number of rounds; that
is, a strategy that always bets to try to win in one round whenever the
bankroll is at least a certain threshold, and that makes Kelly bets (a simple
proportional betting scheme) whenever the bankroll is below the threshold.
","[{""version"":""v1"",""created"":""Mon, 5 Dec 2011 04:26:49 GMT""}]","2011-12-06"
"1112.0830","Albert Todd","Hyunjoo Cho, Sema Salur and Albert J. Todd","A Note on Closed G_2-Structures and 3-Manifolds","7 pages, LaTex",,,,"math.DG hep-th math.SG","http://arxiv.org/licenses/nonexclusive-distrib/1.0/","  This article shows that given any orientable 3-manifold X, the 7-manifold
T^*X x R admits a closed G_2-structure varphi=Re(Omega)+omega\wedge dt where
Omega is a certain complex-valued 3-form on T^*X; next, given any 2-dimensional
submanifold S of X, the conormal bundle N^*S of S is a 3-dimensional
submanifold of T^*X x R such that varphi restricted to N^*S is equivalent to 0.
A corollary of the proof of this result is that N^*S x R is a 4-dimensional
submanifold of T^*X x R such that varphi restricted to N^*S x R is equivalent
to 0.
","[{""version"":""v1"",""created"":""Mon, 5 Dec 2011 04:48:50 GMT""}]","2011-12-06"
"1112.0831","Adrian Ioana","Adrian Ioana","Compact actions and uniqueness of the group measure space decomposition
  of II$_1$ factors",,,,,"math.OA math.FA math.GR","http://arxiv.org/licenses/nonexclusive-distrib/1.0/","  We prove that any II$_1$ factor $L^{\infty}(X)\rtimes\Gamma$ arising from a
compact, free, ergodic, probability measure preserving action of a countable
group $\Gamma$ with positive first $\ell^2$-Betti number, has a unique group
measure space Cartan subalgebra, up to unitary conjugacy.
","[{""version"":""v1"",""created"":""Mon, 5 Dec 2011 04:55:58 GMT""}]","2011-12-06"
"1112.0832","Albert Todd","Hyunjoo Cho, Sema Salur, and Albert J. Todd","Diffeomorphisms of 7-Manifolds with Closed G_2-Structure","13 pages; Ver. 3 fixes errors in addition to further updating the
  introduction and references",,,,"math.DG hep-th math.SG","http://arxiv.org/licenses/nonexclusive-distrib/1.0/","  We introduce G_2-vector fields, Rochesterian 1-forms and Rochesterian vector
fields on manifolds with a closed G_2-structure as analogues of symplectic
vector fields, Hamiltonian functions and Hamiltonian vector fields
respectively, and we show that the spaces of G_2-vector fields and of
Rochesterian vector fields are Lie subalgebras of the Lie algebra of vector
fields with the standard Lie bracket. We also define, in analogy with the
Poisson bracket on smooth real-valued functions from symplectic geometry, a
bracket operation on the space of Rochesterian 1-forms associated to the space
of Rochesterian vector fields and prove, despite the lack of a Jacobi identity,
a relationship between this bracket and diffeomorphisms which preserve
G_2-structures.
","[{""version"":""v1"",""created"":""Mon, 5 Dec 2011 05:13:32 GMT""},{""version"":""v2"",""created"":""Mon, 12 Mar 2012 18:16:05 GMT""},{""version"":""v3"",""created"":""Tue, 11 Dec 2012 00:30:36 GMT""}]","2012-12-12"
