"1112.0765","Victor M. Preciado","Victor M. Preciado, Michael M. Zavlanos, Ali Jadbabaie","Spectral Design of Dynamic Networks via Local Operations","Submitted for publication",,,,"math.OC cs.DM cs.MA cs.SI physics.soc-ph","http://arxiv.org/licenses/nonexclusive-distrib/1.0/","  Motivated by the relationship between the eigenvalue spectrum of the
Laplacian matrix of a network and the behavior of dynamical processes evolving
in it, we propose a distributed iterative algorithm in which a group of $n$
autonomous agents self-organize the structure of their communication network in
order to control the network's eigenvalue spectrum. In our algorithm, we assume
that each agent has access only to a local (myopic) view of the network around
it. In each iteration, agents in the network peform a decentralized decision
process to determine the edge addition/deletion that minimizes a distance
function defined in the space of eigenvalue spectra. This spectral distance
presents interesting theoretical properties that allow an efficient distributed
implementation of the decision process. Our iterative algorithm is stable by
construction, i.e., locally optimizes the network's eigenvalue spectrum, and is
shown to perform extremely well in practice. We illustrate our results with
nontrivial simulations in which we design networks matching the spectral
properties of complex networks, such as small-world and power-law networks.
","[{""version"":""v1"",""created"":""Sun, 4 Dec 2011 16:03:06 GMT""},{""version"":""v2"",""created"":""Fri, 7 Sep 2012 13:22:19 GMT""}]","2012-09-10"
"1112.0766","Ferruccio Renzoni Dr","A. Wickenbrock, D. Cubero, N. A. Abdul Wahab, P. Phoonthong, and F.
  Renzoni","Current reversals in a rocking ratchet: the frequency domain",,"Phys. Rev. E 84, 021127 (2011)","10.1103/PhysRevE.84.021127",,"cond-mat.stat-mech physics.atom-ph quant-ph","http://arxiv.org/licenses/nonexclusive-distrib/1.0/","  Motivated by recent work [D. Cubero et al., Phys. Rev. E 82, 041116 (2010)],
we examine the mechanisms which determine current reversals in rocking ratchets
as observed by varying the frequency of the drive. We found that a class of
these current reversals in the frequency domain are precisely determined by
dissipation-induced symmetry breaking. Our experimental and theoretical work
thus extends and generalizes the previously identified relationship between
dynamical and symmetry-breaking mechanisms in the generation of current
reversals.
","[{""version"":""v1"",""created"":""Sun, 4 Dec 2011 16:03:06 GMT""}]","2011-12-06"
"1112.0767","Akira Ishii Prof.","Akira Ishii, Takehiro Matsumoto, Shinji Miki","Revenue Prediction of Local Event using Mathematical Model of Hit
  Phenomena","8 pages, 3 Figures. submitted to Progress of Theoretical Physics",,,,"physics.soc-ph cs.SI","http://arxiv.org/licenses/nonexclusive-distrib/1.0/","  Theoretical approach to investigate human-human interaction in society
performed using a many-body theory including human-human interaction. The
advertisement is treated as an external force. The word of mouth (WOM) effect
is included as a two-body interaction between humans. The rumor effect is
included as a three-body interaction between humans. The parameters to define
the strength of human interactions are assumed to be constant values. The
calculated result explained well the two local events ""Mizuki-Shigeru Road in
Sakaiminato"" and ""the sculpture festival at Tottori"" in Japan.
","[{""version"":""v1"",""created"":""Sun, 4 Dec 2011 16:15:58 GMT""}]","2011-12-06"
"1112.0768","Ying Zhang","Qiang Tan, Hongyu Wang, Ying Zhang, and Peng Zhu","On cohomology of almost complex 4-manifolds","13 pages. Important Note: The second the two main results of the
  previous version of this paper has been dropped; it has been dealt with in a
  different paper (arXiv:1307.1513)",,,,"math.SG math.DG","http://arxiv.org/licenses/nonexclusive-distrib/1.0/","  Based on recent work of T. Draghici, T.-J. Li and W. Zhang, we further
investigate properties of the dimension h_J of the J-anti-invariant cohomology
subgroup H_J of a closed almost Hermitian 4-manifold (M, g, J, F) using metric
compatible and symplectic 2-form compatible almost complex structures. We prove
that h_J = 0 for generic almost complex structures J on M.
","[{""version"":""v1"",""created"":""Sun, 4 Dec 2011 16:19:40 GMT""},{""version"":""v2"",""created"":""Sat, 20 Apr 2013 18:24:15 GMT""},{""version"":""v3"",""created"":""Wed, 10 Jul 2013 03:48:56 GMT""}]","2013-07-11"
"1112.0769","Kavita Sutar","Kavita Sutar","Orbit closures of representations of source-sink Dynkin quivers","11 pages, 3 figures",,,,"math.AG math.AC math.RT","http://arxiv.org/licenses/nonexclusive-distrib/1.0/","  We use the geometric technique, developed by Weyman, to calculate the
resolution of orbit closures of representations of Dynkin quivers with every
vertex being source or sink. We use this resolution to derive the normality of
such orbit closures. As a consequence we obtain the normality of certain orbit
closures of type E.
","[{""version"":""v1"",""created"":""Sun, 4 Dec 2011 16:21:44 GMT""},{""version"":""v2"",""created"":""Tue, 6 Dec 2011 02:54:26 GMT""}]","2011-12-07"
"1112.0770","Miguel Virasoro","M. A. Virasoro","Non-Gaussianity of the Intraday Returns Distribution: its evolution in
  time","19 pages, 5 figures",,,,"q-fin.ST","http://arxiv.org/licenses/nonexclusive-distrib/1.0/","  We find a remarkable time persistence of various proxies for the kurtosis
(p-kurtosis) of the intraday returns distribution for the S&P500 index and this
permits a significant measure of their evolution from 1983 to 2004. There
appears a long time scale dramatic variation of the p-kurtosis uncorrelated
with the variation of the volatility thus falsifying any hypothesis of a
universal shape for the probability distribution of the returns. A large
increase in the kurtosis anticipates the October 87 crash. During the years
1991-2003 it continuously decreases even when the volatility grows during the
dot-com bubble. We propose some speculative interpretations of these results.
","[{""version"":""v1"",""created"":""Sun, 4 Dec 2011 16:23:41 GMT""},{""version"":""v2"",""created"":""Fri, 9 Dec 2011 15:12:38 GMT""}]","2011-12-12"
"1112.0771","Alcides Buss","Alcides Buss, Ruy Exel","Inverse semigroup expansions and their actions on C*-algebras","22 pages; some typos corrected. To appear in Illinois Journal of
  Mathematics",,,,"math.OA math.GR math.RT","http://arxiv.org/licenses/nonexclusive-distrib/1.0/","  In this work, we give a presentation of the prefix expansion Pr(G) of an
inverse semigroup G as recently introduced by Lawson, Margolis and Steinberg
which is similar to the universal inverse semigroup defined by the second named
author in case G is a group. The inverse semigroup Pr(G) classifies the partial
actions of G on spaces. We extend this result and prove that Fell bundles over
G correspond bijectively to saturated Fell bundles over Pr(G). In particular,
this shows that twisted partial actions of G (on C*-algebras) correspond to
twisted (global) actions of Pr(G). Furthermore, we show that this
correspondence preserves C*-algebras crossed products.
","[{""version"":""v1"",""created"":""Sun, 4 Dec 2011 16:28:53 GMT""},{""version"":""v2"",""created"":""Tue, 10 Dec 2013 17:12:44 GMT""}]","2013-12-11"
"1112.0772","Pierre-Henri Chavanis","Pierre-Henri Chavanis","Kinetic theory of spatially homogeneous systems with long-range
  interactions: I. General results","arXiv admin note: text overlap with arXiv:1107.1475 and
  arXiv:1107.1447","Eur. Phys. J. Plus 127, 19 (2012)",,,"cond-mat.stat-mech","http://arxiv.org/licenses/nonexclusive-distrib/1.0/","  We review and complete the existing literature on the kinetic theory of
spatially homogeneous systems with long-range interactions taking collective
effects into account. The evolution of the system as a whole is described by
the Lenard-Balescu equation which is valid in a weak coupling approximation.
When collective effects are neglected it reduces to the Landau equation and
when collisions (correlations) are neglected it reduces to the Vlasov equation.
The relaxation of a test particle in a bath is described by a Fokker-Planck
equation involving a diffusion term and a friction term. For a thermal bath,
the diffusion and friction coefficients are connected by an Einstein relation.
General expressions of the diffusion and friction coefficients are given,
depending on the potential of interaction and on the dimension of space. We
also discuss the scaling with $N$ (number of particles) or with $\Lambda$
(plasma parameter) of the relaxation time towards statistical equilibrium.
Finally, we consider the effect of an external stochastic forcing on the
evolution of the system and compute the corresponding term in the kinetic
equation.
","[{""version"":""v1"",""created"":""Sun, 4 Dec 2011 16:31:23 GMT""}]","2012-02-20"
"1112.0773","Leo Radzihovsky","Leo Radzihovsky","Quantum liquid-crystal order in resonant atomic gases","Invited Review, 25 pages, 17 figures",,"10.1016/j.physc.2012.04.014",,"cond-mat.quant-gas","http://arxiv.org/licenses/nonexclusive-distrib/1.0/","  I review recent studies that predict quantum liquid-crystalline orders in
resonant atomic gases. As examples of such putative systems I will discuss an
s-wave resonant imbalanced Fermi gas and a p-wave resonant Bose gas. In the
former, the liquid-crystalline smectic, nematic and rich variety of other
descendant states emerge from strongly quantum- and thermally- fluctuating
Fulde-Ferrell and Larkin-Ovchinnikov states, driven by a competition between
resonant pairing and Fermi-surface mismatch. In the latter, at intermediate
detuning the p-wave resonant interaction generically drives Bose-condensation
at a finite momentum, set by a competition between atomic kinetic energy and
atom-molecule hybridization. Because of the underlying rotationally-invariant
environment of the atomic gas trapped isotropically, the putative striped
superfluid is a realization of a quantum superfluid smectic, that can melt into
a variety of interesting phases, such as a quantum nematic. I will discuss the
corresponding rich phase diagrams and transitions, as well the low-energy
properties of the phases and fractional topological defects generic to striped
superfluids and their fluctuation-driven descendants.
","[{""version"":""v1"",""created"":""Sun, 4 Dec 2011 16:43:48 GMT""}]","2015-06-03"
"1112.0774","Michael Pinsker","Martin Goldstern, Michael Pinsker, Saharon Shelah","A closed algebra with a non-Borel clone and an ideal with a Borel clone","9 pages",,,,"math.RA math.LO","http://arxiv.org/licenses/nonexclusive-distrib/1.0/","  Algebras on the natural numbers and their clones of term operations can be
classified according to their descriptive complexity. We give an example of a
closed algebra which has only unary operations and whose clone of term
operations is not Borel. Moreover, we provide an example of a coatom in the
clone lattice whose obvious definition via an ideal of subsets of natural
numbers would suggest that it is complete coanalytic, but which turns out to be
a rather simple Borel set.
","[{""version"":""v1"",""created"":""Sun, 4 Dec 2011 16:51:08 GMT""}]","2011-12-06"
"1112.0775","Stephen Wilson","Stephen D. Wilson, Z. Yamani, Chetan Dhital, B. Freelon, P. G.
  Freeman, J. A. Fernandez-Baca, K. Yamada, S. Wakimoto, W. J. L. Buyers, R. J.
  Birgeneau","Zn-induced spin dynamics in overdoped
  La$_{2-x}$Sr$_x$Cu$_{1-y}$Zn$_y$O$_4$","10 pages, 8 figures","Phys. Rev. B 85, 014507 (2012)","10.1103/PhysRevB.85.014507",,"cond-mat.supr-con cond-mat.str-el","http://arxiv.org/licenses/nonexclusive-distrib/1.0/","  Spin fluctuations and the local spin susceptibility in isovalently
Zn-substituted La$_{2-x}$Sr$_{x}$Cu$_{1-y}$Zn$_y$O$_4$ ($x=0.25$,
$y\approx0.01$) are measured via inelastic neutron scattering techniques. As
Zn$^{2+}$ is substituted onto the Cu$^{2+}$-sites, an anomalous enhancement of
the local spin susceptibility $\chi^{\prime\prime}(\omega)$ appears due to the
emergence of a commensurate antiferromagnetic excitation centered at wave
vector \textbf{Q}$=(\pi, \pi, 0)$ that coexists with the known incommensurate
SDW excitations at \textbf{Q}$_{HK}=(\pi\pm\delta,\pi), (\pi,\pi\pm\delta)$.
Our results support a picture of Zn-induced antiferromagnetic (AF) fluctuations
appearing through a local staggered polarization of Cu$^{2+}$-spins, and the
simultaneous suppression of T$_c$ as AF fluctuations are slowed in proximity to
Zn-impurities suggests the continued importance of high energy AF fluctuations
at the far overdoped edge of superconductivity in the cuprates.
","[{""version"":""v1"",""created"":""Sun, 4 Dec 2011 16:51:15 GMT""},{""version"":""v2"",""created"":""Fri, 20 Jan 2012 15:16:30 GMT""}]","2012-01-23"
"1112.0776","Aviad Frydman","D. Sherman, G. Kopnov, D. Shahar and A. Frydman","A Superconducting Gap in an Insulator","4 pages, 4 figures",,,,"cond-mat.supr-con","http://arxiv.org/licenses/nonexclusive-distrib/1.0/","  We present tunneling spectroscopy and transport measurements on disordered
indium oxide films that reveal the existence of a superconducting gap in an
insulating state. Two films on both sides of the disorder induced
superconductor to insulator transition (SIT) show the same energy gap scale at
low temperatures. This energy gap persists up to relatively high magnetic
fields and is observed across the magnetoresistance peak typical of disordered
superconductors. The results provide useful information for understanding the
nature of the insulating state in the disorder induced SIT.
","[{""version"":""v1"",""created"":""Sun, 4 Dec 2011 16:55:26 GMT""}]","2011-12-06"
"1112.0777","Erkki Kankare","E. Kankare, S. Mattila, S. Ryder, P. Vaisanen, A. Alberdi, A.
  Alonso-Herrero, L. Colina, A. Efstathiou, J. Kotilainen, J. Melinder, M.-A.
  Perez-Torres, C. Romero-Canizales, A. Takalo","Discovery of Two Supernovae in the Nuclear Regions of the Luminous
  Infrared Galaxy IC 883","6 pages, 3 figures, accepted for ApJ Letters",,"10.1088/2041-8205/744/2/L19",,"astro-ph.SR astro-ph.GA","http://arxiv.org/licenses/nonexclusive-distrib/1.0/","  We report the discovery of two consecutive supernovae (SNe), 2010cu and
2011hi, located at 0.37"" (180 pc) and 0.79"" (380 pc) projected distance
respectively from the centre of the K-band nucleus of the luminous infrared
galaxy IC 883. The SNe were discovered in an ongoing near-infrared K-band
search for core-collapse SNe in such galaxies using the ALTAIR/NIRI adaptive
optics system with laser guide star at the Gemini-North Telescope. These are
thus the closest SNe yet discovered to a LIRG nucleus in optical or
near-infrared wavelengths. The near-infrared light curves and colours of both
SNe are consistent with core-collapse events. Both SNe seem to suffer from
relatively low host galaxy extinction suggesting that regardless of their low
projected galactocentric distances, they are not deeply buried in the nuclear
regions of the host galaxy.
","[{""version"":""v1"",""created"":""Sun, 4 Dec 2011 17:01:08 GMT""}]","2015-06-03"
"1112.0778","Thomas Wiecki","Thomas V. Wiecki and Michael J. Frank","A computational model of inhibitory control in frontal cortex and basal
  ganglia","3rd submission (now accepted at Psychological Review). Removed
  switch-DDM and some other data points, restructured some graphics. Added
  systematic accuracy-RT analysis of speed-accuracy trade-off",,,,"q-bio.NC","http://arxiv.org/licenses/nonexclusive-distrib/1.0/","  Planning and executing volitional actions in the face of conflicting habitual
responses is a critical aspect of human behavior. At the core of the interplay
between these two control systems lies an override mechanism that can suppress
the habitual action selection process and allow executive control to take over.
Here, we construct a neural circuit model informed by behavioral and
electrophysiological data collected on various response inhibition paradigms.
This model extends a well established model of action selection in the basal
ganglia by including a frontal executive control network which integrates
information about sensory input and task rules to facilitate well-informed
decision making via the oculomotor system. Our simulations of the antisaccade,
Simon and saccade-override task ensue in conflict between a prepotent and
controlled response which causes the network to pause action selection via
projections to the subthalamic nucleus. Our model reproduces key behavioral and
electrophysiological patterns and their sensitivity to lesions and
pharmacological manipulations. Finally, we show how this network can be
extended to include the inferior frontal cortex to simulate key qualitative
patterns of global response inhibition demands as required in the stop-signal
task.
","[{""version"":""v1"",""created"":""Sun, 4 Dec 2011 17:04:29 GMT""},{""version"":""v2"",""created"":""Sun, 7 Oct 2012 15:09:35 GMT""},{""version"":""v3"",""created"":""Mon, 3 Dec 2012 13:28:22 GMT""}]","2012-12-04"
"1112.0779","Stefan Ivanov","Srefan Ivanov, Alexander Petkov and Dimiter Vassilev","The sharp lower bound of the first eigenvalue of the sub-Laplacian on a
  quaternionic contact manifold","15 pages, LaTeX2e",,,,"math.DG math.AP","http://arxiv.org/licenses/nonexclusive-distrib/1.0/","  The main technical result of the paper is a Bochner type formula for the
sub-laplacian on a quaternionic contact manifold. With the help of this formula
we establish a version of Lichnerowicz' theorem giving a lower bound of the
eigenvalues of the sub-Laplacian under a lower bound on the $Sp(n)Sp(1)$
components of the qc-Ricci curvature. It is shown that in the case of a
3-Sasakian manifold the lower bound is reached iff the quaternionic contact
manifold is a round 3-Sasakian sphere. Another goal of the paper is to
establish a-priori estimates for square integrals of horizontal derivatives of
smooth compactly supported functions. As an application, we prove a sharp
inequality bounding the horizontal Hessian of a function by its sub-Laplacian
on the quaternionic Heisenberg group.
","[{""version"":""v1"",""created"":""Sun, 4 Dec 2011 17:07:09 GMT""}]","2011-12-06"
"1112.0780","Zeyu Pan","Zeyu Pan, Junpeng Guo, Richard Soref, Walter Buchwald, and Greg Sun","Mode Properties of Flat-top Silver Nano-ridge Surface Plasmon Waveguides","23 pages, 9 figures, journal article","JOSA B, Vol. 29, Issue 3, pp. 340-345 (2012)","10.1364/JOSAB.29.000340",,"physics.optics","http://arxiv.org/licenses/nonexclusive-distrib/1.0/","  We investigate surface plasmon modes supported by flat-top silver
nano-ridges. We calculate the mode electromagnetic field distribution, the
dispersion curve, the travel range, and the figure-of-merit of the nano-ridge
mode. We find that the nano-ridge surface plasmon modes are quasi-TEM modes
with longitudinal field components three orders of magnitude smaller than the
transverse field components. The quasi-TEM nature of mode profiles reveals that
the propagation of free electron oscillations on the top of the nano-ridge
contributes mainly to the tightly confined ridge mode. We also find that as the
width of the nano-ridge decreases, the ridge mode becomes more tightly confined
on the ridge top. As the width of the nano-ridge increases, the nano-ridge mode
approaches two decoupled right-angle wedge plasmon modes.
","[{""version"":""v1"",""created"":""Sun, 4 Dec 2011 17:29:38 GMT""}]","2015-03-13"
"1112.0781","Dragos Stefan","Aura B\^arde\c{s}, Drago\c{s} \c{S}tefan","Factorizable enriched categories and applications","25 pages","Journal of Algebra, Volume 348, Issue 1, 2011, Pages 416-445",,,"math.CT","http://arxiv.org/licenses/nonexclusive-distrib/1.0/","  We define the twisted tensor product of two enriched categories, which
generalizes various sorts of `products' of algebraic structures, including the
bicrossed product of groups, the twisted tensor product of (co)algebras and the
double cross product of bialgebras. The key ingredient in the definition is the
notion of simple twisting systems between two enriched categories. To give
examples of simple twisted tensor products we introduce matched pairs of
enriched categories. Several other examples related to ordinary categories,
posets and groupoids are also discussed.
","[{""version"":""v1"",""created"":""Sun, 4 Dec 2011 17:43:09 GMT""}]","2011-12-06"
"1112.0782","Yohai Meiron","Carmit Gordon Lahav, Yohai Meiron, Noam Soker","The limited role of mergers in the black hole to bulge mass relation","6 pages, 3 figures, 2 tables",,,,"astro-ph.CO","http://arxiv.org/licenses/nonexclusive-distrib/1.0/","  We examine the intrinsic scatter in the correlation between black hole masses
and their host bulge masses, and find that it cannot be accounted for by
mergers alone. A simple merger scenario of small galaxies leads to a
proportionality relation between the late-time black hole and bulge masses,
with intrinsic scatter (in linear scale) increasing along the ridge line of the
relation as the square root of the mass. By examining a sample of 86 galaxies
with well measured black hole masses, we find that the intrinsic scatter
increases with mass more rapidly than expected from the merger-only scenario.
We discuss the possibility that the feedback mechanism that operated during
galaxy formation involved the presence of a cooling flow.
","[{""version"":""v1"",""created"":""Sun, 4 Dec 2011 17:48:41 GMT""},{""version"":""v2"",""created"":""Thu, 5 Apr 2012 20:00:05 GMT""}]","2012-04-09"
"1112.0783","Nabil Youssef L","A. M. Sid-Ahmed","The Riddle of Gravitation","40 pages, LaTeX-file",,,,"physics.hist-ph gr-qc math.DG","http://arxiv.org/licenses/nonexclusive-distrib/1.0/","  There is no doubt that both the special and general theories of relativity
capture the imagination. The anti-intuitive properties of the special theory of
relativity and its deep philosophical implications, the bizzare and dazzling
predictions of the general theory of relativity: the curvature of spacetime,
the exotic characteristics of black holes, the bewildering prospects of
gravitational waves, the discovery of astronomical objects as quasers and
pulsers, the expansion and the (possible) recontraction of the universe..., are
all breathtaking phenomena. In this paper, we give a philosophical
non-technical treatment of both the special and the general theory of
relativity together with an exposition of some of the latest physical theories.
We then give an outline of an axiomatic approach to relativity theories due to
Andreka and Nemeti that throws light on the logical structure of both theories.
This is followed by an exposition of some of the bewildering results
established by Andreka and Nemeti concerning the foundations of mathematics
using the notion of relativistic computers. We next give a survey on the
meaning and philosophical implications of the the quantum theory and end the
paper by an imaginary debate between Einstein and Neils Bohr reflecting both
Einstein's and Bohr's philosophical views on the quantum world.
  The paper is written in a somewhat untraditional manner; there are too many
footnotes. In order not to burden the reader with all the details, we have
collected the more advanced material the footnotes. We think that this makes
the paper easier to read and simpler to follow. The paper in full is adressed
more to experts.
","[{""version"":""v1"",""created"":""Sun, 4 Dec 2011 18:08:18 GMT""}]","2011-12-06"
"1112.0784","Jeremy Fineman","Michael A. Bender, Jeremy T. Fineman, Seth Gilbert, and Robert E.
  Tarjan","A New Approach to Incremental Cycle Detection and Related Problems",,,,,"cs.DS","http://arxiv.org/licenses/nonexclusive-distrib/1.0/","  We consider the problem of detecting a cycle in a directed graph that grows
by arc insertions, and the related problems of maintaining a topological order
and the strong components of such a graph. For these problems, we give two
algorithms, one suited to sparse graphs, and the other to dense graphs. The
former takes the minimum of O(m^{3/2}) and O(mn^{2/3}) time to insert m arcs
into an n-vertex graph; the latter takes O(n^2 log(n)) time. Our sparse
algorithm is considerably simpler than a previous O(m^{3/2})-time algorithm; it
is also faster on graphs of sufficient density. The time bound of our dense
algorithm beats the previously best time bound of O(n^{5/2}) for dense graphs.
Our algorithms rely for their efficiency on topologically ordered vertex
numberings; bounds on the size of the numbers give bound on running times.
","[{""version"":""v1"",""created"":""Sun, 4 Dec 2011 18:12:38 GMT""}]","2011-12-06"
