"1112.3334","Paolo Maestro","T. Aaltonen (for the CDF Collaboration)","Measurement of the branching fraction
  ${\mathcal{B}}(\Lambda^0_b\rightarrow \Lambda^+_c\pi^-\pi^+\pi^-)$ at CDF","11 pages, 5 figures. Submitted Phys. Rev. D",,"10.1103/PhysRevD.85.032003","FERMILAB-PUB-11-658-E","hep-ex","http://arxiv.org/licenses/nonexclusive-distrib/1.0/","  We report an analysis of the
$\Lambda^0_b\rightarrow\Lambda^+_c\pi^-\pi^+\pi^-$ decay in a data sample
collected by the CDF II detector at the Fermilab Tevatron corresponding to 2.4
fb$^{-1}$ of integrated luminosity. We reconstruct the currently largest
samples of the decay modes $\Lambda^0_b\rightarrow \Lambda_c(2595)^+\pi^-$
(with $\Lambda_c(2595)^+\rightarrow\Lambda^+_c\pi^+\pi^-$),
$\Lambda^0_b\rightarrow \Lambda_c(2625)^+\pi^-$ (with
$\Lambda_c(2625)^+\rightarrow\Lambda^+_c\pi^+\pi^-$), $\Lambda^0_b\rightarrow
\Sigma_c(2455)^{++}\pi^-\pi^-$ (with
$\Sigma_c(2455)^{++}\rightarrow\Lambda^+_c\pi^+$), and $\Lambda^0_b\rightarrow
\Sigma_c(2455)^0\pi^+\pi^-$ (with $\Sigma_c(2455)^0\rightarrow\Lambda^+_c
\pi^-$) and measure the branching fractions relative to the
$\Lambda^0_b\rightarrow\Lambda^+_c\pi^-$ branching fraction. We measure the
ratio $\BR(\Lambda^0_b\rightarrow \Lambda^+_c\pi^-\pi^+\pi^-)
/\BR(\Lambda^0_b\rightarrow \Lambda^+_c \pi^-) = 3.04 \pm
0.33(\text{stat})^{+0.70}_{-0.55}(\text{syst})$ which is used to derive
$\BR(\Lambda^0_b\rightarrow \Lambda^+_c\pi^-\pi^+\pi^-)=
(26.8^{+11.9}_{-11.2})\times10^{-3}$.
","[{""version"":""v1"",""created"":""Wed, 14 Dec 2011 20:52:40 GMT""},{""version"":""v2"",""created"":""Thu, 15 Dec 2011 08:22:14 GMT""}]","2019-08-13"
"1112.3335","Maria Csete Dr.","Maria Csete, Aron Sipos, Aniko Szalai and Gabor Szabo","Integrated lithography to produce complex structures for spectral
  engineering","12 pages, 5 figures",,,,"physics.optics","http://arxiv.org/licenses/nonexclusive-distrib/1.0/","  An integrated interference and colloid sphere lithography (IICL) is presented
to produce complex plasmonic structures consisting of wavelength-scaled
periodic arrays of nano-objects with arbitrary array symmetry and controllable
nano-scaled sub-structure. The IICL method is based on illumination of colloid
sphere monolayers by interference patterns synchronized with sphere arrays
along arbitrary crystallographic directions. This nano-kaleidoscope method
enables to tune four structure parameters independently: the symmetry and
characteristic periodicity of the interference pattern might be varied by the
wavelength, number and angle of incidence of the interfering beams; the
colloid-spheres' diameter-scaled distance between the nano-objects is
controllable by the relative orientation of the interference pattern with
respect to the hexagonal lattice of colloid spheres; the size of individual
nano-objects is determined by the colloid-spheres diameter and by the light
wavelength and is influenced by power density; the sub-structure size-parameter
sensitively depends on the polarization state and can be tuned with the
nano-object size simultaneously. Finite element method is applied to
demonstrate the capabilities of IICL, and the impact of the resulted complex
plasmonic patterns on spectral properties of thin gold films. The possibility
to realize spectral engineering with predesigned rectangular arrays of
hole-doublets that may be produced uniquely by IICL is shown.
","[{""version"":""v1"",""created"":""Wed, 14 Dec 2011 20:52:47 GMT""},{""version"":""v2"",""created"":""Wed, 11 Jan 2012 18:46:21 GMT""},{""version"":""v3"",""created"":""Thu, 19 Jan 2012 19:28:34 GMT""}]","2012-01-20"
"1112.3336","Nausheen Shah","Marcela Carena, Stefania Gori, Nausheen R. Shah, Carlos E. M. Wagner","A 125 GeV SM-like Higgs in the MSSM and the $\gamma \gamma$ rate","14 pages, 4 figures. Corrected small typos and added references",,"10.1007/JHEP03(2012)014","ANL-HEP-PR 88; EFI 11-35; FERMILAB-PUB-11-659-T","hep-ph","http://arxiv.org/licenses/nonexclusive-distrib/1.0/","  We consider the possibility of a Standard Model (SM)-like Higgs in the
context of the Minimal Supersymmetric Standard Model (MSSM), with a mass of
about 125 GeV and with a production times decay rate into two photons which is
similar or somewhat larger than the SM one. The relatively large value of the
SM-like Higgs mass demands stops in the several hundred GeV mass range with
somewhat large mixing, or a large hierarchy between the two stop masses in the
case that one of the two stops is light. We find that, in general, if the
heaviest stop mass is smaller than a few TeV, the rate of gluon fusion
production of Higgs bosons decaying into two photons tends to be somewhat
suppressed with respect to the SM one in this region of parameters. However, we
show that an enhancement of the photon decay rate may be obtained for light
third generation sleptons with large mixing, which can be naturally obtained
for large values of $\tan\beta$ and sizable values of the Higgsino mass
parameter.
","[{""version"":""v1"",""created"":""Wed, 14 Dec 2011 20:52:50 GMT""},{""version"":""v2"",""created"":""Wed, 28 Mar 2012 21:28:11 GMT""}]","2015-06-03"
"1112.3337","Andris Ambainis","Andris Ambainis, Arturs Backurs, Nikolajs Nahimovs, Raitis Ozols,
  Alexander Rivosh","Search by quantum walks on two-dimensional grid without amplitude
  amplification","22 pages, 3 figures",,,,"quant-ph cs.CC cs.DS","http://arxiv.org/licenses/nonexclusive-distrib/1.0/","  We study search by quantum walk on a finite two dimensional grid. The
algorithm of Ambainis, Kempe, Rivosh (quant-ph/0402107) takes O(\sqrt{N log N})
steps and finds a marked location with probability O(1/log N) for grid of size
\sqrt{N} * \sqrt{N}. This probability is small, thus amplitude amplification is
needed to achieve \Theta(1) success probability. The amplitude amplification
adds an additional O(\sqrt{log N}) factor to the number of steps, making it
O(\sqrt{N} log N).
  In this paper, we show that despite a small probability to find a marked
location, the probability to be within an O(\sqrt{N}) neighbourhood (at an
O(\sqrt[4]{N}) distance) of the marked location is \Theta(1). This allows to
skip amplitude amplification step and leads to an O(\sqrt{log N}) speed-up.
  We describe the results of numerical experiments supporting this idea, and we
prove this fact analytically.
","[{""version"":""v1"",""created"":""Wed, 14 Dec 2011 20:55:56 GMT""}]","2011-12-15"
"1112.3338","Yoske Sumitomo","Xingang Chen, Gary Shiu, Yoske Sumitomo, S.-H. Henry Tye","A Global View on The Search for de-Sitter Vacua in (type IIA) String
  Theory","23 pages, 5 figures; v2, v3: arguments improved, references added;
  v4: version to appear in JHEP",,"10.1007/JHEP04(2012)026","MAD-TH-11-10","hep-th astro-ph.CO hep-ph","http://arxiv.org/licenses/nonexclusive-distrib/1.0/","  The search for classically stable Type IIA de-Sitter vacua typically starts
with an ansatz that gives Anti-de-Sitter supersymmetric vacua and then raises
the cosmological constant by modifying the compactification. As one raises the
cosmological constant, the couplings typically destabilize the classically
stable vacuum, so the probability that this approach will lead to a classically
stable de-Sitter vacuum is Gaussianly suppressed. This suggests that
classically stable de-Sitter vacua in string theory (at least in the Type IIA
region), especially those with relatively high cosmological constants, are very
rare. The probability that a typical de-Sitter extremum is classically stable
(i.e., tachyon-free) is argued to be Gaussianly suppressed as a function of the
number of moduli.
","[{""version"":""v1"",""created"":""Wed, 14 Dec 2011 20:58:03 GMT""},{""version"":""v2"",""created"":""Thu, 15 Dec 2011 16:26:18 GMT""},{""version"":""v3"",""created"":""Fri, 13 Jan 2012 17:00:27 GMT""},{""version"":""v4"",""created"":""Tue, 17 Apr 2012 08:49:26 GMT""}]","2015-06-03"
"1112.3340","Pavel Kroupa","Pavel Kroupa (Bonn), Carsten Weidner (La Laguna), Jan Pflamm-Altenburg
  (Bonn), Ingo Thies (Bonn), Joerg Dabringhausen (Bonn), Michael Marks (Bonn),
  Thomas Maschberger (Grenoble)","The stellar and sub-stellar IMF of simple and composite populations","167 pages, 37 figures, 3 tables, published in Stellar Systems and
  Galactic Structure, Vol.5, Springer. This revised version is consistent with
  the published version and includes additional references and minor additions
  to the text as well as a recomputed Table 1. ISBN 978-90-481-8817-8",,"10.1007/978-94-007-5612-0_4",,"astro-ph.CO","http://arxiv.org/licenses/nonexclusive-distrib/1.0/","  The current knowledge on the stellar IMF is documented. It appears to become
top-heavy when the star-formation rate density surpasses about 0.1Msun/(yr
pc^3) on a pc scale and it may become increasingly bottom-heavy with increasing
metallicity and in increasingly massive early-type galaxies. It declines quite
steeply below about 0.07Msun with brown dwarfs (BDs) and very low mass stars
having their own IMF. The most massive star of mass mmax formed in an embedded
cluster with stellar mass Mecl correlates strongly with Mecl being a result of
gravitation-driven but resource-limited growth and fragmentation induced
starvation. There is no convincing evidence whatsoever that massive stars do
form in isolation. Various methods of discretising a stellar population are
introduced: optimal sampling leads to a mass distribution that perfectly
represents the exact form of the desired IMF and the mmax-to-Mecl relation,
while random sampling results in statistical variations of the shape of the
IMF. The observed mmax-to-Mecl correlation and the small spread of IMF
power-law indices together suggest that optimally sampling the IMF may be the
more realistic description of star formation than random sampling from a
universal IMF with a constant upper mass limit. Composite populations on galaxy
scales, which are formed from many pc scale star formation events, need to be
described by the integrated galactic IMF. This IGIMF varies systematically from
top-light to top-heavy in dependence of galaxy type and star formation rate,
with dramatic implications for theories of galaxy formation and evolution.
","[{""version"":""v1"",""created"":""Wed, 14 Dec 2011 21:00:00 GMT""},{""version"":""v2"",""created"":""Sun, 29 Jan 2012 22:17:06 GMT""},{""version"":""v3"",""created"":""Sun, 4 Nov 2012 16:30:25 GMT""}]","2015-06-03"
"1112.3341","Raphael Bousso","Raphael Bousso","Vacuum Structure and the Arrow of Time","31 pages JHEP format, 3 figures",,"10.1103/PhysRevD.86.123509",,"hep-th astro-ph.CO gr-qc hep-ph","http://arxiv.org/licenses/nonexclusive-distrib/1.0/","  We find ourselves in an extended era of entropy production. Unlike most other
observations, the arrow of time is usually regarded as a constraint on initial
conditions. I argue, however, that it primarily constrains the vacuum structure
of the theory. I exhibit simple scalar field potentials in which low-entropy
initial conditions are not necessary, or not sufficient, for an arrow of time
to arise. I argue that the string theory landscape gives rise to an arrow of
time independently of the initial entropy, assuming a plausible condition on
the lifetime of its metastable vacua. The dynamical resolution of the arrow of
time problem arises from the same structural properties of the string landscape
that allow it to solve the cosmological constant problem without producing an
empty universe, particularly its high dimensionality and the large difference
in vacuum energy between neighboring vacua.
","[{""version"":""v1"",""created"":""Wed, 14 Dec 2011 21:00:00 GMT""},{""version"":""v2"",""created"":""Mon, 11 Jun 2012 05:59:38 GMT""}]","2013-05-30"
"1112.3342","Jason Nordhaus","J. Nordhaus (RIT), T. Brandt (Princeton), A. Burrows (Princeton), A.
  Almgren (LBNL)","The Hydrodynamic Origin of Neutron Star Kicks","Accepted to MNRAS, replaced with accepted manuscript",,"10.1111/j.1365-2966.2012.21002.x",,"astro-ph.SR","http://arxiv.org/licenses/nonexclusive-distrib/1.0/","  We present results from a suite of axisymmetric, core-collapse supernova
simulations in which hydrodynamic recoil from an asymmetric explosion produces
large proto-neutron star (PNS) velocities. We use the adaptive-mesh refinement
code CASTRO to self-consistently follow core-collapse, the formation of the PNS
and its subsequent acceleration. We obtain recoil velocities of up to 620 km/s
at ~1 s after bounce. These velocities are consistent with the observed
distribution of pulsar kicks and with PNS velocities obtained in other
theoretical calculations. Our PNSs are still accelerating at several hundred
km/s at the end of our calculations, suggesting that even the highest velocity
pulsars may be explained by hydrodynamic recoil in generic, core-collapse
supernovae.
","[{""version"":""v1"",""created"":""Wed, 14 Dec 2011 21:00:01 GMT""},{""version"":""v2"",""created"":""Wed, 28 Mar 2012 15:53:36 GMT""}]","2015-06-03"
"1112.3343","Randall Kelley","Randall Kelley, Matthew D. Schwartz, Robert M. Schabinger, Hua Xing
  Zhu","Jet mass with a jet veto at two loops and the universality of non-global
  structure","36 pages, 4 Figures",,"10.1103/PhysRevD.86.054017",,"hep-ph","http://arxiv.org/licenses/nonexclusive-distrib/1.0/","  We investigate the exclusive jet mass distribution in e+e- events, defined
with a veto on the out-of-jet radiation, at two-loop order. In particular, we
calculate the two-loop soft function, which is required to describe this
distribution in the threshold region. When combined with other ingredients
using soft-collinear effective theory, this generates the complete singular
distribution for jet thrust, the sum of the jet masses, at two-loop order. The
result is in excellent agreement with full QCD. The integrated jet thrust
distribution is found to depend in an intricate way on both the finite jet cone
size, R, and the jet veto scale. The result clarifies the structure of the
potentially large logarithms (both global and non- global) which arise in jet
observables for the first time at this order. Somewhat surprisingly, we find
that, in the small R limit, there is a precise and simple correspondence
between the non-global contribution to the integrated jet thrust distribution
and the previously calculated non-global contribution to the integrated
hemisphere soft function, including subleading terms. This suggests that the
small R limit may provide a useful expansion for studying other exclusive jet
substructure observables.
","[{""version"":""v1"",""created"":""Wed, 14 Dec 2011 21:00:01 GMT""}]","2013-05-30"
"1112.3344","Alex Lazarian","A. Lazarian","Power of Turbulent Reconnection: Star Formation, Acceleration of Cosmic
  Rays, Heat Transfer, Flares and Gamma Ray Bursts","10 pages, 8 figures, review, conference ""Magnetic Fields in the
  Universe III""",,,,"astro-ph.GA","http://arxiv.org/licenses/nonexclusive-distrib/1.0/","  Turbulence is ubiquitous in astrophysical fluids. Therefore it is necessary
to study magnetic reconnection in turbulent environments. The model of fast
turbulent reconnection proposed in Lazarian & Vishniac 1999 has been
successfully tested numerically and it suggests numerous astrophysical
implications. Those include a radically new possibility of removing magnetic
field from collapsing clouds which we termed ""reconnection diffusion"",
acceleration of cosmic rays within shrinking filaments of reconnected magnetic
fields, flares of reconnection, from solar flares to much stronger ones which
can account for gamma ray bursts. In addition, the model reveals a very
intimate relation between magnetic reconnection and properties of strong
turbulence, explaining how turbulent eddies can transport heat in magnetized
plasmas. This is a small fraction the astrophysical implications of the
quantitative insight into the fundamental process of magnetic reconnection in
turbulent media.
","[{""version"":""v1"",""created"":""Wed, 14 Dec 2011 21:00:01 GMT""}]","2011-12-16"
"1112.3345","Gianguido Dall'Agata","G. Dall'Agata and G. Inverso","On the vacua of N = 8 gauged supergravity in 4 dimensions","33+1 pages, 4 figures. v2: Typos corrected. Added a subsection with
  an improved discussion of the spectra of the SO(6,2) and CSO(2,0,6) models",,"10.1016/j.nuclphysb.2012.01.023","DFPD-11/TH/17; ROM2F/2011/18","hep-th","http://arxiv.org/licenses/nonexclusive-distrib/1.0/","  We discuss a simple procedure for finding vacua of gauged supergravity
models, based on the variation of the embedding tensor rather than on a direct
minimization of the scalar potential. We apply this procedure to N=8 gauged
supergravity in 4 dimensions. We easily recover many of the previously known
vacua, also completing their scalar mass spectrum, and we apply our procedure
to find a dozen of new analytical vacuum solutions. The analysis shows an
interesting structure on the moduli spaces of these vacua and provides new
criteria to determine the expected value of the cosmological constant by a
simple inspection of the group properties of the embedding tensor.
","[{""version"":""v1"",""created"":""Wed, 14 Dec 2011 21:00:01 GMT""},{""version"":""v2"",""created"":""Mon, 23 Jan 2012 19:44:45 GMT""}]","2015-06-03"
"1112.3346","Eduardo Conde Pena","Eduardo Conde, Jerome Gaillard, Carlos Nunez, Maurizio Piai, Alfonso
  V. Ramallo","Towards the string dual of tumbling and cascading gauge theories","7 pages, 6 figures ; v2. minor changes included","Phys. Lett. B, Volume 709, Issues 4-5, March 2012, 385","10.1016/j.physletb.2012.02.037",,"hep-th hep-ph","http://arxiv.org/licenses/nonexclusive-distrib/1.0/","  We build type IIB backgrounds that can be interpreted as the dual description
of field theories in which the dynamics shows many non-trivial phenomena,
generalizing the baryonic branch of the Klebanov-Strassler system. We
illustrate the steps of the explicit construction with a particularly
interesting example. The dual field theory exhibits the expected behavior of an
N=1 supersymmetric gauge theory which, over different ranges of the radial
direction, is undergoing a cascade of Seiberg dualities, a period of running, a
cascade of Higgsings (tumbling) and finally gaugino condensation.
","[{""version"":""v1"",""created"":""Wed, 14 Dec 2011 21:00:01 GMT""},{""version"":""v2"",""created"":""Fri, 9 Mar 2012 14:18:08 GMT""}]","2012-03-12"
"1112.3347","Armin Rahmani","Rodrigo A. Muniz, Armin Rahmani, Ivar Martin","Fractionalization in spontaneous integer quantum Hall systems","4+ pages, 3 figures, 6 pages of supplemental material",,,,"cond-mat.str-el cond-mat.mes-hall quant-ph","http://arxiv.org/licenses/nonexclusive-distrib/1.0/","  It is widely believed that integer quantum Hall systems do not have
fractional excitations. Here we show the converse to be true for a class of
systems where integer quantum Hall effect emerges spontaneously due to the
interplay of itinerant electrons and noncoplanar magnetic ordering. We show
that magnetic $Z_2$ vortices in such systems, whose topological stability is
guaranteed by the structure of the order parameter, indeed carry fractional
charge.
","[{""version"":""v1"",""created"":""Wed, 14 Dec 2011 21:00:02 GMT""},{""version"":""v2"",""created"":""Thu, 15 Mar 2012 23:41:29 GMT""},{""version"":""v3"",""created"":""Wed, 1 Aug 2012 22:32:51 GMT""}]","2012-08-03"
"1112.3348","Jacopo Fritz","J. Fritz, G. Gentile, M. W. L. Smith, W. K. Gear, R. Braun, J. Roman
  Duval, G. J. Bendo, M. Baes, S. A. Eales, J. Verstappen, J. A. D. L.
  Blommaert, M. Boquien, A. Boselli, D. Clements, A. R. Cooray, L. Cortese, I.
  De Looze, G. P. Ford, F. Galliano, H. L. Gomez, K. D. Gordon, V.
  Lebouteiller, B. O'Halloran, J. Kirk, S. C. Madden, M. J. Page, A. Remy, H.
  Roussel, L. Spinoglio, D. Thilker, M. Vaccari, C. D. Wilson, C. Waelkens","The Herschel Exploitation of Local Galaxy Andromeda (HELGA). I: Global
  far-infrared and sub-mm morphology","15 Pages, 9 Figures. Accepted for publication in Astronomy and
  Astrophysics. A high resolution version of the paper can be found at
  http://wazn.ugent.be/jfritz/HelgaI_final.pdf",,"10.1051/0004-6361/201118619",,"astro-ph.CO","http://arxiv.org/licenses/nonexclusive-distrib/1.0/","  We have obtained Herschel images at five wavelengths from 100 to 500 micron
of a ~5.5x2.5 degree area centred on the local galaxy M31 (Andromeda), our
nearest neighbour spiral galaxy, as part of the Herschel guaranteed time
project ""HELGA"". The main goals of HELGA are to study the characteristics of
the extended dust emission, focusing on larger scales than studied in previous
observations of Andromeda at an increased spatial resolution, and the obscured
star formation. In this paper we present data reduction and Herschel maps, and
provide a description of the far-infrared morphology, comparing it with
features seen at other wavelengths. We use high--resolution maps of the atomic
hydrogen, fully covering our fields, to identify dust emission features that
can be associated to M31 with confidence, distinguishing them from emission
coming from the foreground Galactic cirrus. Thanks to the very large extension
of our maps we detect, for the first time at far-infrared wavelengths, three
arc-like structures extending out to ~21, ~26 and ~31 kpc respectively, in the
south-western part of M31. The presence of these features, hosting ~2.2e6 Msol
of dust, is safely confirmed by their detection in HI maps. Overall, we
estimate a total dust mass of ~5.8e7 Msol, about 78% of which is contained in
the two main ring-like structures at 10 and 15 kpc, at an average temperature
of 16.5 K. We find that the gas-to-dust ratio declines exponentially as a
function of the galacto-centric distance, in agreement with the known
metallicity gradient, with values ranging from 66 in the nucleus to ~275 in the
outermost region. [Abridged]
","[{""version"":""v1"",""created"":""Wed, 14 Dec 2011 21:00:02 GMT""},{""version"":""v2"",""created"":""Mon, 3 Sep 2012 13:43:08 GMT""}]","2015-06-03"
"1112.3349","Gabriele Ghisellini","G. Ghisellini (INAF - Osservatorio Astronomico di Brera)","Powerful extragalactic jets","8 pages, 5 figures, invited talk at the meeting ""The Extreme and
  Variable High Energy Sky"", Chia Laguna, September 2011",,,,"astro-ph.HE astro-ph.CO","http://arxiv.org/licenses/nonexclusive-distrib/1.0/","  The Fermi, Swift and INTEGRAL satellites, together with ground based
(especially Cherenkov) telescopes made possible a great progress in our
understanding of relativistic jets. We can now start to attack the difficult
questions of jet formation, collimation and content. We can also used them as
probes to quantify the amount of IR and optical background radiation, and the
amount of the cosmic magnetic field. Since they are the most powerful steady
sources of the Universe, we can study them also at large redshifts, and this is
a very fruitful field of research. To this aim, I will emphasize the importance
of high energy X-rays, where very powerful blazars are predicted to emit most
of their electromagnetic power. For them, the emission of the underlying
accretion disk becomes unhidden by the non-thermal jet radiation, allowing to
estimate the black hole mass and the accretion rate. In turn, this highlights
the connection between the disk and the jet. Since the highest power blazars
could have their emission peak in the ~MeV band, hard X-ray instruments could
be more appropriate than the Fermi/LAT to detect them.
","[{""version"":""v1"",""created"":""Wed, 14 Dec 2011 21:00:04 GMT""}]","2011-12-16"
"1112.3350","J\'er\^ome Gaillard","Eduardo Conde, Jerome Gaillard, Carlos Nunez, Maurizio Piai and
  Alfonso V. Ramallo","A tale of two cascades: Higgsing and Seiberg-duality cascades from type
  IIB string theory","34 pages plus appendices. Typos corrected and references added,
  version to appear in JHEP",,"10.1007/JHEP02(2012)145",,"hep-th hep-ph","http://arxiv.org/licenses/nonexclusive-distrib/1.0/","  We construct explicitly new solutions of type IIB supergravity with brane
sources, the duals of which are N = 1 supersymmetric field theories exhibiting
two very interesting phenomena. The far UV dynamics is controlled by a cascade
of Seiberg dualities analogous to the Klebanov- Strassler backgrounds. At
intermediate scales a cascade of Higgsing appears, in the sense that the gauge
group undergoes a sequence of spontaneous symmetry breaking steps which reduces
its rank. Deep in the IR, the theory confines, and the gravity background has a
non-singular end of space. We explain in detail how to generate such solutions,
discuss some of the Physics associated with them and briefly comment on the
possible applications.
","[{""version"":""v1"",""created"":""Wed, 14 Dec 2011 21:00:05 GMT""},{""version"":""v2"",""created"":""Fri, 17 Feb 2012 17:56:57 GMT""}]","2015-06-03"
