"1112.3261","Renjun Duan","Renjun Duan, Tong Yang, Huijiang Zhao","Global solutions to the Vlasov-Poisson-Landau System","10 pages",,,,"math.AP","http://arxiv.org/licenses/nonexclusive-distrib/1.0/","  Based on the recent study on the Vlasov-Poisson-Boltzmann system with general
angular cutoff potentials [3, 4], we establish in this paper the global
existence of classical solutions to the Cauchy problem of the
Vlasov-Poisson-Landau system that includes the Coulomb potential. This then
provides a different approach on this topic from the recent work [8].
","[{""version"":""v1"",""created"":""Wed, 14 Dec 2011 16:05:29 GMT""}]","2011-12-15"
"1112.3262","Isabelle Greff","Jacky Cresson (LMA-PAU), Isabelle Greff (LMA-PAU), Pierre Inizan
  (IMCCE)","Lagrangian for the Convection-Diffusion Equation",,,"10.1002/mma.2651",,"math.AP math.DS","http://arxiv.org/licenses/nonexclusive-distrib/1.0/","  Using the asymmetric fractional calculus of variations, we derive a
fractional Lagrangian variational formulation of the convection-diffusion
equation in the special case of constant coefficients.
","[{""version"":""v1"",""created"":""Wed, 14 Dec 2011 16:05:33 GMT""}]","2015-06-03"
"1112.3263","Oliver Baues","Oliver Baues","The deformations of flat affine structures on the two-torus","86 pages, to appear in Handbook of Teichm\""uller theory, Volume III",,,,"math.DG","http://arxiv.org/licenses/nonexclusive-distrib/1.0/","  The group action which defines the moduli problem for the deformation space
of flat affine structures on the two-torus is the action of the affine group
$\Aff(2)$ on $\bbR^2$. Since this action has non-compact stabiliser
$\GL(2,\bbR)$, the underlying locally homogeneous geometry is highly
non-Riemannian. In this article, we describe the deformation space of all flat
affine structures on the two-torus. In this context interesting phenomena arise
in the topology of the deformation space, which, for example, is \emph{not} a
Hausdorff space. This contrasts with the case of constant curvature metrics, or
conformal structures on surfaces, which are encountered in classical
Teichm\""uller theory. As our main result on the space of deformations of flat
affine structures on the two-torus we prove that the holonomy map from the
deformation space to the variety of conjugacy classes of homomorphisms from the
fundamental group of the two-torus to the affine group is a local
homeomorphism.
","[{""version"":""v1"",""created"":""Wed, 14 Dec 2011 16:06:23 GMT""}]","2011-12-15"
"1112.3264","Stefan Gillessen","S. Gillessen, R. Genzel, T. K. Fritz, E. Quataert, C. Alig, A.
  Burkert, J. Cuadra, F. Eisenhauer, O. Pfuhl, K. Dodds-Eden, C. F. Gammie and
  T. Ott","A gas cloud on its way towards the super-massive black hole in the
  Galactic Centre","in press at Nature","2012Natur.481...51G","10.1038/nature10652",,"astro-ph.GA","http://arxiv.org/licenses/nonexclusive-distrib/1.0/","  Measurements of stellar orbits provide compelling evidence that the compact
radio source Sagittarius A* at the Galactic Centre is a black hole four million
times the mass of the Sun. With the exception of modest X-ray and infrared
flares, Sgr A* is surprisingly faint, suggesting that the accretion rate and
radiation efficiency near the event horizon are currently very low. Here we
report the presence of a dense gas cloud approximately three times the mass of
Earth that is falling into the accretion zone of Sgr A*. Our observations
tightly constrain the cloud's orbit to be highly eccentric, with an innermost
radius of approach of only ~3,100 times the event horizon that will be reached
in 2013. Over the past three years the cloud has begun to disrupt, probably
mainly through tidal shearing arising from the black hole's gravitational
force. The cloud's dynamic evolution and radiation in the next few years will
probe the properties of the accretion flow and the feeding processes of the
super-massive black hole. The kilo-electronvolt X-ray emission of Sgr A* may
brighten significantly when the cloud reaches pericentre. There may also be a
giant radiation flare several years from now if the cloud breaks up and its
fragments feed gas into the central accretion zone.
","[{""version"":""v1"",""created"":""Wed, 14 Dec 2011 16:07:43 GMT""}]","2013-08-20"
"1112.3265","Neil Zhenqiang Gong","Neil Zhenqiang Gong, Ameet Talwalkar, Lester Mackey, Ling Huang, Eui
  Chul Richard Shin, Emil Stefanov, Elaine (Runting) Shi and Dawn Song","Jointly Predicting Links and Inferring Attributes using a
  Social-Attribute Network (SAN)","9 pages, 4 figures and 4 tables",,,,"cs.SI physics.soc-ph","http://arxiv.org/licenses/nonexclusive-distrib/1.0/","  The effects of social influence and homophily suggest that both network
structure and node attribute information should inform the tasks of link
prediction and node attribute inference. Recently, Yin et al. proposed
Social-Attribute Network (SAN), an attribute-augmented social network, to
integrate network structure and node attributes to perform both link prediction
and attribute inference. They focused on generalizing the random walk with
restart algorithm to the SAN framework and showed improved performance. In this
paper, we extend the SAN framework with several leading supervised and
unsupervised link prediction algorithms and demonstrate performance improvement
for each algorithm on both link prediction and attribute inference. Moreover,
we make the novel observation that attribute inference can help inform link
prediction, i.e., link prediction accuracy is further improved by first
inferring missing attributes. We comprehensively evaluate these algorithms and
compare them with other existing algorithms using a novel, large-scale Google+
dataset, which we make publicly available.
","[{""version"":""v1"",""created"":""Wed, 14 Dec 2011 16:13:02 GMT""},{""version"":""v2"",""created"":""Fri, 16 Dec 2011 04:22:15 GMT""},{""version"":""v3"",""created"":""Mon, 19 Dec 2011 14:01:37 GMT""},{""version"":""v4"",""created"":""Mon, 13 Feb 2012 23:44:46 GMT""},{""version"":""v5"",""created"":""Wed, 29 Feb 2012 23:55:03 GMT""},{""version"":""v6"",""created"":""Wed, 13 Jun 2012 02:07:42 GMT""},{""version"":""v7"",""created"":""Thu, 14 Jun 2012 03:35:19 GMT""},{""version"":""v8"",""created"":""Fri, 15 Jun 2012 00:57:00 GMT""},{""version"":""v9"",""created"":""Fri, 22 Jun 2012 14:43:41 GMT""}]","2012-06-25"
"1112.3266","Marco Bernardi","Marco Bernardi, Nicola Ferralis, Jin H. Wan, Rachelle Villalon, and
  Jeffrey C. Grossman","Solar Energy Generation in Three Dimensions","40 pages, 16 pages paper (3 figures), 24 pages supplementary
  information (7 figures). Energy and Environmental Science (2012, Published
  on-line)",,"10.1039/c2ee21170j",,"physics.comp-ph cond-mat.other physics.soc-ph","http://arxiv.org/licenses/nonexclusive-distrib/1.0/","  We formulate, solve computationally and study experimentally the problem of
collecting solar energy in three dimensions(1-5). We demonstrate that absorbers
and reflectors can be combined in the absence of sun tracking to build
three-dimensional photovoltaic (3DPV) structures that can generate measured
energy densities (energy per base area, kWh/m2) higher by a factor of 2-20 than
stationary flat PV panels, versus an increase by a factor of 1.3-1.8 achieved
with a flat panel using dual-axis sun tracking(6). The increased energy density
is countered by a higher solar cell area per generated energy for 3DPV compared
to flat panel design (by a factor of 1.5-4 in our conditions), but accompanied
by a vast range of improvements. 3DPV structures are steadier sources of solar
energy generation at all latitudes: they can double the number of peak power
generation hours and dramatically reduce the seasonal, latitude and weather
variations of solar energy generation compared to a flat panel design.
Self-supporting 3D shapes can create new schemes for PV installation and the
increased energy density can facilitate the use of cheaper thin film materials
in area-limited applications. Our findings suggest that harnessing solar energy
in three dimensions can open new avenues towards Terawatt-scale generation.
","[{""version"":""v1"",""created"":""Wed, 14 Dec 2011 16:20:22 GMT""},{""version"":""v2"",""created"":""Sat, 10 Mar 2012 20:44:00 GMT""}]","2012-03-13"
"1112.3267","Laura Gonella","Laura Gonella","Existence of Periodic Solutions for some Singular Elliptic Equations
  with Strong Resonant Data",,,,,"math.AP","http://arxiv.org/licenses/nonexclusive-distrib/1.0/","  We prove the existence of at least one T-periodic solution (T > 0) for
differential equations of the form (u'(t)/sqrt{1-u'^2(t)})'=f(u(t))+h(t), in
(0,T), where f is a continuous function defined on R that satisfies a strong
resonance condition, h is continuous and with zero mean value. Our method uses
variational techniques for nonsmooth functionals.
","[{""version"":""v1"",""created"":""Wed, 14 Dec 2011 16:23:46 GMT""}]","2011-12-15"
"1112.3268","Wei Li","Wei Li, Ya Liu, Genevieve Brett, and James D. Gunton","Encapsulation by Janus spheroids","6 pages, 6 figures, 2 tables",,,,"cond-mat.soft cond-mat.mtrl-sci","http://arxiv.org/licenses/nonexclusive-distrib/1.0/","  The micro/nano encapsulation technology has acquired considerable attention
in the fields of drug delivery, biomaterial engineering, and materials science.
Based on recent advances in chemical particle synthesis, we propose a primitive
model of an encapsulation system produced by the self-assembly of Janus oblate
spheroids, particles with oblate spheroidal bodies and two hemi-surfaces coded
with dissimilar chemical properties. Using Monte Carlo simulation, we
investigate the encapsulation system with spherical particles as encapsulated
guests, for different densities. We study the anisotropic effect due to the
encapsulating agent's geometric shape and chemical composition on the
encapsulation morphology and efficiency. Given the relatively high
encapsulation efficiency we find from the simulations, we believe that this
method of encapsulation has potential practical value.
","[{""version"":""v1"",""created"":""Wed, 14 Dec 2011 16:35:06 GMT""}]","2011-12-15"
"1112.3269","Anatoly Borisov","A. V. Borisov","Lepton-number violating meson decays in theories beyond the Standard
  Model","11 pages, 2 figures, 2 tables; a lecture given at the Helmholtz
  International School ""Heavy Quark Physics"" (HQP08), August 11--21, 2008,
  Dubna, Russia; v2: one reference corrected, 3 new ones and a note added","Proc. of the Helmholtz International School ""Heavy Quark Physics""
  (HQP08), Editors: A. Ali and M. A. Ivanov (DESY, Hamburg, 2009), p. 165--174",,"DESY-PROC-2009-07","hep-ph","http://arxiv.org/licenses/nonexclusive-distrib/1.0/","  After discussion of mechanisms of lepton number violation, we consider meson
decays $K^+ \to\pi^ - \ell ^ + \ell '^ +$ and $D^ + \to K^ - \ell ^ + \ell '^
+$ ($\ell,\ell ' = e,\mu $) with $\Delta L= 2$ in the Standard Model extended
by massive Majorana neutrinos and in a supersymmetric extension of the Standard
Model with explicit breaking of R-parity by trilinear or bilinear Yukawa
couplings in the superpotential. We give estimates of the branching ratios for
these decays and compare the effectiveness of various decay mechanisms taking
into account present experimental bounds on lepton mixing, masses of neutrinos
and superparticles, and R-parity violating couplings.
","[{""version"":""v1"",""created"":""Wed, 14 Dec 2011 16:35:47 GMT""},{""version"":""v2"",""created"":""Sat, 17 Dec 2011 16:51:04 GMT""}]","2011-12-20"
"1112.3270","Daniele Oriti","Aristide Baratin, Daniele Oriti","Ten questions on Group Field Theory (and their tentative answers)","10 pages; contribution to the proceedings of the Loops'11 conference
  (CSIC, Madrid, Spain, 23-28 May 2011); to be published by Journal of Physics:
  Conference Series (JPCS)","J. Phys.: Conf. Ser. 360 (2012) 012002","10.1088/1742-6596/360/1/012002",,"gr-qc hep-th","http://arxiv.org/licenses/nonexclusive-distrib/1.0/","  We provide a short and non-technical summary of our current knowledge and
some possible perspectives on the group field theory formalism for quantum
gravity, in the form of a (partial) FAQ (with answers). Some of the questions
and answers relate to aspects of the formalism that concern loop quantum
gravity. This summary also aims at giving a brief, rough guide to the recent
literature on group field theory (and tensor models).
","[{""version"":""v1"",""created"":""Wed, 14 Dec 2011 16:38:18 GMT""}]","2015-06-03"
"1112.3271","Paul Razafimandimby","Paul Andre Razafimandimby and Mamadou Sango","Existence and large time behaviour for a stochastic model of a modified
  magnetohydrodynamic equations","This paper needs some revision",,"10.1007/s00033-015-0534-x",,"math.AP","http://arxiv.org/licenses/nonexclusive-distrib/1.0/","  In this paper we initiate the mathematical analysis of a system of nonlinear
Stochastic Partial Differential equations describing the motion of turbulent
Non-Newtonian media in the presence of fluctuating magnetic field. The system
is basically obtained by a coupling of the dynamical equations of a
Non-Newtonian fluids having $p$-structure and the Maxwell equations. We mainly
show the existence of weak martingale solutions and their exponential decay
when time goes to infinity.
","[{""version"":""v1"",""created"":""Wed, 14 Dec 2011 16:42:04 GMT""},{""version"":""v2"",""created"":""Wed, 6 Jun 2012 10:10:19 GMT""},{""version"":""v3"",""created"":""Fri, 14 Dec 2012 08:48:18 GMT""}]","2015-07-06"
"1112.3272","Stephan Arlinghaus","Stephan Arlinghaus and Martin Holthaus","Controlled wave-packet manipulation with driven optical lattices","11 pages, 10 figures","Phys. Rev. A 84, 063617 (2011)","10.1103/PhysRevA.84.063617",,"cond-mat.quant-gas","http://arxiv.org/licenses/nonexclusive-distrib/1.0/","  Motivated by recent experimental progress achieved with ultracold atoms in
kilohertz-driven optical lattices, we provide a theoretical discussion of
mechanisms governing the response of a particle in a cosine lattice potential
to strong forcing pulses with smooth envelope. Such pulses effectuate adiabatic
motion of a wave packet's momentum distribution on quasienergy surfaces created
by spatiotemporal Bloch waves. Deviations from adiabaticity can then
deliberately be exploited for exerting coherent control and for reaching target
states which may not be accessible by other means. As one particular example,
we consider an analog of the \pi-pulses known from optical resonance. We also
suggest adapting further techniques previously developed for controlling atomic
and molecular dynamics by laser pulses to the coherent control of matter waves
in shaken optical lattices.
","[{""version"":""v1"",""created"":""Wed, 14 Dec 2011 16:43:35 GMT""}]","2011-12-15"
"1112.3273","Renate Pazourek","Renate Pazourek, Stefan Nagele, Johannes Feist and Joachim
  Burgd\""orfer","Attosecond streaking of correlated two-electron transitions in helium","5 pages, 4 figures","Phys. Rev. Lett. 108, 163001 (2012)","10.1103/PhysRevLett.108.163001",,"physics.atom-ph","http://arxiv.org/licenses/nonexclusive-distrib/1.0/","  We present fully ab initio simulations of attosecond streaking for ionization
of helium accompanied by shake-up of the second electron. This process
represents a prototypical case for strongly correlated electron dynamics on the
attosecond timescale. We show that streaking spectroscopy can provide detailed
information on the Eisenbud-Wigner-Smith time delay as well as on the infrared
field dressing of both bound and continuum states. We find a novel contribution
to the streaking delay that stems from the interplay of electron-electron and
infrared-field interactions in the exit channel. We quantify all the
contributions with attosecond precision and provide a benchmark for future
experiments.
","[{""version"":""v1"",""created"":""Wed, 14 Dec 2011 16:58:00 GMT""}]","2013-05-24"
"1112.3274","Martin Schaden","Martin Schaden","Irreducible Scalar Many-Body Casimir Energies: Theorems and Numerical
  Studies","Writeup of talk given at QFEXT11 (Sept.18-24) in Benasque, Spain. 10
  pages, 3 figures",,"10.1142/S2010194512007635",,"quant-ph hep-th","http://arxiv.org/licenses/nonexclusive-distrib/1.0/","  We define irreducible N-body spectral functions and Casimir energies and
consider a massless scalar quantum field interacting locally by positive
potentials with classical objects. Irreducible N-body spectral functions in
this case are shown to be conditional probabilities of random walks. The
corresponding irreducible contributions to scalar many-body Casimir energies
are finite and positive/negative for an odd/even number of objects. The force
between any two finite objects separable by a plane is always attractive in
this case. Analytical and numerical world-line results for the irreducible
four-body Casimir energy of a scalar with Dirichlet boundary conditions on a
tic-tac-toe pattern of lines are presented. Numerical results for the
irreducible three-body Casimir energy of a massless scalar satisfying Dirichlet
boundary conditions on three intersecting lines forming an isosceles triangle
are also reported. In both cases the symmetric configuration (square and
isosceles triangle) corresponds to the minimal irreducible contribution to the
Casimir energy.
","[{""version"":""v1"",""created"":""Wed, 14 Dec 2011 16:58:04 GMT""}]","2015-06-03"
"1112.3275","St\'ephane Pons","Alberto Crepaldi, Stephane Pons, Emmanouil Frantzeskakis, Klaus Kern,
  and Marco Grioni","Anisotropic spin gaps in BiAg$_2$-Ag/Si(111)","6 pages, 5 figures",,"10.1103/PhysRevB.85.075411",,"cond-mat.mtrl-sci cond-mat.other","http://arxiv.org/licenses/nonexclusive-distrib/1.0/","  We present a detailed analysis of the band structure of the
BiAg$_2$/Ag/Si(111) trilayer system by means of high resolution Angle Resolved
Photoemission Spectroscopy (ARPES). BiAg2/Ag/Si(111) exhibits a complex spin
polarized electronic structure due to giant spin-orbit interactions. We show
that a complete set of constant energy ARPES maps, supplemented by a modified
nearly free electron calculation, provides a unique insight into the structure
of the spin polarized bands and spin gaps. We also show that the complex gap
structure can be continuously tuned in energy by a controlled deposition of an
alkali metal.
","[{""version"":""v1"",""created"":""Wed, 14 Dec 2011 17:00:58 GMT""},{""version"":""v2"",""created"":""Thu, 15 Dec 2011 08:47:55 GMT""},{""version"":""v3"",""created"":""Thu, 19 Jan 2012 16:51:55 GMT""}]","2015-06-03"
"1112.3276","Debashish Chowdhury","Ajeet K. Sharma and Debashish Chowdhury","Error correction during DNA replication","Accepted for publication in Physical Review E (8 pages, including 6
  figures)","Physical Review E, VOL.86, 011913 (2012)","10.1103/PhysRevE.86.011913",,"physics.bio-ph cond-mat.stat-mech q-bio.BM","http://arxiv.org/licenses/nonexclusive-distrib/1.0/","  DNA polymerase (DNAP) is a dual-purpose enzyme that plays two opposite roles
in two different situations during DNA replication. It plays its normal role as
a {\it polymerase} catalyzing the elongation of a new DNA molecule by adding a
monomer. However, it can switch to the role of an {\it exonuclease} and shorten
the same DNA by cleavage of the last incorporated monomer from the nascent DNA.
Just as misincorporated nucleotides can escape exonuclease causing replication
error, correct nucleotide may get sacrificed unnecessarily by erroneous
cleavage. The interplay of polymerase and exonuclease activities of a DNAP is
explored here by developing a minimal stochastic kinetic model of DNA
replication. Exact analytical expressions are derived for a few key statistical
distributions; these characterize the temporal patterns in the mechanical
stepping and the chemical (cleavage) reaction. The Michaelis-Menten-like
analytical expression derived for the average rates of these two processes not
only demonstrate the effects of their coupling, but are also utilized to
measure the extent of {\it replication error} and {\it erroneous cleavage}.
","[{""version"":""v1"",""created"":""Wed, 14 Dec 2011 17:02:57 GMT""},{""version"":""v2"",""created"":""Wed, 21 Dec 2011 18:25:51 GMT""},{""version"":""v3"",""created"":""Wed, 4 Jul 2012 20:00:51 GMT""}]","2013-08-13"
"1112.3277","Pedro Miguel Martins Ferreira","P. M. Ferreira, Rui Santos, Marc Sher, and Joao P. Silva","Implications of the LHC two-photon signal for two-Higgs-doublet models","Latex, 6 pages, 4 figures; v2 - added 2 references",,"10.1103/PhysRevD.85.077703",,"hep-ph","http://arxiv.org/licenses/nonexclusive-distrib/1.0/","  We study the implications for Two Higgs Doublet Models of the recent
announcement at the LHC giving a tantalizing hint for a Higgs boson of mass 125
GeV decaying into two photons. We require that the experimental result be
within a factor of two of the theoretical Standard Model prediction, and
analyze the type I and type II models as well as the lepton-specific and
flipped models, subject to this requirement. It is assumed that there is no new
physics other than two Higgs doublets. In all of the models, we display the
allowed region of parameter space taking the recent LHC announcement at face
value, and we analyze the $W^+W^-$, $ZZ$, $\bar{b}b$ and $\tau^+\tau^-$
expectations in these allowed regions. Throughout the entire range of parameter
space allowed by the $\gamma\gamma$ constraint, the number of events for Higgs
decays into $WW$, $ZZ$ and $b \bar b$ are not changed from the Standard Model
by more than a factor of two. In contrast, in the Lepton Specific model, decays
to $\tau^+ \tau^- $ are very sensitive across the entire $\gamma
\gamma$-allowed region.
","[{""version"":""v1"",""created"":""Wed, 14 Dec 2011 17:04:40 GMT""},{""version"":""v2"",""created"":""Mon, 19 Dec 2011 19:08:03 GMT""}]","2013-05-30"
"1112.3278","Hanchen Huang","L. G. Zhou and Hanchen Huang","Critical Separation of Clusters During Physical Vapor Deposition",,,,,"cond-mat.mtrl-sci","http://arxiv.org/licenses/nonexclusive-distrib/1.0/","  The critical separation of clusters, corresponding to the maximum density of
clusters, affects growth characteristics during physical vapor deposition
(PVD). In particular, this separation can affect surface smoothness in growing
single-crystalline films, grain size distribution in growing polycrystalline
films, and diameter in growing nanorods. This Letter reports a theoretical
expression of the critical separation as a function of deposition conditions
and accompanying verifications using lattice kinetic Monte Carlo (MC)
simulations of PVD on Cu{111}. In contrast to existing theories, the
theoretical expression in this Letter is (1) closed-form, (2) in better
agreement with the MC simulations than the lattice approximation and (3) in
better agreement with the MC simulations than the mean field approximation when
the critical separation is large- larger than 25 nm for PVD on Cu{111}.
","[{""version"":""v1"",""created"":""Wed, 14 Dec 2011 17:08:16 GMT""}]","2011-12-15"
"1112.3279","Farhad Yusef-Zadeh","F. Yusef-Zadeh and M. Wardle","The Origin of Parsec-Scale Gaseous and Stellar Disks in the Galactic
  Center and AGNs","6 pages, 2 figures, to appear in ""The Central Kiloparsec in Galactic
  Nuclei: Astronomy at High Angular Resolution 2011"", open access Journal of
  Physics: Conference Series (JPCS), published by IOP Publishing",,"10.1088/1742-6596/372/1/012024",,"astro-ph.GA","http://arxiv.org/licenses/nonexclusive-distrib/1.0/","  The Galactic center stellar disk and the circumnuclear ring provide a unique
opportunity to study in detail the dynamics and physical conditions of distant
molecular disks in the nuclei of galaxies. One of the key questions is how
these disks form so close to their host black holes and under what condition
they form stars in a tidally stressed environment. We argue that disk formation
around a massive black hole is due to partial accretion of extended molecular
clouds that temporarily pass through the central region of the Galaxy. The
cancellation of angular momentum of the gravitationally focused gas naturally
creates a compact gaseous disk. The disk can potentially become gravitationally
unstable and form stars. We apply these ideas to explain the origin of
sub-parsec megamaser disks found in the nuclei of Seyfert 2 galaxies. We show
that an empirical scaling relation between the mass of the black hole and the
size of the disk can be understood in the context of the cloud capture
scenario. We conclude that the stellar and gas disks found in our Galactic
center act as a bridge to further our understanding of more distant mega-maser
disks in the nuclei of Seyfert 2 galaxies.
","[{""version"":""v1"",""created"":""Wed, 14 Dec 2011 17:09:39 GMT""}]","2015-06-03"
