"1112.3462","Jorge A. Rueda","Rodrigo Negreiros, Remo Ruffini, Carlo Luciano Bianco, Jorge A. Rueda","Cooling of young neutron stars in GRB associated to Supernova","Version to be published by Astronomy & Astrophysics. Abstract reduced
  with respect to the one to be published in A&A due to arXiv system constraint
  of 300 words","Astronomy & Astrophysics, Volume 540, id.A12 (2012)","10.1051/0004-6361/201117006",,"astro-ph.HE gr-qc nucl-th","http://arxiv.org/licenses/nonexclusive-distrib/1.0/","  Recent observations of the late ($t=10^8$--$10^9$ s) emission of supernovae
(SNe) associated to GRBs (GRB-SN) show a distinctive emission in the X-ray
regime consistent with temperatures $10^7$--$10^8$ K. Similar features have
been also observed in the two Type Ic SNe SN 2002ap and SN 1994I that are not
associated to GRBs. We advance the possibility that the late X-ray emission
observed in GRB-SN and in isolated SN is associated to a hot neutron star (NS)
just formed in the SN event, here defined as a neo-NS. We discuss the thermal
evolution of neo-NS in the age regime that spans from $\sim 1$ minute (just
after the proto-NS phase) up to ages <10-100 yr. We examine the key factor
governing the neo-NS cooling emphasizing on the neutrino emission. A
phenomenological heating source and new boundary conditions are introduced to
mimic the high-temperature atmosphere of young NSs. We match the neo-NS
luminosity to the late X-ray emission of the GRB-SN events URCA-1 in
GRB980425-SN1998bw, URCA-2 in GRB030329-SN2003dh, and URCA-3 in
GRB031203-SN2003lw. By calibrating our additional heating source at early times
to $\sim 10^{12}$--$10^{15}$ erg/g/s, we find a striking agreement of the
luminosity obtained from the cooling of neo-NSs with the late
($t=10^{8}$--$10^{9}$ s) X-ray emission observed in GRB-SN. It is therefore
appropriate to revise the boundary conditions used in the cooling theory of
NSs, to match the proper conditions of the atmosphere at young ages. Additional
heating processes that are still not studied within this context, such as e+e-
pair creation by overcritical fields and nuclear fusion and fission energy
release, might also take place under such conditions and deserve further
analysis. Observation of GRB-SN has shown the possibility of witnessing the
thermal evolution of neo-NSs. A new campaign of dedicated observations is
recommended both of GRB-SN and of isolated Type Ic SN.
","[{""version"":""v1"",""created"":""Thu, 15 Dec 2011 09:46:45 GMT""},{""version"":""v2"",""created"":""Fri, 2 Mar 2012 09:09:53 GMT""}]","2012-06-01"
"1112.3463","Horacio Olivares Pil\'on","Horacio Olivares Pil\'on","He$_2^{3+}$ and HeH$^{2+}$ molecular ions in a strong magnetic field:
  the Lagrange mesh approach","8 pages, 1 figure, 2 tables. arXiv admin note: text overlap with
  arXiv:0912.1043",,"10.1016/j.physleta.2012.03.044",,"astro-ph.HE physics.atom-ph","http://arxiv.org/licenses/nonexclusive-distrib/1.0/","  Accurate calculations for the ground state of the molecular ions He$_2^{3+}$
and HeH$^{2+}$ placed in a strong magnetic field $B\gtrsim 10^{2}$ a.u.
($\approx 2.35 \times 10^{11}$G) using the Lagrange-mesh method are presented.
The Born-Oppenheimer approximation of zero order (infinitely massive centers)
and the parallel configuration (molecular axis parallel to the magnetic field)
are considered. Total energies are found with 9-10 s.d. The obtained results
show that the molecular ions He$_2^{3+}$ and HeH$^{2+}$ exist at $B >
100$\,a.u. and $B > 1000$\,a.u., respectively, as predicted in \cite{Tu:2007}
while a saddle point in the potential curve appears for the first time at $B
\sim 80$ a.u. and $B \sim 740$ a.u., respectively.
","[{""version"":""v1"",""created"":""Thu, 15 Dec 2011 09:47:01 GMT""},{""version"":""v2"",""created"":""Fri, 16 Dec 2011 17:29:17 GMT""}]","2015-06-03"
"1112.3464","Piotr Malicki","Alicja Jaworska, Piotr Malicki, Andrzej Skowro\'nski","Classification of modules not lying on short chains",,"The Quarterly Journal of Mathematics 64 (2013), 1141-1160 (title
  changed)","10.1093/qmath/has034",,"math.RT","http://arxiv.org/licenses/nonexclusive-distrib/1.0/","  We give a complete description of finitely generated modules over artin
algebras which are not the middle of a short chain of modules, using injective
and tilting modules over hereditary artin algebras.
","[{""version"":""v1"",""created"":""Thu, 15 Dec 2011 09:48:29 GMT""}]","2013-12-13"
"1112.3465","Fernando Delgado Acosta","F. Delgado and J. Fern\'andez-Rossier","Storage of classical information in quantum spins",,"Physical Review Letters, 108, 196602 (2012)","10.1103/PhysRevLett.108.196602",,"cond-mat.mes-hall","http://arxiv.org/licenses/nonexclusive-distrib/1.0/","  Digital magnetic recording is based on the storage of a bit of information in
the orientation of a magnetic system with two stable ground states. Here we
address two fundamental problems that arise when this is done on a quantized
spin: quantum spin tunneling and back-action of the readout process. We show
that fundamental differences exist between integer and semi-integer spins when
it comes to both, read and record classical information in a quantized spin.
Our findings imply fundamental limits to the miniaturization of magnetic bits
and are relevant to recent experiments where spin polarized scanning tunneling
microscope reads and records a classical bit in the spin orientation of a
single magnetic atom.
","[{""version"":""v1"",""created"":""Thu, 15 Dec 2011 09:52:33 GMT""}]","2012-09-24"
"1112.3466","Mario Bessa","Mario Bessa","C1-stably shadowable conservative diffeomorphisms are Anosov","4 pages","Bulletin of the Korean Mathematical Society, vol 50, 5, 1495-1499,
  2013",,,"math.DS","http://arxiv.org/licenses/nonexclusive-distrib/1.0/","  In this short note we prove that if a symplectomorphism f is C1-stably
shadowable, then f is Anosov. The same result is obtained for volume-preserving
diffeomorphisms.
","[{""version"":""v1"",""created"":""Thu, 15 Dec 2011 10:03:47 GMT""}]","2014-03-17"
"1112.3467","V. A.  Golovko","V. A. Golovko","Incommensurate phases in statistical theory of the crystalline state","31 pages, 2 figures; extra explanations and a reference added",,,,"cond-mat.stat-mech","http://arxiv.org/licenses/nonexclusive-distrib/1.0/","  The paper continues a series of papers devoted to treatment of the
crystalline state on the basis of the approach in equilibrium statistical
mechanics proposed earlier by the author. This paper is concerned with
elaboration of a mathematical apparatus in the approach for studying
second-order phase transitions, both commensurate and incommensurate, and
properties of emerging phases. It is shown that the preliminary symmetry
analysis for a concrete crystal can be performed analogously with the one in
the Landau theory of phase transitions. After the analysis one is able to
deduce a set of equations that describe the emerging phases and corresponding
phase transitions. The treatment of an incommensurate phase is substantially
complicated because the symmetry of the phase cannot be described in terms of
customary space groups. For this reason, a strategy of representing the
incommensurate phase as the limit of a sequence of long-period commensurate
phases whose period tends to infinity is worked out. The strategy enables one
to obviate difficulties due to the devil's staircase that occurs in this
situation.
","[{""version"":""v1"",""created"":""Thu, 15 Dec 2011 10:05:58 GMT""},{""version"":""v2"",""created"":""Thu, 7 Feb 2013 11:38:00 GMT""}]","2013-02-08"
"1112.3468","Ben Green","Emmanuel Breuillard and Ben Green","Contractions and expansion","6 pages, submitted to special volume of EJC in honour of Yahya
  Hamidoune",,,,"math.CO math.NT","http://arxiv.org/licenses/nonexclusive-distrib/1.0/","  Let A be a finite set of reals and let K >= 1 be a real number. Suppose that
for each a in A we are given an injective map f_a : A -> R which fixes a and
contracts other points towards it in the sense that |a - f_a(x)| <= |a - x|/K
for all x in A, and such that f_a(x) always lies between a and x. Then the
union of the f_a(A) has cardinality >= K|A|/10 - O_K(1). An immediate
consequence of this is the estimate |A + K.A| >= K|A|/10 - O_K(1), which is a
slightly weakened version of a result of Bukh.
","[{""version"":""v1"",""created"":""Thu, 15 Dec 2011 10:17:53 GMT""}]","2011-12-16"
"1112.3469","Noureddine Ghiloufi","Noureddine Ghiloufi and Khalifa Dabbek","On the tangent cones to plurisubharmonic currents","18 pages",,,,"math.CV","http://arxiv.org/licenses/nonexclusive-distrib/1.0/","  In this paper, we study the existence of the tangent cone to a positive
plurisubharmonic or plurisuperharmonic current with a suitable condition. Some
Estimates of the growth of the Lelong functions associated to the current and
to its $dd^c$ are given to ensure the existence of the blow-up of this current.
A second proof for the existence of the tangent cone is derived from these
estimates.
","[{""version"":""v1"",""created"":""Thu, 15 Dec 2011 10:20:54 GMT""}]","2011-12-16"
"1112.3470","Svend-Age Biehs","M. Tschikin, and S.-A. Biehs, P. Ben-Abdallah, F. S. S. Rosa","Radiative cooling of nanoparticles close to a surface",,"Eur. Phys. J. B (2012) 85: 233","10.1140/epjb/e2012-30219-7",,"cond-mat.mes-hall","http://arxiv.org/licenses/nonexclusive-distrib/1.0/","  We study the radiative cooling of polar and metallic nanoparticles immersed
in a thermal bath close to a partially reflecting surface. The dynamics of
relaxation is investigated at different distances from the surface, i.e., in
the near-field and far-field zones. We demonstrate the existence of an
oscillating behavior for the thermal relaxation time with respect to the
separation distance from the surface, an analog of Friedel oscillations in
Fermi liquids.
","[{""version"":""v1"",""created"":""Thu, 15 Dec 2011 10:21:20 GMT""},{""version"":""v2"",""created"":""Thu, 19 Jul 2012 16:32:00 GMT""}]","2015-06-03"
"1112.3471","Girish Nair","Girish N. Nair","A Nonstochastic Information Theory for Communication and State
  Estimation",,"IEEE Transactions on Automatic Control 58 (2013) 1497-1510","10.1109/TAC.2013.2241491",,"cs.SY cs.IT math.IT math.OC","http://arxiv.org/licenses/nonexclusive-distrib/1.0/","  In communications, unknown variables are usually modelled as random
variables, and concepts such as independence, entropy and information are
defined in terms of the underlying probability distributions. In contrast,
control theory often treats uncertainties and disturbances as bounded unknowns
having no statistical structure. The area of networked control combines both
fields, raising the question of whether it is possible to construct meaningful
analogues of stochastic concepts such as independence, Markovness, entropy and
information without assuming a probability space. This paper introduces a
framework for doing so, leading to the construction of a maximin information
functional for nonstochastic variables. It is shown that the largest maximin
information rate through a memoryless, error-prone channel in this framework
coincides with the block-coding zero-error capacity of the channel. Maximin
information is then used to derive tight conditions for uniformly estimating
the state of a linear time-invariant system over such a channel, paralleling
recent results of Matveev and Savkin.
","[{""version"":""v1"",""created"":""Thu, 15 Dec 2011 10:33:11 GMT""},{""version"":""v2"",""created"":""Tue, 3 Jan 2012 05:09:41 GMT""},{""version"":""v3"",""created"":""Thu, 5 Jul 2012 08:19:11 GMT""},{""version"":""v4"",""created"":""Tue, 11 Sep 2012 15:58:53 GMT""},{""version"":""v5"",""created"":""Sat, 11 Jan 2014 16:49:10 GMT""}]","2014-01-14"
"1112.3472","Alexander Itin","A. P. Itin and A. I. Neishtadt","Fermi acceleration in time-dependent rectangular billiards due to
  multiple passages through resonances","20 pages. Presented on School-Conference ""Mathematics and Physics of
  Billiard-Like Systems"" (Ubatuba, 2011). Accepted to Chaos","Chaos 22, 026119 (2012)","10.1063/1.4705101",,"nlin.CD cond-mat.stat-mech","http://arxiv.org/licenses/nonexclusive-distrib/1.0/","  We consider a slowly rotating rectangular billiard with moving boundaries and
use the canonical perturbation theory to describe the dynamics of a billiard
particle. In the process of slow evolution certain resonance conditions can be
satisfied. Correspondingly, phenomena of scattering on a resonance and capture
into a resonance happen in the system. These phenomena lead to destruction of
adiabatic invariance and to unlimited acceleration of the particle.
","[{""version"":""v1"",""created"":""Thu, 15 Dec 2011 10:37:23 GMT""},{""version"":""v2"",""created"":""Sun, 8 Apr 2012 18:34:23 GMT""}]","2012-06-26"
"1112.3473","Rashid Nazmitdinov","R. G. Nazmitdinov, N. S. Simonovic, A. R. Plastino, A. V. Chizhov","A geometrical crossover in excited states of two-electron quantum dots
  in a magnetic field","8 pages, 2 figures","Journal of Physics: Conference Series 393 (2012) 012009","10.1088/1742-6596/393/1/012009",,"cond-mat.mes-hall quant-ph","http://arxiv.org/licenses/nonexclusive-distrib/1.0/","  We use the entanglement measure to study the evolution of quantum
correlations in two-electron axially-symmetric parabolic quantum dots under a
perpendicular magnetic field. We found that the entanglement indicates on the
shape transition in the density distribution of two electrons in the lowest
state with zero angular momentum projection at the specific value of the
applied magnetic field.
","[{""version"":""v1"",""created"":""Thu, 15 Dec 2011 10:44:07 GMT""},{""version"":""v2"",""created"":""Wed, 8 May 2013 10:59:54 GMT""}]","2013-05-09"
"1112.3474","Enrico Carlini","Enrico Carlini, Maria Virginia Catalisano, Anthony V. Geramita","The Waring rank of the sum of pairwise coprime monomials","Case 2 of the proof of Theorem 3.2 contained a gap, a new (shorter)
  proof is now presented",,,,"math.AC","http://arxiv.org/licenses/nonexclusive-distrib/1.0/","  In this paper we compute the Waring rank of any polynomial of the form
F=M_1+...+M_r, where the M_i are pairwise coprime monomials, i.e.,
GCD(M_i,M_j)=1 for i not j. In particular, we determine the Waring rank of any
monomial. As an application we show that certain monomials in three variables
give examples of forms of rank higher than the generic form. As a further
application we produce a sum of power decomposition for any form which is the
sum of pairwise coprime monomials.
","[{""version"":""v1"",""created"":""Thu, 15 Dec 2011 10:45:31 GMT""},{""version"":""v2"",""created"":""Tue, 7 Feb 2012 15:28:10 GMT""},{""version"":""v3"",""created"":""Tue, 17 Apr 2012 13:18:29 GMT""}]","2012-04-18"
"1112.3475","Moritz Deger","Stefano Cardanobile, Volker Pernice, Moritz Deger, Stefan Rotter","Discovering universal statistical laws of complex networks",,"PLoS ONE 7(6): e37911 (2012)","10.1371/journal.pone.0037911",,"physics.soc-ph cs.SI q-bio.QM","http://arxiv.org/licenses/nonexclusive-distrib/1.0/","  Different network models have been suggested for the topology underlying
complex interactions in natural systems. These models are aimed at replicating
specific statistical features encountered in real-world networks. However, it
is rarely considered to which degree the results obtained for one particular
network class can be extrapolated to real-world networks. We address this issue
by comparing different classical and more recently developed network models
with respect to their generalisation power, which we identify with large
structural variability and absence of constraints imposed by the construction
scheme. After having identified the most variable networks, we address the
issue of which constraints are common to all network classes and are thus
suitable candidates for being generic statistical laws of complex networks. In
fact, we find that generic, not model-related dependencies between different
network characteristics do exist. This allows, for instance, to infer global
features from local ones using regression models trained on networks with high
generalisation power. Our results confirm and extend previous findings
regarding the synchronisation properties of neural networks. Our method seems
especially relevant for large networks, which are difficult to map completely,
like the neural networks in the brain. The structure of such large networks
cannot be fully sampled with the present technology. Our approach provides a
method to estimate global properties of under-sampled networks with good
approximation. Finally, we demonstrate on three different data sets (C.
elegans' neuronal network, R. prowazekii's metabolic network, and a network of
synonyms extracted from Roget's Thesaurus) that real-world networks have
statistical relations compatible with those obtained using regression models.
","[{""version"":""v1"",""created"":""Thu, 15 Dec 2011 10:47:15 GMT""}]","2012-06-11"
"1112.3476","Antal Jakovac","A. Jakovac and P. Mati","Resummations in the Bloch-Nordsieck model","12 pages, 3 figures, revtex4",,"10.1103/PhysRevD.85.085006",,"hep-ph hep-th","http://arxiv.org/licenses/nonexclusive-distrib/1.0/","  We studied different levels of resummations of the exactly solvable
Bloch-Nordsieck model in order to be able to compare the approximations with an
exact result. We studied one-loop perturbation theory, 2PI resummation and
Schwinger-Dyson equations truncated in a way to maintain Ward-identities. At
all levels we carefully performed renormalization. We found that although the
2PI resummation does not exhibit infrared sensitivity at the mass shell (the
one-loop perturbation theory does), but it is still far from the exact
solution. The method of truncated Schwinger-Dyson equations, however, is exact
in this model, so it provides a new way of solving the Bloch-Nordsieck model.
This method can also be generalized to other, more complicated theories.
","[{""version"":""v1"",""created"":""Thu, 15 Dec 2011 10:47:58 GMT""}]","2015-06-03"
"1112.3477","Nicolas Lichiardopol","Nicolas Lichiardopol","Strong connectivity and directed triangles in oriented graphs. Partial
  results on a particular case of the Caccetta-H\""aggkvist conjecture","14 pages",,,,"math.CO","http://arxiv.org/licenses/nonexclusive-distrib/1.0/","  A particular case of Caccetta-H\""{a}ggkvist conjecture, says that a digraph
of order $n$ with minimum out-degree at least $1/3n$ contains a directed cycle
of length at most 3. Recently, Kral, Hladky and Norine proved that a digraph of
order $n$ with minimum out-degree at least $0.3465n$ contains a directed cycle
of length at most 3 (which currently is the best result). A weaker particular
case says that a digraph of order $n$ with minimum semi-degree at least $1/3n$
contains a directed triangle. In a recent paper, by using the result of Kral et
al, the author proved that for $\beta\geq 0.343545$, any digraph $D$ of order
$n$ with minimum semi-degree at least $\beta n$ contains a directed cycle of
length at most 3 (which currently is the best result). This means that for a
given integer $d\geq 1$, every digraph with minimum semi-degree $d$ and of
order $md$ with $m\leq 2.91082$, contains a directed cycle of length at most 3.
In particular, every oriented graph with minimum semi-degree $d$ and of order
$md$ with $m\leq 2.91082$, contains a directed triangle. In this paper, by
using the result of Kral et al, we prove that every oriented graph with minimum
semi-degree $d$, of order $md$ with $2.91082< m\leq 3$ and of strong
connectivity at most $0.679d$, contains a directed triangle. This will be
implied by a more general and more precise result, valid not only for $2.91082<
m\leq 3$ but also for larger values of $m$. As application, we improve two
existing results. The first result (Authors Broersma and Li), concerns the
number of the directed cycles of length 4 of a triangle free oriented graph of
order $n$ and of minimum semi-degree at least $\frac{n}{3}$. The second result
(Authors Kelly, K\""{u}hn and Osthus), concerns the diameter of a triangle free
oriented graph of order $n$ and of minimum semi-degree at least $\frac{n}{5}$.
","[{""version"":""v1"",""created"":""Thu, 15 Dec 2011 10:53:42 GMT""}]","2011-12-16"
"1112.3478","Michael Kr\""amer","Robert Harlander, Michael Kr\""amer, and Markus Schumacher","Bottom-quark associated Higgs-boson production: reconciling the four-
  and five-flavour scheme approach","8 pages, 4 figures",,,"CERN-PH-TH/2011-134; FR-PHENO-2011-009; TTK-11-17; WUB/11-0","hep-ph hep-ex","http://arxiv.org/licenses/nonexclusive-distrib/1.0/","  The main arguments in the discussion of the proper treatment of the total
inclusive cross section for bottom-quark associated Higgs-boson production are
briefly reviewed. A simple and pragmatic formula for the combination of the
so-called four- and five-flavour schemes is suggested, including the treatment
of the respective theory error estimates. The numerical effects of this
matching formula are discussed.
","[{""version"":""v1"",""created"":""Thu, 15 Dec 2011 10:58:49 GMT""}]","2011-12-16"
"1112.3479","Matthias Kuenzer","Matthias Kuenzer","On adjoint functors of the Heller operator",,,,,"math.KT math.RT","http://arxiv.org/licenses/nonexclusive-distrib/1.0/","  Given an abelian category A with enough projectives, we can form its stable
category _A_ := A/Proj(A)$. The Heller operator Omega : _A_ -> _A_ is
characterised on an object X by a choice of a short exact sequence Omega X -> P
-> X in A with P projective. If A is Frobenius, then Omega is an equivalence,
hence has a left and a right adjoint. If A is hereditary, then Omega is zero,
hence has a left and a right adjoint. In general, Omega is neither an
equivalence nor zero. In the examples we have calculated via Magma, it has a
left adjoint, but in general not a right adjoint. If A has projective covers,
then Omega preserves monomorphisms; this would also follow from Omega having a
left adjoint. I do not know an example where Omega does not have a left
adjoint.
","[{""version"":""v1"",""created"":""Thu, 15 Dec 2011 10:59:21 GMT""}]","2011-12-16"
"1112.3480","Jacqueline Hodge","J. A. Hodge, C. C. Carilli, F. Walter, W. J. G. de Blok, D. Riechers,
  and E. Daddi","CO in GN20: The Nature of a z=4 Submillimeter Galaxy","To appear in the Conference Proceedings for ""Galaxy Mergers in an
  Evolving Universe"", held in Hualien, Taiwan, on October 23-28, 2011",,,,"astro-ph.CO","http://arxiv.org/licenses/nonexclusive-distrib/1.0/","  We present a study of the formation of clustered, massive galaxies at large
look--back times, via high resolution spectroscopic imaging of CO in the unique
GN20 proto-cluster. The data reveal evidence for rich structure and gas
dynamics in unprecedented detail, allowing us to image the molecular gas with a
resolution of only 1 kpc just 1.5 Gyr after the Big Bang. These
state-of-the-art data give new insight into the detailed physical processes
involved in early massive galaxy formation, and they provide a first glimpse of
the morphological studies that will become feasible on a regular basis with
ALMA.
","[{""version"":""v1"",""created"":""Thu, 15 Dec 2011 11:01:51 GMT""}]","2011-12-16"
"1112.3481","Dan Comanescu","Dan Comanescu","Stability of equilibrium states in the Zhukovski case of heavy gyrostat
  using algebraic methods",,,"10.1002/mma.2595",,"math-ph math.DS math.MP","http://arxiv.org/licenses/nonexclusive-distrib/1.0/","  We study the stability of the equilibrium points of a skew product system. We
analyze the possibility to construct a Lyapunov function using a set of
conserved quantities and solving an algebraic system. We apply the theoretical
results to study the stability of an equilibrium state of a heavy gyrostat in
the Zhukovski case.
","[{""version"":""v1"",""created"":""Thu, 15 Dec 2011 11:08:22 GMT""}]","2013-03-15"
"1112.3482","H. Rittich","Andreas Frommer and Karsten Kahl and Thomas Lippert and H. Rittich","Error Bounds for the Sign Function",,,,,"hep-lat","http://arxiv.org/licenses/nonexclusive-distrib/1.0/","  The Overlap operator fulfills the Ginsparg-Wilson relation exactly and
therefore represents an optimal discretization of the QCD Dirac operator with
respect to chiral symmetry. When computing propagators or in HMC simulations,
where one has to invert the overlap operator using some iterative solver, one
has to approxomate the action of the sign function of the (symmetrized) Wilson
fermion matrix Q on a vector b in each iteration. This is usually done
iteratively using a ""primary"" Lanczos iteration. In this process, it is very
important to have good stopping criteria which allow to reliably assess the
quality of the approximation to the action of the sign function computed so
far. In this work we show how to cheaply recover a secondary Lanczos process,
starting at an arbitrary Lanczos vector of the primary process and how to use
this secondary process to efficiently obtain computable error estimates and
error bounds for the Lanczos approximations to sign(Q)b, where the sign
function is approximated by the Zolotarev rational approximation.
","[{""version"":""v1"",""created"":""Thu, 15 Dec 2011 11:08:58 GMT""}]","2011-12-16"
