"1112.3401","Zhen-Qing Chen","Zhen-Qing Chen, Panki Kim and Renming Song","Stability of Dirichlet heat kernel estimates for non-local operators
  under Feynman-Kac perturbation",,,,,"math.PR","http://arxiv.org/licenses/nonexclusive-distrib/1.0/","  In this paper we show that Dirichlet heat kernel estimates for a class of
(not necessarily symmetric) Markov processes are stable under non-local
Feynman-Kac perturbations. This class of processes includes, among others,
(reflected) symmetric stable-like processes on closed $d$-sets in $\bR^d$,
killed symmetric stable processes, censored stable processes in $C^{1, 1}$ open
sets as well as stable processes with drifts in bounded $C^{1, 1}$ open sets.
","[{""version"":""v1"",""created"":""Thu, 15 Dec 2011 00:59:51 GMT""}]","2011-12-16"
"1112.3402","Qian Bin","Bin Qian","Positive curvature property for sub-Laplace on nilpotent Lie group of
  rank two",,,,,"math.PR math.AP math.DG","http://arxiv.org/licenses/nonexclusive-distrib/1.0/","  In this note, we concentrate on the sub-Laplace on the nilpotent Lie group of
rank two, which is the infinitesimal generator of the diffusion generated by
$n$ Brownian motions and their $\frac{n(n-1)}2$ L\'evy area processes, which is
the simple extension of the sub-Laplace on the Heisenberg group $\mathbb{H}$.
In order to study contraction properties of the heat kernel, we show that, as
in the cases of the Heisenberg group and the three Brownian motion model, the
restriction of the sub-Laplace acting on radial functions (see Definition
\ref{radial fun}) satisfies a positive Ricci curvature condition (more
precisely a $CD(0, \infty)$ inequality, see Theorem \ref{positive}, whereas the
operator itself does not satisfy any $CD(r,\infty)$ inequality. From this we
may deduce some useful, sharp gradient bounds for the associated heat kernel.
It can be seen a generalization of the paper \cite{Qian2}.
","[{""version"":""v1"",""created"":""Thu, 15 Dec 2011 01:02:33 GMT""}]","2011-12-19"
"1112.3403","Azat Gainutdinov","A. M. Gainutdinov, N. Read, H. Saleur","Continuum limit and symmetries of the periodic gl(1|1) spin chain","43 pp, few comments added","Nuclear Physics B 871 [FS] (2013) 245-288","10.1016/j.nuclphysb.2013.01.018",,"hep-th cond-mat.stat-mech math-ph math.MP math.QA","http://arxiv.org/licenses/nonexclusive-distrib/1.0/","  This paper is the first in a series devoted to the study of logarithmic
conformal field theories (LCFT) in the bulk. Building on earlier work in the
boundary case, our general strategy consists in analyzing the algebraic
properties of lattice regularizations (quantum spin chains) of these theories.
In the boundary case, a crucial step was the identification of the space of
states as a bimodule over the Temperley Lieb (TL) algebra and the quantum group
U_q sl(2). The extension of this analysis in the bulk case involves
considerable difficulties, since the U_q sl(2) symmetry is partly lost, while
the TL algebra is replaced by a much richer version (the Jones Temperley Lieb -
JTL - algebra). Even the simplest case of the gl(1|1) spin chain -
corresponding to the c=-2 symplectic fermions theory in the continuum limit -
presents very rich aspects, which we will discuss in several papers.
  In this first work, we focus on the symmetries of the spin chain, that is,
the centralizer of the JTL algebra in the alternating tensor product of the
gl(1|1) fundamental representation and its dual. We prove that this centralizer
is only a subalgebra of U_q sl(2) at q=i that we dub U_q^{odd} sl(2). We then
begin the analysis of the continuum limit of the JTL algebra: using general
arguments about the regularization of the stress energy-tensor, we identify
families of JTL elements going over to the Virasoro generators L_n, \bar{L}_n
in the continuum limit. We then discuss the SU(2) symmetry of the (continuum
limit) symplectic fermions theory from the lattice and JTL point of view.
  The analysis of the spin chain as a bimodule over U_q^{odd} sl(2) and JTL is
discussed in the second paper of this series.
","[{""version"":""v1"",""created"":""Thu, 15 Dec 2011 01:08:42 GMT""},{""version"":""v2"",""created"":""Tue, 7 Feb 2012 16:47:49 GMT""},{""version"":""v3"",""created"":""Fri, 22 Feb 2013 17:00:27 GMT""}]","2013-03-29"
"1112.3404","Jeffrey Hunter","Jeffrey J. Hunter","The Derivation of Markov Chain Properties using Generalized Matrix
  Inverses","31 pages","Lectures on Matrix and Graph Methods, Manipal Univ Press Eds R.B.
  Bapat, S.Kirkland, K.M. Prasad, S. Puntanen, pp 61-89, (2012) ISBN
  978-81-922759-6-3",,,"math.PR","http://arxiv.org/licenses/nonexclusive-distrib/1.0/","  The analysis of many problems of interest associated with Markov chains, e.g.
stationary distributions, moments of first passage time distributions and
moments of occupation time random variables, involves the solution of a system
of linear equations involving I - P, where P is the transition matrix of a
finite, irreducible, discrete time Markov chain. Generalized inverses play an
important role in the solution of such singular sets of equations. In this
presentation we survey the application of generalized matrix inverses to the
aforementioned problems.
","[{""version"":""v1"",""created"":""Thu, 15 Dec 2011 01:20:17 GMT""}]","2012-08-29"
"1112.3405","Jackson Clarke","Jackson D. Clarke, Robert Foot, and Raymond R. Volkas","Quark-lepton symmetric model at the LHC","24 pages, 6 figures","Phys.Rev.D85:074012,2012","10.1103/PhysRevD.85.074012",,"hep-ph","http://arxiv.org/licenses/nonexclusive-distrib/1.0/","  We investigate the quark-lepton symmetric model of Foot and Lew in the
context of the Large Hadron Collider (LHC). In this `bottom-up' extension to
the Standard Model, quark-lepton symmetry is achieved by introducing a gauged
`leptonic colour' symmetry which is spontaneously broken above the electroweak
scale. If this breaking occurs at the TeV scale, then we expect new physics to
be discovered at the LHC. We examine three areas of interest: the Z$'$ heavy
neutral gauge boson, charge $\pm1/2$ exotic leptons, and a colour triplet
scalar diquark. We find that the LHC has already explored and/or will explore
new parameter space for these particles over the course of its lifetime.
","[{""version"":""v1"",""created"":""Thu, 15 Dec 2011 01:36:02 GMT""},{""version"":""v2"",""created"":""Sat, 4 Feb 2012 05:31:31 GMT""}]","2012-04-12"
"1112.3406","Martin Magnuson","M. Magnuson, S. M. Butorin, C. S{\aa}the and J. Nordgren and P.
  Ravindran","Spin transition in LaCoO3 investigated by resonant soft X-ray emission
  spectroscopy","8 pages, 2 figures","Europhysics Letters 68 (2), pp. 289-285 (2004)","10.1209/epl/i2004-10183-8",,"cond-mat.str-el cond-mat.mtrl-sci physics.comp-ph","http://arxiv.org/licenses/nonexclusive-distrib/1.0/","  The spin transition in LaCoO3 is investigated by temperature-dependent
resonant soft X-ray emission spectroscopy near the Co 2p absorption edges. This
element-specific technique is more bulk sensitive with respect to the
temperature induced spin-state of the Co3+ ions in LaCoO3 than other
high-energy spectroscopic methods. The spin transition is interpreted and
discussed with ab-initio density-functional theory within the fixed-spin moment
method, which is found to yield consistent spectral functions to the
experimental data. The spectral changes for LaCoO3 as a function of temperature
suggest a change in spin-state as the temperature is raised from 85 to 300 K
while the system remains in the same spin state as the temperature is further
increased to 510 K.
","[{""version"":""v1"",""created"":""Thu, 15 Dec 2011 01:49:21 GMT""},{""version"":""v2"",""created"":""Thu, 29 Dec 2011 18:26:00 GMT""}]","2011-12-30"
"1112.3407","Azat Gainutdinov","A. M. Gainutdinov, N. Read, H. Saleur","Bimodule structure in the periodic gl(1|1) spin chain","latex, 42 pp., 13 figures + 5 figures in color, many comments added","Nuclear Physics B 871 [FS] (2013) 289-329","10.1016/j.nuclphysb.2013.02.017",,"hep-th cond-mat.stat-mech math-ph math.MP math.QA math.RT","http://arxiv.org/licenses/nonexclusive-distrib/1.0/","  This paper is second in a series devoted to the study of periodic super-spin
chains. In our first paper at 2011, we have studied the symmetry algebra of the
periodic gl(1|1) spin chain. In technical terms, this spin chain is built out
of the alternating product of the gl(1|1) fundamental representation and its
dual. The local energy densities - the nearest neighbor Heisenberg-like
couplings - provide a representation of the Jones Temperley Lieb (JTL) algebra.
The symmetry algebra is then the centralizer of JTL, and turns out to be
smaller than for the open chain, since it is now only a subalgebra of U_q sl(2)
at q=i, dubbed U_q^{odd} sl(2). A crucial step in our associative algebraic
approach to bulk logarithmic conformal field theory (LCFT) is then the analysis
of the spin chain as a bimodule over U_q^{odd} sl(2) and JTL. While our
ultimate goal is to use this bimodule to deduce properties of the LCFT in the
continuum limit, its derivation is sufficiently involved to be the sole subject
of this paper. We describe representation theory of the centralizer and then
use it to find a decomposition of the periodic gl(1|1) spin chain over JTL for
any even number N of tensorands and ultimately a corresponding bimodule
structure. Applications of our results to the analysis of the bulk LCFT will
then be discussed in the third part of this series.
","[{""version"":""v1"",""created"":""Thu, 15 Dec 2011 02:06:09 GMT""},{""version"":""v2"",""created"":""Tue, 7 Feb 2012 17:00:25 GMT""},{""version"":""v3"",""created"":""Fri, 22 Feb 2013 17:09:39 GMT""}]","2015-06-03"
"1112.3408","Shiqing Zhang","Donglun Wu and Shiqing Zhang","Hyperbolic Orbits for a Class of Singular Hamiltonian Systems",,,,,"math.CA","http://arxiv.org/licenses/nonexclusive-distrib/1.0/","  The existence of hyperbolic orbits is proved for a class of singular
Hamiltonian systems $\ddot{u}(t)+\nabla V(u(t))=0$ by taking limit for a
sequence of periodic solutions which are the variational minimizers of
Lagrangian actions.
","[{""version"":""v1"",""created"":""Thu, 15 Dec 2011 02:13:59 GMT""},{""version"":""v2"",""created"":""Sun, 29 Jul 2012 00:53:14 GMT""}]","2012-07-31"
"1112.3409","Chi-Thiem Hoang","Thiem Hoang and A. Lazarian","Acceleration of Small Dust Grains due to Charge Fluctuations","14 pages, 9 figures, some typos fixed, discussion revised. Submitted
  to Astrophysical Journal","The Astrophysical Journal, Volume 761, Issue 2, article id. 96, 13
  pp. (2012)","10.1088/0004-637X/761/2/96",,"astro-ph.GA astro-ph.EP","http://arxiv.org/licenses/nonexclusive-distrib/1.0/","  We consider the acceleration of very small dust grains including Polycyclic
Aromatic Hydrocarbons (PAHs) arising from the electrostatic interactions of
dust grains that have charge fluctuations in time due to charging events. We
simulate the charge fluctuations of very small grains due to their sticking
collisions with electrons and ions in plasma, and the emission of
photoelectrons by UV photons using Monte Carlo method. We identify the
acceleration induced by the charge fluctuations as the dominant acceleration
mechanism of very small grains in the diffuse interstellar medium (ISM). We
show that this acceleration mechanism is efficient for environments with low
degree of ionization (i.e., large Debye length), where the charge fluctuations
are slow but have a large amplitude. We also discuss the implications of the
present mechanism for grain coagulation and shattering in the diffuse ISM,
molecular clouds, and protoplanetary disks.
","[{""version"":""v1"",""created"":""Thu, 15 Dec 2011 02:18:21 GMT""},{""version"":""v2"",""created"":""Thu, 22 Dec 2011 07:26:44 GMT""}]","2015-06-03"
"1112.3410","Ran Li","Ran Li","Logarithmic entropy of black hole in gravity with conformal anomaly from
  quantum tunneling approach","10 pages, no figure, EPL in press","Europhys. Lett. 96 (2011) 60014","10.1209/0295-5075/96/60014",,"gr-qc","http://arxiv.org/licenses/nonexclusive-distrib/1.0/","  Using quantum tunneling approach, we are able to derive the entropy with
logarithmic term of the static spherically symmetric black hole in
semi-classical Einstein equations with conformal anomaly. The results indicate
that the logarithmic correction to Bekenstein-Hawking area entropy can be well
explained by the self-gravitation.
","[{""version"":""v1"",""created"":""Thu, 15 Dec 2011 02:23:50 GMT""}]","2011-12-19"
"1112.3411","Yukinobu Toda","Yukinobu Toda","Bogomolov-Gieseker type inequality and counting invariants","42 pages, Lemma 3.16 is added, to appear in Journal of Topology",,"10.1112/jtopol/jts037",,"math.AG hep-th","http://arxiv.org/licenses/nonexclusive-distrib/1.0/","  We study a conjectural relationship among Donaldson-Thomas type invariants on
Calabi-Yau 3-folds counting torsion sheaves supported on ample divisors, ideal
sheaves of curves and Pandharipande-Thomas's stable pairs. The conjecture is a
mathematical formulation of Denef-Moore's formula derived in the study of
Ooguri-Strominger-Vafa's conjecture relating black hole entropy and topological
string. The main result of this paper is to prove our conjecture assuming a
conjectural Bogomolov-Gieseker type inequality proposed by Bayer, Macri and the
author.
","[{""version"":""v1"",""created"":""Thu, 15 Dec 2011 02:25:18 GMT""},{""version"":""v2"",""created"":""Fri, 16 Dec 2011 08:08:03 GMT""},{""version"":""v3"",""created"":""Tue, 16 Oct 2012 05:21:48 GMT""}]","2014-02-26"
"1112.3412","Francisco J Sevilla","P. Salas (1,2), F. J. Sevilla (2) and M. A. Sol\'is (2), ((1) Posgrado
  en Ciencia e Ingenier\'ia de Materiales, UNAM (2) Instituto de F\'isica,
  UNAM)","Boson gas in a periodic array of tubes","9 pages, 10 figures, submitted",,"10.1007/s10909-012-0623-6",,"cond-mat.quant-gas quant-ph","http://arxiv.org/licenses/nonexclusive-distrib/1.0/","  We report the thermodynamic properties of an ideal boson gas confined in an
infinite periodic array of channels modeled by two, mutually perpendicular,
Kronig-Penney delta-potentials. The particle's motion is hindered in the x-y
directions, allowing tunneling of particles through the walls, while no
confinement along the z direction is considered. It is shown that there exists
a finite Bose- Einstein condensation (BEC) critical temperature Tc that
decreases monotonically from the 3D ideal boson gas (IBG) value $T_{0}$ as the
strength of confinement $P_{0}$ is increased while keeping the channel's cross
section, $a_{x}a_{y}$ constant. In contrast, Tc is a non-monotonic function of
the cross-section area for fixed $P_{0}$. In addition to the BEC cusp, the
specific heat exhibits a set of maxima and minima. The minimum located at the
highest temperature is a clear signal of the confinement effect which occurs
when the boson wavelength is twice the cross-section side size. This
confinement is amplified when the wall strength is increased until a
dimensional crossover from 3D to 1D is produced. Some of these features in the
specific heat obtained from this simple model can be related, qualitatively, to
at least two different experimental situations: $^4$He adsorbed within the
interstitial channels of a bundle of carbon nanotubes and
superconductor-multistrand-wires Nb$_{3}$Sn.
","[{""version"":""v1"",""created"":""Thu, 15 Dec 2011 02:27:04 GMT""}]","2015-06-03"
"1112.3413","Jesse Gell-Redman","Jesse Gell-Redman, Andrew Hassell","Potential scattering and the continuity of phase-shifts","10 pages, 2 figures. Corrections made following suggestions of
  referee. Acknowledgements added","Mathematical Research Letters, (3) 19 (2012), 719-729",,,"math.SP math.AP","http://arxiv.org/licenses/nonexclusive-distrib/1.0/","  Let $S(k)$ be the scattering matrix for a Schr\""odinger operator (Laplacian
plus potential) on $\RR^n$ with compactly supported smooth potential. It is
well known that $S(k)$ is unitary and that the spectrum of $S(k)$ accumulates
on the unit circle only at 1; moreover, $S(k)$ depends analytically on $k$ and
therefore its eigenvalues depend analytically on $k$ provided the values stay
away from 1.
  We give examples of smooth, compactly supported potentials on $\RR^n$ for
which (i) the scattering matrix $S(k)$ does not have 1 as an eigenvalue for any
$k > 0$, and (ii) there exists $k_0 > 0$ such that there is an analytic
eigenvalue branch $e^{2i\delta(k)}$ of S(k)$ converging to 1 as $k \downarrow
k_0$. This shows that the eigenvalues of the scattering matrix, as a function
of $k$, do not necessarily have continuous extensions to or across the value 1.
In particular this shows that a `micro-Levinson theorem' for non-central
potentials in $\RR^3$ claimed in a 1989 paper of R. Newton is incorrect.
","[{""version"":""v1"",""created"":""Thu, 15 Dec 2011 02:52:08 GMT""},{""version"":""v2"",""created"":""Thu, 15 Mar 2012 03:41:09 GMT""}]","2015-02-27"
"1112.3414","James Strohaber","J. Strohaber","Frame dragging with optical vortices","13 pages, 2 figures","Gen.Relatic.Gravit. 4 (2013) 2457-2465","10.1007/s10714-013-1596-8",,"gr-qc quant-ph","http://arxiv.org/licenses/nonexclusive-distrib/1.0/","  General Relativistic calculations in the linear regime have been made for
electromagnetic beams of radiation known as optical vortices. These exotic
beams of light carry a physical quantity known as optical orbital angular
momentum (OAM). It is found that when a massive spinning neutral particle is
placed along the optical axis, a phenomenon known as inertial frame dragging
occurs. Our results are compared with those found previously for a ring laser
and an order of magnitude estimate of the laser intensity needed for a
precession frequency of 1 Hz is given for these ""steady"" beams of light.
","[{""version"":""v1"",""created"":""Thu, 15 Dec 2011 03:10:18 GMT""},{""version"":""v2"",""created"":""Sat, 13 Oct 2012 00:18:50 GMT""}]","2016-05-03"
"1112.3415","Osman Yagan","Osman Yagan","Performance of the Eschenauer-Gligor key distribution scheme under an
  ON/OFF channel","Submitted to IEEE Transactions on Information Theory in November,
  2011","IEEE Transactions on Information Theory, Volume: 58, Issue: 6
  Pages: 3821-3835, June 2012","10.1109/TIT.2012.2189353",,"cs.IT math.CO math.IT","http://arxiv.org/licenses/nonexclusive-distrib/1.0/","  We investigate the secure connectivity of wireless sensor networks under the
random key distribution scheme of Eschenauer and Gligor. Unlike recent work
which was carried out under the assumption of full visibility, here we assume a
(simplified) communication model where unreliable wireless links are
represented as on/off channels. We present conditions on how to scale the model
parameters so that the network i) has no secure node which is isolated and ii)
is securely connected, both with high probability when the number of sensor
nodes becomes large. The results are given in the form of full zero-one laws,
and constitute the first complete analysis of the EG scheme under non-full
visibility. Through simulations these zero-one laws are shown to be valid also
under a more realistic communication model, i.e., the disk model. The relations
to the Gupta and Kumar's conjecture on the connectivity of geometric random
graphs with randomly deleted edges are also discussed.
","[{""version"":""v1"",""created"":""Thu, 15 Dec 2011 03:19:59 GMT""}]","2012-06-04"
"1112.3416","Assaf Naor","Manor Mendel and Assaf Naor","Ultrametric skeletons","typos fixed","Proc. Nat. Acad. Sci. vol. 110 no. 48, 19256-19262, 2013","10.1073/pnas.1202500109",,"math.MG math.FA math.PR","http://arxiv.org/licenses/nonexclusive-distrib/1.0/","  We prove that for every $\epsilon\in (0,1)$ there exists $C_\epsilon\in
(0,\infty)$ with the following property. If $(X,d)$ is a compact metric space
and $\mu$ is a Borel probability measure on $X$ then there exists a compact
subset $S\subseteq X$ that embeds into an ultrametric space with distortion
$O(1/\epsilon)$, and a probability measure $\nu$ supported on $S$ satisfying
$\nu(B_d(x,r))\le (\mu(B_d(x,C_\epsilon r))^{1-\epsilon}$ for all $x\in X$ and
$r\in (0,\infty)$. The dependence of the distortion on $\epsilon$ is sharp. We
discuss an extension of this statement to multiple measures, as well as how it
implies Talagrand's majorizing measures theorem.
","[{""version"":""v1"",""created"":""Thu, 15 Dec 2011 03:41:12 GMT""},{""version"":""v2"",""created"":""Sat, 17 Dec 2011 02:35:27 GMT""}]","2015-06-18"
"1112.3417","Jianjun Yao","Jian-Jun Yao, Wenwei Ge, Yaodong Yang, Yanxi Li, Jiefang Li, Peter
  Finkel and D.Viehland","Arrhenius-type domain growth in Pb(In1/2Nb1/2)O3-Pb(Mg1/3Nb2/3)O3-PbTiO3
  crystals","This paper has been withdrawn by the author due to the agreement from
  institute",,,,"cond-mat.mtrl-sci cond-mat.other","http://creativecommons.org/licenses/by/3.0/","  Single crystals of Pb(In1/2Nb1/2)O3-Pb(Mg1/3Nb2/3)O3-PbTiO3 (PIN-PMN-PT)
poled along [001] were investigated by dielectric, x-ray, and polarized light
(PLM) and piezo-force microscopy (PFM) methods. PLM revealed {100} macro-domain
plates that formed after poling, whose size increased on heating between room
temperature and a rhombohedral \rightarrow tetragonal phase transition, above
which point a break-up of the macro-domain plates was observed. Corresponding
PFM studies demonstrated that poling reduced the size of stripe-like domains
that were internal to the macro-domain plates, whose size also increased on
heating to TR-T. The temperature dependence of both the size of the
macro-domain plates and internal sub-domains followed the Arrhenius relation
with the activation energy of 0.4-0.5eV. The coercive field displays an
abnormal increase on heating below TR-T, different than that for PMN-PT. The
anomalously increased coercive field can be ascribed to the Arrhenius-type
domain growth, indicating a simple thermally activated process and an important
role of hierarchial domains in the improved performance of PIN-PMN-PT.
","[{""version"":""v1"",""created"":""Thu, 15 Dec 2011 04:00:24 GMT""},{""version"":""v2"",""created"":""Fri, 19 Apr 2013 13:21:19 GMT""},{""version"":""v3"",""created"":""Tue, 23 Apr 2013 22:51:41 GMT""}]","2013-04-25"
"1112.3418","Jianjun Yao","Jianjun Yao, Jiefang Li, D. Viehland, Yunfei Chang and Gary L. Messing","Aging associated domain evolution in the orthorhombic phase of <001>
  textured (K0.5Na0.5)Nb0.97Sb0.03O3 ceramics",,,"10.1063/1.3698154",,"cond-mat.mtrl-sci cond-mat.other","http://creativecommons.org/licenses/by/3.0/","  An aging effect due to a domain evolution in (K0.5,Na0.5)Nb0.97Sb0.03O3 <001>
textured ceramics was investigated by piezoresponse force microscopy. We find
that such an aging effect is pronounced in the orthorhombic single phase field.
A more uniform and finer domain structure was found with aging, which was
believed to originate from defect-migration. After poling, large domains with
smooth boundaries were found in the aged condition.
","[{""version"":""v1"",""created"":""Thu, 15 Dec 2011 04:04:22 GMT""}]","2015-06-03"
"1112.3419","Shu Chen","Zhihao Xu, Shu Chen","Wigner crystal induced by dipole-dipole interaction in one-dimensional
  optical lattices","5 pages, 5 figures","Phys. Rev. A 85, 033606 (2012)","10.1103/PhysRevA.85.033606",,"cond-mat.quant-gas quant-ph","http://arxiv.org/licenses/nonexclusive-distrib/1.0/","  We demonstrate that the static structure factor, momentum distribution and
density distribution provide clear signatures of the emergence of Wigner
crystal for the fermionic dipolar gas with strongly repulsive dipole-dipole
interactions trapped in one-dimensional optical lattices. Our numerical
evidences are based on the exact diagonalization of the microscopic effective
lattice Hamiltonian of few particles interacting with long-range interactions.
As a comparison, we also study the system with only nearest-neighbor
interactions, which displays quite different behaviors from the dipolar system
in the regime of strong repulsion.
","[{""version"":""v1"",""created"":""Thu, 15 Dec 2011 04:28:05 GMT""},{""version"":""v2"",""created"":""Fri, 17 Feb 2012 03:46:43 GMT""},{""version"":""v3"",""created"":""Mon, 5 Mar 2012 16:26:08 GMT""}]","2012-03-06"
"1112.3420","Xin-Qi Li","Yunshan Cao, Luting Xu, Jianyu Meng and Xin-Qi Li","Non-Markovian Transmission through Two Quantum Dots Connected by a
  Continuum",,"Phys. Lett. A 376, 2989-2993 (2012)","10.1016/j.physleta.2012.09.014",,"cond-mat.mes-hall","http://arxiv.org/licenses/nonexclusive-distrib/1.0/","  We consider a transport setup containing a double-dot connected by a
continuum. Via an exact solution of the time-dependent Schr\""odinger equation,
we demonstrate a highly non-Markovian quantum-coherence-mediated transport
through this dot-continuum-dot (DCD) system, which is in contrast with the
common premise since in typical case a quantum particle does not reenter the
system of interest once it irreversibly decayed into a continuum (such as the
spontaneous emission of a photon). We also find that this DCD system supports
an unusual steady state with unequal source and drain currents, owing to
electrons irreversibly entering the continuum and floating there.
","[{""version"":""v1"",""created"":""Thu, 15 Dec 2011 04:43:47 GMT""},{""version"":""v2"",""created"":""Thu, 8 Mar 2012 05:51:40 GMT""}]","2013-12-16"
