"1104.4379","Rajkumar Buyya","Rajkumar Buyya and Karthik Sukumar","Platforms for Building and Deploying Applications for Cloud Computing","6 pages, 4 figures","CSI Communications, Vol.35, No. 1, Pages: 6-11, 2011",,,"cs.DC","http://arxiv.org/licenses/nonexclusive-distrib/1.0/","  Cloud computing is rapidly emerging as a new paradigm for delivering IT
services as utlity-oriented services on subscription-basis. The rapid
development of applications and their deployment in Cloud computing
environments in efficient manner is a complex task. In this article, we give a
brief introduction to Cloud computing technology and Platform as a Service, we
examine the offerings in this category, and provide the basis for helping
readers to understand basic application platform opportunities in Cloud by
technologies such as Microsoft Azure, Sales Force, Google App, and Aneka for
Cloud computing. We demonstrate that Manjrasoft Aneka is a Cloud Application
Platform (CAP) leveraging these concepts and allowing an easy development of
Cloud ready applications on a Private/Public/Hybrid Cloud. Aneka CAP offers
facilities for quickly developing Cloud applications and a modular platform
where additional services can be easily integrated to extend the system
capabilities, thus being at pace with the rapidly evolution of Cloud computing.
","[{""version"":""v1"",""created"":""Fri, 22 Apr 2011 02:51:54 GMT""}]","2011-04-25"
"1104.4380","Daniel Rockmore","N. Foti, S. Pauls, Daniel N. Rockmore","Stability of the World Trade Web over Time - An Extinction Analysis","20 pages, 6 Figures, 3 Tables",,,,"q-fin.GN physics.soc-ph","http://arxiv.org/licenses/nonexclusive-distrib/1.0/","  The World Trade Web (WTW) is a weighted network whose nodes correspond to
countries with edge weights reflecting the value of imports and/or exports
between countries. In this paper we introduce to this macroeconomic system the
notion of extinction analysis, a technique often used in the analysis of
ecosystems, for the purposes of investigating the robustness of this network.
In particular, we subject the WTW to a principled set of in silico ""knockout
experiments,"" akin to those carried out in the investigation of food webs, but
suitably adapted to this macroeconomic network. Broadly, our experiments show
that over time the WTW moves to a ""robust yet fragile"" configuration where it
is robust to random failures but fragile under targeted attack. This change in
stability is highly correlated with the connectance (edge density) of the
network. Moreover, there is evidence of a sharp change in the structure of the
network in the 1960s and 1970s, where most measures of robustness rapidly
increase before resuming a declining trend. We interpret these results in the
context in the post-World War II move towards globalization. Globalization
coincides with the sharp increase in robustness but also with a rise in those
measures (e.g., connectance and trade imbalances) which correlate with
decreases in robustness. The peak of robustness is reached after the onset of
globalization policy but before the negative impacts are substantial. These
analyses depend on a simple model of dynamics that rebalances the trade flow
upon network perturbation, the most dramatic of which is node deletion. More
subtle and textured forms of perturbation lead to the definition of other
measures of node importance as well as vulnerability. We anticipate that
experiments and measures like these can play an important role in the
evaluation of the stability of economic systems.
","[{""version"":""v1"",""created"":""Fri, 22 Apr 2011 03:02:07 GMT""},{""version"":""v2"",""created"":""Wed, 18 May 2011 10:42:28 GMT""}]","2015-03-19"
"1104.4381","Yanguang Chen","Yanguang Chen","Unraveling the Rank-Size Rule with Self-Similar Hierarchies","22 pages, 5 figures, 2 tables",,,,"physics.soc-ph cs.SI","http://creativecommons.org/licenses/by/3.0/","  Many scientists are interested in but puzzled by the various inverse power
laws with a negative exponent 1 such as the rank-size rule. The rank-size rule
is a very simple scaling law followed by many observations of the ubiquitous
empirical patterns in physical and social systems. Where there is a rank-size
distribution, there will be a hierarchy with cascade structure. However, the
equivalence relation between the rank-size rule and the hierarchical scaling
law remains to be mathematically demonstrated and empirically testified. In
this paper, theoretical derivation, mathematical experiments, and empirical
analysis are employed to show that the rank-size rule is equivalent in theory
to the hierarchical scaling law (the Nn principle). Abstracting an ordered set
of quantities in the form {1, 1/2,..., 1/k,...} from the rank-size rule, I
prove a geometric subdivision theorem of the harmonic sequence (k=1, 2, 3,...).
By the theorem, the rank-size distribution can be transformed into a
self-similar hierarchy, thus a power law can be decomposed as a pair of
exponential laws, and further the rank-size power law can be reconstructed as a
hierarchical scaling law. A number of ubiquitous empirical observations and
rules, including Zipf's law, Pareto's distribution, fractals, allometric
scaling, 1/f noise, can be unified into the hierarchical framework. The
self-similar hierarchy can provide us with a new perspective of looking at the
inverse power law of nature or even how nature works.
","[{""version"":""v1"",""created"":""Fri, 22 Apr 2011 03:23:27 GMT""}]","2011-04-25"
"1104.4382","Mingjing Zhao","Ming-Jing Zhao, Zong-Guo Li, Shao-Ming Fei, Zhi-Xi Wang and Xianqing
  Li-Jost","Faithful teleportation with arbitrary pure or mixed resource states","9 pages","J. Phys. A: Math. Theor. 44 (2011) 215302","10.1088/1751-8113/44/21/215302",,"quant-ph","http://arxiv.org/licenses/nonexclusive-distrib/1.0/","  We study faithful teleportation systematically with arbitrary entangled
states as resources. The necessary conditions of mixed states to complete
perfect teleportation are proved. Based on these results, the necessary and
sufficient conditions of faithful teleportation of an unknown state |\phi> in
C^d with an entangled resource {\rho} in C^m \otimes C^d and C^d \otimes C^n
are derived. It is shown that for {\rho} in C^m\otimesC^d, {\rho} must be a
maximally entangled state, while for {\rho} in C^d \otimes C^n, {\rho} must be
a puremaximally entangled state. Moreover, we show that the sender's
measurements must be all projectors of maximally entangled pure states. The
relations between the entanglement of the formation of the resource states and
faithful teleportation are also discussed.
","[{""version"":""v1"",""created"":""Fri, 22 Apr 2011 03:26:39 GMT""}]","2015-05-27"
"1104.4383","Jia Chen","Jia Chen, Xifan Wu, Annabella Selloni","Electronic structure and bonding properties of cobalt oxide in the
  spinel structure","24 pages, 8 figures",,"10.1103/PhysRevB.83.245204",,"cond-mat.mtrl-sci","http://arxiv.org/licenses/nonexclusive-distrib/1.0/","  The spinel cobalt oxide Co3O4 is a magnetic semiconductor containing cobalt
ions in Co2+ and Co3+ oxidation states. We have studied the electronic,
magnetic and bonding properties of Co3O4 using density functional theory (DFT)
at the Generalized Gradient Approximation (GGA), GGA+U, and PBE0 hybrid
functional levels. The GGA correctly predicts Co3O4 to be a semiconductor, but
severely underestimates the band gap. The GGA+U band gap (1.96 eV) agrees well
with the available experimental value (~ 1.6 eV), whereas the band gap obtained
using the PBE0 hybrid functional (3.42 eV) is strongly overestimated. All the
employed exchange-correlation functionals predict 3 unpaired d electrons on the
Co2+ ions, in agreement with crystal field theory, but the values of the
magnetic moments given by GGA+U and PBE0 are in closer agreement with the
experiment than the GGA value, indicating a better description of the cobalt
localized d states. Bonding properties are studied by means of Maximally
Localized Wannier Functions (MLWFs). We find d-type MLWFs on the cobalt ions,
as well as Wannier functions with the character of sp3d bonds between cobalt
and oxygen ions. Such hybridized bonding states indicate the presence of a
small covalent component in the primarily ionic bonding mechanism of this
compound.
","[{""version"":""v1"",""created"":""Fri, 22 Apr 2011 03:31:39 GMT""}]","2015-05-27"
"1104.4384","Nitin Gupta","Nitin Gupta","EMBANKS: Towards Disk Based Algorithms For Keyword-Search In Structured
  Databases","45 pages, 15 figures, Bachelors Thesis submission to IIT Bombay",,,,"cs.DB","http://arxiv.org/licenses/nonexclusive-distrib/1.0/","  In recent years, there has been a lot of interest in the field of keyword
querying relational databases. A variety of systems such as DBXplorer [ACD02],
Discover [HP02] and ObjectRank [BHP04] have been proposed. Another such system
is BANKS, which enables data and schema browsing together with keyword-based
search for relational databases. It models tuples as nodes in a graph,
connected by links induced by foreign key and other relationships. The size of
the database graph that BANKS uses is proportional to the sum of the number of
nodes and edges in the graph. Systems such as SPIN, which search on Personal
Information Networks and use BANKS as the backend, maintain a lot of
information about the users' data. Since these systems run on the user
workstation which have other demands of memory, such a heavy use of memory is
unreasonable and if possible, should be avoided. In order to alleviate this
problem, we introduce EMBANKS (acronym for External Memory BANKS), a framework
for an optimized disk-based BANKS system. The complexity of this framework
poses many questions, some of which we try to answer in this thesis. We
demonstrate that the cluster representation proposed in EMBANKS enables
in-memory processing of very large database graphs. We also present detailed
experiments that show that EMBANKS can significantly reduce database load time
and query execution times when compared to the original BANKS algorithms.
","[{""version"":""v1"",""created"":""Fri, 22 Apr 2011 03:49:09 GMT""}]","2011-04-25"
"1104.4385","Nikhil Rao","Nikhil S Rao, Robert D. Nowak, Stephen J. Wright and Nick G. Kingsbury","Convex Approaches to Model Wavelet Sparsity Patterns",,,,,"cs.CV stat.ML","http://arxiv.org/licenses/nonexclusive-distrib/1.0/","  Statistical dependencies among wavelet coefficients are commonly represented
by graphical models such as hidden Markov trees(HMTs). However, in linear
inverse problems such as deconvolution, tomography, and compressed sensing, the
presence of a sensing or observation matrix produces a linear mixing of the
simple Markovian dependency structure. This leads to reconstruction problems
that are non-convex optimizations. Past work has dealt with this issue by
resorting to greedy or suboptimal iterative reconstruction methods. In this
paper, we propose new modeling approaches based on group-sparsity penalties
that leads to convex optimizations that can be solved exactly and efficiently.
We show that the methods we develop perform significantly better in
deconvolution and compressed sensing applications, while being as
computationally efficient as standard coefficient-wise approaches such as
lasso.
","[{""version"":""v1"",""created"":""Fri, 22 Apr 2011 04:35:29 GMT""}]","2015-03-19"
"1104.4386","Taotao  Qiu","Taotao Qiu, Debaprasad Maity","Higgs Inflation in Horava-Lifshitz Gravity","5 pages, 1 figure",,,,"hep-th astro-ph.CO astro-ph.HE gr-qc hep-ph","http://arxiv.org/licenses/nonexclusive-distrib/1.0/","  We study the possibility of standard model Higgs boson acting as an inflaton
field in the framework of Horava-Lifshitz Gravity. Under this framework, we
showed that it is possible for the Higgs field to produce right amount of
inflation and generate scale invariant power spectrum with the correct
experimental value. Thanks to the foliation preserving diffeomorphism and
anisotropic space-time scaling, it essentially helps us to construct this model
without the pre-existing inconsistency coming from cosmological and particle
physics constraints. We do not need to introduce any non-minimal or higher
derivative coupling term in an arbitrary basis either.
","[{""version"":""v1"",""created"":""Fri, 22 Apr 2011 05:28:33 GMT""}]","2011-04-25"
"1104.4387","Tom Pugh","P. S. Howe, T. G. Pugh, K. S. Stelle and C. Strickland-Constable","Ectoplasm with an Edge","25 pages","JHEP 1108:081,2011","10.1007/JHEP08(2011)081","KCL-MTH-11-09, Imperial/TP/11/KSS/01, NSF-KITP-11-054","hep-th","http://arxiv.org/licenses/nonexclusive-distrib/1.0/","  The construction of supersymmetric invariant actions on a spacetime manifold
with a boundary is carried out using the ""ectoplasm"" formalism for the
construction of closed forms in superspace. Non-trivial actions are obtained
from the pull-backs to the bosonic bodies of closed but non-exact forms in
superspace; finding supersymmetric invariants thus becomes a cohomology
problem. For a spacetime with a boundary, the appropriate mathematical language
changes to relative cohomology, which we use to give a general formulation of
off-shell supersymmetric invariants in the presence of boundaries. We also
relate this construction to the superembedding formalism for the construction
of brane actions, and we give examples with bulk spacetimes of dimension 3, 4
and 5. The closed superform in the 5D example needs to be constructed as a
Chern-Simons type of invariant, obtained from a closed 6-form displaying Weil
triviality.
","[{""version"":""v1"",""created"":""Fri, 22 Apr 2011 05:54:40 GMT""}]","2011-08-25"
"1104.4388","Igor Medved'","Igor Medved' and Anton Trn\'ik","Collective surface diffusion near a first-order phase transition","9 pages, 4 figures","Phys. Rev. B 83 (2011) 233406","10.1103/PhysRevB.83.233406",,"cond-mat.stat-mech","http://arxiv.org/licenses/nonexclusive-distrib/1.0/","  For a large class of lattice models we study the thermodynamic factor,
$\Phi$, of the collective surface diffusion coefficient near a first-order
phase transition between two phases at low temperatures. In a two-phase regime
its dependence on the coverage, $\te$, is $\Phi \approx \te/[(\te-\te_-)(\te_+
- \te)N]$, where $N$ is the number of adsorption sites and $\te_\pm$ are the
single-phase coverages at the transition. In the crossover between the
two-phase and single-phase regimes $\Phi(\te)$ is shown to have a more complex
behavior. The results are applied to a simple 2D lattice model.
","[{""version"":""v1"",""created"":""Fri, 22 Apr 2011 05:55:17 GMT""}]","2015-05-27"
"1104.4389","Jos\'{e} E. Figueroa-L\'{o}pez","Jos\'e E. Figueroa-L\'opez","Sieve-based confidence intervals and bands for L\'{e}vy densities","Published in at http://dx.doi.org/10.3150/10-BEJ286 the Bernoulli
  (http://isi.cbs.nl/bernoulli/) by the International Statistical
  Institute/Bernoulli Society (http://isi.cbs.nl/BS/bshome.htm)","Bernoulli 2011, Vol. 17, No. 2, 643-670","10.3150/10-BEJ286","IMS-BEJ-BEJ286","math.ST stat.TH","http://arxiv.org/licenses/nonexclusive-distrib/1.0/","  The estimation of the L\'{e}vy density, the infinite-dimensional parameter
controlling the jump dynamics of a L\'{e}vy process, is considered here under a
discrete-sampling scheme. In this setting, the jumps are latent variables, the
statistical properties of which can be assessed when the frequency and time
horizon of observations increase to infinity at suitable rates. Nonparametric
estimators for the L\'{e}vy density based on Grenander's method of sieves was
proposed in Figueroa-L\'{o}pez [IMS Lecture Notes 57 (2009) 117--146]. In this
paper, central limit theorems for these sieve estimators, both pointwise and
uniform on an interval away from the origin, are obtained, leading to pointwise
confidence intervals and bands for the L\'{e}vy density. In the pointwise case,
our estimators converge to the L\'{e}vy density at a rate that is arbitrarily
close to the rate of the minimax risk of estimation on smooth L\'{e}vy
densities. In the case of uniform bands and discrete regular sampling, our
results are consistent with the case of density estimation, achieving a rate of
order arbitrarily close to $\log^{-1/2}(n)\cdot n^{-1/3}$, where $n$ is the
number of observations. The convergence rates are valid, provided that $s$ is
smooth enough and that the time horizon $T_n$ and the dimension of the sieve
are appropriately chosen in terms of $n$.
","[{""version"":""v1"",""created"":""Fri, 22 Apr 2011 06:07:28 GMT""}]","2011-04-25"
"1104.4390","Shota Ono","Shota Ono and Hiroyuki Shima","Flexible control of the Peierls transition in metallic C$_{60}$ polymers","3 pages, 3 figures",,"10.1209/0295-5075/96/27011",,"cond-mat.mes-hall","http://arxiv.org/licenses/nonexclusive-distrib/1.0/","  The metal-semiconductor transition of peanut-shaped fullerene (C$_{60}$)
polymers is clarified by considering the electron-phonon coupling in the uneven
structure of the polymers. We established a theory that accounts for the
transition temperature $T_c$ reported in a recent experiment and also suggests
that $T_c$ is considerably lowered by electron doping or prolonged irradiation
during synthesis. The decrease in $T_c$ is an appealing phenomenon with regard
to realizing high-conductivity C$_{60}$-based nanowires even at low
temperatures.
","[{""version"":""v1"",""created"":""Fri, 22 Apr 2011 06:13:16 GMT""}]","2015-05-27"
"1104.4391","Joshua C. Long","Y. J. Kim, C.-Y. Liu, S. K. Lamoreaux, G. Visser, B. Kunkler, A. N.
  Matlashov, J. C. Long, and T. G. Reddy","New Experimental Limit on the Electric Dipole Moment of the Electron in
  a Paramagnetic Insulator","9 pages, 9 figures, Revtex 4.1","Phys. Rev. D 91 102004 (2015)","10.1103/PhysRevD.91.102004",,"nucl-ex cond-mat.other physics.atom-ph","http://arxiv.org/licenses/nonexclusive-distrib/1.0/","  We report results of an experimental search for the intrinsic Electric Dipole
Moment (EDM) of the electron using a solid-state technique. The experiment
employs a paramagnetic, insulating gadolinium gallium garnet (GGG) that has a
large magnetic response at low temperatures. The presence of the eEDM would
lead to a small but non-zero magnetization as the GGG sample is subject to a
strong electric field. We search for the resulting Stark-induced magnetization
with a sensitive magnetometer. Recent progress on the suppression of several
sources of background allows the experiment to run free of spurious signals at
the level of the statistical uncertainties. We report our first limit on the
eEDM of $(-5.57 \pm 7.98 \pm 0.12)\times$10$^{-25}$e$\cdot$cm with 5 days of
data averaging.
","[{""version"":""v1"",""created"":""Fri, 22 Apr 2011 06:16:14 GMT""},{""version"":""v2"",""created"":""Mon, 1 Jun 2015 22:02:18 GMT""}]","2015-06-03"
"1104.4392","Michel Breger","Michel Breger","Rotational modulation in RRs/Delta Scuti Star pulsation","To appear in the Carnegie Observatories Astrophysics Series, Volume 5",,,,"astro-ph.SR","http://arxiv.org/licenses/nonexclusive-distrib/1.0/","  The 76 frequencies determined from Kepler measurements of the A-type star KIC
9700322 can be understood in a rather simple way as the radial fundamental and
first overtone radial modes, a nonradial \ell = 2 quintuplet, stellar rotation
and combinations of all of these. Two low-frequency peaks are found: f=0.160
c/d and a 2f peak. We show from a variety of arguments that the low-frequency
peak, f, (rather than the 2f peak) is the rotational frequency. The
corresponding prediction of slow rotation is confirmed by a spectrum from which
v sin i = 19 \pm 1 km/s is obtained. During rotation, the brightness changes by
0.5 ppt (parts-per-thousand, peak-to-peak). The rotation also modulates the
amplitudes of the two radial modes, leading to a small (but definite) variation
in amplitude of 0.5% of their average values. Both the rotational brightness
variations and the pulsation amplitudes form a double wave during rotation. The
variations are in phase. The maximum pulsation amplitude occurs at the
rotational phase with minimum brightness. Consequently, the 'normal' star KIC
9700322 behaves such as an extremely weak chemically peculiar star. Since such
variations are also seen in some other A stars studied by Kepler, normal stars
with a symmetric surface may not exist. The significance of this star is that
even a simple, slowly rotating, radial pulsator already shows rotational
brightness variations and modulation of the pulsation amplitude.
","[{""version"":""v1"",""created"":""Fri, 22 Apr 2011 06:28:17 GMT""}]","2015-03-19"
"1104.4393","Saskia Hekker","S. Hekker and S. Basu and D. Stello and T. Kallinger and F. Grundahl
  and S. Mathur and R.A. Garcia and B. Mosser and D. Huber and T.R. Bedding and
  R. Szabo and J. De Ridder and W.J. Chaplin and Y. Elsworth and S.J. Hale and
  J. Christensen-Dalsgaard and R.L. Gilliland and M. Still and S. McCauliff and
  E.V. Quintana","Asteroseismic inferences on red giants in open clusters NGC 6791, NGC
  6819 and NGC 6811 using Kepler","Accepted for publication in Astronomy and Astrophysics, 9 pages, 6
  figures and 3 tables",,"10.1051/0004-6361/201016303",,"astro-ph.SR","http://arxiv.org/licenses/nonexclusive-distrib/1.0/","  Context: Four open clusters are present in the Kepler field of view and
timeseries of nearly a year in length are now available. These timeseries allow
us to derive asteroseismic global oscillation parameters of red-giant stars in
the three open clusters NGC 6791, NGC 6819 and NGC 6811. From these parameters
and effective temperatures, we derive mass, radii and luminosities for the
clusters as well as field red giants. Aims: We study the influence of evolution
and metallicity on the observed red-giant populations. Methods: The global
oscillation parameters are derived using different published methods and the
effective temperatures are derived from 2MASS colours. The observational
results are compared with BaSTI evolution models. Results: We find that the
mass has significant influence on the asteroseismic quantities delta_nu vs.
nu_max relation, while the influence of metallicity is negligible, under the
assumption that the metallicity does not affect the excitation / damping of the
oscillations. The positions of the stars in the H-R diagram depend on both mass
and metallicity. Furthermore, the stellar masses derived for the field stars
are bracketed by those of the cluster stars. Conclusions: Both the mass and
metallicity contribute to the observed difference in locations in the H-R
diagram of the old metal-rich cluster NGC 6791 and the middle-aged
solar-metallicity cluster NGC 6819. For the young cluster NGC 6811, the
explanation of the position of the stars in the H-R diagram challenges the
assumption of solar metallicity, and this open cluster might have significantly
lower metallicity [Fe/H] in the range -0.3 to -0.7 dex. Also, nearly all the
observed field stars seem to be older than NGC 6811 and younger than NGC 6791.
","[{""version"":""v1"",""created"":""Fri, 22 Apr 2011 06:33:32 GMT""}]","2015-05-27"
"1104.4394","Shin-ichiro Okumura","Shin-ichiro Okumura, Takuya Yamashita, Shigeyuki Sako, Takashi Miyata,
  Mitsuhiko Honda, Hirokazu Kataza, Yoshiko K. Okamoto","Physical Relation of Source I to IRc2 in the Orion KL Region","20 pages, 11 figures. Minor corrections had been done in the ver.2.
  Accepted for publication in PASJ",,"10.1093/pasj/63.4.823",,"astro-ph.GA astro-ph.SR","http://arxiv.org/licenses/nonexclusive-distrib/1.0/","  We present mid-infrared narrow-band images of the Orion BN/KL region, and
N-band low-resolution spectra of IRc2 and the nearby radio source ""I."" The
distributions of the silicate absorption strength and the color temperature
have been revealed with a sub-arcsecond resolution. The detailed structure of
the 7.8 micron/12.4 micron color temperature distribution was resolved in the
vicinity of IRc2. A mid-infrared counterpart to source I has been detected as a
large color temperature peak. The color temperature distribution shows an
increasing gradient from IRc2 toward source I, and no dominant temperature peak
is seen at IRc2. The spectral energy distribution of IRc2 could be fitted by a
two-temperature component model, and the ""warmer component"" of the infrared
emission from IRc2 could be reproduced by scattering of radiation from source
I. IRc2 itself is not self-luminous, but is illuminated and heated by an
embedded luminous young stellar object located at source I.
","[{""version"":""v1"",""created"":""Fri, 22 Apr 2011 06:42:45 GMT""},{""version"":""v2"",""created"":""Sat, 25 Jun 2011 15:27:05 GMT""}]","2015-05-27"
"1104.4395","Wojciech Matysiak","Krzysztof Dro\.zd\.zewicz and Wojciech Matysiak","Moments and $q$-commutators of noncommutative random vectors","14 pages, 1 figure",,,,"math.PR","http://arxiv.org/licenses/nonexclusive-distrib/1.0/","  A method for computing the mixed moments of (not necessarily commutative)
random vectors from the first order moments, the $q$-commutators between the
annihilation and creation operators, and the $q$-commutators between the
annihilation and preservation operators, is presented. The method is
illustrated by a relevant characterization of $q$-Gaussian vectors.
","[{""version"":""v1"",""created"":""Fri, 22 Apr 2011 06:43:34 GMT""},{""version"":""v2"",""created"":""Mon, 12 Sep 2011 10:28:16 GMT""}]","2011-09-13"
