"1104.4416","Guyan Robertson","Oliver King and Guyan Robertson","On the K-theory of boundary $C^*$-algebras of $\widetilde A_2$ groups",,"J. K-theory, 9 (2012), 521-536",,,"math.KT math.GR","http://arxiv.org/licenses/nonexclusive-distrib/1.0/","  Let $\Gamma$ be an $\widetilde A_2$ subgroup of $\PGL_3(\mathbb K)$, where
$\mathbb K$ is a local field with residue field of order $q$. The module of
coinvariants $C(\mathbb P^2_{\mathbb K},\mathbb Z)_{\Gamma}$ is shown to be
finite, where $\mathbb P^2_{\mathbb K}$ is the projective plane over $\mathbb
K$. If the group $\Gamma$ is of Tits type and if $q \not\equiv 1 \pmod {3}$
then the exact value of the order of the class $[I]_{K_0}$ in the K-theory of
the (full) crossed product $C^*$-algebra $C(\Omega)\rtimes\Gamma$ is
determined, where $\Omega$ is the Furstenberg boundary of $\PGL_3(\mathbb K)$.
For groups of Tits type, this verifies a conjecture of G. Robertson and T.
Steger.
","[{""version"":""v1"",""created"":""Fri, 22 Apr 2011 10:21:43 GMT""}]","2013-02-25"
"1104.4417","Roberto Benzi","Roberto Benzi, Jean-Francois Pinton","Stochastic Resonance in a simple model of magnetic reversals","6 pages",,"10.1142/S0218127411030684",,"nlin.CD","http://arxiv.org/licenses/nonexclusive-distrib/1.0/","  We discuss the effect of stochastic resonance in a simple model of magnetic
reversals. The model exhibits statistically stationary solutions and bimodal
distribution of the large scale magnetic field. We observe a non trivial
amplification of stochastic resonance induced by turbulent fluctuations, i.e.
the amplitude of the external periodic perturbation needed for stochastic
resonance to occur is much smaller than the one estimated by the equilibrium
probability distribution of the unperturbed system. We argue that similar
amplifications can be observed in many physical systems where turbulent
fluctuations are needed to maintain large scale equilibria.
","[{""version"":""v1"",""created"":""Fri, 22 Apr 2011 10:29:11 GMT""}]","2015-05-27"
"1104.4418","Lionel Tabourier","Oussama Allali, Lionel Tabourier, Cl\'emence Magnien and Matthieu
  Latapy","Internal links and pairs as a new tool for the analysis of bipartite
  complex networks",,,,,"cs.SI physics.soc-ph","http://arxiv.org/licenses/nonexclusive-distrib/1.0/","  Many real-world complex networks are best modeled as bipartite (or 2-mode)
graphs, where nodes are divided into two sets with links connecting one side to
the other. However, there is currently a lack of methods to analyze properly
such graphs as most existing measures and methods are suited to classical
graphs. A usual but limited approach consists in deriving 1-mode graphs (called
projections) from the underlying bipartite structure, though it causes
important loss of information and data storage issues. We introduce here
internal links and pairs as a new notion useful for such analysis: it gives
insights on the information lost by projecting the bipartite graph. We
illustrate the relevance of theses concepts on several real-world instances
illustrating how it enables to discriminate behaviors among various cases when
we compare them to a benchmark of random networks. Then, we show that we can
draw benefit from this concept for both modeling complex networks and storing
them in a compact format.
","[{""version"":""v1"",""created"":""Fri, 22 Apr 2011 10:38:48 GMT""},{""version"":""v2"",""created"":""Thu, 27 Oct 2011 16:31:49 GMT""}]","2011-10-28"
"1104.4419","Zolt\'an K\'asa","Antal Iv\'anyi, Imre K\'atai","Testing of random matrices",,"Acta Universitatis Sapientiae, Informatica, 3, 1 (2011) 99--126",,,"cs.DM","http://arxiv.org/licenses/nonexclusive-distrib/1.0/","  Let $n$ be a positive integer and $X = [x_{ij}]_{1 \leq i, j \leq n}$ be an
$n \times n$\linebreak \noindent sized matrix of independent random variables
having joint uniform distribution $$\hbox{Pr} {x_{ij} = k \hbox{for} 1 \leq k
\leq n} = \frac{1}{n} \quad (1 \leq i, j \leq n) \koz. $$ A realization
$\mathcal{M} = [m_{ij}]$ of $X$ is called \textit{good}, if its each row and
each column contains a permutation of the numbers $1, 2,..., n$. We present and
analyse four typical algorithms which decide whether a given realization is
good.
","[{""version"":""v1"",""created"":""Fri, 22 Apr 2011 11:14:11 GMT""}]","2011-04-25"
"1104.4420","Piotr Boguslawski","O. Volnianska and P. Boguslawski","High spin states of cation vacancies in GaP, GaN, AlN, BN, ZnO and BeO:
  A first principles study","9 pages, 5 figures",,"10.1103/PhysRevB.83.205205",,"cond-mat.mtrl-sci","http://arxiv.org/licenses/nonexclusive-distrib/1.0/","  High spin states of cation vacancies in GaP, GaN, AlN, BN, ZnO and BeO were
analyzed by first principles calculations. The spin-polarized vacancy-induced
level is located in the band gap in GaP, ZnO and BeO. In the nitrides, the
stronger exchange coupling forces the vacancy states to be resonant with
valence bands, forbids formation of positively charged vacancies in GaN and BN,
and allows Al vacancy in p-AlN to assume the highest possible S=2 spin state.
The shape of the spin density, isotropic in the zinc blende structure, has a
pronounced directional character in the wurtzite structure. Stability of spin
polarization of the vacancy states is determined by spin polarization energies
of anions, as well as by interatomic distances between the vacancy neighbors,
and thus is given by both the lattice constant of the host and the atomic
relaxations around the vacancy. Implications for experiment are discussed.
","[{""version"":""v1"",""created"":""Fri, 22 Apr 2011 11:23:08 GMT""}]","2015-05-27"
"1104.4421","Marc Peter Westig","M.P. Westig, R. Engels, K. Grigoryev, M. Mikirtytchiants, F. Rathmann,
  H. Paetz gen. Schieck, G. Schug, A. Vasilyev and H. Str\""oher","Hydrogen Spectroscopy with a Lamb-shift Polarimeter - An Alternative
  Approach Towards Anti-Hydrogen Spectroscopy Experiments","6 pages, 7 figures, accepted by European Physical Journal D","Eur.Phys.J.D57:27-32,2010","10.1140/epjd/e2010-00016-9",,"physics.atom-ph","http://arxiv.org/licenses/nonexclusive-distrib/1.0/","  A Lamb-shift polarimeter, which has been built for a fast determination of
the polarization of protons and deuterons of an atomic-beam source and which is
frequently used in the ANKE experiment at COSY-J\""ulich, is shown to be an
excellent device for atomic-spectroscopy measurements of metastable hydrogen
isotopes. It is demonstrated that magnetic and electric dipole transitions in
hydrogen can be measured as a function of the external magnetic field, giving
access to the full Breit-Rabi diagram for the $2^2S_{1/2}$ and the $2^2P_{1/2}$
states. This will allow the study of hyperfine structure, $g$ factors and the
classical Lamb shift. Although the data are not yet competitive with
state-of-the-art measurements, the potential of the method is enormous,
including a possible application to anti-hydrogen spectroscopy.
","[{""version"":""v1"",""created"":""Fri, 22 Apr 2011 11:55:43 GMT""}]","2011-05-12"
"1104.4422","Suvrit Sra","Suvrit Sra, Dmitrii Karp","The Multivariate Watson Distribution: Maximum-Likelihood Estimation and
  other Aspects","24 pages; extensively updated numerical results",,,,"stat.CO math.CA","http://arxiv.org/licenses/nonexclusive-distrib/1.0/","  This paper studies fundamental aspects of modelling data using multivariate
Watson distributions. Although these distributions are natural for modelling
axially symmetric data (i.e., unit vectors where $\pm \x$ are equivalent), for
high-dimensions using them can be difficult. Why so? Largely because for Watson
distributions even basic tasks such as maximum-likelihood are numerically
challenging. To tackle the numerical difficulties some approximations have been
derived---but these are either grossly inaccurate in high-dimensions
(\emph{Directional Statistics}, Mardia & Jupp. 2000) or when reasonably
accurate (\emph{J. Machine Learning Research, W. & C.P., v2}, Bijral \emph{et
al.}, 2007, pp. 35--42), they lack theoretical justification. We derive new
approximations to the maximum-likelihood estimates; our approximations are
theoretically well-defined, numerically accurate, and easy to compute. We build
on our parameter estimation and discuss mixture-modelling with Watson
distributions; here we uncover a hitherto unknown connection to the
""diametrical clustering"" algorithm of Dhillon \emph{et al.}
(\emph{Bioinformatics}, 19(13), 2003, pp. 1612--1619).
","[{""version"":""v1"",""created"":""Fri, 22 Apr 2011 11:55:52 GMT""},{""version"":""v2"",""created"":""Fri, 25 May 2012 16:06:20 GMT""}]","2012-05-28"
"1104.4423","Ioannis Caragiannis","John Augustine, Ioannis Caragiannis, Angelo Fanelli, Christos
  Kalaitzis","Enforcing efficient equilibria in network design games via subsidies","30 pages, 7 figures",,,,"cs.GT cs.CC","http://arxiv.org/licenses/nonexclusive-distrib/1.0/","  The efficient design of networks has been an important engineering task that
involves challenging combinatorial optimization problems. Typically, a network
designer has to select among several alternatives which links to establish so
that the resulting network satisfies a given set of connectivity requirements
and the cost of establishing the network links is as low as possible. The
Minimum Spanning Tree problem, which is well-understood, is a nice example.
  In this paper, we consider the natural scenario in which the connectivity
requirements are posed by selfish users who have agreed to share the cost of
the network to be established according to a well-defined rule. The design
proposed by the network designer should now be consistent not only with the
connectivity requirements but also with the selfishness of the users.
Essentially, the users are players in a so-called network design game and the
network designer has to propose a design that is an equilibrium for this game.
As it is usually the case when selfishness comes into play, such equilibria may
be suboptimal. In this paper, we consider the following question: can the
network designer enforce particular designs as equilibria or guarantee that
efficient designs are consistent with users' selfishness by appropriately
subsidizing some of the network links? In an attempt to understand this
question, we formulate corresponding optimization problems and present positive
and negative results.
","[{""version"":""v1"",""created"":""Fri, 22 Apr 2011 12:00:10 GMT""},{""version"":""v2"",""created"":""Mon, 11 Jul 2011 16:56:48 GMT""}]","2011-07-12"
"1104.4424","Zolt\'an K\'asa","Zolt\'an K\'asa","Super-d-complexity of finite words",,"8th Joint Conf. on Math. and Comp. Sci. July 14--17, 2010,
  Kom\'arno, Slovakia, Selected papers, 2011. pp. 251--261",,,"cs.DM","http://arxiv.org/licenses/nonexclusive-distrib/1.0/","  In this paper we introduce and study a new complexity measure for finite
words. For positive integer $d$ special scattered subwords, called
super-$d$-subwords, in which the gaps are of length at least $(d-1)$, are
defined. We give methods to compute super-$d$-complexity (the total number of
different super-$d$-subwords) in the case of rainbow words (with pairwise
different letters) by recursive algorithms, by mahematical formulas and by
graph algorithms. In the case of general words, with letters from a given
alphabet without any restriction, the problem of the maximum value of the
super-$d$-complexity of all words of length $n$ is presented.
","[{""version"":""v1"",""created"":""Fri, 22 Apr 2011 12:02:59 GMT""}]","2011-04-25"
"1104.4425","Zolt\'an K\'asa","Zolt\'an K\'asa","On scattered subword complexity",,"Acta Univ. Sapientiae, Informatica 3, 1 (2011) 127--136",,,"cs.DM","http://arxiv.org/licenses/nonexclusive-distrib/1.0/","  Special scattered subwords, in which the gaps are of length from a given set,
are defined. The scattered subword complexity, which is the number of such
scattered subwords, is computed for rainbow words.
","[{""version"":""v1"",""created"":""Fri, 22 Apr 2011 12:11:33 GMT""}]","2011-04-25"
"1104.4426","Maurizio Serva","Maurizio Serva","Phylogeny and geometry of languages from normalized Levenshtein distance","Review paper",,,,"cs.CL q-bio.PE","http://arxiv.org/licenses/nonexclusive-distrib/1.0/","  The idea that the distance among pairs of languages can be evaluated from
lexical differences seems to have its roots in the work of the French explorer
Dumont D'Urville. He collected comparative words lists of various languages
during his voyages aboard the Astrolabe from 1826 to 1829 and, in his work
about the geographical division of the Pacific, he proposed a method to measure
the degree of relation between languages.
  The method used by the modern lexicostatistics, developed by Morris Swadesh
in the 1950s, measures distances from the percentage of shared cognates, which
are words with a common historical origin. The weak point of this method is
that subjective judgment plays a relevant role.
  Recently, we have proposed a new automated method which is motivated by the
analogy with genetics. The new approach avoids any subjectivity and results can
be easily replicated by other scholars. The distance between two languages is
defined by considering a renormalized Levenshtein distance between pair of
words with the same meaning and averaging on the words contained in a list. The
renormalization, which takes into account the length of the words, plays a
crucial role, and no sensible results can be found without it.
  In this paper we give a short review of our automated method and we
illustrate it by considering the cluster of Malagasy dialects. We show that it
sheds new light on their kinship relation and also that it furnishes a lot of
new information concerning the modalities of the settlement of Madagascar.
","[{""version"":""v1"",""created"":""Fri, 22 Apr 2011 12:20:56 GMT""},{""version"":""v2"",""created"":""Thu, 28 Apr 2011 18:07:21 GMT""},{""version"":""v3"",""created"":""Fri, 29 Apr 2011 06:26:36 GMT""}]","2011-07-21"
"1104.4427","Zolt\'an K\'asa","Gerhard Lischke","Primitive words and roots of words",,"Acta Univ. Sapientiae, Informatica 3, 1 (2011) 5-34",,,"cs.FL","http://arxiv.org/licenses/nonexclusive-distrib/1.0/","  In the algebraic theory of codes and formal languages, the set $Q$ of all
primitive words over some alphabet $\zi $ has received special interest. With
this survey article we give an overview about relevant research to this topic
during the last twenty years including own investigations and some new results.
In Section 1 after recalling the most important notions from formal language
theory we illustrate the connection between coding theory and primitive words
by some facts. We define primitive words as words having only a trivial
representation as the power of another word. Nonprimitive words (without the
empty word) are exactly the periodic words. Every nonempty word is a power of
an uniquely determined primitive word which is called the root of the former
one. The set of all roots of nonempty words of a language is called the root of
the language. The primitive words have interesting combinatorial properties
which we consider in Section 2. In Section 3 we investigate the relationship
between the set $Q$ of all primitive words over some fixed alphabet and the
language classes of the Chomsky Hierarchy and the contextual languages over the
same alphabet. The computational complexity of the set $Q$ and of the roots of
languages are considered in Section 4. The set of all powers of the same degree
of all words from a language is the power of this language. We examine the
powers of languages for different sets of exponents, and especially their
regularity and context-freeness, in Section 5, and the decidability of
appropriate questions in Section 6. Section 7 is dedicated to several
generalizations of the notions of periodicity and primitivity of words.
","[{""version"":""v1"",""created"":""Fri, 22 Apr 2011 12:25:18 GMT""}]","2011-04-25"
"1104.4428","Jan Stochel","Zenon Jan Jablonski, Il Bong Jung and Jan Stochel","Normal extensions escape from the class of weighted shifts on directed
  trees","9 pages","Complex Anal. Oper. Theory, 7 (2013), 409-419",,,"math.FA","http://arxiv.org/licenses/nonexclusive-distrib/1.0/","  A formally normal weighted shift on a directed tree is shown to be a bounded
normal operator. The question of whether a normal extension of a subnormal
weighted shift on a directed tree can be modeled as a weighted shift on some,
possible different, directed tree is answered.
","[{""version"":""v1"",""created"":""Fri, 22 Apr 2011 12:29:54 GMT""}]","2013-10-15"
"1104.4429","Rama Cont","Rama Cont, Cecilia Mancini","Nonparametric tests for pathwise properties of semimartingales","Published in at http://dx.doi.org/10.3150/10-BEJ293 the Bernoulli
  (http://isi.cbs.nl/bernoulli/) by the International Statistical
  Institute/Bernoulli Society (http://isi.cbs.nl/BS/bshome.htm)","Bernoulli 2011, Vol. 17, No. 2, 781-813","10.3150/10-BEJ293","IMS-BEJ-BEJ293","math.ST stat.TH","http://arxiv.org/licenses/nonexclusive-distrib/1.0/","  We propose two nonparametric tests for investigating the pathwise properties
of a signal modeled as the sum of a L\'{e}vy process and a Brownian
semimartingale. Using a nonparametric threshold estimator for the continuous
component of the quadratic variation, we design a test for the presence of a
continuous martingale component in the process and a test for establishing
whether the jumps have finite or infinite variation, based on observations on a
discrete-time grid. We evaluate the performance of our tests using simulations
of various stochastic models and use the tests to investigate the fine
structure of the DM/USD exchange rate fluctuations and SPX futures prices. In
both cases, our tests reveal the presence of a non-zero Brownian component and
a finite variation jump component.
","[{""version"":""v1"",""created"":""Fri, 22 Apr 2011 12:41:07 GMT""}]","2011-04-25"
"1104.4430","Hideaki Hara","Hideaki Hara, Yosuke Takasu, Yoshifumi Yamaoka, John M. Doyle, Yoshiro
  Takahashi","Quantum degenerate mixtures of alkali and alkaline-earth-like atoms","4 pages, 3 figures",,"10.1103/PhysRevLett.106.205304",,"physics.atom-ph cond-mat.quant-gas","http://arxiv.org/licenses/nonexclusive-distrib/1.0/","  We realize simultaneous quantum degeneracy in mixtures consisting of the
alkali and alkalineearth-like atoms Li and Yb. This is accomplished within an
optical trap by sympathetic cooling of the fermionic isotope 6Li with
evaporatively cooled bosonic 174Yb and, separately, fermionic 173Yb.Using
cross-thermalization studies, we also measure the elastic s-wave scattering
lengths of both Li-Yb combinations, |a6Li-174Yb| = 1.0\pm0.2 nm and
|a6Li-173Yb| = 0.9\pm0.2 nm. The equality of these lengths is found to be
consistent with mass-scaling analysis. The quantum degenerate mixtures of Li
and Yb, as realized here, can be the basis for creation of ultracold molecules
with electron spin degrees of freedom, studies of novel Efimov trimers, and
impurity probes of superfluid systems.
","[{""version"":""v1"",""created"":""Fri, 22 Apr 2011 12:43:42 GMT""},{""version"":""v2"",""created"":""Wed, 27 Apr 2011 10:41:23 GMT""}]","2015-05-27"
"1104.4431","Byeong-Cheol Lee","B.-C. Lee, D. E. Mkrtichian, I. Han, K.-M.Kim, and M.-G. Park","A likely exoplanet orbiting the oscillating K-giant {\alpha} Arietis","6 pages, 9 figures, 2 tables",,"10.1051/0004-6361/201016293","published in the Astronomy and Astrophysics, Volume 529","astro-ph.EP","http://arxiv.org/licenses/nonexclusive-distrib/1.0/","  Aims. To search for extrasolar planets around intermediate-mass stars, we are
conducting a precise RV survey around K-giants. Methods. We present
high-accuracy RV measurements of {\alpha} Ari made from November 2003 to
February 2010. This star belongs to our sample of 55 K-giants studied for
extrasolar planet and pulsation searches using the fiber-fed Bohyunsan
Observatory Echelle Spectrograph (BOES) attached to the 1.8-m telescope at
Bohyunsan Optical Astronomy Observatory (BOAO) in Korea. Results. We find a
planetary companion with long-period and low-amplitude radial velocity (RV)
variations in oscillating K2 III star {\alpha} Ari (HD 12929). We do not find
the correlation between RV variations and chromospheric activity indicators (Ca
II H & K region, H{\alpha} line). The bisector analysis also shows that the
bisector velocity span (BVS) does not show any obvious correlation with RV
variation but has periodic component that may be attributed to the rotation of
the star. If the RV variation is indeed caused by a planetary companion, an
orbital solution with a period of P = 381 days, a semi-amplitude of K = 41 m/s,
and an eccentricity of e = 0.25 fits the data best. Assuming a possible stellar
mass of M_star = 1.5 M_sun, we estimate the minimum mass for the planetary
companion of m2 sin i = 1.8 M_Jupiter with an orbital semi-major axis of 1.2
AU. Conclusions. Our finding of a likely exoplanet in {\alpha} Ari supports
searching for extrasolar planets around giant stars with multiperiodic
oscillations.
","[{""version"":""v1"",""created"":""Fri, 22 Apr 2011 12:52:01 GMT""}]","2011-04-25"
"1104.4432","S. Cagdas Inam","A. Baykal (1), S.C. Inam (2), B. Icdem (1) ((1) METU, (2) Baskent
  University)","Pulse Profiles of Swift J1626.6+5156","4 pages, 2 figures, Conference proceeding of ""Astrophysics of Neutron
  Stars 2010 -- a conference in honor of M. Ali Alpar"", 2-6 August 2010, Cesme,
  Izmir, Turkey",,"10.1063/1.3629492",,"astro-ph.HE","http://arxiv.org/licenses/nonexclusive-distrib/1.0/","  In this paper, we analyzed pulse profiles of Swift J1626.6+5156 using the
lightcurves from RXTE-PCA observations between MJD 53724 (just after the
outburst) and MJD 55113 and a Chandra-ACIS dataset on MJD 54897 with a 20 ks
exposure. We found that pulse profiles show morphological variations and
pulsations do not cease even $\sim 1200$ days after the outburst. Despite these
variations, we did not find any significant variation in the pulsed fraction
with decreasing X-ray flux.
","[{""version"":""v1"",""created"":""Fri, 22 Apr 2011 13:12:59 GMT""}]","2015-05-27"
"1104.4433","Zolt\'an K\'asa","Vladimir Yu. Popov","Arc-preserving subsequences of arc-annotated sequences",,"Acta Univ. Sapientiae, Informatica 3, 1 (2011) 35--47",,,"cs.CC","http://arxiv.org/licenses/nonexclusive-distrib/1.0/","  Arc-annotated sequences are useful in representing the structural information
of RNA and protein sequences. The longest arc-preserving common subsequence
problem has been introduced as a framework for studying the similarity of
arc-annotated sequences. In this paper, we consider arc-annotated sequences
with various arc structures. We consider the longest arc preserving common
subsequence problem. In particular, we show that the decision version of the
1-{\sc fragment LAPCS(crossing,chain)} and the decision version of the 0-{\sc
diagonal LAPCS(crossing,chain)} are {\bf NP}-complete for some fixed alphabet
$\Sigma$ such that $|\Sigma| = 2$. Also we show that if $|\Sigma| = 1$, then
the decision version of the 1-{\sc fragment LAPCS(unlimited, plain)} and the
decision version of the 0-{\sc diagonal LAPCS(unlimited, plain)} are {\bf
NP}-complete.
","[{""version"":""v1"",""created"":""Fri, 22 Apr 2011 13:13:19 GMT""}]","2011-04-25"
"1104.4434","Rebecca Ronke","R. Ronke, I. D'Amico and T.P. Spiller","Knitting distributed cluster state ladders with spin chains","To be published in PRA. v2 includes minor corrections as well as an
  added discussion on refocussing","Phys. Rev. A 84, 032308 (2011)","10.1103/PhysRevA.84.032308",,"quant-ph","http://arxiv.org/licenses/nonexclusive-distrib/1.0/","  There has been much recent study on the application of spin chains to quantum
state transfer and communication. Here we discuss the utilisation of spin
chains (set up for perfect quantum state transfer) for the knitting of
distributed cluster state structures, between spin qubits repeatedly injected
and extracted at the ends of the chain. The cluster states emerge from the
natural evolution of the system across different excitation number sectors. We
discuss the decohering effects of errors in the injection and extraction
process as well as the effects of fabrication and random errors.
","[{""version"":""v1"",""created"":""Fri, 22 Apr 2011 13:18:55 GMT""},{""version"":""v2"",""created"":""Fri, 19 Aug 2011 09:03:55 GMT""}]","2011-09-12"
"1104.4435","Yuanyuan Bao","Yuanyuan Bao","H(2)-Unknotting Operation Related to 2-Bridge Links","14 pages, 9 figures",,,,"math.GT","http://arxiv.org/licenses/nonexclusive-distrib/1.0/","  This paper concerns the H(2)-unknotting numbers of links related to 2-bridge
links. It consists of three parts. In the first part, we consider a necessary
and sufficient condition for a 2-bridge link to have H(2)-unknotting number
one. The second part concerns an explicit form of composite links with
H(2)-unknotting number one. In the last part, we develop a method of studying
the H(2)-unknotting numbers of some tangle unknotting number one knots via
2-bridge knots.
","[{""version"":""v1"",""created"":""Fri, 22 Apr 2011 13:24:17 GMT""}]","2011-04-25"
