"1104.4340","Walter Grimus","W. Grimus and P.O. Ludl","Maximal atmospheric neutrino mixing from texture zeros and
  quasi-degenerate neutrino masses","14 pages, 2 figures","Phys.Lett.B700:356-361,2011","10.1016/j.physletb.2011.05.029","UWThPh-2011-14","hep-ph","http://arxiv.org/licenses/nonexclusive-distrib/1.0/","  It is well-known that, in the basis where the charged-lepton mass matrix is
diagonal, there are seven cases of two texture zeros in Majorana neutrino mass
matrices that are compatible with all experimental data. We show that two of
these cases, namely B3 and B4 in the classification of Frampton, Glashow and
Marfatia, are special in the sense that they automatically lead to near-maximal
atmospheric neutrino mixing in the limit of a quasi-degenerate neutrino mass
spectrum. This property holds true irrespective of the values of the solar and
reactor mixing angles because, for these two cases, in the limit of a
quasi-degenerate spectrum, the second and third row of the lepton mixing matrix
are, up to signs, approximately complex-conjugate to each other. Moreover, in
the same limit the aforementioned cases also develop a maximal CP-violating
CKM-type phase, provided the reactor mixing angle is not too small.
","[{""version"":""v1"",""created"":""Thu, 21 Apr 2011 19:50:36 GMT""}]","2011-06-07"
"1104.4341","Patrick Hartigan","P. Hartigan, A. Frank, J. M. Foster, B. H. Wilde, M. Douglas, P. A.
  Rosen, R. F. Coker, B. E. Blue and J. F. Hansen","Fluid Dynamics of Stellar Jets in Real Time: Third Epoch HST Images of
  HH 1, HH 34, and HH 47","17 figures. High-resolution PDF with better figure quality available
  at http://sparky.rice.edu/~hartigan/pub.html",,"10.1088/0004-637X/736/1/29",,"astro-ph.SR astro-ph.GA","http://arxiv.org/licenses/nonexclusive-distrib/1.0/","  We present new, third-epoch HST H-alpha and [S II] images of three HH jets
(HH 1 and 2, HH 34, and HH 47) and compare these images with those from the
previous epochs. The high-spatial resolution, coupled with a time-series whose
cadence is of order both the hydrodynamical and radiative cooling timescales of
the flow allows us to follow the hydrodynamical/magnetohydrodynamical evolution
of an astrophysical plasma system in which ionization and radiative cooling
play significant roles. Cooling zones behind the shocks are resolved, so it is
possible to identify which way material flows through a given shock wave. The
images show that heterogeneity is paramount in these jets, with clumps
dominating the morphologies of both bow shocks and their Mach disks. This
clumpiness exists on scales smaller than the jet widths and determines the
behavior of many of the features in the jets. Evidence also exists for
considerable shear as jets interact with their surrounding molecular clouds,
and in several cases we observe shock waves as they form and fade where
material emerges from the source and as it proceeds along the beam of the jet.
Fine-structure within two extended bow shocks may result from Mach stems that
form at the intersection points of oblique shocks within these clumpy objects.
Taken together, these observations represent the most significant foray thus
far into the time domain for stellar jets, and comprise one of the richest data
sets in existence for comparing the behavior of a complex astrophysical plasma
flows with numerical simulations and laboratory experiments.
","[{""version"":""v1"",""created"":""Thu, 21 Apr 2011 19:54:04 GMT""}]","2015-05-27"
"1104.4342","Eric W. Hudson","Ilija Zeljkovic, Elizabeth J. Main, Tess L. Williams, M. C. Boyer,
  Kamalesh Chatterjee, W. D. Wise, Yi Yin, Martin Zech, Adam Pivonka, Takeshi
  Kondo, T. Takeuchi, Hiroshi Ikuta, Jinsheng Wen, Zhijun Xu, G. D. Gu, E. W.
  Hudson, Jennifer E. Hoffman","STM imaging of symmetry-breaking structural distortion in the Bi-based
  cuprate superconductors","4 figures",,"10.1038/NMAT3315",,"cond-mat.supr-con","http://arxiv.org/licenses/nonexclusive-distrib/1.0/","  A complicating factor in unraveling the theory of high-temperature (high-Tc)
superconductivity is the presence of a ""pseudogap"" in the density of states,
whose origin has been debated since its discovery [1]. Some believe the
pseudogap is a broken symmetry state distinct from superconductivity [2-4],
while others believe it arises from short-range correlations without symmetry
breaking [5,6]. A number of broken symmetries have been imaged and identified
with the pseudogap state [7,8], but it remains crucial to disentangle any
electronic symmetry breaking from pre-existing structural symmetry of the
crystal. We use scanning tunneling microscopy (STM) to observe an orthorhombic
structural distortion across the cuprate superconducting Bi2Sr2Can-1CunO2n+4+x
(BSCCO) family tree, which breaks two-dimensional inversion symmetry in the
surface BiO layer. Although this inversion symmetry breaking structure can
impact electronic measurements, we show from its insensitivity to temperature,
magnetic field, and doping, that it cannot be the long-sought pseudogap state.
To detect this picometer-scale variation in lattice structure, we have
implemented a new algorithm which will serve as a powerful tool in the search
for broken symmetry electronic states in cuprates, as well as in other
materials.
","[{""version"":""v1"",""created"":""Thu, 21 Apr 2011 19:58:14 GMT""},{""version"":""v2"",""created"":""Tue, 15 May 2012 16:08:57 GMT""}]","2012-05-16"
"1104.4343","Ian Morrison","Donald Marolf and Ian A. Morrison","The IR stability of de Sitter QFT: Physical initial conditions","32 pages, 3 figures","General Relativity and Gravitation 43 3497-3530 (2011)","10.1007/s10714-011-1233-3",,"gr-qc hep-th","http://arxiv.org/licenses/nonexclusive-distrib/1.0/","  This work uses Lorentz-signature in-in perturbation theory to analyze the
late-time behavior of correlators in time-dependent interacting massive scalar
field theory in de Sitter space. We study a scenario recently considered by
Krotov and Polyakov in which the coupling $g$ turns on smoothly at finite time,
starting from $g=0$ in the far past where the state is taken to be the (free)
Bunch-Davies vacuum. Our main result is that the resulting correlators (which
we compute at the one-loop level) approach those of the interacting
Hartle-Hawking state at late times. We argue that similar results should hold
for other physically-motivated choices of initial conditions. This behavior is
to be expected from recent quantum ""no hair"" theorems for interacting massive
scalar field theory in de Sitter space which established similar results to all
orders in perturbation theory for a dense set of states in the Hilbert space.
Our current work i) indicates that physically motivated initial conditions lie
in this dense set, ii) provides a Lorentz-signature counter-part to the
Euclidean techniques used to prove such theorems, and iii) provides an explicit
example of the relevant renormalization techniques.
","[{""version"":""v1"",""created"":""Thu, 21 Apr 2011 19:58:37 GMT""}]","2016-03-22"
"1104.4346","Asifa Tassaddiq","Asifa Tassaddiq and Asghar Qadir","Fourier Transform Representation of the Extended Fermi-Dirac and
  Bose-Einstein Functions with Applications to the Family of the Zeta and
  Related Functions","13 pages only",,,,"math-ph math.CA math.MP","http://arxiv.org/licenses/nonexclusive-distrib/1.0/","  On the one hand the Fermi-Dirac and Bose-Einstein functions have been
extended in such a way that they are closely related to the Riemann and other
zeta functions. On the other hand the Fourier transform representation of the
gamma and generalized gamma functions proved useful in deriving various
integral formulae for these functions. In this paper we use the Fourier
transform representation of the extended functions to evaluate integrals of
products of these functions. In particular we evaluate some integrals
containing the Riemann and Hurwitz zeta functions, which had not been evaluated
before.
","[{""version"":""v1"",""created"":""Thu, 21 Apr 2011 18:58:34 GMT""}]","2011-04-25"
"1104.4347","Justin Khoury","Austin Joyce and Justin Khoury","Scale Invariance via a Phase of Slow Expansion","34 pages, 5 figures","Phys.Rev.D84:023508,2011","10.1103/PhysRevD.84.023508",,"hep-th astro-ph.CO hep-ph","http://arxiv.org/licenses/nonexclusive-distrib/1.0/","  We consider a cosmological scenario in which a scale-invariant spectrum of
curvature perturbations is generated by a rapidly-evolving equation of state on
a slowly expanding background. This scenario generalizes the ""adiabatic
ekpyrotic"" mechanism proposed recently in arXiv:0910.2230. Whereas the original
proposal assumed a slowly contracting background, the present work shows that
the mechanism works equally well on an expanding background. This greatly
expands the realm of broader cosmological scenarios in which this mechanism can
be embedded. We present a phase space analysis and show that both the expanding
and contracting versions of the scenario are dynamical attractors, with the
expanding branch having a broader basin of attraction. In both cases, a finite
range of scale invariant modes can be generated within the regime of validity
of perturbation theory.
","[{""version"":""v1"",""created"":""Thu, 21 Apr 2011 20:00:00 GMT""}]","2011-08-08"
"1104.4348","Dominik Riechers","Dominik A. Riechers (1,8), Christopher L. Carilli (2), Fabian Walter
  (3), Axel Weiss (4), Jeff Wagg (5), Frank Bertoldi (6), Dennis Downes (7),
  Christian Henkel (4), Jacqueline Hodge (3) ((1) Caltech, (2) NRAO, (3) MPIA,
  (4) MPIfR, (5) ESO, (6) AIfA, (7) IRAM, (8) Hubble Fellow)","Imaging the Molecular Gas Properties of a Major Merger Driving the
  Evolution of a z=2.5 Submillimeter Galaxy","6 pages, 4 figures, to appear in ApJL (accepted April 12, 2011)","Astrophys.J.733:L11,2011","10.1088/2041-8205/733/1/L11",,"astro-ph.CO","http://arxiv.org/licenses/nonexclusive-distrib/1.0/","  We report the detection of spatially extended CO 1-0 and 5-4 emission in the
z=2.49 submillimeter galaxy (SMG) J123707+6214, using the Expanded Very Large
Array and the Plateau de Bure Interferometer. The large molecular gas reservoir
is spatially resolved into two CO(1-0) components (north-east and south-west;
previously identified in CO 3-2 emission) with gas masses of 4.3 and 3.5 x
10^10 (alpha_CO/0.8) Msun. We thus find that the optically invisible north-east
component slightly dominates the gas mass in this system. The total molecular
gas mass derived from the CO(1-0) observations is ~2.5 times larger than
estimated from CO(3-2). The two components are at approximately the same
redshift, but separated by ~20 kpc in projection. The morphology is consistent
with that of an early-stage merger. The total amount of molecular gas is
sufficient to maintain the intense 500 Msun/yr starburst in this system for at
least ~160 Myr. We derive line brightness temperature ratios of
r_31=0.39+/-0.09 and 0.37+/-0.10, and r_51=0.26+/-0.07 and 0.25+/-0.08 in the
two components, respectively, suggesting that the J>=3 lines are substantially
subthermally excited. This also suggests comparable conditions for star
formation in both components. Given the similar gas masses of both components,
this is consistent with the comparable starburst strengths observed in the
radio continuum emission. Our findings are consistent with other recent studies
that find evidence for lower CO excitation in SMGs than in high-z quasar host
galaxies with comparable gas masses. This may provide supporting evidence that
both populations correspond to different evolutionary stages in the formation
of massive galaxies.
","[{""version"":""v1"",""created"":""Thu, 21 Apr 2011 20:00:01 GMT""}]","2012-01-27"
"1104.4349","Yi-Fu Cai","Yi-Fu Cai, Shih-Hung Chen, James B. Dent, Sourish Dutta, Emmanuel N.
  Saridakis","Matter Bounce Cosmology with the f(T) Gravity","10 pages, 3 figures","Class. Quantum Grav. 28 (2011) 215011","10.1088/0264-9381/28/21/215011",,"astro-ph.CO gr-qc hep-th","http://arxiv.org/licenses/nonexclusive-distrib/1.0/","  We show that the f(T) gravitational paradigm, in which gravity is described
by an arbitrary function of the torsion scalar, can provide a mechanism for
realizing bouncing cosmologies, thereby avoiding the Big Bang singularity.
After constructing the simplest version of an f(T) matter bounce, we
investigate the scalar and tensor modes of cosmological perturbations. Our
results show that metric perturbations in the scalar sector lead to a
background-dependent sound speed, which is a distinguishable feature from
Einstein gravity. Additionally, we obtain a scale-invariant primordial power
spectrum, which is consistent with cosmological observations, but suffers from
the problem of a large tensor-to-scalar ratio. However, this can be avoided by
introducing extra fields, such as a matter bounce curvaton.
","[{""version"":""v1"",""created"":""Thu, 21 Apr 2011 20:01:17 GMT""},{""version"":""v2"",""created"":""Wed, 5 Oct 2011 21:46:17 GMT""}]","2011-10-07"
"1104.4350","Marco Di Liberto","M. Di Liberto, O. Tieleman, V. Branchina, C. Morais Smith","Finite-momentum Bose-Einstein condensates in shaken 2D square optical
  lattices","7 pages, 7 figures","Phys. Rev. A 84, 013607 (2011)","10.1103/PhysRevA.84.013607",,"cond-mat.quant-gas","http://arxiv.org/licenses/nonexclusive-distrib/1.0/","  We consider ultracold bosons in a 2D square optical lattice described by the
Bose-Hubbard model. In addition, an external time-dependent sinusoidal force is
applied to the system, which shakes the lattice along one of the diagonals. The
effect of the shaking is to renormalize the nearest-neighbor hopping
coefficients, which can be arbitrarily reduced, can vanish, or can even change
sign, depending on the shaking parameter. It is therefore necessary to account
for higher-order hopping terms, which are renormalized differently by the
shaking, and introduce anisotropy into the problem. We show that the
competition between these different hopping terms leads to finite-momentum
condensates, with a momentum that may be tuned via the strength of the shaking.
We calculate the boundaries between the Mott-insulator and the different
superfluid phases, and present the time-of-flight images expected to be
observed experimentally. Our results open up new possibilities for the
realization of bosonic analogs of the FFLO phase describing inhomogeneous
superconductivity.
","[{""version"":""v1"",""created"":""Thu, 21 Apr 2011 20:02:34 GMT""}]","2015-03-19"
"1104.4351","Gyula Szabo","Gy. M. Szab\'o, K. S\'arneczky, L. L. Kiss","Frozen to death? -- Detection of comet Hale-Bopp at 30.7 AU","4 pages, accepted by A&A",,"10.1051/0004-6361/201116793",,"astro-ph.EP","http://arxiv.org/licenses/nonexclusive-distrib/1.0/","  Comet Hale--Bopp (C/1995 O1) has been the single most significant comet
encountered by modern astronomy, still having displayed significant activity at
25.7 AU solar distance in late 2007. It is a puzzling question when and where
this activity will finally cease. Here we present new observations with the ESO
2.2m telescope at La Silla to check the activity of Hale--Bopp at 30.7 AU solar
distance. On 2010-12-04, 26 CCD images were taken with 180 s exposure times for
photometry and morphology. The comet was detected in R and had a total
brightness of 23.3+-0.2 mag, referring to an absolute brightness of
R(1,1,0)=8.3. The profile of the coma was star-like at a seeing of 1.9"",
without any evidence of a coma or tail extending farther than 2.5"" (=55,000 km
in projection) and exceeding 26.5 mag/arcs^2 surface brightness. The measured
total brightness corresponds to a relative total reflecting surface, a_RC, of
485 km^2, nine times less than three years before. The calculated a_RC value
would imply a nucleus with 60--65 km radius assuming 4% albedo. This size
estimate is in significant contradiction with the previous results scattering
around 35 km. Therefore we suggest that the comet may still be in a low-level
activity, despite the lack of a prominent coma. Alternatively, if the nucleus
is already dormant, the albedo should be as high as 13%, assuming a radius of
35 km. With this observation, Hale--Bopp has been the most distant comet ever
observed, far beyond the orbit of Neptune.
","[{""version"":""v1"",""created"":""Thu, 21 Apr 2011 20:06:11 GMT""}]","2015-05-27"
"1104.4352","Wei Zhang","Tao Yin, Peng Zhang, Wei Zhang","Stable Heteronuclear Few-Atom Bound States in Mixed Dimensions","Extended version with 14 pages and 14 figures","Phys. Rev. A 84, 052727 (2011)","10.1103/PhysRevA.84.052727",,"cond-mat.quant-gas quant-ph","http://arxiv.org/licenses/nonexclusive-distrib/1.0/","  We study few-body problems in mixed dimensions with $N \ge 2$ heavy atoms
trapped individually in parallel one-dimensional tubes or two-dimensional
disks, and a single light atom travels freely in three dimensions. By using the
Born-Oppenheimer approximation, we find three- and four-body bound states for a
broad region of heavy-light atom scattering length combinations. Specifically,
the existence of trimer and tetramer states persist to negative scattering
lengths regime, where no two-body bound state is present. These few-body bound
states are analogous to the Efimov states in three dimensions, but are stable
against three-body recombination due to geometric separation. In addition, we
find that the binding energy of the ground trimer and tetramer state reaches
its maximum value when the scattering lengths are comparable to the separation
between the low-dimensional traps. This resonant behavior is a unique feature
for the few-body bound states in mixed dimensions.
","[{""version"":""v1"",""created"":""Thu, 21 Apr 2011 20:12:55 GMT""},{""version"":""v2"",""created"":""Sun, 3 Jul 2011 14:34:56 GMT""}]","2015-03-19"
"1104.4353","Alexis Kaporis C.","D. Belazzougui, A. C. Kaporis and P. G. Spirakis","Random input helps searching predecessors",,,,,"cs.DS","http://arxiv.org/licenses/nonexclusive-distrib/1.0/","  We solve the dynamic Predecessor Problem with high probability (whp) in
constant time, using only $n^{1+\delta}$ bits of memory, for any constant
$\delta > 0$. The input keys are random wrt a wider class of the well studied
and practically important class of $(f_1, f_2)$-smooth distributions introduced
in \cite{and:mat}. It achieves O(1) whp amortized time. Its worst-case time is
$O(\sqrt{\frac{\log n}{\log \log n}})$. Also, we prove whp $O(\log \log \log
n)$ time using only $n^{1+ \frac{1}{\log \log n}}= n^{1+o(1)}$ bits. Finally,
we show whp $O(\log \log n)$ time using O(n) space.
","[{""version"":""v1"",""created"":""Thu, 21 Apr 2011 20:25:03 GMT""}]","2011-04-25"
"1104.4354","Bhagawan Sahu","Bhagawan Sahu, Hongki Min and Sanjay K. Banerjee","Edge Saturation effects on the magnetism and band gaps in multilayer
  graphene ribbons and flakes","9 pages, 10 figures, submitted","Phys. Rev. B 84, 075481 (2011)","10.1103/PhysRevB.84.075481",,"cond-mat.mtrl-sci","http://arxiv.org/licenses/nonexclusive-distrib/1.0/","  Using a density functional theory based electronic structure method and
semi-local density approximation, we study the interplay of geometric
confinement, magnetism and external electric fields on the electronic structure
and the resulting band gaps of multilayer graphene ribbons whose edges are
saturated with molecular hydrogen (H$_2$) or hydroxyl (OH) groups. We discuss
the similarities and differences of computed features in comparison with the
atomic hydrogen (or H-) saturated ribbons and flakes. For H$_2$
edge-saturation, we find \emph{shifted} labeling of three armchair ribbon
classes and magnetic to non-magnetic transition in narrow zigzag ribbons whose
critical width changes with the number of layers. Other computed
characteristics, such as the existence of a critical gap and external electric
field behavior, layer dependent electronic structure, stacking-dependent band
gap induction and the length confinement effects remain qualitatively same with
those of H-saturated ribbons.
","[{""version"":""v1"",""created"":""Thu, 21 Apr 2011 20:31:27 GMT""}]","2015-05-27"
"1104.4355","Charles Li","Z. C. Feng and Y. Charles Li","A Resolution of the Paradox of Enrichment","submitted",,,,"q-bio.PE math-ph math.AP math.DS math.MP nlin.CD","http://arxiv.org/licenses/nonexclusive-distrib/1.0/","  The paradox of enrichment was observed by M. Rosenzweig in a class of
predator-prey models. Two of the parameters in the models are crucial for the
paradox. These two parameters are the prey's carrying capacity and prey's
half-saturation for predation. Intuitively, increasing the carrying capacity
due to enrichment of the prey's environment should lead to a more stable
predator-prey system. Analytically, it turns out that increasing the carrying
capacity always leads to an unstable predator-prey system that is susceptible
to extinction from environmental random perturbations. This is the so-called
paradox of enrichment. Our resolution here rests upon a closer investigation on
a dimensionless number $H$ formed from the carrying capacity and the prey's
half-saturation. By recasting the models into dimensionless forms, the models
are in fact governed by a few dimensionless numbers including $H$. The effects
of the two parameters: carrying capacity and half-saturation are incorporated
into the number $H$. In fact, increasing the carrying capacity is equivalent
(i.e. has the same effect on $H$) to decreasing the half-saturation which
implies more aggressive predation. Since there is no paradox between more
aggressive predation and instability of the predator-prey system, the paradox
of enrichment is resolved.
  We also further explore spatially dependent models for which the phase space
is infinite dimensional. The spatially independent limit cycle which is
generated by a Hopf bifurcation from an unstable steady state, is linearly
stable in the infinite dimensional phase space. Numerical simulations indicate
that the basin of attraction of the limit cycle is riddled. This shows that
spatial perturbations can sometimes (neither always nor never) remove the
paradox of enrichment near the limit cycle!
","[{""version"":""v1"",""created"":""Thu, 21 Apr 2011 20:38:35 GMT""},{""version"":""v2"",""created"":""Mon, 11 Mar 2013 19:32:00 GMT""}]","2015-03-19"
"1104.4356","Daniel Loebenberger","Daniel Loebenberger and Michael N\""usken","Notions for RSA integers",,,,,"cs.CR math.NT","http://arxiv.org/licenses/nonexclusive-distrib/1.0/","  The key-generation algorithm for the RSA cryptosystem is specified in several
standards, such as PKCS#1, IEEE 1363-2000, FIPS 186-3, ANSI X9.44, or ISO/IEC
18033-2. All of them substantially differ in their requirements. This indicates
that for computing a ""secure"" RSA modulus it does not matter how exactly one
generates RSA integers. In this work we show that this is indeed the case to a
large extend: First, we give a theoretical framework that will enable us to
easily compute the entropy of the output distribution of the considered
standards and show that it is comparatively high. To do so, we compute for each
standard the number of integers they define (up to an error of very small
order) and discuss different methods of generating integers of a specific form.
Second, we show that factoring such integers is hard, provided factoring a
product of two primes of similar size is hard.
","[{""version"":""v1"",""created"":""Thu, 21 Apr 2011 20:44:19 GMT""},{""version"":""v2"",""created"":""Wed, 11 May 2011 14:46:20 GMT""},{""version"":""v3"",""created"":""Mon, 1 Oct 2012 11:27:49 GMT""}]","2012-10-02"
"1104.4357","Joaquin E. Drut","Joaqu\'in E. Drut, Lucas Platter","Exact-exchange density functional theory for neutron drops","7 pages, 3 figures; replaced with published version","Phys.Rev.C84:014318,2011","10.1103/PhysRevC.84.014318","LA-UR-11-10456, INT-PUB-11-015","nucl-th physics.chem-ph","http://arxiv.org/licenses/nonexclusive-distrib/1.0/","  We compute the ground-state properties of finite systems of neutrons in an
external harmonic trap, interacting via the Minnesota potential, using the
""exact-exchange"" form of orbital-dependent density functional theory. We
compare our results with Hartree-Fock calculations and find very close
agreement. Within the context of the interaction studied, we conclude that this
simple orbital-dependent functional brings conventional nuclear density
functional theory to the level of Hartree-Fock in an ab initio fashion. Our
work is a first step towards higher-order ab initio nuclear functionals based
on realistic nucleon-nucleon interactions.
","[{""version"":""v1"",""created"":""Thu, 21 Apr 2011 21:21:13 GMT""},{""version"":""v2"",""created"":""Tue, 19 Jul 2011 03:43:41 GMT""}]","2011-07-28"
