"1103.3949","Ana Sofia Gomes","Ana Sofia Gomes, Jose Julio Alferes, Terrance Swift","A Goal-Directed Implementation of Query Answering for Hybrid MKNF
  Knowledge Bases",,"Theory and Practice of Logic Programming 14 (2014) 239-264","10.1017/S1471068412000439",,"cs.AI","http://arxiv.org/licenses/nonexclusive-distrib/1.0/","  Ontologies and rules are usually loosely coupled in knowledge representation
formalisms. In fact, ontologies use open-world reasoning while the leading
semantics for rules use non-monotonic, closed-world reasoning. One exception is
the tightly-coupled framework of Minimal Knowledge and Negation as Failure
(MKNF), which allows statements about individuals to be jointly derived via
entailment from an ontology and inferences from rules. Nonetheless, the
practical usefulness of MKNF has not always been clear, although recent work
has formalized a general resolution-based method for querying MKNF when rules
are taken to have the well-founded semantics, and the ontology is modeled by a
general oracle. That work leaves open what algorithms should be used to relate
the entailments of the ontology and the inferences of rules. In this paper we
provide such algorithms, and describe the implementation of a query-driven
system, CDF-Rules, for hybrid knowledge bases combining both (non-monotonic)
rules under the well-founded semantics and a (monotonic) ontology, represented
by a CDF Type-1 (ALQ) theory. To appear in Theory and Practice of Logic
Programming (TPLP)
","[{""version"":""v1"",""created"":""Mon, 21 Mar 2011 09:51:36 GMT""},{""version"":""v2"",""created"":""Thu, 1 Nov 2012 14:03:07 GMT""}]","2020-02-19"
"1103.3950","Noam Nisan","Avinatan Hassidim and Haim Kaplan and Yishay Mansour and Noam Nisan","Non-Price Equilibria in Markets of Discrete Goods","ACM EC 2011",,,,"cs.GT","http://arxiv.org/licenses/nonexclusive-distrib/1.0/","  We study markets of indivisible items in which price-based (Walrasian)
equilibria often do not exist due to the discrete non-convex setting. Instead
we consider Nash equilibria of the market viewed as a game, where players bid
for items, and where the highest bidder on an item wins it and pays his bid. We
first observe that pure Nash-equilibria of this game excatly correspond to
price-based equilibiria (and thus need not exist), but that mixed-Nash
equilibria always do exist, and we analyze their structure in several simple
cases where no price-based equilibrium exists. We also undertake an analysis of
the welfare properties of these equilibria showing that while pure equilibria
are always perfectly efficient (""first welfare theorem""), mixed equilibria need
not be, and we provide upper and lower bounds on their amount of inefficiency.
","[{""version"":""v1"",""created"":""Mon, 21 Mar 2011 10:00:56 GMT""}]","2011-03-22"
"1103.3951","Boris A. Arbuzov","Boris A. Arbuzov and Ivan V. Zaitsev","Non-perturbative solutions in the electro-weak theory and the Higgs
  boson mass","10 pages, 2 tables, 8 figures, typos corrected",,,,"hep-ph","http://arxiv.org/licenses/nonexclusive-distrib/1.0/","  We apply Bogoliubov compensation principle to the gauge electro-weak
interaction to demonstrate a spontaneous generation of anomalous three-boson
gauge invariant effective interaction. The non-trivial solution of compensation
equations uniquely defines the form-factor of the anomalous interaction and
parameters of the theory including value of gauge electro-weak coupling
$g(M_W^2)\simeq 0.62$ in satisfactory agreement to the experimental value. A
possibility of spontaneous generation of effective four-fermion interaction of
heavy quarks is also demonstrated. This interaction defines an equation for a
scalar bound state of heavy quarks which serve as a substitute for the
elementary scalar Higgs doublet. As a result we obtain two possible solutions
for the observable Higgs boson mass: $M_1\,=\,(306\,\pm\,14)GeV$ and
$M_2\,=\,(253\,\pm\,10)\,GeV$. Values for other parameters e.g. anomalous
three-boson coupling $\,G$, Higgs boson width $\Gamma_H$, its branching ratios
and estimates for cross-section of Higgs production at LHC are also obtained.
","[{""version"":""v1"",""created"":""Mon, 21 Mar 2011 10:04:03 GMT""},{""version"":""v2"",""created"":""Thu, 24 Mar 2011 09:48:22 GMT""}]","2011-03-25"
"1103.3952","{\L}ukasz D{\ke}bowski","{\L}ukasz D\k{e}bowski","Mixing, Ergodic, and Nonergodic Processes with Rapidly Growing
  Information between Blocks","21 pages","IEEE Transactions on Information Theory 58:3392-3401, 2012","10.1109/TIT.2012.2190708",,"cs.IT cs.CL math.IT","http://arxiv.org/licenses/nonexclusive-distrib/1.0/","  We construct mixing processes over an infinite alphabet and ergodic processes
over a finite alphabet for which Shannon mutual information between adjacent
blocks of length $n$ grows as $n^\beta$, where $\beta\in(0,1)$. The processes
are a modification of nonergodic Santa Fe processes, which were introduced in
the context of natural language modeling. The rates of mutual information for
the latter processes are alike and also established in this paper. As an
auxiliary result, it is shown that infinite direct products of mixing processes
are also mixing.
","[{""version"":""v1"",""created"":""Mon, 21 Mar 2011 10:04:20 GMT""},{""version"":""v2"",""created"":""Tue, 22 Nov 2011 15:52:30 GMT""}]","2020-03-11"
"1103.3953","J. Javier Brey","James W. Dufty and J.Javier Brey","Choosing Hydrodynamic fields",,,,,"cond-mat.stat-mech","http://arxiv.org/licenses/nonexclusive-distrib/1.0/","  Continuum mechanics (e.g., hydrodynamics, elasticity theory) is based on the
assumption that a small set of fields provides a closed description on large
space and time scales. Conditions governing the choice for these fields are
discussed in the context of granular fluids and multi-component fluids. In the
first case, the relevance of temperature or energy as a hydrodynamic field is
justified. For mixtures, the use of a total temperature and single flow
velocity is compared with the use of multiple species temperatures and
velocities.
","[{""version"":""v1"",""created"":""Mon, 21 Mar 2011 10:11:11 GMT""}]","2011-03-22"
"1103.3954","Olivier Bailleux","Olivier Bailleux","BoolVar/PB v1.0, a java library for translating pseudo-Boolean
  constraints into CNF formulae",,,,,"cs.AI","http://arxiv.org/licenses/nonexclusive-distrib/1.0/","  BoolVar/PB is an open source java library dedicated to the translation of
pseudo-Boolean constraints into CNF formulae. Input constraints can be
categorized with tags. Several encoding schemes are implemented in a way that
each input constraint can be translated using one or several encoders,
according to the related tags. The library can be easily extended by adding new
encoders and / or new output formats.
","[{""version"":""v1"",""created"":""Mon, 21 Mar 2011 10:14:40 GMT""}]","2011-03-22"
"1103.3955","Pierfrancesco La Mura","Pierfrancesco La Mura","Astronomical Dating and the Internal Chronology of the Pentateuch","29 pages, 12 figures",,,,"physics.gen-ph","http://arxiv.org/licenses/nonexclusive-distrib/1.0/","  Some of the narratives in the Pentateuch can be associated with known
astronomical events to provide absolute dates for biblical chronology.
","[{""version"":""v1"",""created"":""Mon, 21 Mar 2011 10:14:40 GMT""},{""version"":""v2"",""created"":""Fri, 24 Oct 2014 05:51:06 GMT""}]","2014-10-27"
"1103.3956","Martin Markl","Martin Markl, Elisabeth Remm","Operads for n-ary algebras - calculations and conjectures","10 pages",,,,"math.AT math.KT","http://arxiv.org/licenses/nonexclusive-distrib/1.0/","  In our earlier work we studied Koszulity of a family of operads depending on
a natural number n and on the degree d of the generating operation. While we
proved that, for n < 8, this operad is Koszul if and only if d is even, and
while it follows from a work of Hoffbeck that it is Koszul for d even and
arbitrary n, its (non)Koszulity for d odd and n > 7 remains an open problem. In
this note, we describe some related numerical experiments, and formulate a
conjecture suggested by the results of these computations.
","[{""version"":""v1"",""created"":""Mon, 21 Mar 2011 10:15:28 GMT""}]","2011-03-22"
"1103.3957","Arvid Perego","Arvid Perego, Antonio Rapagnetta","Factoriality properties of moduli spaces of sheaves on abelian and K3
  surfaces","14 pages; added calculation of the weight-two Hodge structures of the
  symplectic resolutions, bibliographical references corrected","Int. Math. Res. Not. (2014), no. 3, 643--680",,,"math.AG","http://arxiv.org/licenses/nonexclusive-distrib/1.0/","  In this paper we complete the determination of the index of factoriality of
moduli spaces of semistable sheaves on an abelian or projective K3 surface $S$.
If $v=2w$ is a Mukai vector, $w$ is primitive, $w^{2}=2$ and $H$ is a generic
polarization, let $M_{v}(S,H)$ be the moduli space of $H-$semistable sheaves on
$S$ with Mukai vector $v$. First, we describe in terms of $v$ the pure
weight-two Hodge structure and the Beauville form on the second integral
cohomology of the symplectic resolutions of $M_{v}(S,H)$ (when $S$ is K3) and
of the fiber $K_{v}(S,H)$ of the Albanese map of $M_{v}(S,H)$ (when $S$ is
abelian). Then, if $S$ is K3 we show that $M_{v}(S,H)$ is either locally
factorial or $2-$factorial, and we give an example of both cases. If $S$ is
abelian, we show that $M_{v}(S,H)$ and $K_{v}(S,H)$ are $2-$factorial.
","[{""version"":""v1"",""created"":""Mon, 21 Mar 2011 10:16:43 GMT""},{""version"":""v2"",""created"":""Sat, 12 Nov 2011 10:41:25 GMT""}]","2015-03-19"
"1103.3958","Christoph Thaele","Tomasz Schreiber, Christoph Thaele","Geometry of iteration stable tessellations: Connection with Poisson
  hyperplanes","Published in at http://dx.doi.org/10.3150/12-BEJ424 the Bernoulli
  (http://isi.cbs.nl/bernoulli/) by the International Statistical
  Institute/Bernoulli Society (http://isi.cbs.nl/BS/bshome.htm). arXiv admin
  note: text overlap with arXiv:1001.0990","Bernoulli 2013, Vol. 19, No. 5A, 1637-1654","10.3150/12-BEJ424","IMS-BEJ-BEJ424","math.PR math.ST stat.TH","http://arxiv.org/licenses/nonexclusive-distrib/1.0/","  Since the seminal work by Nagel and Weiss, the iteration stable (STIT)
tessellations have attracted considerable interest in stochastic geometry as a
natural and flexible, yet analytically tractable model for hierarchical spatial
cell-splitting and crack-formation processes. We provide in this paper a
fundamental link between typical characteristics of STIT tessellations and
those of suitable mixtures of Poisson hyperplane tessellations using martingale
techniques and general theory of piecewise deterministic Markov processes
(PDMPs). As applications, new mean values and new distributional results for
the STIT model are obtained.
","[{""version"":""v1"",""created"":""Mon, 21 Mar 2011 10:17:49 GMT""},{""version"":""v2"",""created"":""Tue, 10 Dec 2013 09:47:49 GMT""},{""version"":""v3"",""created"":""Wed, 24 Dec 2014 12:45:23 GMT""}]","2014-12-25"
"1103.3959","Christoph Thaele","Tomasz Schreiber, Christoph Thaele","Second-Order Theory for Iteration Stable Tessellations",,"Probab. Math. Stat. 32, 281-300 (2012)",,,"math.PR","http://arxiv.org/licenses/nonexclusive-distrib/1.0/","  This paper deals with iteration stable (STIT) tessellations, and, more
generally, with a certain class of tessellations that are infinitely divisible
with respect to iteration. They form a new, rich and flexible class of
spatio-temporal models considered in stochastic geometry. The martingale tools
developed in \cite{STP1} are used to study second-order properties of STIT
tessellations. Firstly, a general formula for the variance of the total surface
area of cell boundaries inside a convex observation window is shown. This
general expression is combined with tools from integral geometry to derive
explicit exact and asymptotic second-order formulae in the stationary and
isotropic set-up, where a family of chord-power integrals plays an important
role. Also a general formula for the pair-correlation function of the surface
measure is found.
","[{""version"":""v1"",""created"":""Mon, 21 Mar 2011 10:20:40 GMT""}]","2013-03-04"
"1103.3960","Christoph Thaele","Tomasz Schreiber, Christoph Thaele","Limit theorems for iteration stable tessellations","Published in at http://dx.doi.org/10.1214/11-AOP718 the Annals of
  Probability (http://www.imstat.org/aop/) by the Institute of Mathematical
  Statistics (http://www.imstat.org). arXiv admin note: text overlap with
  arXiv:1001.0990","Annals of Probability 2013, Vol. 41, No. 3B, 2261-2278","10.1214/11-AOP718","IMS-AOP-AOP718","math.PR","http://arxiv.org/licenses/nonexclusive-distrib/1.0/","  The intent of this paper is to describe the large scale asymptotic geometry
of iteration stable (STIT) tessellations in $\mathbb{R}^d$, which form a rather
new, rich and flexible class of random tessellations considered in stochastic
geometry. For this purpose, martingale tools are combined with second-order
formulas proved earlier to establish limit theorems for STIT tessellations.
More precisely, a Gaussian functional central limit theorem for the surface
increment process induced a by STIT tessellation relative to an initial time
moment is shown. As second main result, a central limit theorem for the total
edge length/facet surface is obtained, with a normal limit distribution in the
planar case and, most interestingly, with a nonnormal limit showing up in all
higher space dimensions.
","[{""version"":""v1"",""created"":""Mon, 21 Mar 2011 10:22:14 GMT""},{""version"":""v2"",""created"":""Thu, 11 Jul 2013 06:02:55 GMT""},{""version"":""v3"",""created"":""Wed, 24 Dec 2014 12:46:41 GMT""}]","2014-12-25"
"1103.3961","Matteo Smerlak","Valentin Bonzom and Matteo Smerlak","Bubble divergences: sorting out topology from cell structure","19 pages","Annales Henri Poincar\'e: 13 (2012) 185-208","10.1007/s00023-011-0127-y","pi-qg-217","gr-qc hep-th math-ph math.MP","http://arxiv.org/licenses/nonexclusive-distrib/1.0/","  We conclude our analysis of bubble divergences in the flat spinfoam model. In
[arXiv:1008.1476] we showed that the divergence degree of an arbitrary
two-complex Gamma can be evaluated exactly by means of twisted cohomology.
Here, we specialize this result to the case where Gamma is the two-skeleton of
the cell decomposition of a pseudomanifold, and sharpen it with a careful
analysis of the cellular and topological structures involved. Moreover, we
explain in detail how this approach reproduces all the previous powercounting
results for the Boulatov-Ooguri (colored) tensor models, and sheds light on
algebraic-topological aspects of Gurau's 1/N expansion.
","[{""version"":""v1"",""created"":""Mon, 21 Mar 2011 10:23:28 GMT""}]","2012-02-03"
"1103.3962","Ebrahim Karimi","Ebrahim Karimi, Jonathan Leach, Sergei Slussarenko, Bruno Piccirillo,
  Lorenzo Marrucci, Lixiang Chen, Weilong She, Sonja Franke-Arnold, Miles J.
  Padgett, and Enrico Santamato","Spin-orbit hybrid entanglement of photons and quantum contextuality","5 pages, 3 figures","Phys. Rev. A 82, 022115 (2010)","10.1103/PhysRevA.82.022115",,"quant-ph physics.optics","http://arxiv.org/licenses/nonexclusive-distrib/1.0/","  We demonstrate electromagnetic quantum states of single photons and of
correlated photon pairs exhibiting ""hybrid"" entanglement between spin and
orbital angular momentum. These states are obtained from entangled photon pairs
emitted by spontaneous parametric down conversion, by employing a $q$-plate for
coupling the spin and orbital degrees of freedom of a photon. Entanglement and
contextual quantum behavior (that is also non-local, in the case of photon
pairs) is demonstrated by the reported violation of the
Clauser-Horne-Shimony-Holt inequality. In addition a classical analog of the
hybrid spin-orbit photonic entanglement is reported and discussed.
","[{""version"":""v1"",""created"":""Mon, 21 Mar 2011 10:32:55 GMT""}]","2011-03-22"
"1103.3963","Attila Mo\'or Dr.","A. Mo\'or, S. Frey, S. B. Lambert, O. Titov, J. Bakos","On the connection of the apparent proper motion and the VLBI structure
  of compact radio sources","14 pages, 3 figures, 1 table. Accepted for publication in the
  Astronomical Journal","The Astronomical Journal, Vol. 141, Issue 6, id. 178 (2011)","10.1088/0004-6256/141/6/178",,"astro-ph.CO","http://arxiv.org/licenses/nonexclusive-distrib/1.0/","  Many of the compact extragalactic radio sources that are used as fiducial
points to define the celestial reference frame are known to have proper motions
detectable with long-term geodetic/astrometric Very Long Baseline
Interferometry (VLBI) measurements. These changes can be as high as several
hundred micro-arcseconds per year for certain objects. When imaged with VLBI at
milli-arcsecond (mas) angular resolution, these sources (radio-loud active
galactic nuclei) typically show structures dominated by a compact, often
unresolved ""core"" and a one-sided ""jet"". The positional instability of compact
radio sources is believed to be connected with changes in their brightness
distribution structure. For the first time, we test this assumption in a
statistical sense on a large sample, not only for individual objects. We
investigate a sample of 62 radio sources for which reliable long-term time
series of astrometric positions as well as detailed 8-GHz VLBI brightness
distribution models are available. We compare the characteristic direction of
their extended jet structure and the direction of their apparent proper motion.
We present our data and analysis method, and conclude that there is indeed a
correlation between the two characteristic directions. However, there are cases
where the ~1-10-mas scale VLBI jet directions are significantly misaligned with
respect to the apparent proper motion direction.
","[{""version"":""v1"",""created"":""Mon, 21 Mar 2011 10:39:20 GMT""}]","2013-04-16"
"1103.3964","Giacomo Livan M. Sc.","Z. Burda, A. Jarosz, G. Livan, M. A. Nowak, A. Swiech","Eigenvalues and Singular Values of Products of Rectangular Gaussian
  Random Matrices (The Extended Version)","50 pages, 8 figures, to appear in the Proceedings of the 23rd Marian
  Smoluchowski Symposium on Statistical Physics: ""Random Matrices, Statistical
  Physics and Information Theory,"" September 26-30, 2010, Krakow, Poland","Acta Phys.Polon.B42:939-985,2011","10.5506/APhysPolB.42.939",,"cond-mat.stat-mech math-ph math.MP","http://arxiv.org/licenses/nonexclusive-distrib/1.0/","  We consider a product of an arbitrary number of independent rectangular
Gaussian random matrices. We derive the mean densities of its eigenvalues and
singular values in the thermodynamic limit, eventually verified numerically.
These densities are encoded in the form of the so called M-transforms, for
which polynomial equations are found. We exploit the methods of planar
diagrammatics, enhanced to the non-Hermitian case, and free random variables,
respectively; both are described in the appendices. As particular results of
these two main equations, we find the singular behavior of the spectral
densities near zero. Moreover, we propose a finite-size form of the spectral
density of the product close to the border of its eigenvalues' domain. Also,
led by the striking similarity between the two main equations, we put forward a
conjecture about a simple relationship between the eigenvalues and singular
values of any non-Hermitian random matrix whose spectrum exhibits rotational
symmetry around zero.
","[{""version"":""v1"",""created"":""Mon, 21 Mar 2011 10:40:17 GMT""}]","2011-06-28"
"1103.3965","Ajay Jasra","Alexandros Beskos, Dan Crisan and Ajay Jasra","On the Stability of Sequential Monte Carlo Methods in High Dimensions",,,,,"stat.CO","http://arxiv.org/licenses/nonexclusive-distrib/1.0/","  We investigate the stability of a Sequential Monte Carlo (SMC) method applied
to the problem of sampling from a target distribution on $\mathbb{R}^d$ for
large $d$. It is well known that using a single importance sampling step one
produces an approximation for the target that deteriorates as the dimension $d$
increases, unless the number of Monte Carlo samples $N$ increases at an
exponential rate in $d$. We show that this degeneracy can be avoided by
introducing a sequence of artificial targets, starting from a `simple' density
and moving to the one of interest, using an SMC method to sample from the
sequence. Using this class of SMC methods with a fixed number of samples, one
can produce an approximation for which the effective sample size (ESS)
converges to a random variable $\varepsilon_N$ as $d\rightarrow\infty$ with
$1<\varepsilon_{N}<N$. The convergence is achieved with a computational cost
proportional to $Nd^2$. If $\varepsilon_N\ll N$, we can raise its value by
introducing a number of resampling steps, say $m$ (where $m$ is independent of
$d$). In this case, ESS converges to a random variable $\varepsilon_{N,m}$ as
$d\rightarrow\infty$ and $\lim_{m\to\infty}\varepsilon_{N,m}=N$. Also, we show
that the Monte Carlo error for estimating a fixed dimensional marginal
expectation is of order $\frac{1}{\sqrt{N}}$ uniformly in $d$. The results
imply that, in high dimensions, SMC algorithms can efficiently control the
variability of the importance sampling weights and estimate fixed dimensional
marginals at a cost which is less than exponential in $d$ and indicate that, in
high dimensions, resampling leads to a reduction in the Monte Carlo error and
increase in the ESS.
","[{""version"":""v1"",""created"":""Mon, 21 Mar 2011 10:41:30 GMT""},{""version"":""v2"",""created"":""Wed, 18 Apr 2012 09:25:17 GMT""}]","2012-04-19"
"1103.3966","Costas Papachristou","C. J. Papachristou","Symmetry and Integrability of a Reduced, 3-Dimensional Self-Dual Gauge
  Field Model","17 pages","Electron. J. Theor. Phys. 9, No. 26 (2012) 119 ;
  http://www.ejtp.com/articles/ejtpv9i26p119.pdf",,,"math-ph math.MP","http://arxiv.org/licenses/nonexclusive-distrib/1.0/","  A 3-dimensional reduction of the seld-dual Yang-Mills (SDYM) equation, named
SDYM3, is examined from the point of view of its symmetry and integrability
characteristics. By using a non-auto-Backlund transformation, this equation is
connected to its potential form (PSDYM3) and a certain isomorphism between the
Lie algebras of symmetries of the two systems is shown to exist. This
isomorphism allows us to study the infinite-dimensional Lie algebraic structure
of the ""potential symmetries"" of SDYM3 by examining the symmetry structure of
PSDYM3 (which is an easier task). By using techniques described in a recent
paper, the recursion operators for both SDYM3 and PSDYM3 are derived. Moreover,
a Lax pair and an infinite set of nonlocal conservation laws for SDYM3 are
found, reflecting the fact that SDYM3 is a totally integrable system. This
system may physically represent gravitational fields or chiral fields.
","[{""version"":""v1"",""created"":""Mon, 21 Mar 2011 10:51:57 GMT""}]","2021-04-23"
"1103.3967","Karine Tribouley","Mathilde Mougeot and Dominique Picard and Karine Tribouley","A new selection method for high-dimensionial instrumental setting:
  application to the Growth Rate convergence hypothesis",,,,,"math.ST stat.TH","http://arxiv.org/licenses/nonexclusive-distrib/1.0/","  This paper investigates the problem of selecting variables in regression-type
models for an ""instrumental"" setting. Our study is motivated by empirically
verifying the conditional convergence hypothesis used in the economical
literature concerning the growth rate. To avoid unnecessary discussion about
the choice and the pertinence of instrumental variables, we embed the model in
a very high dimensional setting. We propose a selection procedure with no
optimization step called LOLA, for Learning Out of Leaders with Adaptation.
LOLA is an auto-driven algorithm with two thresholding steps. The consistency
of the procedure is proved under sparsity conditions and simulations are
conducted to illustrate the practical good performances of LOLA. The behavior
of the algorithm is studied when instrumental variables are artificially added
without a priori significant connection to the model. Using our algorithm, we
provide a solution for modeling the link between the growth rate and the
initial level of the gross domestic product and empirically prove the
convergence hypothesis.
","[{""version"":""v1"",""created"":""Mon, 21 Mar 2011 10:52:06 GMT""}]","2015-03-19"
"1103.3968","Jesus Perez Rios","Massimiliano Bartolomei, Estela Carmona-Novillo, Marta I. Hern\'andez,
  Jes\'us P\'erez-R\'ios, Jos\'e Campos-Mart\'inez and Ram\'on
  Hern\'andez-Lamoneda","The Molecular Oxygen Tetramer: Intermolecular Interactions and
  Implications for the $\epsilon$ Solid Phase",,,"10.1103/PhysRevB.84.092105",,"physics.atm-clus cond-mat.mtrl-sci physics.chem-ph","http://arxiv.org/licenses/nonexclusive-distrib/1.0/","  Recent data have determined that the structure of the high pressure
$\epsilon$ phase of solid oxygen consists of clusters composed of four O$_2$
molecules. This finding has opened the question about the nature of the
intermolecular interactions within the molecular oxygen tetramer. We use
multiconfigurational ab initio calculations to obtain an adequate
characterization of the ground singlet state of
  (O$_2$)$_4$ which is compatible with the non magnetic character of the
$\epsilon$ phase. In contrast to previous suggestions implying chemical
bonding, we show that (O$_2$)$_4$ is a van der Waals like cluster where
exchange interactions preferentially stabilize the singlet state. However, as
the cluster shrinks, there is an extra stabilization due to many-body
interactions that yields a significant softening of the repulsive wall. We show
that this short range behavior is a key issue for the understanding of the
structure of $\epsilon$-oxygen.
","[{""version"":""v1"",""created"":""Mon, 21 Mar 2011 10:54:29 GMT""}]","2015-05-27"
