"1103.4011","Dima Bolmatov","Dima Bolmatov and Kostya Trachenko","Liquid heat capacity in the approach from the solid state: anharmonic
  theory","8 pages, 6 figures","Phys. Rev. B 84, 054106 (2011)","10.1103/PhysRevB.84.054106",,"cond-mat.stat-mech","http://arxiv.org/licenses/nonexclusive-distrib/1.0/","  Calculating liquid energy and heat capacity in general form is an open
problem in condensed matter physics. We develop a recent approach to liquids
from the solid state by accounting for the contribution of anharmonicity and
thermal expansion to liquid energy and heat capacity. We subsequently compare
theoretical predictions to the experiments results of 5 commonly discussed
liquids, and find a good agreement with no free fitting parameters. We discuss
and compare the proposed theory to previous approaches.
","[{""version"":""v1"",""created"":""Mon, 21 Mar 2011 13:59:00 GMT""},{""version"":""v2"",""created"":""Sun, 12 Jun 2011 13:24:57 GMT""},{""version"":""v3"",""created"":""Thu, 18 Aug 2011 14:09:25 GMT""}]","2015-03-19"
"1103.4012","Francesca Tria","Simone Pompei, Vittorio Loreto and Francesca Tria","On the accuracy of language trees","36 pages, 14 figures",,"10.1371/journal.pone.0020109",,"physics.soc-ph cs.CL q-bio.QM","http://arxiv.org/licenses/nonexclusive-distrib/1.0/","  Historical linguistics aims at inferring the most likely language
phylogenetic tree starting from information concerning the evolutionary
relatedness of languages. The available information are typically lists of
homologous (lexical, phonological, syntactic) features or characters for many
different languages.
  From this perspective the reconstruction of language trees is an example of
inverse problems: starting from present, incomplete and often noisy,
information, one aims at inferring the most likely past evolutionary history. A
fundamental issue in inverse problems is the evaluation of the inference made.
A standard way of dealing with this question is to generate data with
artificial models in order to have full access to the evolutionary process one
is going to infer. This procedure presents an intrinsic limitation: when
dealing with real data sets, one typically does not know which model of
evolution is the most suitable for them. A possible way out is to compare
algorithmic inference with expert classifications. This is the point of view we
take here by conducting a thorough survey of the accuracy of reconstruction
methods as compared with the Ethnologue expert classifications. We focus in
particular on state-of-the-art distance-based methods for phylogeny
reconstruction using worldwide linguistic databases.
  In order to assess the accuracy of the inferred trees we introduce and
characterize two generalizations of standard definitions of distances between
trees. Based on these scores we quantify the relative performances of the
distance-based algorithms considered. Further we quantify how the completeness
and the coverage of the available databases affect the accuracy of the
reconstruction. Finally we draw some conclusions about where the accuracy of
the reconstructions in historical linguistics stands and about the leading
directions to improve it.
","[{""version"":""v1"",""created"":""Mon, 21 Mar 2011 13:59:43 GMT""}]","2015-05-27"
"1103.4013","Alessandra Silvestri","Alessandra Silvestri","Scalar radiation from Chameleon-shielded regions","4 pages, 4 figures, slightly edited version matching the journal
  version","Phys.Rev.Lett.106:251101,2011","10.1103/PhysRevLett.106.251101",,"astro-ph.CO gr-qc","http://arxiv.org/licenses/nonexclusive-distrib/1.0/","  I study the profile of the Chameleon field around a radially pulsating mass.
Focusing on the case in which the background (static) Chameleon profile
exhibits a thin-shell, I add small perturbations to the source in the form of
time-dependent radial pulsations. It is found that the Chameleon field inherits
a time-dependence, there is a resultant scalar radiation from the region of the
source and the metric outside the spherically symmetric mass is not static.
This has several interesting and potentially testable consequences.
","[{""version"":""v1"",""created"":""Mon, 21 Mar 2011 14:00:26 GMT""},{""version"":""v2"",""created"":""Fri, 24 Jun 2011 13:34:02 GMT""}]","2015-03-19"
"1103.4014","Piero D'Ancona","Federico Cacciafesta and Piero D'Ancona","Endpoint estimates and global existence for the nonlinear Dirac equation
  with potential",,,,"Roma01.Math","math.AP math-ph math.MP","http://arxiv.org/licenses/nonexclusive-distrib/1.0/","  We prove endpoint estimates with angular regularity for the wave and Dirac
equations perturbed with a small potential. The estimates are applied to prove
global existence for the cubic Dirac equation perturbed with a small potential,
for small initial $H^{1}$ data with additional angular regularity. This implies
in particular global existence in the critical energy space $H^{1}$ for small
radial data.
","[{""version"":""v1"",""created"":""Mon, 21 Mar 2011 14:02:31 GMT""}]","2019-07-25"
"1103.4015","Hideo Suganuma","H.Suganuma, T.Iritani, F.Okiharu, T.T.Takahashi and A.Yamamoto","Lattice QCD Study for Confinement in Hadrons",,,"10.1063/1.3647373",,"hep-lat hep-ph nucl-th","http://arxiv.org/licenses/nonexclusive-distrib/1.0/","  We study three subjects on quark confinement in hadrons in SU(3)$_{\rm c}$
lattice QCD. From the accurate lattice calculation for more than 300 different
patterns of three-quark (3Q) systems, we find that the static 3Q potential is
well described by Y-Ansatz, i.e., the Coulomb plus Y-type linear potential. We
also study the multi-quark (4Q, 5Q) potentials in lattice QCD, and find that
they are well described by the one-gluon-exchange (OGE) Coulomb plus
string-theoretical linear potential, which supports the {\it infrared string
picture} even for the multi-quarks. The second subject is a lattice-QCD
determination of the relevant gluonic momentum component for confinement. The
string tension (confining force) is found to be almost unchanged even after
cutting off the high-momentum gluon component above 1.5GeV in the Landau gauge.
In fact, {\it quark confinement originates from the low-momentum gluon below
about 1.5GeV.} Finally, we consider a possible gauge of QCD for the quark
potential model, by investigating ""instantaneous inter-quark potential"" in
generalized Landau gauge, which describes a continuous change from the Landau
gauge to the Coulomb gauge.
","[{""version"":""v1"",""created"":""Mon, 21 Mar 2011 14:04:34 GMT""}]","2015-05-27"
"1103.4016","Kashif Mahmood Mr","Kashif Mahmood, Mikko Vehkaper\""a, Yuming Jiang","Delay Constrained Throughput Analysis of a Correlated MIMO Wireless
  Channel","Submitted to ICCCN 2011, 8 pages, 5 figures",,,,"cs.NI","http://arxiv.org/licenses/nonexclusive-distrib/1.0/","  The maximum traffic arrival rate at the network for a given delay guarantee
(delay constrained throughput) has been well studied for wired channels.
However, few results are available for wireless channels, especially when
multiple antennas are employed at the transmitter and receiver. In this work,
we analyze the network delay constrained throughput of a multiple input
multiple output (MIMO) wireless channel with time-varying spatial correlation.
The MIMO channel is modeled via its virtual representation, where the
individual spatial paths between the antenna pairs are Gilbert-Elliot channels.
The whole system is then described by a K-State Markov chain, where K depends
upon the degree of freedom (DOF) of the channel. We prove that the DOF based
modeling is indeed accurate. Furthermore, we study the impact of the delay
requirements at the network layer, violation probability and the number of
antennas on the throughput under different fading speeds and signal strength.
","[{""version"":""v1"",""created"":""Mon, 21 Mar 2011 14:05:13 GMT""}]","2011-03-22"
"1103.4017","Krzysztof Pawlowski Mr","Przemyslaw Bienias, Krzysztof Pawlowski, Mariusz Gajda and Kazimierz
  Rzazewski","Statistical properties of one dimensional attractive Bose gas","4 pages, 4 figures",,"10.1209/0295-5075/96/10011",,"quant-ph cond-mat.quant-gas","http://arxiv.org/licenses/nonexclusive-distrib/1.0/","  Using classical field approximation we present the first study of statistical
properties of one dimensional Bose gas with attractive interaction. The
canonical probability distribution is generated with the help of a Monte Carlo
method. This way we obtain not only the depletion of the condensate with
growing temperature but also its fluctuations. The most important is our
discovery of a reduced coherence length, the phenomenon observed earlier only
for the repulsive gas, known as quasicondensation.
","[{""version"":""v1"",""created"":""Mon, 21 Mar 2011 14:08:25 GMT""}]","2015-05-27"
"1103.4018","G\""unter Hinrichs","Detlef D\""urr, G\""unter Hinrichs and Martin Kolb","On a stochastic Trotter formula with application to spontaneous
  localization models","submitted to Journal of Statistical Physics",,"10.1007/s10955-011-0235-6",,"math-ph math.MP math.PR quant-ph","http://arxiv.org/licenses/nonexclusive-distrib/1.0/","  We consider the relation between so called continuous localization models -
i.e. non-linear stochastic Schr\""odinger evolutions - and the discrete
GRW-model of wave function collapse. The former can be understood as scaling
limit of the GRW process. The proof relies on a stochastic Trotter formula,
which is of interest in its own right. Our Trotter formula also allows to
complement results on existence theory of stochastic Schr\""odinger evolutions
by Holevo and Mora/Rebolledo.
","[{""version"":""v1"",""created"":""Mon, 21 Mar 2011 14:11:38 GMT""}]","2015-05-27"
"1103.4019","Peter Haissinsky","Peter Ha\""issinsky (LATP), Kevin M. Pilgrim","Minimal Ahlfors regular conformal dimension of coarse conformal dynamics
  on the sphere",,,,,"math.DS math.MG","http://arxiv.org/licenses/nonexclusive-distrib/1.0/","  We prove that if the Ahlfors regular conformal dimension $Q$ of a
topologically cxc map on the sphere $f: S^2 \to S^2$ is realized by some metric
$d$ on $S^2$, then either Q=2 and $f$ is topologically conjugate to a
semihyperbolic rational map with Julia set equal to the whole Riemann sphere,
or $Q>2$ and $f$ is topologically conjugate to a map which lifts to an affine
expanding map of a torus whose differential has distinct real eigenvalues. This
is an analog of a known result for Gromov hyperbolic groups with two-sphere
boundary, and our methods apply to give a new proof.
","[{""version"":""v1"",""created"":""Mon, 21 Mar 2011 14:14:37 GMT""}]","2011-03-22"
"1103.4020","Alaska Subedi","Alaska Subedi, Lilia Boeri","Vibrational spectrum and electron-phonon coupling of doped solid picene
  from first principles","Replaced with the final version. Previous version had the title
  ""Solid picene: a possible exotic electron-phonon superconductor""","Phys. Rev. B 84, 020508(R) (2011)","10.1103/PhysRevB.84.020508",,"cond-mat.supr-con","http://arxiv.org/licenses/nonexclusive-distrib/1.0/","  We study superconductivity in doped solid picene (C22H14) with linear
response calculations of the phonon spectrum and electron-phonon (ep)
interaction. We show that the coupling of the high-energy C bond-stretching
phonons to the {\pi} molecular orbitals for a doping of ~3 electrons per picene
molecule is sufficiently strong to reproduce the experimental Tc of 18 K within
Migdal-Eliashberg theory. For hole doping, we predict a similar coupling
leading to a maximum Tc of 6 K. However, we argue that, due to its molecular
nature, picene may belong to the same class of strongly correlated ep
superconductors as fullerides. We propose several experimental tests for this
hypothesis and suggest that intercalated hydrocarbons with different
arrangements and numbers of benzene rings may be used to study the interplay
between ep interaction and strong electronic correlations in the highly
nonadiabatic limit.
","[{""version"":""v1"",""created"":""Mon, 21 Mar 2011 14:15:28 GMT""},{""version"":""v2"",""created"":""Mon, 25 Jul 2011 15:26:01 GMT""}]","2011-07-26"
"1103.4021","Wei-Min Zhang","Hua-Tang Tan, Wei-Min Zhang, Gao-xiang Li","Entangling two distant nanocavities via a waveguide","8 pages, 8 figures","Phys. Rev. A83, 062310 (2011)","10.1103/PhysRevA.83.062310",,"quant-ph cond-mat.mes-hall","http://arxiv.org/licenses/nonexclusive-distrib/1.0/","  In this paper, we investigate the generation of continuous variable
entanglement between two spatially-separate nanocavities mediated by a coupled
resonator optical waveguide in photonic crystals. By solving the exact dynamics
of the cavity system coupled to the waveguide, the entanglement and purity of
the two-mode cavity state are discussed in detail for the initially separated
squeezing inputs. It is found that the stable and pure entangled state of the
two distant nanocavities can be achieved with the requirement of only a weak
cavity-waveguide coupling when the cavities are resonant with the band center
of the waveguide. The strong couplings between the cavities and the waveguide
lead to the entanglement sudden death and sudden birth. When the frequencies of
the cavities lie outside the band of the waveguide, the waveguide-induced cross
frequency shift between the cavities can optimize the achievable entanglement.
It is also shown that the entanglement can be easily manipulated through the
changes of the cavity frequencies within the waveguide band.
","[{""version"":""v1"",""created"":""Mon, 21 Mar 2011 14:15:31 GMT""}]","2013-05-29"
"1103.4022","Wojciech Zajaczkowski","Jolanta Socala, Wojciech M. Zajaczkowski","Long time estimate of solutions to 3d Navier-Stokes equations coupled
  with the heat convection",,,,,"math.AP math-ph math.MP","http://arxiv.org/licenses/nonexclusive-distrib/1.0/","  We examine the Navier-Stokes equations with homogeneous slip boundary
conditions coupled with the heat equation with homogeneous Neumann conditions
in a bounded domain in $R^3$. The considered domain is a cylinder with
$x_3$-axis. The aim of this paper is to show long time estimates without
smallness of the initial velocity, the initial temperature and the external
force. To prove the estimate we need however smallness of $L_2$ norms of
derivatives with respect to $x_3$ of the initial velocity, the initial
temperature and the external force.
","[{""version"":""v1"",""created"":""Mon, 21 Mar 2011 14:15:42 GMT""}]","2011-03-22"
"1103.4023","Nicolas Durrande","Nicolas Durrande (CROCUS-ENSMSE), David Ginsbourger, Olivier Roustant
  (CROCUS-ENSMSE, - M\'ethodes d'Analyse Stochastique des Codes et Traitements
  Num\'eriques)","Additive Kernels for Gaussian Process Modeling",,,,,"stat.ML","http://arxiv.org/licenses/nonexclusive-distrib/1.0/","  Gaussian Process (GP) models are often used as mathematical approximations of
computationally expensive experiments. Provided that its kernel is suitably
chosen and that enough data is available to obtain a reasonable fit of the
simulator, a GP model can beneficially be used for tasks such as prediction,
optimization, or Monte-Carlo-based quantification of uncertainty. However, the
former conditions become unrealistic when using classical GPs as the dimension
of input increases. One popular alternative is then to turn to Generalized
Additive Models (GAMs), relying on the assumption that the simulator's response
can approximately be decomposed as a sum of univariate functions. If such an
approach has been successfully applied in approximation, it is nevertheless not
completely compatible with the GP framework and its versatile applications. The
ambition of the present work is to give an insight into the use of GPs for
additive models by integrating additivity within the kernel, and proposing a
parsimonious numerical method for data-driven parameter estimation. The first
part of this article deals with the kernels naturally associated to additive
processes and the properties of the GP models based on such kernels. The second
part is dedicated to a numerical procedure based on relaxation for additive
kernel parameter estimation. Finally, the efficiency of the proposed method is
illustrated and compared to other approaches on Sobol's g-function.
","[{""version"":""v1"",""created"":""Mon, 21 Mar 2011 14:16:55 GMT""}]","2011-03-22"
"1103.4024","Damir Becirevic","Damir Becirevic, Emmanuel Chang, Alain Le Yaouanc Luis Oliver,
  Jean-Claude Raynal","Spatial distributions in static heavy-light mesons: a comparison of
  quark models with lattice QCD","40 pages, 5 figures (version published in PRD)",,"10.1103/PhysRevD.84.054507","LPT 11-51","hep-ph hep-lat nucl-th","http://arxiv.org/licenses/nonexclusive-distrib/1.0/","  Lattice measurements of spatial distributions of the light quark bilinear
densities in static mesons allow to test directly and in detail the wave
functions of quark models. These distributions are gauge invariant quantities
directly related to the spatial distribution of wave functions. We make a
detailed comparison of the recent lattice QCD results with our own quark
models, formulated previously for quite different purposes. We find a striking
agreement not only between our two quark models, but also with the lattice QCD
data for the ground state in an important range of distances up to about 4/GeV.
Moreover the agreement extends to the L=1 states [j^P=(1/2)^+]. An explanation
of several particular features completely at odds with the non-relativistic
approximation is provided. A rather direct, somewhat unexpected and of course
approximate relation between wave functions of certain quark models and QCD has
been established.
","[{""version"":""v1"",""created"":""Mon, 21 Mar 2011 14:17:53 GMT""},{""version"":""v2"",""created"":""Mon, 19 Sep 2011 09:46:31 GMT""}]","2013-05-29"
"1103.4025","Cedric Bonnafe","C\'edric Bonnaf\'e (I3M), J\'er\'emie Guilhot","Asymptotic lowest two-sided cell","45 pages, 10 figures",,,,"math.RT math.GR","http://arxiv.org/licenses/nonexclusive-distrib/1.0/","  To a Coxeter system $(W,S)$ (with $S$ finite) and a weight function $L : W
\to \NM$ is associated a partition of $W$ into Kazhdan-Lusztig (left, right or
two-sided) $L$-cells. Let $S^\circ = \{s \in S | L(s)=0\}$, $S^+=\{s \in S |
L(s) > 0\}$ and let $C$ be a Kazhdan-Lusztig (left, right or two-sided)
$L$-cell. According to the semicontinuity conjecture of the first author, there
should exist a positive natural number $m$ such that, for any weight function
$L' : W \to \NM$ such that $L(s^+)=L'(s^+) > m L'(s^\circ)$ for all $s^+ \in
S^+$ and $s^\circ \in S^\circ$, $C$ is a union of Kazhdan-Lusztig (left, right
or two-sided) $L'$-cells. The aim of this paper is to prove this conjecture
whenever $(W,S)$ is an affine Weyl group and $C$ is contained in the lowest
two-sided $L$-cell.
","[{""version"":""v1"",""created"":""Mon, 21 Mar 2011 14:18:21 GMT""},{""version"":""v2"",""created"":""Tue, 19 Apr 2011 07:32:04 GMT""}]","2011-04-20"
"1103.4026","Sharon Toolan","Bradley C. Whitmore (1), Rupali Chandar (2), Hwihyun Kim (3),
  Catherine Kaleida (3), Max Mutchler (1), Daniela Calzetti (4), Abhijit Saha
  (5), Robert O'Connell (6), Bruce Balick (7), Howard E. Bond (1), Marcella
  Carollo (8), Michael J. Disney (9), Michael A. Dopita (10), Jay A. Frogel
  (11), Donald N. B. Hall (12), Jon A. Holtzman (13), Randy A. Kimble (14),
  Patrick J. McCarthy (15), Francesco Paresce (16), Joseph I. Silk (17), John
  T. Trauger (18), Alistair R. Walker (19), Rogier A. Windhorst (3) and Erick
  T. Young (20) ((1) Space Telescope Science Institute, (2) The University of
  Toledo, (3) Arizona State University, (4) University of Massachusetts, (5)
  NOAO, (6) University of Virginia, (7) University of Washington, (8) Institute
  of Astronomy, ETH-Zurich, (9) Cardiff University, (10) Australian National
  University, (11) AURA, (12) Institute for Astronomy, (13) New Mexico State
  University, (14) Goddard Space Flight Center, (15) Carnegie Institute of
  Washington, (16) Istituto di Astrofisica Spaziale e Fisica Cosmica, INAF,
  (17) University of Oxford, (18) NASA JPL, (19) Cerro Tololo Inter-American
  Observatory, (20) NASA-Ames Research Center)","Using H-alpha Morphology and Surface Brightness Fluctuations to Age-Date
  Star Clusters in M83","33 pages, 10 figures, 3 tables; published in March ApJ","2011ApJ...729...78W","10.1088/0004-637X/729/2/78",,"astro-ph.GA","http://arxiv.org/licenses/nonexclusive-distrib/1.0/","  We use new WFC3 observations of the nearby grand design spiral galaxy M83 to
develop two independent methods for estimating the ages of young star clusters.
The first method uses the physical extent and morphology of Halpha emission to
estimate the ages of clusters younger than tau ~10 Myr. It is based on the
simple premise that the gas in very young (tau < few Myr) clusters is largely
coincident with the cluster stars, is in a small, ring-like structure
surrounding the stars in slightly older clusters (e.g., tau ~5 Myr), and is in
a larger ring-like bubble for still older clusters (i.e., ~5-10 Myr). The
second method is based on an observed relation between pixel-to-pixel flux
variations within clusters and their ages. This method relies on the fact that
the brightest individual stars in a cluster are most prominent at ages around
10 Myr, and fall below the detection limit (i.e., M_V < -3.5) for ages older
than about 100 Myr. These two methods are the basis for a new morphological
classification system which can be used to estimate the ages of star clusters
based on their appearance. We compare previous age estimates of clusters in M83
determined from fitting UBVI Halpha measurements using predictions from stellar
evolutionary models with our new morphological categories and find good
agreement at the ~95% level. The scatter within categories is ~0.1 dex in log
tau for young clusters (<10 Myr) and ~0.5 dex for older (>10 Myr) clusters. A
by-product of this study is the identification of 22 ""single-star"" HII regions
in M83, with central stars having ages ~4 Myr.
","[{""version"":""v1"",""created"":""Mon, 21 Mar 2011 14:18:36 GMT""}]","2011-03-22"
"1103.4027","Wojciech Zajaczkowski","Jolanta Socala, Wojciech M. Zajaczkowski","Long time existence of regular solutions to 3d Navier-Stokes equations
  coupled with the heat convection",,,,,"math.AP math-ph math.MP","http://arxiv.org/licenses/nonexclusive-distrib/1.0/","  We prove long time existence of regular solutions to the Navier-Stokes
equations coupled with the heat equation. We consider the system in non-axially
symmetric cylinder with the slip boundary conditions for the Navier-Stokes
equations and the Neumann condition for the heat equation. The long time
existence is possible because we assumed that derivatives with respect to the
variable along the axis of the cylinder of the initial velocity, initial
temperature and the external force in $L_2$ norms are sufficiently small. We
proved the existence of such solutions that velocity and temperature belong to
$W_\sigma^{2,1}(\Omega\times(0,T))$, where $\sigma>{5\over3}$. The existence is
proved by the Leray-Schauder fixed point theorem.
","[{""version"":""v1"",""created"":""Mon, 21 Mar 2011 14:21:54 GMT""}]","2011-03-22"
"1103.4028","Yu. A. Simonov","Yu. A. Simonov, ITEP (Moscow)","Relativistic theory of string breaking in QCD","LaTeX2,17 pages,2 figures","Phys. Rev. D 84, 065013 (2011)","10.1103/PhysRevD.84.065013",,"hep-ph","http://arxiv.org/licenses/nonexclusive-distrib/1.0/","  The QCD string breaking due to quark pair creation in the vacuum confining
field, possibly accompanied by vector, scalar or Nambu-Goldstone bosons, is
studied nonperturbatively. The scalar light pair creation vertex occurs due to
chiral symmetry breaking and has a confining form, which is computed explicitly
together with subleading vector contributions. Dependence on light quark mass
and flavor is specifically studied. The dominant scalar term is in good
agreement with the $^3P_0$ model and experimental data.
","[{""version"":""v1"",""created"":""Mon, 21 Mar 2011 14:22:25 GMT""}]","2014-01-29"
"1103.4029","Mehdi Fhima","Mehdi Fhima, Arnaud Guillin, Pierre R. Bertrand (INRIA Saclay - Ile de
  France)","Fast change point analysis on the Hurst index of piecewise fractional
  Brownian motion",,,,,"math.ST stat.TH","http://arxiv.org/licenses/nonexclusive-distrib/1.0/","  In this presentation, we introduce a new method for change point analysis on
the Hurst index for a piecewise fractional Brownian motion. We first set the
model and the statistical problem. The proposed method is a transposition of
the FDpV (Filtered Derivative with p-value) method introduced for the detection
of change points on the mean in Bertrand et al. (2011) to the case of changes
on the Hurst index. The underlying statistics of the FDpV technology is a new
statistic estimator for Hurst index, so-called Increment Bernoulli Statistic
(IBS). Both FDpV and IBS are methods with linear time and memory complexity,
with respect to the size of the series. Thus the resulting method for change
point analysis on Hurst index reaches also a linear complexity.
","[{""version"":""v1"",""created"":""Mon, 21 Mar 2011 14:25:18 GMT""}]","2011-03-23"
