"1103.3891","Mohammad Shojaei Arani","Majid Gazor and Pei Yu","The spectral sequences and parametric normal forms",,"J. Differential Equations 2012, Vol 252, pages 1003-1031","10.1016/j.jde.2011.09.043",,"math.DS","http://arxiv.org/licenses/nonexclusive-distrib/1.0/","  We generalize recent developments on normal forms and the spectral sequences
method to make a foundation for parametric normal forms. We further introduce a
new style and costyle to obtain unique parametric normal forms. The results are
applied to systems of generalized Hopf singularity with multiple parameters. A
different (new) version of this paper has been submitted for a possible
publication in a refereed journal.
","[{""version"":""v1"",""created"":""Sun, 20 Mar 2011 21:34:23 GMT""}]","2013-06-11"
"1103.3892","Agn\`es David","Agn\`es David","Caract\`ere d'isog\'enie et crit\`eres d'irr\'eductibilit\'e","30 pages, en fran\c{c}ais ; shortened arguments (results unchanged) ;
  added references",,,,"math.NT","http://arxiv.org/licenses/nonexclusive-distrib/1.0/","  This article deals with the Galois representation attached to elliptic curves
with an isogeny of prime degree over a number field. We first determine uniform
criteria for the irreducibility of Galois representations attached to elliptic
curves in some infinite families, characterised by their reduction type at some
fixed places of the base field. Then, we give an explicit form for a bound that
appear in a theorem of Momose. Finally, we use these results to precise a
previous theorem of the author about the homotheties contained in the image of
the Galois representation.
","[{""version"":""v1"",""created"":""Sun, 20 Mar 2011 21:36:20 GMT""},{""version"":""v2"",""created"":""Wed, 8 Feb 2012 10:17:36 GMT""}]","2012-02-09"
"1103.3893","Armin Straub","Jonathan M. Borwein and Armin Straub","Log-sine evaluations of Mahler measures","25 pages",,,,"math.CA math-ph math.MP","http://arxiv.org/licenses/nonexclusive-distrib/1.0/","  We provide evaluations of several recently studied higher and multiple Mahler
measures using log-sine integrals. This is complemented with an analysis of
generating functions and identities for log-sine integrals which allows the
evaluations to be expressed in terms of zeta values or more general
polylogarithmic terms. The machinery developed is then applied to evaluation of
further families of multiple Mahler measures.
","[{""version"":""v1"",""created"":""Sun, 20 Mar 2011 21:38:47 GMT""}]","2011-03-29"
"1103.3894","Stefano Olivares","Stefano Olivares and Matteo G. A. Paris","Fidelity matters: the birth of entanglement in the interference of
  Gaussian states","4 pages, 2 figures; revised version accepted for publication in Phys.
  Rev. Lett","Phys. Rev. Lett. 107, 170505 (2011)","10.1103/PhysRevLett.107.170505",,"quant-ph","http://creativecommons.org/licenses/by/3.0/","  We address the interaction of two Gaussian states interferring at a beam
splitter and analyze the correlations exhibited by the resulting bipartite
system. We demonstrate that nonlocal correlations (entanglement) arise if and
only if the fidelity between the two input Gaussian states falls under a
threshold value depending only on their purities and on the transmissivity of
the beam splitter. Our result clarifies the role of squeezing as a prerequisite
for entanglement and provide a tool to optimize the generation of entanglement
by passive devices.
","[{""version"":""v1"",""created"":""Sun, 20 Mar 2011 22:11:02 GMT""},{""version"":""v2"",""created"":""Tue, 22 Mar 2011 12:45:23 GMT""},{""version"":""v3"",""created"":""Wed, 21 Sep 2011 08:20:33 GMT""}]","2015-05-27"
"1103.3895","Travis S. Barman","Travis S. Barman, Bruce Macintosh, Quinn M. Konopacky, Christian
  Marois","Clouds and Chemistry in the Atmosphere of Extrasolar Planet HR8799b","17 pages, accepted for publication in The Astrophysical Journal",,"10.1088/0004-637X/733/1/65",,"astro-ph.EP","http://arxiv.org/licenses/nonexclusive-distrib/1.0/","  Using the integral field spectrograph OSIRIS, on the Keck II telescope, broad
near-infrared H and K-band spectra of the young exoplanet HR8799b have been
obtained. In addition, six new narrow-band photometric measurements have been
taken across the H and K bands. These data are combined with previously
published photometry for an analysis of the planet's atmospheric properties.
Thick photospheric dust cloud opacity is invoked to explain the planet's red
near-IR colors and relatively smooth near-IR spectrum. Strong water absorption
is detected, indicating a Hydrogen-rich atmosphere. Only weak CH4 absorption is
detected at K band, indicating efficient vertical mixing and a disequilibrium
CO/CH4 ratio at photospheric depths. The H-band spectrum has a distinct
triangular shape consistent with low surface gravity. New giant planet
atmosphere models are compared to these data with best fitting bulk parameters,
Teff = 1100K +- 100 and log(g) = 3.5 +-0.5 (for solar composition). Given the
observed luminosity, log(Lobs/Lsun) ~ -5.1, these values correspond to a radius
of 0.75 Rjup (+0.17, -0.12) and mass ~ 0.72 Mjup (+2.6,-0.6) -- strikingly
inconsistent with interior/evolution models. Enhanced metallicity (up to ~ 10
times that of the Sun) along with thick clouds and non-equilibrium chemistry
are likely required to reproduce the complete ensemble of spectroscopic and
photometric data and the low effective temperatures (< 1000K) required by the
evolution models.
","[{""version"":""v1"",""created"":""Sun, 20 Mar 2011 22:11:56 GMT""}]","2015-05-27"
"1103.3896","David Latham PhD","David W. Latham (Harvard-Smithsonian Center for Astrophysics), Jason
  F. Rowe (NASA Ames Research Center), Samuel N. Quinn (Harvard-Smithsonian
  Center for Astrophysics) Natalie M. Batalha (San Jose State University),
  William J. Borucki (NASA Ames Research Center), Timothy M. Brown (Las Cumbres
  Observatory Global Telescope), Stephen T. Bryson (NASA Ames Research Center),
  Lars A. Buchhave (Neils Bohr Institute, Copenhagen University), Douglas A.
  Caldwell (SETI Institute, NASA Ames Research Center), Joshua A. Carter
  (Harvard-Smithsonian Center for Astrophysics), Jesse L. Christiansen (SETI
  Institute, NASA Ames Research Center), David R. Ciardi (NASA Exoplanet
  Science Institute/California Institute of Technology), William D. Cochran
  (University of Texas, Austin), Edward W. Dunham (Lowell Observatory), Daniel
  C. Fabrycky (University of California, Santa Cruz), Eric B. Ford (University
  of Florida), Thomas N. Gautier III (Jet Propulsion Laboratory/California
  Institute of Technology), Ronald L. Gilliland (Space Telescope Science
  Institute), Matthew J. Holman (Harvard-Smithsonian Center for Astrophysics),
  Steve B. Howell (National Optical Astronomy Observatory/NASA Ames Research
  Center), Khadeejah A. Ibrahim (Orbital Sciences Corporation/NASA Ames
  Research Center), Howard Isaacson (University of California, Berkeley), Gibor
  Basri (University of California, Berkeley), Gabor Furesz (Harvard-Smithsonian
  Center for Astrophysics), John C. Geary (Harvard-Smithsonian Center for
  Astrophysics), Jon M. Jenkins (SETI Institute/NASA Ames Research Center),
  David G. Koch (NASA Ames Research Center), Jack J. Lissauer (NASA Ames
  Research Center), Geoffrey W. Marcy (University of California, Berkeley),
  Elisa V. Quintana (SETI Institute, NASA Ames Research Center), Darin
  Ragozzine (Harvard-Smithsonian Center for Astrophysics), Dimitar D. Sasselov
  (Harvard-Smithsonian Center for Astrophysics) Avi Shporer (Las Cumbres
  Observatory Global Telescope), Jason H. Steffen (Fermilab Center for Particle
  Astrophysics), William F. Welsh (San Diego State University), Bill Wohler
  (Orbital Sciences Corporation/NASA Ames Research Center)","A First Comparison of Kepler Planet Candidates in Single and Multiple
  Systems","13 pages, 13 figures, submitted to ApJ Letters",,"10.1088/2041-8205/732/2/L24",,"astro-ph.EP","http://arxiv.org/licenses/nonexclusive-distrib/1.0/","  In this letter we present an overview of the rich population of systems with
multiple candidate transiting planets found in the first four months of Kepler
data. The census of multiples includes 115 targets that show 2 candidate
planets, 45 with 3, 8 with 4, and 1 each with 5 and 6, for a total of 170
systems with 408 candidates. When compared to the 827 systems with only one
candidate, the multiples account for 17 percent of the total number of systems,
and a third of all the planet candidates. We compare the characteristics of
candidates found in multiples with those found in singles. False positives due
to eclipsing binaries are much less common for the multiples, as expected.
Singles and multiples are both dominated by planets smaller than Neptune; 69
+2/-3 percent for singles and 86 +2/-5 percent for multiples. This result, that
systems with multiple transiting planets are less likely to include a
transiting giant planet, suggests that close-in giant planets tend to disrupt
the orbital inclinations of small planets in flat systems, or maybe even to
prevent the formation of such systems in the first place.
","[{""version"":""v1"",""created"":""Sun, 20 Mar 2011 22:16:39 GMT""}]","2015-05-27"
"1103.3897","Dominik Riechers","Dominik A. Riechers (Caltech)","Constraints on the Star-Forming Interstellar Medium in Galaxies Back to
  the First Billion Years of Cosmic Time","12 pages, 6 figures, invited talk paper, to appear in ASP Conference
  Series, ""Galaxy Evolution: Infrared to Millimeter Wavelength Perspective"",
  25-29 October 2010, Guilin, China",,,,"astro-ph.CO","http://arxiv.org/licenses/nonexclusive-distrib/1.0/","  Constraints on the molecular gas content of galaxies at high redshift are
crucial to further our understanding of star formation and galaxy evolution
through cosmic times, as molecular gas is the fuel for star formation. Since
its initial detection at large cosmic distances almost two decades ago, studies
of molecular gas in the early universe have come a long way. We have detected
CO emission from >100 galaxies, covering a range of galaxy populations at z>1,
reaching out to z>6, down to sub-kpc scale resolution, and spanning ~2 orders
of magnitude in gas mass (aided by gravitational lensing). Recently, it has
even become possible to directly identify distant galaxies through their
molecular emission lines without prior knowledge of their redshifts. The new
generation of powerful long wavelength interferometers such as the Expanded
Very Large Array (EVLA) and Atacama Large (sub)Millimeter Array (ALMA) thus
hold the promise to liberate studies of molecular gas in high redshift galaxies
from their heavy pre-selection. This will enable more systematic studies of the
molecular gas content in star-forming galaxies back to the earliest cosmic
times.
","[{""version"":""v1"",""created"":""Sun, 20 Mar 2011 22:30:32 GMT""}]","2011-03-22"
"1103.3898","Charis Anastopoulos","Charis Anastopoulos and Ntina Savvidou","Entropy of singularities in self-gravitating radiation","28 pages, 9 figures. Revised version with additional comments and
  references, and a section on physical interpretation. Version to appear in
  CQG","Class. Quantum Grav. 29, 025004 (2012)",,,"gr-qc","http://arxiv.org/licenses/nonexclusive-distrib/1.0/","  The Bekenstein-Hawking entropy suggests that thermodynamics is an intrinsic
ingredient of gravity. Here, we explore the idea that requirements of
thermodynamic consistency could determine the gravitational entropy in other
set-ups. We implement this idea in a simple model: static, spherically
symmetric solutions to Einstein's equations corresponding to self-gravitating
radiation. We find that the principle of maximum entropy provides a consistent
thermodynamic description of the system, only if the entropy includes a
contribution from the spacetime singularities that appear in the solutions of
Einstein's equations. The form of the singularity entropy is stringently
constrained from consistency requirements, so that the existence of a simple
expression satisfying these constraints is highly non-trivial, and suggests of
a fundamental origin. We find that the system is characterized by three
equilibrium phases, and we conduct a preliminary investigation of the
associated phase transitions. These results demonstrate the point that
gravitational entities other than horizons are endowed with thermodynamic
properties.
","[{""version"":""v1"",""created"":""Sun, 20 Mar 2011 22:42:47 GMT""},{""version"":""v2"",""created"":""Wed, 30 Nov 2011 12:24:29 GMT""}]","2011-12-23"
"1103.3899","Clement  Ampadu B","Clement Ampadu","Limit Theorems For Quantum Walks Associated with Hadamard Matrices",,"Physical Review A, Volume 84, Number 1,012324 (2011)","10.1103/PhysRevA.84.012324",,"quant-ph math-ph math.MP","http://arxiv.org/licenses/nonexclusive-distrib/1.0/","  We study a one-parameter family of discrete-time quantum walk models on the
line and in the xy-plane associated with the Hadamard walk. Weak convergence in
the long-time limit of all moments of the walker's pseudo-velocity on the line
and in the xy-plane is proved. Symmetrization on the line and in the xy-plane
is theoretically investigated, leading to the resolution of the
Konno-Namiki-Soshi conjecture in the special case of symmetrization of the
unbiased Hadamard walk on the line . A necessary condition for the existence of
a phenomenon known as localization is given.
","[{""version"":""v1"",""created"":""Sun, 20 Mar 2011 22:48:27 GMT""},{""version"":""v2"",""created"":""Mon, 30 May 2011 19:31:45 GMT""},{""version"":""v3"",""created"":""Tue, 7 Jun 2011 20:51:45 GMT""},{""version"":""v4"",""created"":""Fri, 22 Jul 2011 00:57:35 GMT""}]","2011-07-25"
"1103.3900","Philippe Thebault","Philippe Thebault","Against all odds? Forming the planet of the HD196885 binary","accepted for publication by Celestial Mechanics and Dynamical
  Astronomy (Special issue on EXOPLANETS)",,"10.1007/s10569-011-9346-2",,"astro-ph.EP","http://arxiv.org/licenses/nonexclusive-distrib/1.0/","  HD196885Ab is the most ""extreme"" planet-in-a-binary discovered to date, whose
orbit places it at the limit for orbital stability. The presence of a planet in
such a highly perturbed region poses a clear challenge to planet-formation
scenarios. We investigate this issue by focusing on the planet-formation stage
that is arguably the most sensitive to binary perturbations: the mutual
accretion of kilometre-sized planetesimals. To this effect we numerically
estimate the impact velocities $dv$ amongst a population of circumprimary
planetesimals. We find that most of the circumprimary disc is strongly hostile
to planetesimal accretion, especially the region around 2.6AU (the planet's
location) where binary perturbations induce planetesimal-shattering $dv$ of
more than 1km/s. Possible solutions to the paradox of having a planet in such
accretion-hostile regions are 1) that initial planetesimals were very big, at
least 250km, 2) that the binary had an initial orbit at least twice the present
one, and was later compacted due to early stellar encounters, 3) that
planetesimals did not grow by mutual impacts but by sweeping of dust (the
""snowball"" growth mode identified by Xie et al., 2010b), or 4) that HD196885Ab
was formed not by core-accretion but by the concurent disc instability
mechanism. All of these 4 scenarios remain however highly conjectural.
","[{""version"":""v1"",""created"":""Sun, 20 Mar 2011 22:49:55 GMT""}]","2015-05-27"
"1103.3901","Serge Richard","S. Richard","Time delay for an abstract quantum scattering process","11 pages",,,,"math-ph math.MP","http://arxiv.org/licenses/nonexclusive-distrib/1.0/","  In this short review paper, we discuss the concept of time delay for an
abstract quantum scattering system. Its definition in terms of sojourn times is
explained as well as its identity with the so-called Eisenbud-Wigner time
delay. Necessary and natural conditions for such a construction are introduced
and thoroughly discussed. Assumptions and statements are precisely formulated
but proofs are contained in two companion papers written in collaboration with
R. Tiedra de Aldecoa.
","[{""version"":""v1"",""created"":""Sun, 20 Mar 2011 23:06:41 GMT""}]","2011-03-22"
"1103.3902","Hilmar Forkel","Hilmar Forkel","Multiquark correlations in light mesons and baryons from holographic QCD","7 pages, no figures",,"10.1063/1.3647369",,"hep-ph","http://arxiv.org/licenses/nonexclusive-distrib/1.0/","  A hadron's multiquark content reflects itself in the quark composition of the
interpolator with which it has maximal overlap. The AdS/CFT dictionary
translates the anomalous dimension of this interpolator into a mass correction
for the corresponding dual mode. Hence such bulk-mass corrections can carry
holographic information on multiquark correlations. Two prominent examples are
studied by implementing this robust and universal mechanism into AdS/QCD
gravity duals. In the baryon sector bulk-mass corrections are used to describe
systematic good (i.e. maximally attractive) diquark effects. The baryon sizes
are predicted to decrease with increasing good-diquark content, and the masses
of all 48 observed light-quark baryon states are reproduced with unprecedented
accuracy. Our approach further provides the first holographic description of a
dominant tetraquark component in the lowest-lying scalar mesons. The tetraquark
ground state emerges naturally as the lightest scalar nonet whereas higher
excitations become heavier than their quark--antiquark counterparts and are
thus likely to dissolve into the multiparticle continuum.
","[{""version"":""v1"",""created"":""Sun, 20 Mar 2011 23:38:17 GMT""}]","2015-05-27"
"1103.3903","Alexander Rand","Alexander Rand","Improved Examples of Non-Termination for Ruppert's Algorithm",,,,,"cs.CG","http://arxiv.org/licenses/nonexclusive-distrib/1.0/","  Improving the best known examples, two planar straight-line graphs which
cause the non-termination of Ruppert's algorithm for a minimum angle threshold
as low as 29.06 degrees are given.
","[{""version"":""v1"",""created"":""Sun, 20 Mar 2011 23:46:42 GMT""}]","2011-03-22"
"1103.3904","Daniel Harabor D","Daniel Harabor and Philip Kilby","Informed Heuristics for Guiding Stem-and-Cycle Ejection Chains",,,,,"cs.AI cs.DM","http://arxiv.org/licenses/nonexclusive-distrib/1.0/","  The state of the art in local search for the Traveling Salesman Problem is
dominated by ejection chain methods utilising the Stem-and-Cycle reference
structure. Though effective such algorithms employ very little information in
their successor selection strategy, typically seeking only to minimise the cost
of a move. We propose an alternative approach inspired from the AI literature
and show how an admissible heuristic can be used to guide successor selection.
We undertake an empirical analysis and demonstrate that this technique often
produces better results than less informed strategies albeit at the cost of
running in higher polynomial time.
","[{""version"":""v1"",""created"":""Mon, 21 Mar 2011 00:15:00 GMT""}]","2011-03-22"
"1103.3905","David Bonfield","D. G. Bonfield, M. J. Jarvis, M. J. Hardcastle, A. Cooray, E.
  Hatziminaoglou, R. J. Ivison, M. J. Page, J. A. Stevens, G. de Zotti, R.
  Auld, M. Baes, S. Buttiglione, A. Cava, A. Dariush, J. S. Dunlop, L. Dunne,
  S. Dye, S. Eales, J. Fritz, R. Hopwood, E. Ibar, S. J. Maddox, M. J.
  Micha{\l}owski, E. Pascale, M. Pohlen, E. E. Rigby, G. Rodighiero, S.
  Serjeant, D. J. B. Smith, P. Temi, P. van der Werf","Herschel-ATLAS: The link between accretion luminosity and star formation
  in quasar host galaxies","10 pages, accepted for publication in MNRAS (compared with v1, this
  version has a very slightly expanded discussion of the comparison to other
  work)",,"10.1111/j.1365-2966.2011.18826.x",,"astro-ph.CO","http://arxiv.org/licenses/nonexclusive-distrib/1.0/","  We use the science demonstration field data of the Herschel-ATLAS to study
how star formation, traced by the far-infrared Herschel data, is related to
both the accretion luminosity and redshift of quasars selected from the Sloan
Digital Sky Survey and the 2SLAQ survey. By developing a maximum likelihood
estimator to investigate the presence of correlations between the far-infrared
and optical luminosities we find evidence that the star-formation in quasar
hosts is correlated with both redshift and quasar accretion luminosity.
Assuming a relationship of the form L_IR \propto L_QSO^{\theta} (1 +
z)^{\zeta}, we find {\theta} = 0.22 +/- 0.08 and {\zeta} = 1.6 +/- 0.4,
although there is substantial additional uncertainty in {\zeta} of order +/- 1,
due to uncertainties in the host galaxy dust temperature. We find evidence for
a large intrinsic dispersion in the redshift dependence, but no evidence for
intrinsic dispersion in the correlation between L_QSO and L_IR, suggesting that
the latter may be due to a direct physical connection between star formation
and black hole accretion. This is consistent with the idea that both the quasar
activity and star formation are dependent on the same reservoir of cold gas, so
that they are both affected by the influx of cold gas during mergers or heating
of gas via feedback processes.
","[{""version"":""v1"",""created"":""Mon, 21 Mar 2011 00:17:52 GMT""},{""version"":""v2"",""created"":""Thu, 31 Mar 2011 16:15:32 GMT""}]","2015-05-27"
"1103.3906","Alberto Condori","Alberto A. Condori","An index formula in connection with meromorphic approximation",,,,,"math.FA math.CA math.CV","http://arxiv.org/licenses/nonexclusive-distrib/1.0/","  Let $\Phi$ be a continuous $n\times n$ matrix-valued function on the unit
circle $\T$ such that the $(k-1)$th singular value of the Hankel operator with
symbol $\Phi$ is greater than the $k$th singular value. In this case, it is
well-known that $\Phi$ has a unique superoptimal meromorphic approximant $Q$ in
$H^{\infty}_{(k)}$; that is, $Q$ has at most $k$ poles in the unit disc
$\mathbb{D}$ (i.e. the McMillan degree of $Q$ in $\mathbb{D}$ is at most $k$)
and $Q$ minimizes the essential suprema of singular values
$s_{j}((\Phi-Q)(\zeta))$, $j\geq0$, with respect to the lexicographic ordering.
For each $j\geq 0$, the essential supremum of $s_{j}((\Phi-Q)(\zeta))$ is
called the $j$th superoptimal singular value of $\Phi$ of degree $k$. We prove
that if $\Phi$ has $n$ non-zero superoptimal singular values of degree $k$,
then the Toeplitz operator $T_{\Phi-Q}$ with symbol $\Phi-Q$ is Fredholm and
has index \[ \ind T_{\Phi-Q}=\dim\ker T_{\Phi-Q}=2k+\dim\mathcal{E}, \] where
$\mathcal{E}=\{\xi\in\ker H_{Q}: \|H_{\Phi}\xi\|_{2}=\|(\Phi-Q)\xi\|_{2}\}$ and
$H_{\Phi}$ denotes the Hankel operator with symbol $\Phi$. In fact, this result
can be extended from continuous matrix-valued functions to the wider class of
$k$-\emph{admissible} matrix-valued functions, i.e. essentially bounded
$n\times n$ matrix-valued functions $\Phi$ on $\T$ for which the essential norm
of the Hankel operator $H_{\Phi}$ is strictly less than the smallest non-zero
superoptimal singular value of $\Phi$ of degree $k$.
","[{""version"":""v1"",""created"":""Mon, 21 Mar 2011 00:22:22 GMT""},{""version"":""v2"",""created"":""Fri, 20 May 2011 20:41:57 GMT""}]","2011-05-24"
"1103.3907","John Dobson","John Blythe Dobson","On Lerch's formula for the Fermat quotient","10 tables (at end)",,,,"math.NT","http://arxiv.org/licenses/nonexclusive-distrib/1.0/","  This paper explores some previously-unrecognized consequences of Lerch's 1905
formula for the Fermat quotient, with special attention to the sums which he
introduced in this context. A generalization of his result is proved, and a new
proof given of a sharpened result by Skula (2008). We also sharpen the criteria
given by Emma Lehmer in 1938 for a Wieferich prime to be simultaneously a
Mirimanoff prime.
","[{""version"":""v1"",""created"":""Mon, 21 Mar 2011 00:34:15 GMT""},{""version"":""v2"",""created"":""Mon, 18 Apr 2011 01:28:18 GMT""},{""version"":""v3"",""created"":""Mon, 25 Jun 2012 06:16:56 GMT""},{""version"":""v4"",""created"":""Sun, 6 Jul 2014 21:37:44 GMT""},{""version"":""v5"",""created"":""Sat, 16 Jul 2016 06:09:11 GMT""},{""version"":""v6"",""created"":""Sat, 1 Apr 2017 19:25:09 GMT""}]","2017-04-04"
"1103.3908","Hans Christianson","Hans Christianson and Jared Wunsch","Local smoothing for the Schr\""odinger equation with a prescribed loss","26 pages, incorporated referee's comments",,,,"math.AP math.SP","http://arxiv.org/licenses/nonexclusive-distrib/1.0/","  We consider a family of surfaces of revolution, each with a single periodic
geodesic which is degenerately unstable. We prove a local smoothing estimate
for solutions to the linear Schr\""odinger equation with a loss that depends on
the degeneracy, and we construct explicit examples to show our estimate is
saturated on a weak semiclassical time scale. As a byproduct of our proof, we
obtain a cutoff resolvent estimate with a sharp polynomial loss.
","[{""version"":""v1"",""created"":""Mon, 21 Mar 2011 01:13:37 GMT""},{""version"":""v2"",""created"":""Fri, 27 Jan 2012 16:38:48 GMT""}]","2012-01-30"
