"1103.5604","Enrico Calzavarini","Luca Biferale, Enrico Calzavarini and Federico Toschi","Multi-Time Multi-Scale Correlation Functions in Hydrodynamic Turbulence","6 pages, 4 figures","Phys. Fluids 23, 085107 (2011)","10.1063/1.3623466",,"physics.flu-dyn nlin.CD","http://arxiv.org/licenses/nonexclusive-distrib/1.0/","  High Reynolds numbers Navier-Stokes equations are believed to break
self-similarity concerning both spatial and temporal properties: correlation
functions of different orders exhibit distinct decorrelation times and
anomalous spatial scaling properties. Here, we present a systematic attempt to
measure multi-time and multi-scale correlations functions, by using high
Reynolds numbers numerical simulations of fully homogeneous and isotropic
turbulent flow. The main idea is to set-up an ensemble of probing stations
riding the flow, i.e. measuring correlations in a reference frame centered on
the trajectory of distinct fluid particles (the quasi-Lagrangian reference
frame introduced by Belinicher & L'vov, Sov. Phys. JETP 66, 303 (1987)). In
this way we reduce the large-scale sweeping and measure the non-trivial
temporal dynamics governing the turbulent energy transfer from large to small
scales. We present evidences of the existence of dynamic multiscaling:
multi-time correlation functions are characterized by an infinite set of
characteristic times.
","[{""version"":""v1"",""created"":""Tue, 29 Mar 2011 11:20:08 GMT""}]","2012-10-04"
"1103.5605","Martin Keller-Ressel","Martin Keller-Ressel, Aleksandar Mijatovic","On the Limit Distributions of Continuous-State Branching Processes with
  Immigration","minor update; to appear in SPA",,,,"math.PR","http://arxiv.org/licenses/nonexclusive-distrib/1.0/","  We consider the class of continuous-state branching processes with
immigration (CBI-processes), introduced by Kawazu and Watanabe (1971) and their
limit distributions as time tends to infinity. We determine the Levy-Khintchine
triplet of the limit distribution and give an explicit description in terms of
the characteristic triplets of the Levy subordinator and the spectrally
positive Levy process, which describe the immigration resp. branching mechanism
of the CBI-process. This representation allows us to describe the support of
the limit distribution and characterise its absolute continuity and asymptotic
behavior at the boundary of the support, generalizing several known results on
self-decomposable distributions.
","[{""version"":""v1"",""created"":""Tue, 29 Mar 2011 11:30:52 GMT""},{""version"":""v2"",""created"":""Wed, 28 Sep 2011 12:07:10 GMT""},{""version"":""v3"",""created"":""Wed, 28 Mar 2012 12:56:18 GMT""}]","2012-03-29"
"1103.5606","Wan-lei Guo","Wan-Lei Guo, Yue-Liang Wu","Exploring the singlet scalar dark matter from direct detections and
  neutrino signals via its annihilation in the Sun","21 pages, 5 figures, 1 table. Accepted for publication in Nuclear
  Physics B",,"10.1016/j.nuclphysb.2012.09.016",,"hep-ph astro-ph.CO","http://arxiv.org/licenses/nonexclusive-distrib/1.0/","  We explore the singlet scalar dark matter (DM) from direct detections and
high energy neutrino signals generated by the solar DM annihilation. Two
singlet scalar DM models are discussed, one is the real singlet scalar DM model
as the simple extension of the standard model (SSDM-SM) with a discrete Z_2
symmetry, and another is the complex singlet scalar DM model as the simple
extension of the left-right symmetric two Higgs bidoublet model (SSDM-2HBDM)
with $P$ and CP symmetries. To derive the Sun capture rate, we consider the
uncertainties in the hadronic matrix elements and calculate the
spin-independent DM-nucleon elastic scattering cross section. We find that the
predicted neutrino induced upgoing muon fluxes in the region 3.7 GeV < m_D <
4.2 GeV slightly exceed the Super-Kamiokande limit in the SSDM-SM. However,
this exceeded region can be excluded by the current DM direct detection
experiments. For the SSDM-2HBDM, one may adjust the Yukawa couplings to avoid
the direct detection limits and enhance the predicted muon fluxes. For the
allowed parameter space of the SSDM-SM and SSDM-2HBDM, the produced muon fluxes
in the Super-Kamiokande and muon event rates in the IceCube are less than the
experiment upper bound and atmosphere background, respectively.
","[{""version"":""v1"",""created"":""Tue, 29 Mar 2011 11:35:25 GMT""},{""version"":""v2"",""created"":""Mon, 19 Mar 2012 14:52:33 GMT""},{""version"":""v3"",""created"":""Thu, 1 Nov 2012 14:20:28 GMT""}]","2015-05-27"
"1103.5607","Sebastian Hollenberg","Sebastian Hollenberg, Palash B. Pal","CPT-violating effects in muon decay","6 pages","Phys.Lett.B701:89-92,2011","10.1016/j.physletb.2011.05.035","DO-TH 11/07","hep-ph","http://arxiv.org/licenses/nonexclusive-distrib/1.0/","  We consider low-energy CPT-violating modifications in charged current weak
interactions and analyze possible ramifications in muon and antimuon decays. We
calculate the lifetime of muon and antimuon with these modifications, and from
the result, put bounds on the CPT-violating parameters. Moreover, we elaborate
on the muon and antimuon decay rate differentials in electron energy and
spatial angle, which entail interesting phenomenological consequences
presenting new ways to constrain CPT violation in charged lepton decays.
","[{""version"":""v1"",""created"":""Tue, 29 Mar 2011 11:38:32 GMT""}]","2011-06-28"
"1103.5608","Alexey Osipov","Alexey V. Osipov","Inverse periodic shadowing properties","15 pages, a preprint",,,,"math.DS","http://arxiv.org/licenses/nonexclusive-distrib/1.0/","  We consider inverse periodic shadowing properties of discrete dynamical
systems generated by diffeomorphisms of closed smooth manifolds. We show that
the $C^1$-interior of the set of all diffeomorphisms having so-called inverse
periodic shadowing property coincides with the set of $\Omega$-stable
diffeomorphisms. The equivalence of Lipschitz inverse periodic shadowing
property and hyperbolicity of the closure of all periodic points is proved.
Besides, we prove that the set of all diffeomorphisms that have Lipschitz
inverse periodic shadowing property and whose periodic points are dense in the
nonwandering set coincides with the set of Axiom A diffeomorphisms.
","[{""version"":""v1"",""created"":""Tue, 29 Mar 2011 11:41:34 GMT""}]","2011-03-30"
"1103.5609","Daniel Reichman","Uriel Feige and Daniel Reichman","Recoverable Values for Independent Sets",,,,,"cs.DS","http://arxiv.org/licenses/nonexclusive-distrib/1.0/","  The notion of {\em recoverable value} was advocated in work of Feige,
Immorlica, Mirrokni and Nazerzadeh [Approx 2009] as a measure of quality for
approximation algorithms. There this concept was applied to facility location
problems. In the current work we apply a similar framework to the maximum
independent set problem (MIS). We say that an approximation algorithm has {\em
recoverable value} $\rho$, if for every graph it recovers an independent set of
size at least $\max_I \sum_{v\in I} \min[1,\rho/(d(v) + 1)]$, where $d(v)$ is
the degree of vertex $v$, and $I$ ranges over all independent sets in $G$.
Hence, in a sense, from every vertex $v$ in the maximum independent set the
algorithm recovers a value of at least $\rho/(d_v + 1)$ towards the solution.
This quality measure is most effective in graphs in which the maximum
independent set is composed of low degree vertices. It easily follows from
known results that some simple algorithms for MIS ensure $\rho \ge 1$. We
design a new randomized algorithm for MIS that ensures an expected recoverable
value of at least $\rho \ge 7/3$. In addition, we show that approximating MIS
in graphs with a given $k$-coloring within a ratio larger than $2/k$ is unique
games hard. This rules out a natural approach for obtaining $\rho \ge 2$.
","[{""version"":""v1"",""created"":""Tue, 29 Mar 2011 11:47:04 GMT""}]","2011-03-30"
"1103.5610","Loecherbach Eva","Eva Loecherbach and Dasha Loukianova","Polynomial deviation bounds for recurrent Harris processes having
  general state space",,,,,"math.PR","http://arxiv.org/licenses/nonexclusive-distrib/1.0/","  Consider a strong Markov process in continuous time, taking values in some
Polish state space. Recently, Douc, Fort and Guillin (2009) introduced
verifiable conditions in terms of a supermartingale property implying an
explicit control of modulated moments of hitting times. We show how this
control can be translated into a control of polynomial moments of abstract
regeneration times which are obtained by using the regeneration method of
Nummelin, extended to the time-continuous context.
  As a consequence, if a $p-$th moment of the regeneration times exists, we
obtain non asymptotic deviation bounds of the form
$$P_{\nu}(|\frac1t\int_0^tf(X_s)ds-\mu(f)|\geq\ge)\leq K(p)\frac1{t^{p-
1}}\frac 1{\ge^{2(p-1)}}\|f\|_\infty^{2(p-1)}, p \geq 2. $$ Here, $f$ is a
bounded function and $\mu$ is the invariant measure of the process. We give
several examples, including elliptic stochastic differential equations and
stochastic differential equations driven by a jump noise.
","[{""version"":""v1"",""created"":""Tue, 29 Mar 2011 11:51:50 GMT""},{""version"":""v2"",""created"":""Tue, 20 Sep 2011 05:55:33 GMT""}]","2011-09-21"
"1103.5611","Vincenzo Greco","Salvatore Plumari, Wanda M. Alberico, Vincenzo Greco, Claudia Ratti","Recent thermodynamic results from lattice QCD analyzed within a
  quasi-particle model","18 pages, 9 figures; version accepted in Phys. Rev.D; calculation
  with relaxation time \tau \sim g^4 ln g has been added",,"10.1103/PhysRevD.84.094004",,"hep-ph nucl-th","http://arxiv.org/licenses/nonexclusive-distrib/1.0/","  The thermodynamic behavior of QCD matter at high temperature is currently
studied by lattice QCD theory. The main features are the fast rise of the
energy density $\epsilon$ around the critical temperature $T_c$ and the large
trace anomaly of the energy momentum tensor $< \Theta_\mu^\mu >=\epsilon - 3 P$
which hints at a strongly interacting system. Such features can be accounted
for by employing a massive quasi-particle model with a temperature-dependent
bag constant. Recent lattice QCD calculations with physical quark masses by the
Wuppertal-Budapest group have shown a slower increase of $\epsilon$ and a
smaller $<\Theta_\mu^\mu>$ peak with respect to previous results from the
hotQCD collaboration. We investigate the implications of such differences from
the point of view of a quasi-particle model, also discussing light and strange
quark number susceptibilities. Furthermore, we predict the impact of these
discrepancies on the temperature-dependence of the transport properties of
matter, like the shear and bulk viscosities.
","[{""version"":""v1"",""created"":""Tue, 29 Mar 2011 11:52:30 GMT""},{""version"":""v2"",""created"":""Tue, 4 Oct 2011 13:06:39 GMT""}]","2015-05-27"
"1103.5612","Gideon Koekoek","G. Koekoek, J.W. van Holten","Geodesic deviations: modeling extreme mass-ratio systems and their
  gravitational waves",,"Class. Quantum Grav. 28 (2011) 225022","10.1088/0264-9381/28/22/225022",,"gr-qc","http://arxiv.org/licenses/nonexclusive-distrib/1.0/","  The method of geodesic deviations has been applied to derive accurate
analytic approximations to geodesics in Schwarzschild space-time. The results
are used to construct analytic expressions for the source terms in the
Regge-Wheeler and Zerilli-Moncrief equations, which describe the propagation of
gravitational waves emitted by a compact massive object moving in the
Schwarzschild background space-time. The wave equations are solved numerically
to provide the asymptotic form of the wave at large distances for a series of
non-circular bound orbits with periastron distances up to the ISCO radius, and
the power emitted in gravitational waves by the extreme-mass ratio binary
system is computed. The results compare well with those of purely numerical
approaches.
","[{""version"":""v1"",""created"":""Tue, 29 Mar 2011 12:00:19 GMT""}]","2015-11-26"
"1103.5613","Vladimir Matveev","Vladimir S. Matveev and Stefan Rosemann","Proof of the Yano-Obata Conjecture for holomorph-projective
  transformations","28 pages, 3 pictures. The (v2) version contains in addition a
  relation between h-projectively equivalent metrics and hamiltonian 2-forms
  studies in math.DG/0202280, math.DG/0401320, math.DG/0511118,
  math.DG/0511119. In the (v3) version, we also added an appendix with the
  h-projectively invariant formulation of the main equations and, as their
  application, an alternative proof of Lemma 7","J. Diff. Geom. 92(2012) 221-261",,,"math.DG math.AP math.CV","http://arxiv.org/licenses/nonexclusive-distrib/1.0/","  We prove the classical Yano-Obata conjecture by showing that the connected
component of the group of holomorph-projective transformations of a closed,
connected Riemannian K\""ahler manifold consists of isometries unless the metric
has constant positive holomorphic curvature.
","[{""version"":""v1"",""created"":""Tue, 29 Mar 2011 12:01:09 GMT""},{""version"":""v2"",""created"":""Sun, 15 May 2011 11:38:01 GMT""},{""version"":""v3"",""created"":""Fri, 5 Aug 2011 15:22:27 GMT""}]","2015-10-07"
"1103.5614","Iakov Lyashenko A.","I.A. Lyashenko, A.V. Khomenko, L.S. Metlov","Phenomenological Theory of Boundary Friction in the Stick-Slip Mode","9 pages, 6 figures, 40 references","Ukrainian Journal of Physics, 2011, Vol. 56, no. 3, pp. 278-286",,,"physics.flu-dyn cond-mat.mes-hall cond-mat.stat-mech","http://arxiv.org/licenses/nonexclusive-distrib/1.0/","  A deterministic theory describing the melting of an ultrathin lubricant film
between two atomically smooth solid surfaces has been developed. The lubricant
state is described by introducing a parameter of excess volume that arises
owing to the solid structure chaotization at its melting. The thermodynamic and
shear kinds of melting are described consistently. The dependences of the
stationary friction force on the lubricant temperature and the shear velocity
of rubbing surfaces that move with respect to each other with a constant
velocity have been analyzed. In the framework of a simple tribological model,
the stick-slip mode of friction, when the lubricant periodically melts and
solidifies, has been described. The influence of velocity, temperature, and
load on the stick-slip friction has been analyzed. A qualitative comparison
between the results obtained and experimental data has been carried out.
","[{""version"":""v1"",""created"":""Tue, 29 Mar 2011 12:06:38 GMT""},{""version"":""v2"",""created"":""Wed, 30 Mar 2011 04:28:01 GMT""}]","2011-03-31"
"1103.5615","Michael Baker","Michael J Baker, J. Bordes, H.M. Chan, S.T. Tsou","Mass Hierarchy, Mixing, CP-Violation and Higgs Decay---or Why Rotation
  is Good for Us","47 pages, 9 figures",,"10.1142/S0217751X11053365",,"hep-ph","http://arxiv.org/licenses/nonexclusive-distrib/1.0/","  The idea of a rank-one rotating mass matrix (R2M2) is reviewed detailing how
it leads to ready explanations both for the fermion mass hierarchy and for the
distinctive mixing patterns between up and down fermion states, which can be
and have been tested against experiment and shown to be fully consistent with
existing data. Further, R2M2 is seen to offer, as by-products: (i) a new
solution of the strong CP problem in QCD by linking the theta-angle there to
the Kobayashi-Maskawa CP-violating phase in the CKM matrix, and (ii) some novel
predictions of possible anomalies in Higgs decay observable in principle at the
LHC. A special effort is made to answer some questions raised.
","[{""version"":""v1"",""created"":""Tue, 29 Mar 2011 12:07:40 GMT""}]","2015-05-27"
"1103.5616","Alaa Elnashar","Alaa Ismail Elnashar","To Parallelize or Not to Parallelize, Speed Up Issue",,,,,"cs.SE","http://arxiv.org/licenses/nonexclusive-distrib/1.0/","  Running parallel applications requires special and expensive processing
resources to obtain the required results within a reasonable time. Before
parallelizing serial applications, some analysis is recommended to be carried
out to decide whether it will benefit from parallelization or not. In this
paper we discuss the issue of speed up gained from parallelization using
Message Passing Interface (MPI) to compromise between the overhead of
parallelization cost and the gained parallel speed up. We also propose an
experimental method to predict the speed up of MPI applications.
","[{""version"":""v1"",""created"":""Tue, 29 Mar 2011 12:09:44 GMT""}]","2011-03-30"
"1103.5617","Pierpaolo Vivo","Gernot Akemann, Pierpaolo Vivo","Compact smallest eigenvalue expressions in Wishart-Laguerre ensembles
  with or without fixed-trace","25 pag., 4 fig - minor changes, typos fixed. To appear in JSTAT","J.Stat.Mech.1105:P05020,2011","10.1088/1742-5468/2011/05/P05020",,"math-ph cond-mat.stat-mech hep-th math.MP","http://arxiv.org/licenses/nonexclusive-distrib/1.0/","  The degree of entanglement of random pure states in bipartite quantum systems
can be estimated from the distribution of the extreme Schmidt eigenvalues. For
a bipartition of size M\geq N, these are distributed according to a
Wishart-Laguerre ensemble (WL) of random matrices of size N x M, with a
fixed-trace constraint. We first compute the distribution and moments of the
smallest eigenvalue in the fixed trace orthogonal WL ensemble for arbitrary
M\geq N. Our method is based on a Laplace inversion of the recursive results
for the corresponding orthogonal WL ensemble by Edelman. Explicit examples are
given for fixed N and M, generalizing and simplifying earlier results. In the
microscopic large-N limit with M-N fixed, the orthogonal and unitary WL
distributions exhibit universality after a suitable rescaling and are therefore
independent of the constraint. We prove that very recent results given in terms
of hypergeometric functions of matrix argument are equivalent to more explicit
expressions in terms of a Pfaffian or determinant of Bessel functions. While
the latter were mostly known from the random matrix literature on the QCD Dirac
operator spectrum, we also derive some new results in the orthogonal symmetry
class.
","[{""version"":""v1"",""created"":""Tue, 29 Mar 2011 12:17:35 GMT""},{""version"":""v2"",""created"":""Thu, 28 Apr 2011 08:34:53 GMT""}]","2011-06-07"
"1103.5618","Adi Zitrin","A. Zitrin, T. Broadhurst, D. Coe, K. Umetsu, M. Postman, N. Ben\'itez,
  M. Meneghetti, E. Medezinski, S. Jouvel, L. Bradley, A. Koekemoer, W. Zheng,
  H. Ford, J. Merten, D. Kelson, O. Lahav, D. Lemze, A. Molino, M. Nonino, M.
  Donahue, P. Rosati, A. Van der Wel, M. Bartelmann, R. Bouwens, O. Graur, G.
  Graves, O. Host, L. Infante, S. Jha, Y. Jimenez-Teja, R. Lazkoz, D. Maoz, C.
  McCully, P. Melchior, L. A. Moustakas, S. Ogaz, B. Patel, E. Regoes, A.
  Riess, S. Rodney, S. Seitz","The Cluster Lensing and Supernova Survey with Hubble (CLASH): Strong
  Lensing Analysis of Abell 383 from 16-Band HST WFC3/ACS Imaging","15 pages, 14 figures, 2 tabels; V3 matches the submitted version
  later published in ApJ",,"10.1088/0004-637X/742/2/117",,"astro-ph.CO","http://arxiv.org/licenses/nonexclusive-distrib/1.0/","  We examine the inner mass distribution of the relaxed galaxy cluster Abell
383 in deep 16-band HST/ACS+WFC3 imaging taken as part of the CLASH multi-cycle
treasury program. Our program is designed to study the dark matter distribution
in 25 massive clusters, and balances depth with a wide wavelength coverage to
better identify lensed systems and generate precise photometric redshifts. This
information together with the predictive strength of our strong-lensing
analysis method identifies 13 new multiply-lensed images and candidates, so
that a total of 27 multiple-images of 9 systems are used to tightly constrain
the inner mass profile, $d\log \Sigma/d\log r\simeq -0.6\pm 0.1$ (r<160 kpc).
We find consistency with the standard distance-redshift relation for the full
range spanned by the lensed images, 1.01<z<6.03, with the higher redshift
sources deflected through larger angles as expected. The inner mass profile
derived here is consistent with the results of our independent weak-lensing
analysis of wide-field Subaru images, with good agreement in the region of
overlap. The overall mass profile is well fitted by an NFW profile with
M_{vir}=(5.37^{+0.70}_{-0.63}\pm 0.26) x 10^{14}M_{\odot}/h and a relatively
high concentration, c_{vir}=8.77^{+0.44}_{-0.42}\pm 0.23, which lies above the
standard c-M relation similar to other well-studied clusters. The critical
radius of Abell 383 is modest by the standards of other lensing clusters,
r_{E}\simeq16\pm2\arcsec (for z_s=2.55), so the relatively large number of
lensed images uncovered here with precise photometric redshifts validates our
imaging strategy for the CLASH survey. In total we aim to provide similarly
high-quality lensing data for 25 clusters, 20 of which are X-ray selected
relaxed clusters, enabling a precise determination of the representative mass
profile free from lensing bias. (ABRIDGED)
","[{""version"":""v1"",""created"":""Tue, 29 Mar 2011 12:18:43 GMT""},{""version"":""v2"",""created"":""Wed, 30 Mar 2011 19:02:17 GMT""},{""version"":""v3"",""created"":""Thu, 12 Jul 2012 11:23:26 GMT""}]","2012-07-13"
"1103.5619","Jacob Tsimerman","Jacob Tsimerman","Brauer-Siegel for Arithmetic Tori and lower bounds for Galois orbits of
  special points","Updated: added g=6 case and a few small clarifications",,,,"math.NT","http://arxiv.org/licenses/nonexclusive-distrib/1.0/","  In \cite{S}, Shyr derived an analogue of Dirichlet's class number formula for
arithmetic Tori. We use this formula to derive a Brauer-Siegel formula for
Tori, relating the Discriminant of a torus to the product of its regulator and
class number. We apply this formula to derive asymptotics and lower bounds for
Galois orbits of CM points in the Siegel modular variety $A_{g,1}$.
Specifically, we ask that the sizes of these orbits grows like a power of
Discriminant of the underlying endomorphism algebra. We prove this
unconditionally in the case $g\leq 5$, and for all $g$ under the Generalized
Riemann Hypothesis for CM fields. Along the way we derive a general transfer
principle for torsion in ideal class groups of number fields.
","[{""version"":""v1"",""created"":""Tue, 29 Mar 2011 12:21:13 GMT""},{""version"":""v2"",""created"":""Tue, 5 Apr 2011 20:46:31 GMT""},{""version"":""v3"",""created"":""Sun, 12 Jun 2011 12:22:59 GMT""}]","2011-06-14"
"1103.5620","Dmitri Sokolovski","D.Sokolovski and E.Akhmatskaya","The Hartman effect and weak measurements ""which are not really weak""","6 pages, 1 figure",,"10.1103/PhysRevA.84.022104",,"quant-ph","http://arxiv.org/licenses/nonexclusive-distrib/1.0/","  We show that in wavepacket tunnelling localisation of the transmitted
particle amounts to a quantum measurement of the delay it experiences in the
barrier. With no external degree of freedom involved, the envelope of the
wavepacket plays the role of the initial pointer state. Under tunnelling
conditions such 'self measurement' is necessarily weak, and the Hartman effect
just reflects the general tendency of weak values to diverge, as post-selection
in the final state becomes improbable. We also demonstrate that it is a good
precision, or 'not really weak' quantum measurement: no matter how wide the
barrier d, it is possible to transmit a wavepacket with a width {\sigma} small
compared to the observed advancement. As is the case with all weak
measurements, the probability of transmission rapidly decreases with the ratio
{\sigma}/d.
","[{""version"":""v1"",""created"":""Tue, 29 Mar 2011 12:27:16 GMT""},{""version"":""v2"",""created"":""Sat, 21 May 2011 13:35:52 GMT""}]","2015-05-27"
