"1103.5472","Sam McDermott","Samuel D. McDermott, Hai-Bo Yu, Kathryn M. Zurek","Constraints on Scalar Asymmetric Dark Matter from Black Hole Formation
  in Neutron Stars","24 pages, 5 figures; updated to match published version","Phys. Rev. D 85, 023519 (2012)","10.1103/PhysRevD.85.023519","MCTP-11-16","hep-ph astro-ph.CO","http://arxiv.org/licenses/nonexclusive-distrib/1.0/","  We consider possibly observable effects of asymmetric dark matter (ADM) in
neutron stars. Since dark matter does not self-annihilate in the ADM scenario,
dark matter accumulates in neutron stars, eventually reaching the Chandrasekhar
limit and forming a black hole. We focus on the case of scalar ADM, where the
constraints from Bose-Einstein condensation and subsequent black hole formation
are most severe due to the absence of Fermi degeneracy pressure. We also note
that in some portions of this constrained parameter space, non-trivial effects
from Hawking radiation can modify our limits. We find that for scalar ADM with
mass between 100 keV and 10^5 GeV, the constraint from pulsars in globular
clusters on the scattering cross-section with neutrons ranges from \sigma_n <
10^{-45} cm^2 to 10^{-52} cm}^2. In particular, for scalar ADM with mass
between 1 GeV and 1 TeV (in the case where black hole evaporation due to
Hawking radiation is unimportant), the constraint on the scattering
cross-section is below what is reachable with ton scale direct detection
experiments.
","[{""version"":""v1"",""created"":""Mon, 28 Mar 2011 20:11:07 GMT""},{""version"":""v2"",""created"":""Thu, 21 Apr 2011 12:11:09 GMT""},{""version"":""v3"",""created"":""Mon, 16 Jan 2012 21:26:07 GMT""},{""version"":""v4"",""created"":""Thu, 26 Jan 2012 15:50:47 GMT""}]","2012-01-27"
"1103.5473","Giovanni Panti","Giovanni Panti","Denominator-preserving maps","11 pages, 1 figure",,,,"math.NT math.DS","http://arxiv.org/licenses/nonexclusive-distrib/1.0/","  Let F be a continuous injective map from an open subset of R^n to R^n. Assume
that, for infinitely many k>1, F induces a bijection between the rational
points of denominator k in the domain and those in the image (the denominator
of (a_1/b_1,...,a_n/b_n) being the l.c.m. of b_1,...,b_n). Then F preserves the
Lebesgue measure.
","[{""version"":""v1"",""created"":""Mon, 28 Mar 2011 20:14:56 GMT""},{""version"":""v2"",""created"":""Sat, 7 May 2011 07:41:51 GMT""}]","2011-05-10"
"1103.5474","Uta Grothkopf","Uta Grothkopf and Jill Lagerstrom","Telescope Bibliometrics 101","11 pages, 3 figures. To appear in: Future Professional Communication
  in Astronomy II (FPCA-II)",,"10.1007/978-1-4419-8369-5_12",,"astro-ph.IM cs.DL","http://arxiv.org/licenses/nonexclusive-distrib/1.0/","  During recent years, bibliometric studies have become increasingly important
in evaluating individual scientists, institutes, and entire observatories. In
astronomy, often librarians are involved in maintaining publication databases
and compiling statistics for their institutions. In this paper, we present a
look behind the scenes to understand who is interested in bibliometric
statistics, which methodologies astronomy librarians apply, and what kind of
features next-generation bibliographies may include.
","[{""version"":""v1"",""created"":""Mon, 28 Mar 2011 20:21:22 GMT""}]","2016-01-27"
"1103.5475","Axel Brandenburg","A. Brandenburg (1,2), P. J. K\""apyl\""a (1,3), M. J. Korpi (3) ((1)
  NORDITA, (2) Stockholm University, (3) University of Helsinki)","From convective to stellar dynamos","9 pages, 5 figures, to appear in IAU Symposium 271, proceedings (N.
  Brummell, A. S. Brun, M. S. Miesch, and Y. Ponty, eds.)","Astrophysical Dynamics: From Stars to Galaxies, ed. IAU Symp. 271,
  N. Brummell, A.S. Brun, M.S. Miesch, & Y. Ponty, pp. 279-287 (2011)","10.1017/S1743921311017704","NORDITA-2011-001","astro-ph.SR","http://arxiv.org/licenses/nonexclusive-distrib/1.0/","  Convectively driven dynamos with rotation generating magnetic fields on
scales large compared with the scale of the turbulent eddies are being
reviewed. It is argued that such fields can be understood as the result of an
alpha effect. Simulations in Cartesian domains show that such large-scale
magnetic fields saturate on a time scale compatible with the resistive one,
suggesting that the magnitude of the alpha effect is here still constrained by
approximate magnetic helicity conservation. It is argued that, in the absence
of shear and/or any other known large-scale dynamo effects, these simulations
prove the existence of turbulent alpha^2-type dynamos. Finally, recent results
are discussed in the context of solar and stellar dynamos.
","[{""version"":""v1"",""created"":""Mon, 28 Mar 2011 20:21:32 GMT""}]","2011-08-19"
"1103.5476","Mark Neyrinck","Mark C. Neyrinck (JHU)","Removable Matter-Power-Spectrum Covariance from Bias Fluctuations","Accepted to ApJ. 5 pages, 5 figures; slight clarifications to match
  accepted version","Astrophys. J. 736 (2011) 8","10.1088/0004-637X/736/1/8",,"astro-ph.CO","http://arxiv.org/licenses/nonexclusive-distrib/1.0/","  We find a simple, accurate model for the covariance matrix of the real-space
cosmological matter power spectrum on slightly nonlinear scales (k~0.1-0.8
h/Mpc at z=0), where off-diagonal matrix elements become substantial. The model
includes a multiplicative, scale-independent modulation of the power spectrum.
It has only one parameter, the variance (among realizations) of the variance of
the nonlinear density field in cells, with little dependence on the cell size
between 2-8 Mpc/h. Furthermore, we find that this extra covariance can be
modeled out by instead measuring the power spectrum of (delta/sigma_cell), i.e.
the ratio of the overdensity to its dispersion in cells a few Mpc in size.
Dividing delta by sigma_cell essentially removes the non-Gaussian part of the
covariance matrix, nearly diagonalizing it.
","[{""version"":""v1"",""created"":""Mon, 28 Mar 2011 20:26:08 GMT""},{""version"":""v2"",""created"":""Thu, 28 Apr 2011 20:02:57 GMT""}]","2011-06-30"
"1103.5477","Shan Gao","Shan Gao, Kenji Toma and Peter Meszaros","High Energy Neutrino Emission from the Earliest Gamma-Ray Bursts","13 pages, 10 figures, 2 tables, Phys. Rev. D, in press","Phys.Rev.D83:103004,2011","10.1103/PhysRevD.83.103004",,"astro-ph.HE hep-ph","http://arxiv.org/licenses/nonexclusive-distrib/1.0/","  We discuss the high energy neutrino emission from gamma-ray bursts resulting
from the earliest generation (`population III') stars forming in the Universe,
whose core collapses into a black hole. These gamma-ray bursts are expected to
produce a highly relativistic, magnetically dominated jet, where protons can be
accelerated to ultra-high energies. These interact with the photons produced by
the jet, leading to ultra-high energy photo-meson neutrinos as well as
secondary leptons and photons. The photon luminosity and the shock properties,
and thus the neutrino spectrum, depend on the mass of the black holes as well
as on the density of the surrounding external gas. We calculate the individual
source neutrino spectral fluxes and the expected diffuse neutrino flux for
various source parameters and evolution scenarios. Both the individual and
diffuse signals appear detectable in the 1-300 PeV range with current and
planned neutrino detectors such as IceCube and ARIANNA, provided the black hole
mass is in excess of 30-100 solar masses. This provides a possible test for the
debated mass of the progenitor stellar objects, as well as a probe for the
early cosmological environment and the formation rate of the earliest
structures.
","[{""version"":""v1"",""created"":""Mon, 28 Mar 2011 20:33:21 GMT""},{""version"":""v2"",""created"":""Wed, 20 Apr 2011 23:37:11 GMT""}]","2011-05-25"
"1103.5478","Emmanuel Abbe A","Emmanuel Abbe, Shao-Lun Huang, Emre Telatar","Proof of the outage probability conjecture for MISO channels",,,,,"cs.IT math.IT","http://arxiv.org/licenses/nonexclusive-distrib/1.0/","  In Telatar 1999, it is conjectured that the covariance matrices minimizing
the outage probability for MIMO channels with Gaussian fading are diagonal with
either zeros or constant values on the diagonal. In the MISO setting, this is
equivalent to conjecture that the Gaussian quadratic forms having largest tale
probability correspond to such diagonal matrices. We prove here the conjecture
in the MISO setting.
","[{""version"":""v1"",""created"":""Mon, 28 Mar 2011 20:33:46 GMT""}]","2011-03-30"
"1103.5479","Deanna Needell","Yonina C. Eldar, Deanna Needell, Yaniv Plan","Unicity conditions for low-rank matrix recovery",,,"10.1117/12.891933",,"math.NA cs.IT cs.SY math.IT math.OC math.PR","http://arxiv.org/licenses/nonexclusive-distrib/1.0/","  Low-rank matrix recovery addresses the problem of recovering an unknown
low-rank matrix from few linear measurements. Nuclear-norm minimization is a
tractible approach with a recent surge of strong theoretical backing. Analagous
to the theory of compressed sensing, these results have required random
measurements. For example, m >= Cnr Gaussian measurements are sufficient to
recover any rank-r n x n matrix with high probability. In this paper we address
the theoretical question of how many measurements are needed via any method
whatsoever --- tractible or not. We show that for a family of random
measurement ensembles, m >= 4nr - 4r^2 measurements are sufficient to guarantee
that no rank-2r matrix lies in the null space of the measurement operator with
probability one. This is a necessary and sufficient condition to ensure uniform
recovery of all rank-r matrices by rank minimization. Furthermore, this value
of $m$ precisely matches the dimension of the manifold of all rank-2r matrices.
We also prove that for a fixed rank-r matrix, m >= 2nr - r^2 + 1 random
measurements are enough to guarantee recovery using rank minimization. These
results give a benchmark to which we may compare the efficacy of nuclear-norm
minimization.
","[{""version"":""v1"",""created"":""Mon, 28 Mar 2011 20:36:03 GMT""}]","2015-05-27"
"1103.5480","Naoki Yamamoto","Masanori Hanada and Naoki Yamamoto","Universality of Phases in QCD and QCD-like Theories","v1: 35 pages, 6 figures; v2: 37 pages, 6 figures, minor improvements,
  conclusion unchanged; v3: version published in JHEP","JHEP 1202 (2012) 138","10.1007/JHEP02(2012)138","INT-PUB-11-012","hep-ph hep-lat hep-th","http://arxiv.org/licenses/nonexclusive-distrib/1.0/","  We argue that the whole or the part of the phase diagrams of QCD and QCD-like
theories should be universal in the large-N_c limit through the orbifold
equivalence. The whole phase diagrams, including the chiral phase transitions
and the BEC-BCS crossover regions, are identical between SU(N_c) QCD at finite
isospin chemical potential and SO(2N_c) and Sp(2N_c) gauge theories at finite
baryon chemical potential. Outside the BEC-BCS crossover region in these
theories, the phase diagrams are also identical to that of SU(N_c) QCD at
finite baryon chemical potential. We give examples of the universality in some
solvable cases: (i) QCD and QCD-like theories at asymptotically high density
where the controlled weak-coupling calculations are possible, (ii) chiral
random matrix theories of different universality classes, which are solvable
large-N (large volume) matrix models of QCD. Our results strongly suggest that
the chiral phase transition and the QCD critical point at finite baryon
chemical potential can be studied using sign-free theories, such as QCD at
finite isospin chemical potential, in lattice simulations.
","[{""version"":""v1"",""created"":""Mon, 28 Mar 2011 20:38:09 GMT""},{""version"":""v2"",""created"":""Thu, 14 Jul 2011 07:34:10 GMT""},{""version"":""v3"",""created"":""Tue, 6 Mar 2012 01:45:06 GMT""}]","2012-03-07"
"1103.5481","Ho Bun Lau","Herbert Ho Bun Lau, Adrian T. Potter and Christopher A. Tout","Spindown of massive rotating stars","Accepted by MNRAS",,"10.1111/j.1365-2966.2011.18766.x",,"astro-ph.SR","http://arxiv.org/licenses/nonexclusive-distrib/1.0/","  Models of rapidly rotating massive stars at low metallicities show
significantly different evolution and higher metal yields compared to
non-rotating stars. We estimate the spin-down time-scale of rapid rotating
non-convective stars supporting an alpha-Omega dynamo. The magnetic dynamo
gives rise to mass loss in a magnetically controlled stellar wind and hence
stellar spin down owing to loss of angular momentum. The dynamo is maintained
by strong horizontal rotation-driven turbulence which dominates over the Parker
instability. We calculate the spin-down time-scale and find that it could be
relatively short, a small fraction of the main-sequence lifetime. The spin-down
time-scale decreases dramatically for higher surface rotations suggesting that
rapid rotators may only exhibit such high surface velocities for a short time,
only a small fraction of their main-sequence lifetime.
","[{""version"":""v1"",""created"":""Mon, 28 Mar 2011 20:45:09 GMT""}]","2015-05-27"
"1103.5482","William Gillam","W. D. Gillam","Deformation of quotients on a product",,,,,"math.AG","http://arxiv.org/licenses/nonexclusive-distrib/1.0/","  We consider the general problem of deforming a surjective map of modules $f :
E \to F$ over a coproduct sheaf of rings $B=B_1 \otimes_A B_2$ when the domain
module $E = B_1 \otimes_A E_2$ is obtained via extension of scalars from a
$B_2$-module $E_2$. Assuming $B_1$ is flat over $A$, we show that the Atiyah
class morphism $F \to \LL_{B/B_2} \otimes^{\bL} F[1]$ in the derived category
$D(B)$ factors naturally through (the shift of) a morphism $\beta : \Ker f \to
\LL_{B/B_2} \otimes^{\bL} F$. We describe the obstruction to lifting $f$ over a
(square zero) extension $B_1' \to B_1$ in terms of $\beta$ and the class of the
extension. As an application, we use the reduced Atiyah class to construct a
perfect obstruction theory on the Quot scheme of a vector bundle on a smooth
curve (and more generally).
","[{""version"":""v1"",""created"":""Mon, 28 Mar 2011 20:46:45 GMT""}]","2011-03-30"
"1103.5483","Alexander Gersten","Alexander Gersten","A simple model of cerebral blood flow dependence on arterial blood
  pressure","23 pages, 8 figures; submit/0220878",,,,"physics.bio-ph physics.med-ph q-bio.TO","http://arxiv.org/licenses/nonexclusive-distrib/1.0/","  It is shown that the dependence of the cerebral blood flow (CBF) on mean
arterial blood pressure (MABP) can be described with a simple model having the
following assumptions. Below certain MABP (denoted as MABP1) there are no
autoregulatory or feedback mechanisms influencing CBF. Between MABP1 and MABP2
(MABP at which breakthrough accurs) there is a linear (on MABP) dependent
feedback with a sloap depending very much on the individual considered. The
classical autoregulation model with a plateau in between MABP1 and MABP2 is a
particular case of this model. The model describes well the experiments
performed on dogs (Harper 1966), for which the individual feedback sloap
parameter varied to great extent, indicating the importance of mesurments on
individuals against averaged mesurments (or measurments on diffent individuals)
which superficially support the classical autoregulation. New effect of
decreased CBF, while increasing MABP, was observed.
","[{""version"":""v1"",""created"":""Mon, 28 Mar 2011 20:47:43 GMT""}]","2011-03-30"
"1103.5484","Andre Mueller","Andr\'e M\""uller (ESO, MPIA), Mario van den Ancker (ESO), Ralf
  Launhardt (MPIA), J\""org-Uwe Pott (MPIA), Davide Fedele (Johns Hopkins
  University), and Thomas Henning (MPIA)","HD 135344B: a young star has reached its rotational limit","Accepted for publication in Astronomy & Astrophysics, 9 pages, 12
  figures",,"10.1051/0004-6361/201116732",,"astro-ph.SR","http://arxiv.org/licenses/nonexclusive-distrib/1.0/","  We search for periodic variations in the radial velocity of the young Herbig
star HD 135344B with the aim to determine a rotation period. We analyzed 44
high-resolution optical spectra taken over a time range of 151 days. The
spectra were acquired with FEROS at the 2.2m MPG/ESO telescope in La Silla. The
stellar parameters of HD 135344B are determined by fitting synthetic spectra to
the stellar spectrum. In order to obtain radial velocity measurements, the
stellar spectra have been cross-correlated with a theoretical template computed
from determined stellar parameters. We report the first direct measurement of
the rotation period of a Herbig star from radial-velocity measurements. The
rotation period is found to be 0.16 d (3.9 hr), which makes HD 135344B a rapid
rotator at or close to its break-up velocity. The rapid rotation could explain
some of the properties of the circumstellar environment of HD 135344B such as
the presence of an inner disk with properties (composition, inclination), that
are significantly different from the outer disk.
","[{""version"":""v1"",""created"":""Mon, 28 Mar 2011 20:49:16 GMT""}]","2015-05-27"
"1103.5485","Adri\'an Rodr\'iguez","Tatiana A. Michtchenko and Adri\'an Rodr\'iguez","Modeling the secular evolution of migrating planet pairs","20 pages, 17 figures. Accepted for publication in MNRAS",,"10.1111/j.1365-2966.2011.18857.x",,"astro-ph.EP","http://arxiv.org/licenses/nonexclusive-distrib/1.0/","  The subject of this paper is the secular behaviour of a pair of planets
evolving under dissipative forces. In particular, we investigate the case when
dissipative forces affect the planetary semi-major axes and the planets move
inward/outward the central star, in a process known as planet migration. To
perform this investigation, we introduce fundamental concepts of conservative
and dissipative dynamics of the three-body problem. Based on these concepts, we
develop a qualitative model of the secular evolution of the migrating planetary
pair. Our approach is based on analysis of the energy and the orbital angular
momentum exchange between the two-planet system and an external medium; thus no
specific kind of dissipative forces is invoked. We show that, under assumption
that dissipation is weak and slow, the evolutionary routes of the migrating
planets are traced by the Mode I and Mode II stationary solutions of the
conservative secular problem. The ultimate convergence and the evolution of the
system along one of these secular modes of motion is determined uniquely by the
condition that the dissipation rate is sufficiently smaller than the proper
secular frequency of the system. We show that it is possible to reassemble the
starting configurations and migration history of the systems on the basis of
their final states and consequently to constrain the parameters of the physical
processes involved.
","[{""version"":""v1"",""created"":""Mon, 28 Mar 2011 20:58:19 GMT""}]","2015-05-27"
"1103.5486","Bakhrom Omirov Abdazovich","M. Ladra, B.A. Omirov and U.A. Rozikov","Classification of p-adic 6-dimensional filiform Leibniz algebras by
  solution of x^q=a","15 pages",,,,"math.RA math.NT","http://arxiv.org/licenses/nonexclusive-distrib/1.0/","  In this paper we study the $p$-adic equation $x^q=a$ over the field of
$p$-adic numbers. We construct an algorithm of calculation of criteria of
solvability in the case of $q=p^m$ and present a computer program to compute
the criteria for fixed value of $m \leq p-1$. Moreover, using this solvability
criteria for $q=2,3,4,5,6$, we classify $p$-adic 6-dimensional filiform Leibniz
algebras.
","[{""version"":""v1"",""created"":""Mon, 28 Mar 2011 21:00:20 GMT""}]","2011-03-30"
"1103.5487","K.M. Schure","A. Chiotellis, K.M. Schure, Jacco Vink","The imprint of a symbiotic binary progenitor on the properties of
  Kepler's supernova remnant","13 pages, 9 figures. Submitted to A&A",,"10.1051/0004-6361/201014754",,"astro-ph.GA","http://arxiv.org/licenses/nonexclusive-distrib/1.0/","  We present a model for the Type Ia supernova remnant (SNR) of SN 1604, also
known as Kepler's SNR. We find that its main features can be explained by a
progenitor model of a symbiotic binary consisting of a white dwarf and an AGB
donor star with an initial mass of 4-5 M_sun. The slow, nitrogen rich wind
emanating from the donor star has partially been accreted by the white dwarf,
but has also created a circumstellar bubble. Based on observational evidence,
we assume that the system moves with a velocity of 250 km/s. Due to the
systemic motion the interaction between the wind and the interstellar medium
has resulted in the formation of a bow shock, which can explain the presence of
a one-sided, nitrogen rich shell. We present two-dimensional hydrodynamical
simulations of both the shell formation and the SNR evolution. The SNR
simulations show good agreement with the observed kinematic and morphological
properties of Kepler's SNR. Specifically, the model reproduces the observed
expansion parameters (m=V/(R/t)) of m=0.35 in the north and m=0.6 in the south
of Kepler's SNR. We discuss the variations among our hydrodynamical simulations
in light of the observations, and show that part of the blast wave may have
traversed through the one-sided shell completely. The simulations suggest a
distance to Kepler's SNR of 6 kpc, or otherwise require that SN 1604 was a
sub-energetic Type Ia explosion. Finally, we discuss the possible implications
of our model for Type Ia supernovae and their remnants in general.
","[{""version"":""v1"",""created"":""Mon, 28 Mar 2011 21:01:56 GMT""}]","2015-05-27"
"1103.5488","Jorge Ramirez","Jorge M Ramirez","Population persistence under advection-diffusion in river networks",,,,,"q-bio.PE","http://arxiv.org/licenses/nonexclusive-distrib/1.0/","  An integro-differential equation on a tree graph is used to model the
evolution and spatial distribution of a population of organisms in a river
network. Individual organisms become mobile at a constant rate, and disperse
according to an advection-diffusion process with coefficients that are constant
on the edges of the graph. Appropriate boundary conditions are imposed at the
outlet and upstream nodes of the river network. The local rates of population
growth/decay and that by which the organisms become mobile, are assumed
constant in time and space. Imminent extinction of the population is understood
as the situation whereby the zero solution to the integro-differential equation
is stable. Lower and upper bounds for the eigenvalues of the dispersion
operator, and related Sturm-Liouville problems are found, and therefore
sufficient conditions for imminent extinction are given in terms of the
physical variables of the problem.
","[{""version"":""v1"",""created"":""Mon, 28 Mar 2011 21:07:47 GMT""},{""version"":""v2"",""created"":""Wed, 30 Mar 2011 21:35:21 GMT""}]","2011-04-01"
"1103.5489","Liubin Pan","Liubin Pan and Evan Scannapieco","Passive Scalar Structures in Supersonic Turbulence","4 pages, 3 figures, to appear in PRE",,"10.1103/PhysRevE.83.045302",,"physics.flu-dyn astro-ph.GA","http://arxiv.org/licenses/nonexclusive-distrib/1.0/","  We conduct a systematic numerical study of passive scalar structures in
supersonic turbulent flows. We find that the degree of intermittency in the
scalar structures increases only slightly as the flow changes from transonic to
highly supersonic, while the velocity structures become significantly more
intermittent. This difference is due to the absence of shock-like
discontinuities in the scalar field. The structure functions of the scalar
field are well described by the intermittency model of She and L\'{e}v\^{e}que
[Phys. Rev. Lett. 72, 336 (1994)], and the most intense scalar structures are
found to be sheet-like at all Mach numbers.
","[{""version"":""v1"",""created"":""Mon, 28 Mar 2011 21:12:09 GMT""}]","2015-05-27"
"1103.5490","Andre X. C. N. Valente","A. X. C. N. Valente and Stephen S. Fong","High-Throughput Biologically Optimized Search Engineering Approach to
  Synthetic Biology",,,,,"q-bio.QM","http://arxiv.org/licenses/nonexclusive-distrib/1.0/","  Synthetic Biology is the new engineering-based approach to biology that
includes applications of designing complex biological devices. At present, it
is not yet clear what will emerge as the defining principles of Synthetic
Biology. One proposed approach is to build Synthetic Biology around the
classical engineering principles of standardization, modularity/decoupling and
abstraction/modeling to facilitate component-based design. In this article we
suggest and discuss an alternative paradigm, which we call High-throughput
Biologically Optimized Search Engineering (HT-BOSE). Stemming from directed
evolution, in HT-BOSE the focal point is a biological knowledge based rational
optimization of the search process in the space of device design possibilities.
The HT-BOSE approach may also be relevant in other contexts and we briefly
highlight how it could be applicable to the development of multi-drug cocktails
in a biomedical setting.
","[{""version"":""v1"",""created"":""Mon, 28 Mar 2011 21:17:25 GMT""}]","2011-03-30"
