"1103.5548","Markus Garst","Karin Everschor, Markus Garst, R. A. Duine, Achim Rosch","Current induced rotational torques in the skyrmion lattice phase of
  chiral magnets","11 pages, 6 figures; minor changes, published version","Phys. Rev. B 84, 064401 (2011)","10.1103/PhysRevB.84.064401",,"cond-mat.str-el cond-mat.mtrl-sci","http://arxiv.org/licenses/nonexclusive-distrib/1.0/","  In chiral magnets without inversion symmetry, the magnetic structure can form
a lattice of magnetic whirl lines, a two-dimensional skyrmion lattice,
stabilized by spin-orbit interactions in a small range of temperatures and
magnetic fields. The twist of the magnetization within this phase gives rise to
an efficient coupling of macroscopic magnetic domains to spin currents. We
analyze the resulting spin-transfer effects, and, in particular, focus on the
current induced rotation of the magnetic texture by an angle. Such a rotation
can arise from macroscopic temperature gradients in the system as has recently
been shown experimentally and theoretically. Here we investigate an alternative
mechanism, where small distortions of the skyrmion lattice and the transfer of
angular momentum to the underlying atomic lattice play the key role. We employ
the Landau-Lifshitz-Gilbert equation and adapt the Thiele method to derive an
effective equation of motion for the rotational degree of freedom. We discuss
the dependence of the rotation angle on the orientation of the applied magnetic
field and the distance to the phase transition.
","[{""version"":""v1"",""created"":""Tue, 29 Mar 2011 06:02:46 GMT""},{""version"":""v2"",""created"":""Mon, 12 Sep 2011 11:52:10 GMT""}]","2013-05-29"
"1103.5549","Philip Massey","Kathryn F. Neugent and Philip Massey","The Wolf-Rayet Content of M33","ApJ, in press",,"10.1088/0004-637X/733/2/123",,"astro-ph.CO","http://arxiv.org/licenses/nonexclusive-distrib/1.0/","  Wolf-Rayet stars (WRs) are evolved massive stars, and the relative number of
WC-type and WN-type WRs should vary with metallicity, providing a sensitive
test of stellar evolutionary theory. The observed WC/WN ratio is much higher
than that predicted by theory in some galaxies but this could be due to
observational incompleteness for WN-types, which have weaker lines. Previous
studies of M33's WR content show a galactocentric gradient in the relative
numbers of WCs and WNs, but only small regions have been surveyed with
sufficient sensitivity to detect all of the WNs. Here we present a sensitive
survey for WRs covering all of M33, finding 55 new WRs, mostly of WN type. Our
spectroscopy also improves the spectral types of many previously known WRs,
establishing in one case that the star is actually a background quasar. The
total number of spectroscopically confirmed WRs in M33 is 206, a number we
argue is complete to approximately 5%, with most WRs residing in OB
associations, although approximately 2% are truly isolated. The WC/WN ratio in
the central regions (<2 kpc) of M33 is much higher than that predicted by the
current Geneva evolutionary models, while the WC/WN ratios in the outer regions
are in good accord, as are the values in the SMC and LMC. The WC/WN ratio and
the WC subtype distribution both argue that the oxygen abundance gradient in
M33 is significantly larger than found by some recent studies, but are
consistent with the two-component model proposed by Magrini et al.
","[{""version"":""v1"",""created"":""Tue, 29 Mar 2011 06:08:17 GMT""},{""version"":""v2"",""created"":""Wed, 30 Mar 2011 18:09:34 GMT""}]","2015-05-27"
"1103.5550","Subhasish Mazumder Dr.","T. Mazumdar, S. Mazumderand D. Sen","Temporal evolution of mesoscopic structure of some non-Euclidean systems
  using a Monte Carlo model","31 Pages, 13 Figures","Physical Review B 83, 104302 (2011)","10.1103/PhysRevB.83.104302",,"cond-mat.mtrl-sci","http://arxiv.org/licenses/nonexclusive-distrib/1.0/","  A Monte Carlo based computer model is presented to comprehend the contrasting
observations of Mazumder et al. [Phys. Rev. Lett. 93, 255704 (2004) and Phys.
Rev. B 72, 224208 (2005)], based on neutron-scattering measurements, on
temporal evolution of effective fractal dimension and characteristic length for
hydration of cement with light and heavy water. In this context, a theoretical
model is also proposed to elucidate the same.
","[{""version"":""v1"",""created"":""Tue, 29 Mar 2011 06:12:29 GMT""}]","2015-05-27"
"1103.5551","Brian White","Brian White","Curvatures of embedded minimal disks blow up on subsets of C^1 curves","6 pages. Very minor revisions to previous version","J. Differential Geometry 100 (2015), 389-394",,,"math.DG","http://arxiv.org/licenses/nonexclusive-distrib/1.0/","  Any sequence of properly embedded minimal disks in an open subset U of
Euclidean 3-space has a subsequence such that the curvatures blow up on a
relatively closed subset K of U and such that the disks converge in the
complement of K to a minimal lamination of U\K. Assuming results of
Colding-Minicozzi and an extension due to Meeks, we prove that such a blow-up
set K must be contained in a C^1 embedded curve.
","[{""version"":""v1"",""created"":""Tue, 29 Mar 2011 06:18:42 GMT""},{""version"":""v2"",""created"":""Thu, 14 Jul 2011 21:11:39 GMT""},{""version"":""v3"",""created"":""Thu, 19 Feb 2015 08:05:15 GMT""}]","2016-02-22"
"1103.5552","Katharina Brodatzki","Katharina A. Brodatzki, David J. S. Pardy, Julia K. Becker and
  Reinhard Schlickeiser","Internal gamma gamma-opacity in Active Galactic Nuclei and the
  consequences for the TeV observations of M87 and Cen A","accepted for publication in ApJ",,"10.1088/0004-637X/736/2/98",,"astro-ph.CO","http://arxiv.org/licenses/nonexclusive-distrib/1.0/","  Low Luminosity Active Galactic Nuclei (LLAGNs) possess the characteristic
features of more luminous Active Galactic Nuclei (AGNs) but exhibit a much
lower nuclear Halpha luminosity than their more luminous counterparts. M87 (NGC
4486) and Centaurus A (NGC 5128, CenA) are well-studied nearby LLAGNs. As an
additional feature they show gamma-radiation up to TeV (10^{12}eV) energies,
but the origin of this radiation is not resolved. The coincident observation of
a radio and TeV flare in M87 suggests that the TeV radiation is produced within
around 50-100 gravitational radii of the central supermassive black hole,
depending on the assumed value of the mass of the black hole. Strong radiation
fields can be produced in the central region of an (LL)AGN, e.g., by the
accretion flow around the black hole, the jet plasma, or stars closely orbiting
the black hole. These radiation fields can lead to the absorption of emitted
TeV photons, and in fact high optical depths of such fields can make TeV
detection from inner regions impossible. In this paper we consider the
accretion flow around the black hole as the most prominent source for such a
radiation field and we accordingly calculate the probability for absorption of
TeV photons produced near the black holes in M87 and CenA assuming a low
luminosity Shakura-Sunyaev Disk (SSD). We find that the results are very
different for between the two LLAGNs. While the inner region of M87 is
transparent for TeV radiation up to 15TeV, the optical depth in CenA is >> 1,
leading to an absorption of TeV photons that might be produced near the central
black hole. These results imply either that the TeV gamma production sites and
processes are different for both sources, or that LLAGN black holes do not
accrete (at least only) in form of a low luminosity SSD.
","[{""version"":""v1"",""created"":""Tue, 29 Mar 2011 06:38:39 GMT""}]","2015-05-27"
"1103.5553","Wenceslao Gonz\'alez-Vi\~nas","M. Pichumani and M. Giuliani and W. Gonz\'alez-Vi\~nas","1-D Cluster Array at the Three Phase Contact Line in Diluted Colloids
  Subjected to A.C. Electric Fields","There is supplementary information (see refs. 24, 27), which is
  available upon request (wens@fisica.unav.es)","Phys. Rev. E 83, 047301 (2011)","10.1103/PhysRevE.83.047301",,"cond-mat.soft nlin.PS physics.flu-dyn","http://arxiv.org/licenses/nonexclusive-distrib/1.0/","  Colloidal particles provide an efficient mean of building multiple scale
structured materials from colloidal dispersions. In this Brief Report, we
account for experimental evidence on the formation of a colloidal cluster array
at a three-phase contact line. We study the influence of low frequency external
alternating electric fields on a diluted colloidal dispersion opened to the
air. We focus on the cluster formation and their evolution in the meniscus by
measuring characteristic times and lengths. We observe that the clusters are
separated by a well-defined length and that, in our experimental conditions,
they survive between five a fifteen minutes. These new results could be of
technological relevance in building tailored colloidal structures in
non-patterned substrates.
","[{""version"":""v1"",""created"":""Tue, 29 Mar 2011 06:58:59 GMT""},{""version"":""v2"",""created"":""Fri, 29 Apr 2011 08:19:22 GMT""},{""version"":""v3"",""created"":""Mon, 2 May 2011 10:38:35 GMT""}]","2011-05-03"
"1103.5554","Alberto Alonso Fern\'andez","Alberto Alonso Fern\'andez, Omar \'Alvarez Fres, Ignacio Gonz\'alez
  Alonso and Huosheng Hu","Visual Localisation of Mobile Devices in an Indoor Environment under
  Network Delay Conditions",,"International Journal of Distributed and Parallel Systems (IJDPS)
  Vol.2, No.2, March 2011","10.5121/ijdps.2011.2201",,"cs.RO","http://creativecommons.org/licenses/by-nc-sa/3.0/","  Current progresses in home automation and service robotic environment have
highlighted the need to develop interoperability mechanisms that allow a
standard communication between the two systems. During the development of the
DHCompliant protocol, the problem of locating mobile devices in an indoor
environment has been investigated. The communication of the device with the
location service has been carried out to study the time delay that web services
offer in front of the sockets. The importance of obtaining data from real-time
location systems portends that a basic tool for interoperability, such as web
services, can be ineffective in this scenario because of the delays added in
the invocation of services. This paper is focused on introducing a web service
to resolve a coordinates request without any significant delay in comparison
with the sockets.
","[{""version"":""v1"",""created"":""Tue, 29 Mar 2011 07:03:29 GMT""}]","2011-04-05"
"1103.5555","Rosario N. Mantegna","Dong-Ming Song, Michele Tumminello, Wei-Xing Zhou and Rosario N.
  Mantegna","Evolution of worldwide stock markets, correlation structure and
  correlation based graphs","8 pages, 11 figures","Physical Review E 84 (2), 026108 (2011)","10.1103/PhysRevE.84.026108",,"q-fin.ST physics.soc-ph","http://arxiv.org/licenses/nonexclusive-distrib/1.0/","  We investigate the daily correlation present among market indices of stock
exchanges located all over the world in the time period Jan 1996 - Jul 2009. We
discover that the correlation among market indices presents both a fast and a
slow dynamics. The slow dynamics reflects the development and consolidation of
globalization. The fast dynamics is associated with critical events that
originate in a specific country or region of the world and rapidly affect the
global system. We provide evidence that the short term timescale of correlation
among market indices is less than 3 trading months (about 60 trading days). The
average values of the non diagonal elements of the correlation matrix,
correlation based graphs and the spectral properties of the largest eigenvalues
and eigenvectors of the correlation matrix are carrying information about the
fast and slow dynamics of correlation of market indices. We introduce a measure
of mutual information based on link co-occurrence in networks, in order to
detect the fast dynamics of successive changes of correlation based graphs in a
quantitative way.
","[{""version"":""v1"",""created"":""Tue, 29 Mar 2011 07:14:33 GMT""}]","2011-08-16"
"1103.5556","Ryohko Ishikawa","Ryohko Ishikawa and Saku Tsuneta","Relationship between vertical and horizontal magnetic fields in the
  quiet Sun","50 pages, 11 figures, accepted for publication in The Astrophysical
  Journal",,"10.1088/0004-637X/735/2/74",,"astro-ph.SR","http://arxiv.org/licenses/nonexclusive-distrib/1.0/","  Vertical magnetic fields have been known to exist in the internetwork region
for decades, while the properties of horizontal magnetic fields have recently
been extensively investigated with \textit{Hinode}. Vertical and horizontal
magnetic fields in the internetwork region are considered to be separate
entities and have thus far not been investigated in a unified way. We discover
clear positional association between the vertical and horizontal magnetic
fields in the internetwork region with \textit{Hinode}. Essentially all of the
horizontal magnetic patches are associated with the vertical magnetic patches.
Alternatively, half of the vertical magnetic patches accommodate the horizontal
magnetic patches. These horizontal patches are located around the borders of
the vertical patches. The intrinsic magnetic field strength as obtained with
the Stokes $V$ line ratio inside the horizontal patches is weak, and is in
sub-equipartition field regime ($B<700$ G), while the field strength outside
the horizontal patches ranges from weak to strong (kG) fields. Vertical
magnetic patches are known to be concentrated on mesogranular and supergranular
boundaries, while the horizontal magnetic patches are found only on the
mesogranular boundaries. These observations provide us with new information on
the origin of the vertical and horizontal internetwork magnetic fields, in a
unified way. We conjecture that internetwork magnetic fields are provided by
emergence of small-scale flux tubes with bipolar footpoints, and the vertical
magnetic fields of the footpoints are intensified to kG fields due to
convective collapse. Resultant strong vertical fields are advected by the
supergranular flow, and eventually form the network fields.
","[{""version"":""v1"",""created"":""Tue, 29 Mar 2011 07:17:04 GMT""}]","2015-05-27"
"1103.5557","Jarah Evslin","Jarah Evslin","Slow Burgers Vortices in Hot Conformal Fluids","13 pages, no figures","JHEP 1105:096,2011","10.1007/JHEP05(2011)096",,"hep-th","http://arxiv.org/licenses/nonexclusive-distrib/1.0/","  The quintessential vortex solution in (3+1)-dimensional nonrelativistic,
incompressible fluid mechanics is the Burgers vortex. We show that, in a finite
domain, conformal fluids also admit hot vortex solutions with everywhere
nonrelativistic speeds. These are identical to Burgers' solution, except that
their radius is reduced by a factor of 2/sqrt(3). A rough calculation indicates
that at RHIC these vortices are indeed smaller than the fireball itself during
thermalization. Similarly to the Burgers vortex, these solutions manifest
vortex stretching which avoids short distance singularities and so suggests
that conformal fluid flows share the same nonsingularity as solutions of the
Navier-Stokes equations. Naively generalizing this calculation to an arbitrary
equation of state w, we observe that the Burgers vortex radius diverges as w
crosses -1. While it has been argued that such a crossover leads to an
instability in certain perfect fluids, the absence of Burgers vortices and
therefore vortex stretching suggests that, in addition to the well-studied big
rip singularities, viscous phantom fluids generically develop vorticity
singularities.
","[{""version"":""v1"",""created"":""Tue, 29 Mar 2011 07:19:44 GMT""}]","2011-05-26"
"1103.5558","Xuan Fang","X. Fang, P. J. Storey, X.-W. Liu","New effective recombination coefficients for nebular N II lines","43 pages, 8 figures. Has been accepted for publication in A&A
  (section 12. Atomic, molecular, and nuclear data)",,"10.1051/0004-6361/201116511",,"astro-ph.SR","http://arxiv.org/licenses/nonexclusive-distrib/1.0/","  Here we report new ${\it ab initio}$ calculations of the effective
recombination coefficients for the \ion{N}{ii} recombination spectrum. We have
taken into account the density dependence of the coefficients arising from the
relative populations of the fine-structure levels of the ground state of the
recombining ion, an elaboration that has not been attempted before for this
ion, and it opens up the possibility of electron density determination via
recombination line analysis. Photoionization cross-sections, bound state
energies, and the oscillator strengths of \ion{N}{ii} with $n \leq 11$ and $l
\leq 4$ have been obtained using the close-coupling R-matrix method in the
intermediate coupling scheme. Photoionization data were computed that
accurately map out the near-threshold resonances and were used to derive
recombination coefficients, including radiative and dielectronic recombination.
Also new is including the effects of dielectronic recombination via high-$n$
resonances lying between the $^2$P$^{\rm o}$\,$_{1/2}$ and $^2$P$^{\rm
o}$\,$_{3/2}$ levels. The new calculations are valid for temperatures down to
an unprecedentedly low level (approximately 100 K). The newly calculated
effective recombination coefficients allow us to construct plasma diagnostics
based on the measured strengths of the \ion{N}{ii} optical recombination lines
(ORLs).
  The derived effective recombination coefficients are fitted with analytic
formulae as a function of electron temperature for different electron
densities. The dependence of the emissivities of the strongest transitions of
\ion{N}{ii} on electron density and temperature is illustrated. Potential
applications of the current data to electron density and temperature
diagnostics for photoionized gaseous nebulae are discussed. We also present a
method of determining electron temperature and density simultaneously.
","[{""version"":""v1"",""created"":""Tue, 29 Mar 2011 07:34:43 GMT""}]","2015-05-27"
"1103.5559","Atlas Publications","The ATLAS Collaboration","Search for a heavy particle decaying into an electron and a muon with
  the ATLAS detector in sqrt(s) = 7 TeV pp collisions at the LHC","5 pages plus author list (18 pages total), 4 figures, 1 table,
  submitted to PRL","Phys.Rev.Lett. 106 (2011) 251801","10.1103/PhysRevLett.106.251801","CERN-PH-EP-2011-031","hep-ex","http://arxiv.org/licenses/nonexclusive-distrib/1.0/","  This Letter presents the first search for a heavy particle decaying into an
e\mu final state in sqrt(s)=7 TeV pp collisions at the LHC. The data were
recorded by the ATLAS detector during 2010 and correspond to a total integrated
luminosity of 35/pb. No excess above the Standard Model background expectation
is observed. Exclusions at 95% confidence level are placed on two
representative models. In an R-parity violating supersymmetric model, tau
sneutrinos with a mass below 0.75 TeV are excluded, assuming single coupling
dominance and the couplings lambda'_{311}=0.11, lambda_{312}=0.07. In a lepton
flavor violating model, a Z'-like vector boson with masses of 0.70 to 1.00 TeV
and corresponding cross sections times branching ratios of 0.175 to 0.183 pb is
excluded. These results extend to higher mass RPV sneutrinos and LFV Z's than
previous constraints from the Tevatron.
","[{""version"":""v1"",""created"":""Tue, 29 Mar 2011 07:39:29 GMT""}]","2012-08-27"
"1103.5560","Sameera Salam","Sameera Muhamed Salam, K. N. Parvathy, K. S. Sudeep and K. Murali
  Krishnan","On the Complexity of Edge Packing and Vertex Packing",,,,,"cs.CC","http://arxiv.org/licenses/nonexclusive-distrib/1.0/","  This paper studies the computational complexity of the Edge Packing problem
and the Vertex Packing problem. The edge packing problem (denoted by
$\bar{EDS}$) and the vertex packing problem (denoted by $\bar{DS} $) are linear
programming duals of the edge dominating set problem and the dominating set
problem respectively. It is shown that these two problems are equivalent to the
set packing problem with respect to hardness of approximation and parametric
complexity. It follows that $\bar{EDS}$ and $\bar{DS}$ cannot be approximated
asymptotically within a factor of $O(N^{1/2-\epsilon})$ for any $\epsilon>0$
unless $NP=ZPP$ where, $N$ is the number of vertices in the given graph. This
is in contrast with the fact that the edge dominating set problem is
2-approximable where as the dominating set problem is known to have an $O(\log$
$|V|)$ approximation algorithm. It also follows from our proof that $\bar{EDS}$
and $\bar{DS}$ are $W[1]$-complete.
","[{""version"":""v1"",""created"":""Tue, 29 Mar 2011 07:53:17 GMT""},{""version"":""v2"",""created"":""Thu, 7 Apr 2011 07:16:15 GMT""}]","2011-04-08"
"1103.5561","Hisao Hayakawa","Hisao Hayakawa","Generalized Green-Kubo formula and fluctuation theorem for quantum
  current system around a nonequilibrium steady state","4 pages no figure",,,,"cond-mat.stat-mech","http://arxiv.org/licenses/nonexclusive-distrib/1.0/","  Fluctuation theorem is derived for a quantum current system around a
nonequilibrium steady state. It is demonstrated that the fluctuation theorem
can be a part of the generalized Green-Kubo formula or a nonlinear response
theory of an external field or a change of the chemical potential difference.
","[{""version"":""v1"",""created"":""Tue, 29 Mar 2011 08:17:44 GMT""}]","2011-03-30"
"1103.5562","Tuomas Hyt\""onen","Tuomas Hyt\""onen and Carlos P\'erez","Sharp weighted bounds involving A_\infty","41 pages",,,,"math.CA","http://arxiv.org/licenses/nonexclusive-distrib/1.0/","  We improve on several weighted inequalities of recent interest by replacing a
part of the A_p bounds by weaker A_\infty estimates involving Wilson's A_\infty
constant \[ [w]_{A_\infty}':=\sup_Q\frac{1}{w(Q)}\int_Q M(w\chi_Q). \] In
particular, we show the following improvement of the first author's A_2 theorem
for Calder\'on-Zygmund operators T: \[\|T\|_{B(L^2(w))}\leq c_T
[w]_{A_2}^{1/2}([w]_{A_\infty}'+[w^{-1}]_{A_\infty}')^{1/2}. \] Corresponding
A_p type results are obtained from a new extrapolation theorem with appropriate
mixed A_p-A_\infty bounds. This uses new two-weight estimates for the maximal
function, which improve on Buckley's classical bound. We also derive mixed
A_1-A_\infty type results of Lerner, Ombrosi and the second author (Math. Res.
Lett. 2009) of the form: \[\|T\|_{B(L^p(w))} \leq c
pp'[w]_{A_1}^{1/p}([w]_{A_{\infty}}')^{1/p'}, 1<p<\infty, \]
\[\|Tf\|_{L^{1,\infty}(w)} \leq c[w]_{A_1} \log(e+[w]'_{A_{\infty}})
\|f\|_{L^1(w)}. \] An estimate dual to the last one is also found, as well as
new bounds for commutators of singular integrals.
","[{""version"":""v1"",""created"":""Tue, 29 Mar 2011 08:23:55 GMT""}]","2011-03-30"
"1103.5563","Larry Zamick","Larry Zamick","The Most Negative and the Most Positive Value of the Spin Operator for a
  Many Fermion System",,"Phys. Rev. C 84, 017302 (2011)","10.1103/PhysRevC.84.017302",,"nucl-th nucl-ex","http://arxiv.org/licenses/nonexclusive-distrib/1.0/","  We consider the most negative and most positive value of the spin operator
for a many nucleon system. In the usual Nilsson model and in the single nucleon
model this value has a narrow range.In the Nilsson model with an excited
intrinsic state we can get values of the spin operator greater than one.
","[{""version"":""v1"",""created"":""Tue, 29 Mar 2011 08:25:28 GMT""},{""version"":""v2"",""created"":""Tue, 14 Jun 2011 19:11:46 GMT""},{""version"":""v3"",""created"":""Wed, 15 Jun 2011 09:51:52 GMT""},{""version"":""v4"",""created"":""Wed, 22 Jun 2011 21:42:54 GMT""}]","2019-12-06"
"1103.5564","Guofa Xu","BESIII Collaboration","Study of $\chi_{cJ}$ radiative decays into a vector meson","8 pages, 3 figures","Phys.Rev.D83:112005,2011","10.1103/PhysRevD.83.112005",,"hep-ex","http://arxiv.org/licenses/nonexclusive-distrib/1.0/","  The decays $\chi_{cJ}\to\gamma V$ ($V=\phi, \rho^0, \omega$) are studied with
a sample of radiative $\psip\to\gamma\chi_{cJ}$ events in a sample of
$(1.06\pm0.04)\times 10^{8} \psip$ events collected with the BESIII detector.
The branching fractions are determined to be: ${\cal B}(\chi_{c1}\to
\gamma\phi)=(25.8\pm 5.2\pm 2.3)\times 10^{-6}$, ${\cal B}(\chi_{c1}\to
\gamma\rho^0)=(228\pm 13\pm 22)\times 10^{-6}$, and ${\cal B}(\chi_{c1}\to
\gamma\omega)=(69.7\pm 7.2\pm 6.6)\times 10^{-6}$. The decay $\chi_{c1}\to
\gamma\phi$ is observed for the first time. Upper limits at the 90% confidence
level on the branching fractions for $\chi_{c0}$ and $\chict$ decays into these
final states are determined. In addition, the fractions of the transverse
polarization component of the vector meson in $\chi_{c1}\to \gamma V$ decays
are measured to be $0.29_{-0.12-0.09}^{+0.13+0.10}$ for $\chi_{c1}\to
\gamma\phi$, $0.158\pm 0.034^{+0.015}_{-0.014}$ for $\chi_{c1}\to
\gamma\rho^0$, and $0.247_{-0.087-0.026}^{+0.090+0.044}$ for $\chi_{c1}\to
\gamma\omega$, respectively. The first errors are statistical and the second
ones are systematic.
","[{""version"":""v1"",""created"":""Tue, 29 Mar 2011 08:26:15 GMT""},{""version"":""v2"",""created"":""Mon, 13 Jun 2011 00:57:24 GMT""}]","2012-08-27"
