"1103.5397","Ludovic D.C. Jaubert","L. D. C. Jaubert, M. Haque and R. Moessner","Analysis of a fully packed loop model arising in a magnetic Coulomb
  phase","5 pages, 4 figures","Phys. Rev. Lett. 107, 177202 (2011)","10.1103/PhysRevLett.107.177202",,"cond-mat.stat-mech cond-mat.str-el","http://arxiv.org/licenses/nonexclusive-distrib/1.0/","  The Coulomb phase of spin ice, and indeed the Ic phase of water ice,
naturally realise a fully-packed two-colour loop model in three dimensions. We
present a detailed analysis of the statistics of these loops, which avoid
themselves and other loops of the same colour, and contrast their behaviour to
an analogous two-dimensional model. The properties of another extended degree
of freedom are also addressed, flux lines of the emergent gauge field of the
Coulomb phase, which appear as ""Dirac strings"" in spin ice. We mention
implications of these results for related models, and experiments.
","[{""version"":""v1"",""created"":""Mon, 28 Mar 2011 16:00:01 GMT""}]","2011-11-09"
"1103.5398","Ujjwal Sen","Aditi Sen De, Ujjwal Sen","Benford's Law Detects Quantum Phase Transitions similarly as Earthquakes","v1: 3 pages, 2 figures; v2: 6 (+epsilon) epl pages, 5 figures,
  significant additions, previous results unchanged","Europhys. Lett. vol. 95, 50008 (2011)","10.1209/0295-5075/95/50008",,"quant-ph cond-mat.str-el physics.geo-ph","http://arxiv.org/licenses/nonexclusive-distrib/1.0/","  A century ago, it was predicted that the first significant digit appearing in
a data would be nonuniformly distributed, with the number one appearing with
the highest frequency. This law goes by the name of Benford's law. It holds for
data ranging from infectious disease cases to national greenhouse gas
emissions. Quantum phase transitions are cooperative phenomena where
qualitative changes occur in many-body systems at zero temperature. We show
that the century-old Benford's law can detect quantum phase transitions, much
like it detects earthquakes. Therefore, being certainly of very different
physical origins, seismic activity and quantum cooperative phenomena may be
detected by similar methods. The result has immediate implications in precise
measurements in experiments in general, and for realizable quantum computers in
particular. It shows that estimation of the first significant digit of measured
physical observables is enough to detect the presence of quantum phase
transitions in macroscopic systems.
","[{""version"":""v1"",""created"":""Mon, 28 Mar 2011 16:01:41 GMT""},{""version"":""v2"",""created"":""Thu, 6 Oct 2011 11:45:35 GMT""}]","2011-10-07"
"1103.5399","Thomas Dean","Thomas A. Dean and Sumeetpal S. Singh and Ajay Jasra and Gareth W.
  Peters","Parameter Estimation for Hidden Markov Models with Intractable
  Likelihoods","First version: 1 October 2010",,,"Cambridge University Engineering Department Technical Report 660","math.ST stat.ME stat.TH","http://arxiv.org/licenses/nonexclusive-distrib/1.0/","  Approximate Bayesian computation (ABC) is a popular technique for
approximating likelihoods and is often used in parameter estimation when the
likelihood functions are analytically intractable. Although the use of ABC is
widespread in many fields, there has been little investigation of the
theoretical properties of the resulting estimators. In this paper we give a
theoretical analysis of the asymptotic properties of ABC based maximum
likelihood parameter estimation for hidden Markov models. In particular, we
derive results analogous to those of consistency and asymptotic normality for
standard maximum likelihood estimation. We also discuss how Sequential Monte
Carlo methods provide a natural method for implementing likelihood based ABC
procedures.
","[{""version"":""v1"",""created"":""Mon, 28 Mar 2011 16:10:24 GMT""}]","2011-03-29"
"1103.5400","Yu. A. Sitenko","Yu.A. Sitenko and N.D. Vlasii","Optical theorem for Aharonov-Bohm scattering","22 pages","J.Phys.A44:315301,2011","10.1088/1751-8113/44/31/315301",,"quant-ph hep-th math-ph math.MP","http://arxiv.org/licenses/nonexclusive-distrib/1.0/","  Quantum-mechanical scattering off a magnetic vortex is considered, and the
optical theorem is derived. The vortex core is assumed to be impermeable to
scattered particles, and its transverse size is taken into account. We show
that the scattering Aharonov-Bohm effect is independent of the choice of
boundary conditions from the variety of the Robin ones. The behaviour of the
scattering amplitude in the forward direction is analyzed, and the persistence
of the Fraunhofer diffraction in the short-wavelength limit is shown to be
crucial for maintaining the optical theorem in the quasiclassical limit.
","[{""version"":""v1"",""created"":""Mon, 28 Mar 2011 16:11:11 GMT""},{""version"":""v2"",""created"":""Wed, 6 Apr 2011 14:07:53 GMT""},{""version"":""v3"",""created"":""Thu, 14 Jul 2011 09:29:30 GMT""}]","2011-07-15"
"1103.5401","Giuseppe La Vacca","G. La Vacca, A. Valotti and S. A. Bonometto","Precision cosmology and 7Li data","10 pages, 6 figures, submitted to JCAP",,,,"astro-ph.CO","http://arxiv.org/licenses/nonexclusive-distrib/1.0/","  At variance from 2H, 3He and 4He abundances, 7Li abundance data yield an
extra constraint to cosmological parameters, in top of those deriving from CMB,
BAO, SNIa or H0 data. This constraint, often disregarded, would favor smaller
$\Omega_b h^2$ values, also indicating a preference for Dark Energy state
equations well in the phantom regime, simultaneously softening the upper limit
on the sum of neutrino masses, up to ~1.6eV.
","[{""version"":""v1"",""created"":""Mon, 28 Mar 2011 16:11:58 GMT""}]","2011-03-29"
"1103.5402","Tomonori Totani","Tomonori Totani (1), Tsutomu T. Takeuchi (2), Masahiro Nagashima (3),
  Masakazu A.R. Kobayashi (4), and Ryu Makiya (1) ((1) Kyoto, (2) Nagoya, (3)
  Nagasaki, (4) NAOJ)","Infrared Spectral Energy Distribution of Galaxies in the AKARI All Sky
  Survey: Correlations with Galaxy Properties, and Their Physical Origin","29 pages including 28 figures. matches the published version (PASJ
  2011 Dec. 25 issue). The E-open option was chosen for this article, i.e., the
  official version available from PASJ site
  (http://pasj.asj.or.jp/v63/n6/630613/630613-frame.html) without restriction","Pub. Astron. Soc. Jpn, 63, 1181-1206 (2011)","10.1093/pasj/63.6.1181",,"astro-ph.GA astro-ph.CO","http://arxiv.org/licenses/nonexclusive-distrib/1.0/","  We have studied the properties of more than 1600 low-redshift galaxies by
utilizing high-quality infrared flux measurements of the AKARI All-Sky Survey
and physical quantities based on optical and 21-cm observations. Our goal is to
understand the physics determining the infrared spectral energy distribution
(SED). The ratio of the total infrared luminosity L_TIR, to the star-formation
rate (SFR) is tightly correlated by a power-law to specific SFR (SSFR), and
L_TIR is a good SFR indicator only for galaxies with the largest SSFR. We
discovered a tight linear correlation for normal galaxies between the radiation
field strength of dust heating, estimated by infrared SED fits (U_h), and that
of galactic-scale infrared emission (U_TIR ~ L_TIR/R^2), where R is the optical
size of a galaxy. The dispersion of U_h along this relation is 0.3 dex,
corresponding to 13% dispersion in the dust temperature. This scaling and the
U_h/U_TIR ratio can be explained physically by a thin layer of heating sources
embedded in a thicker, optically-thick dust screen. The data also indicate that
the heated fraction of the total dust mass is anti-correlated to the dust
column density, supporting this interpretation. In the large U_TIR limit, the
data of circumnuclear starbursts indicate the existence of an upper limit on
U_h, corresponding to the maximum SFR per gas mass of ~ 10 Gyr^{-1}. We find
that the number of galaxies sharply drops when they become optically thin
against dust-heating radiation, suggesting that a feedback process to galaxy
formation (likely by the photoelectric heating) is working when dust-heating
radiation is not self-shielded on a galactic scale. Implications are discussed
for the M_HI-size relation, the Kennicutt-Schmidt relation, and galaxy
formation in the cosmological context.
","[{""version"":""v1"",""created"":""Mon, 28 Mar 2011 16:16:08 GMT""},{""version"":""v2"",""created"":""Sun, 26 Jun 2011 11:36:53 GMT""},{""version"":""v3"",""created"":""Thu, 26 Jan 2012 06:04:14 GMT""}]","2015-05-27"
"1103.5403","Susana Gutierrez","Susana Gutierrez, Luis Vega","On the stability of self-similar solutions of 1D cubic Schrodinger
  equations","38 pages, 8 figures",,,,"math.AP","http://arxiv.org/licenses/nonexclusive-distrib/1.0/","  In this paper we will study the stability properties of self-similar
solutions of 1-d cubic NLS equations with time-dependent coefficients of the
form iu_t+u_{xx}+\frac{u}{2} (|u|^2-\frac{A}{t})=0, A\in \R (cubic). The study
of the stability of these self-similar solutions is related, through the
Hasimoto transformation, to the stability of some singular vortex dynamics in
the setting of the Localized Induction Equation (LIE), an equation modeling the
self-induced motion of vortex filaments in ideal fluids and superfluids. We
follow the approach used by Banica and Vega that is based on the so-called
pseudo-conformal transformation, which reduces the problem to the construction
of modified wave operators for solutions of the equation iv_t+ v_{xx}
+\frac{v}{2t}(|v|^2-A)=0. As a by-product of our results we prove that equation
(cubic) is well-posed in appropriate function spaces when the initial datum is
given by u(0,x)= z_0 \pv \frac{1}{x} for some values of z_0\in
\C\setminus\{0\}, and A is adequately chosen. This is in deep contrast with the
case when the initial datum is the Dirac-delta distribution.
","[{""version"":""v1"",""created"":""Mon, 28 Mar 2011 16:18:11 GMT""}]","2011-03-29"
"1103.5404","Margarete Muhlleitner","R.M. Godbole, C. Hangst, M. Muhlleitner, S.D. Rindani and P. Sharma","Model-independent analysis of Higgs spin and CP properties in the
  process $e^+ e^- \to t \bar t \Phi$",,,"10.1140/epjc/s10052-011-1681-7",,"hep-ph","http://arxiv.org/licenses/nonexclusive-distrib/1.0/","  In this paper we investigate methods to study the $t\bar{t}$ Higgs coupling.
The spin and CP properties of a Higgs boson are analysed in a model-independent
way in its associated production with a $t\bar{t}$ pair in high-energy $e^+e^-$
collisions. We study the prospects of establishing the CP quantum numbers of
the Higgs boson in the CP-conserving case as well as those of determining the
CP-mixing if CP is violated. We explore in this analysis the combined use of
the total cross section and its energy dependence, the polarisation asymmetry
of the top quark and the up-down asymmetry of the antitop with respect to the
top-electron plane. We find that combining all three observables remarkably
reduces the error on the determination of the CP properties of the Higgs Yukawa
coupling. Furthermore, the top polarisation asymmetry and the ratio of cross
sections at different collider energies are shown to be sensitive to the spin
of the particle produced in association with the top quark pair.
","[{""version"":""v1"",""created"":""Mon, 28 Mar 2011 16:19:58 GMT""}]","2015-05-27"
"1103.5405","Phoebus Chen","Phoebus Chen, Chithrupa Ramesh, Karl H. Johansson","Network Estimation and Packet Delivery Prediction for Control over
  Wireless Mesh Networks","20 pages, 8 figures. Originally submitted to KTH Royal Institute of
  Technology Technical Report Database on October 20, 2010",,,"TRITA-EE:043","cs.SY cs.NI math.OC","http://creativecommons.org/licenses/by/3.0/","  Much of the current theory of networked control systems uses simple
point-to-point communication models as an abstraction of the underlying
network. As a result, the controller has very limited information on the
network conditions and performs suboptimally. This work models the underlying
wireless multihop mesh network as a graph of links with transmission success
probabilities, and uses a recursive Bayesian estimator to provide packet
delivery predictions to the controller. The predictions are a joint probability
distribution on future packet delivery sequences, and thus capture correlations
between successive packet deliveries. We look at finite horizon LQG control
over a lossy actuation channel and a perfect sensing channel, both without
delay, to study how the controller can compensate for predicted network
outages.
","[{""version"":""v1"",""created"":""Mon, 28 Mar 2011 16:22:01 GMT""}]","2011-03-29"
"1103.5406","Delfim F. M. Torres","Ricardo Almeida, Delfim F. M. Torres","Fractional variational calculus for nondifferentiable functions","Submitted 13-Aug-2010; revised 24-Nov-2010; accepted 28-March-2011;
  for publication in Computers and Mathematics with Applications","Comput. Math. Appl. 61 (2011), no. 10, 3097--3104","10.1016/j.camwa.2011.03.098",,"math.OC","http://arxiv.org/licenses/nonexclusive-distrib/1.0/","  We prove necessary optimality conditions, in the class of continuous
functions, for variational problems defined with Jumarie's modified
Riemann-Liouville derivative. The fractional basic problem of the calculus of
variations with free boundary conditions is considered, as well as problems
with isoperimetric and holonomic constraints.
","[{""version"":""v1"",""created"":""Mon, 28 Mar 2011 16:28:12 GMT""}]","2011-05-10"
"1103.5407","James Scott","Nicholas G. Polson and James G. Scott","Data augmentation for non-Gaussian regression models using variance-mean
  mixtures","Added a discussion of quasi-Newton acceleration",,,,"stat.ME stat.CO","http://arxiv.org/licenses/nonexclusive-distrib/1.0/","  We use the theory of normal variance-mean mixtures to derive a
data-augmentation scheme for a class of common regularization problems. This
generalizes existing theory on normal variance mixtures for priors in
regression and classification. It also allows variants of the
expectation-maximization algorithm to be brought to bear on a wider range of
models than previously appreciated. We demonstrate the method on several
examples, including sparse quantile regression and binary logistic regression.
We also show that quasi-Newton acceleration can substantially improve the speed
of the algorithm without compromising its robustness.
","[{""version"":""v1"",""created"":""Mon, 28 Mar 2011 16:28:32 GMT""},{""version"":""v2"",""created"":""Thu, 14 Jul 2011 22:37:08 GMT""},{""version"":""v3"",""created"":""Sun, 26 Feb 2012 04:51:17 GMT""},{""version"":""v4"",""created"":""Sat, 22 Sep 2012 21:19:23 GMT""}]","2012-09-25"
"1103.5408","John Cotter","John Cotter and Kevin Dowd","Spectral Risk Measures with an Application to Futures Clearinghouse
  Variation Margin Requirements",,,,,"q-fin.RM q-fin.ST","http://arxiv.org/licenses/nonexclusive-distrib/1.0/","  This paper applies an AR(1)-GARCH (1, 1) process to detail the conditional
distributions of the return distributions for the S&P500, FT100, DAX, Hang
Seng, and Nikkei225 futures contracts. It then uses the conditional
distribution for these contracts to estimate spectral risk measures, which are
coherent risk measures that reflect a user's risk-aversion function. It
compares these to more familiar VaR and Expected Shortfall (ES) measures of
risk, and also compares the precision and discusses the relative usefulness of
each of these risk measures in setting variation margins that incorporate
time-varying market conditions. The goodness of fit of the model is confirmed
by a variety of backtests.
","[{""version"":""v1"",""created"":""Mon, 28 Mar 2011 16:32:15 GMT""}]","2011-03-29"
"1103.5409","John Cotter","Kevin Dowd and John Cotter","Exponential Spectral Risk Measures",,,,,"q-fin.RM q-fin.ST","http://arxiv.org/licenses/nonexclusive-distrib/1.0/","  Spectral risk measures are attractive risk measures as they allow the user to
obtain risk measures that reflect their subjective risk-aversion. This paper
examines spectral risk measures based on an exponential utility function, and
finds that these risk measures have nice intuitive properties. It also
discusses how they can be estimated using numerical quadrature methods, and how
confidence intervals for them can be estimated using a parametric bootstrap.
Illustrative results suggest that estimated exponential spectral risk measures
obtained using such methods are quite precise in the presence of normally
distributed losses.
","[{""version"":""v1"",""created"":""Mon, 28 Mar 2011 16:36:10 GMT""}]","2011-03-29"
"1103.5410","Alberto Pepe","Alberto Pepe and Corinna di Gennaro","Political protest Italian-style: The dissonance between the blogosphere
  and mainstream media in the promotion and coverage of Beppe Grillo's V-day","30 pages; First Monday. Volume 14, Number 12. 2009","First Monday. Volume 14, Number 12. 2009",,,"cs.SI cs.CY physics.soc-ph","http://creativecommons.org/licenses/by-nc-sa/3.0/","  We analyze the organization, promotion and public perception of V-day, a
political rally that took place on September 8, 2007, to protest against
corruption in the Italian Parliament. Launched by blogger Beppe Grillo, and
promoted via a word of mouth mobilization on the Italian blogosphere, V-day
brought close to one million Italians in the streets on a single day, but was
mostly ignored by mainstream media. This article is divided into two parts. In
the first part, we analyze the volume and content of online articles published
by both bloggers and mainstream news sources from June 14 (the day V-day was
announced) until September 15, 2007 (one week after it took place) . We find
that the success of V-day can be attributed to the coverage of bloggers and
small-scale local news outlets only, suggesting a strong grassroots component
in the organization of the rally. We also find a dissonant thematic
relationship between content published by blogs and mainstream media: while the
majority of blogs analyzed promote V-day, major mainstream media sources
critique the methods of information production and dissemination employed by
Grillo. Based on this finding, in the second part of the study, we explore the
role of Grillo in the organization of the rally from a network analysis
perspective. We study the interlinking structure of the V-day blogosphere
network, to determine its structure, its levels of heterogeneity, and
resilience. Our analysis contradicts the hypothesis that Grillo served as a
top-down, broadcast-like source of information. Rather, we find that
information about V-day was transferred across heterogeneous nodes in a
moderately robust and resilient core network of blogs. We speculate that the
organization of V-day represents the very first case, in Italian history, of a
political demonstration developed and promoted primarily via the use of social
media on the web.
","[{""version"":""v1"",""created"":""Mon, 28 Mar 2011 16:37:46 GMT""}]","2011-03-30"
"1103.5411","John Cotter","John Cotter and Jim Hanly","Hedging Effectiveness under Conditions of Asymmetry",,,,,"q-fin.CP q-fin.RM","http://arxiv.org/licenses/nonexclusive-distrib/1.0/","  We examine whether hedging effectiveness is affected by asymmetry in the
return distribution by applying tail specific metrics to compare the hedging
effectiveness of short and long hedgers using crude oil futures contracts. The
metrics used include Lower Partial Moments (LPM), Value at Risk (VaR) and
Conditional Value at Risk (CVAR). Comparisons are applied to a number of
hedging strategies including OLS and both Symmetric and Asymmetric GARCH
models. Our findings show that asymmetry reduces in-sample hedging performance
and that there are significant differences in hedging performance between short
and long hedgers. Thus, tail specific performance metrics should be applied in
evaluating hedging effectiveness. We also find that the Ordinary Least Squares
(OLS) model provides consistently good performance across different measures of
hedging effectiveness and estimation methods irrespective of the
characteristics of the underlying distribution.
","[{""version"":""v1"",""created"":""Mon, 28 Mar 2011 16:39:05 GMT""}]","2011-03-29"
"1103.5412","John Cotter","John Cotter and Fran\c{c}ois Longin","Margin setting with high-frequency data1",,,,,"q-fin.RM q-fin.TR","http://arxiv.org/licenses/nonexclusive-distrib/1.0/","  Both in practice and in the academic literature, models for setting margin
requirements in futures markets classically use daily closing price changes.
However, as well documented by research on high-frequency data, financial
markets have recently shown high intraday volatility, which could bring more
risk than expected. This paper tries to answer two questions relevant for
margin committees in practice: is it right to compute margin levels based on
closing prices and ignoring intraday dynamics? Is it justified to implement
intraday margin calls? The paper focuses on the impact of intraday dynamics of
market prices on daily margin levels. Daily margin levels are obtained in two
ways: first, by using daily price changes defined with different time-intervals
(say from 3 pm to 3 pm on the following trading day instead of traditional
closing times); second, by using 5-minute and 1-hour price changes and scaling
the results to one day. Our empirical analysis uses the FTSE 100 futures
contract traded on LIFFE.
","[{""version"":""v1"",""created"":""Mon, 28 Mar 2011 16:41:16 GMT""}]","2011-03-29"
"1103.5413","Howard Baer","Howard Baer, Andre Lessa, Shibi Rajagopalan and Warintorn Sreethawong","Mixed axion/neutralino cold dark matter in supersymmetric models","31 pages including 21 figures",,"10.1088/1475-7516/2011/06/031",,"hep-ph astro-ph.HE","http://arxiv.org/licenses/nonexclusive-distrib/1.0/","  We consider supersymmetric (SUSY) models wherein the strong CP problem is
solved by the Peccei-Quinn (PQ) mechanism with a concommitant axion/axino
supermultiplet. We examine R-parity conserving models where the neutralino is
the lightest SUSY particle, so that a mixture of neutralinos and axions serve
as cold dark matter. The mixed axion/neutralino CDM scenario can match the
measured dark matter abundance for SUSY models which typically give too low a
value of the usual thermal neutralino abundance, such as models with wino-like
or higgsino-like dark matter. The usual thermal neutralino abundance can be
greatly enhanced by the decay of thermally-produced axinos to neutralinos,
followed by neutralino re-annihilation at temperatures much lower than
freeze-out. In this case, the relic density is usually neutralino dominated,
and goes as \sim (f_a/N)/m_{axino}^{3/2}. If axino decay occurs before
neutralino freeze-out, then instead the neutralino abundance can be augmented
by relic axions to match the measured abundance. Entropy production from
late-time axino decays can diminish the axion abundance, but ultimately not the
neutralino abundance. In mixed axion/neutralino CDM models, it may be possible
to detect both a WIMP and an axion as dark matter relics. We also discuss
possible modifications of our results due to production and decay of saxions.
In the appendices, we present expressions for the Hubble expansion rate and the
axion and neutralino relic densities in radiation, matter and decaying-particle
dominated universes.
","[{""version"":""v1"",""created"":""Mon, 28 Mar 2011 16:44:30 GMT""}]","2015-05-27"
"1103.5414","John Cotter","John Cotter and Simon Stevenson","Modeling Long Memory in REITs",,,,,"q-fin.ST","http://arxiv.org/licenses/nonexclusive-distrib/1.0/","  One stylized feature of financial volatility impacting the modeling process
is long memory. This paper examines long memory for alternative risk measures,
observed absolute and squared returns for Daily REITs and compares the findings
for a non- REIT equity index. The paper utilizes a variety of tests for long
memory finding evidence that REIT volatility does display persistence, in
contrast to the actual return series. Trading volume is found to be strongly
associated with long memory. The results do however suggest differences in the
findings with regard to REITs in comparison to the broader equity sector which
may be due to relatively thin trading during the sample period.
","[{""version"":""v1"",""created"":""Mon, 28 Mar 2011 16:44:44 GMT""}]","2011-03-29"
"1103.5415","Witold Kra\'skiewicz","Witold Kra\'skiewicz and Jerzy Weyman","Generic decompositions and semi-invariants for string algebras",,,,,"math.RT math.AG math.RA","http://arxiv.org/licenses/nonexclusive-distrib/1.0/","  We investigate the rings of semi-invariants for tame string algebras A(n) of
non-polynomial growth. We are interested in dimension vectors of band modules.
We use geometric technique related to the description of coordinate rings on
varieties of complexes. The fascinating combinatorics emerges, showing that our
rings of invariants are the rings of some toric varieties. We show that for
$n\le 6$ the rings of semi-invariants are complete intersections but we show an
example for $n=7$ that this is not the case in general.
","[{""version"":""v1"",""created"":""Mon, 28 Mar 2011 16:45:02 GMT""}]","2011-03-29"
