"1111.4211","Anna Elia","Anna Elia, Aaron D. Ludlow and Cristiano Porciani","The spatial and velocity bias of linear density peaks and proto-haloes
  in the Lambda cold dark matter cosmology","10 pages, 4 figures. Matches version accepted for publication in
  MNRAS",,"10.1111/j.1365-2966.2012.20572.x",,"astro-ph.CO","http://arxiv.org/licenses/nonexclusive-distrib/1.0/","  We use high resolution N-body simulations to investigate the Lagrangian bias
of cold dark matter haloes within the LCDM cosmology. Our analysis focuses on
""proto-haloes"", which we identify in the simulation initial conditions with the
subsets of particles belonging to individual redshift-zero haloes. We then
calculate the number-density and velocity-divergence fields of proto-haloes and
estimate their auto spectral densities. We also measure the corresponding cross
spectral densities with the linear matter distribution. We use our results to
test a Lagrangian-bias model presented by Desjacques and Sheth which is based
on the assumption that haloes form out of local density maxima of a specific
height. Our comparison validates the predicted functional form for the
scale-dependence of the bias for both the density and velocity fields. We also
show that the bias coefficients are accurately predicted for the velocity
divergence. On the contrary, the theoretical values for the density bias
parameters do not accurately match the numerical results as a function of halo
mass. This is likely due to the simplistic assumptions that relate virialized
haloes to density peaks of a given height in the model. We also detect
appreciable stochasticity for the Lagrangian density bias, even on very large
scales. These are not included in the model at leading order but correspond to
higher order corrections.
","[{""version"":""v1"",""created"":""Thu, 17 Nov 2011 21:00:06 GMT""},{""version"":""v2"",""created"":""Wed, 15 Feb 2012 11:21:49 GMT""}]","2015-06-03"
"1111.4212","Jun-Qing Xia","Jun-Qing Xia, M. Negrello, A. Lapi, G. De Zotti, L. Danese, M. Viel","Clustering of sub-millimeter galaxies in a self-regulated baryon
  collapse model","9 pages, 4 figures","Mon. Not. Roy. Astron. Soc. 422 (2012) 1324-1331","10.1111/j.1365-2966.2012.20705.x",,"astro-ph.CO","http://arxiv.org/licenses/nonexclusive-distrib/1.0/","  We have investigated the Cosmic Infrared Background (CIB) anisotropies in the
framework of the physical evolutionary model for proto-spheroidal galaxies by
Granato et al. (2004). After having re-calibrated the cumulative flux function
$dS/dz$ at $\lambda \ge 850\,\mu$m using the available determinations of the
shot noise amplitude (the original model already correctly reproduces it at
shorter wavelengths) the CIB power spectra at wavelengths from $250\,\mu$m to
$2\,$mm measured by {\it Planck}, {\it Herschel}, SPT and ACT experiments have
been fitted using the halo model with only 2 free parameters, the minimum halo
mass and the power-law index of the mean occupation function of satellite
galaxies. The best-fit {\it minimum} halo mass is $\log(M_{\rm min}/M_\odot) =
12.24 \pm 0.06$, higher than, but consistent within the errors, with the
estimate by Amblard et al. (2011) and close to the estimate by Planck
Collaboration (2011). The redshift evolution of the volume emissivity of
galaxies yielded by the model is found to be consistent with that inferred from
the data. The derived {\it effective} halo mass, $M_{\rm eff} \simeq 5\times
10^{12}\,M_\odot$, of $z\simeq 2$ sub-millimeter galaxies is close to that
estimated for the most efficient star-formers at the same redshift. The
effective bias factor and the comoving clustering radius at $z\simeq 2$ yielded
by the model are substantially lower than those found for a model whereby the
star formation is fueled by steady gas accretion, but substantially higher than
those found for a merging-driven galaxy evolution with a top-heavy initial mass
function.
","[{""version"":""v1"",""created"":""Thu, 17 Nov 2011 21:00:16 GMT""},{""version"":""v2"",""created"":""Thu, 3 May 2012 10:59:38 GMT""}]","2012-05-04"
"1111.4213","Andrea Fortini","Ingmar Schwarz, Andrea Fortini, Claudia Simone Wagner, Alexander
  Wittemann, Matthias Schmidt","Monte Carlo computer simulations and electron microscopy of colloidal
  cluster formation via emulsion droplet evaporation","12 pages, 10 figures","J. Chem. Phys. 135, 244501 (2011)","10.1063/1.3672106",,"cond-mat.soft cond-mat.mes-hall cond-mat.stat-mech","http://arxiv.org/licenses/nonexclusive-distrib/1.0/","  We consider a theoretical model for a binary mixture of colloidal particles
and spherical emulsion droplets. The hard sphere colloids interact via
additional short-ranged attraction and long-ranged repulsion. The
droplet-colloid interaction is an attractive well at the droplet surface, which
induces the Pickering effect. The droplet-droplet interaction is a hard-core
interaction. The droplets shrink in time, which models the evaporation of the
dispersed (oil) phase, and we use Monte Carlo simulations for the dynamics. In
the experiments, polystyrene particles were assembled using toluene droplets as
templates. The arrangement of the particles on the surface of the droplets was
analyzed with cryogenic field emission scanning electron microscopy. Before
evaporation of the oil, the particle distribution on the droplet surface was
found to be disordered in experiments, and the simulations reproduce this
effect. After complete evaporation, ordered colloidal clusters are formed that
are stable against thermal fluctuations. Both in the simulations and with field
emission scanning electron microscopy, we find stable packings that range from
doublets, triplets, and tetrahedra to complex polyhedra of colloids. The
simulated cluster structures and size distribution agree well with the
experimental results. We also simulate hierarchical assembly in a mixture of
tetrahedral clusters and droplets, and find supercluster structures with
morphologies that are more complex than those of clusters of single particles.
","[{""version"":""v1"",""created"":""Thu, 17 Nov 2011 21:00:29 GMT""},{""version"":""v2"",""created"":""Tue, 6 Dec 2011 15:01:25 GMT""},{""version"":""v3"",""created"":""Wed, 14 Dec 2011 13:17:11 GMT""}]","2012-01-11"
"1111.4214","Jean-Sebastien Bernier","Jean-Sebastien Bernier, Dario Poletti, Peter Barmettler, Guillaume
  Roux, Corinna Kollath","Slow quench dynamics of Mott-insulating regions in a trapped Bose gas","15 pages, 13 figures","Phys. Rev. A 85, 033641 (2012)","10.1103/PhysRevA.85.033641",,"cond-mat.quant-gas cond-mat.str-el","http://arxiv.org/licenses/nonexclusive-distrib/1.0/","  We investigate the dynamics of Mott-insulating regions of a trapped bosonic
gas as the interaction strength is changed linearly with time. The bosonic gas
considered is loaded into an optical lattice and confined to a parabolic
trapping potential. Two situations are addressed: the formation of Mott domains
in a superfluid gas as the interaction is increased, and their melting as the
interaction strength is lowered. In the first case, depending on the local
filling, Mott-insulating barriers can develop and hinder the density and energy
transport throughout the system. In the second case, the density and local
energy adjust rapidly whereas long range correlations require longer time to
settle. For both cases, we consider the time evolution of various observables:
the local density and energy, and their respective currents, the local
compressibility, the local excess energy, the heat and single particle
correlators. The evolution of these observables is obtained using the
time-dependent density-matrix renormalization group technique and comparisons
with time-evolutions done within the Gutzwiller approximation are provided.
","[{""version"":""v1"",""created"":""Thu, 17 Nov 2011 21:00:37 GMT""}]","2015-03-19"
"1111.4215","Alessandro Sonnenfeld","Alessandro Sonnenfeld, Tommaso Treu, Raphael Gavazzi, Philip J.
  Marshall, Matthew W. Auger, Sherry H. Suyu, Leon V. E. Koopmans, Adam S.
  Bolton","Evidence for dark matter contraction and a Salpeter IMF in a massive
  early-type galaxy","18 pages, 17 figures. Accepted for publication in ApJ",,"10.1088/0004-637X/752/2/163",,"astro-ph.CO","http://arxiv.org/licenses/nonexclusive-distrib/1.0/","  Stars and dark matter account for most of the mass of early-type galaxies,
but uncertainties in the stellar population and the dark matter profile make it
challenging to distinguish between the two components. Nevertheless, precise
observations of stellar and dark matter are extremely valuable for testing the
many models of structure formation and evolution. We present a measurement of
the stellar mass and inner slope of the dark matter halo of a massive
early-type galaxy at $z=0.222$. The galaxy is the foreground deflector of the
double Einstein ring gravitational lens system SDSSJ0946+1006, also known as
the ""Jackpot"". By combining the tools of lensing and dynamics, we first
constrain the mean slope of the total mass density profile
($\rho_{\rm{tot}}\propto r^{-\gamma'}$) within the radius of the outer ring to
be $\gamma' = 1.98\pm0.02\pm0.01$. Then we obtain a bulge-halo decomposition,
assuming a power-law form for the dark matter halo. Our analysis yields
$\gamma_{\rm{DM}} = 1.7\pm0.2$ for the inner slope of the dark matter profile,
in agreement with theoretical findings on the distribution of dark matter in
ellipticals, and a stellar mass from lensing and dynamics $M_*^{\rm{LD}} =
5.5_{-1.3}^{+0.4}\times10^{11}M_\Sun$. By comparing this measurement with
stellar masses inferred from stellar population synthesis fitting we find that
a Salpeter IMF provides a good description of the stellar population of the
lens while the probability of the IMF being heavier than Chabrier is 95%. Our
data suggest that growth by accretion of small systems from a compact red
nugget is a plausible formation scenario for this object.
","[{""version"":""v1"",""created"":""Thu, 17 Nov 2011 21:01:45 GMT""},{""version"":""v2"",""created"":""Wed, 23 Nov 2011 00:02:53 GMT""},{""version"":""v3"",""created"":""Mon, 30 Apr 2012 00:11:04 GMT""}]","2015-06-03"
"1111.4216","Robert Wharton","R. S. Wharton, S. Chatterjee, J. M. Cordes, J. S. Deneva, T. J. W.
  Lazio","Multiwavelength Constraints on Pulsar Populations in the Galactic Center","17 pages, 4 figures, 4 tables, Published in ApJ, Updated to match
  published version","ApJ, 753, 108, (2012)","10.1088/0004-637X/753/2/108",,"astro-ph.HE","http://arxiv.org/licenses/nonexclusive-distrib/1.0/","  The detection of radio pulsars within the central few parsecs of the Galaxy
would provide a unique probe of the gravitational and magneto-ionic
environments in the Galactic Center (GC) and, if close enough to Sgr A*,
precise tests of general relativity in the strong-field regime. While it is
difficult to find pulsars at radio wavelengths because of interstellar
scattering, the payoff from detailed timing of pulsars in the GC warrants a
concerted effort. To motivate pulsar surveys and help define search parameters
for them, we constrain the pulsar number and spatial distribution using a wide
range of multiwavelength measurements. These include the five known radio
pulsars within 15 arcmin of Sgr A*, radio and gamma-ray measurements of diffuse
emission, non-detections in high frequency pulsar surveys of the central
parsec, a catalog of radio point sources from an imaging survey, infrared
observations of massive star populations in the central few parsecs, candidate
pulsar wind nebulae in the inner 20 pc and estimates of the core-collapse
supernova rate based on X-ray measurements. We find that under current
observational constraints, the inner parsec of the Galaxy could harbor as many
as ~10^3 active radio pulsars that are beamed towards Earth. Such a large
population would distort the low-frequency measurements of both the intrinsic
spectrum of Sgr A* and the free-free absorption along the line of sight of Sgr
A*.
","[{""version"":""v1"",""created"":""Thu, 17 Nov 2011 21:02:26 GMT""},{""version"":""v2"",""created"":""Wed, 11 Jul 2012 17:15:14 GMT""}]","2012-07-12"
"1111.4217","Casey Watson","Casey R. Watson (Millikin U.), Zhiyuan Li (CfA), Nicholas K. Polley
  (Millikin U.)","Constraining Sterile Neutrino Warm Dark Matter with Chandra Observations
  of the Andromeda Galaxy","minor revisions, key results unchanged, accepted for publication in
  JCAP",,"10.1088/1475-7516/2012/03/018",,"astro-ph.CO hep-ph","http://arxiv.org/licenses/nonexclusive-distrib/1.0/","  We use the Chandra unresolved X-ray emission spectrum from a 12'-28' (2.8-6.4
kpc) annular region of the Andromeda galaxy to constrain the radiative decay of
sterile neutrino warm dark matter. By excising the most baryon-dominated,
central 2.8 kpc of the galaxy, we reduce the uncertainties in our estimate of
the dark matter mass within the field of view and improve the signal-to-noise
ratio of prospective sterile neutrino decay signatures relative to hot gas and
unresolved stellar emission. Our findings impose the most stringent limit on
the sterile neutrino mass to date in the context of the Dodelson-Widrow model,
m_s < 2.2 keV (95% C.L.). Our results also constrain alternative sterile
neutrino production scenarios at very small active-sterile neutrino mixing
angles.
","[{""version"":""v1"",""created"":""Thu, 17 Nov 2011 21:03:15 GMT""},{""version"":""v2"",""created"":""Tue, 10 Jan 2012 03:37:39 GMT""}]","2015-06-03"
"1111.4218","Konstantinos Tassis","Konstantinos Tassis, Karen Willacy, Harold W. Yorke, Neal Turner","Non-Equilibrium Chemistry of Dynamically Evolving Prestellar Cores: II.
  Ionization and Magnetic Field","7 pages, 5 figures, accepted for publication in ApJ",,"10.1088/0004-637X/754/1/6",,"astro-ph.GA","http://arxiv.org/licenses/nonexclusive-distrib/1.0/","  We study the effect that non-equilibrium chemistry in dynamical models of
collapsing molecular cloud cores has on measurements of the magnetic field in
these cores, the degree of ionization, and the mean molecular weight of ions.
We find that OH and CN, usually used in Zeeman observations of the
line-of-sight magnetic field, have an abundance that decreases toward the
center of the core much faster than the density increases. As a result, Zeeman
observations tend to sample the outer layers of the core and consistently
underestimate the core magnetic field. The degree of ionization follows a
complicated dependence on the number density at central densities up to 10^5
cm^{-3} for magnetic models and 10^6 cm^{-3} in non-magnetic models. At higher
central densities the scaling approaches a power-law with a slope of -0.6 and a
normalization which depends on the cosmic-ray ionization rate {\zeta} and the
temperature T as ({\zeta}T)^1/2. The mean molecular weight of ions is
systematically lower than the usually assumed value of 20 - 30, and, at high
densities, approaches a value of 3 due to the asymptotic dominance of the H3+
ion. This significantly lower value implies that ambipolar diffusion operates
faster.
","[{""version"":""v1"",""created"":""Thu, 17 Nov 2011 21:03:21 GMT""},{""version"":""v2"",""created"":""Tue, 22 May 2012 18:50:56 GMT""}]","2015-06-03"
"1111.4219","Martin Pessah","Martin E. Pessah (NBI) and Chi-kwan Chan (NORDITA)","On Hydromagnetic Stresses in Accretion Disk Boundary Layers","6 pages, 4 figures, uses emulateapj, updated to match published
  version in ApJ",,"10.1088/0004-637X/751/1/48",,"astro-ph.HE","http://arxiv.org/licenses/nonexclusive-distrib/1.0/","  Detailed calculations of the physical structure of accretion disk boundary
layers, and thus their inferred observational properties, rely on the
assumption that angular momentum transport is opposite to the radial angular
frequency gradient of the disk. The standard model for turbulent shear
viscosity satisfies this assumption by construction. However, this behavior is
not supported by numerical simulations of turbulent magnetohydrodynamic (MHD)
accretion disks, which show that angular momentum transport driven by the
magnetorotational instability (MRI) is inefficient in disk regions where, as
expected in boundary layers, the angular frequency increases with radius. In
order to shed light into physically viable mechanisms for angular momentum
transport in this inner disk region, we examine the generation of hydromagnetic
stresses and energy density in differentially rotating backgrounds with angular
frequencies that increase outward in the shearing-sheet framework. We isolate
the modes that are unrelated to the standard MRI and provide analytic solutions
for the long-term evolution of the resulting shearing MHD waves. We show that,
although the energy density of these waves can be amplified significantly,
their associated stresses oscillate around zero, rendering them an inefficient
mechanism to transport significant angular momentum (inward). These findings
are consistent with the results obtained in numerical simulations of MHD
accretion disk boundary layers and challenge the standard assumption of
efficient angular momentum transport in the inner disk regions. This suggests
that the detailed structure of turbulent MHD accretion disk boundary layers
could differ appreciably from those derived within the standard framework of
turbulent shear viscosity.
","[{""version"":""v1"",""created"":""Thu, 17 Nov 2011 21:07:59 GMT""},{""version"":""v2"",""created"":""Wed, 23 May 2012 08:39:38 GMT""}]","2012-05-25"
"1111.4220","Robert Schabinger","Robert M. Schabinger","A New Algorithm For The Generation Of Unitarity-Compatible Integration
  By Parts Relations","20 pages; My apologies to Krzysztof Kajda for misspelling his name in
  v1; in v3: the labeling of the variables in (4.5) and eqs. (4.20) and (4.21)
  was adjusted to match the notation used in the rest of Section 4. I thank
  York Schroeder for pointing out the notational inconsistency",,"10.1007/JHEP01(2012)077","IFT-UAM/CSIC-11-89","hep-ph","http://arxiv.org/licenses/nonexclusive-distrib/1.0/","  Many multi-loop calculations make use of integration by parts relations to
reduce the large number of complicated Feynman integrals that arise in such
calculations to a simpler basis of master integrals. Recently, Gluza, Kajda,
and Kosower argued that the reduction to master integrals is complicated by the
presence of integrals with doubled propagator denominators in the integration
by parts relations and they introduced a novel reduction procedure which
eliminates all such integrals from the start. Their approach has the advantage
that it automatically produces integral bases which mesh well with generalized
unitarity. The heart of their procedure is an algorithm which utilizes the
weighty machinery of computational commutative algebra to produce complete sets
of unitarity-compatible integration by parts relations. In this paper, we
propose a conceptually simpler algorithm for the generation of complete sets of
unitarity-compatible integration by parts relations based on recent results in
the mathematical literature. A striking feature of our algorithm is that it can
be described entirely in terms of straightforward linear algebra.
","[{""version"":""v1"",""created"":""Thu, 17 Nov 2011 21:13:43 GMT""},{""version"":""v2"",""created"":""Mon, 21 Nov 2011 22:35:57 GMT""},{""version"":""v3"",""created"":""Wed, 23 Nov 2011 16:39:28 GMT""}]","2015-06-03"
"1111.4221","Takuya Okuda","Yuto Ito, Takuya Okuda, and Masato Taki","Line operators on S^1xR^3 and quantization of the Hitchin moduli space","58 pages; v.2 minor corrections, references added; v.3 corrections
  corresponding to JHEP erratum",,"10.1007/JHEP04(2012)010","UT-Komaba/11-12; YITP-11-96","hep-th","http://arxiv.org/licenses/nonexclusive-distrib/1.0/","  We perform an exact localization calculation for the expectation values of
Wilson-'t Hooft line operators in N=2 gauge theories on S^1xR^3. The
expectation values are naturally expressed in terms of the complexified
Fenchel-Nielsen coordinates, and form a quantum mechanically deformed algebra
of functions on the associated Hitchin moduli space by Moyal multiplication. We
propose that these expectation values are the Weyl transform of the Verlinde
operators, which act on Liouville/Toda conformal blocks as difference
operators. We demonstrate our proposal explicitly in SU(N) examples.
","[{""version"":""v1"",""created"":""Thu, 17 Nov 2011 21:16:37 GMT""},{""version"":""v2"",""created"":""Sun, 8 Apr 2012 12:32:48 GMT""},{""version"":""v3"",""created"":""Tue, 29 Mar 2016 06:47:33 GMT""}]","2016-03-30"
"1111.4222","Josef Pradler","Spencer Chang, Josef Pradler, Itay Yavin","Statistical Tests of Noise and Harmony in Dark Matter Modulation Signals","16 pages, 14 figures; minor correction to Fig. 11, conclusions
  unchanged; journal version","Phys. Rev. D 85, 063505 (2012)","10.1103/PhysRevD.85.063505",,"hep-ph astro-ph.CO astro-ph.IM","http://arxiv.org/licenses/nonexclusive-distrib/1.0/","  The aim of the current work is a detailed time-series analysis of the data
from Dark Matter direct detection experiments as well as related datasets. We
examine recent claims that the cosmic ray muon flux can be responsible for
generating the modulation signals seen by DAMA and, more recently, by the
CoGeNT collaboration. We find no evidence for such a strong correlation and
show that the two phenomena differ in their power spectrum, phase, and possibly
in amplitude. In addition, we investigate in more detail, the time dependence
of Dark Matter scattering. Since the signal is periodic with period of a year
(due to the Earth's motion around the Sun), the presence of higher harmonics
can be expected. We show that the higher harmonics generically have similar
phase to the annual modulation and the biannual mode in particular could
provide another handle in searching for Dark Matter in the laboratory.
","[{""version"":""v1"",""created"":""Thu, 17 Nov 2011 21:24:52 GMT""},{""version"":""v2"",""created"":""Tue, 21 Feb 2012 19:14:21 GMT""}]","2015-03-19"
"1111.4223","Mart\'in Huarte-Espinosa","Mart\'in Huarte-Espinosa, Adam Frank and Eric Blackman (Rochester, NY)","Laboratory experiments and simulations on jets","7 pages, 5 figures, to appear in the proceedings of the ""Magnetic
  Fields in the Universe III"" meeting, Zakopane, PL",,,,"astro-ph.SR physics.plasm-ph","http://arxiv.org/licenses/nonexclusive-distrib/1.0/","  Astrophysical jets have been studied with observations, theoretical models
and numerical simulations for decades. Recently, supersonic magnetized jets
have been formed in laboratory experiments of high-energy density plasmas. I
will review these studies and discuss the experimental setup that has been used
to form millimeter-scale jets driven by strong toroidal magnetic fields in a
MAGPIE generator. The physical conditions of these experiments are such that
they can be scaled to astrophysical scenarios. These laboratory jets provide
insights on the underlying physics of magnetic tower jets and help constrain
some models of astrophysical jets. In this context, we also discuss the
connection between the laboratory jets and recent 3D-MHD numerical simulations
of Poynting flux dominated jets. The simulations allow us to investigate the
effects of thermal energy losses and base rotation on the growth rate of kink
mode perturbations, and to compare the evolution of PFD jets with a
hydrodynamic counterpart of the same energy flux.
","[{""version"":""v1"",""created"":""Thu, 17 Nov 2011 21:25:35 GMT""}]","2011-11-21"
"1111.4224","Kimball A. Milton","Kimball A. Milton, Prachi Parashar, Nima Pourtolami, Iver Brevik","Casimir-Polder repulsion: Polarizable atoms, cylinders, spheres, and
  ellipsoids","17 pages, 4 figures; new version has added references, some
  additional discussion, and slight corrections","Phys. Rev. D 85, 025008 (2012)","10.1103/PhysRevD.85.025008",,"hep-th quant-ph","http://arxiv.org/licenses/nonexclusive-distrib/1.0/","  Recently, the topic of Casimir repulsion has received a great deal of
attention, largely because of the possibility of technological application. The
general subject has a long history, going back to the self-repulsion of a
conducting spherical shell and the repulsion between a perfect electric
conductor and a perfect magnetic conductor. Recently it has been observed that
repulsion can be achieved between ordinary conducting bodies, provided
sufficient anisotropy is present. For example, an anisotropic polarizable atom
can be repelled near an aperture in a conducting plate. Here we provide new
examples of this effect, including the repulsion on such an atom moving on a
trajectory nonintersecting a conducting cylinder; in contrast, such repulsion
does not occur outside a sphere. Classically, repulsion does occur between a
conducting ellipsoid placed in a uniform electric field and an electric dipole.
The Casimir-Polder force between an anisotropic atom and an anisotropic
dielectric semispace does not exhibit repulsion. The general systematics of
repulsion are becoming clear.
","[{""version"":""v1"",""created"":""Thu, 17 Nov 2011 21:27:00 GMT""},{""version"":""v2"",""created"":""Tue, 24 Jan 2012 14:48:47 GMT""}]","2013-05-30"
