"1111.4325","Alessandro Ardizzoni","Alessandro Ardizzoni, Alice Pavarin","Bosonization for dual quasi-bialgebras and preantipode","arXiv admin note: substantial text overlap with arXiv:1012.1956",,,,"math.QA math.RA","http://arxiv.org/licenses/nonexclusive-distrib/1.0/","  In this paper, we associate a dual quasi-bialgebra, called bosonization, to
every dual quasi-bialgebra $H$ and every bialgebra $R$ in the category of
Yetter-Drinfeld modules over $H$. Then, using the fundamental theorem, we
characterize as bosonizations the dual quasi-bialgebras with a projection onto
a dual quasi-bialgebra with a preantipode. As an application we investigate the
structure of the graded coalgebra $grA$ associated to a dual quasi-bialgebra
$A$ with the dual Chevalley property (e.g. $A$ is pointed).
","[{""version"":""v1"",""created"":""Fri, 18 Nov 2011 10:43:40 GMT""}]","2011-11-21"
"1111.4326","Eugene Bezuglyi","Yu. A. Avramenko, E. V. Bezuglyi, N. G. Burma, V. D. Fil","Electric potential of the electron sound wave: Sharp disappearance in
  the superconducting state","8 pages, 5 figures, to be published in Phys. Rev. B, title changed","Phys. Rev. B v.84, 214504 (2011)","10.1103/PhysRevB.84.214504",,"cond-mat.supr-con cond-mat.mtrl-sci","http://arxiv.org/licenses/nonexclusive-distrib/1.0/","  We study the ac electric potential induced by the electron sound wave (a
perturbation of the electron distribution function propagating with the Fermi
velocity) in single crystals of high purity gallium. The potential and the
elastic components of the electron sound demonstrate qualitatively different
dependencies on the electron relaxation rate: while the phase of the potential
increases with temperature, the phase of elastic displacement decreases. This
effect is explained within the multiband model, in which the potential is
attributed to the ballistic quasiwave, while the elastic component is
associated with the zero-sound wave. We observed a mysterious property of the
superconducting state: all manifestations of the potential accompanying the
lattice deformations, including usual sound wave, disappear below T_c in almost
jumplike manner.
","[{""version"":""v1"",""created"":""Fri, 18 Nov 2011 10:53:29 GMT""},{""version"":""v2"",""created"":""Tue, 29 Nov 2011 19:41:15 GMT""}]","2015-06-03"
"1111.4327","Ricardo Doretto","R. L. Doretto and Matthias Vojta","Triangular-lattice anisotropic dimerized Heisenberg antiferromagnet:
  Stability and excitations of the quantum paramagnetic phase","14 pages, 12 figures, new figures added, final version","Phys. Rev. B 85, 104416 (2012)","10.1103/PhysRevB.85.104416",,"cond-mat.str-el cond-mat.stat-mech","http://arxiv.org/licenses/nonexclusive-distrib/1.0/","  Motivated by experiments on non-magnetic triangular-lattice Mott insulators,
we study one candidate paramagnetic phase, the columnar dimer (or valence-bond)
phase. We apply variants of the bond-operator theory to a dimerized and
spatially anisotropic spin-1/2 Heisenberg model and determine its
zero-temperature phase diagram and the spectrum of elementary triplet
excitations (triplons). Depending on model parameters, we find that the minimum
of the triplon energy is located at either a commensurate or an incommensurate
wavevector. Condensation of triplons at this commensurate-incommensurate
transition defines a quantum Lifshitz point, with effective dimensional
reduction which possibly leads to non-trivial paramagnetic (e.g. spin-liquid)
states near the closing of the triplet gap. We also discuss the two-particle
decay of high-energy triplons, and we comment on the relevance of our results
for the organic Mott insulator EtMe3P[Pd(dmit)2]2.
","[{""version"":""v1"",""created"":""Fri, 18 Nov 2011 11:00:03 GMT""},{""version"":""v2"",""created"":""Thu, 29 Mar 2012 12:52:46 GMT""}]","2012-03-30"
"1111.4328","Enrique Ruiz Arriola","R. Navarro Perez, J.E. Amaro, E. Ruiz Arriola","Coarse graining Nuclear Interactions","Presented by RNP at the Erice School on Nuclear Physics 2011: From
  Quarks and Gluons to Hadrons and Nuclei, Erice, Sicily (Italy), 16-24
  September 2011, 7 pages, 6 figures","Prog.Part.Nucl.Phys. 67 (2012) 359-364","10.1016/j.ppnp.2011.12.044",,"nucl-th hep-ph","http://arxiv.org/licenses/nonexclusive-distrib/1.0/","  We consider a coarse graining of NN interactions in coordinate space very
much in the spirit of the well known Vlowk approach. To this end we sample the
interaction at about the minimal de Broglie wavelength probed by NN scattering
below pion production threshold. This amounts to provide a simple delta-shell
potential plus the standard OPE potential above 2 fm. The possible
simplifications in the Nuclear many body problem are discussed.
","[{""version"":""v1"",""created"":""Fri, 18 Nov 2011 11:00:38 GMT""}]","2015-03-19"
"1111.4329","Elisa Piccaro","E.Piccaro (on Behalf of the ATLAS Collaboration)","Measurement of the ATLAS di-muon trigger efficiency in proton-proton
  collisions at 7 TeV","This submission is part of the conference proceedings for PIC2011",,,,"hep-ex","http://arxiv.org/licenses/nonexclusive-distrib/1.0/","  At the LHC, muons are produced in many final states and used in a variety of
analysis, such as Standard Model precision measurements and searches for new
physics. The B-physics programme in ATLAS includes the measurement of CP
violating effects in B meson decays, the search for rare b decay signatures, as
well as the study of the production cross sections. The ATLAS detector can
identify muons with high purity in a transverse momentum ($p_{T}$) range from a
few GeV to several TeV. In order to achieve a high trigger efficiency for low
$p_{T}$ di-muon events and at the same time keep an acceptable trigger rate,
dedicated trigger algorithms have been designed and implemented in the trigger
menu since the 2010 data taking period. There are two categories of B-physics
triggers, one topological and one non-topological. Both of these have been
studied and their performance assessed using collision data at $\sqrt{s}$ = 7
TeV. The performance found with data has been verified with simulated events.
","[{""version"":""v1"",""created"":""Fri, 18 Nov 2011 11:06:00 GMT""}]","2019-08-16"
"1111.4330","Jonathan Eroms","S. Minke, S. H. Jhang, J. Wurm, Y. Skourski, J. Wosnitza, C. Strunk,
  D. Weiss, K. Richter, J. Eroms","Magnetotransport through graphene nanoribbons at high magnetic fields","5 pages, 4 figures, revised version to match published version. First
  author changed her last name from Schmidmeier to Minke","Phys. Rev. B 85, 195432 (2012)","10.1103/PhysRevB.85.195432",,"cond-mat.mes-hall","http://arxiv.org/licenses/nonexclusive-distrib/1.0/","  We have investigated the magnetoresistance of lithographically prepared
single-layer graphene nanoribbons in pulsed, perpendicular magnetic fields up
to 60 T and performed corresponding transport simulations using a tight-binding
model and several types of disorder. In experiment, at high carrier densities
we observe Shubnikov-de Haas oscillations and the quantum Hall effect, while at
low densities the oscillations disappear and an initially negative
magnetoresistance becomes strongly positive at high magnetic fields. The strong
resistance increase at very high fields and low carrier densities is
tentatively ascribed to a field-induced insulating state in the bulk graphene
leads. Comparing numerical results and experiment, we demonstrate that at least
edge disorder and bulk short-range impurities are important in our samples.
","[{""version"":""v1"",""created"":""Fri, 18 Nov 2011 11:09:11 GMT""},{""version"":""v2"",""created"":""Wed, 23 May 2012 08:07:28 GMT""}]","2012-05-24"
"1111.4331","Marcelo Thielo Dr","Marcelo R. Thielo and Marcia C. B. Barbosa","Finite Lattice and Phenomenological Approximations for the Anomaly in
  the Density of a Water-like Lattice Gas Model","17 pages, 7 figures",,,,"cond-mat.stat-mech","http://arxiv.org/licenses/nonexclusive-distrib/1.0/","  We propose a model for a two dimensional, associative water-like lattice gas
with one single variable representing both long and short-range interactions.
The corresponding hamiltonian was solved exactly, by state enumeration in a
finite lattice, so to obtain an analytic expression for the partition function.
The lattice dimensions were chosen based on geometric characteristics of the
stable phases found in previous works using Monte Carlo simulations. An
expression for the particle density in the finite lattice was then obtained,
and coexistence curves with a region of anomaly in the density presented in a
phase diagram. In the end, a phenomenological theory for the system density is
proposed and compared to the previous results.
","[{""version"":""v1"",""created"":""Fri, 18 Nov 2011 11:16:25 GMT""}]","2011-11-21"
"1111.4332","Ovidiu Cristinel Stoica","Ovidiu Cristinel Stoica","Analytic Reissner-Nordstrom Singularity","15 pages, 11 figures","Phys. Scr. 85 (2012) 055004","10.1088/0031-8949/85/05/055004",,"gr-qc math-ph math.DG math.MP","http://arxiv.org/licenses/nonexclusive-distrib/1.0/","  An analytic extension of the Reissner-Nordstrom solution at and beyond the
singularity is presented. The extension is obtained by using new coordinates in
which the metric becomes degenerate at $r=0$. The metric is still singular in
the new coordinates, but its components become finite and smooth. Using this
extension it is shown that the charged and non-rotating black hole
singularities are compatible with the global hyperbolicity and with the
conservation of the initial value data. Geometric models for electrically
charged particles are obtained.
","[{""version"":""v1"",""created"":""Fri, 18 Nov 2011 11:18:09 GMT""},{""version"":""v2"",""created"":""Wed, 30 Nov 2011 19:07:33 GMT""},{""version"":""v3"",""created"":""Thu, 23 Feb 2012 13:57:25 GMT""},{""version"":""v4"",""created"":""Mon, 27 Feb 2012 18:06:45 GMT""},{""version"":""v5"",""created"":""Thu, 19 Apr 2012 17:14:35 GMT""}]","2014-05-13"
"1111.4333","Norisuke Sakai","Akiko Miyake, Kazutoshi Ohta and Norisuke Sakai","Moduli space volume of vortex and localization","10 pages, talk at the international conference ""quantum theory and
  symmetries 7"" in prague, august 7-13, 2011",,"10.1088/1742-6596/343/1/012107",,"hep-th","http://arxiv.org/licenses/nonexclusive-distrib/1.0/","  Volume of moduli space of BPS vortices on a compact genus h Riemann surface
Sigma_h is evaluated by means of topological field theory and localization
technique. Vortex in Abelian gauge theory with a single charged scalar field
(ANO vortex) is studied first and is found that the volume of the moduli space
agrees with the previous results obtained more directly by integrating over the
moduli space metric. Next we extend the evaluation to non-Abelian gauge groups
and multi-flavors of scalar fields in the fundamental representation. We find
that the result of localization can be consistently understood in terms of
moduli matrix formalism wherever possible. More details are found in our paper
in Prog.Theor.Phys.126 (2011) 637.
","[{""version"":""v1"",""created"":""Fri, 18 Nov 2011 11:18:38 GMT""}]","2015-06-03"
"1111.4334","R. H. Sanders","R.H. Sanders","NGC 2419 does not challenge MOND, Part 2","3 page, 2 figures",,"10.1111/j.1745-3933.2012.01227.x",,"astro-ph.CO","http://arxiv.org/licenses/nonexclusive-distrib/1.0/","  I argue that, despite repeated claims of Ibata et al., the globular cluster
NGC 2419 does not pose a problem for modified Newtonian dynamics (MOND). I
present a new polytropic model with a running polytropic index. This model
provides an improved representation of the radial distribution of surface
brightness while maintaining a reasonable fit to the velocity dispersion
profile. Although it may be argued that the differences with these observations
remain large compared to the reported random errors, there are several
undetectable systematic effects which render a formal likelihood analysis
irrelevant. I comment generally upon these effects and upon the intrinsic
limitations of pressure supported objects as tests of gravity.
","[{""version"":""v1"",""created"":""Fri, 18 Nov 2011 11:20:23 GMT""}]","2015-06-03"
"1111.4335","Jyotirmoy Karjee","Jyotirmoy Karjee, H.S Jamadagni","Energy Aware Node Selection for Cluster-based Data Accuracy Estimation
  in Wireless Sensor Networks","11 pages",,,,"cs.NI","http://creativecommons.org/licenses/by/3.0/","  The main objective of this paper is to reduce the number of sensor nodes by
estimating a trade off between data accuracy and energy consumption for
selecting nodes in probabilistic approach in distributed networks. Design
Procedure/Approach: Observed data are highly correlated among sensor nodes in
the spatial domain due to deployment of high density of sensor nodes. These
sensor nodes form non-overlapping distributed clusters due to high data
correlation among them. We develop a probabilistic model for each distributed
cluster to perform data accuracy and energy consumption model in the network.
Finally we find a trade off between data accuracy and energy consumption model
to select an optimal number of sensor nodes in each distributed cluster. We
also compare the performance for our data accuracy estimation model with
information accuracy model for each distributed cluster in the network.
Practical Implementation: Measuring temperature in physical environment and
measuring moisture content in agricultural field. Inventive /Novel Idea:
Optimal node selection in probabilistic approach using the trade of between
data accuracy and energy consumption in cluster-based distributed network.
","[{""version"":""v1"",""created"":""Fri, 18 Nov 2011 11:21:42 GMT""}]","2011-11-21"
"1111.4336","Marijn Versteegh","Marijn A. M. Versteegh, A. J. van Lange, H. T. C. Stoof, Jaap I.
  Dijkhuis","Observation of Preformed Electron-Hole Cooper Pairs","Main article: 11 pages, 3 figures. Supplement: 10 pages, 4 figures","Physical Review B 85, 195206 (2012)","10.1103/PhysRevB.85.195206",,"cond-mat.supr-con cond-mat.mtrl-sci","http://arxiv.org/licenses/nonexclusive-distrib/1.0/","  Electrons and holes in a semiconductor form hydrogen-atom-like bound states,
called excitons. At high electron-hole densities the attractive Coulomb force
becomes screened and excitons can no longer exist. Bardeen-Cooper-Schrieffer
theory predicts that at such high densities co-operative many-body effects can
at low temperatures induce a bound state, an electron-hole Cooper pair,
comparable to an electron-electron Cooper pair in a superconductor. Here we
report the first observation of preformed electron-hole Cooper pairs in a
semiconductor. By measuring stimulated emission from a dense electron-hole gas
in ZnO, we have explored both the crossover from the electron-hole plasma to
the preformed Cooper-pair regime, and the crossover from the exciton to the
preformed Cooper-pair regime.
","[{""version"":""v1"",""created"":""Fri, 18 Nov 2011 11:27:10 GMT""}]","2012-05-16"
"1111.4337","Alessandro Baldi","Alessandro Baldi, Stefano Ettori, Silvano Molendi, Italo Balestra,
  Fabio Gastaldello, Paolo Tozzi","An XMM-Newton spatially-resolved study of metal abundance evolution in
  distant galaxy clusters","12 pages, 8 figures, A&A in press, minor changes (language editing)",,"10.1051/0004-6361/201117836",,"astro-ph.CO","http://arxiv.org/licenses/nonexclusive-distrib/1.0/","  We present an XMM-Newton analysis of the X-ray spectra of 39 clusters of
galaxies at 0.4<z<1.4, covering a temperature range of 1.5<=kT<=11 keV. We
performed a spatially resolved spectral analysis to study how the abundance
evolves with redshift not only through a single emission measure performed on
the whole cluster but also spatially resolving the cluster emission. We do not
observe a statistically significant (>2sigma) abundance evolution with
redshift. The most significant deviation from no evolution (90% c.l.) is
observed in the emission from the whole cluster (r<0.6r500), that could be
parametrized as Z=A*(1+z)^(-0.8+/-0.5). Dividing the emission in 3 radial bins,
no significant evidence of abundance evolution could be observed fitting the
data with a power-law. A substantial agreement with measures presented in
previous works is found. The error-weighted mean of the spatially resolved
abundances in 3 redshift bins is consistent to be constant with z. Although the
large error bars in the measure of the weighted-mean abundance prevent us from
claiming any significant spatially resolved evolution, the trend with z in the
0.15-0.4r500 radial bin complements nicely the measures of Maughan et al., and
broadly agrees with theoretical predictions. We also found that the data points
derived from the spatially resolved analysis are well fitted by the relation
Z(r,z)=Z0*(1+(r/0.15r500)^2)^(-a)*((1+z)/1.6)^(-gamma), showing a significant
negative trend of Z with the radius and no significant evolution with the
redshift. The present study is the first attempt made to spatially resolve the
evolution of abundance with redshift. However, the sample size and the low
statistics associated with most of the clusters in the sample prevents us to
draw any statistically significant conclusion on the different evolutionary
path that the different regions of the clusters may have traversed.
","[{""version"":""v1"",""created"":""Fri, 18 Nov 2011 11:27:10 GMT""},{""version"":""v2"",""created"":""Fri, 2 Dec 2011 15:18:51 GMT""}]","2015-06-03"
"1111.4338","Joan Porti","Pere Menal-Ferrer, Joan Porti","Local coordinates for SL(n,C) character varieties of finite volume
  hyperbolic 3-manifolds","13 pages",,,,"math.GT","http://arxiv.org/licenses/nonexclusive-distrib/1.0/","  Given a finite volume hyperbolic 3-manifold, we compose a lift of the
holonomy in SL(2,C) with the n-dimensional irreducible representation of
SL(2,C) in SL(n,C). In this paper we give local coordinates of the
SL(n,C)-character variety around this representation. As a corollary, this
representation is isolated among all representations that are unipotent at the
cusps.
","[{""version"":""v1"",""created"":""Fri, 18 Nov 2011 11:28:05 GMT""}]","2011-11-21"
"1111.4339","George Barmpalias Dr","George Barmpalias and Angsheng Li","Kolmogorov complexity and computably enumerable sets",,,,,"math.LO cs.IT math.IT","http://arxiv.org/licenses/nonexclusive-distrib/1.0/","  We study the computably enumerable sets in terms of the: (a) Kolmogorov
complexity of their initial segments; (b) Kolmogorov complexity of finite
programs when they are used as oracles. We present an extended discussion of
the existing research on this topic, along with recent developments and open
problems. Besides this survey, our main original result is the following
characterization of the computably enumerable sets with trivial initial segment
prefix-free complexity. A computably enumerable set $A$ is $K$-trivial if and
only if the family of sets with complexity bounded by the complexity of $A$ is
uniformly computable from the halting problem.
","[{""version"":""v1"",""created"":""Fri, 18 Nov 2011 11:33:40 GMT""},{""version"":""v2"",""created"":""Wed, 27 Nov 2013 12:04:12 GMT""}]","2013-11-28"
"1111.4340","Pablo Alvarez","Pablo \'Alvarez, Jos\'e L. S\'anchez Llamazares, Pedro Gorria and
  Jes\'us A. Blanco","Enhanced refrigerant capacity and magnetic entropy flattening using a
  two-amorphous FeZrB(Cu) composite","Regular paper with 11 pages in the pre-print, 3 pages after
  publishing. The following article has been accepted by Applied Physics
  Letter. After it is published, it will be found at
  http://apl.aip.org/resource/1/applab/v99","Appl. Phys. Lett. 99, 232501 (2011)","10.1063/1.3665941",,"cond-mat.mtrl-sci","http://arxiv.org/licenses/nonexclusive-distrib/1.0/","  The temperature dependence of the isothermal magnetic entropy change,
{\Delta}SM, and the magnetic field dependence of the refrigerant capacity, RC,
have been investigated in a composite system xA+(1-x)B, based on Fe87Zr6B6Cu1
(A) and Fe90Zr8B2 (B) amorphous ribbons. Under a magnetic field change of 2 T
the maximum improvement of the full-width at half maximum of {\Delta}SM(T)
curve (47 and 29 %) and the RC (18 and 23 %), in comparison with those of the
individual alloys (A and B), is observed for x \approx 0.5. Moreover, a
flattening over 80 K in the {\Delta}SM(T) curve around room temperature range
is observed, which is a key feature for an Ericsson magnetic refrigeration
cycle.
","[{""version"":""v1"",""created"":""Fri, 18 Nov 2011 11:44:34 GMT""}]","2012-01-24"
"1111.4341","Dong-Ling Deng","Dong-Ling Deng, Chunfeng Wu, Jing-Ling Chen, Shi-Jian Gu, Sixia Yu,
  and C. H. Oh","Bell Function Values Approach to Topological Quantum Phase Transitions","4pages",,,,"quant-ph","http://arxiv.org/licenses/nonexclusive-distrib/1.0/","  We investigate the relation between Bell function values (BFV) of the reduced
density matrix and the topological quantum phase transitions in the
Kitaev-Castelnovo-Chamon model. % [Phys. Rev. B \textbf{77}, %054433 (2008)].
We find that the first order derivative of BFV exhibits singular behavior at
the critical point and we propose that it can serve as a good and convenient
marker for the transition point. More interestingly, the value of the critical
point can be analytically obtained in this approach. Since the BFV serves as a
measure of nonlocality when it is greater than the classical bound of the
correlation functions, our work has established a link between quantum
nonlocality and phase transitions.
","[{""version"":""v1"",""created"":""Fri, 18 Nov 2011 12:15:51 GMT""}]","2011-11-21"
"1111.4342","Andres Santos","Antonio Astillero and Andr\'es Santos","Unsteady non-Newtonian hydrodynamics in granular gases","19 pages, 3 tables, 14 figures","Phys. Rev. E 85, 021302 (2012)","10.1103/PhysRevE.85.021302",,"cond-mat.soft cond-mat.stat-mech","http://arxiv.org/licenses/nonexclusive-distrib/1.0/","  The temporal evolution of a dilute granular gas, both in a compressible flow
(uniform longitudinal flow) and in an incompressible flow (uniform shear flow),
is investigated by means of the direct simulation Monte Carlo method to solve
the Boltzmann equation. Emphasis is laid on the identification of a first
""kinetic"" stage (where the physical properties are strongly dependent on the
initial state) subsequently followed by an unsteady ""hydrodynamic"" stage (where
the momentum fluxes are well-defined non-Newtonian functions of the rate of
strain). The simulation data are seen to support this two-stage scenario.
Furthermore, the rheological functions obtained from simulation are well
described by an approximate analytical solution of a model kinetic equation.
","[{""version"":""v1"",""created"":""Fri, 18 Nov 2011 12:19:49 GMT""},{""version"":""v2"",""created"":""Tue, 7 Feb 2012 17:10:35 GMT""}]","2015-03-19"
"1111.4343","Yuriy Ostapov","Yuriy Ostapov","Question Answering in a Natural Language Understanding System Based on
  Object-Oriented Semantics",,,,,"cs.CL","http://arxiv.org/licenses/nonexclusive-distrib/1.0/","  Algorithms of question answering in a computer system oriented on input and
logical processing of text information are presented. A knowledge domain under
consideration is social behavior of a person. A database of the system includes
an internal representation of natural language sentences and supplemental
information. The answer {\it Yes} or {\it No} is formed for a general question.
A special question containing an interrogative word or group of interrogative
words permits to find a subject, object, place, time, cause, purpose and way of
action or event. Answer generation is based on identification algorithms of
persons, organizations, machines, things, places, and times. Proposed
algorithms of question answering can be realized in information systems closely
connected with text processing (criminology, operation of business, medicine,
document systems).
","[{""version"":""v1"",""created"":""Fri, 18 Nov 2011 12:31:49 GMT""}]","2011-11-21"
"1111.4344","Markus Kortelainen","M. Kortelainen, J. McDonnell, W. Nazarewicz, P.-G. Reinhard, J.
  Sarich, N. Schunck, M. V. Stoitsov, S. M. Wild","Nuclear energy density optimization: Large deformations","16 pages, 11 figures, accepted for publication in Phys. Rev. C",,"10.1103/PhysRevC.85.024304",,"nucl-th","http://arxiv.org/licenses/nonexclusive-distrib/1.0/","  A new Skyrme-like energy density suitable for studies of strongly elongated
nuclei has been determined in the framework of the Hartree-Fock-Bogoliubov
theory using the recently developed model-based, derivative-free optimization
algorithm POUNDerS. A sensitivity analysis at the optimal solution has revealed
the importance of states at large deformations in driving the parameterization
of the functional. The good agreement with experimental data on masses and
separation energies, achieved with the previous parameterization UNEDF0, is
largely preserved. In addition, the new energy density UNEDF1 gives a much
improved description of the fission barriers in 240Pu and neighboring nuclei.
","[{""version"":""v1"",""created"":""Fri, 18 Nov 2011 12:44:47 GMT""},{""version"":""v2"",""created"":""Fri, 20 Jan 2012 12:19:21 GMT""}]","2015-06-03"
