"1111.4260","Hairui Tu","Hairui Tu","Wave Scattering and Guided Modes in Periodic Pillars",,,,,"math-ph math.AP math.MP","http://arxiv.org/licenses/nonexclusive-distrib/1.0/","  We investigate the scattering of scalar harmonic source fields by a periodic
pillar, that is, a spatial structure that is periodic in one dimension and of
finite extent in the other two. Uniqueness of scattering solutions can be
abstracted by guided modes. Extending results for periodic slabs to pillars, we
give conditions under which ""inverse"" pillars cannot admit guided modes. In
addition, we present a new construction of guided modes at frequency $\omega$
and Bloch wavenumber $\kappa$ with $\omega$ embedded in the continuous spectrum
for each $\kappa$. These guided modes have period larger than the period of the
structure, and possess a real dispersion relation $\omega=\omega(\kappa)$,
which is atypical of modes at embedded frequencies.
","[{""version"":""v1"",""created"":""Fri, 18 Nov 2011 02:24:10 GMT""}]","2011-11-21"
"1111.4261","Yimin Wang","Yimin Wang, Ji\v{r}\'i Min\'a\v{r}, Gabriel H\'etet, and Valerio
  Scarani","Quantum memory with a single two-level atom in a half cavity","8 pages, 3 figures","Phys. Rev. A 85, 013823 (2012)","10.1103/PhysRevA.85.013823",,"quant-ph","http://arxiv.org/licenses/nonexclusive-distrib/1.0/","  We propose a setup for quantum memory based on a single two-level atom in a
half cavity with a moving mirror. We show that various temporal shapes of
incident photon can be efficiently stored and readout by shaping the
time-dependent decay rate $\gamma(t)$ between the atom and the light. This is
achieved uniquely by an appropriate motion of the mirror without the need for
additional control laser or atomic level. We present an analytical expression
for the efficiency of the process and study its dependence on the ratio between
the incident light field bandwidth and the atomic decay rate. We discuss
possible implementations and experimental issues, particularly for a single
atom or ion in a half cavity quantum optical setup as well as a superconducting
qubit in the context of circuit QED.
","[{""version"":""v1"",""created"":""Fri, 18 Nov 2011 02:30:14 GMT""},{""version"":""v2"",""created"":""Wed, 18 Jan 2012 15:56:18 GMT""}]","2013-05-30"
"1111.4262","Shoji Yokura","Joerg Schuermann and Shoji Yokura","Grothendieck groups and a categorification of additive invariants","27 pages, to appear in International J. Mathematics","International J. Mathematics, Vol. 23, No. 5 (2012), 1250057-1 -
  1250057-37","10.1142/S0129167X12500577",,"math.AG math.AT","http://arxiv.org/licenses/nonexclusive-distrib/1.0/","  A topologically-invariant and additive homology class is mostly not a natural
transformation as it is. In this paper we discuss turning such a homology class
into a natural transformation; i.e., a ""categorification"" of it. In a general
categorical set-up we introduce a generalized relative Grothendieck group from
a cospan of functors of categories and also consider a categorification of
additive invariants on objects. As an example, we obtain a general theory of
characteristic homology classes of singular varieties.
","[{""version"":""v1"",""created"":""Fri, 18 Nov 2011 02:45:55 GMT""}]","2013-06-21"
"1111.4263","Andreas Krug","Andreas Krug","Extension groups of tautological sheaves on Hilbert schemes","Revised version",,,,"math.AG","http://arxiv.org/licenses/nonexclusive-distrib/1.0/","  We give formulas for the extension groups between tautological sheaves and
more general between tautological objects twisted by a determinant line bundle
on the Hilbert scheme of points on a smooth quasi-projective surface. We do
this using L. Scala's results about the image of tautological sheaves under the
Bridgeland-King-Reid equivalence. We also compute the Yoneda products in terms
of these formulas.
","[{""version"":""v1"",""created"":""Fri, 18 Nov 2011 02:57:23 GMT""},{""version"":""v2"",""created"":""Thu, 21 Jun 2012 15:55:20 GMT""}]","2012-06-22"
"1111.4264","Sergei Nagaitsev","Viatcheslav Danilov and Sergei Nagaitsev","On Quantum Integrable Systems",,,,"FERMILAB-FN-0938-AD","quant-ph physics.acc-ph","http://arxiv.org/licenses/nonexclusive-distrib/1.0/","  Many quantum integrable systems are obtained using an accelerator physics
technique known as Ermakov (or normalized variables) transformation. This
technique was used to create classical nonlinear integrable lattices for
accelerators and nonlinear integrable plasma traps. Now, all classical results
are carried over to a nonrelativistic quantum case.
","[{""version"":""v1"",""created"":""Fri, 18 Nov 2011 03:11:50 GMT""},{""version"":""v2"",""created"":""Wed, 2 May 2012 03:03:02 GMT""}]","2012-05-03"
"1111.4265","Jundan Nie","J. D. Nie, P. R. Wood and C. P. Nicholls","Predicting the Evolutionary Descendents of Sequence E Stars","6 pages, 2 figures",,,,"astro-ph.SR","http://arxiv.org/licenses/nonexclusive-distrib/1.0/","  Sequence E variables are close binary red giants that show ellipsoidal light
variations. They are likely to terminate their red giant evolution by a common
envelope (CE) event when the red giant fills its Roche lobe, and produce close
binary Planetary Nebulae (PNe). We made a Monte Carlo simulation to predict the
fraction of Planetary Nebulae Nuclei (PNNe) that are post-CE binaries, using
the observed frequency of sequence E binaries in the LMC to normalize our
calculations. We find that 10-16% of PNNe should be short period, post-CE
binaries.
","[{""version"":""v1"",""created"":""Fri, 18 Nov 2011 03:14:55 GMT""}]","2011-11-21"
"1111.4266","Tirtha Sankar Ray","Tirtha Sankar Ray","On the possibility of generating leading order gaugino masses in direct
  gauge mediation scenario","13 pages, typos corrected, references updated","Phys. Rev. D 85, 035003 (2012)","10.1103/PhysRevD.85.035003",,"hep-ph hep-th","http://arxiv.org/licenses/nonexclusive-distrib/1.0/","  Generating gaugino masses at the leading order has typically been difficult
in direct/semi-direct gauge mediated supersymmetry breaking models. The
Komargodski-Shih theorem has established that local stability of the
supersymmetry breaking vacuum implies a vanishing leading order gaugino mass in
generic renormalizable O'Raifeartaigh models. We relax the condition of
renormalizability and investigate the possibility to evade the KS no-go theorem
using higher dimensional operators in the Kahler potential and the
superpotential. We demonstrate that higher dimensional terms which are
polynomial in superfields are not adequate to evade the KS theorem. We narrow
down on the possible class of non-polynomial corrections that can induce
unsuppressed gaugino mass in a global supersymmetry breaking vacuum. We find
that these models are tantalizingly close to the theories obtained from
strongly coupled supersymmetry breaking schemes.
","[{""version"":""v1"",""created"":""Fri, 18 Nov 2011 03:23:50 GMT""},{""version"":""v2"",""created"":""Mon, 12 Dec 2011 03:56:13 GMT""}]","2012-02-14"
"1111.4267","Victor A. Rodriguez-Toro","Victor A. Rodriguez-Toro, Jaime E. Garzon, Jesus A. Lopez","Control Neuronal por Modelo Inverso de un Servosistema Usando Algoritmos
  de Aprendizaje Levenberg-Marquardt y Bayesiano",,,,,"cs.AI cs.CE","http://arxiv.org/licenses/nonexclusive-distrib/1.0/","  In this paper we present the experimental results of the neural network
control of a servo-system in order to control its speed. The control strategy
is implemented by using an inverse-model control based on Artificial Neural
Networks (ANNs). The network training was performed using two learning
algorithms: Levenberg-Marquardt and Bayesian regularization. We evaluate the
generalization capability for each method according to both the correct
operation of the controller to follow the reference signal, and the control
efforts developed by the ANN-based controller.
","[{""version"":""v1"",""created"":""Fri, 18 Nov 2011 03:26:47 GMT""}]","2011-11-21"
"1111.4268","John M. Tranquada","John M. Tranquada","Stripes and Superconductivity in Cuprates","6 pages, submitted to proceedings of ECRYS-2011","Physica B 407, 1771 (2012)","10.1016/j.physb.2012.01.026",,"cond-mat.supr-con","http://arxiv.org/licenses/nonexclusive-distrib/1.0/","  Holes doped into the CuO2 planes of cuprate parent compounds frustrate the
antiferromagnetic order. The development of spin and charge stripes provides a
compromise between the competing magnetic and kinetic energies. Static stripe
order has been observed only in certain particular compounds, but there are
signatures which suggest that dynamic stripe correlations are common in the
cuprates. Though stripe order is bad for superconducting phase coherence,
stripes are compatible with strong pairing. Ironically, magnetic-field-induced
stripe order appears to enhance the stability of superconducting order within
the planes.
","[{""version"":""v1"",""created"":""Fri, 18 Nov 2011 03:36:57 GMT""}]","2015-03-19"
"1111.4269","Hua Wang","Hua Wang","Boundedness of singular integral operators with variable kernels on
  weighted weak Hardy spaces","12 pages. arXiv admin note: substantial text overlap with
  arXiv:1207.1242, arXiv:1111.5075, arXiv:1010.0862",,,,"math.CA","http://arxiv.org/licenses/nonexclusive-distrib/1.0/","  Let $T_\Omega$ be the singular integral operator with variable kernel
$\Omega(x,z)$. In this paper, by using the atomic decomposition theory of
weighted weak Hardy spaces, we will obtain the boundedness properties of
$T_\Omega$ on these spaces, under some Dini type conditions imposed on the
variable kernel $\Omega(x,z)$.
","[{""version"":""v1"",""created"":""Fri, 18 Nov 2011 03:43:04 GMT""},{""version"":""v2"",""created"":""Tue, 6 Nov 2012 09:19:42 GMT""},{""version"":""v3"",""created"":""Wed, 26 Dec 2012 03:12:56 GMT""}]","2014-01-27"
"1111.4270","Fernando Camilo","F. Camilo, M. Kerr, P.S. Ray, S.M. Ransom, S. Johnston, R.W. Romani,
  D. Parent, M.E. DeCesar, A.K. Harding, D. Donato, P.M. Saz Parkinson, E.C.
  Ferrara, P.C.C. Freire, L. Guillemot, M. Keith, M. Kramer, K.S. Wood","PSR J2030+3641: radio discovery and gamma-ray study of a middle-aged
  pulsar in the now identified Fermi-LAT source 1FGL J2030.0+3641","Accepted for publication in ApJ, 9 pages, 6 figures",,"10.1088/0004-637X/746/1/39",,"astro-ph.GA astro-ph.HE","http://arxiv.org/licenses/nonexclusive-distrib/1.0/","  In a radio search with the Green Bank Telescope of three unidentified low
Galactic latitude Fermi-LAT sources, we have discovered the middle-aged pulsar
J2030+3641, associated with 1FGL J2030.0+3641 (2FGL J2030.0+3640). Following
the detection of gamma-ray pulsations using a radio ephemeris, we have obtained
a phase-coherent timing solution based on gamma-ray and radio pulse arrival
times that spans the entire Fermi mission. With a rotation period of 0.2 s,
spin-down luminosity of 3e34 erg/s, and characteristic age of 0.5 Myr, PSR
J2030+3641 is a middle-aged neutron star with spin parameters similar to those
of the exceedingly gamma-ray-bright and radio-undetected Geminga. Its gamma-ray
flux is 1% that of Geminga, primarily because of its much larger distance, as
suggested by the large integrated column density of free electrons, DM=246
pc/cc. We fit the gamma-ray light curve, along with limited radio polarimetric
constraints, to four geometrical models of magnetospheric emission, and while
none of the fits have high significance some are encouraging and suggest that
further refinements of these models may be worthwhile. We argue that not many
more non-millisecond radio pulsars may be detected along the Galactic plane
that are responsible for LAT sources, but that modified methods to search for
gamma-ray pulsations should be productive -- PSR J2030+3641 would have been
found blindly in gamma rays if only >0.8 GeV photons had been considered, owing
to its relatively flat spectrum and location in a region of high soft
background.
","[{""version"":""v1"",""created"":""Fri, 18 Nov 2011 03:44:38 GMT""}]","2015-06-03"
"1111.4271","Dmitry B. Karp","Dmitry Karp and Elena Prilepkina","Generalized Stieltjes transforms: basic aspects","23 pages, no figures; a counterexample related to complex variable
  chracterization added; some typos corrected, other minore improvements made",,,,"math.CA math.CV","http://arxiv.org/licenses/nonexclusive-distrib/1.0/","  The paper surveys the basic properties of generalized Stieltjes functions
including some new ones. We introduce the notion of the exact Stieltjes order
and give a criterion of exactness, simple sufficient conditions and some
prototypical examples. The paper includes an appendix, where we define the left
sided Riemann-Liouville and the right sided Kober-Erdelyi fractional integrals
of measures supported on half axis and give inversion formulas for them.
","[{""version"":""v1"",""created"":""Fri, 18 Nov 2011 03:51:32 GMT""},{""version"":""v2"",""created"":""Sat, 11 Feb 2012 02:19:09 GMT""}]","2012-02-14"
"1111.4272","Se-Heon Kim","Se-Heon Kim, Jingqing Huang, Axel Scherer","A photonic crystal nanocavity laser in an optically very thick slab","3 pages, 4 figures",,"10.1364/OL.37.000488",,"physics.optics","http://arxiv.org/licenses/nonexclusive-distrib/1.0/","  A photonic crystal (PhC) nanocavity formed in an optically very thick slab
can support reasonably high-Q modes for lasing. Experimentally, we demonstrate
room-temperature pulsed lasing operation from the PhC dipole mode emitting at
1324 nm, which is fabricated in an InGaAsP slab with thickness (T) of 606 nm.
Numerical simulation reveals that, when T > 800 nm, over 90% of the laser
output power couples to the PhC slab modes, suggesting a new route towards an
efficient in-plane laser for photonic integrated circuits.
","[{""version"":""v1"",""created"":""Fri, 18 Nov 2011 04:02:29 GMT""}]","2012-03-12"
"1111.4273","Mladen Pavicic","Mladen Pavicic","Retraction of ""Near-Deterministic Discrimination of All Bell States with
  Linear Optics,"" Phys. Rev. Lett. 107, 080403 (2011) and Erratum Phys. Rev.
  Lett. 107, 219901 (2011)","The original paper (v. 1 and 2) was retracted from Phys. Rev. Lett.
  107, 080403 (2011) and its Erratum Phys. Rev. Lett. 107. 219901 (2011)",,"10.1103/PhysRevLett.107.080403",,"quant-ph","http://arxiv.org/licenses/nonexclusive-distrib/1.0/","  The original versions (1 and 2) of this paper paper contain a fatal error.
All my attempts to patch the error have failed. As a service to the community I
explain the error in some detail.
","[{""version"":""v1"",""created"":""Fri, 18 Nov 2011 04:06:51 GMT""},{""version"":""v2"",""created"":""Mon, 21 Nov 2011 23:47:52 GMT""},{""version"":""v3"",""created"":""Wed, 25 Jul 2012 01:17:17 GMT""}]","2015-06-03"
"1111.4274","Ming-Liang Hu","Ming-Liang Hu","Disentanglement dynamics of interacting two qubits and two qutrits in an
  XY spin-chain environment with the Dzyaloshinsky-Moriya interaction","16 pages, 10 figures","Physics Letters A, 2010, 374(34): 3520--3528","10.1016/j.physleta.2010.06.026",,"quant-ph","http://arxiv.org/licenses/nonexclusive-distrib/1.0/","  We investigate disentanglement dynamics of two coupled qubits and qutrits
which interact uniformly to a general XY spin-chain environment with the
Dzyaloshinsky-Moriya (DM) interaction. We obtained exact expression of the time
evolution operator and analyzed the dynamical process of the decoherence
factors. Through explicitly calculating the concurrence and the negativity, we
examined disentanglement behaviors of two coupled central spins evolve from
different initial pure states, which are found to be nontrivially different
from those of the uncorrelated ones, in particular, the enhanced decay of the
entanglement induced by quantum criticality of the surrounding environment may
be broken by introducing self-Hamiltonian of the central spin system. Moreover,
the DM interaction may have different influences on decay of the entanglement
depending on the strength of the system-environment coupling, the anisotropy of
the environmental spin chain and the intensity of the transverse magnetic
field, as well as the explicit form of the initial states of the central spin
system.
","[{""version"":""v1"",""created"":""Fri, 18 Nov 2011 04:07:02 GMT""}]","2011-11-21"
"1111.4275","Stephane Houndjo Dr","M. J. S. Houndjo and Oliver F. Piattella","Reconstructing $f(R,T)$ gravity from holographic dark energy","16 pages, 6 figures, accepted for publication in IJMPD","IJMPD 2, 1250024 (2012)","10.1142/S0218271812500241",,"gr-qc astro-ph.CO","http://arxiv.org/licenses/nonexclusive-distrib/1.0/","  We consider cosmological scenarios based on $f(R,T)$ theories of gravity ($R$
is the Ricci scalar and $T$ is the trace of the energy-momentum tensor) and
numerically reconstruct the function $f(R,T)$ which is able to reproduce the
same expansion history generated, in the standard General Relativity theory, by
dark matter and holographic dark energy. We consider two special $f(R,T)$
models: in the first instance, we investigate the modification $R + 2f(T)$,
i.e. the usual Einstein-Hilbert term plus a $f(T)$ correction. In the second
instance, we consider a $f(R)+\lambda T$ theory, i.e. a $T$ correction to the
renown $f(R)$ theory of gravity.
","[{""version"":""v1"",""created"":""Fri, 18 Nov 2011 04:08:17 GMT""},{""version"":""v2"",""created"":""Tue, 24 Jan 2012 14:40:45 GMT""}]","2015-03-19"
"1111.4276","Xiao-song Yang","Xiao-Song Yang","Construction of sphere maps with given degrees and a new proof of Morse
  index formula","9 pages. 0 figure",,,,"math.GN","http://arxiv.org/licenses/nonexclusive-distrib/1.0/","  This note presents a procedure of constructing a higher dimensional sphere
map from a lower dimensional one and gives an explicit formula for smooth
sphere map with a given degree. As an application a new proof of a generalized
Poincare-Hopf theorem called Morse index formula is also presented.
","[{""version"":""v1"",""created"":""Fri, 18 Nov 2011 04:08:23 GMT""}]","2011-11-21"
"1111.4277","Shaolong Wan","Xiaosen Yang, Shaolong Wan","Phase Diagram of Two-dimensional Polarized Fermi Gas With Spin-Orbit
  Coupling","4 pages, 11 figures","Phys. Rev. A85, 023633(2012)",,,"cond-mat.quant-gas","http://arxiv.org/licenses/nonexclusive-distrib/1.0/","  We investigate the ground state of the two-dimensional polarized Fermi gas
with spin-orbit coupling and construct the phase diagram at zero temperature.
We find there exist phase separation when the binding energy is low. As the
binding energy increasing, the topological nontrivial superfluid phase coexist
with topologically trivial superfluid phase which is topological phase
separation. The spin-orbit coupling interaction enhance the triplet pairing and
destabilize the phase separation against superfluid phase.
","[{""version"":""v1"",""created"":""Fri, 18 Nov 2011 04:08:56 GMT""}]","2012-02-27"
"1111.4278","Haiping Huang","Haiping Huang and Haijun Zhou","Counting solutions from finite samplings","9 pages, 4 figures and 1 table, further discussions added","Phys. Rev. E 85, 026118 (2012)","10.1103/PhysRevE.85.026118",,"cond-mat.stat-mech cond-mat.dis-nn cs.IT math.IT physics.bio-ph","http://arxiv.org/licenses/nonexclusive-distrib/1.0/","  We formulate the solution counting problem within the framework of inverse
Ising problem and use fast belief propagation equations to estimate the entropy
whose value provides an estimate on the true one. We test this idea on both
diluted models (random 2-SAT and 3-SAT problems) and fully-connected model
(binary perceptron), and show that when the constraint density is small, this
estimate can be very close to the true value. The information stored by the
salamander retina under the natural movie stimuli can also be estimated and our
result is consistent with that obtained by Monte Carlo method. Of particular
significance is sizes of other metastable states for this real neuronal network
are predicted.
","[{""version"":""v1"",""created"":""Fri, 18 Nov 2011 04:10:29 GMT""},{""version"":""v2"",""created"":""Mon, 26 Dec 2011 10:36:22 GMT""},{""version"":""v3"",""created"":""Wed, 1 Feb 2012 03:35:40 GMT""}]","2012-02-29"
"1111.4279","Nikos Hardavellas","Sourya Roy, Tyler Clemons, S M Faisal, Ke Liu, Nikos Hardavellas,
  Srinivasan Parthasarathy","Elastic Fidelity: Trading-off Computational Accuracy for Energy
  Reduction",,,,"Northwestern University NWU-EECS-11-02, February 2011","cs.AR","http://arxiv.org/licenses/nonexclusive-distrib/1.0/","  Power dissipation and energy consumption have become one of the most
important problems in the design of processors today. This is especially true
in power-constrained environments, such as embedded and mobile computing. While
lowering the operational voltage can reduce power consumption, there are limits
imposed at design time, beyond which hardware components experience faulty
operation. Moreover, the decrease in feature size has led to higher
susceptibility to process variations, leading to reliability issues and
lowering yield. However, not all computations and all data in a workload need
to maintain 100% fidelity. In this paper, we explore the idea of employing
functional or storage units that let go the conservative guardbands imposed on
the design to guarantee reliable execution. Rather, these units exhibit Elastic
Fidelity, by judiciously lowering the voltage to trade-off reliable execution
for power consumption based on the error guarantees required by the executing
code. By estimating the accuracy required by each computational segment of a
workload, and steering each computation to different functional and storage
units, Elastic Fidelity Computing obtains power and energy savings while
reaching the reliability targets required by each computational segment. Our
preliminary results indicate that even with conservative estimates, Elastic
Fidelity can reduce the power and energy consumption of a processor by 11-13%
when executing applications involving human perception that are typically
included in modern mobile platforms, such as audio, image, and video decoding.
","[{""version"":""v1"",""created"":""Fri, 18 Nov 2011 04:12:12 GMT""}]","2011-11-22"
"1111.4280","Victor A. Rodriguez-Toro","Victor A. Rodriguez-Toro, Fabio Noguera-Leon, Jaime Velasco-Medina","Dise\~no de una Arquitectura para la Solucion de la Ecuacion de
  Schroedinger usando el Metodo de Numerov",,,,,"physics.comp-ph cs.NA quant-ph","http://arxiv.org/licenses/nonexclusive-distrib/1.0/","  This paper presents a first approach in order to design an optimal
architecture to implement the Numerov method, which solves the time-independent
Schroedinger equation (TISE) for one dimension. The design and simulation have
been performed by using 64-bits floating-point megafunctions available in
Quartus II (Version 9.0). The verification of these results was done by using
Matlab. According to these results, it is possible to extend this design to
parallel structures, which would be able to calculate several TISE solutions.
","[{""version"":""v1"",""created"":""Fri, 18 Nov 2011 04:17:34 GMT""}]","2011-11-21"
"1111.4281","Keisuke Tomiyasu","K. Tomiyasu, M. Matsuura, H. Kimura, K. Iwasa, K. Ohoyama, T. Yokoo,
  S. Itoh, E. Kudoh, T. Sato, and M. Fujita","Modified Cross-Correlation for Efficient White-Beam Inelastic Neutron
  Scattering Spectroscopy","6 pages, 3 figures","Nuclear Instruments and Methods in Physics Research Section A,
  vol. 677, pp. 89-93 (2012)","10.1016/j.nima.2012.03.001",,"cond-mat.mtrl-sci physics.ins-det","http://arxiv.org/licenses/nonexclusive-distrib/1.0/","  We describe a method of white-beam inelastic neutron scattering for improved
measurement efficiency. The method consists of matrix inversion and selective
extraction. The former is to resolve each incident energy component from the
white-beam data, and the latter eliminates contamination by elastic components,
which produce strong backgrounds that otherwise obfuscate the inelastic
scattering components. In this method, the optimal experimental condition to
obtain high efficiency will strongly depend on the specific aim of the
individual experiments.
","[{""version"":""v1"",""created"":""Fri, 18 Nov 2011 04:19:19 GMT""},{""version"":""v2"",""created"":""Thu, 12 Jan 2012 12:29:51 GMT""},{""version"":""v3"",""created"":""Thu, 22 Mar 2012 12:00:55 GMT""}]","2015-03-19"
"1111.4282","Astrid an Huef","Robert Archbold and Astrid an Huef","Strength of convergence in non-free transformation groups","arXiv admin note: substantial text overlap with arXiv:math/0508342",,,,"math.OA","http://arxiv.org/licenses/nonexclusive-distrib/1.0/","  Let (G, X) be a transformation group where the group $G$ does not necessarily
act freely on the space X. We investigate the extent to which the action of G
may fail to be proper. Stability subgroups are used to define new notions of
strength of convergence in the orbit space and of measure accumulation along
orbits. By using the representation theory of the associated crossed product
C^*-algebra, we show that these notions are equivalent under certain
conditions.
","[{""version"":""v1"",""created"":""Fri, 18 Nov 2011 04:19:48 GMT""}]","2011-11-21"
