"1111.4132","Simone Belli","Simone Belli, Marjolein Dijkstra and Ren\'e van Roij","Depletion-induced biaxial nematic states of boardlike particles",,,"10.1088/0953-8984/24/28/284128",,"cond-mat.soft cond-mat.stat-mech","http://arxiv.org/licenses/nonexclusive-distrib/1.0/","  With the aim of investigating the stability conditions of biaxial nematic
liquid crystals, we study the effect of adding a non-adsorbing ideal depletant
on the phase behavior of colloidal hard boardlike particles. We take into
account the presence of the depletant by introducing an effective depletion
attraction between a pair of boardlike particles. At fixed depletant fugacity,
the stable liquid crystal phase is determined through a mean-field theory with
restricted orientations. Interestingly, we predict that for slightly elongated
boardlike particles a critical depletant density exists, where the system
undergoes a direct transition from an isotropic liquid to a biaxial nematic
phase. As a consequence, by tuning the depletant density, an easy experimental
control parameter, one can stabilize states of high biaxial nematic order even
when these states are unstable for pure systems of boardlike particles.
","[{""version"":""v1"",""created"":""Thu, 17 Nov 2011 16:08:17 GMT""},{""version"":""v2"",""created"":""Mon, 26 Mar 2012 08:57:54 GMT""}]","2015-06-03"
"1111.4133","Daniel an der Br\""ugge","Daniel an der Br\""ugge, Alexander Pukhov","Theory of Attosecond Pulses from Relativistic Surface Plasmas","51 pages, 37 figures. arXiv admin note: substantial text overlap with
  arXiv:1002.3576",,,,"physics.plasm-ph physics.optics","http://arxiv.org/licenses/nonexclusive-distrib/1.0/","  High harmonic generation by relativistically intense laser pulses from
overdense plasma layers is surveyed. High harmonics are generated in form of
(sub-)attosecond pulses when the plasma surface rebounds towards the observer
with relativistic velocity. Different cases are considered. The
""relativistically oscillating mirror"" (ROM) model, describing the most typical
case, is analyzed in detail. The resulting harmonic spectrum is usually a power
law with the exponent -8/3 [baeva2006relativistic], but possible exceptions due
to ""higher order \gamma-spikes"" are considered. It is shown that under certain
conditions, ultra-dense electron nanobunches can be formed at plasma surface
that emit coherent synchrotron radiation. The resulting spectrum is much
flatter and leads to the formation of a giant attosecond pulse in the reflected
radiation. The harmonics radiation is also considered in time domain, where
they form a train of attosecond pulses. It is characterized and a possibility
to select a single attosecond pulse via polarization gating is described.
Further, the line structure in relativistic harmonic spectra is analyzed. It is
shown that the harmonics have an intrinsic chirp and it can be responsible for
experimentally observed spectral modulations. Finally, high harmonic generation
is considered in realistic three-dimensional geometry. It is shown that free
space diffraction can act as a high pass filter, altering the spectrum and the
reflected field structure. The high harmonics tend to be self-focused by the
reflecting surface. This leads to a natural angular divergence as well as to
field boost at the focal position. Coherently focusing the harmonics using an
optimized geometry may result in a significantly higher field than the field of
the driving laser.
","[{""version"":""v1"",""created"":""Thu, 17 Nov 2011 16:08:27 GMT""}]","2011-11-18"
"1111.4134","Roberto Soler","R. Soler, J. Andries, and M. Goossens","Resonant Alfven waves in partially ionized plasmas of the solar
  atmosphere",,,"10.1051/0004-6361/201118235",,"astro-ph.SR","http://arxiv.org/licenses/nonexclusive-distrib/1.0/","  Context. Magnetohydrodynamic (MHD) waves are ubiquitous in the solar
atmosphere. In magnetic waveguides resonant absorption due to plasma
inhomogeneity naturally transfers wave energy from large-scale motions to
small-scale motions. In the cooler parts of the solar atmosphere as, e.g., the
chromosphere, effects due to partial ionization may be relevant for wave
dynamics and heating. Aims. We study resonant Alfven waves in partially ionized
plasmas. Methods. We use the multifluid equations in the cold plasma
approximation. We investigate propagating resonant MHD waves in partially
ionized flux tubes. We use approximate analytical theory based on normal modes
in the thin tube and thin boundary approximations along with numerical
eigenvalue computations. Results. We find that the jumps of the wave
perturbations across the resonant layer are the same as in fully ionized
plasmas. The damping length due to resonant absorption is inversely
proportional to the frequency, while that due to ion-neutral collisions is
inversely proportional to the square of the frequency. For observed frequencies
in the solar atmosphere, the amplitude of MHD kink waves is more efficiently
damped by resonant absorption than by ion-neutral collisions. Conclusions. Most
of the energy carried by chromospheric kink waves is converted into localized
azimuthal Alfven waves that can deposit energy in the coronal medium. The
dissipation of wave energy in the chromosphere due to ion-neutral collisions is
only effective for high-frequency waves. The chromosphere acts as a filter for
kink waves with periods shorter than 10 s.
","[{""version"":""v1"",""created"":""Thu, 17 Nov 2011 16:15:26 GMT""}]","2015-06-03"
"1111.4135","L.D Contreras-Pulido Dr.","L. Debora Contreras-Pulido, Janine Splettstoesser, Michele Governale,
  J\""urgen K\""onig, and Markus B\""uttiker","Time scales in the dynamics of an interacting quantum dot","Version accpeted in PRB","Phys. Rev. B 85, 075301 (2012)","10.1103/PhysRevB.85.075301",,"cond-mat.mes-hall","http://arxiv.org/licenses/nonexclusive-distrib/1.0/","  We analyze the dynamics of a single-level quantum dot with Coulomb
interaction, weakly tunnel coupled to an electronic reservoir, after it has
been brought out of equilibrium, e.g. by a step-pulse potential. We investigate
the exponential decay towards the equilibrium state, which is governed by three
time scales. In addition to the charge and spin relaxation time there is a
third time scale which is independent of the level position and the Coulomb
interaction. This time scale emerges in the time evolution of physical
quantities sensitive to two-particle processes.
","[{""version"":""v1"",""created"":""Thu, 17 Nov 2011 16:17:48 GMT""},{""version"":""v2"",""created"":""Tue, 28 Feb 2012 12:08:25 GMT""}]","2015-06-03"
"1111.4137","Fei Zhou","Fei Zhou and Vidvuds Ozolins","Self-consistent density functional calculations of the crystal field
  levels in lanthanide and actinide dioxides","12 pages, 2 figures, 4 tables. To appear in PRB","Physical Review B 85, 075124 (2012)","10.1103/PhysRevB.85.075124",,"cond-mat.str-el","http://arxiv.org/licenses/nonexclusive-distrib/1.0/","  Using a recently developed method combining a nonspherical self-interaction
corrected LDA+$U$ scheme and an on-site multi-body Hamiltonian [Phys.\ Rev.\ B
83, 085106 (2011)], we calculate the crystal field parameters and crystal field
(CF) excitation levels of $f$-element dioxides in the fluorite structure with
$f^{n}$ electronic configurations, including $n=1$ (PaO$_{2}$, PrO$_{2}$),
$n=2$ (UO$_{2}$), $n=3$ (NpO$_{2}$), and $n=4$ (PuO$_{2}$). It is shown that
good agreement with experimental data (within approximately 10 to 20 meV) can
be obtained in all cases. The properties of the multi-electron CF ground states
are analyzed.
","[{""version"":""v1"",""created"":""Thu, 17 Nov 2011 16:19:50 GMT""},{""version"":""v2"",""created"":""Fri, 10 Feb 2012 05:57:33 GMT""},{""version"":""v3"",""created"":""Mon, 13 Feb 2012 04:00:32 GMT""}]","2015-11-17"
"1111.4138","Andrei Timoshevskii","A. S. Bakai, A. N. Timoshevskii, B. Z. Yanchitsky","On chemical bonding of Helium with hcp-Beryllium","Revised version of manuscript, 4 pages, 4 figures",,"10.1063/1.3665873",,"cond-mat.mtrl-sci","http://arxiv.org/licenses/nonexclusive-distrib/1.0/","  Chemical inertness is the key property of helium determining its solubility,
distribution and accumulation kinetics in metals. Against all expectations, our
ab initio calculations show a substantial chemical bonding between He and Be
atoms in the hcp-Be matrix when He occupies a non-symmetric position in a basal
plane.
","[{""version"":""v1"",""created"":""Thu, 17 Nov 2011 16:28:04 GMT""},{""version"":""v2"",""created"":""Tue, 29 May 2012 15:18:31 GMT""}]","2015-06-03"
"1111.4139","S. I. Matveenko","S. I. Matveenko, S. I. Mukhin, F. V. Kusmartsev","Stripes and superconductivity in the two-dimensional self-consistent
  model","14 pages, 2 figures",,,,"cond-mat.supr-con cond-mat.str-el","http://arxiv.org/licenses/nonexclusive-distrib/1.0/","  We found solutions of the Bogoliubov-de Gennes equations for the
two-dimensional self-consistent model of superconductors with $d_{x^2-y^2}$
symmetry of the order parameter, taking into account spin and charge
distributions. Analytical solutions for spin-charge density wave phases in the
absence of the superconductivity (""stripe"" and ""checkerboard"" structures) are
presented. Analytical solutions for coexisting superconductivity and stripes
are found.
","[{""version"":""v1"",""created"":""Thu, 17 Nov 2011 16:29:47 GMT""},{""version"":""v2"",""created"":""Thu, 27 Dec 2012 15:20:09 GMT""}]","2013-01-01"
"1111.4141","Sean MacMullin","S. MacMullin, G. K. Giovanetti, M. P. Green, R. Henning, R. Holmes, K.
  Vorren, J. F. Wilkerson","Measurement of airborne fission products in Chapel Hill, NC, USA from
  the Fukushima Dai-ichi reactor accident","10 pages, 4 figures","Journal of Environmental Radioactivity 112 (2012) 165-170","10.1016/j.jenvrad.2012.01.026",,"nucl-ex","http://arxiv.org/licenses/nonexclusive-distrib/1.0/","  We present measurements of airborne fission products in Chapel Hill, NC, USA,
from 62 days following the March 11, 2011, accident at the Fukushima Dai-ichi
nuclear power plant. Airborne particle samples were collected daily in air
filters and radio-assayed with two high-purity germanium (HPGe) detectors. The
fission products I-131 and Cs-137 were measured with maximum activities of 4.2
+/- 0.6 mBq/m^3 and 0.42 +/- 0.07 mBq/m^3 respectively. Additional activity
from I-131, I-132, Cs-134, Cs-136, Cs-137 and Te-132 were measured in the same
air filters using a low-background HPGe detector at the Kimballton Underground
Research Facility (KURF).
","[{""version"":""v1"",""created"":""Thu, 17 Nov 2011 16:31:48 GMT""},{""version"":""v2"",""created"":""Mon, 23 Jan 2012 20:45:35 GMT""},{""version"":""v3"",""created"":""Wed, 3 Oct 2012 17:30:56 GMT""}]","2015-03-19"
"1111.4142","Manuel Nieto-Vesperinas","F. J. Valdivia-Valero and M. Nieto-Vesperinas","Composites of resonant dielectric rods: A test of their behavior as
  metamaterial refractive elements",,,"10.1016/j.photonics.2012.04.012",,"physics.optics","http://arxiv.org/licenses/nonexclusive-distrib/1.0/","  We report numerical experiments of optical wave propagation in composites of
high refractive index dielectric rods at frequencies where their first electric
and magnetic Mie resonances are excited. The arrays of these particles have
been extensively studied and proposed as non-absorbing and isotropic
metamaterials. We show that negative refraction, observed in ordered particle
arrays, is due to diffraction and that an effective medium theory yields
constitutive parameters that do not reproduce the observations in these
composites, whose transmission also depends on the sample shape. This is
further confirmed by disordering the arrays, a case in which large transmission
losses appear due to extinction by resonant scattering from the particles.
Therefore, these composites although little absorbing have large extinction due
to scattering.
","[{""version"":""v1"",""created"":""Thu, 17 Nov 2011 16:38:34 GMT""},{""version"":""v2"",""created"":""Thu, 12 Jan 2012 11:57:40 GMT""},{""version"":""v3"",""created"":""Fri, 3 Feb 2012 10:15:00 GMT""}]","2015-06-03"
"1111.4143","Rapha\""el Fino","Raphael Fino","Around rationality of cycles",,,,,"math.AG","http://arxiv.org/licenses/nonexclusive-distrib/1.0/","  In this article we prove certain results comparing rationality of algebraic
cycles over the function field of a quadric and over the base field. Those
results have already been proved by Alexander Vishik in the case of
characteristic 0, which allowed him to work with algebraic cobordism theory.
Our proofs use the modulo 2 Steenrod operations in the Chow theory and work in
any characteristic different from 2.
","[{""version"":""v1"",""created"":""Thu, 17 Nov 2011 16:38:49 GMT""},{""version"":""v2"",""created"":""Wed, 7 Dec 2011 20:07:35 GMT""}]","2016-11-25"
"1111.4144","Aravindh Krishnamoorthy","Aravindh Krishnamoorthy and Deepak Menon","Matrix Inversion Using Cholesky Decomposition","3pp with minor changes, pre-print; accepted for publication 2013 IEEE
  Signal Processing: Algorithms, Architectures, Arrangements, and Applications
  (SPA) conference",,,,"cs.MS","http://arxiv.org/licenses/nonexclusive-distrib/1.0/","  In this paper we present a method for matrix inversion based on Cholesky
decomposition with reduced number of operations by avoiding computation of
intermediate results; further, we use fixed point simulations to compare the
numerical accuracy of the method.
","[{""version"":""v1"",""created"":""Thu, 17 Nov 2011 16:44:40 GMT""},{""version"":""v2"",""created"":""Thu, 17 Oct 2013 20:33:59 GMT""}]","2013-10-21"
"1111.4145","Igor Samsonov","I. L. Buchbinder, E. A. Ivanov, I. B. Samsonov, B. M. Zupnik","Superconformal N=3 SYM Low-Energy Effective Action","1+29 pages; v2: minor corrections, JHEP style",,"10.1007/JHEP01(2012)001",,"hep-th","http://arxiv.org/licenses/nonexclusive-distrib/1.0/","  We construct a manifestly N=3 supersymmetric low-energy effective action of
N=3 super Yang-Mills theory. The effective action is written in the N=3
harmonic superspace and respects the full N=3 superconformal symmetry. On mass
shell this action is responsible for the four-derivative terms in the N=4 SYM
effective action, such as F^4/X^4 and its supersymmetric completions, while off
shell it involves also higher-derivative terms. For constant Maxwell and scalar
fields its bosonic part coincides, up to the F^6/X^8 order, with the bosonic
part of the D3 brane action in the AdS_5 x S^5 background. We also argue that
in the sector of scalar fields it involves the correctly normalized Wess-Zumino
term with the implicit SU(3) symmetry.
","[{""version"":""v1"",""created"":""Thu, 17 Nov 2011 16:45:33 GMT""},{""version"":""v2"",""created"":""Wed, 11 Jan 2012 16:00:04 GMT""}]","2015-06-03"
"1111.4146","Marcy Robertson","Marcy Robertson","The Homotopy Theory of Simplicially Enriched Multicategories",,,,,"math.AT math.CT","http://arxiv.org/licenses/nonexclusive-distrib/1.0/","  In this paper we construct a cofibrantly generated model category structure
on the category of all small symmetric multicategories enriched in simplicial
sets.
","[{""version"":""v1"",""created"":""Thu, 17 Nov 2011 16:46:20 GMT""}]","2011-11-18"
"1111.4147","Enrique Mart\'in L\'opez","Enrique Martin-Lopez, Anthony Laing, Thomas Lawson, Roberto Alvarez,
  Xiao-Qi Zhou and Jeremy L. O'Brien","Experimental realisation of Shor's quantum factoring algorithm using
  qubit recycling","7 pages, 3 figures","Nature Photonics 6, 773-776 (2012)","10.1038/nphoton.2012.259",,"quant-ph","http://arxiv.org/licenses/nonexclusive-distrib/1.0/","  Quantum computational algorithms exploit quantum mechanics to solve problems
exponentially faster than the best classical algorithms. Shor's quantum
algorithm for fast number factoring is a key example and the prime motivator in
the international effort to realise a quantum computer. However, due to the
substantial resource requirement, to date, there have been only four
small-scale demonstrations. Here we address this resource demand and
demonstrate a scalable version of Shor's algorithm in which the n qubit control
register is replaced by a single qubit that is recycled n times: the total
number of qubits is one third of that required in the standard protocol.
Encoding the work register in higher-dimensional states, we implement a
two-photon compiled algorithm to factor N=21. The algorithmic output is
distinguishable from noise, in contrast to previous demonstrations. These
results point to larger-scale implementations of Shor's algorithm by harnessing
scalable resource reductions applicable to all physical architectures.
","[{""version"":""v1"",""created"":""Thu, 17 Nov 2011 16:55:45 GMT""},{""version"":""v2"",""created"":""Wed, 24 Oct 2012 13:48:35 GMT""}]","2012-11-19"
"1111.4148","Surya Tokdar Surya Tokdar","Surya T. Tokdar","Adaptive Convergence Rates of a Dirichlet Process Mixture of
  Multivariate Normals","12 pages",,,,"math.ST stat.ME stat.TH","http://arxiv.org/licenses/nonexclusive-distrib/1.0/","  It is shown that a simple Dirichlet process mixture of multivariate normals
offers Bayesian density estimation with adaptive posterior convergence rates.
Toward this, a novel sieve for non-parametric mixture densities is explored,
and its rate adaptability to various smoothness classes of densities in
arbitrary dimension is demonstrated. This sieve construction is expected to
offer a substantial technical advancement in studying Bayesian non-parametric
mixture models based on stick-breaking priors.
","[{""version"":""v1"",""created"":""Thu, 17 Nov 2011 16:58:39 GMT""}]","2011-11-18"
"1111.4149","Michal Silarski","M. Silarski (for the KLOE-2 Collaboration)","Physics topics at KLOE-2","Proceedings of the EXA2011 conference,1 figure, 5 pages, be published
  in Hyperfine Interactions","Hyperfine Interact. 211:33-38, 2012","10.1007/s10751-012-0568-9",,"hep-ex","http://arxiv.org/licenses/nonexclusive-distrib/1.0/","  The goal of the KLOE-2 experiment operating at the upgraded DA{\Phi}NE
e+e-collider is to collect an integrated luminosity of about 20 fb-1 during 3-4
years of running. Measurements using the KLOE-2 apparatus equipped with the
inner tracker, new scintillation calorimeters and tagging detectors for
gamma-gamma physics will allow to refine and extend the KLOE program on kaon
physics and tests of fundamental symmetries as well as the quantum
interferometry. Here the latest results from KLOE data analysis and
perspectives at KLOE-2 are presented.
","[{""version"":""v1"",""created"":""Thu, 17 Nov 2011 17:09:49 GMT""},{""version"":""v2"",""created"":""Mon, 26 Dec 2011 12:46:12 GMT""},{""version"":""v3"",""created"":""Wed, 25 Jan 2012 14:22:55 GMT""}]","2019-08-14"
"1111.4150","Serge Duarte Pinto","Serge Duarte Pinto, Philippe Carri\`ere, Jens Spanggaard, Gerard
  Tranquille","Antiproton beam profile measurements using Gas Electron Multipliers","Submitted to the IEEE Nuclear Science Symposium conference record","IEEE Nuclear Science Symposium 2011 Conference Record","10.1109/NSSMIC.2011.6153647",,"physics.ins-det","http://arxiv.org/licenses/nonexclusive-distrib/1.0/","  The new beam profile measurement for the Antiproton Decelerator (AD) at CERN
is based on a single Gas Electron Multiplier (GEM) with a 2D readout structure.
This detector is very light, ~0.4% X_0, as required by the low energy of the
antiprotons, 5.3 MeV. This overcomes the problems previously encountered with
multi-wire proportional chambers (MWPC) for the same purpose, where beam
interactions with the detector severely affect the obtained profiles. A
prototype was installed and successfully tested in late 2010, with another five
detectors now installed in the ASACUSA and AEgIS beam lines. We will provide a
detailed description of the detector and discuss the results obtained.
  The success of these detectors in the AD makes GEM-based detectors likely
candidates for upgrade of the beam profile monitors in all experimental areas
at CERN. The various types of MWPC currently in use are aging and becoming
increasingly difficult to maintain.
","[{""version"":""v1"",""created"":""Thu, 17 Nov 2011 17:10:20 GMT""}]","2012-08-31"
"1111.4151","Dmytro Inosov S.","G. Friemel, Yuan Li, A. V. Dukhnenko, N. Yu. Shitsevalova, N. E.
  Sluchanko, A. Ivanov, V. B. Filipov, B. Keimer, and D. S. Inosov","Resonant magnetic exciton mode in the heavy-fermion antiferromagnet CeB6",,"Nature Communications 3, 830 (2012)","10.1038/ncomms1821",,"cond-mat.str-el cond-mat.mtrl-sci cond-mat.supr-con","http://arxiv.org/licenses/nonexclusive-distrib/1.0/","  Resonant magnetic excitations are widely recognized as hallmarks of
unconventional superconductivity in copper oxides, iron pnictides, and
heavy-fermion compounds. Numerous model calculations have related these modes
to the microscopic properties of the pair wave function, but the mechanisms
underlying their formation are still debated. Here we report the discovery of a
similar resonant mode in the non-superconducting, antiferromagnetically ordered
heavy-fermion metal CeB6. Unlike conventional magnons, the mode is
non-dispersive, and its intensity is sharply concentrated around a wave vector
separate from those characterizing the antiferromagnetic order. The magnetic
intensity distribution rather suggests that the mode is associated with a
coexisting order parameter of the unusual antiferro-quadrupolar phase of CeB6,
which has long remained ""hidden"" to the neutron-scattering probes. The mode
energy increases continuously below the onset temperature for
antiferromagnetism, in parallel to the opening of a nearly isotropic spin gap
throughout the Brillouin zone. These attributes bear strong similarity to those
of the resonant modes observed in unconventional superconductors below their
critical temperatures. This unexpected commonality between the two disparate
ground states indicates the dominance of itinerant spin dynamics in the ordered
low-temperature phases of CeB6 and throws new light on the interplay between
antiferromagnetism, superconductivity, and ""hidden"" order parameters in
correlated-electron materials.
","[{""version"":""v1"",""created"":""Thu, 17 Nov 2011 17:13:41 GMT""}]","2012-05-16"
"1111.4152","Christophe Ritzenthaler","Reynald Lercier and Christophe Ritzenthaler","Hyperelliptic curves and their invariants: geometric, arithmetic and
  algorithmic aspects","46 pages ; related programs are available on the web pages of the
  authors",,,,"math.NT math.AG","http://arxiv.org/licenses/nonexclusive-distrib/1.0/","  We apply classical invariant theory of binary forms to explicitly
characterize isomorphism classes of hyperelliptic curves of small genus and,
conversely, propose algorithms for reconstructing hyperelliptic models from
given invariants. We focus on genus 3 hyperelliptic curves. Both geometric and
arithmetic aspects are considered.
","[{""version"":""v1"",""created"":""Thu, 17 Nov 2011 17:14:00 GMT""}]","2011-11-18"
"1111.4153","Tord Riemann","J. Fleischer, T. Riemann","Simplifying 5-point tensor reduction","8 pages, Talk presented at XXXV International Conference of
  Theoretical Physics Matter to the Deepest: Recent Developments in Physics of
  Fundamental Interactions, Ustron'11",,,"DESY 11-206; BI-TP 2011/37; SFB/CPP-11-66","hep-ph","http://arxiv.org/licenses/nonexclusive-distrib/1.0/","  The 5-point tensors have the property that after insertion of the metric
tensor $g^{\mu \nu}$ in terms of external momenta, all $g^{\mu
\nu}$-contributions in the tensor decomposition cancel. If furthermore the
tensors are contracted with external momenta, the inverse 5-point Gram
determinant $()_5$ cancels automatically. If the remaining 4-point sub-Gram
determinant ${s\choose s}_5$ is not small then this approach appears to be
particularly efficient in numerical calculations. We also indicate how to deal
with small ${s\choose s}_5$. Explicit formulae for tensors of degree 2 and 3
are given for large and small (sub-) Gram determinants.
","[{""version"":""v1"",""created"":""Thu, 17 Nov 2011 17:14:03 GMT""}]","2011-11-18"
"1111.4154","Oleg Selyugin","O. V. Selyugin, J.-R. Cudell, E. Predazzi","The slope of the hadron spin-flip amplitude and the determination of
  \rho(s,t)","4 pages, 1 figure, talk on XIV Workshop on High Energy Spin Pisics,
  Dubna (2011)",,,,"hep-ph hep-ex","http://arxiv.org/licenses/nonexclusive-distrib/1.0/","  We re-examine the extraction of \rho(s,t), the ratio of the real part to the
imaginary part of the scattering amplitude, and of the spin-flip amplitude,
from the existing experimental data in the Coulomb-hadron interference region.
We show that it is not possible to find reasonable assumptions about the
structure of the scattering amplitude of proton-proton and proton-antiproton
elastic scattering at high energy that would lead, in proton-antiproton
scattering for 3.8 < p_L <6 GeV/c, to an agreement between data and an analysis
based on dispersion relations.
","[{""version"":""v1"",""created"":""Thu, 17 Nov 2011 17:16:12 GMT""}]","2011-11-18"
