"1105.1165","Severin Winkler","Severin Winkler, Marco Tomamichel, Stefan Hengl, Renato Renner","Impossibility of Growing Quantum Bit Commitments","10 pages, minor changes","Phys. Rev. Lett. 107, 090502 (2011)","10.1103/PhysRevLett.107.090502",,"quant-ph","http://arxiv.org/licenses/nonexclusive-distrib/1.0/","  Quantum key distribution (QKD) is often, more correctly, called key growing.
Given a short key as a seed, QKD enables two parties, connected by an insecure
quantum channel, to generate a secret key of arbitrary length. Conversely, no
key agreement is possible without access to an initial key. Here, we consider
another fundamental cryptographic task, commitments. While, similar to key
agreement, commitments cannot be realized from scratch, we ask whether they may
be grown. That is, given the ability to commit to a fixed number of bits, is
there a way to augment this to commitments to strings of arbitrary length?
Using recently developed information-theoretic techniques, we answer this
question to the negative.
","[{""version"":""v1"",""created"":""Thu, 5 May 2011 20:03:00 GMT""},{""version"":""v2"",""created"":""Tue, 27 Sep 2011 12:00:34 GMT""}]","2011-09-28"
"1105.1166","Daniel Phalen","Markus A. Luty and Daniel J. Phalen","Higgsstrahlung from R-hadrons","9 pages, 3 figures, 2 tables",,"10.1007/JHEP11(2011)019",,"hep-ph hep-ex","http://arxiv.org/licenses/nonexclusive-distrib/1.0/","  If R hadrons are discovered at the LHC, investigation of their properties
will be of paramount importance. One important question is how much of the
R-hadron mass is due to electroweak symmetry breaking, i.e. the coupling of the
Higgs to R-hadrons. In this paper we show that in models where the Higgs has a
sizable coupling to R-hadrons we can readily observe Higgs production in
association with a pair of R-hadrons (""Higgsstrahlung""). This process can be
used to distinguish between different models of R-hadrons. It may be the
discovery mode of the Higgs for low mass Higgs bosons, and provides a
low-background Higgs sample to study h to bb.
","[{""version"":""v1"",""created"":""Thu, 5 May 2011 20:03:28 GMT""}]","2015-05-28"
"1105.1167","Roxana Racec","E. R. Racec","Fano effect and nonuniversal phase lapses in mesoscopic regime of
  transport","REVTex4, 16 pages, 12 figures, 1 table",,,,"cond-mat.mes-hall","http://arxiv.org/licenses/nonexclusive-distrib/1.0/","  The transmission probability and phase through a few-electron quantum dot are
studied within a resonance theory for the strong coupling regime to the
conducting leads. We find that the interaction between overlapping resonances
leads to their separation in the complex energy plane and to the decoherent
dephasing of the resonant modes. The appearance of the Fano effect is
conditioned not only by the induced dephasing generally associated with a phase
lapse, but also by a favorable parity of the resonant modes. To identify the
contribution of each resonance to the transmission, we propose, in the case of
overlapping resonances, a decomposition of the scattering matrix in resonant
terms and a background. The resonant contributions are approximated by Fano
lines with complex asymmetry parameters and the background by a constant. The
conductance and the transmission phase calculated within this approach
reproduce the generic features of the experimental data.
","[{""version"":""v1"",""created"":""Thu, 5 May 2011 20:03:41 GMT""}]","2011-05-09"
"1105.1168","Christoph Adam","C. Adam, J.M. Queiruga, J. Sanchez-Guillen, A. Wereszczynski","N=1 supersymmetric extension of the baby Skyrme model","9 pages, Latex","Phys.Rev.D84:025008,2011","10.1103/PhysRevD.84.025008",,"hep-th math-ph math.MP","http://arxiv.org/licenses/nonexclusive-distrib/1.0/","  We construct a method to supersymmetrize higher kinetic terms and apply it to
the baby Skyrme model. We find that there exist N=1 supersymmetric extensions
for baby Skyrme models with arbitrary potential.
","[{""version"":""v1"",""created"":""Thu, 5 May 2011 20:04:31 GMT""}]","2011-08-08"
"1105.1169","Christopher D. Hacon","Christopher D. Hacon and Chenyang Xu","Existence of log canonical closures",,,,,"math.AG","http://arxiv.org/licenses/nonexclusive-distrib/1.0/","  Let $f:X\to U$ be a projective morphism of normal varieties and $(X,\Delta)$
a dlt pair. We prove that if there is an open set $U^0\subset U$, such that
$(X,\Delta)\times_U U^0$ has a good minimal model over $U^0$ and the images of
all the non-klt centers intersect $U^0$, then $(X,\Delta)$ has a good minimal
model over $U$. As consequences we show the existence of log canonical
compactifications for open log canonical pairs, and the fact that the moduli
functor of stable schemes satisfies the valuative criterion for properness.
","[{""version"":""v1"",""created"":""Thu, 5 May 2011 20:22:18 GMT""},{""version"":""v2"",""created"":""Tue, 10 May 2011 19:46:12 GMT""},{""version"":""v3"",""created"":""Thu, 28 Jun 2012 13:07:03 GMT""}]","2012-06-29"
"1105.1170","Manish Jain","Manish Jain, James R. Chelikowsky and Steven G. Louie","Quasiparticle Excitations and Charge Transition Levels of Oxygen
  Vacancies in Hafnia","10 pages, 3 figures",,"10.1103/PhysRevLett.107.216803",,"cond-mat.mtrl-sci","http://arxiv.org/licenses/nonexclusive-distrib/1.0/","  We calculate the quasiparticle defect states and charge transition levels of
oxygen vacancies in monoclinic hafnia. The charge transition levels, although
they are thermodynamic quantities, can be critically dependent on the band gap
owing to localized defect states. These quasiparticle defect level effects are
treated using the first principle GW approximation to the self energy. We show
that the quality and reliability of the results may be evaluated by calculating
the same transition level via two physical paths and that it is important to
include the necessary electrostatic corrections in a supercell calculation.
Contrary to many previous reports, the oxygen vacancies in monoclinic hafnia
are found to be a positive U center, where U is the defect electron addition
energy. We identify a physical partitioning of U in terms of an electronic and
structural relaxation part.
","[{""version"":""v1"",""created"":""Thu, 5 May 2011 20:45:33 GMT""}]","2011-11-29"
"1105.1171","Tom Mackay","Tom G. Mackay (University of Edinburgh)","Voigt waves in homogenized particulate composites based on isotropic
  dielectric components",,"Journal of Optics 13 (2011) 105702","10.1088/2040-8978/13/10/105702",,"physics.optics","http://arxiv.org/licenses/nonexclusive-distrib/1.0/","  Homogenized composite materials (HCMs) can support a singular form of optical
propagation, known as Voigt wave propagation, while their component materials
do not. This phenomenon was investigated for biaxial HCMs arising from
nondissipative isotropic dielectric component materials. The biaxiality of
these HCMs stems from the oriented spheroidal shapes of the particles which
make up the component materials. An extended version of the Bruggeman
homogenization formalism was used to investigate the influence of component
particle orientation, shape and size, as well as volume fraction of the
component materials, upon Voigt wave propagation. Our numerical studies
revealed that the directions in which Voigt waves propagate is highly sensitive
to the orientation of the component particles and to the volume fraction of the
component materials, but less sensitive to the shape of the component particles
and less sensitive still to the size of the component particles. Furthermore,
whether or not such an HCM supports Voigt wave propagation at all is critically
dependent upon the size of the component particles and, in certain cases, upon
the volume fraction of the component materials.
","[{""version"":""v1"",""created"":""Thu, 5 May 2011 20:47:57 GMT""}]","2015-05-28"
"1105.1172","Miguel Pino Rozas","M\'aximo Ba\~nados, Andr\'es Gomberoff, Miguel Pino","The bigravity black hole and its thermodynamics","14 pages, 9 figures",,"10.1103/PhysRevD.84.104028",,"gr-qc","http://arxiv.org/licenses/nonexclusive-distrib/1.0/","  We argue that the Isham-Storey exact solution to bigravity does not describe
black holes because the horizon is a singular surface. However, this is not a
generic property of bigravity, but a property of a particular potential. More
general potentials do accept regular black holes. For regular black holes, we
compute the total energy and thermodynamical parameters. Phase transitions
occur for certain critical temperatures. We also find a novel region on phase
space describing up to 4 allowed states for a given temperature.
","[{""version"":""v1"",""created"":""Thu, 5 May 2011 20:58:40 GMT""},{""version"":""v2"",""created"":""Tue, 17 May 2011 19:09:02 GMT""},{""version"":""v3"",""created"":""Tue, 4 Oct 2011 21:03:27 GMT""}]","2015-03-19"
"1105.1173","Ludmil Zikatanov","Guozhu Yu and Jinchao Xu and Ludmil Zikatanov","Analysis of two-level method for anisotropic diffusion equations on
  aligned and non-aligned grids",,,,,"math.NA","http://arxiv.org/licenses/nonexclusive-distrib/1.0/","  This paper is devoted to the multigrid convergence analysis for the linear
systems arising from the conforming linear finite element discretization of the
second order elliptic equations with anisotropic diffusion. The multigrid
convergence behavior is known to strongly depend on whether the discretization
grid is aligned or non-aligned with the anisotropic direction and analyses in
the paper will be mainly focused on two-level algorithms. For an aligned grid
case, a lower bound is given for point-wise smoother which shows deterioration
of convergence rate. In both aligned and non-aligned cases we show that for a
specially designed block smoother the convergence is uniform with respect to
both anisotropy ratio and mesh size in the energy norm. The analysis is
complemented with numerical experiments which confirm the theoretical results
","[{""version"":""v1"",""created"":""Thu, 5 May 2011 20:59:07 GMT""}]","2011-05-09"
"1105.1174","Jianhai Bao","Jianhai Bao and Chenggui Yuan","Stochastic Population Dynamics Driven by Levy Noise","16 pages",,,,"math.PR","http://arxiv.org/licenses/nonexclusive-distrib/1.0/","  This paper considers stochastic population dynamics driven by Levy noise. The
contributions of this paper lie in that (a) Using Khasminskii-Mao theorem, we
show that the stochastic differential equation associated with the model has a
unique global positive solution; (b) Applying an exponential martingale
inequality with jumps, we discuss the asymptotic pathwise estimation of such
model.
","[{""version"":""v1"",""created"":""Thu, 5 May 2011 21:02:35 GMT""}]","2011-05-09"
"1105.1175","Emanuel Gull","Emanuel Gull, David R. Reichman, Andrew J. Millis","Numerically Exact Long Time Behavior of Nonequilibrium Quantum Impurity
  Models",,"Phys. Rev. B 84, 085134 (2011)","10.1103/PhysRevB.84.085134",,"cond-mat.str-el","http://arxiv.org/licenses/nonexclusive-distrib/1.0/","  A Monte Carlo sampling of diagrammatic corrections to the non-crossing
approximation is shown to provide numerically exact estimates of the long-time
dynamics and steady state properties of nonequilibrium quantum impurity models.
This `bold' expansion converges uniformly in time and significantly ameliorates
the sign problem that has heretofore limited the power of real-time Monte Carlo
approaches to strongly interacting real-time quantum problems. The new approach
enables the study of previously intractable problems ranging from generic long
time nonequilibrium transport characteristics in systems with large onsite
repulsion to the direct description of spectral functions on the real frequency
axis in Dynamical Mean Field Theory.
","[{""version"":""v1"",""created"":""Thu, 5 May 2011 21:11:24 GMT""}]","2012-12-21"
"1105.1176","J. Brian Conrey","Brian Conrey, Henryk Iwaniec, Kannan Soundararajan","Asymptotic Large Sieve",,,,"AIM 2011-7","math.NT","http://arxiv.org/licenses/nonexclusive-distrib/1.0/","  Motivated by applications to the study of L-functions, we develop an
asymptotic version of the large sieve inequality for linear forms in primitive
Dirichlet characters.
","[{""version"":""v1"",""created"":""Thu, 5 May 2011 21:20:30 GMT""}]","2011-05-09"
"1105.1177","J. Brian Conrey","Brian Conrey, Henryk Iwaniec, Kannan Soundararajan","Critical zeros of Dirichlet $L$-functions",,,,"AIM 2011-8","math.NT","http://arxiv.org/licenses/nonexclusive-distrib/1.0/","  We use the Asymptotic Large Sieve and Levinson's method to obtain lower
bounds for the proportion of simple zeros on the critical line of the twists by
primitive Dirichlet characters of a fixed L-function of degree 1,2, or 3.
","[{""version"":""v1"",""created"":""Thu, 5 May 2011 21:24:36 GMT""}]","2011-05-09"
"1105.1178","Daniel Tarlow","Daniel Tarlow, Inmar E. Givoni, Richard S. Zemel, Brendan J. Frey","Interpreting Graph Cuts as a Max-Product Algorithm",,,,,"cs.LG cs.DS stat.ML","http://arxiv.org/licenses/nonexclusive-distrib/1.0/","  The maximum a posteriori (MAP) configuration of binary variable models with
submodular graph-structured energy functions can be found efficiently and
exactly by graph cuts. Max-product belief propagation (MP) has been shown to be
suboptimal on this class of energy functions by a canonical counterexample
where MP converges to a suboptimal fixed point (Kulesza & Pereira, 2008).
  In this work, we show that under a particular scheduling and damping scheme,
MP is equivalent to graph cuts, and thus optimal. We explain the apparent
contradiction by showing that with proper scheduling and damping, MP always
converges to an optimal fixed point. Thus, the canonical counterexample only
shows the suboptimality of MP with a particular suboptimal choice of schedule
and damping. With proper choices, MP is optimal.
","[{""version"":""v1"",""created"":""Thu, 5 May 2011 21:24:37 GMT""}]","2012-02-19"
"1105.1179","Ramon Brasser","E. Nogueira, R. Brasser, R. Gomes","Reassessing the origin of Triton","Accepted in Icarus 2011",,"10.1016/j.icarus.2011.05.003",,"astro-ph.EP","http://arxiv.org/licenses/nonexclusive-distrib/1.0/","  Agnor & Hamilton (2006) demonstrated that the disruption of a binary was an
effective mechanism to capture Triton. The subsequent evolution of Triton's
post-capture orbit could have proceeded through gravitational tides. The study
by Agnor & Hamilton (2006) is repeated in the framework of the Nice model to
determine the post-capture orbit of Triton. After capture it is then subjected
to tidal evolution. The perturbations from the Sun and the figure of Neptune
are included. The perturbations from the Sun acting on Triton cause it to spend
a long time in its high-eccentricity phase, usually of the order of 10 Myr,
while the typical time to circularise to its current orbit is some 200 Myr. The
current orbit of Triton is consistent with an origin through binary capture and
tidal evolution, even though the model prefers Triton to be closer to Neptune
than it is today. The probability of capturing Triton in this manner is
approximately 0.7%. Since the capture of Triton was at most a 50% event --
since only Neptune has one, but Uranus does not -- we deduce that in the
primordial trans-Neptunian disc there were 100 binaries with at least one
Triton-sized member. Morbidelli et al. (2009) concludes there were some 1000
Triton-sized bodies in the trans-Neptunian proto-planetary disc, so the
primordial binary fraction with at least one Triton-sized member is 10%. This
value is consistent with theoretical predictions, but at the low end. If Triton
was captured at the same time as Neptune's irregular satellites, the far
majority of these, including Nereid, would be lost. This suggests either that
Triton was captured on an orbit with a small semi-major axis a < 50 R_N (a rare
event), or that it was captured before the dynamical instability of the Nice
model, or that some other mechanism was at play. The issue of keeping the
irregular satellites remains unresolved.
","[{""version"":""v1"",""created"":""Thu, 5 May 2011 21:34:50 GMT""}]","2015-05-28"
"1105.1180","Luisa Rebull","L. M. Rebull, C. H. Johnson, V. Hoette, J. S. Kim, S. Laine, M.
  Foster, R. Laher, M. Legassie, C. R. Mallory, K. McCarron, W. H. Sherry","New Young Star Candidates in CG4 and Sa101","Accepted for publication in AJ",,"10.1088/0004-6256/142/1/25",,"astro-ph.SR","http://creativecommons.org/licenses/by/3.0/","  The CG4 and Sa101 regions together cover a region of ~0.5 square degree in
the vicinity of a ""cometary globule"" that is part of the Gum Nebula. There are
seven previously identified young stars in this region; we have searched for
new young stars using mid- and far-infrared data (3.6 to 70 microns) from the
Spitzer Space Telescope, combined with ground-based optical data and
near-infrared data from the Two-Micron All-Sky Survey (2MASS). We find infrared
excesses in all 6 of the previously identified young stars in our maps, and we
identify 16 more candidate young stars based on apparent infrared excesses.
Most (73%) of the new young stars are Class II objects. There is a tighter
grouping of young stars and young star candidates in the Sa101 region, in
contrast to the CG4 region, where there are fewer young stars and young star
candidates, and they are more dispersed. Few likely young objects are found in
the ""fingers"" of the dust being disturbed by the ionization front from the
heart of the Gum Nebula.
","[{""version"":""v1"",""created"":""Thu, 5 May 2011 21:36:15 GMT""}]","2015-05-28"
"1105.1181","Yaroslav Kartashov","Olga V. Borovkova, Yaroslav V. Kartashov, Valery E. Lobanov, Victor A.
  Vysloukh, Lluis Torner","General quasi-non-spreading linear three-dimensional wave-packets","3 pages, 4 figures, to appear in Optics Letters","Optics Letters 36, 2176 (2011)","10.1364/OL.36.002176",,"physics.optics nlin.PS","http://arxiv.org/licenses/nonexclusive-distrib/1.0/","  We introduce a general approach for generation of sets of three-dimensional
quasi-non-spreading wavepackets propagating in linear media, also referred to
as linear light bullets. The spectrum of rigorously non-spreading wavepackets
in media with anomalous group velocity dispersion is localized on the surface
of a sphere, thus drastically restricting the possible wavepacket shapes.
However, broadening slightly the spectrum affords the generation of a large
variety of quasi-non-spreading distributions featuring complex topologies and
shapes in space and time that are of interest in different areas, such as
biophysics or nanosurgery. Here we discuss the method and show several
illustrative examples of its potential.
","[{""version"":""v1"",""created"":""Thu, 5 May 2011 21:48:51 GMT""}]","2015-05-28"
"1105.1182","Yamac Pehlivan","Y. Pehlivan, A. B. Balantekin, Toshitaka Kajino and Takashi Yoshida","Invariants of Collective Neutrino Oscillations","26 pages with one figure. Published version",,"10.1103/PhysRevD.84.065008",,"astro-ph.CO hep-ph math-ph math.MP nucl-th","http://arxiv.org/licenses/nonexclusive-distrib/1.0/","  We consider the flavor evolution of a dense neutrino gas by taking into
account both vacuum oscillations and self interactions of neutrinos. We examine
the system from a many-body perspective as well as from the point of view of an
effective one-body description formulated in terms of the neutrino polarization
vectors. We show that, in the single angle approximation, both the many-body
picture and the effective one-particle picture possess several constants of
motion. We write down these constants of motion explicitly in terms of the
neutrino isospin operators for the many-body case and in terms of the
polarization vectors for the effective one-body case. The existence of these
constants of motion is a direct consequence of the fact that the collective
neutrino oscillation Hamiltonian belongs to the class of Gaudin Hamiltonians.
This class of Hamiltonians also includes the (reduced) BCS pairing Hamiltonian
describing superconductivity. We point out the similarity between the
collective neutrino oscillation Hamiltonian and the BCS pairing Hamiltonian.
The constants of motion manifest the exact solvability of the system. Borrowing
the well established techniques of calculating the exact BCS spectrum, we
present exact eigenstates and eigenvalues of both the many-body and the
effective one-particle Hamiltonians describing the collective neutrino
oscillations. For the effective one-body case, we show that spectral splits of
neutrinos can be understood in terms of the adiabatic evolution of some
quasi-particle degrees of freedom from a high density region where they
coincide with flavor eigenstates to the vacuum where they coincide with mass
eigenstates. We write down the most general consistency equations which should
be satisfied by the effective one-body eigenstates and show that they reduce to
the spectral split consistency equations for the appropriate initial
conditions.
","[{""version"":""v1"",""created"":""Thu, 5 May 2011 22:09:31 GMT""},{""version"":""v2"",""created"":""Fri, 15 Jul 2011 19:24:33 GMT""}]","2015-05-28"
"1105.1183","Fernando Guevara Vasquez","Liliana Borcea, Fernando Guevara Vasquez and Alexander V. Mamonov","Study of noise effects in electrical impedance tomography with resistor
  networks","submitted to Inverse Problems and Imaging","Inverse Probl. Imaging, 7 (2013), no. 2, pp 417-443","10.3934/ipi.2013.7.417",,"math-ph math.MP","http://arxiv.org/licenses/nonexclusive-distrib/1.0/","  We present a study of the numerical solution of the two dimensional
electrical impedance tomography problem, with noisy measurements of the
Dirichlet to Neumann map. The inversion uses parametrizations of the
conductivity on optimal grids. The grids are optimal in the sense that finite
volume discretizations on them give spectrally accurate approximations of the
Dirichlet to Neumann map. The approximations are Dirichlet to Neumann maps of
special resistor networks, that are uniquely recoverable from the measurements.
Inversion on optimal grids has been proposed and analyzed recently, but the
study of noise effects on the inversion has not been carried out. In this paper
we present a numerical study of both the linearized and the nonlinear inverse
problem. We take three different parametrizations of the unknown conductivity,
with the same number of degrees of freedom. We obtain that the parametrization
induced by the inversion on optimal grids is the most efficient of the three,
because it gives the smallest standard deviation of the maximum a posteriori
estimates of the conductivity, uniformly in the domain. For the nonlinear
problem we compute the mean and variance of the maximum a posteriori estimates
of the conductivity, on optimal grids. For small noise, we obtain that the
estimates are unbiased and their variance is very close to the optimal one,
given by the Cramer-Rao bound. For larger noise we use regularization and
quantify the trade-off between reducing the variance and introducing bias in
the solution. Both the full and partial measurement setups are considered.
","[{""version"":""v1"",""created"":""Thu, 5 May 2011 22:12:13 GMT""},{""version"":""v2"",""created"":""Mon, 12 Dec 2011 17:32:08 GMT""}]","2015-06-03"
"1105.1184","Subramanian Vaitheeswaran","S. Vaitheeswaran, Jie Chen, D. Thirumalai","Hydrophobic and ionic-interactions in bulk and confined water with
  implications for collapse and folding of proteins",,,"10.1007/s10955-011-0313-9",,"cond-mat.soft physics.bio-ph physics.chem-ph q-bio.BM","http://arxiv.org/licenses/nonexclusive-distrib/1.0/","  Water and water-mediated interactions determine thermodynamic and kinetics of
protein folding, protein aggregation and self-assembly in confined spaces. To
obtain insights into the role of water in the context of folding problems, we
describe computer simulations of a few related model systems. The dynamics of
collapse of eicosane shows that upon expulsion of water the linear hydrocarbon
chain adopts an ordered helical hairpin structure with 1.5 turns. The structure
of dimer of eicosane molecules has two well ordered helical hairpins that are
stacked perpendicular to each other. As a prelude to studying folding in
confined spaces we used simulations to understand changes in hydrophobic and
ionic interactions in nano droplets. Solvation of hydrophobic and charged
species change drastically in nano water droplets. Hydrophobic species are
localized at the boundary. The tendency of ions to be at the boundary where
water density is low increases as the charge density decreases. Interaction
between hydrophobic, polar, and charged residue are also profoundly altered in
confined spaces. Using the results of computer simulations and accounting for
loss of chain entropy upon confinement we argue and then demonstrate, using
simulations in explicit water, that ordered states of generic amphiphilic
peptide sequences should be stabilized in cylindrical nanopores.
","[{""version"":""v1"",""created"":""Thu, 5 May 2011 22:18:43 GMT""}]","2015-05-28"
"1105.1185","Maysum Panju","Maysum Panju","Iterative Methods for Computing Eigenvalues and Eigenvectors","9 pages","The Waterloo Mathematics Review 1 (2011) 9-18",,,"math.NA","http://arxiv.org/licenses/nonexclusive-distrib/1.0/","  We examine some numerical iterative methods for computing the eigenvalues and
eigenvectors of real matrices. The five methods examined here range from the
simple power iteration method to the more complicated QR iteration method. The
derivations, procedure, and advantages of each method are briefly discussed.
","[{""version"":""v1"",""created"":""Thu, 5 May 2011 22:22:37 GMT""}]","2011-05-09"
