"1105.1111","Askhat Gazizov","R. Aloisio, V. Berezinsky and A. Gazizov","Disappointing model for ultrahigh-energy cosmic rays","4 pages, 7 figures, the talk presented by A. Gazizov at NPA5
  Conference, April 3-8, 2011, Eilat, Israel","J.Phys.Conf.Ser. 337 (2012) 012042","10.1088/1742-6596/337/1/012042",,"astro-ph.HE","http://arxiv.org/licenses/nonexclusive-distrib/1.0/","  Data of Pierre Auger Observatory show a proton-dominated chemical composition
of ultrahigh-energy cosmic rays spectrum at (1 - 3) EeV and a steadily heavier
composition with energy increasing. In order to explain this feature we assume
that (1 - 3) EeV protons are extragalactic and derive their maximum
acceleration energy, E_p^{max} \simeq 4 EeV, compatible with both the spectrum
and the composition. We also assume the rigidity-dependent acceleration
mechanism of heavier nuclei, E_A^{max} = Z x E_p^{max}. The proposed model has
rather disappointing consequences: i) no pion photo-production on CMB photons
in extragalactic space and hence ii) no high-energy cosmogenic neutrino fluxes;
iii) no GZK-cutoff in the spectrum; iv) no correlation with nearby sources due
to nuclei deflection in the galactic magnetic fields up to highest energies.
","[{""version"":""v1"",""created"":""Thu, 5 May 2011 16:01:44 GMT""}]","2012-09-25"
"1105.1112","Herbert Weigel","N. Graham, M. Quandt, H. Weigel","Fermion Energies in the Background of a Cosmic String","38 pages, 6 figures, version accepted for publication in Phys Rev D","Phys.Rev.D84:025017,2011","10.1103/PhysRevD.84.025017","Phys. Rev. D 84, (2011) 025017","hep-th gr-qc hep-ph","http://arxiv.org/licenses/nonexclusive-distrib/1.0/","  We provide a thorough exposition, including technical and numerical details,
of previously published results on the quantum stabilization of cosmic strings.
Stabilization occurs through the coupling to a heavy fermion doublet in a
reduced version of the standard model. We combine the vacuum polarization
energy of fermion zero-point fluctuations and the binding energy of occupied
energy levels, which are of the same order in a semi-classical expansion.
Populating these bound states assigns a charge to the string. We show that
strings carrying fermion charge become stable if the electro-weak bosons are
coupled to a fermion that is less than twice as heavy as the top quark. The
vacuum remains stable in our model, because neutral strings are not
energetically favored. These findings suggests that extraordinarily large
fermion masses or unrealistic couplings are not required to bind a cosmic
string in the standard model.
","[{""version"":""v1"",""created"":""Thu, 5 May 2011 16:08:07 GMT""},{""version"":""v2"",""created"":""Fri, 10 Jun 2011 16:25:50 GMT""}]","2011-08-09"
"1105.1113","Frank Daniel Steffen","Ayres Freitas, Frank Daniel Steffen, Nurhana Tajuddin, Daniel Wyler","Axinos in Cosmology and at Colliders","64 pages, 22 figures","JHEP 1106 (2011) 036","10.1007/JHEP06(2011)036","MPP-2011-1","hep-ph astro-ph.CO hep-ex","http://arxiv.org/licenses/nonexclusive-distrib/1.0/","  The axino, the fermionic superpartner of the axion, is a well-motivated
candidate for cold dark matter if it is the lightest supersymmetric particle.
Since the axino couples very weakly to the matter multiplets, the
next-to-lightest supersymmetric particle (NLSP) has a long lifetime, which has
important consequences for both cosmology and collider phenomenology. Assuming
that a charged slepton is the NLSP, we calculate the complete leading one- and
two-loop contributions to its decay. We analyze in detail constraints on the
parameters space from cosmology and discuss how this scenario can be probed at
colliders. Scenarios in which both the axino and the gravitino are lighter than
the long-lived charged slepton are also explored with particular emphasis on
cosmological constraints and collider phenomenology.
","[{""version"":""v1"",""created"":""Thu, 5 May 2011 16:19:35 GMT""}]","2012-07-25"
"1105.1114","Marco Cogoni","M. Cogoni, B. D'Aguanno, L.N. Kuleshova and D.W.M. Hofmann","A powerful computational crystallography method to study ice
  polymorphism","RevTex 4.1, 7 figures - to be published in the Journal of Chemical
  Physics",,"10.1063/1.3593200",,"cond-mat.mtrl-sci","http://arxiv.org/licenses/nonexclusive-distrib/1.0/","  Classical Molecular Dynamics (MD) simulations are employed as a tool to
investigate structural properties of ice crystals under several temperature and
pressure conditions. All ice crystal phases are analyzed by means of a
computational protocol based on a clustering approach following standard MD
simulations. The MD simulations are performed by using a recently published
classical interaction potential for oxygen and hydrogen in bulk water, derived
from neutron scattering data, able to successfully describe complex phenomena
such as proton hopping and bond formation/breaking. The present study
demonstrates the ability of the interaction potential model to well describe
most ice structures found in the phase diagram of water and to estimate the
relative stability of sixteen known phases through a cluster analysis of
simulated powder diagrams of polymorphs obtained from MD simulations. The
proposed computational protocol is suited for automated crystal structure
identification.
","[{""version"":""v1"",""created"":""Thu, 5 May 2011 16:26:51 GMT""}]","2015-05-28"
"1105.1115","Ciprian Demeter","Ciprian Demeter","$L^2$ bounds for a Kakeya type maximal operator in $\R^3$","13 pages",,"10.1112/blms/bds004",,"math.CA","http://arxiv.org/licenses/nonexclusive-distrib/1.0/","  We prove that the maximal operator obtained by taking averages at scale 1
along $N$ arbitrary directions on the sphere, is bounded in $L^2(\R^3)$ by
$N^{1/4}{\log N}$. When the directions are $N^{-1/2}$ separated, we improve the
bound to $N^{1/4}\sqrt{\log N}$. Apart from the logarithmic terms these bounds
are optimal.
","[{""version"":""v1"",""created"":""Thu, 5 May 2011 16:30:55 GMT""}]","2014-02-26"
"1105.1116","Carl Modes","Carl D. Modes and Mark Warner","Blueprinting Nematic Glass: Systematically Constructing and Combining
  Active Points of Curvature for Emergent Morphology","8 pages, 8 figures","Physical Review E, Vol. 84(2) 021711 (2011)","10.1103/PhysRevE.84.021711",,"cond-mat.soft","http://arxiv.org/licenses/nonexclusive-distrib/1.0/","  Much recent progress has been made in the study of nematic solids, both
glassy and elastomeric, particularly in the realm of stress-free, defect-driven
deformation in thin sheets of material. In this paper we consider a subset of
texture domains in nematic glasses that are simple to synthesize, and explore
the ways that these simple domains may be compatibly combined to yield analogs
of the traditional smooth disclination defect textures seen in standard liquid
crystals. We calculate the deformation properties of these constructed
textures, and show that, subject to the compatibility constraints of the
construction, these textures may be further combined to achieve shape
blueprinting of 3-D structures from flat sheets.
","[{""version"":""v1"",""created"":""Thu, 5 May 2011 16:32:09 GMT""}]","2013-02-11"
"1105.1117","Alfonso P\'erez-Escudero","Alfonso P\'erez-Escudero, Gonzalo G. de Polavieja","Collective Animal Behavior from Bayesian Estimation and Probability
  Matching","19 pages, including Supplemental Figures and Supplemental Text. In
  press in PLoS Computational Biology","PLoS Comput Biol 7(11): e1002282 (2011)","10.1371/journal.pcbi.1002282",,"q-bio.QM cs.SI nlin.AO physics.data-an physics.soc-ph q-bio.NC","http://arxiv.org/licenses/nonexclusive-distrib/1.0/","  Animals living in groups make movement decisions that depend, among other
factors, on social interactions with other group members. Our present
understanding of social rules in animal collectives is mainly based on
empirical fits to observations, with less emphasis in obtaining
first-principles approaches that allow their derivation. Here we show that
patterns of collective decisions can be derived from the basic ability of
animals to make probabilistic estimations in the presence of uncertainty. We
build a decision-making model with two stages: Bayesian estimation and
probabilistic matching. In the first stage, each animal makes a Bayesian
estimation of which behavior is best to perform taking into account personal
information about the environment and social information collected by observing
the behaviors of other animals. In the probability matching stage, each animal
chooses a behavior with a probability equal to the Bayesian-estimated
probability that this behavior is the most appropriate one. This model derives
very simple rules of interaction in animal collectives that depend only on two
types of reliability parameters, one that each animal assigns to the other
animals and another given by the quality of the non-social information. We test
our model by obtaining theoretically a rich set of observed collective patterns
of decisions in three-spined sticklebacks, Gasterosteus aculeatus, a shoaling
fish species. The quantitative link shown between probabilistic estimation and
collective rules of behavior allows a better contact with other fields such as
foraging, mate selection, neurobiology and psychology, and gives predictions
for experiments directly testing the relationship between estimation and
collective behavior.
","[{""version"":""v1"",""created"":""Thu, 5 May 2011 16:32:59 GMT""},{""version"":""v2"",""created"":""Mon, 7 Nov 2011 13:59:44 GMT""}]","2011-11-22"
"1105.1118","Rui Vigelis Facundo","Rui F. Vigelis and Charles C. Cavalcante","On $\varphi$-families of probability distributions",,,,,"math.PR","http://creativecommons.org/licenses/by-nc-sa/3.0/","  We generalize the exponential family of probability distributions. In our
approach, the exponential function is replaced by a $\varphi$-function,
resulting in a $\varphi$-family of probability distributions. We show how
$\varphi$-families are constructed. In a $\varphi$-family, the analogue of the
cumulant-generating function is a normalizing function. We define the
$\varphi$-divergence as the Bregman divergence associated to the normalizing
function, providing a generalization of the Kullback-Leibler divergence. A
formula for the $\varphi$-divergence where the $\varphi$-function is the
Kaniadakis' $\kappa$-exponential function is derived.
","[{""version"":""v1"",""created"":""Thu, 5 May 2011 16:33:13 GMT""},{""version"":""v2"",""created"":""Fri, 6 May 2011 12:37:24 GMT""},{""version"":""v3"",""created"":""Wed, 11 Sep 2013 16:55:50 GMT""}]","2013-09-12"
"1105.1119","Marcio Catelan","M. Catelan (1), D. Minniti (1), P. W. Lucas (2), J. Alonso-Garcia (1),
  R. Angeloni (1), J. C. Beamin (1), C. Bonatto (3), J. Borissova (4), C.
  Contreras (1,2), N. Cross (5), I. Dekany (1), J. P. Emerson (6), S.
  Eyheramendy (1), D. Geisler (7), E. Gonzalez-Solares (8), K. G. Helminiak
  (1), M. Hempel (1), M. J. Irwin (8), V. D. Ivanov (9), A. Jordan (1), E.
  Kerins (10), R. Kurtev (4), F. Mauro (7), C. Moni Bidin (7), C. Navarrete
  (1), P. Perez (1,11), K. Pichara (1), M. Read (5), M. Rejkuba (12), R. K.
  Saito (1), S. E. Sale (1,4), I. Toledo (1) ((1) PUC-Chile, (2) Hertfordshire,
  UK, (3) UFRGS, Brazil, (4) Valparaiso, Chile, (5) Edinburgh, UK, (6) Queen
  Mary, London, UK, (7) Concepcion, Chile, (8) Cambridge, UK, (9) ESO-Chile,
  (10) Manchester, UK, (11) Univ. Chile, Chile, (12) ESO-Garching)","The Vista Variables in the Via Lactea (VVV) ESO Public Survey: Current
  Status and First Results","25 pages, 18 figures. To appear in the Carnegie Observatories
  Astrophysics Series, Volume 5",,,,"astro-ph.GA astro-ph.IM astro-ph.SR","http://arxiv.org/licenses/nonexclusive-distrib/1.0/","  Vista Variables in the Via Lactea (VVV) is an ESO Public Survey that is
performing a variability survey of the Galactic bulge and part of the inner
disk using ESO's Visible and Infrared Survey Telescope for Astronomy (VISTA).
The survey covers 520 deg^2 of sky area in the ZYJHK_S filters, for a total
observing time of 1929 hours, including ~ 10^9 point sources and an estimated ~
10^6 variable stars. Here we describe the current status of the VVV Survey, in
addition to a variety of new results based on VVV data, including light curves
for variable stars, newly discovered globular clusters, open clusters, and
associations. A set of reddening-free indices based on the ZYJHK_S system is
also introduced. Finally, we provide an overview of the VVV Templates Project,
whose main goal is to derive well-defined light curve templates in the near-IR,
for the automated classification of VVV light curves.
","[{""version"":""v1"",""created"":""Thu, 5 May 2011 16:38:28 GMT""},{""version"":""v2"",""created"":""Tue, 7 Jun 2011 17:12:31 GMT""}]","2011-06-08"
"1105.1120","Karam Bahari","K. Karami, K. Bahari","The effect of twisted magnetic field on the resonant absorption of MHD
  waves in coronal loops","18 pages, 9 figures","Solar Phys. 263 (2010) 87","10.1007/s11207-010-9537-0",,"astro-ph.SR","http://arxiv.org/licenses/nonexclusive-distrib/1.0/","  The standing quasi modes in a cylindrical incompressible flux tube with
magnetic twist that undergoes a radial density structuring is considered in
ideal magnetohydrodynamics (MHD). The radial structuring is assumed to be a
linearly varying density profile. Using the relevant connection formulae, the
dispersion relation for the MHD waves is derived and solved numerically to
obtain both the frequencies and damping rates of the fundamental and
first-overtone modes of both the kink (m=1) and fluting (m=2,3) waves. It was
found that a magnetic twist will increase the frequencies, damping rates and
the ratio of the oscillation frequency to the damping rate of these modes. The
period ratio P_1/P_2 of the fundamental and its first-overtone surface waves
for kink (m=1) and fluting (m=2,3) modes is lower than 2 (the value for an
untwisted loop) in the presence of twisted magnetic field. For the kink modes,
particularly, the magnetic twists B_{\phi}/B_z=0.0065 and 0.0255 can achieve
deviations from 2 of the same order of magnitude as in the observations.
Furthermore, for the fundamental kink body waves, the frequency bandwidth
increases with increasing the magnetic twist.
","[{""version"":""v1"",""created"":""Thu, 5 May 2011 16:40:04 GMT""}]","2011-05-06"
"1105.1121","Jan-Frederik Pietschmann","Luis A. Caffarelli, Peter A. Markowich, Jan-Frederik Pietschmann","On a price formation free boundary model by Lasry & Lions",,,,,"math.AP","http://arxiv.org/licenses/nonexclusive-distrib/1.0/","  We discuss global existence and asymptotic behaviour of a price formation
free boundary model introduced by Lasry & Lions in 2007. Our results are based
on a construction which transforms the problem into the heat equation with
specially prepared initial datum. The key point is that the free boundary
present in the original problem becomes the zero level set of this solution.
Using the properties of the heat operator we can show global existence,
regularity and asymptotic results of the free boundary.
","[{""version"":""v1"",""created"":""Thu, 5 May 2011 16:48:11 GMT""}]","2011-05-06"
"1105.1122","Vincenzo F. Cardone Dr","V.F. Cardone, M. Perillo, S. Capozziello","Systematics in the Gamma Ray Bursts Hubble diagram","14 pages, 1 figure, 6 tables",,"10.1111/j.1365-2966.2011.19228.x",,"astro-ph.CO astro-ph.HE","http://arxiv.org/licenses/nonexclusive-distrib/1.0/","  Thanks to their enormous energy release which allows to detect them up to
very high redshift, Gamma Rays Bursts (GRBs) have recently attracted a lot of
interest to probe the Hubble diagram (HD) deep into the matter dominated era
and hence complement Type Ia Supernoave (SNeIa). However, lacking a local GRBs
sample, calibrating the scaling relations proposed as an equivalent to the
Phillips law to standardize GRBs is not an easy task because of the need to
estimate the GRBs luminosity distance in a model independent way. We consider
here three different calibration methods based on the use of a fiducial
$\Lambda$CDM model, on cosmographic parameters and on the local regression on
SNeIa. We find that the calibration coefficients and the intrinsic scatter do
not significantly depend on the adopted calibration procedure. We then
investigate the evolution of these parameters with the redshift finding no
statistically motivated improvement in the likelihood so that the no evolution
assumption is actually a well founded working hypothesis. Under this
assumption, we then consider possible systematics effects on the HDs introduced
by the calibration method, the averaging procedure and the homogeneity of the
sample arguing against any significant bias. We nevertheless stress that a
larger GRBs sample with smaller uncertainties is needed to definitely conclude
that the different systematics considered here have indeed a negligible impact
on the HDs thus strengthening the use of GRBs as cosmological tools.
","[{""version"":""v1"",""created"":""Thu, 5 May 2011 17:06:11 GMT""}]","2015-05-28"
"1105.1123","Volodymyr Mazorchuk","Volodymyr Mazorchuk and Kaiming Zhao","Characterization of simple highest weight modules",,"Can. Math. Bull. 56 (2013) 606-614","10.4153/CMB-2011-199-5",,"math.RT","http://arxiv.org/licenses/nonexclusive-distrib/1.0/","  We prove that for simple complex finite dimensional Lie algebras, affine
Kac-Moody Lie algebras, the Virasoro algebra and the Heisenberg-Virasoro
algebra, simple highest weight modules are characterized by the property that
all positive root elements act on these modules locally nilpotently. We also
show that this is not the case for higher rank Virasoro and for Heisenberg
algebras.
","[{""version"":""v1"",""created"":""Thu, 5 May 2011 17:26:28 GMT""},{""version"":""v2"",""created"":""Mon, 28 Nov 2011 17:45:36 GMT""}]","2019-08-15"
"1105.1124","Elisabeth Werner M","Elisabeth M. Werner","R\'enyi Divergence and $L_p$-affine surface area for convex bodies",,,,,"math.FA","http://arxiv.org/licenses/nonexclusive-distrib/1.0/","  We show that the fundamental objects of the $L_p$-Brunn-Minkowski theory,
namely the $L_p$-affine surface areas for a convex body, are closely related to
information theory: they are exponentials of R\'enyi divergences of the cone
measures of a convex body and its polar.
  We give geometric interpretations for all R\'enyi divergences $D_\alpha$, not
just for the previously treated special case of relative entropy which is the
case $\alpha =1$. Now, no symmetry assumptions are needed and, if at all, only
very weak regularity assumptions are required.
  Previously, the relative entropies appeared only after performing second
order expansions of certain expressions. Now already first order expansions
makes them appear. Thus, in the new approach we detect ""faster"" details about
the boundary of a convex body.
","[{""version"":""v1"",""created"":""Thu, 5 May 2011 17:31:54 GMT""}]","2011-05-06"
"1105.1125","Andrey Chaves","Andrey Chaves, L. Covaci, Kh. Yu. Rakhimov, G. A. Farias, and F. M.
  Peeters","Wave packet dynamics and valley filter in strained graphene","13 pages, 10 figures","Phys. Rev. B 82, 205430 (2010)","10.1103/PhysRevB.82.205430",,"cond-mat.mes-hall","http://arxiv.org/licenses/nonexclusive-distrib/1.0/","  The time evolution of a wavepacket in strained graphene is studied within the
tight-binding model and continuum model. The effect of an external magnetic
field, as well as a strain-induced pseudo-magnetic field, on the wave packet
trajectories and zitterbewegung are analyzed. Combining the effects of strain
with those of an external magnetic field produces an effective magnetic field
which is large in one of the Dirac cones, but can be practically zero in the
other. We construct an efficient valley filter, where for a propagating
incoming wave packet consisting of momenta around the K and K' Dirac points,
the outgoing wave packet exhibits momenta in only one of these Dirac points,
while the components of the packet that belong to the other Dirac point are
reflected due to the Lorentz force. We also found that the zitterbewegung is
permanent in time in the presence of either external or strain-induced magnetic
fields, but when both the external and strain-induced magnetic fields are
present, the zitterbewegung is transient in one of the Dirac cones, whereas in
the other cone the wave packet exhibits permanent spatial oscillations.
","[{""version"":""v1"",""created"":""Thu, 5 May 2011 17:36:42 GMT""}]","2011-05-06"
"1105.1126","Judith G. Cohen","Judith G. Cohen, Norbert Christlieb, Andrew McWilliam, Stephen
  Shectman and Ian Thompson","A Status Report on the 0Z Project","To appear in the Carnegie Observatories Astrophysics Series, Volume 5",,,,"astro-ph.SR astro-ph.GA","http://arxiv.org/licenses/nonexclusive-distrib/1.0/","  We present an update on the status of the 0Z Survey, an effort to datamine
the Hamburg/ESO Survey to find and study in detail a large sample of extremely
metal-poor Galactic halo field stars with [Fe/H] < -3 dex. After searching
1,565 moderate resolution spectra of candidates selected from the HES, we have
acquired high resolution spectra of 103 of the most metal-poor of them.
Detailed abundance analyses have been performed for all these stars. This has
resulted in the discovery of 18 new stars below [Fe/H] -3.5 dex and 57 below
-3.0 dex. Some results are presented regarding our search for outliers in
chemical abundances of particular species among the sample of 103 stars.
Ignoring C and N, about 15% of the sample are ""abnormal"" in some way. Our plans
to complete this project and write the final set of papers are described.
","[{""version"":""v1"",""created"":""Thu, 5 May 2011 17:37:27 GMT""}]","2011-05-06"
"1105.1127","Bakir Farhi","Bakir Farhi","An explicit formula generating the non-Fibonacci numbers","5 pages",,,,"math.NT","http://arxiv.org/licenses/nonexclusive-distrib/1.0/","  We show among others that the formula: $$ \lfloor n +
\log_{\Phi}\{\sqrt{5}(\log_{\Phi}(\sqrt{5}n) + n) -5 + \frac{3}{n}\} - 2
\rfloor (n \geq 2), $$ (where $\Phi$ denotes the golden ratio and $\lfloor
\rfloor$ denotes the integer part) generates the non-Fibonacci numbers.
","[{""version"":""v1"",""created"":""Thu, 5 May 2011 17:41:02 GMT""},{""version"":""v2"",""created"":""Tue, 10 May 2011 11:19:29 GMT""}]","2011-05-11"
"1105.1128","Chris Carilli","C.L. Carilli (NRAO), F. Walter, D. Riechers, R. Wang, E. Daddi, J.
  Wagg, F. Bertoldi, K. Menten","Radio studies of galaxy formation: Dense Gas History of the Universe","aastex format, 21figures, Review for the Astronomische Gesellschaft
  to appear in Astronomische Nachrichten",,"10.1002/9783527644384.ch8",,"astro-ph.CO","http://arxiv.org/licenses/nonexclusive-distrib/1.0/","  Line and continuum studies at centimeter through submillimeter wavelengths
address probe deep into the earliest, most active and dust obscured phases of
galaxy formation, and reveal the molecular and cool atomic gas. We summarize
the techniques of radio astronomy to perform these studies, then review the
progress on radio studies of galaxy formation. The dominant work over the last
decade has focused on massive, luminous starburst galaxies (submm galaxies and
AGN host galaxies). The far infrared luminosities are ~ 1e13 Lsun, implying
star formation rates, SFR > 1e3 Msun/year. Molecular gas reservoirs are found
with masses: M(H_2) > 1e10 (alpha/0.8}) Msun. The CO excitation in these
luminous systems is much higher than in low redshift spiral galaxies. Imaging
of the gas distribution and dynamics suggests strongly interacting and merging
galaxies, indicating gravitationally induced, short duration (~ 1e7 year)
starbursts. These systems correspond to a major star formation episode in
massive galaxies in proto-clusters at intermediate to high redshift. Recently,
radio observations have probed the more typical star forming galaxy population
(SFR ~ 100 Msun/year), during the peak epoch of Universal star formation (z ~
1.5 to 2.5). These observations reveal massive gas reservoirs without
hyper-starbursts, and show that active star formation occurs over a wide range
in galaxy stellar mass. The conditions in this gas are comparable to those
found in the Milky Way disk. A key result is that the peak epoch of star
formation in the Universe also corresponds to an epoch when the baryon content
of star forming galaxies was dominated by molecular gas, not stars. We consider
the possibility of tracing out the dense gas history of the Universe, and
perform initial, admittedly gross, calculations. ABRIDGED
","[{""version"":""v1"",""created"":""Thu, 5 May 2011 17:41:05 GMT""}]","2015-06-11"
