"1105.1261","Robin Scheibler","Robin Scheibler, Paul Hurley, Amina Chebira","Pruned Continuous Haar Transform of 2D Polygonal Patterns with
  Application to VLSI Layouts","4 pages, 5 figures, 1 algorithm","R. Scheibler, P. Hurley, and A. Chebira, ""Pruned Continuous Haar
  Transform of 2D Polygonal Patterns with Application to VLSI Layouts,"" Proc.
  of the 2010 IRAST Int. Cong. on Comp. App. and Computational Sci. (CACS
  2010), pp. 984--987, 2010",,,"cs.CE cs.CG cs.DS","http://arxiv.org/licenses/nonexclusive-distrib/1.0/","  We introduce an algorithm for the efficient computation of the continuous
Haar transform of 2D patterns that can be described by polygons. These patterns
are ubiquitous in VLSI processes where they are used to describe design and
mask layouts. There, speed is of paramount importance due to the magnitude of
the problems to be solved and hence very fast algorithms are needed. We show
that by techniques borrowed from computational geometry we are not only able to
compute the continuous Haar transform directly, but also to do it quickly. This
is achieved by massively pruning the transform tree and thus dramatically
decreasing the computational load when the number of vertices is small, as is
the case for VLSI layouts. We call this new algorithm the pruned continuous
Haar transform. We implement this algorithm and show that for patterns found in
VLSI layouts the proposed algorithm was in the worst case as fast as its
discrete counterpart and up to 12 times faster.
","[{""version"":""v1"",""created"":""Fri, 6 May 2011 10:46:32 GMT""}]","2011-05-09"
"1105.1262","Clara Gonzalez-Santander","C. Gonz\'alez-Santander, F. Dom\'inguez-Adame and R. A. R\""omer","Excitonic Aharonov-Bohm effect in a two-dimensional quantum ring","7 pages, 7 figures","Phys. Rev. B 84, 235103 (2011)","10.1103/PhysRevB.84.235103",,"cond-mat.mes-hall cond-mat.str-el","http://arxiv.org/licenses/nonexclusive-distrib/1.0/","  We study theoretically the optical properties of an exciton in a
two-dimensional ring threaded by a magnetic flux. We model the quantum ring by
a confining potential that can be continuously tuned from strictly
one-dimensional to truly two-dimensional with finite radius-to-width ratio. We
present an analytic solution of the problem when the electron-hole interaction
is short-ranged. The oscillatory dependence of the oscillator strength as a
function of the magnetic flux is attributed to the Aharonov-Bohm effect. The
amplitude of the oscillations changes upon increasing the width of the quantum
ring. We find that the Aharonov-Bohm oscillations of the ground state of the
exciton decrease with increasing the width, but remarkably the amplitude
remains finite down to radius-to-width ratios less than unity. We attribute
this resilience of the excitonic oscillations to the non-simply connectedness
of our chosen confinement potential.
","[{""version"":""v1"",""created"":""Fri, 6 May 2011 10:49:29 GMT""},{""version"":""v2"",""created"":""Thu, 14 Jul 2011 10:09:32 GMT""},{""version"":""v3"",""created"":""Thu, 1 Dec 2011 21:19:55 GMT""}]","2011-12-05"
"1105.1263","Emil Lundh","Emil Lundh","Mott insulator dynamics","7 pages, 11 color figures. Updated in response to referee report","Phys. Rev. A 84, 033603 (2011)","10.1103/PhysRevA.84.033603",,"cond-mat.quant-gas","http://arxiv.org/licenses/nonexclusive-distrib/1.0/","  The hydrodynamics of a lattice Bose gas in a time-dependent external
potential is studied in a mean-field approximation. The conditions under which
a Mott insulating region can melt, and the local density adjust to the new
potential, are determined. In the case of a suddenly switched potential, it is
found that the Mott insulator stays insulating and the density will not adjust
if the switch is too abrupt. This comes about because too rapid currents result
in Bloch oscillation-type current reversals. For a stirrer moved through a Mott
insulating cloud, it is seen that only if the stirrer starts in a superfluid
region and the velocity is comparable to the time scale set by the tunneling,
will the Mott insulator be affected.
","[{""version"":""v1"",""created"":""Fri, 6 May 2011 10:55:04 GMT""},{""version"":""v2"",""created"":""Mon, 13 Jun 2011 17:14:57 GMT""}]","2011-09-12"
"1105.1264","Sergei Duzhin","S. Duzhin, M. Shkolnikov","Bipartite knots","8 pages, 8 figures, some typos corrected, some words added",,,,"math.GT","http://arxiv.org/licenses/nonexclusive-distrib/1.0/","  We give a solution to a part of Problem 1.60 in Kirby's list of open problems
in topology thus answering in the positive the 1987 conjecture by J.Przytycki
concerning the existence of knots without matched diagrams.
","[{""version"":""v1"",""created"":""Fri, 6 May 2011 11:05:39 GMT""},{""version"":""v2"",""created"":""Sat, 21 May 2011 19:12:13 GMT""}]","2015-03-19"
"1105.1265","Jochen Greiner","J. Greiner, K. Mannheim, F. Aharonian, M. Ajello, L. G. Balasz, G.
  Barbiellini, R. Bellazzini, S. Bishop, G. S. Bisnovatij-Kogan, S. Boggs, A.
  Bykov, G. DiCocco, R. Diehl, D. Els\""asser, S. Foley, C. Fransson, N.
  Gehrels, L. Hanlon, D. Hartmann, W. Hermsen, W. Hillebrandt, R. Hudec, A.
  Iyudin, J. Jose, M. Kadler, G. Kanbach, W. Klamra, J. Kiener, S. Klose, I.
  Kreykenbohm, L. M. Kuiper, N. Kylafis, C. Labanti, K. Langanke, N. Langer, S.
  Larsson, B. Leibundgut, U. Laux, F. Longo, K. Maeda, R. Marcinkowski, M.
  Marisaldi, B. McBreen, S. McBreen, A. Meszaros, K. Nomoto, M. Pearce, A.
  Peer, E. Pian, N. Prantzos, G. Raffelt, O. Reimer, W. Rhode, F. Ryde, C.
  Schmidt, J. Silk, B. M. Shustov, A. Strong, N. Tanvir, F.-K. Thielemann, O.
  Tibolla, D. Tierney, J. Tr\""umper, D. A. Varshalovich, J. Wilms, G. Wrochna,
  A. Zdziarski, A. Zoglauer","GRIPS - Gamma-Ray Imaging, Polarimetry and Spectroscopy","to appear in Exp. Astron., special vol. on M3-Call of ESA's Cosmic
  Vision 2010; 25 p., 25 figs; see also www.grips-mission.eu",,"10.1007/s10686-011-9255-0",,"astro-ph.HE","http://arxiv.org/licenses/nonexclusive-distrib/1.0/","  We propose to perform a continuously scanning all-sky survey from 200 keV to
80 MeV achieving a sensitivity which is better by a factor of 40 or more
compared to the previous missions in this energy range. The Gamma-Ray Imaging,
Polarimetry and Spectroscopy (GRIPS) mission addresses fundamental questions in
ESA's Cosmic Vision plan. Among the major themes of the strategic plan, GRIPS
has its focus on the evolving, violent Universe, exploring a unique energy
window. We propose to investigate $\gamma$-ray bursts and blazars, the
mechanisms behind supernova explosions, nucleosynthesis and spallation, the
enigmatic origin of positrons in our Galaxy, and the nature of radiation
processes and particle acceleration in extreme cosmic sources including pulsars
and magnetars. The natural energy scale for these non-thermal processes is of
the order of MeV. Although they can be partially and indirectly studied using
other methods, only the proposed GRIPS measurements will provide direct access
to their primary photons. GRIPS will be a driver for the study of transient
sources in the era of neutrino and gravitational wave observatories such as
IceCUBE and LISA, establishing a new type of diagnostics in relativistic and
nuclear astrophysics. This will support extrapolations to investigate star
formation, galaxy evolution, and black hole formation at high redshifts.
","[{""version"":""v1"",""created"":""Fri, 6 May 2011 11:19:56 GMT""}]","2015-05-28"
"1105.1266","Amelia Carolina Sparavigna","Amelia Carolina Sparavigna","Fernando Sanford and the ""Kirlian effect""",,,,,"physics.pop-ph","http://arxiv.org/licenses/nonexclusive-distrib/1.0/","  In 1894 Fernando Sanford discussed in a paper published by the Physical
Review an electric photography technique, which he developed starting from
1891. The images that he published in the paper are clearly showing some
fringes about the objects he photographed. Several years after, the fringes
appearing in the electric photography have been recognized as the ""Kirlian
effect"". Unlike Kirlian, Sanford did his best to reduce these fringes,
improving the device but losing the ""Sanford effect"".
","[{""version"":""v1"",""created"":""Fri, 6 May 2011 11:24:40 GMT""}]","2011-05-09"
"1105.1267","Stefan Gerhold","Peter Friz, Stefan Gerhold","Don't stay local - extrapolation analytics for Dupire's local volatility",,,,,"q-fin.PR math.PR","http://arxiv.org/licenses/nonexclusive-distrib/1.0/","  A robust implementation of a Dupire type local volatility model is an
important issue for every option trading floor. Typically, this (inverse)
problem is solved in a two step procedure : (i) a smooth parametrization of the
implied volatility surface; (ii) computation of the local volatility based on
the resulting call price surface. Point (i), and in particular how to
extrapolate the implied volatility in extreme strike regimes not seen in the
market, has been the subject of numerous articles, starting with Lee (Math.
Finance, 2004). In the present paper we give direct analytic insights into the
asymptotic behavior of local volatility at extreme strikes.
","[{""version"":""v1"",""created"":""Fri, 6 May 2011 11:44:28 GMT""}]","2011-05-09"
"1105.1268","Alexander Nindos","A. Nindos, C.E. Alissandrakis, A. Hillaris, P. Preka-Papadema","On the relationship of shock waves to flares and coronal mass ejections","13 pages, 14 figures. ""Astronomy and Astrophysics"", in press",,"10.1051/0004-6361/201116799",,"astro-ph.SR","http://arxiv.org/licenses/nonexclusive-distrib/1.0/","  Context: Metric type II bursts are the most direct diagnostic of shock waves
in the solar corona.
  Aims: There are two main competing views about the origin of coronal shocks:
that they originate in either blast waves ignited by the pressure pulse of a
flare or piston-driven shocks due to coronal mass ejections (CMEs). We studied
three well-observed type II bursts in an attempt to place tighter constraints
on their origins.
  Methods: The type II bursts were observed by the ARTEMIS radio spectrograph
and imaged by the Nan\c{c}ay Radioheliograph (NRH) at least at two frequencies.
To take advantage of projection effects, we selected events that occurred away
from disk center.
  Results: In all events, both flares and CMEs were observed. In the first
event, the speed of the shock was about 4200 km/s, while the speed of the CME
was about 850 km/s. This discrepancy ruled out the CME as the primary shock
driver. The CME may have played a role in the ignition of another shock that
occurred just after the high speed one. A CME driver was excluded from the
second event as well because the CMEs that appeared in the coronagraph data
were not synchronized with the type II burst. In the third event, the
kinematics of the CME which was determined by combining EUV and white light
data was broadly consistent with the kinematics of the type II burst, and,
therefore, the shock was probably CME-driven.
  Conclusions: Our study demonstrates the diversity of conditions that may lead
to the generation of coronal shocks.
","[{""version"":""v1"",""created"":""Fri, 6 May 2011 12:08:07 GMT""}]","2015-05-28"
"1105.1269","Jing Ping Wang","Alexander V. Mikhailov and Jing Ping Wang","A new recursion operator for the Viallet equation",,"Physics Letters A 375: 3960--3963, 2011","10.1016/j.physleta.2011.09.018",,"nlin.SI","http://arxiv.org/licenses/nonexclusive-distrib/1.0/","  We present a new recursion and Hamiltonian operators for the Viallet
equation. This new recursion operator and the recursion operator found in
[Theoretical and Mathematical Physics, 167:421--443 (2011), arXiv:1004.5346]
satisfy the elliptic curve equation associated with the Viallet equation.
","[{""version"":""v1"",""created"":""Fri, 6 May 2011 12:11:49 GMT""}]","2015-05-28"
"1105.1270","Tobias Fritz","Valerio Capraro, Tobias Fritz","On the axiomatization of convex subsets of Banach spaces","8 pages, 1 figure. v3: added post-publication note on missing
  reference with partly overlapping material","Proc. Amer. Math. Soc. 141 (2013), 2127-2135","10.1090/S0002-9939-2013-11465-6",,"math.MG math.FA math.OA","http://arxiv.org/licenses/nonexclusive-distrib/1.0/","  We prove that any convex-like structure in the sense of Nate Brown is
affinely and isometrically isomorphic to a closed convex subset of a Banach
space. This answers an open question of Brown. As an intermediate step, we
identify Brown's algebraic axioms as equivalent to certain well-known axioms of
abstract convexity. We conclude with a new characterization of convex subsets
of Banach spaces.
","[{""version"":""v1"",""created"":""Fri, 6 May 2011 12:24:03 GMT""},{""version"":""v2"",""created"":""Tue, 27 Sep 2011 07:29:17 GMT""},{""version"":""v3"",""created"":""Tue, 20 Oct 2015 08:37:47 GMT""}]","2015-10-21"
"1105.1271","Frank Wagner","F.W. Wagner, F. Sohl, T. R\""uckriemen, H. Rauer","Physical State of the Deep Interior of the CoRoT-7b Exoplanet","4 pages, 3 figures. IAU 276 Proceedings","IAU 276 Proceedings: The Astrophysics of Planetary Systems:
  Formation, Structure, and Dynamical Evolution; 2011","10.1017/S1743921311020175",,"astro-ph.EP","http://arxiv.org/licenses/nonexclusive-distrib/1.0/","  The present study takes the CoRoT-7b exoplanet as an analogue for massive
terrestrial planets to investigate conditions, under which intrinsic magnetic
fields could be sustained in liquid cores. We examine the effect of
depth-dependent transport parameters (e.g., activation volume of mantle rock)
on a planet's thermal structure and the related heat flux across the core
mantle boundary. For terrestrial planets more massive than the Earth, our
calculations suggest that a substantial part of the lowermost mantle is in a
sluggish convective regime, primarily due to pressure effects on viscosity.
Hence, we find substantially higher core temperatures than previously reported
from parameterized convection models. We also discuss the effect of melting
point depression in the presence of impurities (e.g., sulfur) in iron-rich
cores and compare corresponding melting relations to the calculated thermal
structure. Since impurity effects become less important at the elevated
pressure and temperature conditions prevalent in the deep interior of CoRoT-7b,
iron-rich cores are likely solid, implying that a self-sustained magnetic field
would be absent.
","[{""version"":""v1"",""created"":""Fri, 6 May 2011 12:35:42 GMT""}]","2015-05-28"
"1105.1272","Anthony Metcalfe Dr","Anthony Metcalfe","Universality properties of Gelfand-Tsetlin patterns","32 pages",,,,"math.PR","http://arxiv.org/licenses/nonexclusive-distrib/1.0/","  A standard Gelfand-Tsetlin pattern of depth $n$ is a configuration of
particles in $\{1,...,n\} \times \R$. For each $r \in \{1,...,n\}$, $\{r\}
\times \R$ is referred to as the $r^\text{th}$ level of the pattern. A standard
Gelfand-Tsetlin pattern has exactly $r$ particles on each level $r$, and
particles on adjacent levels satisfy an interlacing constraint.
  Probability distributions on the set of Gelfand-Tsetlin patterns of depth $n$
arise naturally as distributions of eigenvalue minor processes of random
Hermitian matrices of size $n$. We consider such probability spaces when the
distribution of the matrix is unitarily invariant, prove a determinantal
structure for a broad subclass, and calculate the correlation kernel.
  In particular we consider the case where the eigenvalues of the random matrix
are fixed. This corresponds to choosing uniformly from the set of
Gelfand-Tsetlin patterns whose $n^\text{th}$ level is fixed at the eigenvalues
of the matrix. Fixing $q_n \in \{1,...,n\}$, and letting $n \to \infty$ under
the assumption that $\frac{q_n}n \to \a \in (0,1)$ and the empirical
distribution of the particles on the $n^\text{th}$ level converges weakly, the
asymptotic behaviour of particles on level $q_n$ is relevant to free
probability theory. Saddle point analysis is used to identify the set in which
these particles behave asymptotically like a determinantal random point field
with the Sine kernel.
","[{""version"":""v1"",""created"":""Fri, 6 May 2011 12:36:32 GMT""},{""version"":""v2"",""created"":""Sat, 12 Nov 2011 12:05:36 GMT""}]","2011-11-15"
"1105.1273","Guillaume Bossard","Guillaume Bossard and Hermann Nicolai","Counterterms vs. Dualities","15 pages",,"10.1007/JHEP08(2011)074","AEI-2011-026, CPHT-RR039.0511","hep-th","http://arxiv.org/licenses/nonexclusive-distrib/1.0/","  We investigate and clarify the mutual compatibility of the higher order
corrections arising in supergravity and string theory effective actions and the
non-linear duality symmetries of these theories. Starting from a conventional
tree level action leading to duality invariant equations of motion, we show how
to accommodate duality invariant counterterms given as functionals of both
electric and magnetic fields in a perturbative expansion, and to deduce from
them a non-polynomial bona fide action satisfying the Gaillard-Zumino
constraint. There exists a corresponding consistency constraint in the
non-covariant Henneaux-Teitelboim formalism which ensures that one can always
restore diffeomorphism invariance by perturbatively solving this functional
identity. We illustrate how this procedure works for the R^2 \nabla F \nabla F
and F^4 counterterms in Maxwell theory.
","[{""version"":""v1"",""created"":""Fri, 6 May 2011 12:42:19 GMT""},{""version"":""v2"",""created"":""Thu, 4 Aug 2011 12:45:13 GMT""}]","2015-05-28"
"1105.1274","Dmitri Volchenkov","Ph. Blanchard, T. Krueger, D. Volchenkov","Heavy-tailed Distributions In Stochastic Dynamical Models",,,,,"math-ph math.MP nlin.CD physics.data-an physics.soc-ph","http://arxiv.org/licenses/nonexclusive-distrib/1.0/","  Heavy-tailed distributions are found throughout many naturally occurring
phenomena. We have reviewed the models of stochastic dynamics that lead to
heavy-tailed distributions (and power law distributions, in particular)
including the multiplicative noise models, the models subjected to the
Degree-Mass-Action principle (the generalized preferential attachment
principle), the intermittent behavior occurring in complex physical systems
near a bifurcation point, queuing systems, and the models of Self-organized
criticality. Heavy-tailed distributions appear in them as the emergent
phenomena sensitive for coupling rules essential for the entire dynamics.
","[{""version"":""v1"",""created"":""Fri, 6 May 2011 12:50:02 GMT""}]","2011-05-09"
"1105.1275","Daniel Soudry","Daniel Soudry, Ron Meir","Slow dynamics of neuronal excitability under pulse stimulation","This version of the paper is now obselete. See a complete version of
  this paper under ""Conductance-based neuron models and the slow dynamics of
  excitability (2012), Frontiers in Computational Neuroscience""",,,,"q-bio.CB","http://arxiv.org/licenses/nonexclusive-distrib/1.0/","  Neurons fire irregularly on multiple timescales when stimulated with a
periodic pulse train. This raises two questions: Does this irregularity imply
significant intrinsic stochasticity? Can existing neuron models be readily
extended to describe behavior at long timescales? We show here that for
commonly studied neuronal models, dynamics is not chaotic and can only produce
stable and periodic firing patterns. This is done by transforming the neuron
model to an analytically tractable piecewise linear discrete map. Thus we
answer ""yes"" and ""no"" to the above questions, respectively.
","[{""version"":""v1"",""created"":""Fri, 6 May 2011 12:57:55 GMT""},{""version"":""v2"",""created"":""Sun, 19 Feb 2012 22:29:20 GMT""},{""version"":""v3"",""created"":""Fri, 11 Jan 2013 18:43:57 GMT""}]","2013-01-14"
"1105.1276","Mael Guennou","Mael Guennou, Pierre Bouvier, Gaston Garbarino, Jens Kreisel","Structural investigation of LaAlO3 up to 63 GPa","10 pages, 4 figures, 2 tables","J. Phys.: Condens. Matter 23 (2011) 395401","10.1088/0953-8984/23/39/395401",,"cond-mat.mtrl-sci","http://arxiv.org/licenses/nonexclusive-distrib/1.0/","  We report a high-pressure single-crystal synchrotron x-ray diffraction on a
LaAlO3 single crystal. The transition from rhombohedral to cubic at 14.8 GPa is
confirmed by the loss of the superstructure reflections, whose intensity shows
a linear pressure dependence, characteristic of a second-order transition. The
crystal remains cubic up to 63 GPa, the highest pressure reached, which
provides a confirmation over a very large pressure range of the general rules
for the evolution of distortions of perovskites under pressure. We give the
parameters of Birch-Murnaghan equations of state in the low- and high-pressure
phases and discuss the evolution of the bulk modulus.
","[{""version"":""v1"",""created"":""Fri, 6 May 2011 13:00:51 GMT""},{""version"":""v2"",""created"":""Sat, 2 Jul 2011 21:34:48 GMT""}]","2011-09-12"
"1105.1277","Maciej Capinski","Maciej J. Capinski and Carles Simo","Computer Assisted Proof for Normally Hyperbolic Invariant Manifolds","33 pages, 16 figures",,"10.1088/0951-7715/25/7/1997",,"math.DS","http://arxiv.org/licenses/nonexclusive-distrib/1.0/","  We present a topological proof of the existence of a normally hyperbolic
invariant manifold for maps. In our approach we do not require that the map is
a perturbation of some other map for which we already have an invariant
manifold. But a non-rigorous, good enough, guess is necessary. The required
assumptions are formulated in a way which allows for rigorous computer assisted
verification. We apply our method for a driven logistic map, for which
non-rigorous numerical simulation in plain double precision suggests the
existence of a chaotic attractor. We prove that this numerical evidence is
false and that the attractor is a normally hyperbolic invariant curve.
","[{""version"":""v1"",""created"":""Fri, 6 May 2011 13:02:24 GMT""}]","2015-05-28"
"1105.1278","Nils Berglund","Nils Berglund and Damien Landon","Mixed-mode oscillations and interspike interval statistics in the
  stochastic FitzHugh-Nagumo model","36 pages","Nonlinearity 25 (2012) 2303--2335","10.1088/0951-7715/25/8/2303",,"math.PR math.DS q-bio.NC","http://arxiv.org/licenses/nonexclusive-distrib/1.0/","  We study the stochastic FitzHugh-Nagumo equations, modelling the dynamics of
neuronal action potentials, in parameter regimes characterised by mixed-mode
oscillations. The interspike time interval is related to the random number of
small-amplitude oscillations separating consecutive spikes. We prove that this
number has an asymptotically geometric distribution, whose parameter is related
to the principal eigenvalue of a substochastic Markov chain. We provide
rigorous bounds on this eigenvalue in the small-noise regime, and derive an
approximation of its dependence on the system's parameters for a large range of
noise intensities. This yields a precise description of the probability
distribution of observed mixed-mode patterns and interspike intervals.
","[{""version"":""v1"",""created"":""Fri, 6 May 2011 13:06:00 GMT""},{""version"":""v2"",""created"":""Thu, 13 Oct 2011 09:23:29 GMT""},{""version"":""v3"",""created"":""Thu, 5 Apr 2012 15:16:44 GMT""}]","2012-07-10"
"1105.1279","Fanggang Wang","Fanggang Wang and Soung Chang Liew","Wireless MIMO Switching with Network Coding","This manuscript is an extention work of our previous paper ""Wireless
  MIMO Switching"" and also with some results of a talk given in CUHK. The major
  extention is that physical-layer network coding is used and significantly
  improves the throughput performance",,,,"cs.IT cs.NI math.IT","http://arxiv.org/licenses/nonexclusive-distrib/1.0/","  In a generic switching problem, a switching pattern consists of a one-to-one
mapping from a set of inputs to a set of outputs (i.e., a permutation). We
propose and investigate a wireless switching framework in which a multi-antenna
relay is responsible for switching traffic among a set of $N$ stations. We
refer to such a relay as a MIMO switch. With beamforming and linear detection,
the MIMO switch controls which stations are connected to which other stations.
Each beamforming matrix realizes a permutation pattern among the stations. We
refer to the corresponding permutation matrix as a switch matrix. By scheduling
a set of different switch matrices, full connectivity among the stations can be
established. In this paper, we focus on ""fair switching"" in which equal amounts
of traffic are to be delivered for all $N(N-1)$ ordered pairs of stations. In
particular, we investigate how the system throughput can be maximized. In
general, for large $N$ the number of possible switch matrices (i.e.,
permutations) is huge, making the scheduling problem combinatorially
challenging. We show that for the cases of N=4 and 5, only a subset of $N-1$
switch matrices need to be considered in the scheduling problem to achieve good
throughput. We conjecture that this will be the case for large $N$ as well.
This conjecture, if valid, implies that for practical purposes, fair-switching
scheduling is not an intractable problem. We also investigate MIMO switching
with physical-layer network coding in this paper. We find that it can improve
throughput appreciably.
","[{""version"":""v1"",""created"":""Fri, 6 May 2011 13:34:35 GMT""}]","2011-05-09"
