"1105.1225","Toshihiro Kubo","Toshihiro Kubo, Yuki Ichigo, and Yasuhiro Tokura","Phase and amplitude of Aharonov-Bohm oscillations in nonlinear
  three-terminal transport through a double quantum dot","17 pages, 9 figures, accepted for publication in Physical Review B",,"10.1103/PhysRevB.83.235310",,"cond-mat.mes-hall","http://arxiv.org/licenses/nonexclusive-distrib/1.0/","  We study three-terminal linear and nonlinear transport through an
Aharonov-Bohm interferometer containing a double quantum dot using the
nonequilibrium Green's function method. Under the condition that one of the
three terminals is a voltage probe, we show that the linear conductance is
symmetric with respect to the magnetic field (phase symmetry). However, in the
nonlinear transport regime, the phase symmetry is broken. Unlike two-terminal
transport, the phase symmetry is broken even in noninteracting electron
systems. Based on the lowest-order nonlinear conductance coefficient with
respect to the source-drain bias voltage, we discuss the direction in which the
phase shifts with the magnetic field. When the higher harmonic components of
the Aharonov-Bohm oscillations are negligible, the phaseshift is a
monotonically increasing function with respect to the source-drain bias
voltage. To observe the Aharonov-Bohm oscillations with higher visibility, we
need strong coupling between the quantum dots and the voltage probe. However,
this leads to dephasing since the voltage probe acts as a B\""{u}ttiker
dephasing probe. The interplay between such antithetic concepts provides a peak
in the visibility of the Aharonov-Bohm oscillations when the coupling between
the quantum dots and the voltage probe changes.
","[{""version"":""v1"",""created"":""Fri, 6 May 2011 05:18:34 GMT""}]","2015-05-28"
"1105.1226","Gintaras Barisevicius","G. Barisevi\v{c}ius, B. Tamulynas","Multilingual lexicon design tool and database management system for MT",,"Proceedings of the 2nd Baltic Conference on Human Language
  Technologies, April 4-5, 2005, Tallin, Estonia. Tallin : Tallin University of
  Technology, 2005. ISBN 9985894839. p. 219-224",,,"cs.CL","http://arxiv.org/licenses/nonexclusive-distrib/1.0/","  The paper presents the design and development of English-Lithuanian-English
dictionarylexicon tool and lexicon database management system for MT. The
system is oriented to support two main requirements: to be open to the user and
to describe much more attributes of speech parts as a regular dictionary that
are required for the MT. Programming language Java and database management
system MySql is used to implement the designing tool and lexicon database
respectively. This solution allows easily deploying this system in the
Internet. The system is able to run on various OS such as: Windows, Linux, Mac
and other OS where Java Virtual Machine is supported. Since the modern lexicon
database managing system is used, it is not a problem accessing the same
database for several users.
","[{""version"":""v1"",""created"":""Fri, 6 May 2011 05:26:43 GMT""}]","2011-05-09"
"1105.1227","Ismael Rafols","Ismael Rafols, Loet Leydesdorff, Alice O'Hare, Paul Nightingale and
  Andy Stirling","How journal rankings can suppress interdisciplinary research. A
  comparison between Innovation Studies and Business & Management","41 pages, 10 figures","Research Policy, Volume 41, Issue 7, September 2012, Pages
  1262-1282","10.1016/j.wasman.2012.01.017",,"cs.DL physics.soc-ph","http://arxiv.org/licenses/nonexclusive-distrib/1.0/","  This study provides quantitative evidence on how the use of journal rankings
can disadvantage interdisciplinary research in research evaluations. Using
publication and citation data, it compares the degree of interdisciplinarity
and the research performance of a number of Innovation Studies units with that
of leading Business & Management schools in the UK. On the basis of various
mappings and metrics, this study shows that: (i) Innovation Studies units are
consistently more interdisciplinary in their research than Business &
Management schools; (ii) the top journals in the Association of Business
Schools' rankings span a less diverse set of disciplines than lower-ranked
journals; (iii) this results in a more favourable assessment of the performance
of Business & Management schools, which are more disciplinary-focused. This
citation-based analysis challenges the journal ranking-based assessment. In
short, the investigation illustrates how ostensibly 'excellence-based' journal
rankings exhibit a systematic bias in favour of mono-disciplinary research. The
paper concludes with a discussion of implications of these phenomena, in
particular how the bias is likely to affect negatively the evaluation and
associated financial resourcing of interdisciplinary research organisations,
and may result in researchers becoming more compliant with disciplinary
authority over time.
","[{""version"":""v1"",""created"":""Fri, 6 May 2011 05:42:30 GMT""},{""version"":""v2"",""created"":""Thu, 29 Sep 2011 10:54:23 GMT""},{""version"":""v3"",""created"":""Mon, 5 Dec 2011 08:56:00 GMT""},{""version"":""v4"",""created"":""Thu, 19 Apr 2012 15:24:20 GMT""}]","2014-07-02"
"1105.1228","Bernard Di Martino","Bernard Di Martino (SPE), Catherine Giacomoni (SPE), Jean-Martin Paoli
  (SPE), Pierre Simonnet (SPE)","Simulation of a viscous fluid spreading by a bidimensional shallow water
  model",,"Applied Mathematical Modelling 35 (2011) 3387-3395","10.1016/j.apm.2011.01.015",,"math.NA","http://arxiv.org/licenses/nonexclusive-distrib/1.0/","  In this paper we propose a numerical method to solve the Cauchy problem based
on the viscous shallow water equations in an horizontally moving domain. More
precisely, we are interested in a flooding and drying model, used to modelize
the overflow of a river or the intrusion of a tsunami on ground. We use a non
conservative form of the two-dimensional shallow water equations, in eight
velocity formulation and we build a numerical approximation, based on the
Arbitrary Lagrangian Eulerian formulation, in order to compute the solution in
the moving domain.
","[{""version"":""v1"",""created"":""Fri, 6 May 2011 06:35:17 GMT""}]","2011-05-09"
"1105.1229","Bernard Mourrain","Alessandra Bernardi (INRIA Sophia Antipolis), Jerome Brachat (INRIA
  Sophia Antipolis), Pierre Comon, Bernard Mourrain (INRIA Sophia Antipolis)","General Tensor Decomposition, Moment Matrices and Applications","Submitted (2011)","Journal of Symbolic Computation (2012)","10.1016/j.jsc.2012.05.012",,"math.AG","http://arxiv.org/licenses/nonexclusive-distrib/1.0/","  The tensor decomposition addressed in this paper may be seen as a
generalisation of Singular Value Decomposition of matrices. We consider general
multilinear and multihomogeneous tensors. We show how to reduce the problem to
a truncated moment matrix problem and give a new criterion for flat extension
of Quasi-Hankel matrices. We connect this criterion to the commutation
characterisation of border bases. A new algorithm is described. It applies for
general multihomogeneous tensors, extending the approach of J.J. Sylvester to
binary forms. An example illustrates the algebraic operations involved in this
approach and how the decomposition can be recovered from eigenvector
computation.
","[{""version"":""v1"",""created"":""Fri, 6 May 2011 06:35:56 GMT""},{""version"":""v2"",""created"":""Fri, 20 May 2011 13:29:59 GMT""},{""version"":""v3"",""created"":""Thu, 20 Oct 2011 19:41:02 GMT""}]","2012-10-17"
"1105.1230","Eric Gaudron","\'Eric Gaudron (IF), Ga\""el R\'emond (IF)","Th\'eor\`eme des p\'eriodes et degr\'es minimaux d'isog\'enies","38 pages",,,,"math.NT","http://arxiv.org/licenses/nonexclusive-distrib/1.0/","  We give a new, sharpened version of the period theorem of Masser and
W\""ustholz, which is moreover totally explicit. We also present a new
formulation involving all archimedean places. We then derive new bounds for
elliptic isogenies, improving those of Pellarin. The small numerical constants
obtained allow an application to Serre's uniformity problem in the split Cartan
case, thanks to the work of Bilu, Parent and Rebolledo.
","[{""version"":""v1"",""created"":""Fri, 6 May 2011 06:36:31 GMT""}]","2011-05-09"
"1105.1231","Riku Kl\'en","Riku Kl\'en and Matti Vuorinen","Inclusion relations of hyperbolic type metric balls II","22 pages, 5 figures","Publ. Math. Debrecen 83/1-2 (2013), 21-42",,,"math.MG","http://arxiv.org/licenses/nonexclusive-distrib/1.0/","  Inclusion relations of metric balls defined by the hyperbolic, the
quasihyperbolic, the $j$-metric and the chordal metric will be studied. The
hyperbolic metric, the quasihyperbolic metric and the $j$-metric are considered
in the unit ball.
","[{""version"":""v1"",""created"":""Fri, 6 May 2011 06:40:07 GMT""},{""version"":""v2"",""created"":""Mon, 3 Sep 2012 09:53:58 GMT""},{""version"":""v3"",""created"":""Wed, 6 Mar 2013 09:03:18 GMT""}]","2013-09-20"
"1105.1232","Tzonelih Hwang","Song-Kong Chong, Yi-Ping Luo, Tzonelih Hwang","On the ""Security analysis and improvements of arbitrated quantum
  signature schemes""",,,"10.1103/PhysRevA.85.056301",,"quant-ph","http://arxiv.org/licenses/nonexclusive-distrib/1.0/","  Recently, Zou et al. [Phys. Rev. A 82, 042325 (2010)] pointed out that two
arbitrated quantum signature (AQS) schemes are not secure, because an
arbitrator cannot arbitrate the dispute between two users when a receiver
repudiates the integrity of a signature. By using a public board, they try to
propose two AQS schemes to solve the problem. This work shows that the same
security problem may exist in their schemes and also a malicious party can
reveal the other party's secret key without being detected by using the
Trojan-horse attacks. Accordingly, two basic properties of a quantum signature,
i.e. unforgeability and undeniability, may not be satisfied in their scheme.
","[{""version"":""v1"",""created"":""Fri, 6 May 2011 06:42:30 GMT""}]","2013-05-30"
"1105.1233","Zinovy Malkin","Zinovy Malkin","The impact of celestial pole offset modelling on VLBI UT1 Intensive
  results","8 pp., accepted for publication in Journal of Geodesy","Journal of Geodesy, 2011, v. 85, No. 9, pp. 617-622","10.1007/s00190-011-0468-9",,"physics.geo-ph","http://arxiv.org/licenses/nonexclusive-distrib/1.0/","  Very Long Baseline Interferometry (VLBI) Intensive sessions are scheduled to
provide operational Universal Time (UT1) determinations with low latency. UT1
estimates obtained from these observations heavily depend on the model of the
celestial pole motion used during data processing. However, even the most
accurate precession-nutation model, IAU 2000/2006, is not accurate enough to
realize the full potential of VLBI observations. To achieve the highest
possible accuracy in UT1 estimates, a celestial pole offset (CPO), which is the
difference between the actual and modelled precession-nutation angles, should
be applied. Three CPO models are currently available for users. In this paper,
these models have been tested and the differences between UT1 estimates
obtained with those models are investigated. It has been shown that neglecting
CPO modelling during VLBI UT1 Intensive processing causes systematic errors in
UT1 series of up to 20 microarcseconds. It has been also found that using
different CPO models causes the differences in UT1 estimates reaching 10
microarcseconds. Obtained results are applicable to the satellite data
processing as well.
","[{""version"":""v1"",""created"":""Fri, 6 May 2011 06:52:52 GMT""}]","2011-08-23"
"1105.1234","Andreas Baldi","Ghossoon. M. W. Al-Saadoon, Hilal M.Y. Al-Bayatti","A Comparison of Trojan Virus Behavior in Linux and Windows Operating
  Systems","7 Pages","World of Computer Science and Information Technology Journal
  (WCSIT), Vol. 1, No. 3, 56-62, 2011",,,"cs.CR","http://arxiv.org/licenses/nonexclusive-distrib/1.0/","  Trojan virus attacks pose one of the most serious threats to computer
security. A Trojan horse is typically separated into two parts - a server and a
client. It is the client that is cleverly disguised as significant software and
positioned in peer-to-peer file sharing networks, or unauthorized download
websites. The most common means of infection is through email attachments. The
developer of the virus usually uses various spamming techniques in order to
distribute the virus to unsuspecting users. Malware developers use chat
software as another method to spread their Trojan horse viruses such as Yahoo
Messenger and Skype. The objective of this paper is to explore the network
packet information and detect the behavior of Trojan attacks to monitoring
operating systems such as Windows and Linux. This is accomplished by detecting
and analyzing the Trojan infected packet from a network segment -which passes
through email attachment- before attacking a host computer. The results that
have been obtained to detect information and to store infected packets through
monitoring when using the web browser also compare the behaviors of Linux and
Windows using the payload size after implementing the Wireshark sniffer packet
results. Conclusions of the figures analysis from the packet captured data to
analyze the control bit, and check the behavior of the control bits, and the
usability of the operating systems Linux and Windows.
","[{""version"":""v1"",""created"":""Fri, 6 May 2011 06:59:57 GMT""},{""version"":""v2"",""created"":""Tue, 24 May 2011 13:13:31 GMT""}]","2011-05-25"
"1105.1235","Laurens Willems van Beveren","Laurens H. Willems van Beveren, Hans Huebl, Andrea Morello","Radio frequency readout of electrically detected magnetic resonance in
  phosphorus-doped silicon MOSFETs","2 pages, 3 figures","Optoelectronic and Microelectronic Materials and Devices (COMMAD),
  2010 Conference on, 221-222 (2010)","10.1109/COMMAD.2010.5699750",,"cond-mat.mes-hall cond-mat.mtrl-sci","http://arxiv.org/licenses/nonexclusive-distrib/1.0/","  We demonstrate radio frequency (RF) readout of electrically detected magnetic
resonance in phosphorus-doped silicon metal-oxide field-effecttransistors
(MOSFETs), operated at liquid helium temperatures. For the first time, the Si:P
hyperfine lines have been observed using radio frequency reflectometry, which
is promising for high-bandwidth operation and possibly time-resolved detection
of spin resonance in donor-based semiconductor devices. Here we present the
effect of microwave (MW) power and MOSFET biasing conditions on the EDMR
signals.
","[{""version"":""v1"",""created"":""Fri, 6 May 2011 07:08:12 GMT""}]","2011-05-09"
"1105.1236","Kyle Arnold","K. J. Arnold, M. P. Baden, M. D. Barrett","Collective cavity quantum electrodynamics with multiple atomic levels","4 pages, 4 figures","Phys. Rev. A 84, 033843 (2011)","10.1103/PhysRevA.84.033843",,"quant-ph","http://arxiv.org/licenses/nonexclusive-distrib/1.0/","  We study the transmission spectra of ultracold rubidium atoms coupled to a
high-finesse optical cavity. Under weak probing with pi-polarized light, the
linear response of the system is that of a collective spin with multiple levels
coupled to a single mode of the cavity. By varying the atom number, we change
the collective coupling of the system. We observe the change in transmission
spectra when going from a regime where the collective coupling is much smaller
than the separation of the atomic levels to a regime where both are of
comparable size. The observations are in good agreement with a reduced model we
developed for our system.
","[{""version"":""v1"",""created"":""Fri, 6 May 2011 07:31:45 GMT""},{""version"":""v2"",""created"":""Wed, 21 Sep 2011 08:03:47 GMT""}]","2011-09-22"
"1105.1237","Mkhitaryan Vagharsh","M. Ortu\~no, A. M. Somoza, V. V. Mkhitaryan, and M. E. Raikh","Phase diagram of weak-magnetic-field quantum Hall transition quantified
  from classical percolation","12 pages, 13 figures","Phys. Rev. B 84, 165314 (2011)","10.1103/PhysRevB.84.165314",,"cond-mat.dis-nn","http://arxiv.org/licenses/nonexclusive-distrib/1.0/","  We consider magnetotransport in high-mobility 2D electron gas in a
non-quantizing magnetic field. We employ a weakly chiral network model to test
numerically the prediction of the scaling theory that the transition from an
Anderson to a quantum Hall insulator takes place when the Drude value of the
non-diagonal conductivity is equal to 1/2. The weaker is the magnetic field the
harder it is to locate a delocalization transition using quantum simulations.
The main idea of the present study is that the position of the transition does
not change when a strong local inhomogeneity is introduced. Since the strong
inhomogeneity suppresses interference, transport reduces to classical
percolation. We show that the corresponding percolation problem is bond
percolation over two sublattices coupled to each other by random bonds.
Simulation of this percolation allows to access the domain of very weak
magnetic fields. Simulation results confirm the criterion \sigma_{xy}=1/2 for
values \sigma_{xx}\sim 10, where they agree with earlier quantum simulation
results. However for larger \sigma_{xx} we find that the transition boundary is
described by \sigma_{xy} \sigma_{xx}^k with k= 0.5, i.e., the transition takes
place at higher magnetic fields. The strong inhomogeneity limit of
magnetotransport in the presence of a random magnetic field, pertinent to
composite fermions, corresponds to a different percolation problem. In this
limit we find for the delocalization transition boundary \sigma_{xy}
\sigma_{xx}^{0.6}.
","[{""version"":""v1"",""created"":""Fri, 6 May 2011 07:38:33 GMT""}]","2012-01-19"
"1105.1238","Dominic Horsman","Rodney Van Meter, Joe Touch, Dominic Horsman","Recursive quantum repeater networks","14 pages","Progress in Informatics, No. 8, pp.65-79, (2011)","10.2201/NiiPi.2011.8.8",,"quant-ph","http://arxiv.org/licenses/nonexclusive-distrib/1.0/","  Internet-scale quantum repeater networks will be heterogeneous in physical
technology, repeater functionality, and management. The classical control
necessary to use the network will therefore face similar issues as Internet
data transmission. Many scalability and management problems that arose during
the development of the Internet might have been solved in a more uniform
fashion, improving flexibility and reducing redundant engineering effort.
Quantum repeater network development is currently at the stage where we risk
similar duplication when separate systems are combined. We propose a unifying
framework that can be used with all existing repeater designs. We introduce the
notion of a Quantum Recursive Network Architecture, developed from the emerging
classical concept of 'recursive networks', extending recursive mechanisms from
a focus on data forwarding to a more general distributed computing request
framework. Recursion abstracts independent transit networks as single relay
nodes, unifies software layering, and virtualizes the addresses of resources to
improve information hiding and resource management. Our architecture is useful
for building arbitrary distributed states, including fundamental distributed
states such as Bell pairs and GHZ, W, and cluster states.
","[{""version"":""v1"",""created"":""Fri, 6 May 2011 07:48:28 GMT""}]","2023-04-21"
"1105.1239","Anatoly Kochubei","Anatoly N. Kochubei","General Fractional Calculus, Evolution Equations, and Renewal Processes","To appear in Integral Equations and Operator Theory",,,,"math.CA math-ph math.AP math.MP math.PR","http://arxiv.org/licenses/nonexclusive-distrib/1.0/","  We develop a kind of fractional calculus and theory of relaxation and
diffusion equations associated with operators in the time variable, of the form
$(Du)(t)=\frac{d}{dt}\int\limits_0^tk(t-\tau)u(\tau)\,d\tau -k(t)u(0)$ where
$k$ is a nonnegative locally integrable function. Our results are based on the
theory of complete Bernstein functions. The solution of the Cauchy problem for
the relaxation equation $Du=-\lambda u$, $\lambda >0$, proved to be (under some
conditions upon $k$) continuous on $[(0,\infty)$ and completely monotone,
appears in the description by Meerschaert, Nane, and Vellaisamy of the process
$N(E(t))$ as a renewal process. Here $N(t)$ is the Poisson process of intensity
$\lambda$, $E(t)$ is an inverse subordinator.
","[{""version"":""v1"",""created"":""Fri, 6 May 2011 08:24:00 GMT""},{""version"":""v2"",""created"":""Sat, 8 Oct 2011 07:54:53 GMT""}]","2011-10-11"
"1105.1240","Zameddin Ismailov","Zameddin I. Ismailov, Rukiye Ozturk Mert","Selfadjoint Extensions of a Singular Multipoint Differential Operator
  for First Order","10 pages",,,,"math.FA","http://arxiv.org/licenses/nonexclusive-distrib/1.0/","  In this work, firstly in the direct sum of Hilbert spaces of vector-functions
L^2 (H,(-{\infty},a_1)){\Box}L^2 (H,(a_2,b_2)){\Box}L^2 (H,(a_3,+{\infty})),-
{\infty}<a_1<a_2<b_2<a_3<+{\infty} all selfadjoint extensions of the minimal
operator generated by linear singular multipoint symmetric differential
expression l=(l_1,l_2,l_3),l_k=i d/dt+A_k with a selfadjoint operator
coefficient A_k k=1,2,3 in any Hilbert space H, are described in terms of
boundary values. Later structure of the spectrum of these extensions is
investigated.
","[{""version"":""v1"",""created"":""Fri, 6 May 2011 08:25:17 GMT""}]","2011-05-09"
"1105.1241","Niko Marola","Seppo Granlund and Niko Marola","On the problem of unique continuation for the p-Laplace equation",,"Nonlinear Anal. 101 (2014), 89-97","10.1016/j.na.2014.01.020",,"math.AP","http://arxiv.org/licenses/nonexclusive-distrib/1.0/","  We study if two different solutions of the $p$-Laplace equation
$$\nabla\cdot(|\nabla u|^{p-2}\nabla u)=0,$$ where $1<p<\infty$, can coincide
in an open subset of their common domain of definition. We obtain some partial
results on this interesting problem.
","[{""version"":""v1"",""created"":""Fri, 6 May 2011 08:26:00 GMT""},{""version"":""v2"",""created"":""Tue, 31 May 2011 11:04:40 GMT""},{""version"":""v3"",""created"":""Tue, 18 Feb 2014 08:42:18 GMT""}]","2014-02-19"
"1105.1242","Hemant Kowshik","Hemant Kowshik and P. R. Kumar","Optimal Computation of Symmetric Boolean Functions in Collocated
  Networks","submitted to IEEE Transactions on Information Theory",,,,"cs.IT cs.DC cs.NI math.IT","http://arxiv.org/licenses/nonexclusive-distrib/1.0/","  We consider collocated wireless sensor networks, where each node has a
Boolean measurement and the goal is to compute a given Boolean function of
these measurements. We first consider the worst case setting and study optimal
block computation strategies for computing symmetric Boolean functions. We
study three classes of functions: threshold functions, delta functions and
interval functions. We provide exactly optimal strategies for the first two
classes, and a scaling law order-optimal strategy with optimal preconstant for
interval functions. We also extend the results to the case of integer
measurements and certain integer-valued functions. We use lower bounds from
communication complexity theory, and provide an achievable scheme using
information theoretic tools.
  Next, we consider the case where nodes measurements are random and drawn from
independent Bernoulli distributions. We address the problem of optimal function
computation so as to minimize the expected total number of bits that are
transmitted. In the case of computing a single instance of a Boolean threshold
function, we show the surprising result that the optimal order of transmissions
depends in an extremely simple way on the values of previously transmitted
bits, and the ordering of the marginal probabilities of the Boolean variables.
  The approach presented can be generalized to the case where each node has a
block of measurements, though the resulting problem is somewhat harder, and we
conjecture the optimal strategy. We further show how to generalize to a pulse
model of communication. One can also consider the related problem of
approximate computation given a fixed number of bits. In this case, the optimal
strategy is significantly different, and lacks an elegant characterization.
However, for the special case of the parity function, we show that the greedy
strategy is optimal.
","[{""version"":""v1"",""created"":""Fri, 6 May 2011 08:28:41 GMT""}]","2011-05-09"
"1105.1243","Rizos John","J. Rizos (Ioannina U.)","Towards classification of SO(10) heterotic string vacua","4 pages, 2 figures, To appear in the proceedings of 10th Hellenic
  School and Workshops on Elementary Particle Physics and Gravity (CORFU2010),
  Corfu, Greece, 29 Aug - 19 Sep 2010",,"10.1002/prop.201100057",,"hep-ph hep-th","http://arxiv.org/licenses/nonexclusive-distrib/1.0/","  We report some recent progress towards classification of phenomenologically
appealing heterotic string models in the Free Fermionic Formulation. We focus
on a class of Z2xZ2 models with SO(10) space-time gauge symmetry and study
their main phenomenological aspects. We further consider reducing the gauge
symmetry to the Pati-Salam gauge group SU(4)XSU(2)_LxSU(2)_R and impose a
series of phenomenological constraints including the existence of gauge
symmetry breaking Higgs particles and the elimination of exotic fractionally
charged states.
","[{""version"":""v1"",""created"":""Fri, 6 May 2011 08:38:28 GMT""}]","2015-05-28"
