"1105.2303","Damian Ejlli","Alexander D. Dolgov, Damian Ejlli","Relic gravitational waves from light primordial black holes","32 pages, 4 figures; according to the referee comments some
  inaccurate statements are corrected and high frequency detectors of
  gravitational waves are briefly discussed","Phys.Rev.D84:024028,2011","10.1103/PhysRevD.84.024028",,"astro-ph.CO gr-qc","http://arxiv.org/licenses/nonexclusive-distrib/1.0/","  The energy density of relic gravitational waves (GWs) emitted by primordial
black holes (PBHs) is calculated. We estimate the intensity of GWs produced at
quantum and classical scattering of PBHs, the classical graviton emission from
the PBH binaries in the early Universe, and the graviton emission due to PBH
evaporation. If nonrelativistic PBHs dominated the cosmological energy density
prior to their evaporation, the probability of formation of dense clusters of
PBHs and their binaries in such clusters would be significant and the energy
density of the generated gravitational waves in the present day universe could
exceed that produced by other known mechanisms. The intensity of these
gravitational waves would be maximal in the GHz frequency band of the spectrum
or higher and makes their observation very difficult by present detectors but
also gives a rather good possibility to investigate it by present and future
high frequency gravitational waves electromagnetic detectors. However, the low
frequency part of the spectrum in the range $f\sim 0.1-10$ Hz may be detectable
by the planned space interferometers DECIGO/BBO. For sufficiently long duration
of the PBH matter dominated stage the cosmological energy fraction of GWs from
inflation would be noticeably diluted.
","[{""version"":""v1"",""created"":""Wed, 11 May 2011 20:05:14 GMT""},{""version"":""v2"",""created"":""Wed, 18 May 2011 08:45:00 GMT""},{""version"":""v3"",""created"":""Mon, 13 Jun 2011 08:45:56 GMT""}]","2011-07-19"
"1105.2304","Anton Prosekin","S.R. Kelner, A.Yu. Prosekin, F.A. Aharonian","Mechanics and kinetics in the Friedmann-Lemaitre-Robertson-Walker
  space-times",,"Phys.Rev.D84:044016,2011","10.1103/PhysRevD.84.044016",,"gr-qc astro-ph.CO","http://arxiv.org/licenses/nonexclusive-distrib/1.0/","  Using the standard canonical formalism, the equations of mechanics and
kinetics in the Friedmann-Lemaitre-Robertson-Walker (FLRW) space-times in
Cartesian coordinates have been obtained. The transformation law of the
generalized momentum under the shift of the origin of the coordinate system has
been found, and the form invariance of the Hamiltonian function relative to the
shift transformation has been proved. The general solution of the collisionless
Boltzmann equation has been found. In the case of the homogeneous distribution
the solutions of the kinetic equation for several simple, but important for
applications, cases have been obtained.
","[{""version"":""v1"",""created"":""Wed, 11 May 2011 20:10:58 GMT""}]","2011-08-12"
"1105.2306","Samoil Bilenky M.","S. M. Bilenky","Neutrino masses and oscillations","A report at the symposium ""100th anniversary of the discovery of
  atomic nucleus"" March 10-11, 2011, JINR, Dubna, Russia",,,,"hep-ph","http://arxiv.org/licenses/nonexclusive-distrib/1.0/","  A report on neutrino masses, mixing and oscillations, made in Dubna at the
symposium dedicated to 100 years of the Rutherford's discovery of atomic
nucleus, is presented. We start with the hypothesis of neutrino which was
proposed by W. Pauli in December 1930 in order to solve some problems of nuclei
(the problem of spin of $^{7}N_{14}$ and other nuclei and the problem of
continuous $\beta$-spectra). After that we consider the theory of massless
two-component neutrino and first ideas of neutrino oscillations which were put
forward by B. Pontecorvo in Dubna in 1957-58. The present status of neutrino
mixing and oscillations is briefly reviewed. The seesaw mechanism of the
generation of small Majorana neutrino masses is discussed and neutrinoless
double $\beta$-decay of nuclei is considered. A possibility to probe the
Majorana mass mechanism of the $0\nu\beta\beta$-decay is discussed.
","[{""version"":""v1"",""created"":""Wed, 11 May 2011 20:20:00 GMT""},{""version"":""v2"",""created"":""Wed, 25 May 2011 22:03:34 GMT""}]","2011-05-27"
"1105.2307","Tien-Cuong Dinh","Tien-Cuong Dinh, Viet-Anh Nguyen and Nessim Sibony","Entropy for hyperbolic Riemann surface laminations I","27 pages, Part 1. The article is adapted for the use we need in the
  second part of our study of hyperbolic entropy for singular foliations",,,,"math.DS math.CV","http://arxiv.org/licenses/nonexclusive-distrib/1.0/","  We develop a notion of entropy, using hyperbolic time, for laminations by
hyperbolic Riemann surfaces. When the lamination is compact and transversally
smooth, we show that the entropy is finite and the Poincare metric on leaves is
transversally Holder continuous. A notion of metric entropy is also introduced
for harmonic measures.
","[{""version"":""v1"",""created"":""Wed, 11 May 2011 20:21:40 GMT""},{""version"":""v2"",""created"":""Thu, 4 Aug 2011 10:38:19 GMT""}]","2011-08-05"
"1105.2308","Angela Lepidi","Alexander D. Dolgov and Angela Lepidi","Screening of magnetic fields by charged Bose condensate","References added, minor changes in text, results unchanged. Matches
  version published in PLA","Phys.Lett.A375:3188-3190,2011","10.1016/j.physleta.2011.07.017",,"hep-th hep-ph physics.plasm-ph","http://arxiv.org/licenses/nonexclusive-distrib/1.0/","  The space-space component of the photon polarization operator is calculated
in zero frequency limit for a medium with Bose-Einstein condensate (BEC) of
electrically charged particles. It is found that the polarization operator
tends to a finite value at vanishing photon 3-momentum, as it happens in
superconducting media. It means that magnetic fields are exponentially screened
in such a medium analogously to the Debye screening of electric charges. At
non-zero temperature the screened magnetic field oscillates and contains a
contribution which drops only as a power of distance. This phenomenon is
unknown for superconductors, even in BEC phase and can be potentially
observable.
","[{""version"":""v1"",""created"":""Wed, 11 May 2011 20:22:34 GMT""},{""version"":""v2"",""created"":""Fri, 29 Jul 2011 08:33:10 GMT""}]","2011-08-09"
"1105.2309","Xun Shi","X. Shi (1 and 2), P. Schneider (1), B. Joachimi (3) ((1) AIfA Bonn,
  (2) IMPRS for Astronomy and Astrophysics, (3) IfA, Edinburgh)","Relations between three-point configuration space shear and convergence
  statistics","17 pages, 5 figures, submitted to A&A","Astronomy and Astrophysics, Volume 533, 2011, id.A48","10.1051/0004-6361/201117236",,"astro-ph.CO math-ph math.MP","http://arxiv.org/licenses/nonexclusive-distrib/1.0/","  With the growing interest in and ability of using weak lensing studies to
probe the non-Gaussian properties of the matter density field, there is an
increasing need for the study of suitable statistical measures, e.g. shear
three-point statistics. In this paper we establish the relations between the
three-point configuration space shear and convergence statistics, which are an
important missing link between different weak lensing three-point statistics
and provide an alternative way of relating observation and theory. The method
we use also allows us to derive the relations between other two- and
three-point correlation functions. We show the consistency of the relations
obtained with already established results and demonstrate how they can be
evaluated numerically. As a direct application, we use these relations to
formulate the condition for E/B-mode decomposition of lensing three-point
statistics, which is the basis for constructing new three-point statistics
which allow for exact E/B-mode separation. Our work applies also to other
two-dimensional polarization fields such as that of the Cosmic Microwave
Background.
","[{""version"":""v1"",""created"":""Wed, 11 May 2011 20:26:04 GMT""}]","2011-08-29"
"1105.2310","Janusz Adamus","Janusz Adamus and Serge Randriambololona","Tameness of holomorphic closure dimension in a semialgebraic set","Published version","Math. Ann. 355 (2013), 985--1005","10.1007/s00208-012-0808-y",,"math.CV","http://arxiv.org/licenses/nonexclusive-distrib/1.0/","  Given a semianalytic set S in a complex space and a point p in S, there is a
unique smallest complex-analytic germ at p which contains the germ of S, called
the holomorphic closure of S at p. We show that if S is semialgebraic then its
holomorphic closure is a Nash germ, for every p, and S admits a semialgebraic
filtration by the holomorphic closure dimension. As a consequence, every
semialgebraic subset of a complex vector space admits a semialgebraic
stratification into CR manifolds satisfying a strong version of the condition
of the frontier.
","[{""version"":""v1"",""created"":""Wed, 11 May 2011 20:33:41 GMT""},{""version"":""v2"",""created"":""Wed, 18 May 2011 22:00:55 GMT""},{""version"":""v3"",""created"":""Wed, 27 Sep 2017 21:09:17 GMT""}]","2017-09-29"
"1105.2311","Ramji Venkataramanan","Ramji Venkataramanan, S. Sandeep Pradhan","An Achievable Rate Region for the Broadcast Channel with Feedback","To appear in IEEE Transactions on Information Theory. Contains
  example of AWGN Broadcast Channel with noisy feedback","IEEE Transactions on Information Theory, vol. 59, no.10, pp. 6175
  - 6191, Oct. 2013","10.1109/TIT.2013.2268532",,"cs.IT math.IT","http://arxiv.org/licenses/nonexclusive-distrib/1.0/","  A single-letter achievable rate region is proposed for the two-receiver
discrete memoryless broadcast channel with generalized feedback. The coding
strategy involves block-Markov superposition coding, using Marton's coding
scheme for the broadcast channel without feedback as the starting point. If the
message rates in the Marton scheme are too high to be decoded at the end of a
block, each receiver is left with a list of messages compatible with its
output. Resolution information is sent in the following block to enable each
receiver to resolve its list. The key observation is that the resolution
information of the first receiver is correlated with that of the second. This
correlated information is efficiently transmitted via joint source-channel
coding, using ideas similar to the Han-Costa coding scheme. Using the result,
we obtain an achievable rate region for the stochastically degraded AWGN
broadcast channel with noisy feedback from only one receiver. It is shown that
this region is strictly larger than the no-feedback capacity region.
","[{""version"":""v1"",""created"":""Wed, 11 May 2011 20:36:06 GMT""},{""version"":""v2"",""created"":""Sat, 7 Jan 2012 01:33:22 GMT""},{""version"":""v3"",""created"":""Fri, 12 Oct 2012 15:22:54 GMT""},{""version"":""v4"",""created"":""Fri, 19 Jul 2013 15:19:46 GMT""}]","2014-02-10"
"1105.2312","Heedeuk Shin","Heedeuk Shin, Kam Wai Clifford Chan, Hye Jeong Chang, and Robert W.
  Boyd","Quantum spatial superresolution by optical centroid measurements","4 pages, 2 figures","PhysRevLett.107.083603 (2011)","10.1103/PhysRevLett.107.083603",,"quant-ph","http://arxiv.org/licenses/nonexclusive-distrib/1.0/","  Quantum lithography (QL) has been suggested as a means of achieving enhanced
spatial resolution for optical imaging, but its realization has been held back
by the low multi-photon detection rates of recording materials. Recently, an
optical centroid measurement (OCM) procedure was proposed as a way to obtain
spatial resolution enhancement identical to that of QL but with higher
detection efficiency (M. Tsang, Phys. Rev. Lett. 102, 253601, 2009). Here we
describe a variation of the OCM method with still higher detection efficiency
based on the use of photon-number-resolving detection. We also report
laboratory results for two-photon interference. We compare these results with
those of the standard QL method based on multi-photon detection and show that
the new method leads to superresolution but with higher detection efficiency.
","[{""version"":""v1"",""created"":""Wed, 11 May 2011 20:37:10 GMT""}]","2015-05-28"
"1105.2313","Sergey Leble","Grzegorz Kwiatkowski and Sergey Leble","On quantum corrections to dislocations mass","14 pages, mini-symposium on integrable systems, Zielona Gora, 2011",,,,"quant-ph cond-mat.soft math-ph math.MP","http://arxiv.org/licenses/nonexclusive-distrib/1.0/","  Quasi-classical quantization of crystal dislocations field is considered in
terms of functional integral. The generalized zeta-function is used to evaluate
the functional integral and quantum corrections to mass in quasi-classical
approximation. The quantum corrections to few classical solutions of
one-dimensional Sin-Gordon model are evaluated with account of rest $n-1$
dimensions. The results are applied to appropriate crystal dislocation models.
","[{""version"":""v1"",""created"":""Wed, 11 May 2011 20:38:00 GMT""}]","2011-05-13"
"1105.2314","Christian Wagner","Patrick Steffen, Achim Jung, Duc Bach Nguyen, Torsten M\""uller, Ingolf
  Bernhardt, Lars Kaestner, and Christian Wagner","Stimulation of human red blood cells leads to Ca2+-mediated
  intercellular adhesion","Manuscript with figures included, 1 supplementary figure, 1 video",,,,"physics.bio-ph q-bio.TO","http://arxiv.org/licenses/nonexclusive-distrib/1.0/","  Red blood cells (RBCs) are a major component of blood clots, which form
physiologically as a response to injury or pathologically in thrombosis. The
active participation of RBCs in thrombus solidification has been previously
proposed but not yet experimentally proven. Holographic optical tweezers and
single-cell force spectroscopy were used to study potential cell-cell adhesion
between RBCs. Irreversible intercellular adhesion of RBCs could be induced by
stimulation with lysophosphatidic acid (LPA), a compound known to be released
by activated platelets. We identified Ca2+ as an essential player in the
signaling cascade by directly inducing Ca2+ influx using A23187. Elevation of
the internal Ca2+ concentration leads to an intercellular adhesion of RBCs
similar to that induced by LPA stimulation. Using single-cell force
spectroscopy, the adhesion of the RBCs was identified to be approximately 100
pN, a value large enough to be of significance inside a blood clot or in
pathological situations like the vasco-occlusive crisis in sickle cell disease
patients.
","[{""version"":""v1"",""created"":""Wed, 11 May 2011 20:38:32 GMT""}]","2015-03-13"
"1105.2315","Dirk Zeindler","Ashkan Nikeghbali and Dirk Zeindler","The generalized weighted probability measure on the symmetric group and
  the asymptotic behavior of the cycles",,,,,"math.PR math.CO math.CV","http://arxiv.org/licenses/nonexclusive-distrib/1.0/","  The goal of this paper is to analyse the asymptotic behavior of the cycle
process and the total number of cycles of weighted and generalized weighted
random permutations which are relevant models in physics and which extend the
Ewens measure. We combine tools from combinatorics and complex analysis (e.g.
singularity analysis of generating functions) to prove that under some analytic
conditions (on relevant generating functions) the cycle process converges to a
vector of independent Poisson variables and to establish a central limit
theorem for the total number of cycles. Our methods allow us to obtain an
asymptotic estimate of the characteristic functions of the different random
vectors of interest together with an error estimate, thus having a control on
the speed of convergence. In fact we are able to prove a finer convergence for
the total number of cycles, namely \textit{mod-Poisson convergence}. From there
we apply previous results on mod-Poisson convergence to obtain Poisson
approximation for the total number of cycles as well as large deviations
estimates.
","[{""version"":""v1"",""created"":""Wed, 11 May 2011 20:39:27 GMT""}]","2011-05-13"
"1105.2316","Norman G\""urlebeck","Norman G\""urlebeck","The interior solution of axially symmetric, stationary and rigidly
  rotating dust configurations","minor corrections to the published version, 10 pages","Gen. Relativ. Gravit. (2009) 41:2687-2696","10.1007/s10714-009-0796-8",,"gr-qc astro-ph.GA","http://arxiv.org/licenses/nonexclusive-distrib/1.0/","  It is shown that the interior solution of axially symmetric, stationary and
rigidly rotating dust configurations is completely determined by the mass
density along the axis of rotation. The particularly interesting case of a mass
density, which is cylindrical symmetric in the interior of the dust
configuration, is presented. Among other things, this proves the non-existence
of homogeneous dust configurations.
","[{""version"":""v1"",""created"":""Wed, 11 May 2011 20:39:33 GMT""}]","2011-05-13"
"1105.2317","Breanna Binder","B. Binder, B. F. Williams, A. K. H. Kong, T. J. Gaetz, P. P.
  Plucinsky, J. J. Dalcanton, D. R. Weisz","Chandra Detection of SN 2010da Four Months After Outburst: Evidence for
  a Supergiant X-ray Binary in NGC 300","6 pages, 3 figures. Submitted to ApJL",,"10.1088/2041-8205/739/2/L51",,"astro-ph.HE astro-ph.CO","http://arxiv.org/licenses/nonexclusive-distrib/1.0/","  We present the results of a 63 ks {\it Chandra} observation of the ""supernova
impostor"" SN 2010da four months after it was first observed on 25 May 2010. We
detect an X-ray source at $\sim7\sigma$ confidence coincident with the optical
location of the SN 2010da outburst. Our imaging analysis has revealed a hard
central point source, surrounded by soft diffuse emission extending as far as
$\sim$8\asn north of the central source. The diffuse emission has a hardness
ratio, 0.35-2 keV luminosity ($\sim6\times10^{35}$ erg s$^{-1}$), and size
($\sim20$ pc) consistent with that of a supernova remnant, although the low
number of counts prohibits detailed spectral modeling. Our best-fit spectral
model for the hard central source is a black body ($kT = 1.79^{+0.66}_{-0.43}$
keV) with no evidence for intrinsic absorption beyond the Galactic column. We
estimate the 0.3-10 keV luminosity to be 1.7$^{+0.2}_{-0.5}\times10^{37}$ erg
s$^{-1}$, a factor of $\sim$25 decrease since the initial outburst four months
previously. The high X-ray luminosity and slow fading rate is not consistent
with this object being a single massive star undergoing an outburst; instead,
we favor the scenario where the massive star powering the SN 2010da optical
transient is part of a wind-fed supergiant X-ray binary system with a compact
companion powering the observed X-ray emission.
","[{""version"":""v1"",""created"":""Wed, 11 May 2011 20:46:16 GMT""}]","2015-05-28"
"1105.2318","Guido Risaliti","G. Risaliti, E. Nardini, M. Elvis, L. Brenneman, and M. Salvati","Probing general relativistic effects during AGN X-ray eclipses","7 pages, 3 figures. Accepted for publication in MNRAS",,"10.1111/j.1365-2966.2011.19055.x",,"astro-ph.CO","http://arxiv.org/licenses/nonexclusive-distrib/1.0/","  Long X-ray observations of bright Active Galactic Nuclei show that X-ray
eclipses, with durations from a few hours to a few days, are rather common.
This opens up a new window of opportunity in the search for signatures of
relativistic effects in AGNs: an obscuring cloud covers/uncovers different
parts of the accretion disc at different times, allowing a direct check of the
expected pattern of disc emission. In particular, the combination of
gravitational redshift and relativistic Doppler boosting should imply strong
differences between the receding and approaching parts of an inclined thin
disc. At present, these effects may be already detectable with a ""lucky""
XMM-Newton or Suzaku observation of a complete eclipse by a Compton-thick cloud
(a rare, but not impossible-to-see event). In the future, higher sensitivity
observatories will be able to perform these tests easily on tens of AGNs. This
will provide a powerful and direct way to test extreme gravity, and to probe
the structure of AGNs in the close vicinity of the central black holes.
","[{""version"":""v1"",""created"":""Wed, 11 May 2011 20:52:24 GMT""}]","2015-05-28"
"1105.2319","Zheng  Cai","Zheng Cai, Xiaohui Fan, Linhua Jiang, Fuyan Bian, Ian McGreer, Romeel
  Dave, Eiichi Egami, Ann Zabludoff, Yujin Yang, S. Peng Oh","Probing Population III Stars in Galaxy IOK-1 at z = 6.96 through He II
  Emission","13 pages, 2 figures; Article first published online: July 07 2011","ApJ, 2011, 736, L28","10.1088/2041-8205/736/2/L28",,"astro-ph.CO astro-ph.GA","http://arxiv.org/licenses/nonexclusive-distrib/1.0/","  The He II \lambda 1640 emission line has been suggested as a direct probe of
Population III (Pop III) stars at high-redshift, since it can arise from highly
energetic ionizing photons associated with hot, metal free stars. We use the
HST WFC3/F130N IR narrowband filter to probe He II \lambda 1640 emission in
galaxy IOK-1 at z=6.96. The sensitivity of this measurement is >5x deeper than
for previous measurements. From this deep narrowband imaging, combined with
broadband observations in the F125W and F160W filters, we find the He II flux
to be 1.2+/- 1.0x 10^-18 ergs/s/cm^2, corresponding to a 1\sigma upper limit on
the Pop III star formation rate (SFR) of ~ 0.5 M_sun/yr for the case of a
Salpeter IMF with 50-500M_sun and mass loss. Given that the broadband
measurements can be fit with a UV continuum spectral flux density of ~ 4.85x
10^-10x \lambda ^-2.46 ergs/s/cm^2/A, which corresponds to an overall SFR of
~16+/-2.6 M_sun/yr, massive Pop III stars represent < 6% of the total star
formation. This measurement places the strongest limit yet on metal-free star
formation at high redshift, although the exact conversion from He II luminosity
to Pop III SFR is highly uncertain due to the unknown IMF, stellar evolution,
and photoionization effects. Although we have not detected He II \lambda 1640
at more than the 1.2\sigma level, our work suggests that a > 3\sigma level
detection is possible with JWST.
","[{""version"":""v1"",""created"":""Wed, 11 May 2011 20:57:04 GMT""},{""version"":""v2"",""created"":""Fri, 8 Jul 2011 15:17:43 GMT""}]","2015-05-28"
"1105.2320","Ashley Ross Dr.","Ashley J Ross, Shirley Ho, Antonio J. Cuesta, Rita Tojeiro, Will J.
  Percival, David Wake, Karen L. Masters, Robert C. Nichol, Adam D. Myers,
  Fernando de Simoni, Hee Jong Seo, Carlos Hernandez-Monteagudo, Robert
  Crittenden, Michael Blanton, J. Brinkmann, Luiz A. N. da Costa, Hong Guo,
  Eyal Kazin, Marcio A. G. Maia, Claudia Maraston, Nikhil Padmanabhan,
  Francisco Prada, Beatriz Ramos, Ariel Sanchez, Edward F. Schlafly, David J.
  Schlegel, Donald P. Schneider, Ramin Skibba, Daniel Thomas, Benjamin A.
  Weaver, Martin White, Idit Zehavi","Ameliorating Systematic Uncertainties in the Angular Clustering of
  Galaxies: A Study using SDSS-III","Accepted by MNRAS",,"10.1111/j.1365-2966.2011.19351.x",,"astro-ph.CO","http://arxiv.org/licenses/nonexclusive-distrib/1.0/","  We investigate the effects of potential sources of systematic error on the
angular and photometric redshift, z_phot, distributions of a sample of redshift
0.4 < z < 0.7 massive galaxies whose selection matches that of the Baryon
Oscillation Spectroscopic Survey (BOSS) constant mass sample. Utilizing over
112,778 BOSS spectra as a training sample, we produce a photometric redshift
catalog for the galaxies in the SDSS DR8 imaging area that, after masking,
covers nearly one quarter of the sky (9,913 square degrees). We investigate
fluctuations in the number density of objects in this sample as a function of
Galactic extinction, seeing, stellar density, sky background, airmass,
photometric offset, and North/South Galactic hemisphere. We find that the
presence of stars of comparable magnitudes to our galaxies (which are not
traditionally masked) effectively remove area. Failing to correct for such
stars can produce systematic errors on the measured angular auto-correlation
function, w, that are larger than its statistical uncertainty. We describe how
one can effectively mask for the presence of the stars, without removing any
galaxies from the sample, and minimize the systematic error. Additionally, we
apply two separate methods that can be used to correct the systematic errors
imparted by any parameter that can be turned into a map on the sky. We find
that failing to properly account for varying sky background introduces a
systematic error on w. We measure w, in four z_phot slices of width 0.05
between 0.45 < z_phot < 0.65 and find that the measurements, after correcting
for the systematic effects of stars and sky background, are generally
consistent with a generic LambdaCDM model, at scales up to 60 degrees. At
scales greater than 3 degrees and z_phot > 0.5, the magnitude of the
corrections we apply are greater than the statistical uncertainty in w.
","[{""version"":""v1"",""created"":""Wed, 11 May 2011 21:00:11 GMT""},{""version"":""v2"",""created"":""Fri, 1 Jul 2011 08:55:19 GMT""}]","2015-05-28"
