"1105.2436","Mathieu Bongrand","Mathieu Bongrand (for the SuperNEMO Collaboration)","The BiPo detector for ultralow radioactivity measurements","Proceeding - Low Radioactivity Techniques (LRT) Workshop - SNOLab -
  2010",,"10.1063/1.3579559",,"physics.ins-det","http://arxiv.org/licenses/nonexclusive-distrib/1.0/","  The development of BiPo detectors is dedicated to the measurement of
extremely high radiopurity in 208Tl and 214Bi for the SuperNEMO double beta
decay source foils. A modular prototype, called BiPo-1, with 0.8 m2 of
sensitive surface area, has been running in the Modane Underground Laboratory
since February, 2008. The goal of BiPo-1 is to measure the different components
of the background and in particular the surface radiopurity of the plastic
scintillators that make up the detector. The first phase of data collection has
been dedicated to the measurement of the radiopurity in 208Tl. After more than
one year of background measurement, a surface activity of the scintillators of
A(208Tl) = 1.5 \muBq/m2 is reported here.
  Given this level of background, a larger BiPo3 detector having 3.25 m2 of
active surface area, will able to qualify the radiopurity of the SuperNEMO
selenium double beta decay foils with the required sensitivity of A(208Tl) <
3-4 \mu Bq/kg (90% C.L.) with a six month measurement. This detector is
actually under construction and will be installed in the Canfranc Underground
Laboratory mid 2011.
","[{""version"":""v1"",""created"":""Thu, 12 May 2011 11:47:00 GMT""}]","2019-08-21"
"1105.2437","Anton Eremeev","Kovalenko Julia Viktorovna","Continuous-time model for multi-product scheduling in production","8 pages, in Russian",,,,"math.OC","http://arxiv.org/licenses/nonexclusive-distrib/1.0/","  We consider a problem of multi-product scheduling in production. Each product
can be produced by a family of alternative multi-machine technologies.
Multi-machine technologies require more than one machine at the same time. A
sequence dependent setup time is needed between different technologies. We
formulate a mixed integer linear programming model for the general case of the
problem and for the case, when the setup times satisfy the triangle inequality.
The proposed models are experimentally tested on randomly generated instances.
","[{""version"":""v1"",""created"":""Thu, 12 May 2011 11:48:55 GMT""}]","2011-05-13"
"1105.2438","Cms Collaboration","CMS Collaboration","Long-range and short-range dihadron angular correlations in central PbPb
  collisions at a nucleon-nucleon center of mass energy of 2.76 TeV",,"JHEP 7 (2011) 76","10.1007/JHEP07(2011)076","CMS-HIN-11-001, CERN-PH-EP-2011-056","nucl-ex","http://arxiv.org/licenses/nonexclusive-distrib/1.0/","  First measurements of dihadron correlations for charged particles are
presented for central PbPb collisions at a nucleon-nucleon center-of-mass
energy of 2.76 TeV over a broad range in relative pseudorapidity, Delta(eta),
and the full range of relative azimuthal angle, Delta(phi). The data were
collected with the CMS detector, at the LHC. A broadening of the away-side
(Delta(phi) approximately pi) azimuthal correlation is observed at all
Delta(eta), as compared to the measurements in pp collisions. Furthermore,
long-range dihadron correlations in Delta(eta) are observed for particles with
similar phi values. This phenomenon, also known as the ""ridge"", persists up to
at least |Delta(eta)| = 4. For particles with transverse momenta (pt) of 2-4
GeV/c, the ridge is found to be most prominent when these particles are
correlated with particles of pt = 2-6 GeV/c, and to be much reduced when paired
with particles of pt = 10-12 GeV/c.
","[{""version"":""v1"",""created"":""Thu, 12 May 2011 11:52:21 GMT""}]","2012-08-27"
"1105.2439","Sarah J. Witherspoon","Joerg Feldvoss and Sarah Witherspoon","Support Varieties and Representation Type of Self-Injective Algebras","21 pages",,,,"math.RT math.RA","http://arxiv.org/licenses/nonexclusive-distrib/1.0/","  We use the theory of varieties for modules arising from Hochschild cohomology
to give an alternative version of the wildness criterion of Bergh and Solberg:
If a finite dimensional self-injective algebra has a module of complexity at
least 3 and satisfies some finiteness assumptions on Hochschild cohomology,
then the algebra is wild. We show directly how this is related to the analogous
theory for Hopf algebras that we developed. We give applications to many
different types of algebras: Hecke algebras, reduced universal enveloping
algebras, small half-quantum groups, and Nichols (quantum symmetric) algebras.
","[{""version"":""v1"",""created"":""Thu, 12 May 2011 12:04:07 GMT""}]","2011-05-13"
"1105.2440","Paul Tangney","Philip W. Avraam, Nicholas D. M. Hine, Paul Tangney, and Peter D.
  Haynes","Factors influencing the distribution of charge in polar nanocrystals","Accepted for publication in Phys. Rev. B Rapid Communications","Phys. Rev. B 83, 241402(R) (2011)","10.1103/PhysRevB.83.241402",,"cond-mat.mes-hall cond-mat.mtrl-sci","http://arxiv.org/licenses/nonexclusive-distrib/1.0/","  We perform first-principles calculations of wurtzite GaAs nanorods to explore
the factors determining charge distributions in polar nanostructures. We show
that both the direction and magnitude of the dipole moment $\mathbf{d}$ of a
nanorod, and its electic field, depend sensitively on how its surfaces are
terminated and do not depend strongly on the spontaneous polarization of the
underlying lattice. We identify two physical mechanisms by which $\mathbf{d}$
is controlled by the surface termination, and we show that the excess charge on
the nanorod ends is not strongly localized. We discuss the implications of
these results for tuning nanocrystal properties, and for their growth and
assembly.
","[{""version"":""v1"",""created"":""Thu, 12 May 2011 12:06:19 GMT""}]","2012-06-08"
"1105.2441","Philipp Mayr","Peter Mutschke, Philipp Mayr, Philipp Schaer, York Sure","Science Models as Value-Added Services for Scholarly Information Systems","26 pages, to appear in Scientometrics",,"10.1007/s11192-011-0430-x",,"cs.DL cs.IR","http://creativecommons.org/licenses/by-nc-sa/3.0/","  The paper introduces scholarly Information Retrieval (IR) as a further
dimension that should be considered in the science modeling debate. The IR use
case is seen as a validation model of the adequacy of science models in
representing and predicting structure and dynamics in science. Particular
conceptualizations of scholarly activity and structures in science are used as
value-added search services to improve retrieval quality: a co-word model
depicting the cognitive structure of a field (used for query expansion), the
Bradford law of information concentration, and a model of co-authorship
networks (both used for re-ranking search results). An evaluation of the
retrieval quality when science model driven services are used turned out that
the models proposed actually provide beneficial effects to retrieval quality.
From an IR perspective, the models studied are therefore verified as expressive
conceptualizations of central phenomena in science. Thus, it could be shown
that the IR perspective can significantly contribute to a better understanding
of scholarly structures and activities.
","[{""version"":""v1"",""created"":""Thu, 12 May 2011 12:07:42 GMT""}]","2017-05-03"
"1105.2442","Francois Henault","Francois Henault","Phase-shifting technique for improving the imaging capacity of
  sparse-aperture optical interferometers","40 pages and 9 figures","Appl.Opt.50:4207-4220,2011","10.1364/AO.50.004207",,"physics.optics astro-ph.IM","http://arxiv.org/licenses/nonexclusive-distrib/1.0/","  In this paper, we describe the principle of a multi-aperture interferometer
that uses a phase-shifting technique and is suitable for quick, snapshot
imaging of astrophysical objects at extreme angular resolution through Fourier
inversion. A few advantages of the proposed design are highlighted, among which
are radiometric efficiency, Field of View equivalent to those of Fizeau
interferometers, and a preliminary calibration procedure allowing
characterization of instrumental errors. For large telescope numbers, the
proposed design also results in considerable simplification of the optical and
mechanical design. Numerical simulations suggest that it should be possible to
couple hundreds of telescopes on a single 4K x 4K detector array, using only
conventional optical components or emerging technologies.
","[{""version"":""v1"",""created"":""Thu, 12 May 2011 12:10:52 GMT""},{""version"":""v2"",""created"":""Fri, 24 Jun 2011 22:00:40 GMT""}]","2015-05-28"
"1105.2443","Philipp Mayr","Mark Thamm, Philipp Mayr","Comparing webometric with web-independent rankings: a case study with
  German universities","3 pages, ACM Web Science 2011",,,,"cs.SI cs.DL physics.soc-ph","http://creativecommons.org/licenses/by-nc-sa/3.0/","  In this paper we examine if hyperlink-based (webometric) indicators can be
used to rank academic websites. Therefore we analyzed the interlinking
structure of German university websites and compared our simple hyperlink-based
ranking with official and web-independent rankings of universities. We found
that link impact could not easily be seen as a prestige factor for
universities.
","[{""version"":""v1"",""created"":""Thu, 12 May 2011 12:14:47 GMT""}]","2011-05-13"
"1105.2444","Christian  Webb","Christian Webb","Exact asymptotics of the freezing transition of a logarithmically
  correlated random energy model",,,"10.1007/s10955-011-0359-8",,"math-ph cond-mat.dis-nn math.MP math.PR","http://arxiv.org/licenses/nonexclusive-distrib/1.0/","  We consider a logarithmically correlated random energy model, namely a model
for directed polymers on a Cayley tree, which was introduced by Derrida and
Spohn. We prove asymptotic properties of a generating function of the partition
function of the model by studying a discrete time analogy of the KPP-equation -
thus translating Bramson's work on the KPP-equation into a discrete time case.
We also discuss connections to extreme value statistics of a branching random
walk and a rescaled multiplicative cascade measure beyond the critical point.
","[{""version"":""v1"",""created"":""Thu, 12 May 2011 12:19:38 GMT""},{""version"":""v2"",""created"":""Fri, 26 Aug 2011 08:32:41 GMT""}]","2015-05-28"
"1105.2445","Tomoki Endo","Tomoki Endo","Region of hadron-quark mixed phase in hybrid stars","to be published in Physical Review C","Phys.Rev.C83:068801,2011","10.1103/PhysRevC.83.068801",,"astro-ph.SR nucl-th","http://arxiv.org/licenses/nonexclusive-distrib/1.0/","  Hadron--quark mixed phase is expected in a wide region of the inner structure
of hybrid stars. However, we show that the hadron--quark mixed phase should be
restricted to a narrower region to because of the charge screening effect. The
narrow region of the mixed phase seems to explain physical phenomena of neutron
stars such as the strong magnetic field and glitch phenomena, and it would give
a new cooling curve for the neutron star.
","[{""version"":""v1"",""created"":""Thu, 12 May 2011 12:25:36 GMT""}]","2011-07-04"
"1105.2446","Gabriele De Chiara","Gabriele De Chiara and Anna Sanpera","Detection of entanglement in ultracold lattice gases","Submitted to the Special Issue: ""Strong correlations in Quantum
  Gases"" in The Journal of Low Temperature Physics","J Low Temp Phys 165, 292 (2011)","10.1007/s10909-011-0403-8",,"quant-ph cond-mat.quant-gas","http://arxiv.org/licenses/nonexclusive-distrib/1.0/","  We propose the use of quantum polarization spectroscopy for detecting
multi-particle entanglement of ultracold atoms in optical lattices. This
method, based on a light-matter interface employing the quantum Farady effect,
allows for the non destructive measurement of spin-spin correlations. We apply
it to the specific example of a one dimensional spin chain and reconstruct its
phase diagram using the light signal, readily measurable in experiments with
ultracold atoms. Interestingly, the same technique can be extended to detect
quantum many-body entanglement in such systems.
","[{""version"":""v1"",""created"":""Thu, 12 May 2011 12:25:49 GMT""}]","2014-04-02"
"1105.2447","Gabriele D'Angelo","Gabriele D'Angelo and Stefano Ferretti","LUNES: Agent-based Simulation of P2P Systems (Extended Version)","Proceedings of the International Workshop on Modeling and Simulation
  of Peer-to-Peer Architectures and Systems (MOSPAS 2011). As part of the 2011
  International Conference on High Performance Computing and Simulation (HPCS
  2011)",,"10.1109/HPCSim.2011.5999879",,"cs.DC cs.MA cs.NI","http://arxiv.org/licenses/nonexclusive-distrib/1.0/","  We present LUNES, an agent-based Large Unstructured NEtwork Simulator, which
allows to simulate complex networks composed of a high number of nodes. LUNES
is modular, since it splits the three phases of network topology creation,
protocol simulation and performance evaluation. This permits to easily
integrate external software tools into the main software architecture. The
simulation of the interaction protocols among network nodes is performed via a
simulation middleware that supports both the sequential and the
parallel/distributed simulation approaches. In the latter case, a specific
mechanism for the communication overhead-reduction is used; this guarantees
high levels of performance and scalability. To demonstrate the efficiency of
LUNES, we test the simulator with gossip protocols executed on top of networks
(representing peer-to-peer overlays), generated with different topologies.
Results demonstrate the effectiveness of the proposed approach.
","[{""version"":""v1"",""created"":""Thu, 12 May 2011 12:26:40 GMT""},{""version"":""v2"",""created"":""Thu, 27 Dec 2012 08:58:52 GMT""},{""version"":""v3"",""created"":""Mon, 28 Jul 2014 09:38:29 GMT""}]","2015-03-19"
"1105.2448","Xingxing Huang","Xing-Xing Huang, Jun-Xian Wang, Ying Tan, Huan Yang, Ya-Fang Huang","A unique X-ray unabsorbed Seyfert 2 galaxy IRAS F01475-0740","13 pages, 3 figures, 1 table, accepted to the Astrophysical Journal
  Letters","APJL 734 (2011), id. L16","10.1088/2041-8205/734/1/L16",,"astro-ph.HE","http://arxiv.org/licenses/nonexclusive-distrib/1.0/","  X-ray unabsorbed Seyfert 2 galaxies appear to have X-ray absorption column
densities that are too low (NH < 10^22 cm-2) to explain the absence of broad
emission lines in their optical spectra, challenging the standard AGN
unification model. In this paper we report Suzaku exposure on the X-ray
unabsorbed Seyfert 2 galaxy IRAS F01475-0740, in which a hidden broad line
region was detected through spectropolarimetric observation. The X-ray data
show rapid and significant variations on time scales down to 5 ks, indicating
that we are viewing its central engine directly. A newly obtained optical
spectrum and previous optical/X-ray data suggest that state transition is
unlikely in this source. These make IRAS F01475-0740 a very peculiar X-ray
unabsorbed Seyfert 2 galaxy which can only be explained by absorption from
materials with abnormally high dust-to-gas ratio (by a factor of > 4 larger
than Galactic). This is in contrast to most AGNs, which typically show
dust-to-gas ratios 3 - 100 times lower than the Galactic.
","[{""version"":""v1"",""created"":""Thu, 12 May 2011 12:40:51 GMT""},{""version"":""v2"",""created"":""Tue, 24 May 2011 06:38:53 GMT""}]","2011-05-25"
"1105.2449","Tomotsugu Wakasa","T. Wakasa, M. Okamoto, M. Takaki, M. Dozono, K. Hatanaka, M. Ichimura,
  T. Noro, H. Okamura, and Y. Sakemi","Complete set of polarization transfer observables for the ${}^{16}{\rm
  O}(\vec{p},\vec{n}){}^{16}{\rm F}$ reaction at 296 MeV and 0 degrees","6 figures, submitted to Physical Review C","Phys.Rev.C84:014614,2011","10.1103/PhysRevC.84.014614",,"nucl-ex","http://arxiv.org/licenses/nonexclusive-distrib/1.0/","  We report measurements of the cross section and a complete set of
polarization transfer observables for the ${}^{16}{\rm
O}(\vec{p},\vec{n}){}^{16}{\rm F}$ reaction at a bombarding energy of $T_p$ =
296 MeV and a reaction angle of $\theta_{\rm lab}$ = $0^{\circ}$.
  The data are compared with distorted-wave impulse approximation calculations
employing the large configuration-space shell-model (SM) wave functions.
  The well-known Gamow-Teller and spin-dipole (SD) states at excitation
energies of $E_x$ $\lesssim$ 8 MeV have been reasonably reproduced by the
calculations except for the spin--parity $J^{\pi}$ = $2^-$ state at $E_x$ =
5.86 MeV.
  The SD resonance at $E_x$ $\simeq$ 9.5 MeV appears to have more $J^{\pi}$ =
$2^-$ strength than $J^{\pi}$ = $1^-$ strength, consistent with the
calculations.
  The data show significant strength in the spin-longitudinal polarized cross
section $ID_L(0^{\circ})$ at $E_x$ $\simeq$ 15 MeV, which indicates existence
of the $J^{\pi}$ = $0^-$ SD resonance as predicted in the SM calculations.
","[{""version"":""v1"",""created"":""Thu, 12 May 2011 12:41:59 GMT""},{""version"":""v2"",""created"":""Tue, 21 Jun 2011 02:43:16 GMT""}]","2011-08-22"
"1105.2450","Svjetlana Terzic","Jelena Grbic, Svjetlana Terzic","The integral homology ring of the based loop space on some generalised
  symmetric spaces","14 pages; few background information added; to appear in Moscow
  Mathematical Journal",,,,"math.AT math.GT","http://arxiv.org/licenses/nonexclusive-distrib/1.0/","  In this paper we calculate the integral Pontrjagin homology ring of the based
loop space on some generalised symmetric spaces with a toral stationary
subgroup. In the Appendix we show that the method can be applied to other type
generalised symmetric spaces as well.
","[{""version"":""v1"",""created"":""Thu, 12 May 2011 12:43:44 GMT""},{""version"":""v2"",""created"":""Mon, 6 Feb 2012 13:19:10 GMT""}]","2012-02-07"
"1105.2451","Chris Carilli","C.L. Carilli (NRAO), J. Hodge, F. Walter (MPIA), D. Riechers (CIT), E.
  Daddi, H. Dannerbauer (CEA), G. Morrison (UH)","EVLA observations of a proto-cluster of molecular gas rich galaxies at z
  = 4.05","AAStex format, 4 figures; prepared for the ApJ Letters EVLA special
  issue",,"10.1088/2041-8205/739/1/L33",,"astro-ph.CO","http://arxiv.org/licenses/nonexclusive-distrib/1.0/","  We present observations of the molecular gas in the GN20 proto-cluster of
galaxies at $z =4.05$ using the Expanded Very Large Array (EVLA). This group of
galaxies is the ideal laboratory for studying the formation of massive galaxies
via luminous, gas-rich starbursts within 1.6 Gyr of the Big Bang. We detect
three galaxies in the proto-cluster in CO 2-1 emission, with gas masses (H$_2$)
between $10^{10}$ and $10^{11} \times (\alpha/0.8)$ M$_\odot$. The emission
from the brightest source, GN20, is resolved with a size $\sim 2""$, and has a
clear north-south velocity gradient, possibly indicating ordered rotation. The
gas mass in GN20 is comparable to the stellar mass ($1.3\times 10^{11} \times
(\alpha/0.8)$ M$_\odot$ and $2.3\times 10^{11}$ M$_\odot$, respectively), and
the sum of gas plus stellar mass is comparable to the dynamical mass of the
system ($\sim 3.4\times 10^{11} [sin(i)/sin(45^o)]^{-2}$ M$_\odot$), within a
5kpc radius. There is also evidence for a tidal tail extending another $2""$
north of the galaxy with a narrow velocity dispersion. GN20 may be a massive,
gas rich disk that is gravitationally disturbed, but not completely disrupted.
There is one Lyman-break galaxy (BD29079) in the GN20 proto-cluster with an
optical spectroscopic redshift within our search volume, and we set a 3$\sigma$
limit to the molecular gas mass of this galaxy of $1.1\times 10^{10} \times
(\alpha/0.8)$ M$_\odot$.
","[{""version"":""v1"",""created"":""Thu, 12 May 2011 12:44:46 GMT""}]","2015-05-28"
"1105.2452","Ryo Tamura","Ryo Tamura and Naoki Kawashima","First-Order Phase Transition with Breaking of Lattice Rotation Symmetry
  in Continuous-Spin Model on Triangular Lattice","11pages, 16figures, accepted to JPSJ","J. Phys. Soc. Jpn. 80, 074008 (2011)","10.1143/JPSJ.80.074008",,"cond-mat.stat-mech","http://arxiv.org/licenses/nonexclusive-distrib/1.0/","  Using a Monte Carlo method, we study the finite-temperature phase transition
in the two-dimensional classical Heisenberg model on a triangular lattice with
or without easy-plane anisotropy. The model takes account of competing
interactions: a ferromagnetic nearest-neighbor interaction $J_1$ and an
antiferromagnetic third nearest-neighbor interaction $J_3$. As a result, the
ground state is a spiral spin configuration for $-4 < J_1/J_3 < 0$. In this
structure, global spin rotation cannot compensate for the effect of 120-degree
lattice rotation, in contrast to the conventional 120-degree structure of the
nearest-neighbor interaction model. We find that this model exhibits a
first-order phase transition with breaking of the lattice rotation symmetry at
a finite temperature. The transition is characterized as a $Z_2$ vortex
dissociation in the isotropic case, whereas it can be viewed as a $Z$ vortex
dissociation in the anisotropic case. Remarkably, the latter is continuously
connected to the former as the magnitude of anisotropy decreases, in contrast
to the recent work by Misawa and Motome [J. Phys. Soc. Jpn. \textbf{79} (2010)
073001.] in which both the transitions were found to be continuous.
","[{""version"":""v1"",""created"":""Thu, 12 May 2011 12:48:18 GMT""},{""version"":""v2"",""created"":""Fri, 20 May 2011 06:33:09 GMT""}]","2015-03-19"
"1105.2453","S. Goriely","S. Goriely, N. Chamel, H.-T. Janka, and J.M. Pearson","The decompression of the outer neutron star crust and r-process
  nucleosynthesis","11 pages, 16 figures; Accepted in A&A main Journal",,"10.1051/0004-6361/201116897",,"astro-ph.SR","http://arxiv.org/licenses/nonexclusive-distrib/1.0/","  The rapid neutron-capture process, or r-process, is known to be fundamental
for explaining the origin of approximately half of the A>60 stable nuclei
observed in nature. In recent years nuclear astrophysicists have developed more
and more sophisticated r-process models, by adding new astrophysical or nuclear
physics ingredients to explain the solar system composition in a satisfactory
way. Despite these efforts, the astrophysical site of the r-process remains
unidentified. The composition of the neutron star outer crust material is
investigated after the decompression that follows its possible ejection. The
composition of the outer crust of a neutron star is estimated before and after
decompression. Two different possible initial conditions are considered, namely
an idealized crust composed of cold catalyzed matter and a crust initially in
nuclear statistical equilibrium at temperatures around 10 GK. We show that in
this second case before decompression and at temperatures typically
corresponding to 8 GK, the Coulomb effect due to the high densities in the
crust leads to an overall composition of the outer crust in neutron-rich nuclei
with a mass distribution close to the solar system r-abundance distribution.
Such distributions differ, however, from the solar one due to a systematic
shift in the second peak to lower values. After decompression, the capture of
the few neutrons per seed nucleus available in the hot outer crust leads to a
final distribution of stable neutron-rich nuclei with a mass distribution of 80
< A < 140 nuclei in excellent agreement with the solar distribution, provided
the outer crust is initially at temperatures around 8 GK and all layers of the
outer crust are ejected. The decompression of the neutron star matter from the
outer crust provides suitable conditions for a robust r-processing of the light
species, i.e., r-nuclei with A < 140.
","[{""version"":""v1"",""created"":""Thu, 12 May 2011 12:48:20 GMT""}]","2015-05-28"
"1105.2454","Eric Gautier","Eric Gautier (TSE), Christiern Rose","High-dimensional instrumental variables regression and confidence sets",,,,,"math.ST stat.TH","http://arxiv.org/licenses/nonexclusive-distrib/1.0/","  This article considers inference in linear instrumental variables models with
many regressors, all of which could be endogenous. We propose the STIV
estimator. Identification robust confidence sets are derived by solving linear
programs. We present results on rates of convergence, variable selection,
confidence sets which adapt to the sparsity, and analyze confidence bands for
vectors of linear functions using bias correction. We also provide solutions to
some instruments being endogenous. The application is to the EASI demand
system.
","[{""version"":""v1"",""created"":""Thu, 12 May 2011 12:56:13 GMT""},{""version"":""v2"",""created"":""Fri, 2 Sep 2011 06:39:52 GMT""},{""version"":""v3"",""created"":""Sat, 8 Oct 2011 19:17:19 GMT""},{""version"":""v4"",""created"":""Sun, 7 Sep 2014 06:38:37 GMT""},{""version"":""v5"",""created"":""Thu, 21 Jun 2018 09:22:11 GMT""},{""version"":""v6"",""created"":""Wed, 6 Nov 2019 14:25:19 GMT""},{""version"":""v7"",""created"":""Fri, 6 Aug 2021 08:21:38 GMT""}]","2021-08-09"
