"1105.2230","Christian Bick","Christian Bick, Marc Timme, Danilo Paulikat, Dirk Rathlev, Peter
  Ashwin","Chaos in Symmetric Phase Oscillator Networks","4 pages; Accepted by Physical Review Letters","Phys. Rev. Lett. 107 (2011) 244101","10.1103/PhysRevLett.107.244101",,"nlin.CD cond-mat.dis-nn math.DS","http://arxiv.org/licenses/nonexclusive-distrib/1.0/","  Phase-coupled oscillators serve as paradigmatic models of networks of weakly
interacting oscillatory units in physics and biology. The order parameter which
quantifies synchronization was so far found to be chaotic only in systems with
inhomogeneities. Here we show that even symmetric systems of identical
oscillators may not only exhibit chaotic dynamics, but also chaotically
fluctuating order parameters. Our findings imply that neither inhomogeneities
nor amplitude variations are necessary to obtain chaos, i.e., nonlinear
interactions of phases give rise to the necessary instabilities.
","[{""version"":""v1"",""created"":""Wed, 11 May 2011 16:01:58 GMT""},{""version"":""v2"",""created"":""Thu, 13 Oct 2011 10:34:46 GMT""}]","2011-12-12"
"1105.2231","Andrei Mikhailov","Andrei Mikhailov","Finite dimensional vertex","LaTeX 48pp; v2: added explanations, small corrections, reference",,"10.1007/JHEP12(2011)005",,"hep-th","http://arxiv.org/licenses/nonexclusive-distrib/1.0/","  The spectrum of linearized excitations of the Type IIB SUGRA on AdS5xS5
contains both unitary and non-unitary representations. Among the non-unitary,
some are finite-dimensional. We explicitly construct the pure spinor vertex
operators for a family of such finite-dimensional representations. The
construction can also be applied to infinite-dimensional representations,
including unitary, although it becomes in this case somewhat less explicit.
","[{""version"":""v1"",""created"":""Wed, 11 May 2011 16:02:02 GMT""},{""version"":""v2"",""created"":""Fri, 18 Nov 2011 18:25:26 GMT""}]","2015-05-28"
"1105.2232","Jean-Philippe Reid","J.-Ph. Reid, M. A. Tanatar, X. G. Luo, H. Shakeripour, S. Ren\'e de
  Cotret, N. Doiron-Leyraud, J. Chang, B. Shen, H.-H. Wen, H. Kim, R. Prozorov,
  and L. Taillefer","Doping-induced vertical line nodes in the superconducting gap of the
  iron arsenide K-Ba122 from directional thermal conductivity","This paper has been replaced by arXiv: 1602.03914",,,,"cond-mat.supr-con cond-mat.str-el","http://arxiv.org/licenses/nonexclusive-distrib/1.0/","  The thermal conductivity k of the iron-arsenide superconductor K-Ba122 was
measured down to 50 mK in a magnetic field up to 15 T, for a heat current
parallel and perpendicular to the tetragonal c axis. In the range from optimal
doping (x ~ 0.4) down to x = 0.16, there is no residual linear term in k(T) at
T = 0, showing that there are no nodes in the superconducting gap anywhere on
the Fermi surface. Upon crossing below x = 0.16, a large residual linear term
suddenly appears, signaling the onset of nodes in the superconducting gap, most
likely vertical line nodes running along the c axis. We discuss two scenarios:
1) accidental nodes in an s-wave gap, resulting from a strong modulation of the
gap around the Fermi surface, in which minima deepen rapidly with underdoping;
2) a phase transition from a nodeless s-wave state to a d-wave state, in which
nodes are imposed by symmetry.
","[{""version"":""v1"",""created"":""Wed, 11 May 2011 16:05:18 GMT""},{""version"":""v2"",""created"":""Mon, 15 Feb 2016 08:57:18 GMT""}]","2016-02-16"
"1105.2233","Eduardo Cuansing Jr.","Eduardo C. Cuansing, Huanan Li, and Jian-Sheng Wang","Role of the on-site pinning potential in establishing quasi-steady-state
  conditions of heat transport in finite quantum systems","version accepted for publication in PRE","Phys. Rev. E 86, 031132 (2012)","10.1103/PhysRevE.86.031132",,"cond-mat.stat-mech cond-mat.mes-hall","http://arxiv.org/licenses/nonexclusive-distrib/1.0/","  We study the transport of energy in a finite linear harmonic chain by solving
the Heisenberg equation of motion, as well as by using nonequilibrium Green's
functions to verify our results. The initial state of the system consists of
two separate and finite linear chains that are in their respective equilibriums
at different temperatures. The chains are then abruptly attached to form a
composite chain. The time evolution of the current from just after switch-on to
the transient regime and then to later times is determined numerically. We
expect the current to approach a steady-state value at later times.
Surprisingly, this is possible only if a nonzero quadratic on-site pinning
potential is applied to each particle in the chain. If there is no on-site
potential a recurrent phenomenon appears when the time scale is longer than the
traveling time of sound to make a round trip from the midpoint to a chain edge
and then back. Analytic expressions for the transient and steady-state currents
are derived to further elucidate the role of the on-site potential.
","[{""version"":""v1"",""created"":""Wed, 11 May 2011 16:10:07 GMT""},{""version"":""v2"",""created"":""Mon, 1 Oct 2012 06:21:34 GMT""}]","2012-10-02"
"1105.2234","Robert Gilman","Robert Gilman, Alexei Myasnikov and Vitalii Romankov","Random equations in nilpotent groups","25 pages",,,,"math.GR","http://arxiv.org/licenses/nonexclusive-distrib/1.0/","  In this paper we study satisfiability of random equations in an infinite
finitely generated nilpotent group G. We show that the set SAT(G,k) of all
equations in k > 1 variables over G which are satisfiable in G has an
intermediate asymptotic density in the space of all equations in k variables
over G. When G is a free abelian group of finite rank, we compute this density
precisely; otherwise we give some non-trivial upper and lower bounds. For k = 1
the set SAT(G,k) is negligible. Usually the asymptotic densities of interesting
sets in groups are either zero or one. The results of this paper provide new
examples of algebraically significant sets of intermediate asymptotic density.
","[{""version"":""v1"",""created"":""Wed, 11 May 2011 16:12:45 GMT""},{""version"":""v2"",""created"":""Wed, 8 Jun 2011 22:58:48 GMT""}]","2011-06-10"
"1105.2235","Ana Lucia  Uribe  Mrs","Ana Uribe, Hubert Klahr, Mario Flock and Thomas Henning","3D MHD Simulations of Planet Migration in Turbulent Stratified Disks","Accepted for publication in ApJ","ApJ, 736, 85 (2011)","10.1088/0004-637X/736/2/85",,"astro-ph.EP","http://arxiv.org/licenses/nonexclusive-distrib/1.0/","  We performed 3D MHD simulations of planet migration in stratified disks using
the Godunov code PLUTO, where the disk is turbulent due to the
magnetorotational instability. We study the migration for planets with
different planet-star mass ratios $q=M_{p}/M_{s}$. In agreement with previous
studies, for the low-mass planet cases ($q=5\times10^{-6}$ and $10^{-5}$),
migration is dominated by random fluctuations in the torque. For a Jupiter-mass
planet $(q=M_{p}/M_{s}=10^{-3}$ for $M_{s}=1M_{\odot})$, we find a reduction of
the magnetic stress inside the orbit of the planet and around the gap region.
After an initial stage where the torque on the planet is positive, it reverses
and we recover migration rates similar to those found in disks where the
turbulent viscosity is modelled by an $\alpha$ viscosity. For the
intermediate-mass planets ($q=5\times10^{-5}, 10^{-4}$ and $2\times10^{-4}$) we
find a new and so far unexpected behavior. In some cases they experience
sustained and systematic outwards migration for the entire duration of the
simulation. For this case, the horseshoe region is resolved and torques coming
from the corotation region can remain unsaturated due to the stresses in the
disk. These stresses are generated directly by the magnetic field. The
magnitude of the horseshoe drag can overcome the negative Lindblad contribution
when the local surface density profile is flat or increasing outwards, which we
see in certain locations in our simulations due to the presence of a zonal
flow. The intermediate-mass planet is migrating radially outwards in locations
where there is a positive gradient of a pressure bump (zonal flow).
","[{""version"":""v1"",""created"":""Wed, 11 May 2011 16:15:12 GMT""}]","2011-07-19"
"1105.2236","Daniel Alayon-Solarz","D. Alay\'on-Solarz","A note on elliptic first order systems in the plane and the Vekua
  Equation with structure polynomial $X^2 + \beta X + \alpha $",,,,,"math.CV math.AP","http://arxiv.org/licenses/nonexclusive-distrib/1.0/","  This note deals with the following problem: under which conditions can
elliptic first order systems in the plane be complex-rewritten as a
parameter-depending Vekua-type equation?
","[{""version"":""v1"",""created"":""Wed, 11 May 2011 16:15:48 GMT""}]","2011-05-16"
"1105.2237","Esther Garcia","Esther Garcia, Miguel Gomez Lozano","Abelian gradings in Lie algebras",,,,,"math.RA","http://arxiv.org/licenses/nonexclusive-distrib/1.0/","  Given a Lie algebra $L$ graded by a group $G$, if $L$ is does not contain
orthogonal graded ideals and $G$ is generated by the support of $L$, then $G$
is an abelian group.
","[{""version"":""v1"",""created"":""Wed, 11 May 2011 16:17:18 GMT""}]","2011-05-12"
"1105.2238","Jozef H. Przytycki","Jozef H. Przytycki (George Washington University)","The Trieste look at Knot Theory","41 pages, 46 figures, Chapter in the book ""Introductory Lectures on
  Knot Theory: Selected Lectures presented at the Advanced School and
  Conference on Knot Theory and its Applications to Physics and Biology"", ICTP,
  Trieste, Italy, 11 - 29 May 2009, World Scientific, to appear 2011",,,,"math.GT math.HO","http://arxiv.org/licenses/nonexclusive-distrib/1.0/","  This paper is base on talks which I gave in May, 2010 at Workshop in Trieste
(ICTP). In the first part we present an introduction to knots and knot theory
from an historical perspective, starting from Summerian knots and ending on Fox
3-coloring. We show also a relation between 3-colorings and the Jones
polynomial. In the second part we develop the general theory of Fox colorings
and show how to associate a symplectic structure to a tangle boundary so that
tangles becomes Lagrangians (a proof of this result has not been published
before).
  Chapter VI of the book ""KNOTS: From combinatorics of knot diagrams to
combinatorial topology based on knots will be based on this paper.
","[{""version"":""v1"",""created"":""Wed, 11 May 2011 16:25:05 GMT""}]","2011-05-12"
"1105.2239","Joerg Wotschack","The HARP-CDP Group: A. Bolshakova, I. Boyko, G. Chelkov, D. Dedovitch,
  A. Elagin, D. Emelyanov, M. Gostkin, A. Guskov, Z. Kroumchtein, Y. Nefedov,
  K. Nikolaev, A. Zhemchugov, F. Dydak, J. Wotschack, A. De Min, V. Ammosov, V.
  Gapienko, V. Koreshev, A. Semak, Y. Sviridov, E. Usenko, V. Zaets","Cross-sections of large-angle hadron production in proton- and
  pion-nucleus interactions VII: tin nuclei and beam momenta from \pm3 GeV/c to
  \pm15 GeV/c","68 pages, 13 figures",,"10.1140/epjc/s10052-011-1719-x","CERN-PH-EP-2011-069","hep-ex","http://arxiv.org/licenses/nonexclusive-distrib/1.0/","  We report on double-differential inclusive cross-sections of the production
of secondary protons, charged pions, and deuterons, in the interactions with a
5% nuclear interaction length thick stationary tin target, of proton and pion
beams with momentum from \pm3 GeV/c to \pm15 GeV/c. Results are given for
secondary particles with production angles between 20 and 125 degrees.
Cross-sections on tin nuclei are compared with cross-sections on beryllium,
carbon, copper, tantalum and lead nuclei.
","[{""version"":""v1"",""created"":""Wed, 11 May 2011 16:26:43 GMT""}]","2015-05-28"
"1105.2240","Thomas Barnet-Lamb","Thomas Barnet-Lamb, Toby Gee, David Geraghty, Richard Taylor","Local-global compatibility for l=p, I","26 pages",,,,"math.NT","http://arxiv.org/licenses/nonexclusive-distrib/1.0/","  We prove the compatibility of the local and global Langlands correspondences
at places dividing l for the l-adic Galois representations associated to
regular algebraic conjugate self-dual cuspidal automorphic representations of
GL_n over an imaginary CM field, under the assumption that the automorphic
representations have Iwahori-fixed vectors at places dividing l and have
Shin-regular weight.
","[{""version"":""v1"",""created"":""Wed, 11 May 2011 16:27:02 GMT""}]","2011-05-12"
"1105.2241","Jian Qin","Jian Qin, Piotr Grzywacz, and David C. Morse","Renormalized One-loop Theory of Correlations in Disordered Diblock
  Copolymers","16 pages, 13 figures, submitted to J. Chem. Phys",,"10.1063/1.3609758",,"cond-mat.soft","http://arxiv.org/licenses/nonexclusive-distrib/1.0/","  A renormalized one-loop theory (ROL) is used to calculate corrections to the
random phase approximation (RPA) for the structure factor $\Sc(q)$ in
disordered diblock copolymer melts. Predictions are given for the peak
intensity $S(q^{\star})$, peak position $q^{\star}$, and single-chain
statistics for symmetric and asymmetric copolymers as functions of $\chi N$,
where $\chi$ is the Flory-Huggins interaction parameter and $N$ is the degree
of polymerization. The ROL and Fredrickson-Helfand (FH) theories are found to
yield asymptotically equivalent results for the dependence of the peak
intensity $S(q^{\star})$ upon $\chi N$ for symmetric diblock copolymers in the
limit of strong scattering, or large $\chi N$, but yield qualitatively
different predictions for symmetric copolymers far from the ODT and for
asymmetric copolymers. The ROL theory predicts a suppression of $S(q^\star)$
and a decrease of $q^{\star}$ for large values of $\chi N$, relative to the RPA
predictions, but an enhancement of $S(q^{\star})$ and an increase in
$q^{\star}$ for small $\chi N$ ($\chi N < 5$). By separating intra- and
inter-molecular contributions to $S^{-1}(q)$, we show that the decrease in
$q^{\star}$ near the ODT is caused by the $q$ dependence of the intermolecular
direct correlation function, and is unrelated to any change in single-chain
statistics, but that the increase in $q^{\star}$ at small values of $\chi N$ is
a result of non-Gaussian single-chain statistics.
","[{""version"":""v1"",""created"":""Wed, 11 May 2011 16:30:00 GMT""}]","2015-05-28"
"1105.2242","Thomas Barnet-Lamb","Thomas Barnet-Lamb, Toby Gee, David Geraghty, Richard Taylor","Local-global compatibility for l=p, II","13 pages",,,,"math.NT","http://arxiv.org/licenses/nonexclusive-distrib/1.0/","  We prove the compatibility at places dividing l of the local and global
Langlands correspondences for the l-adic Galois representations associated to
regular algebraic essentially (conjugate) self-dual cuspidal automorphic
representations of GL_n over an imaginary CM or totally real field. We prove
this compatibility up to semisimplification in all cases, and up to Frobenius
semisimplification in the case of Shin-regular weight.
","[{""version"":""v1"",""created"":""Wed, 11 May 2011 16:31:09 GMT""}]","2011-05-12"
"1105.2243","Fran\c{c}ois M\'eriaux","Fran\c{c}ois M\'eriaux, Samson Lasaulce, Michel Kieffer","More about Base Station Location Games","ValueTools '11: 6th International Conference on Performance
  Evaluation Methodologies and Tools, May 2011, Paris, France",,,,"cs.NI cs.GT","http://arxiv.org/licenses/nonexclusive-distrib/1.0/","  This paper addresses the problem of locating base stations in a certain area
which is highly populated by mobile stations; each mobile station is assumed to
select the closest base station. Base stations are modeled by players who
choose their best location for maximizing their uplink throughput. The approach
of this paper is to make some simplifying assumptions in order to get
interpretable analytical results and insights to the problem under study.
Specifically, a relatively complete Nash equilibrium (NE) analysis is conducted
(existence, uniqueness, determination, and efficiency). Then, assuming that the
base station location can be adjusted dynamically, the best-response dynamics
and reinforcement learning algorithm are applied, discussed, and illustrated
through numerical results.
","[{""version"":""v1"",""created"":""Wed, 11 May 2011 16:34:21 GMT""}]","2011-05-12"
"1105.2244","Steven Sam","Christine Berkesch, Daniel Erman, Manoj Kummini, Steven V Sam","Shapes of free resolutions over a local ring","14 pages, 1 figure; v2: sections have been reorganized substantially
  and exposition has been streamlined","Math. Ann. 354 (2012), no. 3, 939-954","10.1007/s00208-011-0760-2","Mittag-Leffler-2011spring","math.AC","http://arxiv.org/licenses/nonexclusive-distrib/1.0/","  We classify the possible shapes of minimal free resolutions over a regular
local ring. This illustrates the existence of free resolutions whose Betti
numbers behave in surprisingly pathological ways. We also give an asymptotic
characterization of the possible shapes of minimal free resolutions over
hypersurface rings. Our key new technique uses asymptotic arguments to study
formal Q-Betti sequences.
","[{""version"":""v1"",""created"":""Wed, 11 May 2011 16:34:46 GMT""},{""version"":""v2"",""created"":""Tue, 8 Nov 2011 02:57:54 GMT""}]","2012-10-16"
"1105.2245","Melinda Sweany","M. Sweany, A. Bernstein, N.S. Bowden, S. Dazeley, G. Keefer, R.
  Svoboda, M. Tripathi","Large-scale Gadolinium-doped Water Cerenkov Detector for
  Non-Proliferation","7 pages, 11 figures. Submitted to Nuclear Instruments and Methods in
  Physics Research A",,,,"physics.ins-det hep-ex nucl-ex","http://arxiv.org/licenses/nonexclusive-distrib/1.0/","  Fission events from Special Nuclear Material (SNM), such as highly enriched
uranium or plutonium, can produce simultaneous emission of multiple neutrons
and high energy gamma-rays. The observation of time correlations between any of
these particles is a significant indicator of the presence of fissionable
material. Cosmogenic processes can also mimic these types of correlated
signals. However, if the background is sufficiently low and fully
characterized, significant changes in the correlated event rate in the presence
of a target of interest constitutes a robust signature of the presence of SNM.
Since fission emissions are isotropic, adequate sensitivity to these
multiplicities requires a high efficiency detector with a large solid angle
with respect to the target. Water Cerenkov detectors are a cost-effective
choice when large solid angle coverage is required. In order to characterize
the neutron detection performance of large-scale water Cerenkov detectors, we
have designed and built a 3.5 kL water Cerenkov-based gamma-ray and neutron
detector, and modeled the detector response in Geant4 [1]. We report the
position-dependent neutron detection efficiency and energy response of the
detector, as well as the basic characteristics of the simulation.
","[{""version"":""v1"",""created"":""Wed, 11 May 2011 16:35:56 GMT""}]","2011-05-12"
"1105.2246","Clemens Kupke","Corina Cirstea (University of Southampton), Clemens Kupke (Imperial
  College London), Dirk Pattinson (Imperial College London)","EXPTIME Tableaux for the Coalgebraic mu-Calculus",,"Logical Methods in Computer Science, Volume 7, Issue 3 (August 11,
  2011) lmcs:784","10.2168/LMCS-7(3:3)2011",,"cs.LO math.LO","http://arxiv.org/licenses/nonexclusive-distrib/1.0/","  The coalgebraic approach to modal logic provides a uniform framework that
captures the semantics of a large class of structurally different modal logics,
including e.g. graded and probabilistic modal logics and coalition logic. In
this paper, we introduce the coalgebraic mu-calculus, an extension of the
general (coalgebraic) framework with fixpoint operators. Our main results are
completeness of the associated tableau calculus and EXPTIME decidability for
guarded formulas. Technically, this is achieved by reducing satisfiability to
the existence of non-wellfounded tableaux, which is in turn equivalent to the
existence of winning strategies in parity games. Our results are parametric in
the underlying class of models and yield, as concrete applications, previously
unknown complexity bounds for the probabilistic mu-calculus and for an
extension of coalition logic with fixpoints.
","[{""version"":""v1"",""created"":""Wed, 11 May 2011 16:36:39 GMT""},{""version"":""v2"",""created"":""Tue, 9 Aug 2011 20:20:50 GMT""}]","2016-11-23"
"1105.2247","Walter H. Aschbacher","Walter H. Aschbacher, Jean-Marie Barbaroux, J\'er\'emy Faupin, and
  Jean-Claude Guillot","Spectral theory for a mathematical model of the weak interaction: The
  decay of the intermediate vector bosons W+/-, II","To appear in Ann. Henri Poincar\'e",,"10.1007/s00023-011-0114-3",,"math-ph math.FA math.MP math.SP","http://arxiv.org/licenses/nonexclusive-distrib/1.0/","  We do the spectral analysis of the Hamiltonian for the weak leptonic decay of
the gauge bosons W+/-. Using Mourre theory, it is shown that the spectrum
between the unique ground state and the first threshold is purely absolutely
continuous. Neither sharp neutrino high energy cutoff nor infrared
regularization are assumed.
","[{""version"":""v1"",""created"":""Wed, 11 May 2011 16:41:01 GMT""}]","2015-05-28"
"1105.2248","Danhong Huang","Danhong Huang, Godfrey Gumbs, and O. Roslyak","Optical Modulation Effects on Nonlinear Electron Transport in Graphene
  in Terahertz Frequency Range",,,"10.1080/09500340.2011.588345",,"cond-mat.mes-hall","http://arxiv.org/licenses/nonexclusive-distrib/1.0/","  We describe very fast electron dynamics for a graphene nanoribbon driven by a
control electromagnetic field in the terahertz regime. The mobility as a
function of bias possesses a large threshold value when entering a nonlinear
transport regime. This value depends on the temperature, electron density,
impurity scattering strength, nanoribbon width and correlation length for the
line-edge roughness. An enhanced electron mobility beyond this threshold has
been observed, which is related to the initially-heated electrons in high
energy states with a larger group velocity. However, this mobility enhancement
quickly reaches a maximum governed by the Fermi velocity in graphene and the
dramatically increased phonon scattering. Super-linear and sub-linear
temperature dependences of the mobility are seen in the linear and nonlinear
transport regimes, which is attributed separately to the results of sweeping
electrons from the right Fermi edge to the left one through elastic scattering
and moving electrons from low-energy states to high-energy ones through
field-induced electron heating. The threshold field is pushed up by a decreased
correlation length in the high field regime, and is further accompanied by a
reduced magnitude in the mobility enhancement. This implies an anomalous
high-field increase of the line-edge roughness scattering with decreasing
correlation length due to the occupation of high-energy states by field-induced
electron heating. Additionally, a self-consistent device modeling has been
proposed for graphene transistors under an optical modulation on its gate,
which employs Boltzmann moment equations up to the third order for describing
fast carrier dynamics and full wave electromagnetics coupled to the Boltzmann
equation for describing spatial-temporal dependence of the total field.
","[{""version"":""v1"",""created"":""Wed, 11 May 2011 16:41:19 GMT""}]","2015-05-28"
"1105.2249","Jonathan Sondow","Jonathan Sondow, John W. Nicholson, and Tony D. Noe","Ramanujan Primes: Bounds, Runs, Twins, and Gaps","11 pages, 3 tables. Corrected mistakes in the published version of
  Table 1, added corresponding Acknowledgment","J. Integer Seq. 14 (2011) Article 11.6.2",,,"math.NT","http://arxiv.org/licenses/nonexclusive-distrib/1.0/","  The $n$th Ramanujan prime is the smallest positive integer $R_n$ such that if
$x \ge R_n$, then the interval $(x/2,x]$ contains at least $n$ primes. We
sharpen Laishram's theorem that $R_n < p_{3n}$ by proving that the maximum of
$R_n/p_{3n}$ is $R_5/p_{15} = 41/47$. We give statistics on the length of the
longest run of Ramanujan primes among all primes $p<10^n$, for $n\le9$. We
prove that if an upper twin prime is Ramanujan, then so is the lower; a table
gives the number of twin primes below $10^n$ of three types. Finally, we relate
runs of Ramanujan primes to prime gaps. Along the way we state several
conjectures and open problems. The Appendix explains Noe's fast algorithm for
computing $R_1,R_2,...,R_n$.
","[{""version"":""v1"",""created"":""Wed, 11 May 2011 16:43:45 GMT""},{""version"":""v2"",""created"":""Mon, 1 Aug 2011 01:28:38 GMT""}]","2011-08-02"
"1105.2250","Hui Zhai","Zeng-Qiang Yu and Hui Zhai","Spin-Orbit Coupled Fermi Gases across a Feshbach Resonance","4+3 pages, 4 figures, supplementary material added","Physical Review Letters, 107, 195305 (2011)","10.1103/PhysRevLett.107.195305",,"cond-mat.quant-gas","http://arxiv.org/licenses/nonexclusive-distrib/1.0/","  In this letter we study both ground state properties and the superfluid
transition temperature of a spin-1/2 Fermi gas across a Feshbach resonance with
a synthetic spin-orbit coupling, using mean-field theory and exact solution of
two-body problem. We show that a strong spin-orbit coupling can significantly
enhance the pairing gap for 1/(k_F a_s)<=0 due to increased density-of-state.
Strong spin-orbit coupling also significantly enhances the superfluid
transition temperature when 1/(k_F a_s)<=0, while suppresses it slightly when
1/(k_F a_s)>0. The universal interaction energy and pair size at resonance are
also discussed.
","[{""version"":""v1"",""created"":""Wed, 11 May 2011 16:54:19 GMT""},{""version"":""v2"",""created"":""Fri, 13 May 2011 09:41:35 GMT""},{""version"":""v3"",""created"":""Sat, 28 May 2011 09:52:01 GMT""}]","2011-11-09"
