"1106.4866","P. Liberatore","P. Liberatore","On Polynomial Sized MDP Succinct Policies",,"Journal Of Artificial Intelligence Research, Volume 21, pages
  551-577, 2004","10.1613/jair.1134",,"cs.AI","http://arxiv.org/licenses/nonexclusive-distrib/1.0/","  Policies of Markov Decision Processes (MDPs) determine the next action to
execute from the current state and, possibly, the history (the past states).
When the number of states is large, succinct representations are often used to
compactly represent both the MDPs and the policies in a reduced amount of
space. In this paper, some problems related to the size of succinctly
represented policies are analyzed. Namely, it is shown that some MDPs have
policies that can only be represented in space super-polynomial in the size of
the MDP, unless the polynomial hierarchy collapses. This fact motivates the
study of the problem of deciding whether a given MDP has a policy of a given
size and reward. Since some algorithms for MDPs work by finding a succinct
representation of the value function, the problem of deciding the existence of
a succinct representation of a value function of a given size and reward is
also considered.
","[{""version"":""v1"",""created"":""Fri, 24 Jun 2011 00:57:19 GMT""}]","2011-06-27"
"1106.4867","F. Lin","F. Lin","Compiling Causal Theories to Successor State Axioms and STRIPS-Like
  Systems",,"Journal Of Artificial Intelligence Research, Volume 19, pages
  279-314, 2003","10.1613/jair.1135",,"cs.AI","http://arxiv.org/licenses/nonexclusive-distrib/1.0/","  We describe a system for specifying the effects of actions. Unlike those
commonly used in AI planning, our system uses an action description language
that allows one to specify the effects of actions using domain rules, which are
state constraints that can entail new action effects from old ones.
Declaratively, an action domain in our language corresponds to a nonmonotonic
causal theory in the situation calculus. Procedurally, such an action domain is
compiled into a set of logical theories, one for each action in the domain,
from which fully instantiated successor state-like axioms and STRIPS-like
systems are then generated. We expect the system to be a useful tool for
knowledge engineers writing action specifications for classical AI planning
systems, GOLOG systems, and other systems where formal specifications of
actions are needed.
","[{""version"":""v1"",""created"":""Fri, 24 Jun 2011 00:57:41 GMT""}]","2011-06-27"
"1106.4868","R. G. Simmons","R. G. Simmons, H. L.S. Younes","VHPOP: Versatile Heuristic Partial Order Planner",,"Journal Of Artificial Intelligence Research, Volume 20, pages
  405-430, 2003","10.1613/jair.1136",,"cs.AI","http://arxiv.org/licenses/nonexclusive-distrib/1.0/","  VHPOP is a partial order causal link (POCL) planner loosely based on UCPOP.
It draws from the experience gained in the early to mid 1990's on flaw
selection strategies for POCL planning, and combines this with more recent
developments in the field of domain independent planning such as distance based
heuristics and reachability analysis. We present an adaptation of the additive
heuristic for plan space planning, and modify it to account for possible reuse
of existing actions in a plan. We also propose a large set of novel flaw
selection strategies, and show how these can help us solve more problems than
previously possible by POCL planners. VHPOP also supports planning with
durative actions by incorporating standard techniques for temporal constraint
reasoning. We demonstrate that the same heuristic techniques used to boost the
performance of classical POCL planning can be effective in domains with
durative actions as well. The result is a versatile heuristic POCL planner
competitive with established CSP-based and heuristic state space planners.
","[{""version"":""v1"",""created"":""Fri, 24 Jun 2011 00:58:05 GMT""}]","2011-06-27"
"1106.4869","T. C. Au","T. C. Au, O. Ilghami, U. Kuter, J. W. Murdock, D. S. Nau, D. Wu, F.
  Yaman","SHOP2: An HTN Planning System",,"Journal Of Artificial Intelligence Research, Volume 20, pages
  379-404, 2003","10.1613/jair.1141",,"cs.AI","http://arxiv.org/licenses/nonexclusive-distrib/1.0/","  The SHOP2 planning system received one of the awards for distinguished
performance in the 2002 International Planning Competition. This paper
describes the features of SHOP2 which enabled it to excel in the competition,
especially those aspects of SHOP2 that deal with temporal and metric planning
domains.
","[{""version"":""v1"",""created"":""Fri, 24 Jun 2011 00:58:42 GMT""}]","2011-06-27"
"1106.4870","Guoce Xin","Guoce Xin","On Zeilberger's Constant Term for Andrews' TSSCPP Theorem","13 pages, two comments from Krattenhaler are added at the end of the
  file","Electronic Journal of Combinatorics, 18 (2) (2011) P11",,,"math.CO","http://arxiv.org/licenses/nonexclusive-distrib/1.0/","  This paper studies Zeilberger's two prized constant term identities. For one
of the identities, Zeilberger asked for a simple proof that may give rise to a
simple proof of Andrews theorem for the number of totally symmetric self
complementary plane partitions. We obtain an identity reducing a constant term
in $2k$ variables to a constant term in $k$ variables. As applications,
Zeilberger's constant terms are converted to single determinants. The result
extends for two classes of matrices, the sum of all of whose full rank minors
is converted to a single determinant. One of the prized constant term problems
is solved, and we give a seemingly new approach to Macdonald's constant term
for root system of type BC.
","[{""version"":""v1"",""created"":""Fri, 24 Jun 2011 00:58:57 GMT""}]","2011-06-27"
"1106.4871","J. E. Laird","J. E. Laird, R. E. Wray","An Architectural Approach to Ensuring Consistency in Hierarchical
  Execution",,"Journal Of Artificial Intelligence Research, Volume 19, pages
  355-398, 2003","10.1613/jair.1142",,"cs.AI","http://arxiv.org/licenses/nonexclusive-distrib/1.0/","  Hierarchical task decomposition is a method used in many agent systems to
organize agent knowledge. This work shows how the combination of a hierarchy
and persistent assertions of knowledge can lead to difficulty in maintaining
logical consistency in asserted knowledge. We explore the problematic
consequences of persistent assumptions in the reasoning process and introduce
novel potential solutions. Having implemented one of the possible solutions,
Dynamic Hierarchical Justification, its effectiveness is demonstrated with an
empirical analysis.
","[{""version"":""v1"",""created"":""Fri, 24 Jun 2011 00:59:16 GMT""}]","2011-06-27"
"1106.4872","C. A. Knoblock","C. A. Knoblock, K. Lerman, S. N. Minton","Wrapper Maintenance: A Machine Learning Approach",,"Journal Of Artificial Intelligence Research, Volume 18, pages
  149-181, 2003","10.1613/jair.1145",,"cs.AI","http://arxiv.org/licenses/nonexclusive-distrib/1.0/","  The proliferation of online information sources has led to an increased use
of wrappers for extracting data from Web sources. While most of the previous
research has focused on quick and efficient generation of wrappers, the
development of tools for wrapper maintenance has received less attention. This
is an important research problem because Web sources often change in ways that
prevent the wrappers from extracting data correctly. We present an efficient
algorithm that learns structural information about data from positive examples
alone. We describe how this information can be used for two wrapper maintenance
applications: wrapper verification and reinduction. The wrapper verification
system detects when a wrapper is not extracting correct data, usually because
the Web source has changed its format. The reinduction algorithm automatically
recovers from changes in the Web source by identifying data on Web pages so
that a new wrapper may be generated for this source. To validate our approach,
we monitored 27 wrappers over a period of a year. The verification algorithm
correctly discovered 35 of the 37 wrapper changes, and made 16 mistakes,
resulting in precision of 0.73 and recall of 0.95. We validated the reinduction
algorithm on ten Web sources. We were able to successfully reinduce the
wrappers, obtaining precision and recall values of 0.90 and 0.80 on the data
extraction task.
","[{""version"":""v1"",""created"":""Fri, 24 Jun 2011 00:59:47 GMT""}]","2011-06-27"
"1106.4873","Piotr Sulkowski","Piotr Su{\l}kowski","BPS states, crystals and matrices","67 pages, 20 figures; references added","Advances in High Energy Physics (2011) 357016","10.1155/2011/357016","CALT-68-2835","hep-th","http://arxiv.org/licenses/nonexclusive-distrib/1.0/","  We review free fermion, melting crystal and matrix model representations of
wall-crossing phenomena on local, toric Calabi-Yau manifolds. We consider both
unrefined and refined BPS counting of closed BPS states involving D2 and
D0-branes bound to a D6-brane, as well as open BPS states involving open
D2-branes ending on an additional D4-brane. Appropriate limit of these
constructions provides, among the others, matrix model representation of
refined and unrefined topological string amplitudes.
","[{""version"":""v1"",""created"":""Fri, 24 Jun 2011 01:03:30 GMT""},{""version"":""v2"",""created"":""Thu, 12 Jul 2012 19:19:02 GMT""}]","2012-07-13"
"1106.4874","Patrick Rabier","Patrick J. Rabier","Embeddings of weighted Sobolev spaces and generalized
  Caffarelli-Kohn-Nirenberg inequalities",,"J. Anal. Math. 118 (2012) 251-296",,,"math.AP math.FA","http://arxiv.org/licenses/nonexclusive-distrib/1.0/","  We characterize all the real numbers a,b,c and 1<= p,q,r<infty such that the
weighted Sobolev space W_{a,b}^(q,p)(R^N\{0}) with power weights |x|^a and
|x|^b is continuously embedded into L^{r}(R^N;|x|^cdx). Furthermore, we show
that this embedding is (almost) always characterized by a multiplicative norm
inequality. When a,b,c>-N and attention is confined to smooth functions with
compact support, these inequalities coincide with the Caffarelli-Kohn-Nirenberg
inequalities. Variants for radially symmetric functions, or when r<=min{p,q},
are also obtained along the way.
","[{""version"":""v1"",""created"":""Fri, 24 Jun 2011 01:26:42 GMT""},{""version"":""v2"",""created"":""Thu, 30 Jun 2011 17:27:52 GMT""},{""version"":""v3"",""created"":""Mon, 25 Jul 2011 15:49:46 GMT""},{""version"":""v4"",""created"":""Tue, 23 Aug 2011 17:51:13 GMT""}]","2015-01-20"
"1106.4875","William Newton","M. Gearheart, W.G. Newton, J. Hooker and Bao-An Li","Upper limits on the observational effects of nuclear pasta in neutron
  stars","8 pages, 7 figures, accepted for publication in Monthly Notices of
  the Royal Astronomical Society",,"10.1111/j.1365-2966.2011.19628.x",,"astro-ph.SR nucl-th","http://arxiv.org/licenses/nonexclusive-distrib/1.0/","  The effects of the existence of exotic nuclear shapes at the bottom of the
neutron star inner crust - nuclear `pasta' - on observational phenomena are
estimated by comparing the limiting cases that those phases have a vanishing
shear modulus and that they have the shear modulus of a crystalline solid . We
estimate the effect on torsional crustal vibrations and on the maximum
quadrupole ellipticity sustainable by the crust. The crust composition and
transition densities are calculated consistently with the global properties,
using a liquid drop model with a bulk nuclear equation of state (EoS) which
allows a systematic variation of the nuclear symmetry energy. The symmetry
energy J and its density dependence L at nuclear saturation density are the
dominant nuclear inputs which determine the thickness of the crust, the range
of densities at which pasta might appear, as well as global properties such as
the radius and moment of inertia. We show the importance of calculating the
global neutron star properties on the same footing as the crust EoS, and
demonstrate that in the range of experimentally acceptable values of L, the
pasta phase can alter the crust frequencies by up to a factor of three,
exceeding the effects of superfluidity on the crust modes, and decrease the
maximum quadrupole ellipticity sustainable by the crust by up to an order of
magnitude. The signature of the pasta phases and the density dependence of the
symmetry energy on the potential observables highlights the possibility of
constraining the EoS of dense, neutron-rich matter and the properties of the
pasta phases using astrophysical observations.
","[{""version"":""v1"",""created"":""Fri, 24 Jun 2011 01:50:10 GMT""},{""version"":""v2"",""created"":""Thu, 11 Aug 2011 18:12:17 GMT""}]","2015-05-28"
"1106.4876","Casey Law","C. J. Law (1), G. Jones (2,3), D. C. Backer (1), W. C. Barott (4), G.
  C. Bower (1), C. Gutierrez-Kraybill (1), P. K. G. Williams (1), D. Werthimer
  (1) (1, UC Berkeley, 2, Caltech, 3, Jansky Fellow, 4, Embry-Riddle
  Aeronautical Univ.)","Millisecond Imaging of Radio Transients with the Pocket Correlator","13 pages, accepted to ApJ",,"10.1088/0004-637X/742/1/12",,"astro-ph.IM","http://arxiv.org/licenses/nonexclusive-distrib/1.0/","  We demonstrate a signal processing concept for imaging the sky at millisecond
rates with radio interferometers. The ""Pocket Correlator"" (PoCo) correlates the
signals from multiple elements of a radio interferometer fast enough to image
brief, dispersed pulses. By the nature of interferometry, a millisecond
correlator functions like a large, single-dish telescope, but with improved
survey speed, spatial localization, calibration, and interference rejection. To
test the concept, we installed PoCo at the Allen Telescope Array (ATA) to
search for dispersed pulses from the Crab pulsar, B0329+54, and M31 using
total-power, visibility-based, and image-plane techniques. In 1.7 hours of
observing, PoCo detected 191 giant pulses from the Crab pulsar brighter than a
typical 5 sigma sensitivity limit of 60 Jy over pulse widths of 3 milliseconds.
Roughly 40% of pulses from pulsar B0329+54 were detected by using novel
visibility-based techniques. Observations of M31 constrain the rate of pulses
brighter than 190 Jy in a three degree region surrounding the galaxy to
<4.3/hr. We calculate the computational demand of various visibility-based
pulse search algorithms and demonstrate how compute clusters can help meet this
demand. Larger implementations of the fast imaging concept will conduct blind
searches for millisecond pulses in our Galaxy and beyond, providing a valuable
probe of the interstellar/intergalactic media, discovering new kinds of radio
transients, and localizing them to constrain models of their origin.
","[{""version"":""v1"",""created"":""Fri, 24 Jun 2011 02:13:17 GMT""},{""version"":""v2"",""created"":""Wed, 10 Aug 2011 18:37:13 GMT""}]","2015-05-28"
"1106.4877","Oleksiy Roslyak V","Godfrey Gumbs, O. Roslyak, Danhong Huang, Antonios Balassis","Spectroscopic Characterization of Gapped Graphene in the Presence of
  Circularly Polarized Light",,,"10.1080/09500340.2011.601330",,"cond-mat.mtrl-sci","http://arxiv.org/licenses/nonexclusive-distrib/1.0/","  We present a description of the energy loss of a charged particle moving
parallel to a graphene layer and graphene double layers. Specifically, we
compare the stopping power of the plasma oscillations for these two
configurations in the absence as well as the presence of circularly polarized
light whose frequency and intensity can be varied to yield an energy gap of
several hundred $\texttt{meV}$ between the valence and conduction bands. The
dressed states of the Dirac electrons by the photons yield collective plasma
excitations whose characteristics are qualitatively and quantitatively
different from those produced by Dirac fermions in gapless graphene, due in
part to the finite effective mass of the dressed electrons. For example, the
range of wave numbers for undamped self-sustaining plasmons is increased as the
gap is increased, thereby increasing the stopping power of graphene for some
range of charged particle velocity when graphene is radiated by circularly
polarized light.
","[{""version"":""v1"",""created"":""Fri, 24 Jun 2011 02:22:10 GMT""}]","2015-05-28"
"1106.4878","Wu Xiaohua","Xoaohua Wu and Bo You","Unitary application of the quantum error correction codes","4 pages, 4 figures",,,,"quant-ph","http://arxiv.org/licenses/nonexclusive-distrib/1.0/","  From the set of operators for errors and its correction code, we introduce
the so-called complete unitary transformation. It can be used for encoding
while the inverse of it can be applied for correcting the errors of the encoded
qubit. We show that this unitary protocol can be applied for any code which
satisfies the quantum error correction condition.
","[{""version"":""v1"",""created"":""Fri, 24 Jun 2011 02:35:03 GMT""}]","2011-06-27"
"1106.4879","Sarah Reynolds","Sarah J. Reynolds (KU), Mikhail V. Medvedev (KU)","Radiative diagnostics for sub-Larmor scale magnetic turbulence","17 pages, 4 figures, submitted to Phys. Plasmas",,"10.1063/1.3677827",,"physics.plasm-ph astro-ph.HE","http://arxiv.org/licenses/nonexclusive-distrib/1.0/","  Radiative diagnostics of high-energy density plasmas is addressed in this
paper. We propose that the radiation produced by energetic particles in
small-scale magnetic field turbulence, which can occur in laser-plasma
experiments, collisionless shocks, and during magnetic reconnection, can be
used to deduce some properties of the turbulent magnetic field. Particles
propagating through such turbulence encounter locally strong magnetic fields,
but over lengths much shorter than a particle gyroradius. Consequently, the
particle is accelerated but not deviated substantially from a straight line
path. We develop the general jitter radiation solutions for this case and show
that the resulting radiation is directly dependent upon the spectral
distribution of the magnetic field through which the particle propagates. We
demonstrate the power of this approach in considering the radiation produced by
particles moving through a region in which a (Weibel-like) filamentation
instability grows magnetic fields randomly oriented in a plane transverse to
counterstreaming particle populations. We calculate the spectrum as would be
seen from the original particle population and as could be seen by using a
quasi-monoenergetic electron beam to probe the turbulent region at various
angles to the filamentation axis.
","[{""version"":""v1"",""created"":""Fri, 24 Jun 2011 03:16:16 GMT""}]","2015-05-28"
"1106.4880","Ying Ding","Qian Zhu, Yuyin Sun, Sashikiran Challa, Ying Ding, Michael S.
  Lajiness, David J. Wild","Semantic Inference using Chemogenomics Data for Drug Discovery","23 pages, 9 figures, 4 tables",,"10.1186/1471-2105-12-256",,"q-bio.QM cs.DL cs.IR","http://arxiv.org/licenses/nonexclusive-distrib/1.0/","  Background Semantic Web Technology (SWT) makes it possible to integrate and
search the large volume of life science datasets in the public domain, as
demonstrated by well-known linked data projects such as LODD, Bio2RDF, and
Chem2Bio2RDF. Integration of these sets creates large networks of information.
We have previously described a tool called WENDI for aggregating information
pertaining to new chemical compounds, effectively creating evidence paths
relating the compounds to genes, diseases and so on. In this paper we examine
the utility of automatically inferring new compound-disease associations (and
thus new links in the network) based on semantically marked-up versions of
these evidence paths, rule-sets and inference engines.
  Results Through the implementation of a semantic inference algorithm, rule
set, Semantic Web methods (RDF, OWL and SPARQL) and new interfaces, we have
created a new tool called Chemogenomic Explorer that uses networks of
ontologically annotated RDF statements along with deductive reasoning tools to
infer new associations between the query structure and genes and diseases from
WENDI results. The tool then permits interactive clustering and filtering of
these evidence paths.
  Conclusions We present a new aggregate approach to inferring links between
chemical compounds and diseases using semantic inference. This approach allows
multiple evidence paths between compounds and diseases to be identified using a
rule-set and semantically annotated data, and for these evidence paths to be
clustered to show overall evidence linking the compound to a disease. We
believe this is a powerful approach, because it allows compound-disease
relationships to be ranked by the amount of evidence supporting them.
","[{""version"":""v1"",""created"":""Fri, 24 Jun 2011 03:21:56 GMT""}]","2011-06-27"
"1106.4881","Peter Jarvis","Peter Jarvis (University of Tasmania)","Conformal supermultiplets without superpartners","4 pages, uses RevTeX; minor typos corrected",,,,"hep-th math-ph math.MP","http://arxiv.org/licenses/nonexclusive-distrib/1.0/","  We consider polynomial deformations of Lie superalgebras and their
representations. For the class A(n-1,0) ~ sl(n/1), we identify families of
superalgebras of quadratic and cubic type, consistent with Jacobi identities.
For such deformed superalgebras we point out the possibility of zero step
supermultiplets, carried on a single, irreducible representation of the even
(Lie) subalgebra. For the conformal group SU(2,2) in 1+3-dimensional spacetime,
such irreducible (unitary) representations correspond to standard conformal
fields (j_1,j_2;d), where (j_1,j_2) is the spin and d the conformal dimension;
in the massless class j_1 j_2=0, and d=j_1+j_2+1. We show that these
repesentations are zero step supermultiplets for the superalgebra
SU_(2)(2,2/1), the quadratic deformation of conformal supersymmetry SU(2,2/1).
We propose to elevate SU_(2)(2,2/1) to a symmetry of the S-matrix. Under this
scenario, low-energy standard model matter fields (leptons, quarks, Higgs
scalars and gauge fields) descended from such conformal supermultiplets are not
accompanied by superpartners.
","[{""version"":""v1"",""created"":""Fri, 24 Jun 2011 03:30:57 GMT""},{""version"":""v2"",""created"":""Tue, 28 Jun 2011 21:39:04 GMT""}]","2011-06-30"
"1106.4882","Kenji Fukaya","Kenji Fukaya","Floer homology of Lagrangian submanifolds","29 pages",,,,"math.SG","http://arxiv.org/licenses/nonexclusive-distrib/1.0/","  This is a translation of an article appeared in Japanese in Suugaku 63
(2011), no. 1, 43-66 (MR2790665) and is a survey of Lagrangian Floer homology
which the author studies jointly with Y.-G.Oh, H. Ohta, and K. Ono. It also
contains some explanation on its relation to (homological) mirror symmetry.
","[{""version"":""v1"",""created"":""Fri, 24 Jun 2011 03:32:45 GMT""}]","2011-06-27"
"1106.4883","Leonid Petrov","Leonid Petrov","The EVN Galactic Plane Survey - EGaPS","Submitted to the Monthly Notices of Royal Astronomical Society; 9
  pages, 5 figures, 3 tables. The online table 3 can be retrieved by
  downloading the source of this manuscript and uncompressing the tar.gz file","Monthly Notices of the Royal Astronomical Society, 2012, Volume
  419, Issue 2, pp. 1097-1106","10.1111/j.1365-2966.2011.19765.x",,"astro-ph.CO","http://arxiv.org/licenses/nonexclusive-distrib/1.0/","  I present a catalogue of positions and correlated flux densities of 109
compact extragalactic radio sources in the Galactic plane determined from
analysis of a 48 hour VLBI experiment at 22 GHz with the European VLBI Network.
The median position uncertainty is 9 mas. The correlated flux densities of
detected sources are in the range of 20 to 300 mJy. In addition to target
sources, nine water masers have been detected, two of them new. I derived
position of masers with accuracies 30 to 200 mas and determined velocities of
maser components and their correlated flux densities. The catalogue and
supporting material is available at http://astrogeo.org/egaps.
","[{""version"":""v1"",""created"":""Fri, 24 Jun 2011 03:36:28 GMT""}]","2012-07-26"
"1106.4884","Davron Matrasulov","D.U.Matrasulov, P.K.Khabibullaev, F.C.Khanna, D.M.Otajanov","Periodically driven dynamics of a particle moving in the field of
  Coulomb plus confining potential",,"Phys.Scr.78:065003,2008","10.1088/0031-8949/78/06/065003",,"math-ph hep-th math.MP nlin.CD physics.atom-ph","http://arxiv.org/licenses/nonexclusive-distrib/1.0/","  Periodically driven dynamics of a particle moving in the field Coulomb plus
confining potential is treated for one and three dimensional cases. Critical
value of the external field strength at which chaotization will occur is
evaluated analytically based on the resonance overlap criterion. The analysis
of the phase-space dynamics is presented.
","[{""version"":""v1"",""created"":""Fri, 24 Jun 2011 03:44:04 GMT""}]","2011-08-31"
