"1106.4812","Fernanda Pinheiro M.Sc","Fernanda Pinheiro and A. F. R. de Toledo Piza","Quantum entanglement of bound particles under free center of mass
  dispersion","17 pages, 5 figures","Phys. Scr. 85 065002, (2012)","10.1088/0031-8949/85/06/065002",,"quant-ph","http://arxiv.org/licenses/nonexclusive-distrib/1.0/","  On the basis of the full analytical solution of the overall unitary dynamics,
the time evolution of entanglement is studied in a simple bipartite model
system evolving unitarily from a pure initial state. The system consists of two
particles in one spacial dimension bound by harmonic forces and having its free
center of mass initially localized in space in a minimum uncertainty wave
packet. The existence of such initial states in which the bound particles are
not entangled is pointed out. The entanglement of the two particles is shown to
be independent of the wavepacket mean momentum, and to increase monotonically
in a time scale distinct from that of the spreading of the center of mass
wavepacket.
","[{""version"":""v1"",""created"":""Thu, 23 Jun 2011 20:00:00 GMT""}]","2012-05-10"
"1106.4813","Alex Geringer-Sameth","Alex Geringer-Sameth, Savvas M. Koushiappas (Brown U.)","Extracting the unresolved pulsar contribution to the gamma-ray
  background","13 pages, 2 figures. Minor formatting corrections","Mon.Not.Roy.Astron.Soc.421:1813-1824,2012","10.1111/j.1365-2966.2012.20453.x",,"astro-ph.HE astro-ph.IM","http://arxiv.org/licenses/nonexclusive-distrib/1.0/","  We present a statistical framework which can be used to determine the
contribution of an unresolved population of pulsars to the gamma-ray
background. This formalism is based on the joint analysis of photon time series
over extended regions of the sky. We demonstrate the robustness of this
technique in controlled simulations of pulsar populations, and show that the
Fermi Gamma-ray Space Telescope can be used to detect a pulsar contribution as
small as 0.1% of the gamma-ray background. This technique is sensitive to
pulsar populations with photon fluxes greater than ~1E-10 cm^-2 s^-1. The
framework is extensible to arbitrarily complex searches for periodicity and can
therefore be tailored to specific applications such as all-sky surveys and
studies of the Galactic center and globular clusters.
","[{""version"":""v1"",""created"":""Thu, 23 Jun 2011 20:00:01 GMT""},{""version"":""v2"",""created"":""Wed, 29 Jun 2011 19:11:38 GMT""}]","2012-03-20"
"1106.4814","Henry Tillson","Henry Tillson, Lance Miller and Julien Devriendt","The environment and redshift dependence of accretion onto dark matter
  halos and subhalos","16 pages, 11 figures. Accepted for publication in MNRAS",,"10.1111/j.1365-2966.2011.19311.x",,"astro-ph.CO","http://arxiv.org/licenses/nonexclusive-distrib/1.0/","  A dark-matter-only Horizon Project simulation is used to investigate the
environment- and redshift- dependence of accretion onto both halos and
subhalos. These objects grow in the simulation via mergers and via accretion of
diffuse non-halo material, and we measure the combined signal from these two
modes of accretion. It is found that the halo accretion rate varies less
strongly with redshift than predicted by the Extended Press-Schechter (EPS)
formalism and is dominated by minor-merger and diffuse accretion events at z=0,
for all halos. These latter growth mechanisms may be able to drive the
radio-mode feedback hypothesised for recent galaxy-formation models, and have
both the correct accretion rate and form of cosmological evolution. The low
redshift subhalo accretors in the simulation form a mass-selected subsample
safely above the mass resolution limit that reside in the outer regions of
their host, with ~70% beyond their host's virial radius, where they are
probably not being significantly stripped of mass. These subhalos accrete, on
average, at higher rates than halos at low redshift and we argue that this is
due to their enhanced clustering at small scales. At cluster scales, the mass
accretion rate onto halos and subhalos at low redshift is found to be only
weakly dependent on environment and we confirm that at z~2 halos accrete
independently of their environment at all scales, as reported by other authors.
By comparing our results with an observational study of black hole growth, we
support previous suggestions that at z>1, dark matter halos and their
associated central black holes grew coevally, but show that by the present day,
dark matter halos could be accreting at fractional rates that are up to a
factor 3-4 higher than their associated black holes.
","[{""version"":""v1"",""created"":""Thu, 23 Jun 2011 20:00:02 GMT""}]","2015-05-28"
"1106.4815","Jamison Galloway","Aleksandr Azatov, Jamison Galloway, Markus A. Luty","Superconformal Technicolor: Models and Phenomenology","34 pages, 3 figures; v2: minor changes, references added",,"10.1103/PhysRevD.85.015018",,"hep-ph","http://arxiv.org/licenses/nonexclusive-distrib/1.0/","  In supersymmetric theories with a strong conformal sector, soft supersymmetry
breaking naturally gives rise to confinement and chiral symmetry breaking in
the strong sector at the TeV scale. We construct and analyze models where such
a sector dynamically breaks electroweak symmetry, and take the first steps in
studying their phenomenology. We consider two scenarios, one where the strong
dynamics induces vacuum expectation values for elementary Higgs fields, and
another where the strong dynamics is solely responsible for electroweak
symmetry breaking. In both cases there is no fine tuning required to explain
the absence of a Higgs boson below the LEP bound, solving the supersymmetry
naturalness problem. Quark and lepton masses arise from conventional Yukawa
couplings to elementary Higgs bosons, so there are no additional
flavor-changing effects associated with the strong dynamics. A good precision
electroweak fit can be obtained because the strong sector is an SU(2) gauge
theory with one weak doublet, and has adjustable parameters that control the
violation of custodial symmetry. In addition to the the standard supersymmetry
signals, these models predict production of multiple heavy standard model
particles (t, W, Z, and b) from decays of resonances in the strong sector. The
strong sector has no approximate parity symmetry, so WW scattering is
unitarized by states that can decay to WWW as well as WW.
","[{""version"":""v1"",""created"":""Thu, 23 Jun 2011 20:00:04 GMT""},{""version"":""v2"",""created"":""Tue, 27 Sep 2011 09:20:13 GMT""}]","2013-05-30"
"1106.4816","Prateek Sharma","Prateek Sharma, Michael McCourt, Eliot Quataert, Ian J. Parrish","Thermal Instability & the Feedback Regulation of Hot Halos in Clusters,
  Groups, and Galaxies","26 pages, 18 figures; abstract abridged; to be submitted to MNRAS",,"10.1111/j.1365-2966.2011.20246.x",,"astro-ph.CO","http://arxiv.org/licenses/nonexclusive-distrib/1.0/","  Observations of clusters and groups imply that such halos are roughly in
global thermal equilibrium, with heating balancing cooling when averaged over
sufficiently long time- and length-scales; the ICM is, however, very likely to
be locally thermally unstable. Using simple observationally-motivated heating
prescriptions, we show that local thermal instability (TI) can produce a
multi-phase medium---with ~ 10000 K cold filaments condensing out of the hot
ICM---only when the ratio of the TI timescale in the hot plasma (t_{TI}) to the
free-fall timescale (t_{ff}) satisfies t_{TI}/t_{ff} <~ 10. This criterion
quantitatively explains why cold gas and star formation are preferentially
observed in low-entropy clusters and groups. In addition, the interplay among
heating, cooling, and TI reduces the net cooling rate and the mass accretion
rate at small radii by factors of ~ 100 relative to cooling-flow models. This
dramatic reduction is in line with observations. The feedback efficiency
required to prevent a cooling-flow is ~ 0.001 for clusters and decreases for
lower mass halos; supernova heating may be energetically sufficient to balance
cooling in galactic halos. We further argue that the ICM self-adjusts so that
t_{TI}/t_{ff} >~ 10 at all radii. When this criterion is not satisfied, cold
filaments condense out of the hot phase and reduce the density of the ICM.
These cold filaments can power the black hole and/or stellar feedback required
for global thermal balance, which drives t_{TI}/t_{ff} >~ 10. In comparison to
clusters, groups have central cores with lower densities and larger radii. This
can account for the deviations from self-similarity in the X-ray
luminosity-temperature (L_X-T_X) relation. The high-velocity clouds observed in
the Galactic halo can also be due to local TI producing multi-phase gas close
to the virial radius.
","[{""version"":""v1"",""created"":""Thu, 23 Jun 2011 20:00:05 GMT""}]","2015-05-28"
"1106.4817","Joanna Bulger","J. Patience, J. Bulger, R. R. King, B. Ayliffe, M. R. Bate, I. Song,
  C. Pinte, J. Koda, C. D. Dowell and A. Kovacs","Spatially resolved submm imaging of the HR 8799 debris disk","5 pages, 4 figures, Accepted for publication in Astronomy and
  Astrophysics",,"10.1051/0004-6361/201117395",,"astro-ph.EP astro-ph.SR","http://arxiv.org/licenses/nonexclusive-distrib/1.0/","  Dynamical interactions between planets and debris disks may sculpt the disk
structure and impact planetary orbits, but only a few systems with both imaged
planets and spatially resolved debris disks are known. With the Caltech Submm
Observatory (CSO), we have observed the HR 8799 debris disk at 350{\mu}m. The
350{\mu}m map is the first spatially resolved measurement of the debris disk
encircling the HR 8799 planetary system at this wavelength. Both the flux and
size of the emission are consistent with a Kuiper belt of dust extending from
~100-300 AU. Although the resolution of the current map is limited, the map
shows an indication of offset asymmetric emission, and several scenarios for
this possibility are explored with radiative transfer calculations of a
star-disk system and N-body numerical simulations of planet-disk interactions
with parameters representative of the HR 8799 system.
","[{""version"":""v1"",""created"":""Thu, 23 Jun 2011 20:00:10 GMT""}]","2015-05-28"
"1106.4818","Amanda Kepley","Amanda A. Kepley, Laura Chomiuk, Kelsey E. Johnson, W.M. Goss, Dana S.
  Balser, and D.J. Pisano","Unveiling Extragalactic Star Formation Using Radio Recombination Lines:
  An EVLA Pilot Study with NGC 253","Accepted for publication in the ApJL EVLA Special Issue. Version with
  high resolution figures at
  http://www.astro.virginia.edu/~aak8t/data/rrl/ms.ps",,"10.1088/2041-8205/739/1/L24",,"astro-ph.GA","http://arxiv.org/licenses/nonexclusive-distrib/1.0/","  Radio recombination lines (RRLs) are powerful, extinction-free diagnostics of
the ionized gas in young, star-forming regions. Unfortunately, these lines are
difficult to detect in external galaxies. We present the results of EVLA
observations of the RRL and radio continuum emission at 33 GHz from NGC 253, a
nearby nuclear starburst galaxy. We detect the previously unobserved H58a and
H59a RRLs and make simultaneous sensitive measurements of the continuum. We
measure integrated line fluxes of $44.3 \pm 0.7$ W m$^{-2}$ and $39.9 \pm 0.8$
W m$^{-2}$ for the H58a and H59a lines, respectively. The thermal gas in NGC
253 is kinematically complex with multiple velocity components. We constrain
the density of the thermal gas to $1.4 - 4 \times 10^4$ cm$^{-3}$ and estimate
an ionizing photon flux of $1 \times 10^{53}$ s$^{-1}$. We use the RRL
kinematics and the derived ionizing photon flux to show that the nuclear region
of NGC 253 is not gravitationally bound, which is consistent with the outflow
of gas inferred from the X-ray and Halpha measurements. The line profiles,
fluxes, and kinematics of the H58a and H59a lines agree with those of RRLs at
different frequencies confirming the accuracy of the previous, more difficult,
high frequency observations. We find that the EVLA is an order of magnitude
more efficient for extragalactic RRL observations than the VLA. These
observations demonstrate both the power of the EVLA and the future potential of
extragalactic RRL studies with the EVLA.
","[{""version"":""v1"",""created"":""Thu, 23 Jun 2011 20:00:11 GMT""}]","2015-05-28"
"1106.4819","Bryan Zald\'ivar Montero","Yann Mambrini and Bryan Zald\'ivar","When LEP and Tevatron combined with WMAP and XENON100 shed light on the
  nature of Dark Matter","8 pages, 6 figures",,"10.1088/1475-7516/2011/10/023",,"hep-ph astro-ph.HE","http://arxiv.org/licenses/nonexclusive-distrib/1.0/","  Recently, several astrophysical data or would-be signals has been observed in
different dark-matter oriented experiments. In each case, one could fit the
data at the price of specific nature of the coupling between the Standard Model
(SM) particles and a light Dark Matter candidate: hadrophobic (INTEGRAL,
PAMELA) or leptophobic (WMAP Haze, dijet anomalies of CDF, FERMI Galactic
Center observation). In this work, we show that when one takes into account the
more recent LEP and Tevatron analysis, a light thermal fermionic Dark Matte
(\lesssim 10 GeV) that couples to electrons is mainly ruled out if one combines
the analysis with WMAP constraints. We also study the special case of scalar
dark matter, using a mono-photon events simulation to constrain the coupling of
dark matter to electron.
","[{""version"":""v1"",""created"":""Thu, 23 Jun 2011 20:00:11 GMT""}]","2015-05-28"
"1106.4820","Aaron Lee","Aaron T. Lee, Steven W. Stahler","Dynamical Friction in a Gas: The Subsonic Case","To appear in MNRAS, 26 pages, 7 figures, single column v2 - Small
  changes to reflect published version, fixed y-axis scaling on Figure 6",,"10.1111/j.1365-2966.2011.19273.x",,"astro-ph.GA","http://arxiv.org/licenses/nonexclusive-distrib/1.0/","  We study the force of dynamical friction acting on a gravitating point mass
that travels through an extended, isothermal gas. This force is well
established in the hypersonic limit, but remains less understood in the
subsonic regime. Using perturbation theory, we analyze the changes in gas
velocity and density far from the mass. We show analytically that the
steady-state friction force is Mdot*V, where Mdot is the mass accretion rate
onto an object moving at speed V. It follows that the speed of an object
experiencing no other forces declines as the inverse square of its mass. Using
a modified version of the classic Bondi-Hoyle interpolation formula for Mdot as
a function of V, we derive an analytic expression for the friction force. This
expression also holds when mass accretion is thwarted, e.g. by a wind, as long
as the wind-cloud interaction is sufficiently confined spatially. Our result
should find application in a number of astrophysical settings, such as the
motion of galaxies through intracluster gas.
","[{""version"":""v1"",""created"":""Thu, 23 Jun 2011 20:00:35 GMT""},{""version"":""v2"",""created"":""Wed, 24 Aug 2011 02:48:12 GMT""}]","2015-05-28"
"1106.4821","Torsten Bringmann","Torsten Bringmann, Fiorenza Donato, Roberto A. Lineros","Radio data and synchrotron emission in consistent cosmic ray models","IOP style; 11 pages, 3 figures; considerably extended and updated
  discussion, matches the published version","JCAP 1201, 049 (2012)","10.1088/1475-7516/2012/01/049",,"astro-ph.GA astro-ph.CO hep-ph","http://arxiv.org/licenses/nonexclusive-distrib/1.0/","  It is well established that phenomenological two-zone diffusion models of the
galactic halo can very well reproduce cosmic-ray nuclear data and the observed
antiproton flux. Here, we consider lepton propagation in such models and
compute the expected galactic population of electrons, as well as the diffuse
synchrotron emission that results from their interaction with galactic magnetic
fields. We find models in agreement not only with cosmic ray data but also with
radio surveys at essentially all frequencies. Requiring such a globally
consistent description strongly disfavors very large ($L\gtrsim 15$ kpc) and,
even stronger, small ($L\lesssim 1$ kpc) effective diffusive halo sizes. This
has profound implications for, e.g., indirect dark matter searches.
","[{""version"":""v1"",""created"":""Thu, 23 Jun 2011 20:03:51 GMT""},{""version"":""v2"",""created"":""Tue, 31 Jan 2012 22:06:00 GMT""}]","2015-05-28"
"1106.4822","Asuman Aksoy G.","Asuman G\""uven Aksoy and Grzegorz Lewicki","Limit Theorems for Numerical Index",,,,,"math.FA math.OA","http://arxiv.org/licenses/nonexclusive-distrib/1.0/","  We improve upon on a limit theorem for numerical index for large classes of
Banach spaces including vector valued $\ell_p$-spaces and $\ell_p$-sums of
Banach spaces where $1\leq p \leq \infty$. We first prove $ n_1(X) =
\displaystyle \lim_m n_1(X_m)$ for a modified numerical index $n_1(\, .\,)$.
Later, we establish if a norm on $X$ satisfies the local characterization
condition, then $n(X) = \displaystyle\lim_m n(X_m).$ We also present an example
of a Banach space where the local characterization condition is satisfied.
","[{""version"":""v1"",""created"":""Thu, 23 Jun 2011 20:05:38 GMT""}]","2011-06-27"
"1106.4823","Hassan Attarchi","H. Attarchi and M. M. Rezaii","An Adapted Frame on Indicatrix Bundle of a Finsler Manifold and its
  Geometric Properties","Duo to some error on the last Theorem",,,,"math.MG","http://arxiv.org/licenses/nonexclusive-distrib/1.0/","  In this paper, a frame is introduced on tangent bundle of a Finsler manifold
in a manner that it makes some simplicity to study the properties of the
natural foliations in tangent bundle. Moreover, we show that the indicatrix
bundle of a Finsler manifold with lifted sasaki metric and natural almost
complex structure on tangent bundle cannot be a sasakian manifold.
","[{""version"":""v1"",""created"":""Thu, 23 Jun 2011 20:06:06 GMT""},{""version"":""v2"",""created"":""Tue, 22 Jul 2014 12:14:50 GMT""}]","2014-07-23"
"1106.4824","Sarah Dodson-Robinson","Sarah E. Dodson-Robinson and Colette Salyk (University of Texas)","Transitional Disks as Signposts of Young, Multiplanet Systems","Accepted for publication in the Astrophysical Journal. 22 pages,
  including appendix material, 5 figures and 2 tables",,"10.1088/0004-637X/738/2/131",,"astro-ph.EP astro-ph.SR","http://arxiv.org/licenses/nonexclusive-distrib/1.0/","  Although there has yet been no undisputed discovery of a still-forming planet
embedded in a gaseous protoplanetary disk, the cleared inner holes of
transitional disks may be signposts of young planets. Here we show that the
subset of accreting transitional disks with wide, optically thin inner holes of
15 AU or more can only be sculpted by multiple planets orbiting inside each
hole. Multiplanet systems provide two key ingredients for explaining the
origins of transitional disks. First, multiple planets can clear wide inner
holes where single planets open only narrow gaps. Second, the confined,
non-axisymmetric accretion flows produced by multiple planets provide a way for
an arbitrary amount of mass transfer to occur through an apparently optically
thin hole without over-producing infrared excess flux. Rather than assuming the
gas and dust in the hole are evenly and axisymmetrically distributed, one can
construct an inner hole with apparently optically thin infrared fluxes by
covering a macroscopic fraction of the hole's surface area with locally
optically thick tidal tails. We also establish that other clearing mechanisms,
such as photoevaporation, cannot explain our subset of accreting transitional
disks with wide holes. Transitional disks are therefore high-value targets for
observational searches for young planetary systems.
","[{""version"":""v1"",""created"":""Thu, 23 Jun 2011 20:09:37 GMT""}]","2015-05-28"
"1106.4825","Paul P. van der Werf","Paul P. van der Werf, Alicia Berciano Alba, Marco Spaans, Edo Loenen,
  Rowin Meijerink, Dominik Riechers, Pierre Cox, Axel Weiss, and Fabian Walter","Water vapor emission reveals a highly obscured, star forming nuclear
  region in the QSO host galaxy APM08279+5255 at z=3.9","accepted for publication in Astrophysical Journal Letters; typos
  fixed",,"10.1088/2041-8205/741/2/L38",,"astro-ph.CO","http://arxiv.org/licenses/nonexclusive-distrib/1.0/","  We present the detection of four rotational emission lines of water vapor,
from energy levels Eu/k= 101 - 454 K, in the gravitationally lensed z=3.9 QSO
host galaxy APM08279+5255. While the lowest H2O lines are collisionally excited
in clumps of warm, dense gas (density of hydrogen nuclei n_H=(3.1 +/- 1.2) x
10^6 cm^-3, gas temperature T_g ~ 105 +/- 21 K), we find that the excitation of
the higher lines is dominated by the intense local infrared radiation field.
Since only collisionally excited emission contributes to gas cooling, we
conclude that H2O is not a significant coolant of the warm molecular gas. Our
excitation model requires the radiatively excited gas to be located in an
extended region of high 100 micron opacity (tau_100 = 0.9 +/- 0.2). Locally,
such extended infrared-opaque regions are found only in the nuclei of
ultraluminous infrared galaxies. We propose a model where the infrared-opaque
circumnuclear cloud, which is penetrated by the X-ray radiation field of the
QSO nucleus, contains clumps of massive star formation where the H2O emission
originates. The radiation pressure from the intense local infrared radiation
field exceeds the thermal gas pressure by about an order of magnitude,
suggesting close to Eddington-limited star formation in these clumps.
","[{""version"":""v1"",""created"":""Thu, 23 Jun 2011 20:10:34 GMT""},{""version"":""v2"",""created"":""Fri, 2 Sep 2011 10:00:12 GMT""},{""version"":""v3"",""created"":""Tue, 27 Sep 2011 17:28:20 GMT""}]","2015-05-28"
"1106.4826","Ioannis Papadimitriou","Ioannis Papadimitriou","Holographic Renormalization of general dilaton-axion gravity","42 pages. v2: two references added. Version published in JHEP. v3:
  fixed minor typos in eqs. (1.6), (2.3), (3.20), (A.3), (B.8), (B.12) and
  (B.22)",,"10.1007/JHEP08(2011)119",,"hep-th gr-qc","http://arxiv.org/licenses/nonexclusive-distrib/1.0/","  We consider a very general dilaton-axion system coupled to Einstein-Hilbert
gravity in arbitrary dimension and we carry out holographic renormalization for
any dimension up to and including five dimensions. This is achieved by
developing a new systematic algorithm for iteratively solving the radial
Hamilton-Jacobi equation in a derivative expansion. The boundary term derived
is valid not only for asymptotically AdS backgrounds, but also for more general
asymptotics, including non-conformal branes and Improved Holographic QCD. In
the second half of the paper, we apply the general result to Improved
Holographic QCD with arbitrary dilaton potential. In particular, we derive the
generalized Fefferman-Graham asymptotic expansions and provide a proof of the
holographic Ward identities.
","[{""version"":""v1"",""created"":""Thu, 23 Jun 2011 20:12:20 GMT""},{""version"":""v2"",""created"":""Tue, 23 Aug 2011 19:10:12 GMT""},{""version"":""v3"",""created"":""Wed, 10 Feb 2016 23:34:01 GMT""}]","2016-02-12"
"1106.4827","Nemanja Kaloper","Nemanja Kaloper, Antonio Padilla and Norihiro Tanahashi","Galileon Hairs of Dyson Spheres, Vainshtein's Coiffure and Hirsute
  Bubbles","29+1 pages, LaTeX, 2 .pdf figures",,"10.1007/JHEP10(2011)148",,"hep-th astro-ph.CO gr-qc hep-ph","http://arxiv.org/licenses/nonexclusive-distrib/1.0/","  We study the fields of spherically symmetric thin shell sources, a.k.a. Dyson
spheres, in a {\it fully nonlinear covariant} theory of gravity with the
simplest galileon field. We integrate exactly all the field equations once,
reducing them to first order nonlinear equations. For the simplest galileon,
static solutions come on {\it six} distinct branches. On one, a Dyson sphere
surrounds itself with a galileon hair, which far away looks like a hair of any
Brans-Dicke field. The hair changes below the Vainshtein scale, where the extra
galileon terms dominate the minimal gradients of the field. Their hair looks
more like a fuzz, because the galileon terms are suppressed by the derivative
of the volume determinant. It shuts off the `hair bunching' over the `angular'
2-sphere. Hence the fuzz remains dilute even close to the source. This is
really why the Vainshtein's suppression of the modifications of gravity works
close to the source. On the other five branches, the static solutions are all
{\it singular} far from the source, and shuttered off from asymptotic infinity.
One of them, however, is really the self-accelerating branch, and the
singularity is removed by turning on time dependence. We give examples of
regulated solutions, where the Dyson sphere explodes outward, and its
self-accelerating side is nonsingular. These constructions may open channels
for nonperturbative transitions between branches, which need to be addressed
further to determine phenomenological viability of multi-branch gravities.
","[{""version"":""v1"",""created"":""Thu, 23 Jun 2011 20:12:23 GMT""}]","2015-05-28"
