"1106.4941","Wei Gu","Wu Guang and Gu Wei","Entropy Bound Derived from the New Thermodynamics on Holographic Screen","10 pages, 0 figures; Commun.Theor.Phys, 2011","Commun. Theor. Phys. 56 .2011. 451","10.1088/0253-6102/56/3/10",,"hep-th astro-ph.CO gr-qc","http://arxiv.org/licenses/nonexclusive-distrib/1.0/","  We introduce a new interpretation of chemical potential and show that
holographic entropy is entropy bound, which is supported by two ideal cases
discussed in detail. One is sparse but incompressible liquid like a star of
uniform density and the other is a screen at infinity in spherically symmetric
sapcetime. Our work is based on the new scenario of entropy force and
holographic thermodynamics, and the Brown-York quasi-local energy.
","[{""version"":""v1"",""created"":""Fri, 24 Jun 2011 11:39:33 GMT""}]","2015-05-28"
"1106.4942","Andres Papa R. R.","Andres R. R. Papa, Marco A. do Espirito Santo, Cleiton S. Barbosa,
  David Oliva","A generalized Bak-Sneppen model for Earth's magnetic field reversals","13 pages, 8 figures",,,,"physics.geo-ph","http://arxiv.org/licenses/nonexclusive-distrib/1.0/","  We introduce a simple model for Earth's magnetic field reversals. The model
consists in random nodes simulating vortices in the liquid part of the core
which through a simple updating algorithm converge to a self organized critical
state, with inter-reversal time probability distributions functions in the form
of power laws (as supposed to be in actual reversals). It should not be
expected a detailed description of reversals. However, we hope to reach a
profounder knowledge of reversals through some of the basic characteristic that
are well reproduced.
","[{""version"":""v1"",""created"":""Fri, 24 Jun 2011 11:39:57 GMT""}]","2011-06-27"
"1106.4943","Jose Manuel Garcia Calcines","J. Calcines and L. Vandembroucq","Topological complexity and the homotopy cofibre of the diagonal map","26 pages",,,,"math.AT","http://arxiv.org/licenses/nonexclusive-distrib/1.0/","  In this paper we analyze some relationships between the topological
complexity of a space $X$ and the category of $C_{\Delta_X},$ the homotopy
cofibre of the diagonal map $\Delta_X:X\rightarrow X\times X.$ We establish the
equality of the two invariants for several classes of spaces including the
spheres, the H-spaces, the real and complex projective spaces and almost all
the (standard) lens spaces.
","[{""version"":""v1"",""created"":""Fri, 24 Jun 2011 11:41:20 GMT""},{""version"":""v2"",""created"":""Wed, 22 Feb 2012 13:38:30 GMT""}]","2012-02-23"
"1106.4944","Eiji Abe","E. Abe, A. Ono, T. Itoi, M. Yamasaki, Y. Kawamura","Polytypes of long-period stacking structures synchronized with chemical
  order in a dilute Mg-Zn-Y alloy","8 pages, 4 figures; submitted to Philosophical Magazine Letters",,"10.1080/09500839.2011.609149",,"cond-mat.mtrl-sci","http://arxiv.org/licenses/nonexclusive-distrib/1.0/","  A series of structural polytypes formed in an Mg-1at.%Zn-2at.%Y alloy has
been identified, which are reasonably viewed as long-period stacking
derivatives of the hcp Mg structure with alternate AB stacking of the
close-packed atomic layers. Atomic-resolution Z-contrast imaging clearly
revealed that the structures are long-period chemical-ordered as well as
stacking-ordered; unique chemical order along the stacking direction occurs as
being synchronized with a local faulted stacking of AB'C'A, where B' and C'
layers are commonly enriched by Zn/Y atoms.
","[{""version"":""v1"",""created"":""Fri, 24 Jun 2011 11:42:11 GMT""},{""version"":""v2"",""created"":""Tue, 26 Jul 2011 06:52:28 GMT""}]","2011-08-30"
"1106.4945","Giorgio Mantica","Giorgio Mantica","Direct and Inverse Computation of Jacobi Matrices of Infinite
  Homogeneous Affine I.F.S","20 pages 6 figures","Numerische Mathematik: Volume 125, Issue 4 (2013), Page 705-731","10.1007/s00211-013-0551-7",,"math.NA math-ph math.MP math.SP","http://arxiv.org/licenses/nonexclusive-distrib/1.0/","  We introduce a new set of algorithms to compute Jacobi matrices associated
with measures generated by infinite systems of iterated functions. We
demonstrate their relevance in the study of theoretical problems, such as the
continuity of these measures and the logarithmic capacity of their support.
Since our approach is based on a reversible transformation between pairs of
Jacobi matrices, we also discuss its application to an inverse / approximation
problem. Numerical experiments show that the proposed algorithms are stable and
can reliably compute Jacobi matrices of large order.
","[{""version"":""v1"",""created"":""Fri, 24 Jun 2011 11:44:21 GMT""}]","2013-11-20"
"1106.4946","Maria Jo\~ao Oliveira","Dmitri L. Finkelshtein, Yuri G. Kondratiev, and Maria Jo\~ao Oliveira","Markov evolutions and hierarchical equations in the continuum: II.
  Multicomponent systems","31 pages","Rep. Math. Phys. 71 (1)(2013), 123--148","10.1016/S0034-4877(13)60024-5",,"math-ph math.MP","http://arxiv.org/licenses/nonexclusive-distrib/1.0/","  General birth-and-death as well as hopping stochastic dynamics of infinite
multicomponent particle systems in the continuum are considered. We derive the
corresponding evolution equations for quasi-observables and correlation
functions. We also present sufficient conditions that allows us to consider
these equations on suitable Banach spaces.
","[{""version"":""v1"",""created"":""Fri, 24 Jun 2011 11:55:59 GMT""}]","2013-03-28"
"1106.4947","Ana Cristina Ferreira","Ana Cristina Ferreira","Einstein four-manifolds with skew torsion",,,"10.1016/j.geomphys.2011.07.009",,"math.DG","http://arxiv.org/licenses/nonexclusive-distrib/1.0/","  We develop a notion of Einstein manifolds with skew torsion on compact,
orientable Riemannian manifolds of dimension four. We prove an analogue of the
Hitchin-Thorpe inequality and study the case of equality. We use the link with
self-duality to study the moduli space of 1-instantons on the 4-sphere for a
family of metrics defined by Bonneau.
","[{""version"":""v1"",""created"":""Fri, 24 Jun 2011 12:10:41 GMT""}]","2015-05-28"
"1106.4948","Alexander Mozeika","Alexander Mozeika, David Saad","Phase transitions and memory effects in the dynamics of Boolean networks",,,"10.1080/14786435.2011.602371",,"cond-mat.dis-nn q-bio.MN","http://arxiv.org/licenses/nonexclusive-distrib/1.0/","  The generating functional method is employed to investigate the synchronous
dynamics of Boolean networks, providing an exact result for the system dynamics
via a set of macroscopic order parameters. The topology of the networks studied
and its constituent Boolean functions represent the system's quenched disorder
and are sampled from a given distribution. The framework accommodates a variety
of topologies and Boolean function distributions and can be used to study both
the noisy and noiseless regimes; it enables one to calculate correlation
functions at different times that are inaccessible via commonly used
approximations. It is also used to determine conditions for the annealed
approximation to be valid, explore phases of the system under different levels
of noise and obtain results for models with strong memory effects, where
existing approximations break down. Links between BN and general Boolean
formulas are identified and common results to both system types are
highlighted.
","[{""version"":""v1"",""created"":""Fri, 24 Jun 2011 12:11:00 GMT""}]","2015-05-28"
"1106.4949","Sukumar Rajauria dr","Sukumar Rajauria, L. M. A. Pascal, Ph. Gandit, F. W. J. Hekking, B.
  Pannetier, and H. Courtois","Efficient Quasiparticle Evacuation in Superconducting Devices","4 pages, 4 figures","Phys. Rev. B 85, 020505(R) (2012)","10.1103/PhysRevB.85.020505",,"cond-mat.mes-hall","http://arxiv.org/licenses/nonexclusive-distrib/1.0/","  We have studied the diffusion of excess quasiparticles in a current-biased
superconductor strip in proximity to a metallic trap junction. In particular,
we have measured accurately the superconductor temperature at a near-gap
injection voltage. By analyzing our data quantitatively, we provide a full
description of the spatial distribution of excess quasiparticles in the
superconductor. We show that a metallic trap junction contributes significantly
to the evacuation of excess quasiparticles.
","[{""version"":""v1"",""created"":""Fri, 24 Jun 2011 12:13:37 GMT""}]","2015-05-28"
"1106.4950","Detang Zhou","Xu Cheng and Detang Zhou","Volume estimate about shrinkers","References are updated",,,,"math.DG","http://arxiv.org/licenses/nonexclusive-distrib/1.0/","  We derive a precise estimate on the volume growth of the level set of a
potential function on a complete noncompact Riemannian manifold. As
applications, we obtain the volume growth rate of a complete noncompact
self-shrinker and a gradient shrinking Ricci soliton. We also prove the
equivalence of weighted volume finiteness, polynomial volume growth and
properness of an immersed self-shrinker in Euclidean space.
","[{""version"":""v1"",""created"":""Fri, 24 Jun 2011 12:14:02 GMT""},{""version"":""v2"",""created"":""Wed, 8 Aug 2012 21:23:33 GMT""}]","2012-08-10"
"1106.4951","Khalid Muhammad","M. Khalid and P. Esquinazi","Hydrogen-induced ferromagnetism in ZnO single crystals investigated by
  Magnetotransport",,,"10.1103/PhysRevB.85.134424",,"cond-mat.str-el","http://arxiv.org/licenses/nonexclusive-distrib/1.0/","  We investigated the electrical and magnetic properties of low-energy
hydrogen-implanted ZnO single crystals with hydrogen concentrations up to 3
at.% in the first 20 nm surface layer between 10 K and 300 K. All samples
showed clear ferromagnetic hysteresis loops at 300 K with a saturation
magnetization up to 4 emu/g. The measured anomalous Hall effect agrees with the
hysteresis loops measured by superconducting quantum interferometer device
magnetometry. All the H-treated ZnO crystals exhibited a negative
magnetoresistance up to the room temperature. The relative magnitude of the
anisotropic magnetoresistance reaches 0.4 % at 250 K and 2 % at 10 K,
exhibiting an anomalous, non-monotonous behavior and a change of sign below 100
K. All the experimental data indicate that hydrogen atoms alone in a few
percent range trigger a magnetic order in a ZnO crystalline state. Hydrogen
implantation turns out to be a simpler and effective method to generate a
magnetic order in ZnO, which provides interesting possibilities for future
applications due to the strong reduction of the electrical resistance.
","[{""version"":""v1"",""created"":""Fri, 24 Jun 2011 12:15:44 GMT""}]","2015-05-28"
"1106.4952","Carlo Petronio","Ekaterina Pervova, Carlo Petronio, Vito Sasso","Notes on the complexity of 3-valent graphs in 3-manifolds","15 pages, 6 figures",,,,"math.GT","http://arxiv.org/licenses/nonexclusive-distrib/1.0/","  A theory of complexity for pairs (M,G) with M an arbitrary closed 3-manifold
and G a 3-valent graph in M was introduced by the first two named authors,
extending the original notion due to Matveev. The complexity c is known to be
always additive under connected sum away from the graphs, but not always under
connected sum along (unknotted) arcs of the graphs. In this article we prove
the slightly surprising fact that if in M there is a sphere intersecting G
transversely at one point, and this point belongs to an edge e of G, then e can
be canceled from G without affecting the complexity. Using this fact we
completely characterize the circumstances under which complexity is additive
under connected sum along graphs. For the set of pairs (M,K) with K a knot in
M, we also prove that any function that is fully additive under connected sum
along knots is actually a function of the ambient manifold only.
","[{""version"":""v1"",""created"":""Fri, 24 Jun 2011 12:37:12 GMT""}]","2011-06-27"
"1106.4953","Denis Bernard","Michel Bauer and Denis Bernard","Convergence of repeated quantum non-demolition measurements and wave
  function collapse","4 pages, 1 figure","Phys. Rev. A84, 044103 (2011)","10.1103/PhysRevA.84.044103",,"math-ph cond-mat.stat-mech math.MP quant-ph","http://arxiv.org/licenses/nonexclusive-distrib/1.0/","  Motivated by recent experiments on quantum trapped fields, we give a rigorous
proof that repeated indirect quantum non-demolition (QND) measurements converge
to the collapse of the wave function as predicted by the postulates of quantum
mechanics for direct measurements. We also relate the rate of convergence
toward the collapsed wave function to the relative entropy of each indirect
measurement, a result which makes contact with information theory.
","[{""version"":""v1"",""created"":""Fri, 24 Jun 2011 12:39:45 GMT""},{""version"":""v2"",""created"":""Tue, 25 Oct 2011 10:26:23 GMT""}]","2015-05-28"
"1106.4954","Lorentz Jantschi","Lorentz J\""antschi, Sorana D. Bolboac\u{a}, Radu E. Sestra\c{s}","Distribution fitting 12. Sampling distribution of compounds abundance
  from plant species measured by instrumentation. Application to plants
  metabolism classification","8 pages, 3 tables, 3 figures; lognormal distribution, combining
  independent tests of significance, plants classification systems",,,,"stat.AP","http://arxiv.org/licenses/nonexclusive-distrib/1.0/","  A series of ten plant species belonging to Magnoliopsida - Dicotyledons class
were analyzed in terms of chemical compounds distribution of abundance,
starting from the assumption that these distributions should give a picture of
similarities and differences between plants metabolism. From a pool of
theoretical distributions, log-normal distribution was selected giving the best
accuracy with the modeled phenomena and agreement with the observed data. From
obtained lognormal distributions statistics a classification were constructed
and were compared with the classification based on phylogeny.
","[{""version"":""v1"",""created"":""Fri, 24 Jun 2011 12:41:20 GMT""},{""version"":""v2"",""created"":""Mon, 27 Jun 2011 06:01:32 GMT""}]","2011-06-28"
"1106.4955","Frederic Paugam","Frederic Paugam","Homotopical Poisson reduction of gauge theories","31 pages",,,,"math-ph math.AG math.MP","http://arxiv.org/licenses/nonexclusive-distrib/1.0/","  The classical Poisson reduction of a given Lagrangian system with (local)
gauge symmetries has to be done before its quantization. We propose here a
coordinate free and self-contained mathematical presentation of the covariant
Batalin-Vilkovisky Poisson reduction of a general gauge theory. It was
explained in physical terms (DeWitt indices) in Henneaux and Teitelboim's book
on quantization of gauge theories. It was studied in coordinates using jet
spaces by Barnich-Brandt-Henneaux and Stasheff, among others. The main idea of
our approach is to use the functor of point approach to spaces of fields to
gain coordinate free geometrical insights on the spaces in play, and to focus
on the notion of Noether identities, that is a simple replacement of the notion
of gauge symmetry, harder to handle algebraically. Our main results are a
precise formulation and understanding of the optimal finiteness hypothesis
necessary for the existence of a solution of the classical master equation, and
an interpretation of the Batalin-Vilkovisky construction in the setting of
homotopical geometry of non-linear partial differential equations.
","[{""version"":""v1"",""created"":""Fri, 24 Jun 2011 12:51:26 GMT""},{""version"":""v2"",""created"":""Wed, 2 Nov 2011 09:06:09 GMT""}]","2011-11-03"
"1106.4956","Javier Fernandez de Bobadilla","Javier Fernandez de Bobadilla and Aurelio Menegon Neto","The boundary of the Milnor fibre of complex and real analytic
  non-isolated singularities","Improved version filling a gap in a paper that is cited and used",,,,"math.AG math.CV","http://arxiv.org/licenses/nonexclusive-distrib/1.0/","  Let f and g be holomorphic function-germs vanishing at the origin of a
complex analytic germ of dimension three. Suppose that they have no common
irreducible component and that the real analytic map-germ given by the
multiplication of f by the conjugate of g has an isolated critical value at 0.
We give necessary and sufficient conditions for the real analytic map-germ to
have a Milnor fibration and we prove that in this case the boundary of its
Milnor fibre is a Waldhausen manifold. As an intermediate milestone we describe
geometrically the Milnor fibre of map-germs given by the multiplication of a
holomorphic and a anti-holomorphic function defined in a complex surface germ,
and we prove an A'Campo-type formula for the zeta function of their monodromy.
","[{""version"":""v1"",""created"":""Fri, 24 Jun 2011 12:53:03 GMT""},{""version"":""v2"",""created"":""Wed, 5 Sep 2012 17:58:41 GMT""},{""version"":""v3"",""created"":""Sun, 31 Mar 2013 18:32:19 GMT""}]","2013-04-02"
"1106.4957","Rosario Bartiromo Dr","Rosario Bartiromo","Maximum entropy distribution of stock price fluctuations",,,,,"q-fin.ST physics.data-an","http://arxiv.org/licenses/nonexclusive-distrib/1.0/","  The principle of absence of arbitrage opportunities allows obtaining the
distribution of stock price fluctuations by maximizing its information entropy.
This leads to a physical description of the underlying dynamics as a random
walk characterized by a stochastic diffusion coefficient and constrained to a
given value of the expected volatility, taking in this way into account the
information provided by the existence of an option market. This model is
validated by a comprehensive comparison with observed distributions of both
price return and diffusion coefficient. Expected volatility is the only
parameter in the model and can be obtained by analysing option prices. We give
an analytic formulation of the probability density function for price returns
which can be used to extract expected volatility from stock option data. This
distribution is of high practical interest since it should be preferred to a
Gaussian when dealing with the problem of pricing derivative financial
contracts.
","[{""version"":""v1"",""created"":""Fri, 24 Jun 2011 12:55:42 GMT""},{""version"":""v2"",""created"":""Fri, 11 May 2012 15:32:58 GMT""},{""version"":""v3"",""created"":""Mon, 14 May 2012 13:02:49 GMT""},{""version"":""v4"",""created"":""Wed, 30 Oct 2013 14:12:16 GMT""}]","2013-10-31"
"1106.4958","Marcus Schaffry","Marcus Schaffry and Brendon W. Lovett and Erik M. Gauger","Creating nuclear spin entanglement using an optical degree of freedom",,"Physical Review A, 84(3):032332, 2011","10.1103/PhysRevA.84.032332",,"quant-ph","http://arxiv.org/licenses/nonexclusive-distrib/1.0/","  Molecular nanostructures are promising building blocks for future quantum
technologies, provided methods of harnessing their multiple degrees of freedom
can be identified and implemented. Due to low decoherence rates nuclear spins
are considered ideal candidates for storing quantum information while optical
excitations can give rise to fast and controllable interactions for information
processing. A recent paper (Physical Review Letters \textbf{104} 200501)
proposed a method for entangling two nuclear spins through their mutual
coupling to a transient optically excited electron spin. Building on the same
idea, we here present an extended and much more detailed theoretical framework,
showing that this method is in fact applicable to a much wider class of
molecular structures than previously discussed in the original proposal.
","[{""version"":""v1"",""created"":""Fri, 24 Jun 2011 12:56:13 GMT""}]","2011-11-15"
"1106.4959","Dremin","I.M. Dremin and V.A. Nechitailo","Soft multiple parton interactions as seen in multiplicity distributions
  at Tevatron and LHC","15 pages, 11 figures",,"10.1103/PhysRevD.84.034026","FIAN/TD-11/11","hep-ph","http://arxiv.org/licenses/nonexclusive-distrib/1.0/","  We analyse the multiplicity distributions of charged particles at Tevatron
(p\bar p) and LHC (pp) energies in the framework of the independent pair parton
interactions (IPPI) model. It is shown that the number of soft pair parton
interactions (and therefore the density of the partonic medium) is large and
increases with energy. The mean multiplicity at each parton interaction grows
also with energy. This growth depends on the width of the rapidity window. The
similar conclusions are obtained in the multiladder exchange model (QGSM).
","[{""version"":""v1"",""created"":""Fri, 24 Jun 2011 12:58:00 GMT""}]","2015-05-28"
"1106.4960","Chin-Cheng Lin","Chin-Cheng Lin, Heping Liu, and Yu Liu","Hardy spaces associated with Schrodinger operators on the Heisenberg
  group","42 pages",,,,"math.AP","http://arxiv.org/licenses/nonexclusive-distrib/1.0/","  Let $L= -\Delta_{\mathbb{H}^n}+V$ be a Schr\""odinger operator on the
Heisenberg group $\mathbb{H}^n$, where $\Delta_{\mathbb{H}^n}$ is the
sub-Laplacian and the nonnegative potential $V$ belongs to the reverse H\""older
class $B_{\frac{Q}{2}}$ and $Q$ is the homogeneous dimension of $\mathbb{H}^n$.
The Riesz transforms associated with the Schr\""odinger operator $L$ are bounded
from $L^1(\mathbb{H}^n)$ to $L^{1,\infty}(\mathbb{H}^n)$. The $L^1$
integrability of the Riesz transforms associated with $L$ characterizes a
certain Hardy type space denoted by $H^1_L(\mathbb{H}^n)$ which is larger than
the usual Hardy space $H^1(\mathbb{H}^n)$. We define $H^1_L(\mathbb{H}^n)$ in
terms of the maximal function with respect to the semigroup $\big \{e^{-s L}:\;
s>0 \big\}$, and give the atomic decomposition of $H^1_L(\mathbb{H}^n)$. As an
application of the atomic decomposition theorem, we prove that
$H^1_L(\mathbb{H}^n)$ can be characterized by the Riesz transforms associated
with $L$. All results hold for stratified groups as well.
","[{""version"":""v1"",""created"":""Fri, 24 Jun 2011 12:58:58 GMT""}]","2011-06-27"
"1106.4961","Michal Kurzynski","Michal Kurzynski, Mieczyslaw Torchala, and Przemyslaw Chelminiak","Output-input coupling in thermally fluctuating biomolecular machines",,"Phys. Rev. E 89, 012722 (2014)","10.1103/PhysRevE.89.012722",,"physics.bio-ph q-bio.BM","http://arxiv.org/licenses/nonexclusive-distrib/1.0/","  Biological molecular machines are proteins that operate under isothermal
conditions hence are referred to as free energy transducers. They can be
formally considered as enzymes that simultaneously catalyze two chemical
reactions: the free energy-donating reaction and the free energy-accepting one.
Most if not all biologically active proteins display a slow stochastic dynamics
of transitions between a variety of conformational substates composing their
native state. In the steady state, this dynamics is characterized by mean
first-passage times between transition substates of the catalyzed reactions. On
taking advantage of the assumption that each reaction proceeds through a single
pair (the gate) of conformational transition substates of the enzyme-substrates
complex, analytical formulas were derived for the flux-force dependence of the
both reactions, the respective stalling forces and the degree of coupling
between the free energy-accepting (output) reaction flux and the free
energy-donating (input) one. The theory is confronted with the results of
random walk simulations on the 5-dimensional hypercube. The formal proof is
given that in the case of reactions proceeding through single gates, the degree
of coupling cannot exceed unity. As some experiments suggest such exceeding,
looking for conditions of increasing the degree of coupling over unity
challenges theory. Though no analytical formulas for models involving more
transition substates are available, study simulations of random walks on
several model networks indicate that the case of the degree of coupling value
higher than one occurs in a natural way for scale-free tree-like networks. This
supports a hypothesis that the protein conformational transition networks, like
higher level biological networks: the proteome and the metabolome, have evolved
in a process of self-organized criticality.
","[{""version"":""v1"",""created"":""Fri, 24 Jun 2011 12:59:50 GMT""}]","2014-02-05"
"1106.4962","Vladimir Skalozub","E.Elizalde and V.Skalozub","Lower bound on the magnetic field strength in the hot universe","6 pages",,,,"hep-ph astro-ph.HE hep-th","http://arxiv.org/licenses/nonexclusive-distrib/1.0/","  It is assumed that long range coherent magnetic fields in the universe were
spontaneously generated at high temperature due to vacuum polarization of
non-Abelian gauge fields, and resulted in the present intergalaxy magnetic
field. The zero value of the screening mass for fields of this type was
discovered recently. Here, a procedure to estimate the field strengths at
different temperatures is developed and the lower bound on the magnetic field
strength $B \sim 10^{14} G$, at the electroweak phase transition temperature,
is derived. As a particular case, the standard model is considered. Some model
dependent peculiarities of the phenomena under investigation are briefly
discussed.
","[{""version"":""v1"",""created"":""Fri, 24 Jun 2011 13:05:56 GMT""}]","2011-06-27"
