"1101.1168","Steve Arscott","Damien Debuisson, Vincent Senez and Steve Arscott","Tunable contact angle hysteresis on micropatterned surfaces","9 pages, 5 figures, 2 tables","Appl. Phys. Lett. 98, 184101 (2011)","10.1063/1.3576921",,"physics.flu-dyn","http://arxiv.org/licenses/nonexclusive-distrib/1.0/","  Micropatterned surfaces composed of concentric circular defects having a
smooth trench-like profile are formed using a photoresist (SU-8). When an
evaporating droplet encounters the micropatterned surface an evaporation phase
is observed consisting of distinct discontinuities and steps in the droplet
wetting contact angle and base radius respectively. The addition of gaps into
the circular defects enables tuning of the contact angle hysteresis; the
receding contact angle of fluorocarbon coated SU-8 can be tuned between
34.6{\deg} and 89.1{\deg} and that of SU-8 surfaces from 5.6{\deg} to
43.3{\deg} depending on the gap length. In addition, a model is developed which
accurately predicts the observed behavior.
","[{""version"":""v1"",""created"":""Thu, 6 Jan 2011 09:13:37 GMT""}]","2011-09-29"
"1101.1169","Prahladh Harsha","Steve Chien and Prahladh Harsha and Alistair Sinclair and Srikanth
  Srinivasan","Almost Settling the Hardness of Noncommutative Determinant","20 pages, 3 figures","In Proc. 43rd ACM Symp. on Theory of Computing (STOC), pages
  499-508, 2011","10.1145/1993636.1993703",,"cs.CC","http://arxiv.org/licenses/nonexclusive-distrib/1.0/","  In this paper, we study the complexity of computing the determinant of a
matrix over a non-commutative algebra. In particular, we ask the question,
""over which algebras, is the determinant easier to compute than the permanent?""
Towards resolving this question, we show the following hardness and easiness of
noncommutative determinant computation.
  * [Hardness] Computing the determinant of an n \times n matrix whose entries
are themselves 2 \times 2 matrices over a field is as hard as computing the
permanent over the field. This extends the recent result of Arvind and
Srinivasan, who proved a similar result which however required the entries to
be of linear dimension.
  * [Easiness] Determinant of an n \times n matrix whose entries are themselves
d \times d upper triangular matrices can be computed in poly(n^d) time.
  Combining the above with the decomposition theorem of finite dimensional
algebras (in particular exploiting the simple structure of 2 \times 2 matrix
algebras), we can extend the above hardness and easiness statements to more
general algebras as follows. Let A be a finite dimensional algebra over a
finite field with radical R(A).
  * [Hardness] If the quotient A/R(A) is non-commutative, then computing the
determinant over the algebra A is as hard as computing the permanent.
  * [Easiness] If the quotient A/R(A) is commutative and furthermore, R(A) has
nilpotency index d (i.e., the smallest d such that R(A)d = 0), then there
exists a poly(n^d)-time algorithm that computes determinants over the algebra
A.
  In particular, for any constant dimensional algebra A over a finite field,
since the nilpotency index of R(A) is at most a constant, we have the following
dichotomy theorem: if A/R(A) is commutative, then efficient determinant
computation is feasible and otherwise determinant is as hard as permanent.
","[{""version"":""v1"",""created"":""Thu, 6 Jan 2011 09:14:42 GMT""}]","2018-10-09"
"1101.1170","Sylvaine Turck-Chieze STC","S. Turck-Chi\`eze, G. Loisel, D. Gilles, L. Piau, C. Blancard, T.
  Blenski, M. Busquet, T. Caillaud, P. Coss\'e, F. Delahaye, G. Faussurier, J.
  Fariaut, F. Gilleron, J.A. Guzik, J. Harris, D.P. Kilcrease, N.H. Magee, J.C.
  Pain, Q. Porcherot, M. Poirier, G. Soullier, C.J. Zeippen, S.
  Bastiani-Ceccotti, C. Reverdin, V. Silvert, F. Thais, B. Villette","Radiative properties of stellar plasmas and open challenges","6 pages, 5 figures, in press (conference HEDLA 2010)","Astrophys. Space Science 2011","10.1007/s10509-010-0583-8",,"astro-ph.SR physics.plasm-ph","http://arxiv.org/licenses/nonexclusive-distrib/1.0/","  The lifetime of solar-like stars, the envelope structure of more massive
stars, and stellar acoustic frequencies largely depend on the radiative
properties of the stellar plasma. Up to now, these complex quantities have been
estimated only theoretically. The development of the powerful tools of helio-
and astero- seismology has made it possible to gain insights on the interiors
of stars. Consequently, increased emphasis is now placed on knowledge of the
monochromatic opacity coefficients. Here we review how these radiative
properties play a role, and where they are most important. We then concentrate
specifically on the envelopes of $\beta$ Cephei variable stars. We discuss the
dispersion of eight different theoretical estimates of the monochromatic
opacity spectrum and the challenges we need to face to check these calculations
experimentally.
","[{""version"":""v1"",""created"":""Thu, 6 Jan 2011 09:17:56 GMT""}]","2015-05-20"
"1101.1171","Abbas Najati","Abbas Najati And Soon-Mo Jung","Approximately Quadratic Mappings on Restricted Domains","9 pages","J. Inequalities and Applications, Volume 2010, Article ID 503458","10.1155/2010/503458",,"math.FA","http://arxiv.org/licenses/nonexclusive-distrib/1.0/","  In this paper, we introduce a generalized quadratic functional equation $f(rx
+ sy) = rf(x) + sf(y) - rsf(x - y)$ where $r, s$ are nonzero real numbers with
$r + s = 1.$ We show that this functional equation is quadratic if $r, s$ are
rational numbers. We also investigate its stability problem on restricted
domains. These results are applied to study of an asymptotic behavior of these
generalized quadratic mappings.
","[{""version"":""v1"",""created"":""Thu, 6 Jan 2011 09:19:53 GMT""}]","2011-01-07"
"1101.1172","Simon Blackburn","Simon R Blackburn","The existence of k-radius sequences","8 pages. More papers cited, and a minor reorganisation of the last
  section, since last version. Typo corrected in the statement of Theorem 4",,,,"math.CO cs.DM","http://arxiv.org/licenses/nonexclusive-distrib/1.0/","  Let $n$ and $k$ be positive integers, and let $F$ be an alphabet of size $n$.
A sequence over $F$ of length $m$ is a \emph{$k$-radius sequence} if any two
distinct elements of $F$ occur within distance $k$ of each other somewhere in
the sequence. These sequences were introduced by Jaromczyk and Lonc in 2004, in
order to produce an efficient caching strategy when computing certain functions
on large data sets such as medical images.
  Let $f_k(n)$ be the length of the shortest $n$-ary $k$-radius sequence. The
paper shows, using a probabilistic argument, that whenever $k$ is fixed and
$n\rightarrow\infty$ \[ f_k(n)\sim \frac{1}{k}\binom{n}{2}. \]
  The paper observes that the same argument generalises to the situation when
we require the following stronger property for some integer $t$ such that
$2\leq t\leq k+1$: any $t$ distinct elements of $F$ must simultaneously occur
within a distance $k$ of each other somewhere in the sequence.
","[{""version"":""v1"",""created"":""Thu, 6 Jan 2011 09:21:16 GMT""},{""version"":""v2"",""created"":""Thu, 24 Feb 2011 16:43:53 GMT""},{""version"":""v3"",""created"":""Fri, 5 Aug 2011 09:40:30 GMT""}]","2011-08-08"
"1101.1173","Jean-Marc Luck","D. Gredat, I. Dornic, and J.M. Luck","On an imaginary exponential functional of Brownian motion","30 pages, 9 figures, 3 tables","J. Phys. A: Math. Theor. 44 (2011) 175003","10.1088/1751-8113/44/17/175003",,"cond-mat.stat-mech math-ph math.MP","http://arxiv.org/licenses/nonexclusive-distrib/1.0/","  We investigate a random integral which provides a natural example of an
imaginary exponential functional of Brownian motion. This functional shows up
in the study of the binary annihilation process, within the Doi-Peliti
formalism for reaction-diffusion systems. The main emphasis is put on the
complementarity between the usual Langevin approach and another approach based
on the similarity with Kesten variables and other one-dimensional disordered
systems. Even though neither of these routes leads to the full solution of the
problem, we have obtained a collection of results describing various regimes of
interest.
","[{""version"":""v1"",""created"":""Thu, 6 Jan 2011 09:21:46 GMT""}]","2015-03-17"
"1101.1174","Cecile Robilliard","C\'ecile Robilliard (LCAR), Gilles Bailly (LCAR)","Towards a first observation of magneto-electric directional anisotropy
  and linear birefringence in gases","Proceedings of PSAS'2010, to be published in Canadian Journal of
  Physics, 2011 Jan",,"10.1139/P10-097",,"quant-ph physics.optics","http://arxiv.org/licenses/nonexclusive-distrib/1.0/","  In this contribution to PSAS'2010 we report on recent progress on an
experiment aimed at measuring small optical directional anisotropies by
frequency metrology in a high finesse ring cavity. We focus on our first
experimental goal, the measurement of magneto-electric effects in gases. After
a review of the expected effects in our set-up, we present the apparatus and
the measurement procedure, showing that we already have the necessary
sensitivity to start novel experiments.
","[{""version"":""v1"",""created"":""Thu, 6 Jan 2011 09:22:38 GMT""}]","2015-05-20"
"1101.1175","Gad Koren","Gad Koren and Tal Kirzhner","Observation of two Andreev-like energy scales in $La_{2-x}Sr_{x}CuO_4$
  superconductor/normal-metal/superconductor junctions","19 pages, 11 figures","Phys. Rev. Lett. vol. 106, 017002 (2011), including the
  supplementary material herewith","10.1103/PhysRevLett.106.017002",,"cond-mat.supr-con cond-mat.str-el","http://arxiv.org/licenses/nonexclusive-distrib/1.0/","  Conductance spectra measurements of highly transparent ramp-type junctions
made of superconducting $La_{2-x}Sr_{x}CuO_4$ electrodes and non
superconducting $La_{1.65}Sr_{0.35}CuO_4$ barrier are reported. At low
temperatures below $T_c$, these junctions have two prominent Andreev-like
conductance peaks with clear steps at energies $\Delta_1$ and $\Delta_2$ with
$\Delta_2 > 2\Delta_1$. No such peaks appear above $T_c$. The doping dependence
at 2 K shows that both $\Delta_1$ and $\Delta_2$ scale roughly as $T_c$.
$\Delta_1$ is identified as the superconducting energy gap, while a few
scenarios are proposed as for the origin of $\Delta_2$.
","[{""version"":""v1"",""created"":""Thu, 6 Jan 2011 09:23:00 GMT""}]","2015-05-20"
"1101.1176","Makoto Nakashima","Makoto Nakashima","Almost sure central limit theorem for branching random walks in random
  environment","Published in at http://dx.doi.org/10.1214/10-AAP699 the Annals of
  Applied Probability (http://www.imstat.org/aap/) by the Institute of
  Mathematical Statistics (http://www.imstat.org)","Annals of Applied Probability 2011, Vol. 21, No. 1, 351-373","10.1214/10-AAP699","IMS-AAP-AAP699","math.PR","http://arxiv.org/licenses/nonexclusive-distrib/1.0/","  We consider the branching random walks in $d$-dimensional integer lattice
with time--space i.i.d. offspring distributions. Then the normalization of the
total population is a nonnegative martingale and it almost surely converges to
a certain random variable. When $d\geq3$ and the fluctuation of environment
satisfies a certain uniform square integrability then it is nondegenerate and
we prove a central limit theorem for the density of the population in terms of
almost sure convergence.
","[{""version"":""v1"",""created"":""Thu, 6 Jan 2011 09:46:51 GMT""}]","2011-01-07"
"1101.1177","Tekin Dereli","T. Dereli, O. Sert","Non-minimally Coupled Gravitational and Electromagnetic Fields: pp-Wave
  Solutions",,"Phys.Rev.D83:065005,2011","10.1103/PhysRevD.83.065005",,"gr-qc hep-th","http://arxiv.org/licenses/nonexclusive-distrib/1.0/","  We give the Lagrangian formulation of a generic non-minimally extended
Einstein-Maxwell theory with an action that is linear in the curvature and
quadratic in the electromagnetic field. We derive the coupled field equations
by a first order variational principle using the method of Lagrange
multipliers. We look for solutions describing plane-fronted Einstein-Maxwell
waves with parallel rays. We give a family of exact solutions associated with a
partially massless spin-2 photon and a partially massive spin-2 graviton.
","[{""version"":""v1"",""created"":""Thu, 6 Jan 2011 10:00:03 GMT""}]","2011-03-21"
"1101.1178","Valentina Tozzini Dr","Valentina Tozzini and Vittorio Pellegrini","Reversible hydrogen storage by controlled buckling of graphene layers",,,,,"cond-mat.mes-hall","http://arxiv.org/licenses/nonexclusive-distrib/1.0/","  We propose a multi-layer graphene-based device in which storage and release
of atomic hydrogen is obtained by exploiting and controlling the corrugation of
the layers. The proposal is based on density-functional simulations of hydrogen
chemisorption on graphene with superimposed corrugation. We report a tunability
of the binding energies of more than 2 eV by changing the sheet out-of-plane
deformation up to \pm 0.2 {\AA}, the convex regions allocating the
energetically favored hydrogen binding sites. We discuss an optimized process
of curvature inversion that can lead to efficient and fast hydrogen release and
H2 formation. Our corrugated graphene device can potentially reach gravimetric
capacities of ~8 wt % and reversibly store and release atomic hydrogen by
application of external fields without the need of modifying temperature and
pressure.
","[{""version"":""v1"",""created"":""Thu, 6 Jan 2011 10:10:41 GMT""}]","2011-01-07"
"1101.1179","Jukka V\""ayrynen","Jukka I. Vayrynen and G.E. Volovik","Soft topological objects in topological media","6 pages, no figures, JETP Letters style, version submitted to JETP
  Lett","Pisma Zh.Eksp.Teor.Fiz.93:378-382, 2011; JETP Lett.93:344-348,2011","10.1134/S0021364011060129",,"cond-mat.str-el hep-ph","http://arxiv.org/licenses/nonexclusive-distrib/1.0/","  Topological invariants in terms of the Green's function in momentum and real
space determine properties of smooth textures within topological media. In
space dimension D=1 the topological invariant N_3 in terms of the Green's
function G(\omega,k_x,x) determines the fermion number of the 1D soliton, while
in space dimension D=3 the topological invariant N_5 in terms of the Green's
function G(\omega,k_x,k_y,k_z,z) determines quantization of Hall conductivity
in the soliton plane within the topological insulators.
","[{""version"":""v1"",""created"":""Thu, 6 Jan 2011 10:12:08 GMT""},{""version"":""v2"",""created"":""Mon, 14 Feb 2011 21:08:33 GMT""},{""version"":""v3"",""created"":""Wed, 16 Feb 2011 07:36:30 GMT""}]","2015-03-17"
"1101.1180","Konstantinos Tsekouras","K.Tsekouras, D.Lacoste, K.Mallick and J.-F. Joanny","Condensation of actin filaments pushing against a barrier","21 pages, 6 figures: Combined figures, fixed typos, added extra
  material, altered symbolism to avoid confusion. Accepted by New Journal of
  Physics","New J. Phys. 13, 103032 (2011)","10.1088/1367-2630/13/10/103032",,"cond-mat.stat-mech physics.bio-ph q-bio.SC","http://arxiv.org/licenses/nonexclusive-distrib/1.0/","  We develop a model to describe the force generated by the polymerization of
an array of parallel biofilaments. The filaments are assumed to be coupled only
through mechanical contact with a movable barrier. We calculate the filament
density distribution and the force-velocity relation with a mean-field approach
combined with simulations. We identify two regimes: a non-condensed regime at
low force in which filaments are spread out spatially, and a condensed regime
at high force in which filaments accumulate near the barrier. We confirm a
result previously known from other related studies, namely that the stall force
is equal to N times the stall force of a single filament. In the model studied
here, the approach to stalling is very slow, and the velocity is practically
zero at forces significantly lower than the stall force.
","[{""version"":""v1"",""created"":""Thu, 6 Jan 2011 10:18:43 GMT""},{""version"":""v2"",""created"":""Wed, 13 Apr 2011 08:44:25 GMT""},{""version"":""v3"",""created"":""Thu, 19 May 2011 21:01:01 GMT""},{""version"":""v4"",""created"":""Thu, 6 Oct 2011 17:40:25 GMT""}]","2015-05-20"
"1101.1181","Burkhard Schmidt","Burkhard Schmidt and Mohammad Siahatgar and Peter Thalmeier","Ordered moment in the anisotropic and frustrated square lattice
  Heisenberg model","19 pages, 19 figures","Phys. Rev. B 83, 075123 (2011)","10.1103/PhysRevB.83.075123",,"cond-mat.str-el","http://arxiv.org/licenses/nonexclusive-distrib/1.0/","  The two-dimensional frustrated next nearest neighbor Heisenberg model on the
square lattice is a prime example for a spin system where quantum fluctuations
can either destroy or stabilize magnetic order. The phase boundaries and
staggered moment dependence on the frustration ratio J_2/J_1 of the exchange
constants are fairly well understood both from approximate analytical and
numerical methods. In this work we use exact diagonalization for finite
clusters for an extensive investigation of the more general J_1a,b-J_2 model
which includes a spatial exchange anisotropy between next-neighbor spins. We
introduce a systematic way of tiling the square lattice and, for this low
symmetry model, define a controlled procedure for the finite size scaling that
is compatible with the possible magnetic phases. We obtain ground state
energies, structure factors and ordered moments and compare with the results of
spin wave calculations. We conclude that J_1a,b exchange anisotropy strongly
stabilizes the columnar antiferromagnetic phase for all frustration parameters,
in particular in the region of the spin nematic phase of the isotropic model.
","[{""version"":""v1"",""created"":""Thu, 6 Jan 2011 10:26:07 GMT""},{""version"":""v2"",""created"":""Thu, 10 Mar 2011 09:42:06 GMT""}]","2011-03-11"
"1101.1182","Sylvaine Turck-Chieze STC","S Turck-Chi\`eze, G Loisel, D Gilles, F Thais, S Bastiani, C Blancard,
  M Busquet, T Caillaud, P Cosse, T Blenski, F Delahaye, J E Ducret, G
  Faussurier, F Gilleron, J Guzik, J W Harris, D P Kilcrease, N H Magee, L
  Piau, J C Pain, M Poirier, Q Porcherot, C Reverdin, V Silvert, B Villette and
  C Zeippen","Theoretical and experimental activities on opacities for a good
  interpretation of seismic stellar probes","6 pages, 4 figures, invited talk at SOHO24","Journal of Physics: conf series 2011","10.1088/1742-6596/271/1/012035",,"astro-ph.SR","http://arxiv.org/licenses/nonexclusive-distrib/1.0/","  Opacity calculations are basic ingredients of stellar modelling. They play a
crucial role in the interpretation of acoustic modes detected by SoHO, COROT
and KEPLER. In this review we present our activities on both theoretical and
experimental sides. We show new calculations of opacity spectra and comparisons
between eight groups who produce opacity spectra calculations in the domain
where experiments are scheduled. Real differences are noticed with real
astrophysical consequences when one extends helioseismology to cluster studies
of different compositions. Two cases are considered presently: (1) the solar
radiative zone and (2) the beta Cephei envelops. We describe how our
experiments are performed and new preliminary results on nickel obtained in the
campaign 2010 at LULI 2000 at Polytechnique.
","[{""version"":""v1"",""created"":""Thu, 6 Jan 2011 10:32:45 GMT""}]","2015-05-20"
"1101.1183","Miloslav Znojil","Miloslav Znojil","An exactly solvable quantum-lattice model with a tunable degree of
  nonlocality","35 pp","J. Phys. A: Math. Theor. 44 (2011) 075302","10.1088/1751-8113/44/7/075302",,"math-ph math.MP quant-ph","http://arxiv.org/licenses/nonexclusive-distrib/1.0/","  An array of N subsequent Laguerre polynomials is interpreted as an
eigenvector of a non-Hermitian tridiagonal Hamiltonian $H$ with real spectrum
or, better said, of an exactly solvable N-site-lattice cryptohermitian
Hamiltonian whose spectrum is known as equal to the set of zeros of the N-th
Laguerre polynomial. The two key problems (viz., the one of the ambiguity and
the one of the closed-form construction of all of the eligible inner products
which make $H$ Hermitian in the respective {\em ad hoc} Hilbert spaces) are
discussed. Then, for illustration, the first four simplest, $k-$parametric
definitions of inner products with $k=0,k=1,k=2$ and $k=3$ are explicitly
displayed. In mathematical terms these alternative inner products may be
perceived as alternative Hermitian conjugations of the initial N-plet of
Laguerre polynomials. In physical terms the parameter $k$ may be interpreted as
a measure of the ""smearing of the lattice coordinates"" in the model.
","[{""version"":""v1"",""created"":""Thu, 6 Jan 2011 10:34:28 GMT""}]","2011-01-27"
"1101.1184","Jean-Philippe Mandallena","Omar Anza Hafsa and Jean-Philippe Mandallena","Relaxation and 3d-2d passage theorems in hyperelasticity","31 pages",,,,"math.AP math.CA","http://arxiv.org/licenses/nonexclusive-distrib/1.0/","  We give an overview of relaxation and 3d-2d passage theorems in
hyperelasticity in the framework of the multidimensional calculus of
variations. Some open questions are addressed. This paper, which is an expanded
version of the outline-paper [AHM09b], comes as a companion to [AHM09a].
","[{""version"":""v1"",""created"":""Thu, 6 Jan 2011 10:41:22 GMT""}]","2011-01-07"
"1101.1185","Sylvaine Turck-Chieze STC","S Turck-Chieze, S Couvidat, V Duez, S Mathis, J Marques, A Palacios, L
  Piau","The dynamics of the radiative zone of the Sun","4 pages, 2 figures, contribution to SOHO24 in press","Journal of Physics: Conf. Series 2011","10.1088/1742-6596/271/1/012044",,"astro-ph.SR","http://arxiv.org/licenses/nonexclusive-distrib/1.0/","  Helioseismology puts strong constraints on the internal sound speed and on
the rotation profile in the radiative zone. Young stars of solar type are more
active and faster rotators than the Sun. So we begin to build models which
include different rotation histories and compare the results with all the solar
observations. The profiles of the rotation we get have interesting consequence
for the introduction of magnetic field in the radiative zone. We discuss also
the impact of mass loss deduced from measured flux of young stars. We deduce
from these comparisons some quantitative effect of the dynamical processes
(rotation, magnetic field and mass loss) of these early stages on the present
sound speed and density. We show finally how we can improve our present
knowledge of the radiative zone with PICARD and GOLFNG.
","[{""version"":""v1"",""created"":""Thu, 6 Jan 2011 10:43:25 GMT""}]","2015-05-20"
"1101.1186","Poilblanc","Didier Poilblanc, Andreas W.W. Ludwig, Simon Trebst and Matthias
  Troyer","Quantum spin ladders of non-Abelian anyons","12 pages, 17 figures, 3 tables, 2 references added","Phys. Rev. B 83, 134439 (2011)","10.1103/PhysRevB.83.134439",,"cond-mat.str-el quant-ph","http://arxiv.org/licenses/nonexclusive-distrib/1.0/","  Quantum ladder models, consisting of coupled chains, form intriguing systems
bridging one and two dimensions and have been well studied in the context of
quantum magnets and fermionic systems. Here we consider ladder systems made of
more exotic quantum mechanical degrees of freedom, so-called non-Abelian
anyons, which can be thought of as certain quantum deformations of ordinary
SU(2) spins. Such non-Abelian anyons occur as quasiparticle excitations in
topological quantum fluids, including p_x + i p_y superconductors, certain
fractional quantum Hall states, and rotating Bose-Einstein condensates. Here we
use a combination of exact diagonalization and conformal field theory to
determine the phase diagrams of ladders with up to four chains. We discuss how
phenomena familiar from ordinary SU(2) spin ladders are generalized in their
anyonic counterparts, such as gapless and gapped phases, odd/even effects with
the ladder width, and elementary `magnon' excitations. Other features are
entirely due to the topological nature of the anyonic degrees of freedom.
","[{""version"":""v1"",""created"":""Thu, 6 Jan 2011 10:44:00 GMT""},{""version"":""v2"",""created"":""Thu, 13 Jan 2011 10:16:43 GMT""}]","2015-03-17"
"1101.1187","Mathieu Ribordy","M. Ribordy (for the IceCube coll)","Multi-Messenger Astrophysics with IceCube","10 pages, 3 figures. Conference proceedings of invited talk at
  SciNeGHE 2010, Sept. 8-10, Trieste. To appear in Il Nuovo Cimento C -
  Colloquia on physics",,"10.1393/ncc/i2011-10862-5",,"astro-ph.HE","http://arxiv.org/licenses/nonexclusive-distrib/1.0/","  The cubic kilometer IceCube neutrino telescope now operating at the South
Pole in a near complete configuration observes the neutrino sky with an
unprecedented sensitivity to galactic and extra-galactic cosmic ray
accelerators. Within the multi-messenger framework, IceCube offers unique
capabilities to correlate and contrast the neutrino sky with the gamma-ray sky
and ultra high energy cosmic rays and complements other indirect and direct
dark matter search programs. We review here the status of the experiment and
recent selected results. A discussion of the implications of the observations
will be followed by the prospects of future developments, substantially
extending the reach of the observatory at extremely high energies, in the GZK
region and at low energies enhancing capabilities to probe dark matter and
cosmic ray sources in the southern sky.
","[{""version"":""v1"",""created"":""Thu, 6 Jan 2011 10:46:04 GMT""}]","2022-03-02"
