"1101.1016","Renjin Jiang","Renjin Jiang","Gradient Estimate for Solutions to Poisson Equations in Metric Measure
  Spaces","Journal of Functional Analysis, to appear",,,,"math.AP","http://arxiv.org/licenses/nonexclusive-distrib/1.0/","  Let $(X,d)$ be a complete, pathwise connected metric measure space with
locally Ahlfors $Q$-regular measure $\mu$, where $Q>1$. Suppose that
$(X,d,\mu)$ supports a (local) $(1,2)$-Poincar\'e inequality and a suitable
curvature lower bound. For the Poisson equation $\Delta u=f$ on $(X,d,\mu)$,
Moser-Trudinger and Sobolev inequalities are established for the gradient of
$u$. The local H\""older continuity with optimal exponent of solutions is
obtained.
","[{""version"":""v1"",""created"":""Wed, 5 Jan 2011 16:01:16 GMT""},{""version"":""v2"",""created"":""Thu, 15 Sep 2011 16:12:58 GMT""}]","2011-09-16"
"1101.1017","Weiqiang Yu","Weiqiang Yu, L. Ma, J. B. He, D. M. Wang, T.-L. Xia, G. F. Chen, Wei
  Bao","77Se NMR study of pairing symmetry and spin dynamics in KyFe2-xSe2","Chemical composition of crystals determined. Accepted in Physical
  Review Letters","Phys. Rev. Lett. 106, 197001 (2011)","10.1103/PhysRevLett.106.197001",,"cond-mat.supr-con cond-mat.str-el","http://arxiv.org/licenses/nonexclusive-distrib/1.0/","  We present a 77Se NMR study of the newly discovered iron selenide
superconductor KyFe2-xSe2, in which Tc = 32 K. Below Tc, the Knight shift 77K
drops sharply with temperature, providing strong evidence for singlet pairing.
Above Tc, Korringa-type relaxation indicates Fermi-liquid behavior. Our
experimental results set strict constraints on the nature of possible theories
for the mechanism of high-Tc superconductivity in this iron selenide system.
","[{""version"":""v1"",""created"":""Wed, 5 Jan 2011 16:03:24 GMT""},{""version"":""v2"",""created"":""Wed, 13 Apr 2011 00:34:23 GMT""}]","2015-05-20"
"1101.1018","Justin Panarin","J. Panarin, S.Raymond, G.Lapertot, J.-M. Mignot and J.Flouquet","Effects of La non-magnetic impurities on the spin resonance of
  CeCoIn$_{5}$","4 pages, 5 figures",,,,"cond-mat.supr-con cond-mat.str-el","http://arxiv.org/licenses/nonexclusive-distrib/1.0/","  The influence of La non magnetic impurities on the spin dynamics of
CeCoIn$_{5}$ was studied by inelastic neutron scattering. In La-substituted
systems, the spin resonance peak (observed at $\Omega_{res}=0.55 meV$ in the
pure system) is shifted to lower energies but the ratio
$\Omega_{res}/k_{B}T_{c}$ remains unchanged. The excitation broadens till it
reaches 0.3 meV equal to the value of the quasi-elastic signal in the normal
state. The evolution of La substitution is compared with the evolution of the
magnetic resonance in Ni and Zn substituted YBa$_{2}$Cu$_{3}$O$_{7}$.
","[{""version"":""v1"",""created"":""Wed, 5 Jan 2011 16:10:20 GMT""}]","2011-01-06"
"1101.1019","Marco Squassina","Marco Squassina","Symmetry in variational principles and applications","20 pages",,"10.1112/jlms/jdr046",,"math.OC math.FA","http://arxiv.org/licenses/nonexclusive-distrib/1.0/","  We formulate symmetric versions of classical variational principles. Within
the framework of non-smooth critical point theory, we detect Palais-Smale
sequences with additional second order and symmetry information. We discuss
applications to PDEs, fixed point theory and geometric analysis.
","[{""version"":""v1"",""created"":""Wed, 5 Jan 2011 16:14:08 GMT""}]","2014-02-26"
"1101.1020","Martin Rubey","Stefan Kluge, Martin Rubey","Cyclic Sieving for torsion pairs in the cluster category of Dynkin type
  A_n","17 pages, 4 pdf-Figures",,,,"math.CO","http://arxiv.org/licenses/nonexclusive-distrib/1.0/","  Recently, a combinatorial model for torsion pairs in the cluster category of
Dynkin type A_n was introduced, and used to derive an explicit formula for
their number. In this article we determine the number of torsion pairs that are
invariant under b-fold application of Auslander-Reiten translation. It turns
out that the set of torsion pairs together with Auslander-Reiten translation,
and a natural q-analogue of the formula for the number of all torsion pairs
exhibits the cyclic sieving phenomenon.
","[{""version"":""v1"",""created"":""Wed, 5 Jan 2011 16:17:24 GMT""}]","2015-03-17"
"1101.1021","Sangwon Oh","Sangwon Oh, A. M. Mounce, S. Mukhopadhyay, W. P. Halperin, A. B.
  Vorontsov, S. L. Bud'ko, P. C. Canfield, Y. Furukawa, A. P. Reyes, P. L.
  Kuhns","$^{75}$As NMR of Ba(Fe$_{0.93}$Co$_{0.07}$)$_{2}$As$_{2}$ in High
  Magnetic Field","13 pages, 9 figures","Phys. Rev. B 83, 214501 (2011)","10.1103/PhysRevB.83.214501",,"cond-mat.supr-con","http://arxiv.org/licenses/nonexclusive-distrib/1.0/","  The superconducting state of an optimally doped single crystal of
Ba(Fe$_{0.93}$Co$_{0.07}$)$_2$As$_2$ was investigated by $^{75}$As NMR in high
magnetic fields from 6.4 T to 28 T. It was found that the Knight shift is least
affected by vortex supercurrents in high magnetic fields, $H>11$ T, revealing
slow, possibly higher order than linear, increase with temperature at $T
\lesssim 0.5 \, T_c$, with $T_c \approx 23 \, K$. This is consistent with the
extended s-wave state with $A_{1g}$ symmetry but the precise details of the gap
structure are harder to resolve. Measurements of the NMR spin-spin relaxation
time, $T_2$, indicate a strong indirect exchange interaction at all
temperatures. Below the superconducting transition temperature vortex dynamics
lead to an anomalous dip in $T_2$ at the vortex freezing transition from which
we obtain the vortex phase diagram up to $H = 28$ T.
","[{""version"":""v1"",""created"":""Wed, 5 Jan 2011 16:22:00 GMT""},{""version"":""v2"",""created"":""Thu, 3 Mar 2011 15:50:13 GMT""},{""version"":""v3"",""created"":""Wed, 1 Jun 2011 22:51:09 GMT""}]","2011-06-03"
"1101.1022","Michel  Pocchiola","Luc Habert and Michel Pocchiola","LR characterization of chirotopes of finite planar families of pairwise
  disjoint convex bodies","100 pages, 73 figures; accepted manuscript version","Discrete Comput. Geom., 50 (3): 552-648, 2013","10.1007/s00454-013-9532-y",,"math.CO cs.CG math.MG","http://arxiv.org/licenses/nonexclusive-distrib/1.0/","  We extend the classical LR characterization of chirotopes of finite planar
families of points to chirotopes of finite planar families of pairwise disjoint
convex bodies: a map \c{hi} on the set of 3-subsets of a finite set I is a
chirotope of finite planar families of pairwise disjoint convex bodies if and
only if for every 3-, 4-, and 5-subset J of I the restriction of \c{hi} to the
set of 3-subsets of J is a chirotope of finite planar families of pairwise
disjoint convex bodies. Our main tool is the polarity map, i.e., the map that
assigns to a convex body the set of lines missing its interior, from which we
derive the key notion of arrangements of double pseudolines, introduced for the
first time in this paper.
","[{""version"":""v1"",""created"":""Wed, 5 Jan 2011 16:42:24 GMT""},{""version"":""v2"",""created"":""Mon, 16 Jul 2012 13:16:54 GMT""},{""version"":""v3"",""created"":""Sun, 5 Oct 2014 19:14:26 GMT""}]","2014-10-07"
"1101.1023","Francois Dubin","Mathieu Alloing, Aristide Lemaitre, Francois Dubin","Quantum Signature Blurred by Disorder in Indirect Exciton Gases",,,"10.1209/0295-5075/93/17007",,"cond-mat.str-el cond-mat.mes-hall","http://arxiv.org/licenses/nonexclusive-distrib/1.0/","  The photoluminescence dynamics of a microscopic gas of indirect excitons
trapped in coupled quantum wells is probed at very low bath temperature
(approximately 350 mK). Our experiments reveal the non linear energy relaxation
characteristics of indirect excitons. Particularly, we observe that the
excitons dynamics is strongly correlated with the screening of structural
disorder by repulsive exciton-exciton interactions. For our experiments where
two-dimensional excitonic states are gradually defined, the distinctive
enhancement of the exciton scattering rate towards lowest energy states with
increasing density does not reveal unambiguously quantum statistical effects
such as Bose stimulation.
","[{""version"":""v1"",""created"":""Wed, 5 Jan 2011 16:50:13 GMT""}]","2015-05-20"
"1101.1024","Nam-Gyu Kang","Nam-Gyu Kang and Nikolai Makarov","Gaussian free field and conformal field theory","122 pages, 5 figures. To appear in Ast\'erisque",,,,"math.PR math-ph math.CV math.MP","http://arxiv.org/licenses/nonexclusive-distrib/1.0/","  In these mostly expository lectures, we give an elementary introduction to
conformal field theory in the context of probability theory and complex
analysis. We consider statistical fields, and define Ward functionals in terms
of their Lie derivatives. Based on this approach, we explain some equations of
conformal field theory and outline their relation to SLE theory.
","[{""version"":""v1"",""created"":""Wed, 5 Jan 2011 16:51:30 GMT""},{""version"":""v2"",""created"":""Wed, 9 Feb 2011 04:57:42 GMT""},{""version"":""v3"",""created"":""Wed, 19 Jun 2013 20:57:35 GMT""}]","2015-03-17"
"1101.1025","Kristine Bauer","Kristine Bauer, Brenda Johnson and Randy McCarthy","Cross effects and calculus in an unbased setting","55 pages. With appendix by Rosona Eldred. Submitted to Transactions
  of the AMS. New version adds section 7 on convergence of the cotriple tower.
  Second update makes repairs to section 3 in the proof of establishing the
  cotriple, adds a careful accounting of homotopy (co)limit properties being
  used in the paper, some of these are established in a new appendix",,,,"math.AT","http://arxiv.org/licenses/nonexclusive-distrib/1.0/","  We study functors F from C_f to D where C and D are simplicial model
categories and C_f is the full subcategory of C consisting of objects that
factor a fixed morphism f from A to B. We define the analogs of Eilenberg and
Mac Lane's cross effects functors in this context, and identify explicit
adjoint pairs of functors whose associated cotriples are the diagonals of the
cross effects. With this, we generalize the cotriple Taylor tower construction
of [10] from the setting of functors from pointed categories to abelian
categories to that of functors from C_f to D to produce a tower of functors
whose n-th term is a degree n functor. We compare this tower to Goodwillie's
tower of n-excisive approximations to F found in [8]. When D is a good category
of spectra, and F is a functor that commutes with realizations, the towers
agree. More generally, for functors that do not commute with realizations, we
show that the terms of the towers agree when evaluated at the initial object of
C_f.
","[{""version"":""v1"",""created"":""Wed, 5 Jan 2011 16:56:26 GMT""},{""version"":""v2"",""created"":""Fri, 29 Jun 2012 21:07:27 GMT""},{""version"":""v3"",""created"":""Fri, 28 Feb 2014 18:08:49 GMT""}]","2014-03-03"
"1101.1026","Emiliano Sefusatti","Emiliano Sefusatti and Filippo Vernizzi","Cosmological structure formation with clustering quintessence","36 pages, 11 figures. Replaced to match published version. Two
  figures added and minor revisions","JCAP 1103:047,2011","10.1088/1475-7516/2011/03/047","t11/007","astro-ph.CO gr-qc hep-th","http://arxiv.org/licenses/nonexclusive-distrib/1.0/","  We study large-scale structure formation in the presence of a quintessence
component with zero speed of sound in the framework of Eulerian Perturbation
Theory. Due to the absence of pressure gradients, quintessence and dark matter
are comoving and can be studied as a unique fluid in terms of the total energy
density contrast and the common velocity. In this description the clustering of
quintessence enhances the linear term proportional to the velocity divergence
in the continuity equation by a factor (1+w) Omega_Q / Omega_m. This is
responsible for a rapid evolution of the growth rate at low redshifts, and
modifies the standard relation between the velocity divergence and the growth
factor. For the total fluid, the solutions for the linear growth function and
growth rate can be written in integral forms and admit simple fitting formulae,
as in the LambdaCDM case. At second order in perturbation theory, we derive an
explicit expression for the kernels F_2 and G_2. They receive modifications of
the order of the ratio between quintessence and total energy density
perturbations, which affect the corresponding tree-level bispectra. We finally
compute the cumulative signal-to-noise in the power spectrum, bispectrum and
reduced bispectrum, expected for departures from a LambdaCDM cosmology both in
the clustering and smooth quintessence scenarios. The reduced bispectrum, in
particular, receives sensible modifications only in the clustering case and can
potentially be used to detect or rule out the model.
","[{""version"":""v1"",""created"":""Wed, 5 Jan 2011 16:56:56 GMT""},{""version"":""v2"",""created"":""Wed, 26 Jan 2011 23:50:53 GMT""},{""version"":""v3"",""created"":""Tue, 29 Mar 2011 14:01:50 GMT""}]","2015-03-17"
"1101.1027","Samuel Meek","Samuel A. Meek, Gabriele Santambrogio, Boris G. Sartakov, Horst
  Conrad, Gerard Meijer","Suppression of non-adiabatic losses of molecules from chip-based
  microtraps","12 pages, 5 figures","Phys. Rev. A 83, 033413 (2011)","10.1103/PhysRevA.83.033413",,"physics.atom-ph","http://arxiv.org/licenses/nonexclusive-distrib/1.0/","  Polar molecules in selected quantum states can be guided, decelerated and
trapped using electric fields created by microstructured electrodes on a chip.
Here we explore how non-adiabatic transitions between levels in which the
molecules are trapped and levels in which the molecules are not trapped can be
suppressed. We use 12-CO and 13-CO (a 3-Pi(1), v=0) molecules, prepared in the
upper Lambda-doublet component of the J=1 rotational level, and study the trap
loss as a function of an offset magnetic field. The experimentally observed
suppression (enhancement) of the non-adiabatic transitions for 12-CO (13-CO)
with increasing magnetic field is quantitatively explained.
","[{""version"":""v1"",""created"":""Wed, 5 Jan 2011 16:58:10 GMT""},{""version"":""v2"",""created"":""Wed, 23 Mar 2011 14:06:41 GMT""}]","2011-03-24"
"1101.1028","Hideki Miyake","CDF Collaboration, T. Aaltonen, et al","Measurement of the Forward-Backward Asymmetry in the B -> K(*) mu+ mu-
  Decay and First Observation of the Bs -> phi mu+ mu- Decay","7 pages, 2 figures, 3 tables. Submitted to Phys. Rev. Lett","Phys.Rev.Lett.106:161801,2011","10.1103/PhysRevLett.106.161801","FERMILAB-PUB-11-005-E","hep-ex","http://arxiv.org/licenses/nonexclusive-distrib/1.0/","  We reconstruct the rare decays $B^+ \to K^+\mu^+\mu^-$, $B^0 \to
K^{*}(892)^0\mu^+\mu^-$, and $B^0_s \to \phi(1020)\mu^+\mu^-$ in a data sample
corresponding to $4.4 {\rm fb^{-1}}$ collected in $p\bar{p}$ collisions at
$\sqrt{s}=1.96 {\rm TeV}$ by the CDF II detector at the Fermilab Tevatron
Collider. Using $121 \pm 16$ $B^+ \to K^+\mu^+\mu^-$ and $101 \pm 12$ $B^0 \to
K^{*0}\mu^+\mu^-$ decays we report the branching ratios. In addition, we report
the measurement of the differential branching ratio and the muon
forward-backward asymmetry in the $B^+$ and $B^0$ decay modes, and the $K^{*0}$
longitudinal polarization in the $B^0$ decay mode with respect to the squared
dimuon mass. These are consistent with the theoretical prediction from the
standard model, and most recent determinations from other experiments and of
comparable accuracy. We also report the first observation of the $B^0_s \to
\phi\mu^+\mu^- decay and measure its branching ratio ${\mathcal{B}}(B^0_s \to
\phi\mu^+\mu^-) = [1.44 \pm 0.33 \pm 0.46] \times 10^{-6}$ using $27 \pm 6$
signal events. This is currently the most rare $B^0_s$ decay observed.
","[{""version"":""v1"",""created"":""Wed, 5 Jan 2011 17:04:18 GMT""},{""version"":""v2"",""created"":""Sat, 19 Mar 2011 21:51:28 GMT""},{""version"":""v3"",""created"":""Tue, 10 May 2011 16:02:30 GMT""}]","2015-03-17"
"1101.1029","Pat Scott","Pat Scott","Dark stars: structure, evolution and impacts upon the high-redshift
  Universe","Proceedings of invited talk at CRF2010, DESY Hamburg, Nov 9-12 2010;
  7 pages, 3 figures; v2 includes minor updates to match final PoS version","PoS(CRF 2010)021",,,"astro-ph.CO hep-ph","http://arxiv.org/licenses/nonexclusive-distrib/1.0/","  The most compelling and popular models for dark matter predict that it should
congregate and annihilate in stellar cores. Stars where annihilation
contributes substantially to the total energy budget look very different to
those with which we are familiar. Here I explain the general features of stars
modified by dark matter annihilation with the help of a series of grids of
'dark' stellar evolutionary models, and describe the public code with which
they were computed. I go on to discuss possible impacts of dark stars on the
high-redshift Universe, including the history of reionisation. The preliminary
reionisation calculations reproduced here are based on dedicated models for
dark star atmospheres, and for the stellar populations to which dark stars
would belong.
","[{""version"":""v1"",""created"":""Wed, 5 Jan 2011 17:05:48 GMT""},{""version"":""v2"",""created"":""Sun, 13 Feb 2011 22:50:57 GMT""}]","2015-03-17"
"1101.1030","Dinesh Singh","Dinesh Singh, Nader Mobed","Local Space-Time Curvature Effects on Quantum Orbital Angular Momentum","21 pages, 1 figure; references added; accepted for publication in
  Classical and Quantum Gravity","Class.Quant.Grav.28:105024,2011","10.1088/0264-9381/28/10/105024",,"gr-qc hep-th quant-ph","http://arxiv.org/licenses/nonexclusive-distrib/1.0/","  This paper claims that local space-time curvature can non-trivially
contribute to the properties of orbital angular momentum in quantum mechanics.
Of key importance is the demonstration that an extended orbital angular
momentum operator due to gravitation can identify the existence of orbital
states with half-integer projection quantum numbers ""m"" along the axis of
quantization, while still preserving integer-valued orbital quantum numbers ""l""
for a simply connected topology. The consequences of this possibility are
explored in depth, noting that the half-integer ""m"" states vanish as required
when the locally curved space-time reduces to flat space-time, fully recovering
all established properties of orbital angular momentum in this limit. In
particular, it is shown that a minimum orbital number of ""l = 2"" is necessary
for the gravitational interaction to appear within this context, in perfect
correspondence with the spin-2 nature of linearized general relativity.
","[{""version"":""v1"",""created"":""Wed, 5 Jan 2011 17:12:30 GMT""},{""version"":""v2"",""created"":""Fri, 1 Apr 2011 16:32:30 GMT""}]","2011-04-28"
"1101.1031","Boris I. Belevtsev","E. Yu. Beliayev, B. I. Belevtsev, Yu. A. Kolesnichenko","Mixed (1D-2D) quantum electron transport in percolating gold film","26 pages. 9 figures",,"10.1063/1.3592529",,"cond-mat.mes-hall","http://arxiv.org/licenses/nonexclusive-distrib/1.0/","  The gold film (mean thickness $\approx$ 3.5 nm) was condensed in high vacuum
at temperature 70 K on single-crystal sapphire substrate. The transport
properties of the film at low temperature reveal simultaneously indications of
1D and 2D quantum interference effects of weak localization and
electron-electron interaction. It is shown that this behavior is determined by
inhomogeneous electron transport at the threshold of thickness-controlled
metal-insulator transition.
","[{""version"":""v1"",""created"":""Wed, 5 Jan 2011 17:13:10 GMT""}]","2015-05-20"
"1101.1032","Emilio Seijo","Emilio Seijo, Bodhisattva Sen","Change-point in stochastic design regression and the bootstrap",,,,,"math.ST stat.ME stat.TH","http://arxiv.org/licenses/nonexclusive-distrib/1.0/","  In this paper we study the consistency of different bootstrap procedures for
constructing confidence intervals (CIs) for the unique jump discontinuity
(change-point) in an otherwise smooth regression function in a stochastic
design setting. This problem exhibits nonstandard asymptotics and we argue that
the standard bootstrap procedures in regression fail to provide valid
confidence intervals for the change-point. We propose a version of smoothed
bootstrap, illustrate its remarkable finite sample performance in our
simulation study, and prove the consistency of the procedure. The $m$ out of
$n$ bootstrap procedure is also considered and shown to be consistent. We also
provide sufficient conditions for any bootstrap procedure to be consistent in
this scenario.
","[{""version"":""v1"",""created"":""Wed, 5 Jan 2011 17:17:36 GMT""}]","2011-01-06"
"1101.1033","Karl Schwede","Lance Edward Miller and Karl Schwede","Semi-log canonical vs $F$-pure singularities","Minor changes, 21 pages, to appear in the Journal of Algebra","Journal of Algebra, Vol. 349, Issue 1, 150--164, Jan. 2012",,,"math.AG math.AC","http://arxiv.org/licenses/nonexclusive-distrib/1.0/","  If $X$ is Frobenius split, then so is its normalization and we explore
conditions which imply the converse. To do this, we recall that given an
$\mathcal{O}_X$-linear map $\phi : F_* \mathcal{O}_X \to \mathcal{O}_X$, it
always extends to a map $\bar{\phi}$ on the normalization of $X$. In this
paper, we study when the surjectivity of $\bar{\phi}$ implies the surjectivity
of $\phi$. While this doesn't occur generally, we show it always happens if
certain tameness conditions are satisfied for the normalization map. Our result
has geometric consequences including a connection between $F$-pure
singularities and semi-log canonical singularities, and a more familiar version
of the ($F$-)inversion of adjunction formula.
","[{""version"":""v1"",""created"":""Wed, 5 Jan 2011 17:19:22 GMT""},{""version"":""v2"",""created"":""Wed, 9 Feb 2011 00:57:35 GMT""},{""version"":""v3"",""created"":""Thu, 6 Oct 2011 02:57:07 GMT""}]","2015-03-17"
"1101.1034","Claudia Kluppelberg","Damien Bankowski, Claudia Kl\""uppelberg and Ross Maller","On the Ruin Probability of the Generalised Ornstein-Uhlenbeck Process in
  the Cram\'er Case",,,,,"math.PR","http://arxiv.org/licenses/nonexclusive-distrib/1.0/","  For a bivariate \Levy process $(\xi_t,\eta_t)_{t\ge 0}$ and initial value
$V_0$ define the Generalised Ornstein-Uhlenbeck (GOU) process \[
V_t:=e^{\xi_t}\Big(V_0+\int_0^t e^{-\xi_{s-}}\ud \eta_s\Big),\quad t\ge0,\] and
the associated stochastic integral process \[Z_t:=\int_0^t e^{-\xi_{s-}}\ud
\eta_s,\quad t\ge0.\] Let $T_z:=\inf\{t>0:V_t<0\mid V_0=z\}$ and
$\psi(z):=P(T_z<\infty)$ for $z\ge 0$ be the ruin time and infinite horizon
ruin probability of the GOU. Our results extend previous work of Nyrhinen
(2001) and others to give asymptotic estimates for $\psi(z)$ and the
distribution of $T_z$ as $z\to\infty$, under very general, easily checkable,
assumptions, when $\xi$ satisfies a Cram\'er condition.
","[{""version"":""v1"",""created"":""Wed, 5 Jan 2011 17:20:52 GMT""}]","2011-01-06"
"1101.1035","Sergei Nayakshin","Sergei Nayakshin, Seung-Hoon Cha, and John Bridges (Leicester)","The Tidal Downsizing hypothesis for planet formation and the composition
  of Solar System comets","Same paper; was withdrawn by mistake (the paper intended to be
  withdrawn should have been arXiv:1102.4297)",,"10.1111/j.1745-3933.2011.01095.x",,"astro-ph.EP","http://arxiv.org/licenses/nonexclusive-distrib/1.0/","  Comets are believed to be born in the outer Solar System where the
temperature is assumed to have never exceeded T ~ 100 K. Surprisingly,
observations and samples of cometary dust particles returned to Earth showed
that they are in fact made of a mix of ices, as expected, but also of materials
forged at high-temperatures (T ~ 1500 K). We propose a radically new view
regarding the origin of the high-temperature processed materials in comets,
based on the recent ""Tidal Downsizing"" (TD) hypothesis for planet formation. In
the latter, the outer proto-planetary disc is gravitationally unstable and
forms massive giant planet embryos (GEs). These hot (T ~ hundreds to 2000 K)
and dense regions, immersed in the background cold and low density disc, are
eventually disrupted. We propose that both planets and the high-T materials in
comets are synthesised inside the GEs. Disruption of GEs separates planets and
small solids as the latter are ""frozen-in"" into gas and are peeled off together
with it. These small solids are then mixed with the ambient cold disc
containing ices before being incorporated into comets. Several predictions of
this picture may be testable with future observations of the Solar System and
exoplanets.
","[{""version"":""v1"",""created"":""Wed, 5 Jan 2011 17:21:33 GMT""},{""version"":""v2"",""created"":""Wed, 9 Mar 2011 17:42:49 GMT""},{""version"":""v3"",""created"":""Tue, 15 Mar 2011 18:41:48 GMT""}]","2015-05-20"
