"1101.1127","Wei Qing Liu","Weiqing Liu, Jinghua Xiao, Lixiang Li, Ye Wu and Min Lu","Effects of gradient coupling on amplitude death in nonidentical
  oscillators","20 pages, 7 figures","Nonlinear Dynamics (2012) 69:1041-1050","10.1007/s11071-012-0325-2",,"nlin.CD","http://arxiv.org/licenses/nonexclusive-distrib/1.0/","  In this work, we investigate gradient coupling effect on amplitude death in
an array of N cou- pled nonidentical oscillators with no-flux boundary
conditions and periodic boundary conditions respectively. We find that the
effects of gradient coupling on amplitude death in diffusive coupled
nonidentical oscillators is quite different between those two boundaries
conditions. With no-flux boundary conditions, there is a system size related
critical gradient coupling $r_c$ within which the gradient coupling tends to
monotonically enlarge the amplitude death domain in the parameter space. With
the periodical boundary conditions, there is an optimal gradient coupling
constant $r_o$ to realize largest AD domain. The gradient coupling first
enlarges then decreases the amplitude death domain of diffusive coupled
oscillators. The amplitude death domain of parameter space are analytically
predicted for small number of gradient coupled oscillators.
","[{""version"":""v1"",""created"":""Thu, 6 Jan 2011 01:36:34 GMT""}]","2012-06-08"
"1101.1128","Susan Gardner","Susan Gardner, Daheng He","Tracing Remnants of the Baryon Vector Current Anomaly in Neutron
  Radiative Beta Decay","5 pages, 2 figures, prepared for the proceedings to Physics of
  Fundamental Symmetries and Interactions (PSI 2010), Oct. 11-14, 2010, Paul
  Scherrer Institute, Switzerland",,"10.1063/1.3700607",,"hep-ph nucl-th","http://arxiv.org/licenses/nonexclusive-distrib/1.0/","  Harvey, Hill, and Hill have found that unexpected interactions involving the
nucleon, photon, and weak gauge bosons at low energies emerge from gauging the
axial anomaly of QCD under the full electroweak symmetry of the Standard Model
(SM). In this contribution we consider how such interactions can be isolated
through a triple-product momentum correlation in neutron radiative beta-decay.
The correlation is both parity- and naively time-reversal-odd, so that it
vanishes in the Standard Model save for effects induced by final-state
interactions (FSI). Nevertheless, the correlation can be generated by sources
of CP violation beyond the Standard Model, and such couplings, being
spin-independent, are not constrained by the nonobservation of the neutron
electric dipole moment (EDM). We consider the sorts of limits on its strength
which can be determined at existing and anticipated facilities, as well as the
size of induced correlations from known FSI. We also briefly consider the
possibility of nuclear beta-decay studies as well as the prospects for
muon-induced reaction studies.
","[{""version"":""v1"",""created"":""Thu, 6 Jan 2011 01:48:41 GMT""}]","2015-05-20"
"1101.1129","Zhiyun Cheng","Zhiyun Cheng, Hongzhu Gao","On region crossing change and incidence matrix","10 pages, 7 figures","SCIENCE CHINA Mathematics, 2012, 55(7), 1487-1495","10.1007/s11425-012-4403-1",,"math.GT","http://arxiv.org/licenses/nonexclusive-distrib/1.0/","  In a recent work of Ayaka Shimizu$^{[5]}$, she defined an operation named
region crossing change on link diagrams, and showed that region crossing change
is an unknotting operation for knot diagrams. In this paper, we prove that
region crossing change on a 2-component link diagram is an unknotting operation
if and only if the linking number of the diagram is even.
  Besides, we define an incidence matrix of a link diagram via its signed
planar graph and its dual graph. By studying the relation between region
crossing change and incidence matrix, we prove that a signed planar graph
represents an $n$-component link diagram if and only if the rank of the
associated incidence matrix equals to $c-n+1$, here $c$ denotes the size of the
graph.
","[{""version"":""v1"",""created"":""Thu, 6 Jan 2011 02:15:51 GMT""},{""version"":""v2"",""created"":""Fri, 22 Apr 2011 03:51:30 GMT""}]","2015-05-20"
"1101.1130","Xing-Gang Wu","Jia-Wei Zhang, Xing-Gang Wu, Tao Zhong, Yao Yu and Zhen-Yun Fang","Hadronic Production of the Doubly Heavy Baryon $\Xi_{bc}$ at LHC","9 pages, 8 figures, 6 tables. References updated and more discussions
  are added. To be published in Phys.Rev.D","Phys.Rev.D83:034026,2011","10.1103/PhysRevD.83.034026",,"hep-ph","http://arxiv.org/licenses/nonexclusive-distrib/1.0/","  We investigate the hadronic production of the doubly heavy baryon $\Xi_{bc}$
at the large hadron collider (LHC), where contributions from the four
$(bc)$-diquark states $(bc)_{\bf\bar{3},6}[^1S_0]$ and
$(bc)_{\bf\bar{3},6}[^3S_1]$ have been taken into consideration. Numerical
results show that under the condition of $p_T>4$ GeV and $|y|<1.5$, sizable
$\Xi_{bc}$ events about $ 1.7\times 10^7$ and $3.5\times10^9$ per year can be
produced for the center-of-mass energy $\sqrt{S}=7$ TeV and $\sqrt{S}=14$ TeV
respectively. For experimental usage, the total and the interested differential
cross-sections are estimated under some typical $p_T$- and $y$- cuts for the
LHC detectors CMS, ATLAS and LHCb. Main uncertainties are discussed and a
comparative study on the hadronic production of $\Xi_{cc}$, $\Xi_{bc}$ and
$\Xi_{bb}$ at LHC are also presented.
","[{""version"":""v1"",""created"":""Thu, 6 Jan 2011 02:35:23 GMT""},{""version"":""v2"",""created"":""Mon, 17 Jan 2011 15:45:48 GMT""},{""version"":""v3"",""created"":""Sat, 29 Jan 2011 03:55:26 GMT""}]","2011-02-25"
"1101.1131","Wang Yong","Jian Wang, Yong Wang","Double Conformal Invariants and the Wodzicki Residue",,,,,"math.DG","http://arxiv.org/licenses/nonexclusive-distrib/1.0/","  For compact real manifolds, a new double conformal invariant is constructed
using the Wodzicki residue and the $d$ operator in the framework of Connes. In
the flat case, we compute this double conformal invariant, and in some special
cases, we also compute this double conformal invariants. For complex manifolds,
a new double conformal invariant is constructed using the Wodzicki residue and
the $\bar{\partial}$ operator in the same way, and this double conformal
invariant is computed in the flat case.
","[{""version"":""v1"",""created"":""Thu, 6 Jan 2011 02:39:48 GMT""}]","2011-01-07"
"1101.1132","James Wan","James Wan","Moments of Products of Elliptic Integrals",,,,,"math.CA math.NT","http://arxiv.org/licenses/nonexclusive-distrib/1.0/","  We consider the moments of products of complete elliptic integrals of the
first and second kinds. In particular, we derive new results using elementary
means, aided by computer experimentation and a theorem of W. Zudilin. Diverse
related evaluations, and two conjectures, are also given.
","[{""version"":""v1"",""created"":""Thu, 6 Jan 2011 03:26:20 GMT""}]","2011-01-07"
"1101.1133","Andrea Perna","Andrea Perna, Pascale Kuntz, St\'ephane Douady","Characterisation of spatial network-like patterns from junctions'
  geometry","version 2, 14 pages",,"10.1103/PhysRevE.83.066106",,"nlin.PS","http://arxiv.org/licenses/nonexclusive-distrib/1.0/","  We propose a new method for quantitative characterization of spatial
network-like patterns with loops, such as surface fracture patterns, leaf vein
networks and patterns of urban streets. Such patterns are not well
characterized by purely topological estimators: also patterns that both look
different and result from different morphogenetic processes can have similar
topology. A local geometric cue -the angles formed by the different branches at
junctions- can complement topological information and allow to quantify the
large scale spatial coherence of the pattern. For patterns that grow over time,
such as fracture lines on the surface of ceramics, the rank assigned by our
method to each individual segment of the pattern approximates the order of
appearance of that segment. We apply the method to various network-like
patterns and we find a continuous but sharp dichotomy between two classes of
spatial networks: hierarchical and homogeneous. The first class results from a
sequential growth process and presents large scale organization, the latter
presents local, but not global organization.
","[{""version"":""v1"",""created"":""Thu, 6 Jan 2011 03:34:01 GMT""},{""version"":""v2"",""created"":""Wed, 27 Apr 2011 09:34:28 GMT""}]","2015-05-20"
"1101.1134","Hui Hu","Hui Hu and Xia-Ji Liu","Universal dynamic structure factor of a strongly correlated Fermi gas","5 pages, 4 figures","Phys. Rev. A 85, 023612 (2012)","10.1103/PhysRevA.85.023612",,"cond-mat.quant-gas","http://arxiv.org/licenses/nonexclusive-distrib/1.0/","  Universality of strongly interacting fermions is a topic of great interest in
diverse fields. Here we investigate theoretically the universal dynamic density
response of resonantly interacting ultracold Fermi atoms in the limit of either
high temperature or large frequency: (1) At high temperature, we use quantum
virial expansion to derive universal, non-perturbative expansion functions of
dynamic structure factor; (2) At large momentum, we identify that the
second-order expansion function gives the Wilson coefficient used in the
operator expansion product method. The dynamic structure factor is therefore
determined by its second-order expansion function with an overall normalization
factor given by Tan's contact parameter. We show that the spin parallel and
antiparallel dynamic structure factors have respectively a tail of the form
$\sim \pm \omega^{-5/2}$ for $\omega\rightarrow\infty$, decaying slower than
the total dynamic structure factor found previously ($\sim \omega^{-7/2}$). Our
predictions for dynamic structure factor at high temperature or large frequency
are testable using Bragg spectroscopy for ultracold atomic Fermi gases.
","[{""version"":""v1"",""created"":""Thu, 6 Jan 2011 03:41:12 GMT""}]","2013-09-03"
"1101.1135","Joseph Schick","J. T. Schick, C. G. Morgan, P. Papoulias","Gallium interstitial contributions to diffusion in gallium arsenide","41 pages, 20 figures",,,,"cond-mat.mtrl-sci","http://arxiv.org/licenses/nonexclusive-distrib/1.0/","  Enthalpies of formation of gallium interstitials and all the other native
point defects in gallium arsenide are calculated using the same well-converged
\emph{ab initio} techniques. Using these results, equilibrium concentrations of
these defects are computed as a function of chemical potential from the arsenic
rich limit to the gallium rich limit and as a function of the doping level from
$p$-type to $n$-type. Gallium interstitial diffusion paths and migration
barriers for diffusion are determined for all the interstitial charge states
which are favored for Fermi levels anywhere in the gap, and the charge states
which dominate diffusion as a function of Fermi level are identified. The
effects of chemical potential, doping level, and non-equilibrium defect
concentrations produced by ion implantation or irradiation on gallium
self-diffusion are examined. Results are consistent with experimental results
across the ranges of doping and stoichometry where comparisons can be made.
Finally, these calculations shed some light on the complex situation for
gallium diffusion in gallium arsenide that is gallium-rich and doped heavily
$p$-type.
","[{""version"":""v1"",""created"":""Thu, 6 Jan 2011 03:59:56 GMT""},{""version"":""v2"",""created"":""Fri, 18 Mar 2011 17:09:25 GMT""}]","2015-03-17"
"1101.1136","Benedict Escoto","Benedict Escoto","Marginal Likelihood Computation via Arrogance Sampling",,,,,"stat.CO","http://creativecommons.org/licenses/by/3.0/","  This paper describes a method for estimating the marginal likelihood or Bayes
factors of Bayesian models using non-parametric importance sampling (""arrogance
sampling""). This method can also be used to compute the normalizing constant of
probability distributions. Because the required inputs are samples from the
distribution to be normalized and the scaled density at those samples, this
method may be a convenient replacement for the harmonic mean estimator. The
method has been implemented in the open source R package margLikArrogance.
","[{""version"":""v1"",""created"":""Thu, 6 Jan 2011 04:30:27 GMT""}]","2015-03-17"
"1101.1137","Mosleh Almarashi","Mosleh Almarashi and Stefano Moretti","Muon Signals of Very Light CP-odd Higgs states of the NMSSM at the LHC","10 pages, 16 figures, one typo correction","Phys.Rev.D83:035023,2011","10.1103/PhysRevD.83.035023","SHEP-10-44","hep-ph","http://arxiv.org/licenses/nonexclusive-distrib/1.0/","  We study here the di-muon decay mode of a very light CP-odd Higgs boson of
the NMSSM, a1, produced in association with a bottom-antibottom pair and find
that, despite small event rates, a significant signal should be extractable
from the SM background at the LHC with high luminosity.
","[{""version"":""v1"",""created"":""Thu, 6 Jan 2011 04:37:36 GMT""},{""version"":""v2"",""created"":""Thu, 24 Mar 2011 17:33:05 GMT""}]","2015-03-17"
"1101.1138","Man Shun John Ma","John Man-shun Ma, Tom Yau-heng Wan","Lagrangian angles of family of Lagrangian fibrations under mean
  curvature flow","10 pages",,,,"math.DG","http://arxiv.org/licenses/nonexclusive-distrib/1.0/","  In this paper, we discuss the Lagrangian angles of a family of Lagrangian
fibrations moved under mean curvature flow. In the case $n=1$, the angle
function is shown to satisfy a degenerated partial differential equation. We
prove that any smooth solution to the equation also corresponds to smooth
foliation of curves under mean curvature flow.
","[{""version"":""v1"",""created"":""Thu, 6 Jan 2011 04:44:19 GMT""},{""version"":""v2"",""created"":""Fri, 7 Jan 2011 04:54:42 GMT""}]","2011-01-10"
"1101.1139","Jun-ichi Yoshikawa","Jun-ichi Yoshikawa, Yoshichika Miwa, Radim Filip, Akira Furusawa","Demonstration of reversible phase-insensitive optical amplifier","16 pages, 17 figures","Phys. Rev. A 83, 052307 (2011)","10.1103/PhysRevA.83.052307",,"quant-ph","http://arxiv.org/licenses/nonexclusive-distrib/1.0/","  We experimentally demonstrate phase-insensitive linear optical amplification
which preserves the idler at the output. Since our amplification operation is
unitary up to small excess noise, it is reversible beyond the classical limit.
The entanglement between the two output modes is the resource for the
reversibility. The amplification gain of 2.0 is demonstrated. In addition,
combining this amplifier with a beamsplitter, we also demonstrate approximate
cloning of coherent states where an anticlone is present. We investigate the
reversibility by reconstructing the initial state from the output correlations,
and the results are slightly beyond the cloning limit. Furthermore, full
characterization of the amplifier and cloner is given by using coherent states
with several different mean values as inputs. Our amplifier is based on linear
optics, offline preparation of nonclassical ancillas, and homodyne measurements
followed by feedforward. Squeezed states are used as the ancillas, and
nonlinear optical effects are exploited only for their generation. The ancillas
introduce nonclassicality into the amplifying operation, making entanglement at
the output.
","[{""version"":""v1"",""created"":""Thu, 6 Jan 2011 04:51:05 GMT""}]","2011-05-25"
"1101.1140","Kyle Arnold","K. J. Arnold and M. D. Barrett","All-Optical BEC in a 1.06 micron dipole trap","4 pages, 4 figures","Optics Communications, Volume 284, Issue 13, 15 June 2011, Pages
  3288-3291","10.1016/j.optcom.2011.03.008",,"quant-ph cond-mat.quant-gas physics.atom-ph","http://arxiv.org/licenses/nonexclusive-distrib/1.0/","  We report the all-optical production of a Rb87 Bose-Einstein condensate (BEC)
in a simple 1.06 micron dipole trap experiment. We load a single beam dipole
trap directly from a magneto-optic trap (MOT) using an optimized loading
sequence. After evaporation in the single beam, a second crossed beam is used
for compression. The intensity in both beams is then reduced for evaporation to
BEC. We obtain a BEC with 3.5E4 atoms after 3 seconds of total evaporation
time. We also give a detailed account of the thermal distribution in cross beam
traps. This account highlights the possible difficulties in using shorter
wavelength lasers to condense all optically.
","[{""version"":""v1"",""created"":""Thu, 6 Jan 2011 05:06:54 GMT""},{""version"":""v2"",""created"":""Tue, 10 May 2011 02:51:25 GMT""}]","2011-05-11"
"1101.1141","Chenggang Tao","Chenggang Tao, Liying Jiao, Oleg V. Yazyev, Yen-Chia Chen, Juanjuan
  Feng, Xiaowei Zhang, Rodrigo B. Capaz, James M. Tour, Alex Zettl, Steven G.
  Louie, Hongjie Dai, Michael F. Crommie","Spatially Resolving Spin-split Edge States of Chiral Graphene
  Nanoribbons",,,"10.1038/nphys1991","Nature Physics 7, 616-620 (2011)","cond-mat.mes-hall cond-mat.mtrl-sci","http://arxiv.org/licenses/nonexclusive-distrib/1.0/","  A central question in the field of graphene-related research is how graphene
behaves when it is patterned at the nanometer scale with different edge
geometries. Perhaps the most fundamental shape relevant to this question is the
graphene nanoribbon (GNR), a narrow strip of graphene that can have different
chirality depending on the angle at which it is cut. Such GNRs have been
predicted to exhibit a wide range of behaviour (depending on their chirality
and width) that includes tunable energy gaps and the presence of unique
one-dimensional (1D) edge states with unusual magnetic structure. Most GNRs
explored experimentally up to now have been characterized via electrical
conductivity, leaving the critical relationship between electronic structure
and local atomic geometry unclear (especially at edges). Here we present a
sub-nm-resolved scanning tunnelling microscopy (STM) and spectroscopy (STS)
study of GNRs that allows us to examine how GNR electronic structure depends on
the chirality of atomically well-defined GNR edges. The GNRs used here were
chemically synthesized via carbon nanotube (CNT) unzipping methods that allow
flexible variation of GNR width, length, chirality, and substrate. Our STS
measurements reveal the presence of 1D GNR edge states whose spatial
characteristics closely match theoretical expectations for GNR's of similar
width and chirality. We observe width-dependent splitting in the GNR edge state
energy bands, providing compelling evidence of their magnetic nature. These
results confirm the novel electronic behaviour predicted for GNRs with
atomically clean edges, and thus open the door to a whole new area of
applications exploiting the unique magnetoelectronic properties of chiral GNRs.
","[{""version"":""v1"",""created"":""Thu, 6 Jan 2011 05:07:56 GMT""}]","2011-08-31"
"1101.1142","Vladimir Druzhinin","The BABAR Collaboration","Measurement of the gamma gamma* --> eta and gamma gamma* --> eta'
  transition form factors","21 pages, 18 postscript figures, published version","Phys.Rev.D84:052001,2011","10.1103/PhysRevD.84.052001","BABAR-PUB-10/028, SLAC-PUB-14317","hep-ex","http://arxiv.org/licenses/nonexclusive-distrib/1.0/","  We study the reactions e+e- --> e+e- eta (eta') in the single-tag mode and
measure the gamma gamma* --> eta (eta') transition form factors in the momentum
transfer range from 4 to 40 GeV^2. The analysis is based on 469 fb-1 of
integrated luminosity collected at PEP-II with the BABAR detector at e+e-
center-of-mass energies near 10.6 GeV.
","[{""version"":""v1"",""created"":""Thu, 6 Jan 2011 05:08:32 GMT""},{""version"":""v2"",""created"":""Wed, 21 Sep 2011 04:09:21 GMT""}]","2015-05-20"
"1101.1143","Takayoshi Sano","T. Sano, N. Ozaki, T. Sakaiya, K. Shigemori, M. Ikoma, T. Kimura, K.
  Miyanishi, T. Endo, A. Shiroshita, H. Takahashi, T. Jitsui, Y. Hori, Y.
  Hironaka, A. Iwamoto, T. Kadono, M. Nakai, T. Okuchi, K. Otani, K. Shimizu,
  T. Kondo, R. Kodama, K. Mima","Laser-Shock Compression and Hugoniot Measurements of Liquid Hydrogen to
  55 GPa","8 pages, 7 figures, 2 tables, accepted for publication in Physical
  Review B",,"10.1103/PhysRevB.83.054117",,"cond-mat.mtrl-sci astro-ph.EP","http://arxiv.org/licenses/nonexclusive-distrib/1.0/","  The principal Hugoniot for liquid hydrogen was obtained up to 55 GPa under
laser-driven shock loading. Pressure and density of compressed hydrogen were
determined by impedance-matching to a quartz standard. The shock temperature
was independently measured from the brightness of the shock front. Hugoniot
data of hydrogen provide a good benchmark to modern theories of condensed
matter. The initial number density of liquid hydrogen is lower than that for
liquid deuterium, and this results in shock compressed hydrogen having a higher
compression and higher temperature than deuterium at the same shock pressure.
","[{""version"":""v1"",""created"":""Thu, 6 Jan 2011 05:24:38 GMT""}]","2015-05-20"
"1101.1144","Hongfei Cui","Anqiang Zhu and Liang Cheng","Curvature tensor under the Ricci-Harmonic flow","6 pages",,,,"math.DG","http://arxiv.org/licenses/nonexclusive-distrib/1.0/","  We prove that if the Ricci curvature is uniformly bounded under the
Ricci-Harmonic flow for all times $t$ \in[0, T), then the curvature tensor has
to be uniformly bounded as well.
","[{""version"":""v1"",""created"":""Thu, 6 Jan 2011 05:25:00 GMT""}]","2011-01-07"
"1101.1145","Simon Trebst","Hong-Chen Jiang, Zheng-Cheng Gu, Xiao-Liang Qi, Simon Trebst","Possible proximity of the Mott insulating Iridate Na2IrO3 to a
  topological phase: Phase diagram of the Heisenberg-Kitaev model in a magnetic
  field","5 pages, 6 figures","Phys. Rev. B 83, 245104 (2011)","10.1103/PhysRevB.83.245104",,"cond-mat.str-el cond-mat.mtrl-sci","http://arxiv.org/licenses/nonexclusive-distrib/1.0/","  Motivated by the recent experimental observation of a Mott insulating state
for the layered Iridate Na2IrO3, we discuss possible ordering states of the
effective Iridium moments in the presence of strong spin-orbit coupling and a
magnetic field. For a field pointing in the [111] direction - perpendicular to
the hexagonal lattice formed by the Iridium moments - we find that a
combination of Heisenberg and Kitaev exchange interactions gives rise to a rich
phase diagram with both symmetry breaking magnetically ordered phases as well
as a topologically ordered phase that is stable over a small range of coupling
parameters. Our numerical simulations further indicate two exotic multicritical
points at the boundaries between these ordered phases.
","[{""version"":""v1"",""created"":""Thu, 6 Jan 2011 05:40:39 GMT""}]","2011-06-07"
"1101.1146","Suhan Ree","Suhan Ree","Opinion dynamics of random-walking agents on a lattice","9 pages, 9 figures (Will appear in Phys. Rev. E)","Phys. Rev. E. 83, 056110 (2011)","10.1103/PhysRevE.83.056110",,"physics.soc-ph cs.SI","http://arxiv.org/licenses/nonexclusive-distrib/1.0/","  Opinion dynamics of random-walking agents on finite two-dimensional lattices
is studied. In the model, the opinion is continuous, and both the lattice and
the opinion can be either periodic or non-periodic. At each time step, all
agents move randomly on the lattice, and update their opinions based on those
of neighbors with whom the differences of opinions are not greater than a given
threshold. Due to the effect of repeated averaging, opinions first converge
locally, and eventually reach steady states. Like other models with bounded
confidence, steady states in general are those with one or more opinion groups,
in which all agents have the same opinion. When both the lattice and the
opinion are periodic, however, metastable states, in which the whole spectrum
of location-dependent opinions can coexist, can emerge. This result shows that,
when a set of continuous opinions forms a structure like a circle, other that a
typically-used linear opinions, rich dynamic behavior can arise. When there are
geographical restrictions in reality, a complete consensus is rarely reached,
and metastable states here can be one of the explanations for these situations,
especially when opinions are not linear.
","[{""version"":""v1"",""created"":""Thu, 6 Jan 2011 06:35:56 GMT""},{""version"":""v2"",""created"":""Wed, 13 Apr 2011 06:18:31 GMT""}]","2012-04-27"
"1101.1147","Kouji Nakamura","Kouji Nakamura","Decomposition of linear metric perturbations on generic background
  spacetime -- Toward higher-order general-relativistic gauge-invariant
  perturbation theory","41 pages, no figure, Full paper version of [arXiv:1011.5272[gr-qc]]",,,,"gr-qc astro-ph.CO hep-th math-ph math.MP","http://arxiv.org/licenses/nonexclusive-distrib/1.0/","  The decomposition of the linear-order metric perturbation is discussed in the
context of the higher-order gauge-invariant perturbation theory. We show that
the linear order metric perturbation is decomposed into gauge-invariant and
gauge-variant parts on the general background spacetime which admits ADM
decomposition. This decomposition was an important premise of the general
framework of the higher order gauge-invariant perturbation theory proposed in
the papers [K. Nakamura, Prog. Theor. Phys. vol.110 (2003), 723; ibid. vol.113
(2005), 481]. This implies that we can develop the higher-order gauge-invariant
perturbation theory on generic background spacetime. Remaining issues to
complete the general-framework of the higher-order gauge-invariant perturbation
theories are also discussed.
","[{""version"":""v1"",""created"":""Thu, 6 Jan 2011 06:40:19 GMT""}]","2011-01-10"
