"1101.1075","Serguei Mokhov","Serguei A. Mokhov and Marc-Andr\'e Laverdi\`ere and Nader Hatami and
  Ali Benssam","Cryptolysis v.0.0.1 - A Framework for Automated Cryptanalysis of
  Classical Ciphers","27 pages; 4 figures; preliminary results in aux; index; a 2005
  report; v2 fixes name spelling and revisions",,"10.1109/SERA.2010.44",,"cs.CR cs.SE","http://arxiv.org/licenses/nonexclusive-distrib/1.0/","  Cryptolysis is a framework that includes a collection of automated attacks on
the classical ciphers based on the article by Clark Dawson on Optimisation
heuristics for the automated cryptanalysis of classical ciphers from the
Journal of Combinatorial Mathematics and Combinatorial Computing, 1998.
","[{""version"":""v1"",""created"":""Wed, 5 Jan 2011 20:51:43 GMT""},{""version"":""v2"",""created"":""Fri, 7 Jan 2011 20:27:46 GMT""}]","2015-03-17"
"1101.1076","Dilip Asthagiri","Safir Merchant, Jindal K. Shah, and D. Asthagiri","Water coordination structures and the excess free energy of the liquid",,,"10.1063/1.3572058",,"physics.chem-ph cond-mat.soft physics.bio-ph","http://arxiv.org/licenses/nonexclusive-distrib/1.0/","  For a distinguished water molecule, the solute water, we assess the
contribution of each coordination state to its excess chemical potential, using
a molecular aufbau approach. In this approach, we define a coordination sphere,
the inner-shell, and separate the excess chemical potential into packing,
outer-shell, and local chemical contributions; the coordination state is
defined by the number of solvent water molecules within the coordination
sphere. The packing term accounts for the free energy of creating a solute-free
coordination sphere in the liquid. The outer-shell term accounts for the
interaction of the solute with the fluid outside the coordination sphere and it
is accurately described by a Gaussian model of hydration for coordination radii
greater than the minimum of the oxygen-oxygen pair correlation function.
Consistent with the conventional radial cut-off used for defining
hydrogen-bonds in liquid water, theory helps identify a chemically meaningful
coordination radius. The local chemical contribution is recast as a sum over
coordination states. The n-th term in this sum is given by the probability of
observing n water molecules inside the coordination sphere in the absence of
the solute water times a factor accounting for the interaction of the solute
with the inner-shell solvent water molecules. Using this molecular aufbau
expansion, we monitor the change in the chemical contribution due to the
incremental increase in n. We find that though four water molecules are needed
to fully account for the chemical term, the first added water accounts for
nearly half the chemical term. Our results emphasize the need to acknowledge
the intrinsic occupancy of a solute-free coordination sphere together with
solute-solvent interactions in rationalizing the tetrahedral coordination of
the solute water.
","[{""version"":""v1"",""created"":""Wed, 5 Jan 2011 20:53:13 GMT""}]","2015-05-20"
"1101.1077","Bart Jacobs","Bart Jacobs","Dagger Categories of Tame Relations",,,,,"math.LO quant-ph","http://arxiv.org/licenses/nonexclusive-distrib/1.0/","  Within the context of an involutive monoidal category the notion of a
comparison relation is identified. Instances are equality on sets, inequality
on posets, orthogonality on orthomodular lattices, non-empty intersection on
powersets, and inner product on vector or Hilbert spaces. Associated with a
collection of such (symmetric) comparison relations a dagger category is
defined with ""tame"" relations as morphisms. Examples include familiar
categories in the foundations of quantum mechanics, such as sets with partial
injections, or with locally bifinite relations, or with formal distributions
between them, or Hilbert spaces with bounded (continuous) linear maps. Of one
particular example of such a dagger category of tame relations, involving sets
and bifinite multirelations between them, the categorical structure is
investigated in some detail. It turns out to involve symmetric monoidal dagger
structure, with biproducts, and dagger kernels. This category may form an
appropriate universe for discrete quantum computations, just like Hilbert
spaces form a universe for continuous computation.
","[{""version"":""v1"",""created"":""Wed, 5 Jan 2011 20:54:24 GMT""},{""version"":""v2"",""created"":""Mon, 16 Jul 2012 22:06:37 GMT""}]","2012-07-18"
"1101.1078","Giorgio Krstulovic","Giorgio Krstulovic, Marc-Etienne Brachet and Annick Pouquet","Alfv\'en waves and ideal two-dimensional Galerkin truncated
  magnetohydrodynamics",,,"10.1103/PhysRevE.84.016410",,"nlin.CD","http://arxiv.org/licenses/nonexclusive-distrib/1.0/","  We investigate numerically the dynamics of two-dimensional Euler and ideal
magnetohydrodynamics (MHD) flows in systems with a finite number of modes, up
to $4096^2$, for which several quadratic invariants are preserved by the
truncation and the statistical equilibria are known. Initial conditions are the
Orszag-Tang vortex with a neutral X-point centered on a stagnation point of the
velocity field in the large scales. In MHD, we observe that the total energy
spectra at intermediate times and intermediate scales correspond to the
interactions of eddies and waves, $E_T(k)\sim k^{-3/2}$. Moreover, no
dissipative range is visible neither for Euler nor for MHD in two dimensions;
in the former case, this may be linked to the existence of a vanishing
turbulent viscosity whereas in MHD, the numerical resolution employed may be
insufficient. When imposing a uniform magnetic field to the flow, we observe a
lack of saturation of the formation of small scales together with a significant
slowing-down of their equilibration, with however a cut-off independent partial
thermalization being reached at intermediate scales.
","[{""version"":""v1"",""created"":""Wed, 5 Jan 2011 20:55:08 GMT""}]","2015-05-20"
"1101.1079","Georgi Raikov","Pablo Miranda, Georgi Raikov","Discrete Spectrum of Quantum Hall Effect Hamiltonians II. Periodic Edge
  Potentials","Lemma 2.1 added, the proof of Theorem 3.1 streamlined, typos
  corrected. 21 pages",,,,"math-ph math.AP math.MP math.SP","http://arxiv.org/licenses/nonexclusive-distrib/1.0/","  We consider the unperturbed operator $H_0: = (-i \nabla - {\bf A})^2 + W$,
self-adjoint in $L^2({\mathbb R}^2)$. Here ${\bf A}$ is a magnetic potential
which generates a constant magnetic field $b>0$, and the edge potential $W =
\bar{W}$ is a ${\mathcal T}$-periodic non constant bounded function depending
only on the first coordinate $x \in {\mathbb R}$ of $(x,y) \in {\mathbb R}^2$.
Then the spectrum $\sigma(H_0)$ of $H_0$ has a band structure, the band
functions are $b {\mathcal T}$-periodic, and generically there are infinitely
many open gaps in $\sigma(H_0)$. We establish explicit sufficient conditions
which guarantee that a given band of $\sigma(H_0)$ has a positive length, and
all the extremal points of the corresponding band function are non degenerate.
Under these assumptions we consider the perturbed operators $H_{\pm} = H_0 \pm
V$ where the electric potential $V \in L^{\infty}({\mathbb R}^2)$ is
non-negative and decays at infinity. We investigate the asymptotic distribution
of the discrete spectrum of $H_\pm$ in the spectral gaps of $H_0$. We introduce
an effective Hamiltonian which governs the main asymptotic term; this
Hamiltonian could be interpreted as a 1D Schroedinger operator with
infinite-matrix-valued potential. Further, we restrict our attention on
perturbations $V$ of compact support. We find that there are infinitely many
discrete eigenvalues in any open gap in the spectrum of $\sigma(H_0)$, and the
convergence of these eigenvalues to the corresponding spectral edge is
asymptotically Gaussian.
","[{""version"":""v1"",""created"":""Wed, 5 Jan 2011 20:57:04 GMT""},{""version"":""v2"",""created"":""Fri, 15 Apr 2011 21:23:34 GMT""},{""version"":""v3"",""created"":""Fri, 27 May 2011 21:48:27 GMT""}]","2011-05-31"
"1101.1080","Joseph  Smidt","Alexandre Amblard, Asantha Cooray, Paolo Serra (UC Irvine), B.
  Altieri, V. Arumugam, H. Aussel, A. Blain, J. Bock, A. Boselli, V. Buat, N.
  Castro-Rodriguez, A. Cava, P. Chanial, E. Chapin, D.L. Clements, A. Conley,
  L. Conversi, C.D. Dowell, E. Dwek, S. Eales, D. Elbaz, D. Farrah, A.
  Franceschini, W. Gear, J. Glenn, M. Griffin, M. Halpern, E. Hatziminaoglou,
  E. Ibar, K. Isaak, R.J. Ivison, A.A. Khostovan, G. Lagache, L. Levenson, N.
  Lu, S. Madden, B. Maffei, G. Mainetti, L. Marchetti, G. Marsden, K.
  Mitchell-Wynne, H.T. Nguyen, B. O'Halloran, S.J. Oliver, A. Omont, M.J. Page,
  P. Panuzzo, A. Papageorgiou, C.P. Pearson, I. Perez-Fournon, M. Pohlen, N.
  Rangwala, I.G. Roseboom, M. Rowan-Robinson, M. Sanchez Portal, B. Schulz,
  Douglas Scott, N. Seymour, D.L. Shupe, A.J. Smith, J.A. Stevens, M.
  Symeonidis, M. Trichas, K. Tugwell, M. Vaccari, E. Valiante, I. Valtchanov,
  J. D. Vieira, L. Vigroux, L. Wang, R. Ward, G. Wright, C.K. Xu, M. Zemcov","Sub-millimetre galaxies reside in dark matter halos with masses greater
  than 3x10^11 solar masses","Accepted for publication as a Letter to Editor in Nature; This paper
  is under press embargo until Nature publication (early February).
  Supplementary material and electronic tables will be available from
  http://cosmology.uci.edu at the time of publication. For HerMES team
  information see http://hermes.sussex.ac.uk/ and for data releases see
  http://hedam.oamp.fr/HerMES/","Nature, 485, 213-216 (2012)","10.1038/nature09771",,"astro-ph.CO","http://arxiv.org/licenses/nonexclusive-distrib/1.0/","  The extragalactic background light at far-infrared wavelengths originates
from optically-faint, dusty, star-forming galaxies in the universe with
star-formation rates at the level of a few hundred solar masses per year. Due
to the relatively poor spatial resolution of far-infrared telescopes, the faint
sub-millimetre galaxies are challenging to study individually. Instead, their
average properties can be studied using statistics such as the angular power
spectrum of the background intensity variations. A previous attempt at
measuring this power spectrum resulted in the suggestion that the clustering
amplitude is below the level computed with a simple ansatz based on a halo
model. Here we report a clear detection of the excess clustering over the
linear prediction at arcminute angular scales in the power spectrum of
brightness fluctuations at 250, 350, and 500 microns. From this excess, we find
that sub-millimetre galaxies are located in dark matter halos with a minimum
mass of log[M_min/M_sun ]= 11.5^+0.7_-0.2 at 350 microns. This minimum dark
matter halo mass corresponds to the most efficient mass scale for star
formation in the universe, and is lower than that predicted by semi-analytical
models for galaxy formation.
","[{""version"":""v1"",""created"":""Wed, 5 Jan 2011 21:00:00 GMT""}]","2015-03-17"
"1101.1081","Petr Horava","Petr Horava","General Covariance in Gravity at a Lifshitz Point","12 pages, 2 figures","Class.Quant.Grav.28:114012,2011","10.1088/0264-9381/28/11/114012",,"hep-th astro-ph.CO gr-qc hep-ph","http://arxiv.org/licenses/nonexclusive-distrib/1.0/","  This paper is based on the invited talks delivered by the author at GR 19:
the 19th International Conference on General Relativity and Gravitation, Ciudad
de M\'exico, M\'exico, July 2010. In Part 1, we briefly review some of the main
features of quantum gravity with anisotropic scaling, and comment on its
possible relation to the causal dynamical triangulations (CDT) approach to
lattice quantum gravity. Part 2 explains the construction of gravity with
anisotropic scaling with an extended gauge symmetry -- essentially a
nonrelativistic version of general covariance. This extra symmetry eliminates
the scalar graviton polarization, and thus brings the theory closer to general
relativity at long distances.
","[{""version"":""v1"",""created"":""Wed, 5 Jan 2011 21:00:01 GMT""}]","2011-06-07"
"1101.1082","Andrew West","Andrew A. West, Dylan P. Morgan, John J. Bochanski, Jan Marie
  Andersen, Keaton J. Bell, Adam F. Kowalski, James R. A. Davenport, Suzanne L.
  Hawley, Sarah J. Schmidt, David Bernat, Eric J. Hilton, Philip Muirhead,
  Kevin R. Covey, Barbara Rojas-Ayala, Everett Schlawin, Mary Gooding, Kyle
  Schluns, Saurav Dhital, J. Sebastian Pineda, David O. Jones","The Sloan Digital Sky Survey Data Release 7 Spectroscopic M Dwarf
  Catalog I: Data","14 pages, 10 figures, 5 tables (in emulateapj format), accepted for
  publication in the Astronomical Journal",,"10.1088/0004-6256/141/3/97",,"astro-ph.SR","http://arxiv.org/licenses/nonexclusive-distrib/1.0/","  We present a spectroscopic catalog of 70,841 visually inspected M dwarfs from
the seventh data release of the Sloan Digital Sky Survey (SDSS). For each
spectrum, we provide measurements of the spectral type, a number of molecular
bandheads, and the H-alpha, H-beta, H-gamma, H-delta and Ca II K emission
lines. In addition, we calculate the metallicity-sensitive parameter zeta and
identify a relationship between zeta and the g-r and r-z colors of M dwarfs. We
assess the precision of our spectral types (which were assigned by individual
examination), review the bulk attributes of the sample, and examine the
magnetic activity properties of M dwarfs, in particular those traced by the
higher order Balmer transitions. Our catalog is cross-matched to Two Micron All
Sky Survey (2MASS) infrared data, and contains photometric distances for each
star. Lastly, we identify eight new late-type M dwarfs that are possibly within
25 pc of the Sun. Future studies will use these data to thoroughly examine
magnetic activity and kinematics in late-type M dwarfs and examine the chemical
and dynamical history of the local Milky Way.
","[{""version"":""v1"",""created"":""Wed, 5 Jan 2011 21:00:02 GMT""},{""version"":""v2"",""created"":""Thu, 20 Jan 2011 17:40:47 GMT""}]","2015-05-20"
"1101.1083","Don N. Page","Don N. Page","Statistical Evidence Against Simple Forms of Wavefunction Collapse","8 pages, LaTeX",,,"Alberta-Thy-01-11","hep-th gr-qc quant-ph","http://arxiv.org/licenses/nonexclusive-distrib/1.0/","  If the initial quantum state of the universe is a multiverse superposition
over many different sets of values of the effective coupling ""constants"" of
physics, and if this quantum state collapses to an eigenstate of the set of
coupling ""constants"" with a probability purely proportional to the absolute
square of the amplitude (with no additional factor for something like life or
consciousness), then one should not expect that the coupling `constants' would
be so biophilic as they are observed to be. Therefore, the observed biophilic
values (apparent fine tuning) of the coupling ""constants"" is statistical
evidence against such simple forms of wavefunction collapse.
","[{""version"":""v1"",""created"":""Wed, 5 Jan 2011 21:00:02 GMT""}]","2011-01-07"
"1101.1084","Stephen Gwyn","Stephen D.J. Gwyn","The CFHT Legacy Survey: stacked images and catalogs","56 pages, 19 figures Submitted to AJ. Data available at:
  http://www.cadc.hia.nrc.gc.ca/community/CFHTLS-SG/docs/cfhtls.html",,"10.1088/0004-6256/143/2/38",,"astro-ph.CO","http://arxiv.org/licenses/nonexclusive-distrib/1.0/","  This paper describes the image stacks and catalogs of the CFHT Legacy Survey
produced using using the MegaPipe data pipeline at the Canadian Astronomy Data
Centre. The Legacy Survey is divided into to two parts: The Deep Survey
consists of 4 fields each of 1 square degree, with magnitude limits of u=27.5,
g=27.9, r=27.7, i=27.4, and z=26.2, and contains 1.6 million sources. The Wide
Survey consists of 171 square degree pointings split over 4 fields, with
magnitude limits of u=26.0, g=26.5, r=25.9, i=25.7, and z=24.6, and contains 30
million sources. This paper describes the calibration, image stacking and
catalog generation process. The images and catalogs are available on the web
through several interfaces: normal image and text file catalog downloads, a
Google Sky interface, an image cutout service, and a catalog database query
service.
","[{""version"":""v1"",""created"":""Wed, 5 Jan 2011 21:00:03 GMT""},{""version"":""v2"",""created"":""Wed, 9 Nov 2011 08:39:16 GMT""}]","2017-03-15"
"1101.1085","Luigi Foschini","L. Foschini, G. Ghisellini, F. Tavecchio, G. Bonnoli, A. Stamerra","Search for the shortest variability at gamma rays in flat-spectrum radio
  quasars","5 pages, 3 figures, 1 table. Accepted for publication on A&A",,"10.1051/0004-6361/201117064",,"astro-ph.HE astro-ph.CO astro-ph.GA","http://arxiv.org/licenses/nonexclusive-distrib/1.0/","  We report about the search for short-term variability in the high-energy
gamma-ray energy band of three flat-spectrum radio quasars (3C 454.3, 3C 273,
PKS B1222+216), whose flux at E > 100 MeV exceeded the value of 10^-5 ph cm^-2
s^-1 for at least one day. Although, the statistics was not yet sufficient to
effectively measure the characteristic time scale, it allowed us to set tight
upper limits on the observed doubling time scale (< 2-3 hours) -- the smallest
measured to date at MeV energies --, which can constrain the size of the
gamma-ray emitting region. The results obtained in the present work favor the
hypothesis that gamma rays are generated inside the broad-line region.
","[{""version"":""v1"",""created"":""Wed, 5 Jan 2011 21:00:03 GMT""},{""version"":""v2"",""created"":""Mon, 11 Apr 2011 17:39:08 GMT""},{""version"":""v3"",""created"":""Tue, 26 Apr 2011 17:02:34 GMT""}]","2015-05-20"
"1101.1086","Andrew West","Andrew A. West, John J. Bochanski, Brendan P. Bowler, Aaron Dotter,
  John A. Johnson, Sebastian Lepine, Barbara Rojas-Ayala, Andreas Schweitzer","Determining the Metallicity of Low-Mass Stars and Brown Dwarfs: Tools
  for Probing Fundamental Stellar Astrophysics, Tracing Chemical Evolution of
  the Milky Way and Identifying the Hosts of Extrasolar Planets","12 pages, 6 figures, to be published in the Proceedings of the Cool
  Stars 16 meeting in Seattle, WA",,,,"astro-ph.SR","http://arxiv.org/licenses/nonexclusive-distrib/1.0/","  We present a brief overview of a splinter session on determining the
metallicity of low-mass dwarfs that was organized as part of the Cool Stars 16
conference. We review contemporary spectroscopic and photometric techniques for
estimating metallicity in low-mass dwarfs and discuss the importance of
measuring accurate metallicities for studies of Galactic and chemical evolution
using subdwarfs, creating metallicity benchmarks for brown dwarfs, and
searching for extrasolar planets that are orbiting around low--mass dwarfs. In
addition, we present the current understanding of the effects of metallicity on
stellar evolution and atmosphere models and discuss some of the limitations
that are important to consider when comparing theoretical models to data.
","[{""version"":""v1"",""created"":""Wed, 5 Jan 2011 21:00:04 GMT""}]","2015-03-17"
"1101.1087","Stephen Kane","Stephen R. Kane, Dawn M. Gelino","On the Inclination Dependence of Exoplanet Phase Signatures","6 pages, 3 figures, accepted for publication in ApJ","2011, ApJ, 729, 74","10.1088/0004-637X/729/1/74",,"astro-ph.EP","http://arxiv.org/licenses/nonexclusive-distrib/1.0/","  Improved photometric sensitivity from space-based telescopes have enabled the
detection of phase variations for a small sample of hot Jupiters. However,
exoplanets in highly eccentric orbits present unique opportunities to study the
effects of drastically changing incident flux on the upper atmospheres of giant
planets. Here we expand upon previous studies of phase functions for these
planets at optical wavelengths by investigating the effects of orbital
inclination on the flux ratio as it interacts with the other effects induced by
orbital eccentricity. We determine optimal orbital inclinations for maximum
flux ratios and combine these calculations with those of projected separation
for application to coronagraphic observations. These are applied to several of
the known exoplanets which may serve as potential targets in current and future
coronagraph experiments.
","[{""version"":""v1"",""created"":""Wed, 5 Jan 2011 21:00:04 GMT""}]","2015-05-20"
"1101.1088","Ross Church","Ross P. Church, Andrew J. Levan, Melvyn B. Davies, Nial Tanvir","Implications for the origin of short gamma-ray bursts from their
  observed positions around their host galaxies","12 pages, 13 figures. Accepted for publication in MNRAS",,"10.1111/j.1365-2966.2011.18277.x",,"astro-ph.HE","http://arxiv.org/licenses/nonexclusive-distrib/1.0/","  We present the observed offsets of short-duration gamma-ray bursts (SGRBs)
from their putative host galaxies and compare them to the expected
distributions of merging compact object binaries, given the observed properties
of the hosts. We find that for all but one burst in our sample the offsets are
consistent with this model. For the case of bursts with massive elliptical host
galaxies, the circular velocities of the hosts' haloes exceed the natal
velocities of almost all our compact object binaries. Hence the extents of the
predicted offset distributions for elliptical galaxies are determined largely
by their spatial extents. In contrast, for spiral hosts the galactic rotation
velocities are smaller than typical binary natal velocities and the predicted
burst offset distributions are more extended than the galaxies.
  One SGRB, 060502B, apparently has a large radial offset that is inconsistent
with an origin in a merging galactic compact binary. Although it is plausible
that the host of GRB 060502B is mis-identified, our results show that the large
offset is compatible with a scenario where at least a few per cent of SGRBs are
created by the merger of compact binaries that form dynamically in globular
clusters.
","[{""version"":""v1"",""created"":""Wed, 5 Jan 2011 21:00:05 GMT""}]","2015-05-20"
"1101.1089","Laurent Cambresy","L. Cambr\'esy, J. Rho, D. J. Marshall, W. T. Reach","Variation of the extinction law in the Trifid nebula","Accepted for publication in A&A. 10 pages, 8 figures",,"10.1051/0004-6361/201015863",,"astro-ph.GA","http://arxiv.org/licenses/nonexclusive-distrib/1.0/","  In the past few years, the extinction law has been measured in the infrared
wavelengths for various molecular clouds and different laws have been obtained.
In this paper we seek variations of the extinction law within the Trifid nebula
region. Such variations would demonstrate a local dust evolution linked to
variation of the environment parameters such as the density or the interstellar
radiation field. The extinction values, A_lambda/A_V, are obtained using the
2MASS, UKIDSS and Spitzer/GLIMPSE surveys. The technique is to inter-calibrate
color-excess maps from different wavelengths to derive the extinction law and
to map the extinction in the Trifid region. We measured the extinction law at
3.6, 4.5, and 5.8 um and we found a transition at A_V ~ 20 mag. Below this
threshold the extinction law is as expected from models for R_V=5.5 whereas
above 20 mag of visual extinction, it is flatter. Using these results the
color-excess maps are converted into a composite extinction map of the Trifid
nebula at a spatial resolution of 1 arcmin. A tridimensional analysis along the
line-of-sight allowed us to estimate a distance of 2.7 kpc for the Trifid. The
comparison of the extinction with the 1.25 mm emission suggests the millimeter
emissivity is enhanced in the dense condensations of the cloud. Our results
suggest a dust transition at large extinction which has not been reported so
far and dust emissivity variations.
","[{""version"":""v1"",""created"":""Wed, 5 Jan 2011 21:00:06 GMT""}]","2015-05-20"
"1101.1090","James Moore","J. Christopher Moore and Louis J. Rubbo","Are we teaching students to think like scientists?","10 pages, 3 figures, submitted to The Physics Teacher",,,,"physics.ed-ph","http://arxiv.org/licenses/nonexclusive-distrib/1.0/","  University courses in conceptual physics and astronomy typically serve as the
terminal science experience for non-science majors. Significant work has gone
into developing research-verified pedagogical methods for the algebra- and
calculus-based physics courses typically populated by natural and physical
science majors; however, there is significantly less volume in the literature
concerning the non-science population. This is quickly changing, and large,
repeatable gains on concept tests are being reported. However, we may be losing
sight of what is arguably the most important goal of such a course: development
of scientific reasoning. Are we teaching this population of students to think
like scientists?
","[{""version"":""v1"",""created"":""Wed, 5 Jan 2011 21:01:09 GMT""}]","2011-01-07"
