"1101.5021","Fabrizio Caselli","Fabrizio Caselli and Roberta Fulci","Gelfand models and Robinson-Schensted correspondence","23 pages",,,,"math.CO math.RT","http://arxiv.org/licenses/nonexclusive-distrib/1.0/","  In [F. Caselli, Involutory reflection groups and their models, J. Algebra 24
(2010), 370--393] there is constructed a uniform Gelfand model for all
non-exceptional irreducible complex reflection groups which are involutory.
Such model can be naturally decomposed into the direct sum of submodules
indexed by $S_n$-conjugacy classes, and we present here a general result that
relates the irreducible decomposition of these submodules with the projective
Robinson-Schensted correspondence. This description also reflects in a very
explicit way the existence of split representations for these groups.
","[{""version"":""v1"",""created"":""Wed, 26 Jan 2011 10:45:37 GMT""}]","2011-01-27"
"1101.5022","Jes\'us Antonio \'Alvarez L\'opez","Jes\'us A. \'Alvarez L\'opez and Manuel Calaza","Application of the method of Bonan-Clark to the generalized Hermite
  polynomials","19 pages",,,,"math.SP math-ph math.FA math.MP","http://arxiv.org/licenses/nonexclusive-distrib/1.0/","  It is shown that the method of Bonan-Clark can be used to prove asymptotic
estimates for the generalized Hermite polynomials, showing also that these
estimates are optimal.
","[{""version"":""v1"",""created"":""Wed, 26 Jan 2011 10:47:42 GMT""},{""version"":""v10"",""created"":""Fri, 6 Sep 2013 09:39:02 GMT""},{""version"":""v11"",""created"":""Mon, 3 Apr 2017 13:19:30 GMT""},{""version"":""v12"",""created"":""Wed, 17 May 2017 18:21:53 GMT""},{""version"":""v2"",""created"":""Thu, 10 Feb 2011 10:10:51 GMT""},{""version"":""v3"",""created"":""Sat, 12 Feb 2011 07:33:22 GMT""},{""version"":""v4"",""created"":""Fri, 17 Feb 2012 19:56:03 GMT""},{""version"":""v5"",""created"":""Thu, 22 Mar 2012 15:18:30 GMT""},{""version"":""v6"",""created"":""Wed, 2 May 2012 08:02:25 GMT""},{""version"":""v7"",""created"":""Thu, 17 Jan 2013 19:25:22 GMT""},{""version"":""v8"",""created"":""Sun, 17 Feb 2013 19:17:07 GMT""},{""version"":""v9"",""created"":""Mon, 18 Mar 2013 15:31:58 GMT""}]","2017-05-19"
"1101.5023","Voja Radovanovic","Marija Dimitrijevic, Biljana Nikolic and Voja Radovanovic","Twisted SUSY: twisted symmetry versus renormalizability","20 pages, no figures","Phys.Rev.D83:065010,2011","10.1103/PhysRevD.83.065010",,"hep-th","http://arxiv.org/licenses/nonexclusive-distrib/1.0/","  We discuss a deformation of superspace based on a hermitian twist. The twist
implies a $\star$-product that is noncommutative, hermitian and finite when
expanded in power series of the deformation parameter. The Leibniz rule for the
twisted SUSY transformations is deformed. A minimal deformation of the
Wess-Zumino action is proposed and its renormalizability properties are
discussed. There is no tadpole contribution, but the two-point function
diverges. We speculate that the deformed Leibniz rule, or more generally the
twisted symmetry, interferes with renormalizability properties of the model. We
discuss different possibilities to render a renormalizable model.
","[{""version"":""v1"",""created"":""Wed, 26 Jan 2011 11:06:48 GMT""}]","2011-03-21"
"1101.5024","Barbara Sciascia","B. Sciascia (for the FlaviaNet Kaon Working Group)","Vus and precise Standard Model tests","5 pages, Proceedings of CKM2010, the 6th International Workshop on
  the CKM Unitarity Triangle, University of Warwick, UK, 6-10 September 2010",,,,"hep-ph","http://arxiv.org/licenses/nonexclusive-distrib/1.0/","  The recent significant progress on both the experimental and theoretical
sides on the study of leptonic and semileptonic kaon decays allows to precisely
test the Standard Model. Here we present results for the determination of Vus
from experimental data, the comparison between the values of Vus obtained from
data on semileptonic and leptonic kaon decays, and tests of lepton universality
in semileptonic kaon decays.
","[{""version"":""v1"",""created"":""Wed, 26 Jan 2011 11:07:49 GMT""}]","2019-08-14"
"1101.5025","Pavel Loskot","Saif E. A. Alnawayseh and Pavel Loskot","Order Statistics Based List Decoding Techniques for Linear Binary Block
  Codes","17 pages, 2 tables, 6 figures, submitted to IEEE Transactions on
  Information Theory",,,,"cs.IT math.IT","http://arxiv.org/licenses/nonexclusive-distrib/1.0/","  The order statistics based list decoding techniques for linear binary block
codes of small to medium block length are investigated. The construction of the
list of the test error patterns is considered. The original order statistics
decoding is generalized by assuming segmentation of the most reliable
independent positions of the received bits. The segmentation is shown to
overcome several drawbacks of the original order statistics decoding. The
complexity of the order statistics based decoding is further reduced by
assuming a partial ordering of the received bits in order to avoid the complex
Gauss elimination. The probability of the test error patterns in the decoding
list is derived. The bit error rate performance and the decoding complexity
trade-off of the proposed decoding algorithms is studied by computer
simulations. Numerical examples show that, in some cases, the proposed decoding
schemes are superior to the original order statistics decoding in terms of both
the bit error rate performance as well as the decoding complexity.
","[{""version"":""v1"",""created"":""Wed, 26 Jan 2011 11:19:36 GMT""}]","2011-01-27"
"1101.5026","Michael Ruzhansky","Michael Ruzhansky, Mitsuru Sugimoto","Structural resolvent estimates and derivative nonlinear Schrodinger
  equations","21 pages","Comm. Math. Phys., 314 (2012), 281-304","10.1007/s00220-012-1524-x",,"math.AP math.FA","http://arxiv.org/licenses/nonexclusive-distrib/1.0/","  A refinement of uniform resolvent estimate is given and several smoothing
estimates for Schrodinger equations in the critical case are induced from it.
The relation between this resolvent estimate and radiation condition is
discussed. As an application of critical smoothing estimates, we show a global
existence results for derivative nonlinear Schrodinger equations.
","[{""version"":""v1"",""created"":""Wed, 26 Jan 2011 11:22:55 GMT""}]","2014-01-14"
"1101.5027","Sandro Bosio","Sandro Bosio and Di Yuan","Modeling and Solving AP Location and Frequency Assignment for Maximizing
  Access Efficiency in Wi-Fi Networks","In proceedings of International Network Optimization Conference 2009
  (INOC 2009), Pisa, Italy, 2009",,,,"math.OC cs.NI","http://arxiv.org/licenses/nonexclusive-distrib/1.0/","  In this paper, we present optimization approaches for Access Point (AP)
location and frequency assignment, two major planning tasks in deploying Wi-Fi
networks. Since APs are relatively cheap, the major concern is network
performance. We consider a performance metric, referred to as access
efficiency, that captures key aspects of how user devices share access to the
wireless medium. We propose a two-step approach to deal with AP location and
frequency assignment in maximizing access efficiency. A novelty of our modeling
approach is to estimate, in the first step of AP location, the impact of
expected frequency availability on frequency assignment. For each of the two
steps we derive hyperbolic formulations and their linearizations, and we
propose a promising enumerative formulation. Sample results are reported to
show the applicability of the approach.
","[{""version"":""v1"",""created"":""Wed, 26 Jan 2011 11:26:02 GMT""}]","2011-01-27"
"1101.5028","Ilya Lvovich Shapiro","Davi C. Rodrigues, Filipe de O. Salles, Ilya L. Shapiro, Alexei A.
  Starobinsky","Auxiliary fields representation for modified gravity models","Added a few comments on quantum properties and a new section about
  quantum UV completion of the classically equivalent theories, plus
  corresponding references. Fits the manuscript accepted for publication in
  Physical Review D. 29 pages, no figures","Phys.Rev.D83:084028,2011","10.1103/PhysRevD.83.084028","RESCEU-25/10","gr-qc hep-th","http://arxiv.org/licenses/nonexclusive-distrib/1.0/","  We consider tensor-multiscalar representations for several types of modified
gravity actions. The first example is the theory with the action representing
an arbitrary smooth function of the scalar curvature R and (Box R), the
integrand of the Gauss-Bonnet term and the square of the Weyl tensor. We
present a simple procedure leading to an equivalent theory of a space-time
metric and four auxiliary scalars and specially discuss calibration of a
cosmological constant and the condition of the existence of dS-like solutions
in the case of empty universe. The condition for obtaining a smaller number of
independent scalar fields is derived. The second example is the Eddington-like
gravity action. In this case we show, in particular, the equivalence of the
theory to GR with the cosmological constant term, with or without use of the
first-order formalism, and also discuss some possible generalizations.
","[{""version"":""v1"",""created"":""Wed, 26 Jan 2011 11:26:59 GMT""},{""version"":""v2"",""created"":""Sat, 26 Mar 2011 21:44:14 GMT""}]","2011-05-05"
"1101.5029","Cms Collaboration","CMS Collaboration","Dijet Azimuthal Decorrelations in pp Collisions at sqrt(s) = 7 TeV",,"Phys.Rev.Lett.106:122003,2011","10.1103/PhysRevLett.106.122003","CMS-QCD-10-026, CERN-PH-EP-2010-086","hep-ex","http://arxiv.org/licenses/nonexclusive-distrib/1.0/","  Measurements of dijet azimuthal decorrelations in pp collisions at sqrt(s) =
7 TeV using the CMS detector at the CERN LHC are presented. The analysis is
based on an inclusive dijet event sample corresponding to an integrated
luminosity of 2.9 inverse picobarns. The results are compared to predictions
from perturbative QCD calculations and various Monte Carlo event generators.
The dijet azimuthal distributions are found to be sensitive to initial-state
gluon radiation.
","[{""version"":""v1"",""created"":""Wed, 26 Jan 2011 11:28:10 GMT""},{""version"":""v2"",""created"":""Thu, 21 Apr 2011 14:06:28 GMT""}]","2015-03-18"
"1101.5030","David Applebaum","David Applebaum","Pseudo Differential Operators and Markov Semigroups on Compact Lie
  Groups",,,,,"math.PR","http://arxiv.org/licenses/nonexclusive-distrib/1.0/","  We extend the Ruzhansky-Turunen theory of pseudo differential operators on
compact Lie groups into a tool that can be used to investigate group-valued
Markov processes in the spirit of the work in Euclidean spaces of N.Jacob and
collaborators. Feller semigroups, their generators and resolvents are exhibited
as pseudo-differential operators and the symbols of the operators forming the
semigroup are expressed in terms of the Fourier transform of the transition
kernel. The symbols are explicitly computed for some examples including the
Feller processes associated to stochastic flows arising from solutions of
stochastic differential equations on the group driven by L\'{e}vy processes. We
study a family of L\'{e}vy-type linear operators on general Lie groups that are
pseudo differential operators when the group is compact and find conditions for
them to give rise to symmetric Dirichlet forms.
","[{""version"":""v1"",""created"":""Wed, 26 Jan 2011 11:29:30 GMT""}]","2011-01-27"
"1101.5031","Michele Veltri","M. Veltri","K+-(mu3) Form Factors Measurement at NA48/2","Proceedings of CKM2010, the 6th International Workshop on the CKM
  Unitarity Triangle, University of Warwick, UK, 6-10 September 2010",,,,"hep-ex","http://arxiv.org/licenses/nonexclusive-distrib/1.0/","  We report here a measurement of form factors of $K^{\pm}_{\mu 3}$ decay by
the NA48/2 experiment at CERN. Using a sample of 3.4$\times10^6$ events we
provide preliminary form factor values according to various parametrizations.
The slope of the scalar form factor is in agreement with other measurements and
theory predictions.
","[{""version"":""v1"",""created"":""Wed, 26 Jan 2011 11:39:30 GMT""}]","2011-01-27"
"1101.5032","Nikolai Moshchevitin","Nikolay Moshchevitin","On certain Littlewood-like and Schmidt-like problems in inhomogeneous
  Diophantine approximations","18 pages",,,,"math.NT","http://arxiv.org/licenses/nonexclusive-distrib/1.0/","  We give several results related to inhomogeneous approximations to two real
numbers and badly approximable numbers. Our results are related to classical
theorems by A. Khintchine (1926) and to an original method invented by Y. Peres
and W. Schlag (2001).
","[{""version"":""v1"",""created"":""Wed, 26 Jan 2011 11:41:11 GMT""},{""version"":""v2"",""created"":""Fri, 11 Feb 2011 16:20:23 GMT""}]","2011-02-14"
"1101.5033","Luis Granda","L. N. Granda","Holographic unification of dark matter and dark energy","10 pages, time integration clarified",,,,"hep-th gr-qc","http://arxiv.org/licenses/nonexclusive-distrib/1.0/","  Using a new version of the holographic principle, a constant term was
introduced, which conduces to the description of the standard cosmological LCDM
model, and unifies under the same concept the dark matter and dark energy
phenomena. The obtained model improves the results of previously considered
holographic models based on local quantities. The inclusion of constant term is
interpreted as a natural first approximation for the infrared cutoff which is
associated with the vacuum energy, and the additional terms guarantee an
appropriate evolutionary scenario that fits the astrophysical observations. The
model allows to reproduce the standard LCDM model without explicitly
introducing matter content, and using only geometrical quantities. It is also
obtained that the model may describe the dark energy beyond the standard LCDM.
","[{""version"":""v1"",""created"":""Wed, 26 Jan 2011 11:45:06 GMT""},{""version"":""v2"",""created"":""Fri, 28 Jan 2011 12:58:15 GMT""},{""version"":""v3"",""created"":""Mon, 31 Jan 2011 17:42:35 GMT""},{""version"":""v4"",""created"":""Wed, 2 Feb 2011 19:56:42 GMT""}]","2011-02-03"
"1101.5034","Mauricio Cataldo MC","Mauricio Cataldo, Paola Meza and Paul Minning","N-dimensional static and evolving Lorentzian wormholes with cosmological
  constant","10 pages, accepted for publication in Phys. Rev. D","Phys.Rev.D83:044050,2011","10.1103/PhysRevD.83.044050",,"gr-qc hep-th","http://arxiv.org/licenses/nonexclusive-distrib/1.0/","  We present a family of static and evolving spherically symmetric Lorentzian
wormhole solutions in N+1 dimensional Einstein gravity. In general, for static
wormholes, we require that at least the radial pressure has a barotropic
equation of state of the form $p_r=\omega_r \rho$, where the state parameter
$\omega_r$ is constant. On the other hand, it is shown that in any dimension $N
\geq 3$, with $\phi(r)=\Lambda=0$ and anisotropic barotropic pressure with
constant state parameters, static wormhole configurations are always
asymptotically flat spacetimes, while in 2+1 gravity there are not only
asymptotically flat static wormholes and also more general ones. In this case,
the matter sustaining the three-dimensional wormhole may be only a pressureless
fluid. In the case of evolving wormholes with $N \geq 3$, the presence of a
cosmological constant leads to an expansion or contraction of the wormhole
configurations: for positive cosmological constant we have wormholes which
expand forever and, for negative cosmological constant we have wormholes which
expand to a maximum value and then recollapse. In the absence of a cosmological
constant the wormhole expands with constant velocity, i.e without acceleration
or deceleration. In 2+1 dimensions the expanding wormholes always have an
isotropic and homogeneous pressure, depending only on the time coordinate.
","[{""version"":""v1"",""created"":""Wed, 26 Jan 2011 11:48:01 GMT""}]","2011-03-23"
"1101.5035","Andreas Kyprianou A.E.","Andreas E. Kyprianou and Juan Carlos Pardo","An optimal stopping problem for fragmentation processes",,,,,"math.PR","http://arxiv.org/licenses/nonexclusive-distrib/1.0/","  In this article we consider a toy example of an optimal stopping problem
driven by fragmentation processes. We show that one can work with the concept
of stopping lines to formulate the notion of an optimal stopping problem and
moreover, to reduce it to a classical optimal stopping problem for a
generalized Ornstein-Uhlenbeck process associated with Bertoin's tagged
fragment. We go on to solve the latter using a classical verification technique
thanks to the application of aspects of the modern theory of integrated
exponential Levy processes.
","[{""version"":""v1"",""created"":""Wed, 26 Jan 2011 11:48:39 GMT""}]","2011-01-27"
"1101.5036","Pablo Reig","Pablo Reig","Be/X-ray binaries","""The final publication is available at http://www.springerlink.com"".
  This review article has been accepted for publication in Astrophysics and
  Space Science",,"10.1007/s10509-010-0575-8",,"astro-ph.HE","http://arxiv.org/licenses/nonexclusive-distrib/1.0/","  The purpose of this work is to review the observational properties of
Be/X-ray binaries. The open questions in Be/X-ray binaries include those
related to the Be star companion, that is, the so-called ""Be phenomenon"", such
as, timescales associated to the formation and dissipation of the equatorial
disc, mass-ejection mechanisms, V/R variability, and rotation rates; those
related to the neutron star, such as, mass determination, accretion physics,
and spin period evolution; but also, those that result from the interaction of
the two constituents, such as, disc truncation and mass transfer. Until
recently, it was thought that the Be stars' disc was not significantly affected
by the neutron star. In this review, I present the observational evidence
accumulated in recent years on the interaction between the circumstellar disc
and the compact companion. The most obvious effect is the tidal truncation of
the disc. As a result, the equatorial discs in Be/X-ray binaries are smaller
and denser than those around isolated Be stars.
","[{""version"":""v1"",""created"":""Wed, 26 Jan 2011 11:56:39 GMT""}]","2015-05-27"
"1101.5037","M Ponmurugan","M. Ponmurugan","Entropy reduction from a detailed fluctuation theorem for a
  nonequilibrium stochastic system driven under feedback control","5 pages",,,,"cond-mat.stat-mech","http://arxiv.org/licenses/nonexclusive-distrib/1.0/","  We show explicitly the entropy reduction from a detailed fluctuation theorem
for the general stochastic system driven by nonequilibrium process under
feedback control. The effect of interaction of the feedback controller with the
system is to reduce the entropy of the system. We define the entropy reduction
for the single trajectory and show that the overall entropy production for the
stochastic system with feedback control can be either positive or negative. The
negative entropy production has been studied earlier for a simple system with
velocity dependent feedback control [K. H. Kim and H. Qian, Phys. Rev. Lett.
{\bf 93}, 120602 (2004)]. Our general approach provides the overall positive or
negative entropy production irrespective of velocity dependent and position
dependent feedback control.
","[{""version"":""v1"",""created"":""Wed, 26 Jan 2011 12:20:06 GMT""},{""version"":""v2"",""created"":""Tue, 26 Apr 2011 10:31:27 GMT""}]","2011-04-27"
"1101.5038","Jonas Blomme","J. Blomme, L.M. Sarro, F.T. O'Donovan, J. Debosscher, T. Brown, M.
  Lopez, P. Dubath, L. Rimoldini, D. Charbonneau, E. Dunham, G. Mandushev, D.R.
  Ciardi, J. De Ridder and C. Aerts","Automated classification of periodic variable stars{Improved methodology
  for the automated classification of periodic variable stars}","11 pages, 6 figures Accepted for publication in MNRAS",,"10.1111/j.1365-2966.2011.19466.x",,"astro-ph.IM","http://arxiv.org/licenses/nonexclusive-distrib/1.0/","  We present a novel automated methodology to detect and classify periodic
variable stars in a large database of photometric time series. The methods are
based on multivariate Bayesian statistics and use a multi-stage approach. We
applied our method to the ground-based data of the TrES Lyr1 field, which is
also observed by the Kepler satellite, covering ~26000 stars. We found many
eclipsing binaries as well as classical non-radial pulsators, such as slowly
pulsating B stars, Gamma Doradus, Beta Cephei and Delta Scuti stars. Also a few
classical radial pulsators were found.
","[{""version"":""v1"",""created"":""Wed, 26 Jan 2011 12:21:09 GMT""}]","2014-06-27"
"1101.5039","Alireza Nowroozi","Mohammadreza Abolghasemi-Dahaghani, Farzad Didehvar (1), Alireza
  Nowroozi","A Novel Template-Based Learning Model",,,,,"cs.LG","http://arxiv.org/licenses/nonexclusive-distrib/1.0/","  This article presents a model which is capable of learning and abstracting
new concepts based on comparing observations and finding the resemblance
between the observations. In the model, the new observations are compared with
the templates which have been derived from the previous experiences. In the
first stage, the objects are first represented through a geometric description
which is used for finding the object boundaries and a descriptor which is
inspired by the human visual system and then they are fed into the model. Next,
the new observations are identified through comparing them with the
previously-learned templates and are used for producing new templates. The
comparisons are made based on measures like Euclidean or correlation distance.
The new template is created by applying onion-pealing algorithm. The algorithm
consecutively uses convex hulls which are made by the points representing the
objects. If the new observation is remarkably similar to one of the observed
categories, it is no longer utilized in creating a new template. The existing
templates are used to provide a description of the new observation. This
description is provided in the templates space. Each template represents a
dimension of the feature space. The degree of the resemblance each template
bears to each object indicates the value associated with the object in that
dimension of the templates space. In this way, the description of the new
observation becomes more accurate and detailed as the time passes and the
experiences increase. We have used this model for learning and recognizing the
new polygons in the polygon space. Representing the polygons was made possible
through employing a geometric method and a method inspired by human visual
system. Various implementations of the model have been compared. The evaluation
results of the model prove its efficiency in learning and deriving new
templates.
","[{""version"":""v1"",""created"":""Wed, 26 Jan 2011 12:21:13 GMT""}]","2011-01-27"
"1101.5040","Meszaros Attila","Attila Meszaros, Jakub Ripa, Felix Ryde","Cosmological effects on the observed flux and fluence distributions of
  gamma-ray bursts: Are the most distant bursts in general the faintest ones?","Accepted for publication in Astronomy and Astrophysics, 5 figures, 7
  tables",,"10.1051/0004-6361/201014918",,"astro-ph.CO","http://arxiv.org/licenses/nonexclusive-distrib/1.0/","  Several claims have been put forward that an essential fraction of
long-duration BATSE gamma-ray bursts should lie at redshifts larger than 5.
This point-of-view follows from the natural assumption that fainter objects
should, on average, lie at larger redshifts. However, redshifts larger than 5
are rare for bursts observed by Swift, seemingly contradicting the BATSE
estimates. The purpose of this article is to clarify this contradiction. We
derive the cosmological relationships between the observed and emitted
quantities, and we arrive at a prediction that can be tested on the ensembles
of bursts with determined redshifts. This analysis is independent on the
assumed cosmology, on the observational biases, as well as on any gamma-ray
burst model. Four different samples are studied: 8 BATSE bursts with redshifts,
13 bursts with derived pseudo-redshifts, 134 Swift bursts with redshifts, and 6
Fermi bursts with redshifts. The controversy can be explained by the fact that
apparently fainter bursts need not, in general, lie at large redshifts. Such a
behaviour is possible, when the luminosities (or emitted energies) in a sample
of bursts increase more than the dimming of the observed values with redshift.
In such a case dP(z)/dz > 0 can hold, where P(z) is either the peak-flux or the
fluence. All four different samples of the long bursts suggest that this is
really the case. This also means that the hundreds of faint, long-duration
BATSE bursts need not lie at high redshifts, and that the observed redshift
distribution of long Swift bursts might actually represent the actual
distribution.
","[{""version"":""v1"",""created"":""Wed, 26 Jan 2011 12:22:32 GMT""}]","2015-05-27"
