"1101.4963","Uwe C. T\""auber","Qian He (Virginia Tech), Mauro Mobilia (University of Leeds), and Uwe
  C. Tauber (Virginia Tech)","Co-existence in the two-dimensional May-Leonard model with random rates","9 pages, 4 figures; to appear in Eur. Phys. J. B (2011)","Eur. Phys. J. B 82 (2011) 97","10.1140/epjb/e2011-20259-x",,"q-bio.PE cond-mat.stat-mech","http://arxiv.org/licenses/nonexclusive-distrib/1.0/","  We employ Monte Carlo simulations to numerically study the temporal evolution
and transient oscillations of the population densities, the associated
frequency power spectra, and the spatial correlation functions in the
(quasi-)steady state in two-dimensional stochastic May--Leonard models of
mobile individuals, allowing for particle exchanges with nearest-neighbors and
hopping onto empty sites. We therefore consider a class of four-state
three-species cyclic predator-prey models whose total particle number is not
conserved. We demonstrate that quenched disorder in either the reaction or in
the mobility rates hardly impacts the dynamical evolution, the emergence and
structure of spiral patterns, or the mean extinction time in this system. We
also show that direct particle pair exchange processes promote the formation of
regular spiral structures. Moreover, upon increasing the rates of mobility, we
observe a remarkable change in the extinction properties in the May--Leonard
system (for small system sizes): (1) As the mobility rate exceeds a threshold
that separates a species coexistence (quasi-)steady state from an absorbing
state, the mean extinction time as function of system size N crosses over from
a functional form ~ e^{cN} / N (where c is a constant) to a linear dependence;
(2) the measured histogram of extinction times displays a corresponding
crossover from an (approximately) exponential to a Gaussian distribution. The
latter results are found to hold true also when the mobility rates are randomly
distributed.
","[{""version"":""v1"",""created"":""Tue, 25 Jan 2011 22:03:25 GMT""},{""version"":""v2"",""created"":""Thu, 27 Jan 2011 14:35:39 GMT""},{""version"":""v3"",""created"":""Sat, 21 May 2011 09:03:27 GMT""},{""version"":""v4"",""created"":""Mon, 13 Jun 2011 14:46:21 GMT""}]","2015-03-18"
"1101.4964","Marcelo  Borges Fernandes","Marcelo Borges Fernandes (1 and 2), Anthony Meilland (3), Philippe
  Bendjoya (2), Armando Domiciano de Souza (2), Gilles Niccolini (2), Olivier
  Chesneau (2), Florentin Millour (3), Alain Spang (2), Philippe Stee (2) and
  Michaela Kraus (4) ((1) Observatorio Nacional, Brazil, (2) Fizeau, France,
  (3) MPIFR, Germany, (4) Astronomicky ustav Ondrejov, Czech Republic)","The galactic unclassified B[e] star HD 50138. II. Interferometric
  constraints on the close circumstellar environment","Paper accepted for publication in Astronomy and Astrophysics (9
  pages, 5 figures, 2011 in press)",,"10.1051/0004-6361/201015602",,"astro-ph.SR","http://arxiv.org/licenses/nonexclusive-distrib/1.0/","  HD 50138 is a southern star that presents the B[e] phenomenon, but its
evolutionary stage is still not well known. This object presents spectral
variability, which can be explained by outbursts or shell phases and
spectropolarimetric observations have shown the presence of a non-spherically
symmetric circumstellar environment that is responsible for the B[e]
phenomenon. Based on recent optical long baseline interferometric observations
from the VLTI/MIDI and VLTI/AMBER, and also from the Keck segment-tilting
experiment, we study the structure of the circumstellar environment of HD
50138, through a geometrical analytical modeling, also using the recent LITpro
software and considering a large space of parameters. We resolve and describe
its circumstellar geometry for the first time in detail. The presence of a
dusty circumstellar disk with an orientation onto the sky-plane of 71+-7
degrees, which is perpendicular to the polarimetric measurements from the
literature, was derived. We also derived that HD 50138 is seen under an
intermediate angle related to the line of sight, 56+-4 degrees. In addition,
the structure of the disk and the flux contributions of the gas and dust
components is discussed.
","[{""version"":""v1"",""created"":""Tue, 25 Jan 2011 22:06:36 GMT""}]","2015-05-27"
"1101.4965","Daniel Mortlock","Daniel J. Mortlock (1), Mitesh Patel (1), Stephen J. Warren (1), Paul
  C. Hewett (2), Bram P. Venemans (3), Richard G. McMahon (2), Chris J. Simpson
  (4) ((1) Imperial College London, (2) University of Cambridge, (3) European
  Southern Observatory, (4) Liverpool John Moores University)","Probabilistic selection of high-redshift quasars","submitted to MNRAS; 20 pages, 13 figures","2012, MNRAS, 419, 390","10.1111/j.1365-2966.2011.19710.x",,"astro-ph.IM astro-ph.CO","http://arxiv.org/licenses/nonexclusive-distrib/1.0/","  High redshift quasars (HZQs) with redshifts of z >~ 6 are so rare that any
photometrically-selected sample of sources with HZQ-like colours is likely to
be dominated by Galactic stars and brown dwarfs scattered from the stellar
locus. It is impractical to reobserve all such candidates, so an alternative
approach was developed in which Bayesian model comparison techniques are used
to calculate the probability that a candidate is a HZQ, P_q, by combining
models of the quasar and star populations with the photometric measurements of
the object. This method was motivated specifically by the large number of HZQ
candidates identified by cross-matching the UKIRT Infrared Deep Sky Survey
(UKIDSS) Large Area Survey (LAS) to the Sloan Digital Sky Survey (SDSS): in the
~1900 deg^2 covered by the LAS in the UKIDSS Seventh Data Release (DR7) there
are ~10^3 real astronomical point-sources with the measured colours of the
target quasars, of which only ~10 are expected to be HZQs. Applying Bayesian
model comparison to the sample reveals that most sources with HZQ-like colours
have P_q <~ 0.1 and can be confidently rejected without the need for any
further observations. In the case of the UKIDSS DR7 LAS, there were just 88
candidates with P_q >= 0.1; these object were prioritized for reobservation by
ranking according to P_q (and their likely redshift, which was also inferred
from the photometric data). Most candidates were rejected after one or two
(moderate depth) photometric measurements by recalculating P_q using the new
data. That left seven confirmed HZQs, three of which were previously identified
in the SDSS and four of which were new UKIDSS discoveries. The high efficiency
of this Bayesian selection method suggests that it could usefully be extended
to other HZQ surveys (e.g. searches by Pan-STARRS or VISTA) as well as to other
searches for rare objects.
","[{""version"":""v1"",""created"":""Tue, 25 Jan 2011 22:09:06 GMT""}]","2015-03-18"
"1101.4966","Brian McNamara","R. Samuele (Northrop Grumman), B.R. McNamara (U.Waterloo & Perimeter
  Institute), A. Vikhlinin (CfA), C.R. Mullis (ESO)","Evidence for Rapid Redshift Evolution of Strong Cluster Cooling Flows","Accepted for publication in ApJ",,"10.1088/0004-637X/731/1/31",,"astro-ph.CO","http://arxiv.org/licenses/nonexclusive-distrib/1.0/","  We present equivalent widths of the [OII] and Ha nebular emission lines for
77 brightest cluster galaxies (BCGs) selected from the 160 Square Degree
$ROSAT$ X-ray survey. We find no [OII] or Ha emission stronger than -15
angstroms or -5 angstroms, respectively, in any BCG. The corresponding emission
line luminosities lie below 6E40 erg/s, which is a factor of 30 below that of
NGC1275 in the Perseus cluster. A comparison to the detection frequency of
nebular emission in BCGs lying at redshifts above z = 0.35 drawn from the
Brightest Cluster Survey (Crawford et al. 1999) indicates that we should have
detected roughly one dozen emission-line galaxies, assuming the two surveys are
selecting similar clusters in the X-ray luminosity range 10E42 erg/s to 10E45
erg/s. The absence of luminous nebular emission (ie., Perseus-like systems) in
our sample is consistent with an increase in the number density of {\it strong}
cooling flow (cooling core) clusters between $\rm z=0.5$ and today. The decline
in their numbers at higher redshift could be due to cluster mergers and AGN
heating.
","[{""version"":""v1"",""created"":""Tue, 25 Jan 2011 22:12:27 GMT""}]","2015-05-27"
"1101.4967","Takashi Imai","D. A. Torchetti, M. Fu, D. C. Christensen, K. J. Nelson, T. Imai, H.
  C. Lei, and C. Petrovic","77Se NMR Investigation of the K(x)Fe(2-y)Se(2) High Tc Superconductor
  (Tc=33K)","Final version","Physical Review B 83 (2011) 104508","10.1103/PhysRevB.83.104508",,"cond-mat.supr-con cond-mat.str-el","http://arxiv.org/licenses/nonexclusive-distrib/1.0/","  We report a comprehensive 77Se NMR study of the structural, magnetic, and
superconducting properties of a single crystalline sample of the newly
discovered FeSe-based high temperature superconductor K(x)Fe(2-y)Se(2) (Tc=33K)
in a broad temperature range up to 290 K. We will compare our results with
those reported for FeSe (Tc=9K) and FeAs-based high Tc systems.
","[{""version"":""v1"",""created"":""Tue, 25 Jan 2011 22:22:56 GMT""},{""version"":""v2"",""created"":""Thu, 27 Jan 2011 18:01:44 GMT""},{""version"":""v3"",""created"":""Sun, 20 Mar 2011 15:37:55 GMT""}]","2011-03-22"
"1101.4968","Dimitra Atri","Dimitra Atri (U Kansas), Julia DeMarines (International Space U) and
  Jacob Haqq-Misra (Penn State U)","A Protocol for Messaging to Extraterrestrial Intelligence","Accepted for publication in Space Policy","Space Policy, Volume 27, Issue 3, August 2011, Pages 165-169, ISSN
  0265-9646","10.1016/j.spacepol.2011.01.001",,"physics.pop-ph astro-ph.IM physics.ed-ph","http://arxiv.org/licenses/nonexclusive-distrib/1.0/","  Messaging to extraterrestrial intelligence (METI) is a branch of study
concerned with constructing and broadcasting a message toward habitable
planets. Since the Arecibo message of 1974, the handful of METI broadcasts have
increased in content and complexity, but the lack of an established protocol
has produced unorganized or cryptic messages that could be difficult to
interpret. Here we outline the development of a self-consistent protocol for
messaging to extraterrestrial intelligence that provides constraints and
guidelines for the construction of a message in order to maximize the
probability that the message effectively communicates. A METI protocol
considers several factors including signal encoding, message length,
information content, anthropocentrism, transmission method, and transmission
periodicity. Once developed, the protocol will be released for testing on
different human groups worldwide and across cultural boundaries. An effective
message to extraterrestrials should at least be understandable by humans, and
releasing the protocol for testing will allow us to improve the protocol and
develop potential messages. Through an interactive website, users across the
world will be able to create and exchange messages that follow the protocol in
order to discover the types of messages better suited for cross-cultural
communication. The development of a METI protocol will serve to improve the
quality of messages to extraterrestrials, foster international collaboration,
and extend astrobiology outreach to the public.
","[{""version"":""v1"",""created"":""Tue, 25 Jan 2011 22:30:08 GMT""},{""version"":""v2"",""created"":""Wed, 2 Feb 2011 17:26:41 GMT""}]","2011-10-10"
"1101.4969","Eyal Neuman","Leonid Mytnik and Eyal Neuman","Sample Path Properties of Volterra Processes","15 pages","Communications on Stochastic Analysis Vol. 6, No. 3 (2012) 359-377",,,"math.PR","http://arxiv.org/licenses/nonexclusive-distrib/1.0/","  We consider the regularity of sample paths of Volterra processes. These
processes are defined as stochastic integrals $$ M(t)=\int_{0}^{t}F(t,r)dX(r),
\ \ t \in \mathds{R}_{+}, $$ where $X$ is a semimartingale and $F$ is a
deterministic real-valued function. We derive the information on the modulus of
continuity for these processes under regularity assumptions on the function $F$
and show that $M(t)$ has ""worst"" regularity properties at times of jumps of
$X(t)$. We apply our results to obtain the optimal H\""older exponent for
fractional L\'{e}vy processes.
","[{""version"":""v1"",""created"":""Tue, 25 Jan 2011 22:45:39 GMT""},{""version"":""v2"",""created"":""Sat, 5 Nov 2011 09:22:51 GMT""}]","2015-03-18"
"1101.4970","Thomas Richard Marsh","T.R. Marsh","Double white dwarfs and LISA","11 pages, 2 figures, in press Classical and Quantum Gravity. Summary
  of talk given at 8th LISA Symposium, Stanford, July 2010",,"10.1088/0264-9381/28/9/094019",,"astro-ph.SR","http://arxiv.org/licenses/nonexclusive-distrib/1.0/","  Close pairs of white dwarfs are potential progenitors of Type~Ia supernovae
and they are common, with of order 100 -- 300 million in the Galaxy. As such
they will be significant, probably dominant, sources of the gravitational waves
detectable by LISA. In the context of LISA's goals for fundamental physics,
double white dwarfs are a source of noise, but from an astrophysical
perspective, they are of considerable interest in their own right. In this
paper I discuss our current knowledge of double white dwarfs and their close
relatives (and possible descendants) the AM~CVn stars. LISA will add to our
knowledge of these systems by providing the following unique constraints: (i)
an almost direct measurement of the Galactic merger rate of DWDs from the
detection of short period systems and their period evolution, (ii) an accurate
and precise normalisation of binary evolution models at the shortest periods,
(iii) a determination of the evolutionary pathways to the formation of AM~CVn
stars, (iv) measurements of the influence of tidal coupling in white dwarfs and
its significance for stabilising mass transfer, and (v) discovery of numerous
examples of eclipsing white dwarfs with the potential for optical follow-up to
test models of white dwarfs.
","[{""version"":""v1"",""created"":""Tue, 25 Jan 2011 22:58:38 GMT""}]","2015-05-27"
"1101.4971","Jason DeBlois","Jason DeBlois","The geometry of cyclic hyperbolic polygons","Minor changes suggested by referee, updated references",,,,"math.GT math.MG","http://arxiv.org/licenses/nonexclusive-distrib/1.0/","  A hyperbolic polygon is defined to be cyclic, horocyclic, or equidistant if
its vertices lie on a metric circle, horocycle, or a component of the
equidistant locus to a hyperbolic geodesic, respectively. Convex such $n$-gons
are parametrized by the subspaces of $(0,\infty)^n$ that contain their side
length collections, and area and circumcircle or ""collar"" radius determine
symmetric, smooth functions on these spaces. We give formulas for and bounds on
the derivatives of these functions, and make some observations on their
behavior. Notably, the monotonicity properties of area and circumcircle radius
exhibit qualitative differences on the collection of centered vs non-centered
cyclic polygons, where a cyclic polygon is ""centered"" if it contains the center
of its circumcircle in its interior.
","[{""version"":""v1"",""created"":""Tue, 25 Jan 2011 23:20:13 GMT""},{""version"":""v2"",""created"":""Tue, 22 Mar 2011 21:05:39 GMT""},{""version"":""v3"",""created"":""Mon, 26 Aug 2013 21:04:51 GMT""},{""version"":""v4"",""created"":""Thu, 17 Jul 2014 16:41:59 GMT""},{""version"":""v5"",""created"":""Tue, 30 Jun 2015 15:00:46 GMT""}]","2015-07-01"
"1101.4972","Ernest Ma","Ernest Ma (UC Riverside)","Observable Lepton Flavor Symmetry at LHC","12 pages, 4 figures, talk at the ""International Conference on Flavor
  Physics in the LHC Era,"" Singapore (November 2010)","Mod.Phys.Lett.A26:377-385,2011","10.1142/S0217732311035171","UCRHEP-T501 (January 2011)","hep-ph","http://arxiv.org/licenses/nonexclusive-distrib/1.0/","  I discuss a model of lepton flavor symmetry based on the non-Abelian finite
group T(7) and the gauging of B-L, which has a residual Z(3) symmetry in the
charged-lepton Yukawa sector, allowing it to be observable at the Large Hadron
Collider (LHC) from the decay of the new Z' gauge boson of this model to a pair
of scalar bosons which the unusual highly distinguishable final states
tau(-)tau(-)mu(+)e(+).
","[{""version"":""v1"",""created"":""Tue, 25 Jan 2011 23:22:03 GMT""}]","2011-03-02"
"1101.4973","Janusz Adamus","Janusz Adamus and Lech Adamus","A degree condition for cycles of maximum length in bipartite digraphs","8 pages, minor exposition changes","Discrete Math. 312 (2012), 1117--1122","10.1016/j.disc.2011.11.032",,"math.CO","http://arxiv.org/licenses/nonexclusive-distrib/1.0/","  We prove a sharp Ore-type criterion for hamiltonicity of balanced bipartite
digraphs: A bipartite digraph D, with colour classes of cardinality N, is
hamiltonian if, for every pair of vertices u and v from opposite colour classes
of D such that the arc uv is not in D, the sum of the outdegree of u and the
indegree of v is greater than or equal to N+2.
","[{""version"":""v1"",""created"":""Tue, 25 Jan 2011 23:22:08 GMT""},{""version"":""v2"",""created"":""Mon, 2 Jan 2012 16:01:45 GMT""}]","2012-01-04"
"1101.4974","Joseph Najnudel","J. Najnudel, D. Stroock, M. Yor","On a flow of transformations of a Wiener space",,,,,"math.PR","http://arxiv.org/licenses/nonexclusive-distrib/1.0/","  In this paper, we define, via Fourier transform, an ergodic flow of
transformations of a Wiener space which preserves the law of the
Ornstein-Uhlenbeck process and which interpolates the iterations of a
transformation previously defined by Jeulin and Yor. Then, we give a more
explicit expression for this flow, and we construct from it a continuous
gaussian process indexed by R^2, such that all its restriction obtained by
fixing the first coordinate are Ornstein-Uhlenbeck processes.
","[{""version"":""v1"",""created"":""Tue, 25 Jan 2011 23:26:53 GMT""}]","2011-01-27"
"1101.4975","Joanna Ku{\l}aga","Joanna Ku{\l}aga","A note on the isomorphism of Cartesian products of ergodic flows",,,,,"math.DS","http://arxiv.org/licenses/nonexclusive-distrib/1.0/","  We show an isomorphism stability property for Cartesian products of either
flows with joining primeness property or flows which are $\alpha$-weakly
mixing.
","[{""version"":""v1"",""created"":""Tue, 25 Jan 2011 23:31:06 GMT""}]","2011-01-27"
"1101.4976","Christian Flacco","Christian J. Flacco, Daniel Whiteson, Matthew Kelly","Fourth generation quark mass limits in CKM-element space",,,"10.1103/PhysRevD.83.114048",,"hep-ph hep-ex","http://arxiv.org/licenses/nonexclusive-distrib/1.0/","  We present a reanalysis of CDF data to extend limits on individual
fourth-generation quark masses from particular flavor-mixing rates to the
entire space of possible mixing values. Measurements from CDF have set
individual limits on masses, $m_{b'}$ and $m_{t'}$, at the level of
$335$--$385$ GeV assuming specific and favorable flavor-mixing rates. We
consider the space of possible values for the mixing rates and find that the
CDF data imply limits of $290$ GeV and greater over a wide range of mixing
scenarios. We also analyze the limits from the perspective of a four-generation
CKM matrix. We find that present experimental constraints on CKM elements do
not suggest further constraints on fourth-generation quark masses.
","[{""version"":""v1"",""created"":""Tue, 25 Jan 2011 23:44:23 GMT""}]","2015-05-27"
"1101.4977","Michael Mueller","Michael Mueller, M. Delbo', J. L. Hora, D. E. Trilling, B.
  Bhattacharya, W. F. Bottke, S. Chesley, J. P. Emery, G. Fazio, A. W. Harris,
  A. Mainzer, M. Mommert, B. Penprase, H. A. Smith, T. B. Spahr, J. A.
  Stansberry, C. A. Thomas","ExploreNEOs III: Physical characterization of 65 low-deltaV NEOs","Accepted to AJ",,,,"astro-ph.EP","http://arxiv.org/licenses/nonexclusive-distrib/1.0/","  Space missions to NEOs are being planned at all major space agencies, and
recently a manned mission to an NEO was announced as a NASA goal. Efforts to
find and select suitable targets (plus backup targets) are severely hampered by
our lack of knowledge of the physical properties of dynamically favorable NEOs.
In particular, current mission scenarios tend to favor primitive low-albedo
objects. For the vast majority of NEOs the albedo is unknown.
  Here we report new constraints on the size and albedo of 65 NEOs with
rendezvous deltaV < 7 km/s. Our results are based on thermal-IR flux data
obtained in the framework of our ongoing (2009--2011) ExploreNEOs survey
(Trilling et al. 2010) using NASA's ""Warm Spitzer"" space telescope. As of 2010
July 14, we have results for 293 objects in hand (including the 65 low-deltaV
NEOs presented here); before the end of 2011 we expect to have measured the
size and albedo of ~ 700 NEOs (including probably ~ 160 low-deltaV NEOs).
  While there are reasons to believe that primitive volatile-rich materials are
universally low in albedo, the converse need not be true: the orbital evolution
of some dark objects likely has caused them to lose their volatiles by coming
too close to the Sun. For all our targets, we give the closest perihelion
distance they are likely to have reached (using orbital integrations from
Marchi et al. 2009) and corresponding upper limits on the past surface
temperature. Low-deltaV objects for which both albedo and thermal history may
suggest a primitive composition include (162998) 2001 SK162, (68372) 2001 PM9,
and (100085) 1992 UY4.
","[{""version"":""v1"",""created"":""Tue, 25 Jan 2011 23:52:50 GMT""}]","2011-01-27"
"1101.4978","Maria Hermanns","Maria Hermanns, Nicolas Regnault, B. Andrei Bernevig, and Eddy Ardonne","From Irrational to Non-Unitary: on the Haffnian and Haldane-Rezayi wave
  functions","4+ pages, published version","Phys. Rev. B 83, 241302 (2011)","10.1103/PhysRevB.83.241302","NORDITA-2011-9","cond-mat.str-el cond-mat.mes-hall","http://arxiv.org/licenses/nonexclusive-distrib/1.0/","  We study the Haffnian and Haldane-Rezayi quantum Hall wave functions and
their quasihole excitations by means of their `root configurations', and point
out a close connection between these seemingly different states. For both
states, we formulate a `generalized Pauli-principle', which allows to count the
degeneracies of these states. The connection between these states might
elucidate the underlying theory describing the `irrational' Haffnian state.
","[{""version"":""v1"",""created"":""Wed, 26 Jan 2011 00:19:08 GMT""},{""version"":""v2"",""created"":""Mon, 20 Jun 2011 18:13:57 GMT""}]","2011-06-21"
"1101.4979","Birs Secretary","Nassif Ghoussoub, Abbas Moameni","A Self-dual Polar Factorization for Vector Fields","20 pages, Updated version - if any - can be downloaded at
  http://www.birs.ca/~nassif/",,,,"math.AP","http://arxiv.org/licenses/nonexclusive-distrib/1.0/","  We show that any non-degenerate vector field $u$ in $ L^{\infty}(\Omega,
\R^N)$, where $\Omega$ is a bounded domain in $\R^N$, can be written as
{equation} \hbox{$u(x)= \nabla_1 H(S(x), x)$ for a.e. $x \in \Omega$},
{equation} where $S$ is a measure preserving point transformation on $\Omega$
such that $S^2=I$ a.e (an involution), and $H: \R^N \times \R^N \to \R$ is a
globally Lipschitz anti-symmetric convex-concave Hamiltonian. Moreover, $u$ is
a monotone map if and only if $S$ can be taken to be the identity, which
suggests that our result is a self-dual version of Brenier's polar
decomposition for the vector field $u$ as $u(x)=\nabla \phi (S(x))$, where
$\phi$ is convex and $S$ is a measure preserving transformation. We also
describe how our polar decomposition can be reformulated as a self-dual mass
transport problem.
","[{""version"":""v1"",""created"":""Wed, 26 Jan 2011 00:36:19 GMT""},{""version"":""v2"",""created"":""Wed, 10 Aug 2011 23:17:58 GMT""}]","2011-08-12"
"1101.4980","Nataliia Dzysiuk Dr","I. Kadenko and N. Dzysiuk","Observation of 511 keV peak high count rate in studying (n,x) and (g,x)
  reactions on terbium","5 pages, 3 figures",,,,"nucl-ex","http://arxiv.org/licenses/nonexclusive-distrib/1.0/","  Experimental investigation of (n, x) and (g, x) reactions on Tb-159 with
activation technique was carried out. Tb specimens of natural composition were
irradiated with (d-d) and (d-t) neutrons using NG-300 neutron generator.
Additionally the series of experiments were performed with application of M-30
microtrone as a source of electrons for bremsstrahlung spectra production with
end point energies 7.5, 9.5, 11, 11.5, 12, 12.5, 16.5, and 18.5 MeV.
Instrumental spectra of Tb specimens were measured with HPGe and Ge(Li)
spectrometers. Within the main scope of nuclear reactions research and accurate
{\gamma}-spectrometry of Tb specimens a high count rate in 511 keV
{\gamma}-line peak was observed. The first-priority analysis of Tb specimen
impurities was done with further attempts to explain a result of observations
with reference to the specific nuclear properties of Tb which could appear due
to complex GDR structure. The energy threshold of the process detected was
determined around 12.2 MeV. The lower estimate of cross section value for this
process was assumed and calculated.
","[{""version"":""v1"",""created"":""Wed, 26 Jan 2011 00:46:29 GMT""}]","2011-01-27"
