"1101.4916","Edward Anderson","Edward Anderson","On the Semiclassical Approach to Quantum Cosmology","20 pages, 1 figure","Class. Quant. Grav. 28 185008 (2011)","10.1088/0264-9381/28/18/185008",,"gr-qc","http://arxiv.org/licenses/nonexclusive-distrib/1.0/","  The emergent semiclassical time approach to resolving the problem of time in
quantum gravity involves heavy slow degrees of freedom providing via an
approximately Hamilton-Jacobi equation an approximate timestandard with respect
to which the quantum mechanics of light fast degrees of freedom can run. More
concretely, this approach involves Born-Oppenheimer and WKB ansatze and some
accompanying approximations. In this paper, I investigate this approach for
concrete scaled relational particle mechanics models, i.e. models featuring
only relative separations, relative angles and relative times. I consider the
heavy-light interaction term in the light quantum equation - necessary for the
semiclassical approach to work, firstly as an emergent-time dependent
perturbation of the emergent-time-dependent Schrodinger equation for the light
subsystem. Secondly, I consider a scheme in which the backreaction is small but
non-negligible, so that the l-subsystem also affects the form of the emergent
time. I also suggest that the many terms involving expectation values of the
light wavefunctions in both the (unapproximated) heavy and light equations
might require treatment in parallel to the Hartree--Fock self-consistent
approach rather than merely being discarded; for the moment this paper provides
a counterexample to such terms being smaller than their unaveraged
counterparts. Investigation of these ideas and methods will give us a more
robust understanding of the suggested quantum-cosmological origin of microwave
background inhomogeneities and galaxies.
","[{""version"":""v1"",""created"":""Tue, 25 Jan 2011 20:19:15 GMT""}]","2015-05-27"
"1101.4917","Justin Dressel","J. Dressel, C. J. Broadbent, J. C. Howell, and A. N. Jordan","Experimental Violation of Two-Party Leggett-Garg Inequalities with
  Semi-weak Measurements","4 pages, 6 figures","Phys.Rev.Lett.106:040402,2011","10.1103/PhysRevLett.106.040402",,"quant-ph","http://arxiv.org/licenses/nonexclusive-distrib/1.0/","  We generalize the derivation of Leggett-Garg inequalities to systematically
treat a larger class of experimental situations by allowing multi-particle
correlations, invasive detection, and ambiguous detector results. Furthermore,
we show how many such inequalities may be tested simultaneously with a single
setup. As a proof of principle, we violate several such two-particle
inequalities with data obtained from a polarization-entangled biphoton state
and a semi-weak polarization measurement based on Fresnel reflection. We also
point out a non- trivial connection between specific two-party Leggett-Garg
inequality violations and convex sums of strange weak values.
","[{""version"":""v1"",""created"":""Tue, 25 Jan 2011 20:23:37 GMT""}]","2015-03-18"
"1101.4918","Ridwan Al Iqbal","Ridwan Al Iqbal","Using Feature Weights to Improve Performance of Neural Networks","2 tables, 4 figures",,,,"cs.LG cs.AI cs.CV","http://arxiv.org/licenses/nonexclusive-distrib/1.0/","  Different features have different relevance to a particular learning problem.
Some features are less relevant; while some very important. Instead of
selecting the most relevant features using feature selection, an algorithm can
be given this knowledge of feature importance based on expert opinion or prior
learning. Learning can be faster and more accurate if learners take feature
importance into account. Correlation aided Neural Networks (CANN) is presented
which is such an algorithm. CANN treats feature importance as the correlation
coefficient between the target attribute and the features. CANN modifies normal
feed-forward Neural Network to fit both correlation values and training data.
Empirical evaluation shows that CANN is faster and more accurate than applying
the two step approach of feature selection and then using normal learning
algorithms.
","[{""version"":""v1"",""created"":""Tue, 25 Jan 2011 20:24:25 GMT""}]","2011-01-26"
"1101.4919","Alessandro Strumia","Roberto Franceschini, Gian Francesco Giudice, Pier Paolo Giardino,
  Paolo Lodone, Alessandro Strumia","LHC bounds on large extra dimensions","16 pages, 6 figures. v2: updated with CMS data. v3: updated with
  ATLAS data at 36/pb; final published version","JHEP 1105:092,2011","10.1007/JHEP05(2011)092","IFUP-TH/2010-43, CERN-PH-TH/2010-286","hep-ph hep-ex hep-th","http://arxiv.org/licenses/nonexclusive-distrib/1.0/","  We derive new dominant bounds on the coefficient of the effective operator
generated by tree-level graviton exchange in large extra dimensions from pp
\rightarrow jj data at LHC: M_T > 2.1TeV (ATLAS after 3.1/pb of integrated
luminosity), M_T > 3.4 TeV (CMS after 36/pb), MT > 3.2 TeV (ATLAS after 36/pb).
We clarify the role of on-shell graviton exchange and compare the full graviton
amplitude to ATLAS data, setting bounds on the fundamental quantum-gravity
scale.
","[{""version"":""v1"",""created"":""Tue, 25 Jan 2011 20:24:32 GMT""},{""version"":""v2"",""created"":""Sat, 19 Feb 2011 13:19:36 GMT""},{""version"":""v3"",""created"":""Mon, 30 May 2011 11:15:18 GMT""}]","2011-06-21"
"1101.4920","Sharon Toolan","Bradley C. Whitmore (Space Telescope Science Institute)","Luminous Stars in Galaxies Beyond 3 Mpc","7 pages, 5 figures; to be published in UP: Have Observations Revealed
  a Variable Upper End of the Initial Mass Function? Marie Treyer, Ted Wyder,
  Don Neill, Mark Seibert, and Janice Lee (editors), p. 141 (ASP, in press)",,,,"astro-ph.GA","http://arxiv.org/licenses/nonexclusive-distrib/1.0/","  I am mainly interested in the formation and destruction of young star
clusters in nearby star forming galaxies such as the Antennae, M83, and M51.
One of the first analysis steps is to throw out all those pesky stars that keep
contaminating my young cluster samples. Recently, spurred on by our new WFC3
Early Release Science data of galaxies including M83, NGC 4214, M82, NGC 2841,
and Cen A, we began taking a closer look at the stellar component. Questions we
are addressing are: 1) what are the most luminous stars, 2) how can we use them
to help study the destruction of star clusters and the population of the field,
3) what fraction of stars, at least the bright stars, are formed in the field,
in associations, and in compact clusters. In this contribution we describe some
of the beginning steps in this process. More specifically, we describe how we
separate stars from clusters in our galaxies, and describe how candidate
Luminous Blue Variables (LBVs) and ""Single Star"" HII (SSHII) regions have been
identified.
","[{""version"":""v1"",""created"":""Tue, 25 Jan 2011 20:26:06 GMT""}]","2011-01-26"
"1101.4921","Tomas Everaert","Tomas Everaert","Effective descent morphisms of regular epimorphisms",,"Journal of Pure and Applied Algebra, Volume 216, Issues 8-9,
  August 2012, Pages 1896-1904","10.1016/j.jpaa.2012.02.027",,"math.CT","http://arxiv.org/licenses/nonexclusive-distrib/1.0/","  Let $A$ be a regular category with pushouts of regular epimorphisms by
regular epimorphism and $Reg(A)$ the category of regular epimorphisms in $A$.
We prove that every regular epimorphism in $Reg(A)$ is an effective descent
morphism if, and only if, $Reg(A)$ is a regular category. Then, moreover, every
regular epimorphism in $A$ is an effective descent morphism. This is the case,
for instance, when $A$ is either exact Goursat, or ideal determined, or is a
category of topological Mal'tsev algebras, or is the category of $n$-fold
regular epimorphisms in any of the three previous cases, for any $n\geq 1$.
","[{""version"":""v1"",""created"":""Tue, 25 Jan 2011 20:28:13 GMT""},{""version"":""v2"",""created"":""Tue, 13 Mar 2012 02:16:36 GMT""}]","2015-04-20"
"1101.4922","Anthony O'Farrell","Stephen M. Buckley and Anthony G. O'Farrell","Wiring Switches to Light Bulbs","19 pages, 14 figures",,,,"math.CO","http://arxiv.org/licenses/nonexclusive-distrib/1.0/","  Given n buttons and n bulbs so that the ith button toggles the ith bulb and
at most two other bulbs, we compute the sharp lower bound on the number of
bulbs that can be lit regardless of the action of the buttons.
","[{""version"":""v1"",""created"":""Tue, 25 Jan 2011 20:33:35 GMT""}]","2011-01-26"
"1101.4923","Pierre Richard","X.-P. Wang, T. Qian, P. Richard, P. Zhang, J. Dong, H.-D. Wang, C.-H.
  Dong, M.-H. Fang and H. Ding","Strong nodeless pairing on separate electron Fermi surface sheets in
  (Tl, K)Fe$_{1.78}$Se$_2$ probed by ARPES","5 pages, 4 figures","Europhysics Letters 93, 57001 (2011)","10.1209/0295-5075/93/57001",,"cond-mat.supr-con","http://arxiv.org/licenses/nonexclusive-distrib/1.0/","  We performed a high-resolution angle-resolved photoemission spectroscopy
study of the Tl$_{0.63}$K$_{0.37}$Fe$_{1.78}$Se$_2$ superconductor ($T_c=29$
K). We show the existence of two electronlike bands at the M$(\pi, 0)$ point
which cross the Fermi level at similar Fermi wave vectors to form nearly
circular electronlike Fermi surface pockets. We observe a nearly isotropic
$\sim$ 8.5 meV superconducting gap ($\Delta/k_BT_c\sim 7$) on these Fermi
surfaces. Our analysis of the band structure around the Brillouin zone centre
reveals two additional electronlike Fermi surfaces: a very small one and a
larger one with $k_F$ comparable to the FS pockets at M. Interestingly, a SC
gap with a magnitude of $\sim$ 8 meV also develops along the latter FS. Our
observations are consistent with the s-wave strong coupling scenario.
","[{""version"":""v1"",""created"":""Tue, 25 Jan 2011 20:37:48 GMT""}]","2011-02-23"
"1101.4924","Ridwan Al Iqbal","Ridwan Al Iqbal","A Generalized Method for Integrating Rule-based Knowledge into Inductive
  Methods Through Virtual Sample Creation",,,,,"cs.LG cs.AI cs.CV","http://arxiv.org/licenses/nonexclusive-distrib/1.0/","  Hybrid learning methods use theoretical knowledge of a domain and a set of
classified examples to develop a method for classification. Methods that use
domain knowledge have been shown to perform better than inductive learners.
However, there is no general method to include domain knowledge into all
inductive learning algorithms as all hybrid methods are highly specialized for
a particular algorithm. We present an algorithm that will take domain knowledge
in the form of propositional rules, generate artificial examples from the rules
and also remove instances likely to be flawed. This enriched dataset then can
be used by any learning algorithm. Experimental results of different scenarios
are shown that demonstrate this method to be more effective than simple
inductive learning.
","[{""version"":""v1"",""created"":""Tue, 25 Jan 2011 20:42:01 GMT""}]","2011-01-26"
"1101.4925","Yurii Averboukh","Yurii Averboukh","Proximal Calculus and Universal Feedback Strategies in Two Person
  Non-Zero Sum Differential Games","This paper has been withdrawn by the author due to the absence of
  examples except the smooth solutions of the systems of HJB equations",,,,"math.OC","http://arxiv.org/licenses/nonexclusive-distrib/1.0/","  In this paper we introduce the discontinuous universal feedback for the
problem of Nash equilibrium in two person non-zero sum differential game. We
assume that there exist functions satisfying some conditions analogous to the
infinitesimal conditions on value function in zero sum differential games.
Under this assumption we prove the existence of universal feedback Nash
equilibrium.
","[{""version"":""v1"",""created"":""Tue, 25 Jan 2011 20:46:14 GMT""},{""version"":""v2"",""created"":""Mon, 21 Jan 2013 20:01:29 GMT""}]","2013-01-22"
"1101.4926","Constantinos Vellidis","The CDF Collaboration: T. Aaltonen, et al","Measurement of the Top Quark Mass in the Lepton+Jets Channel Using the
  Lepton Transverse Momentum","submitted to Phys. Lett. B","Phys.Lett.B698:371-379,2011","10.1016/j.physletb.2011.03.041","FERMILAB-PUB-11-015-E","hep-ex","http://arxiv.org/licenses/nonexclusive-distrib/1.0/","  This letter reports a measurement of the top quark mass, M_{top}, in data
from p-pbar collisions at sqrt{s} = 1.96 TeV corresponding to 2.7 fb^{-1} of
integrated luminosity at the Fermilab Tevatron using the CDF II detector.
Events with the lepton+jets topology are selected. An unbinned likelihood is
constructed based on the dependence of the lepton transverse momentum, P_T, on
M_{top}. A maximum likelihood fit to the data yields a measured mass M_{top} =
(176.9 +/- 8.0 stat +/- 2.7 syst) GeV/c^2. In this measurement, the
contribution by the jet energy scale uncertainty to the systematic error is
negligible. The result provides an important consistency test for other M_{top}
measurements where explicit use of the jet energy is made for deriving the top
quark mass.
","[{""version"":""v1"",""created"":""Tue, 25 Jan 2011 20:47:16 GMT""},{""version"":""v2"",""created"":""Wed, 30 Mar 2011 20:11:26 GMT""}]","2011-04-20"
"1101.4927","Katharina Huber","A.W.W. Dress, K.T. Huber, J. Koolen, V. Moulton","Blocks and Cut Vertices of the Buneman Graph",,,,,"math.CO","http://arxiv.org/licenses/nonexclusive-distrib/1.0/","  Given a set $\Sg$ of bipartitions of some finite set $X$ of cardinality at
least 2, one can associate to $\Sg$ a canonical $X$-labeled graph $\B(\Sg)$,
called the Buneman graph. This graph has several interesting mathematical
properties - for example, it is a median network and therefore an isometric
subgraph of a hypercube. It is commonly used as a tool in studies of DNA
sequences gathered from populations. In this paper, we present some results
concerning the {\em cut vertices} of $\B(\Sg)$, i.e., vertices whose removal
disconnect the graph, as well as its {\em blocks} or 2-{\em connected
components} - results that yield, in particular, an intriguing generalization
of the well-known fact that $\B(\Sg)$ is a tree if and only if any two splits
in $\Sg$ are compatible.
","[{""version"":""v1"",""created"":""Tue, 25 Jan 2011 20:49:54 GMT""}]","2011-01-26"
"1101.4928","Michael DiPompeo","Michael A. DiPompeo, Michael S. Brotherton, Carlos De Breuck","VLT Spectropolarimetry of Broad Absorption Line QSOs","Accepted for publication in the Astrophysical Journal Supplement
  Series",,"10.1088/0067-0049/193/1/9",,"astro-ph.CO","http://arxiv.org/licenses/nonexclusive-distrib/1.0/","  We present spectropolarimetry of 19 confirmed and 4 possible bright, southern
broad absorption line (BAL) quasars from the European Southern Observatory
(ESO) Very Large Telescope (VLT). A wide range of redshifts is covered in the
sample (from 0.9 to 3.4), and both low- and hi-ionization quasars are
represented, as well as radio-loud and radio-quiet BALQSOs. We continue to
confirm previously established spectropolarimetric properties of BALQSOs,
including the generally rising continuum polarization with shorter wavelengths
and comparatively large fraction with high broad-band polarization (6 of 19
with polarizations >2%). Emission lines are polarized less than or similar to
the continuum, except in a few unusual cases, and absorption troughs tend to
have higher polarizations. A search for correlations between polarization
properties has been done, identifying 2 significant or marginally significant
correlations. These are an increase in continuum polarization with decreasing
optical luminosity (increasing absolute B magnitude) and decreasing \ion{C}{4}
emission-line polarization with increased continuum polarization.
","[{""version"":""v1"",""created"":""Tue, 25 Jan 2011 20:53:25 GMT""}]","2015-05-27"
"1101.4929","Jiri Adamek","Jiri Adamek (Institut fuer Theoretische Informatik, Technische
  Universitaet Braunschweig, Ger), Stefan Milius (Institut fuer Theoretische
  Informatik, Technische Universitaet Braunschweig, Ger), Jiri Velebil (Faculty
  of Electrical Engineering, Czech Technical University of Prague, Prague)","Semantics of Higher-Order Recursion Schemes",,"Logical Methods in Computer Science, Volume 7, Issue 1 (April 1,
  2011) lmcs:1177","10.2168/LMCS-7(1:15)2011",,"cs.LO math.CT","http://arxiv.org/licenses/nonexclusive-distrib/1.0/","  Higher-order recursion schemes are recursive equations defining new
operations from given ones called ""terminals"". Every such recursion scheme is
proved to have a least interpreted semantics in every Scott's model of
\lambda-calculus in which the terminals are interpreted as continuous
operations. For the uninterpreted semantics based on infinite \lambda-terms we
follow the idea of Fiore, Plotkin and Turi and work in the category of sets in
context, which are presheaves on the category of finite sets. Fiore et al
showed how to capture the type of variable binding in \lambda-calculus by an
endofunctor H\lambda and they explained simultaneous substitution of
\lambda-terms by proving that the presheaf of \lambda-terms is an initial
H\lambda-monoid. Here we work with the presheaf of rational infinite
\lambda-terms and prove that this is an initial iterative H\lambda-monoid. We
conclude that every guarded higher-order recursion scheme has a unique
uninterpreted solution in this monoid.
","[{""version"":""v1"",""created"":""Tue, 25 Jan 2011 20:53:37 GMT""},{""version"":""v2"",""created"":""Thu, 31 Mar 2011 12:54:23 GMT""},{""version"":""v3"",""created"":""Wed, 20 Apr 2011 15:22:28 GMT""}]","2019-08-15"
"1101.4930","Lorenzo A. Sadun","Natalie Priebe Frank and Lorenzo Sadun","Fusion: a general framework for hierarchical tilings of $R^d$","Updated to published version","Geometriae Dedicata 171 (2014) 149-186",,,"math.DS","http://arxiv.org/licenses/nonexclusive-distrib/1.0/","  We introduce a formalism for handling general spaces of hierarchical tilings,
a category that includes substitution tilings, Bratteli-Vershik systems, S-adic
transformations, and multi-dimensional cut-and-stack transformations. We
explore ergodic, spectral and topological properties of these spaces. We show
that familiar properties of substitution tilings carry over under appropriate
assumptions, and give counter-examples where these assumptions are not met. For
instance, we exhibit a minimal tiling space that is not uniquely ergodic, with
one ergodic measure having pure point spectrum and another ergodic measure
having mixed spectrum. We also exhibit a 2-dimensional tiling space that has
pure point measure-theoretic spectrum but is topologically weakly mixing.
","[{""version"":""v1"",""created"":""Tue, 25 Jan 2011 20:54:36 GMT""},{""version"":""v2"",""created"":""Fri, 1 Apr 2011 18:37:25 GMT""},{""version"":""v3"",""created"":""Fri, 29 Jun 2012 20:02:14 GMT""},{""version"":""v4"",""created"":""Fri, 6 Jul 2018 20:49:47 GMT""}]","2018-07-10"
"1101.4932","Sang-Kil Son","Sang-Kil Son, Linda Young, Robin Santra","Impact of hollow-atom formation on coherent x-ray scattering at high
  intensity","12 pages, 6 figures","Phys. Rev. A 83, 033402 (2001)","10.1103/PhysRevA.83.033402",,"physics.atom-ph physics.bio-ph","http://arxiv.org/licenses/nonexclusive-distrib/1.0/","  X-ray free-electron lasers (FELs) are promising tools for structural
determination of macromolecules via coherent x-ray scattering. During
ultrashort and ultraintense x-ray pulses with an atomic scale wavelength,
samples are subject to radiation damage and possibly become highly ionized,
which may influence the quality of x-ray scattering patterns. We develop a
toolkit to treat detailed ionization, relaxation, and scattering dynamics for
an atom within a consistent theoretical framework. The coherent x-ray
scattering problem including radiation damage is investigated as a function of
x-ray FEL parameters such as pulse length, fluence, and photon energy. We find
that the x-ray scattering intensity saturates at a fluence of ~10^7
photons/{\AA}^2 per pulse, but can be maximized by using a pulse duration much
shorter than the time scales involved in the relaxation of the inner-shell
vacancy states created. Under these conditions, both inner-shell electrons in a
carbon atom are removed, and the resulting hollow atom gives rise to a
scattering pattern with little loss of quality for a spatial resolution > 1
{\AA}. Our numerical results predict that in order to scatter from a carbon
atom 0.1 photons per x-ray pulse, within a spatial resolution of 1.7 {\AA}, a
fluence of 10^7 photons/{\AA}^2 per pulse is required at a pulse length of 1 fs
and a photon energy of 12 keV. By using a pulse length of a few hundred
attoseconds, one can suppress even secondary ionization processes in extended
systems. The present results suggest that high-brightness attosecond x-ray FELs
would be ideal for single-shot imaging of individual macromolecules.
","[{""version"":""v1"",""created"":""Tue, 25 Jan 2011 20:58:53 GMT""},{""version"":""v2"",""created"":""Mon, 17 Oct 2011 12:34:15 GMT""}]","2011-10-18"
"1101.4933","Kazuya Matsubayashi","Kazuya Matsubayashi, Masafumi Yagi, Tomotsugu Goto, Akira Akita,
  Hajime Sugai, Atsushi Kawai, Atsushi Shimono, and Takashi Hattori","Spatially Resolved Spectroscopic Observations of a Possible E+A
  Progenitor SDSS J160241.00+521426.9","39 pages, 10 figures and 10 tables, accepted to ApJ",,"10.1088/0004-637X/729/1/29",,"astro-ph.GA","http://arxiv.org/licenses/nonexclusive-distrib/1.0/","  In order to investigate the evolution of E+A galaxies, we observed a galaxy
SDSS J160241.00+521426.9, a possible E+A progenitor which shows both emission
and strong Balmer absorptions, and its neighbor galaxy. We used the integral
field spectroscopic mode of the Kyoto Tridimensional Spectrograph (Kyoto3DII),
mounted on the University of Hawaii 88-inch telescope located on Mauna Kea, and
the slit-spectroscopic mode of the Faint Object Camera and Spectrograph (FOCAS)
on the Subaru Telescope. We found a strong Balmer absorption region in the
center of the galaxy and an emission-line region located 2 kpc from the center,
in the direction of its neighbor galaxy. The recession velocities of the galaxy
and its neighbor galaxy differ only by 100 km s^-1, which suggests that they
are a physical pair and would have been interacting. Comparing observed Lick
indices of Balmer lines and color indices with those predicted from stellar
population synthesis models, we find that a suddenly quenched star-formation
scenario is plausible for the star-formation history of the central region. We
consider that star formation started in the galaxy due to galaxy interactions
and was quenched in the central region, whereas star formation in a region
offset from the center still continues or has begun recently. This work is the
first study of a possible E+A progenitor using spatially resolved spectroscopy.
","[{""version"":""v1"",""created"":""Tue, 25 Jan 2011 20:59:59 GMT""}]","2015-05-27"
"1101.4934","Beth Biller","Beth Biller, Katelyn Allers, Michael Liu, Laird Close, Trent Dupuy","A Keck LGS AO Search for Brown Dwarf and Planetary Mass Companions to
  Upper Scorpius Brown Dwarfs","37 pages, 6 figures, accepted to ApJ",,"10.1088/0004-637X/730/1/39",,"astro-ph.SR","http://arxiv.org/licenses/nonexclusive-distrib/1.0/","  We searched for binary companions to 20 young brown dwarfs in the Upper
Scorpius association (145 pc, 5 Myr, nearest OB association) with the the Laser
Guide Star adaptive optics system and the facility infrared camera NIRC2 on the
10 m Keck II telescope. We discovered a 0.14"" companion (20.9+-0.4 AU) to the
<0.1 MSun object SCH J16091837-20073523. From spectral deconvolution of
integrated-light near-IR spectroscopy of SCH1609 using the SpeX spectrograph
(Rayner et al. 2003), we estimate primary and secondary spectral types of
M6+-0.5 and M7+-1.0, corresponding to masses of 79+-17 MJup and 55+-25 MJup at
an age of 5 Myr and masses of 84+-15 MJup and 60+-25 MJup at an age of 10 Myr.
For our survey objects with spectral types later than M8, we find an upper
limit on the binary fraction of <9% (1-sigma) at separations of 10 -- 500 AU.
We combine the results of our survey with previous surveys of Upper Sco and
similar young regions to set the strongest constraints to date on binary
fraction for young substellar objects and very low mass stars. The binary
fraction for low mass (<40 MJup) brown dwarfs in Upper Sco is similar to that
for T dwarfs in the field; for higher mass brown dwarfs and very low mass
stars, there is an excess of medium-separation (10-50 AU projected separation)
young binaries with respect to the field. These medium separation binaries will
likely survive to late ages.
","[{""version"":""v1"",""created"":""Tue, 25 Jan 2011 21:00:00 GMT""},{""version"":""v2"",""created"":""Thu, 27 Jan 2011 10:21:59 GMT""}]","2015-05-27"
