"1101.5560","Arakel Petrosyan","Kirill Karelsky, Arakel Petrosyan, Stepan Tarasevich","Nonlinear dynamics of magnetohydrodynamic flows of heavy fluid over an
  arbitrary surface in shallow water approximation","43 pages, submitted to Theoretical and Computational Fluid Dynamics",,"10.1134/S106377611107003X",,"physics.flu-dyn astro-ph.SR physics.plasm-ph","http://arxiv.org/licenses/nonexclusive-distrib/1.0/","  The magnetohydrodynamic equations system for heavy fluid over an arbitrary
surface in shallow water approximation is studied in the present paper. It is
shown that simple wave solutions exist only for underlying surfaces that are
slopes of constant inclination. All self-similar discontinuous and continuous
solutions are found. The exact explicit solutions of initial discontinuity
decay problem over a flat plane and a slope are found. It is shown that the
initial discontinuity decay solution is represented by one of five possible
wave configurations. For each configuration the necessary and sufficient
conditions for its realization are found. The change of dependent and
independent variables transforming the initial equations over a slope to those
over a flat plane is found.
","[{""version"":""v1"",""created"":""Fri, 28 Jan 2011 16:06:32 GMT""}]","2015-05-27"
"1101.5561","Marco Bramanti","Marco Bramanti and Maochun Zhu","Local real analysis in locally homogeneous spaces",,,,,"math.FA math.AP","http://arxiv.org/licenses/nonexclusive-distrib/1.0/","  We introduce the concept of locally homogeneous space, and prove in this
context L^p and Holder estimates for singular and fractional integrals, as well
as L^p estimates on the commutator of a singular or fractional integral with a
BMO or VMO function. These results are motivated by local a-priori estimates
for subelliptic equations.
","[{""version"":""v1"",""created"":""Fri, 28 Jan 2011 16:06:52 GMT""}]","2011-01-31"
"1101.5562","Takeshi Ohta","T. Ohta, S. Bouchigny, J.-P. Didelez, M. Fujiwara, K. Fukuda, H.
  Kohri, T. Kunimatsu, C. Morisaki, S. Ono, G. Rouille, M. Tanaka, K. Ueda, M.
  Uraki, M. Utsuro, S.Y. Wang, and M. Yosoi","HD gas analysis with Gas Chromatography and Quadrupole Mass Spectrometer","7 pages, 8 figures",,"10.1016/j.nima.2011.02.091",,"nucl-ex","http://arxiv.org/licenses/nonexclusive-distrib/1.0/","  A gas analyzer system has been developed to analyze Hydrogen-Deuteride (HD)
gas for producing frozen-spin polarized HD targets, which are used for hadron
photoproduction experiments at SPring-8. Small amounts of ortho-H$_{2}$ and
para-D$_{2}$ gas mixtures ($\sim$0.01%) in the purified HD gas are a key to
realize a frozen-spin polarized target. In order to obtain reliable
concentrations of these gas mixtures in the HD gas, we produced a new gas
analyzer system combining two independent measurements with the gas
chromatography and the QMS. The para-H$_{2}$, ortho-H$_{2}$, HD, and D$_{2}$
are separated using the retention time of the gas chromatography and the
mass/charge. It is found that the new gas analyzer system can measure small
concentrations of $\sim$0.01% for the otho-H$_2$ and D$_2$ with good S/N
ratios.
","[{""version"":""v1"",""created"":""Fri, 28 Jan 2011 16:22:50 GMT""}]","2015-05-27"
"1101.5563","Clementina Sasso","C. Sasso, A. Lagg and S. K. Solanki","Multicomponent He I 10830 {\AA} profiles in an active filament","Accepted for publication in Astronomy and Astrophysics on September
  27, 2010","A&A 526, A42 (2011)","10.1051/0004-6361/200912956",,"astro-ph.SR","http://arxiv.org/licenses/nonexclusive-distrib/1.0/","  We present new spectropolarimetric observations of the chromospheric He I
10830 {\AA} multiplet observed in a filament during its phase of activity. The
data were recorded with the new Tenerife Infrared Polarimeter (TIP-II) at the
German Vacuum Tower Telescope (VTT) on 2005 May 18. We inverted the He Stokes
profiles using multiple atmospheric components. The observed He Stokes profiles
display a remarkably wide variety of shapes. Most of the profiles show very
broad Stokes I absorptions and complex and spatially variable Stokes V
signatures. The inversion of the profiles shows evidence of different
atmospheric blue- and redshifted components of the He I lines within the
resolution element (1 arcsec), with supersonic velocities of up to 100 km/s. Up
to five different atmospheric components are found in the same profile. We show
that even these complex profiles can be reliably inverted.
","[{""version"":""v1"",""created"":""Fri, 28 Jan 2011 16:24:53 GMT""}]","2011-02-09"
"1101.5564","Didier Sornette","A. Saichev and D. Sornette","Generating Functions and Stability Study of Multivariate Self-Excited
  Epidemic Processes","27 pages, 8 figures","European Physical Journal B 83, 271-282 (2011)","10.1140/epjb/e2011-20298-3",,"cond-mat.stat-mech physics.data-an physics.geo-ph","http://arxiv.org/licenses/nonexclusive-distrib/1.0/","  We present a stability study of the class of multivariate self-excited Hawkes
point processes, that can model natural and social systems, including
earthquakes, epileptic seizures and the dynamics of neuron assemblies, bursts
of exchanges in social communities, interactions between Internet bloggers,
bank network fragility and cascading of failures, national sovereign default
contagion, and so on. We present the general theory of multivariate generating
functions to derive the number of events over all generations of various types
that are triggered by a mother event of a given type. We obtain the stability
domains of various systems, as a function of the topological structure of the
mutual excitations across different event types. We find that mutual triggering
tends to provide a significant extension of the stability (or subcritical)
domain compared with the case where event types are decoupled, that is, when an
event of a given type can only trigger events of the same type.
","[{""version"":""v1"",""created"":""Fri, 28 Jan 2011 16:34:27 GMT""}]","2015-05-27"
"1101.5565","G\'abor Heged\""us Dr","Gabor Heged\""us","Betti numbers of Stanley--Reisner rings with pure resolutions","10 pages, new formulas for the components of the clique complex of
  chordal graphs",,,,"math.AC math.CO","http://arxiv.org/licenses/nonexclusive-distrib/1.0/","  Let $\Delta$ be simplicial complex and let $k[\Delta]$ denote the
Stanley--Reisner ring corresponding to $\Delta$. Suppose that $k[\Delta]$ has a
pure free resolution. Then we describe the Betti numbers and the
Hilbert--Samuel multiplicity of $k[\Delta]$ in terms of the $h$--vector of
$\Delta$. As an application, we derive a linear equation system for the
components of the $h$--vector of the clique complex of an arbitrary chordal
graph.
","[{""version"":""v1"",""created"":""Fri, 28 Jan 2011 16:35:26 GMT""},{""version"":""v2"",""created"":""Mon, 31 Jan 2011 15:11:29 GMT""}]","2011-02-01"
"1101.5566","Valeriy Nazaruk","V. I. Nazaruk","On the suppression of the $n\bar{n}$ transitions in medium","15 pages, 3 figures",,"10.1142/S0218301311020381",,"hep-ph nucl-th","http://arxiv.org/licenses/nonexclusive-distrib/1.0/","  The new model of $n\bar{n}$ transitions in the medium based on unitary
$S$-matrix is considered. The time-dependence and corrections to the model are
studied. The lower limit on the free-space $n\bar{n}$ oscillation time $\tau $
is in the range $10^{16}\; {\rm yr}>\tau >1.2\cdot 10^{9}\; {\rm s}$
","[{""version"":""v1"",""created"":""Fri, 28 Jan 2011 16:37:47 GMT""}]","2015-05-27"
"1101.5567","Francis W. Starr","Francis W. Starr and Jack F. Douglas","Modifying Fragility and Collective Motion in Polymer Melts with
  Nanoparticles","To appear in Physical Review Letters",,"10.1103/PhysRevLett.106.115702",,"cond-mat.soft","http://arxiv.org/licenses/nonexclusive-distrib/1.0/","  We investigate the impact of nanoparticles (NP) on the fragility and
cooperative string-like motion in a model glass-forming polymer melt by
molecular dynamics simulation. The NP cause significant changes to both the
fragility and the average length of string-like motion, where the effect
depends on the NP-polymer interaction and the NP concentration. We interpret
these changes via the Adam-Gibbs (AG) theory, assuming the strings can be
identified with the ""cooperatively rearranging regions"" of AG. Our findings
indicate fragility is primarily a measure of the temperature dependence of the
cooperativity of molecular motion.
","[{""version"":""v1"",""created"":""Fri, 28 Jan 2011 16:39:13 GMT""}]","2015-05-27"
"1101.5568","Karleyne Silva M.G.","K. M. G. Silva, C. V. Rodrigues and J. E. R. Costa","CYCLOPS-X: Simultaneous optical and X-ray modeling of polars","4 pages, poster presented at the conference on 'Physics of Accreting
  Compact Binaries', July 2010 in Kyoto, Japan; proceedings to be published by
  Universal Academy Press",,,,"astro-ph.SR","http://arxiv.org/licenses/nonexclusive-distrib/1.0/","  From the optical to the X-ray frequencies, most of the continuum emission
from AM Her systems originates in the post-shock region. Hence, using
multi-spectral data can be useful to restrict the physical and geometrical
properties of that region. In spite of that, distinct codes are used to model
these frequency ranges. CYCLOPS is a code to model the optical cyclotron
emission of polars. In this contribution, we present the first version of
CYCLOPS-X, an improvement of CYCLOPS to fit simultaneously optical and X-ray
data. The new code adds the bremsstrahlung as an emission process as well as
the effects of X-ray absorption by the upper portion of the accretion column.
As a first application of CYCLOPS-X, we present X-ray light curves using two
sets of parameters provided by the optical modeling of CP Tuc. These two cases
have very similar optical emission, but quite distinct light-curves in high
energies. It illustrates the need of simultaneous modeling of the optical and
X-ray emission to a proper description of the magnetic accretion in polars.
","[{""version"":""v1"",""created"":""Fri, 28 Jan 2011 16:40:09 GMT""}]","2011-01-31"
"1101.5569","Piotr Jacek Puczynski","Piotr J. Puczynski","T2Script Programming Language","27 pages, 9 figures",,,,"cs.PL","http://arxiv.org/licenses/nonexclusive-distrib/1.0/","  Event-driven programming is used in many fields of modern Computer Science.
In event-driven programming languages user interacts with a program by
triggering the events. We propose a new approach that we denote command-event
driven programming in which the user interacts with a program by means of
events and commands. We describe a new programming language, T2Script, which is
based on command-event driven paradigm. T2Script has been already implemented
and used in one of industrial products. We describe the rationale, basic
concepts and advanced programming techniques of new T2Script language. We
evaluate the new language and show what advantages and limitations it has.
","[{""version"":""v1"",""created"":""Fri, 28 Jan 2011 16:42:00 GMT""}]","2015-03-18"
"1101.5570","Menassie Ephrem","Menassie Ephrem","$C^*$-algebra of the $\mathds{Z}^n$-tree","20 pages","Ephrem, M. $C^*$-algebra of the $\mathds{Z}^n$-tree New York J.
  Math. {\bf 17} (2011), 1--20",,,"math.OA","http://arxiv.org/licenses/nonexclusive-distrib/1.0/","  Let $\Lambda = \mathbb{Z}^n$ with lexicographic ordering. $\Lambda$ is a
totally ordered group. Let $X = \Lambda^+ * \Lambda^+$. Then $X$ is a
$\Lambda$-tree. Analogous to the construction of graph $C^*$-algebras, we form
a groupoid whose unit space is the space of ends of the tree. The $C^*$-algebra
of the $\Lambda$-tree is defined as the $C^*$-algebra of this groupoid. We
prove some properties of this $C^*$-algebra.
","[{""version"":""v1"",""created"":""Fri, 28 Jan 2011 16:51:15 GMT""}]","2011-01-31"
"1101.5571","Anthony Francis Mr","Anthony Francis and Frithjof Karsch","Continuum extrapolation of finite temperature meson correlation
  functions in quenched lattice QCD","13 pages, 13 figures, Contribution presented at The XXVIII
  International Symposium on Lattice Field Theory, Lattice2010, June 14-19,
  2010, Villasimius, Italy. Corrected factor $\chi_q$ in unnumbered equation on
  page 12 as opposed to published version of this proceedings contribution",,,,"hep-lat hep-ph","http://arxiv.org/licenses/nonexclusive-distrib/1.0/","  We explore the continuum limit $a\rightarrow 0$ of meson correlation
functions at finite temperature. In detail we analyze finite volume and lattice
cut-off effects in view of possible consequences for continuum physics. We
perform calculations on quenched gauge configurations using the clover improved
Wilson fermion action. We present and discuss simulations on isotropic
$N_\sigma^3\times 16$ lattices with $N_\sigma=32,48,64,128$ and $128^3 \times
N_\tau$ lattices with $N_\tau=16,24,32,48$ corresponding to lattice spacings in
the range of $0.01 fm \lsim a \lsim\ 0.031 fm$ at $T\simeq1.45T_c$. Continuum
limit extrapolations of vector meson and pseudo scalar correlators are
performed and their large distance expansion in terms of thermal moments is
introduced. We discuss consequences of this analysis for the calculation of the
electrical conductivity of the QGP at this temperature.
","[{""version"":""v1"",""created"":""Fri, 28 Jan 2011 16:55:50 GMT""}]","2015-03-18"
"1101.5572","Peter Thalmeier","Peter Thalmeier","Surface phonon propagation in topological insulators","6 pages, 3 figures, to appear in Phys. Rev. B","Phys. Rev. B 83, 125314 (2011)","10.1103/PhysRevB.83.125314",,"cond-mat.mtrl-sci","http://arxiv.org/licenses/nonexclusive-distrib/1.0/","  The effect of helical Dirac states on surface phonons in a topological
insulators is investigated. Their coupling is derived in the continuum limit by
assuming displacement dependent Dirac cones. The resulting renormalisation of
sound velocity and attenuation and its dependence on chemical potential and
wave vector is calculated. At finite wave vectors a Kohn anomaly in the
renormalized phonon frequency is caused by intraband-transitions. It appears at
wave vectors q<2k_F due to a lack of backscattering for helical Dirac
electrons. The wave vector and chemical potential dependence of this anomaly is
calculated.
","[{""version"":""v1"",""created"":""Fri, 28 Jan 2011 16:56:48 GMT""}]","2015-05-27"
"1101.5573","Donald M. Davis","Donald M. Davis","Some new nonimmersion results for real projective spaces","10 pages",,,,"math.AT","http://arxiv.org/licenses/nonexclusive-distrib/1.0/","  We use the spectrum tmf to obtain new nonimmersion results for many real
projective spaces RP^n for n as small as 113. The only new ingredient is some
new calculations of tmf-cohomology groups. We present an expanded table of
nonimmersion results. Our new theorem is new for 17% of the values of n between
2^i and 2^i + 2^14 for i > 14.
","[{""version"":""v1"",""created"":""Fri, 28 Jan 2011 16:57:54 GMT""}]","2011-01-31"
"1101.5574","Yboon Garcia Ramos","Yboon Garc\'ia and Marc Lassonde","Limits of sequences of maximal monotone operators",,,,,"math.OC","http://arxiv.org/licenses/nonexclusive-distrib/1.0/","  We show that the lower limit of a sequence of maximal monotone operators on a
reflexive Banach space is a representable monotone operator. As a consequence,
we obtain that the variational sum of maximal monotone operators and the
variational composition of a maximal monotone operator with a linear continuous
operator are both representable monotone operators.
","[{""version"":""v1"",""created"":""Fri, 28 Jan 2011 16:59:01 GMT""}]","2011-01-31"
"1101.5575","Igor Ivanov","I. P. Ivanov","Colliding particles carrying non-zero orbital angular momentum","v2: 24 pages, 2 figures; merged with arXiv:1101.1630 and matches the
  published version","Phys.Rev.D83:093001,2011","10.1103/PhysRevD.83.093001",,"hep-ph hep-ex","http://arxiv.org/licenses/nonexclusive-distrib/1.0/","  Photons carrying non-zero orbital angular momentum (twisted photons) are
well-known in optics. Recently, it was suggested to use Compton backscattering
to boost optical twisted photons to high energies. Twisted electrons in the
intermediate energy range have also been produced recently. Thus, collisions
involving energetic twisted particles seem to be feasible and represent a new
tool in high-energy physics. Here we discuss some generic features of
scattering processes involving twisted particles in the initial and/or final
state. In order to avoid additional complications arising from non-trivial
polarization states, we focus here on scalar fields only. We show that
processes involving twisted particles allow one to perform a Fourier analysis
of the plane wave cross section with respect to the azimuthal angles of the
initial particles. In addition, using twisted states one can probe the
autocorrelation function of the amplitude, which is inaccessible in the plane
wave collisions. Finally, we discuss prospects for experimental study of these
effects.
","[{""version"":""v1"",""created"":""Fri, 28 Jan 2011 17:01:00 GMT""},{""version"":""v2"",""created"":""Tue, 3 May 2011 15:00:08 GMT""}]","2011-05-12"
"1101.5576","Christoph Lehner","Christoph Lehner, Jacques Bloch, Shoji Hashimoto, Tilo Wettig","Geometry dependence of RMT-based methods to extract the low-energy
  constants Sigma and F","14 pages, 6 figures; extended discussion of systematic errors, as
  published in JHEP","JHEP05(2011)115","10.1007/JHEP05(2011)115","BNL-94618-2011-JA, KEK-CP-251, RBRC-883","hep-lat","http://arxiv.org/licenses/nonexclusive-distrib/1.0/","  The lowest-order low-energy constants $\Sigma$ and $F$ of chiral pertubation
theory can be extracted from lattice data using methods based on the
equivalence of random matrix theory (RMT) and QCD in the epsilon regime. We
discuss how the choice of the lattice geometry affects such methods. In
particular, we show how to minimize systematic deviations from RMT by an
optimal choice of the lattice geometry in the case of two light quark flavors.
We illustrate our findings by determining $\Sigma$ and $F$ from lattice
configurations with two dynamical overlap fermions generated by JLQCD, using
two different lattice geometries.
","[{""version"":""v1"",""created"":""Fri, 28 Jan 2011 17:02:37 GMT""},{""version"":""v2"",""created"":""Tue, 21 Jun 2011 15:56:20 GMT""}]","2011-06-22"
"1101.5577","Bernhard Schmid","Rolf Schilling and Bernhard Schmid","Comment on ""Mode-Coupling Theory as a Mean-Field Description of the
  Glass Transition""","1 page, 1 figure","Phys. Rev. Lett. 106, 049601 (2011)","10.1103/PhysRevLett.106.049601",,"cond-mat.soft","http://arxiv.org/licenses/nonexclusive-distrib/1.0/","  A Comment on the Letter by Atsushi Ikeda and Kunimasa Miyazaki,
[arXiv:1003.5472v2, Phys. Rev. Lett. 104, 255704 (2010)].
","[{""version"":""v1"",""created"":""Fri, 28 Jan 2011 17:04:39 GMT""}]","2011-01-31"
"1101.5578","Daniele Perito","Daniele Perito, Claude Castelluccia, Mohamed Ali Kaafar, Pere Manils","How Unique and Traceable are Usernames?",,,,,"cs.CR","http://arxiv.org/licenses/nonexclusive-distrib/1.0/","  Suppose you find the same username on different online services, what is the
probability that these usernames refer to the same physical person? This work
addresses what appears to be a fairly simple question, which has many
implications for anonymity and privacy on the Internet. One possible way of
estimating this probability would be to look at the public information
associated to the two accounts and try to match them. However, for most
services, these information are chosen by the users themselves and are often
very heterogeneous, possibly false and difficult to collect. Furthermore,
several websites do not disclose any additional public information about users
apart from their usernames (e.g., discus- sion forums or Blog comments),
nonetheless, they might contain sensitive information about users. This paper
explores the possibility of linking users profiles only by looking at their
usernames. The intuition is that the probability that two usernames refer to
the same physical person strongly depends on the ""entropy"" of the username
string itself. Our experiments, based on crawls of real web services, show that
a significant portion of the users' profiles can be linked using their
usernames. To the best of our knowledge, this is the first time that usernames
are considered as a source of information when profiling users on the Internet.
","[{""version"":""v1"",""created"":""Fri, 28 Jan 2011 17:04:40 GMT""},{""version"":""v2"",""created"":""Thu, 3 Feb 2011 15:02:22 GMT""},{""version"":""v3"",""created"":""Tue, 8 Mar 2011 10:04:49 GMT""}]","2015-03-18"
"1101.5579","Nicolas Garron","Peter Boyle, Nicolas Garron","Non-perturbative renormalization of kaon four-quark operators with
  nf=2+1 Domain Wall fermions","7 pages, 6 figures, contribution to the XXVIII International
  Symposium on Lattice Field Theory, Lattice 2010, June 14-19, 2010,
  Villasimius, Sardinia, Italy","PoS(Lattice 2010)307",,,"hep-lat","http://arxiv.org/licenses/nonexclusive-distrib/1.0/","  We present our strategy and some preliminary results for the renormalization
of four-quark operators relevant for kaon physics. We follow the
non-perturbative Rome-Southampton method, with both exceptional and
non-exceptional kinematics. We also implement momentum sources and twisted
boundary conditions. We use an (almost) unitary setup: Domain-Wall valence on
nf=2+1 Domain-Wall sea and Iwasaki gauge action, at two values of the lattice
spacing corresponding to approximately 0.086 fm and 0.114 fm . The chiral
properties of these fermions play a crucial role in this compuation and are
studied in detail in this work.
","[{""version"":""v1"",""created"":""Fri, 28 Jan 2011 17:11:21 GMT""}]","2015-03-18"
"1101.5580","Hongjie Dong","Hongjie Dong, Robert M. Strain","On partial regularity of steady-state solutions to the 6D Navier-Stokes
  equations","19 pages, revised version, to appear in Indiana Univ. Math. J","Indiana Univ. Math. J. (2012)","10.1512/iumj.2012.61.4765",,"math.AP","http://arxiv.org/licenses/nonexclusive-distrib/1.0/","  Consider steady-state weak solutions to the incompressible Navier-Stokes
equations in six spatial dimensions. We prove that the 2D Hausdorff measure of
the set of singular points is equal to zero. This problem was mentioned in 1988
by Struwe [24], during his study of the five dimensional case.
","[{""version"":""v1"",""created"":""Fri, 28 Jan 2011 17:16:22 GMT""},{""version"":""v2"",""created"":""Fri, 9 Mar 2012 20:17:42 GMT""}]","2016-02-22"
"1101.5581","Jian Liu","Jian Liu, S. Okamoto, M. van Veenendaal, M. Kareev, B. Gray, P. Ryan,
  J. W. Freeland, and J. Chakhalian","Quantum confinement of Mott electrons in ultrathin LaNiO3/LaAlO3
  superlattice","4 pages, 3 figures",,"10.1103/PhysRevB.83.161102",,"cond-mat.str-el","http://arxiv.org/licenses/nonexclusive-distrib/1.0/","  We investigate the electronic reconstruction in
(LaNiO$_{3}$)$_n$/(LaAlO$_{3}$)$_3$ (n=3, 5 and 10) superlattices due to the
quantum confinement (QC) by d.c. transport and resonant soft x-ray absorption
spectroscopy. In proximity to the QC limit, a Mott-type transition from an
itinerant electron behavior to a localized state is observed. The system
exhibits tendency towards charge-order during the transition. ab initio cluster
calculations are in good agreement with the absorption spectra, indicating that
the apical ligand hole density is highly suppressed resulting in a strong
modification of the electronic structure. At the dimensional crossover cellular
dynamical-mean-field calculations support the emergence of a Mott insulator
ground state in the heterostructured ultra-thin slab of LaNiO$_{3}$.
","[{""version"":""v1"",""created"":""Fri, 28 Jan 2011 17:16:56 GMT""}]","2015-05-27"
"1101.5582","Shinji Ejiri","S. Ejiri, Y. Nakagawa, S. Aoki, K. Kanaya, H. Ohno, H. Saito, T.
  Hatsuda, Y. Maezawa, T. Umeda (WHOT-QCD collaboration)","Scaling behavior of chiral phase transition in two-flavor QCD with
  improved Wilson quarks at finite density","7 pages, 6 figures, poster presented at the XXVIII International
  Symposium on Lattice Field Theory, June 14-19 2010, Villasimius, Italy","PoS LATTICE2010 (2010) 181",,,"hep-lat","http://arxiv.org/licenses/nonexclusive-distrib/1.0/","  We study scaling behavior of a chiral order parameter performing a simulation
of two-flavor QCD with improved Wilson quarks. It has been shown that the
scaling behavior of the chiral order parameter defined by a Ward-Takahashi
identity agrees with the scaling function of the three-dimensional O(4) spin
model at zero chemical potential. We extend the scaling study to finite density
QCD. Calculating derivatives of the chiral order parameter with respect to the
chemical potential in two-flavor QCD, the scaling property of chiral phase
transition is discussed in the low density region. We moreover calculate the
curvature of the phase boundary of the chirl phase transition in the
temperature and chemical potential plane assuming the O(4) scaling relation.
","[{""version"":""v1"",""created"":""Fri, 28 Jan 2011 17:19:47 GMT""}]","2015-03-18"
