"1101.5639","Stefan Natu","Stefan S. Natu and Erich J. Mueller","Pairing, Ferromagnetism, and Condensation of a normal spin-1 Bose gas","4 pages, 3 figures, 1 table. Supplementary materials attached","Phys. Rev. A 84, 053625 (2011)","10.1103/PhysRevA.84.053625",,"cond-mat.quant-gas","http://arxiv.org/licenses/nonexclusive-distrib/1.0/","  We theoretically study the stability of a normal, spin disordered, homogenous
spin-1 Bose gas against ferromagnetism, pairing, and condensation through a
Random Phase Approximation which includes exchange (RPA-X). Repulsive
spin-independent interactions stabilize the normal state against both
ferromagnetism and pairing, and for typical interaction strengths leads to a
direct transition from an unordered normal state to a fully ordered single
particle condensate. Atoms with much larger spin-dependent interaction may
experience a transition to a ferromagnetic normal state or a paired superfluid,
but, within the RPA-X, there is no instability towards a normal state with
spontaneous nematic order. We analyze the role of the quadratic Zeeman effect
and finite system size.
","[{""version"":""v1"",""created"":""Fri, 28 Jan 2011 22:11:47 GMT""}]","2011-11-30"
"1101.5640","Ramiro Debbe Dr","R. Debbe (BNL)","Dependence of Single Particle Distributions on Rapidity and Centrality
  in d+Au Collisions at \snn = 200 GeV","Submitted to Nucl. Phys. A as part of the proceedings of the Workshop
  on Saturation, the Color Glass Condensate and Glasma: What Have we Learned
  from RHIC?, Brookhaven, Upton, New York, 10-12 May 2010","Nucl.Phys.A854:131-143,2011","10.1016/j.nuclphysa.2011.01.015","BNL-94238-2010-JA","nucl-ex","http://arxiv.org/licenses/nonexclusive-distrib/1.0/","  Measurements of identified single particle distributions in d+Au collisions
at \snn = 200 GeV at the RHIC collider are described. The dependence of these
distributions on the centrality of the collisions, as well as the rapidity of
the detected particles are emphasized in this report.
","[{""version"":""v1"",""created"":""Fri, 28 Jan 2011 22:13:22 GMT""}]","2015-03-18"
"1101.5641","Glenn Hurlbert","Glenn Hurlbert","A linear optimization technique for graph pebbling",,,,,"math.CO","http://arxiv.org/licenses/nonexclusive-distrib/1.0/","  Graph pebbling is a network model for studying whether or not a given supply
of discrete pebbles can satisfy a given demand via pebbling moves. A pebbling
move across an edge of a graph takes two pebbles from one endpoint and places
one pebble at the other endpoint; the other pebble is lost in transit as a
toll. It has been shown that deciding whether a supply can meet a demand on a
graph is NP-complete. The pebbling number of a graph is the smallest t such
that every supply of t pebbles can satisfy every demand of one pebble. Deciding
if the pebbling number is at most k is \Pi_2^P-complete. In this paper we
develop a tool, called the Weight Function Lemma, for computing upper bounds
and sometimes exact values for pebbling numbers with the assistance of linear
optimization. With this tool we are able to calculate the pebbling numbers of
much larger graphs than in previous algorithms, and much more quickly as well.
We also obtain results for many families of graphs, in many cases by hand, with
much simpler and remarkably shorter proofs than given in previously existing
arguments (certificates typically of size at most the number of vertices times
the maximum degree), especially for highly symmetric graphs. Here we apply the
Weight Function Lemma to several specific graphs, including the Petersen,
Lemke, 4th weak Bruhat, Lemke squared, and two random graphs, as well as to a
number of infinite families of graphs, such as trees, cycles, graph powers of
cycles, cubes, and some generalized Petersen and Coxeter graphs. This partly
answers a question of Pachter, et al., by computing the pebbling exponent of
cycles to within an asymptotically small range. It is conceivable that this
method yields an approximation algorithm for graph pebbling.
","[{""version"":""v1"",""created"":""Fri, 28 Jan 2011 22:18:25 GMT""}]","2015-03-18"
"1101.5642","Shawna Hollen","S. M. Hollen, H. Q. Nguyen, E. Rudisaile, M. D. Stewart Jr., J.
  Shainline, J. M. Xu, and J. M. Valles Jr","Cooper pair insulator in amorphous films induced by nanometer-scale
  thickness variations","4 pages, 3 figures, 1 supplemental page with 1 supplemental figure","Phys. Rev. B 84, 064528 (2011)","10.1103/PhysRevB.84.064528",,"cond-mat.supr-con cond-mat.str-el","http://arxiv.org/licenses/nonexclusive-distrib/1.0/","  Unusual transport properties of superconducting (SC) materials, such as the
under doped cuprates, low dimensional superconductors in strong magnetic
fields, and insulating films near the Insulator Superconductor Transition
(IST), have been attributed to the formation of inhomogeneous phases.
Difficulty correlating the behaviors with observations of the inhomogeneities
make these connections uncertain. Of primary interest here are proposals that
insulating films near the IST, which show an activated resistance and giant
positive magnetoresistance, contain islands of Cooper Pairs (CPs). Here we
present evidence that these types of inhomogeneities are essential to such an
insulating phase in amorphous Bi (a-Bi) films deposited on substrates patterned
with nanometer-sized holes. The patterning induces film thickness variations,
and corresponding coupling constant variations, that transform the composition
of the insulator from localized electrons to CPs. Analyses near the
thickness-tuned ISTs of films on nine different substrates show that weak links
between SC islands dominate the transport. In particular, the ISTs all occur
when the link resistance approaches the resistance quantum for pairs. These
observations lead to a detailed picture of CPs localized by spatial variations
of the superconducting coupling constant.
","[{""version"":""v1"",""created"":""Fri, 28 Jan 2011 23:07:52 GMT""}]","2013-01-28"
"1101.5643","Karapet Mkrtchyan","Karapet Mkrtchyan","On generating functions of Higher Spin cubic interactions","8 pages, based on talk, given in XIV international conference
  ""Symmetry Methods in Physics"", 16-22 August, 2010 Tsakhkadzor, Armenia",,"10.1134/S1063778812100146",,"hep-th","http://arxiv.org/licenses/nonexclusive-distrib/1.0/","  We present off-shell generating functions for all cubic interactions of
totally symmetric massless Higher Spin gauge fields and discuss their
properties.
","[{""version"":""v1"",""created"":""Fri, 28 Jan 2011 23:27:39 GMT""},{""version"":""v2"",""created"":""Sat, 2 Jun 2012 18:24:56 GMT""}]","2015-05-27"
"1101.5644","Yasmine Sassa","Y. Sassa, M. Radovic, M. M{\aa}nsson, E. Razzoli, X. Y. Cui, S.
  Pailh\mues, S. Guerrero, M. Shi, P. R. Willmott, F. Miletto Granozio, J.
  Mesot, M. R. Norman, and L. Patthey","Revealing the ortho-II Band Folding in YBa2Cu3O7-delta Films","Accepted in Physical Review B, Rapid Communication","Physical Review B 83, 140511(R) (2011)","10.1103/PhysRevB.83.140511",,"cond-mat.supr-con","http://arxiv.org/licenses/nonexclusive-distrib/1.0/","  We present an angle-resolved photoelectron spectroscopy study of
YBa2Cu3O7-delta films in situ grown by pulsed laser deposition. We have
successfully produced underdoped surfaces with ordered oxygen vacancies within
the CuO chains resulting in a clear ortho-II band folding of the Fermi surface.
This indicates that order within the CuO chains affects the electronic
properties of the CuO2 planes. Our results highlight the importance of having
not only the correct surface carrier concentration, but also a very well
ordered and clean surface in order that photoemission data on this compound be
representative of the bulk.
","[{""version"":""v1"",""created"":""Fri, 28 Jan 2011 23:38:15 GMT""},{""version"":""v2"",""created"":""Sat, 12 Mar 2011 12:26:05 GMT""}]","2016-08-14"
"1101.5645","Michel Godefroid R.","T Carette and M R Godefroid","Ab initio calculations of the {33}S 3p4 3P_J and {33}S- / {37,35}Cl 3p5
  2Po_J hyperfine structures","14 pages, 2 figures (10 subfigures)",,"10.1088/0953-4075/44/10/105001",,"physics.atom-ph","http://arxiv.org/licenses/nonexclusive-distrib/1.0/","  We present highly correlated multi-configuration Hartree-Fock (MCHF)
calculations of the hyperfine structure of the 3p5 2Po_J levels of {33}S- and
{35,37}Cl. We obtain a good agreement with observation. The hyperfine structure
of the neutral sulfur {33}S 3p4 3P_J lowest multiplet that has never been
measured to the knowledge of the authors, is also estimated theoretically. We
discuss some interesting observations made on the description of the atomic
core in MCHF theory.
","[{""version"":""v1"",""created"":""Fri, 28 Jan 2011 23:43:00 GMT""}]","2015-05-27"
"1101.5646","David Arnett","W. David Arnett and Casey Meakin","Towards Realistic Progenitors of Core-Collapse Supernovae","26 pages, 1 table, 4 figures",,"10.1088/0004-637X/733/2/78",,"astro-ph.SR","http://arxiv.org/licenses/nonexclusive-distrib/1.0/","  Two-dimensional (2D) hydrodynamical simulations of progenitor evolution of a
23 solar mass star, close to core collapse (about 1 hour, in 1D), with
simultaneously active C, Ne, O, and Si burning shells, are presented and
contrasted to existing 1D models (which are forced to be quasi-static).
Pronounced asymmetries, and strong dynamical interactions between shells are
seen in 2D. Although instigated by turbulence, the dynamic behavior proceeds to
sufficiently large amplitudes that it couples to the nuclear burning. Dramatic
growth of low order modes is seen, as well as large deviations from spherical
symmetry in the burning shells. The vigorous dynamics is more violent than that
seen in earlier burning stages in the 3D simulations of a single cell in the
oxygen burning shell, or in 2D simulations not including an active Si shell.
Linear perturbative analysis does not capture the chaotic behavior of
turbulence (e.g., strange attractors such as that discovered by Lorenz), and
therefore badly underestimates the vigor of the instability. The limitations of
1D and 2D models are discussed in detail. The 2D models, although flawed
geometrically, represent a more realistic treatment of the relevant dynamics
than existing 1D models, and present a dramatically different view of the
stages of evolution prior to collapse. Implications for interpretation of
SN1987A, abundances in young supernova remnants, pre-collapse outbursts,
progenitor structure, neutron star kicks, and fallback are outlined. While 2D
simulations provide new qualitative insight, fully 3D simulations are needed
for a quantitative understanding of this stage of stellar evolution. The
necessary properties of such simulations are delineated.
","[{""version"":""v1"",""created"":""Sat, 29 Jan 2011 00:14:19 GMT""}]","2015-05-27"
"1101.5647","Luisa Rebull","L. M. Rebull","Mid-Infrared Variation in Young Stars","to appear in Cool Stars 16 conference proceedings, ASP Conference
  Series",,,,"astro-ph.SR","http://arxiv.org/licenses/nonexclusive-distrib/1.0/","  Since 2003, the Spitzer Space Telescope has provided groundbreaking views of
Galactic star formation in bands from 3.6 past 24 microns. During the cryogenic
mission (the first 5.5 years), variability of young stars at these bands was
noted, although typically with just a few epochs of observation. The cryogen
ran out in 2009, and we are now in the warm mission era where the shortest two
bands (3.6 and 4.5 microns) continue to function essentially as before. The
phenomenal sensitivity and stability of Spitzer at these bands has enabled
several dedicated monitoring programs studying the variability of young stars
at timescales from minutes to years. The largest of these programs is YSOVAR
(Stauffer et al.), but there are several smaller programs as well. With at
least as many as 2200 young star light curves likely to come out of this, these
programs as a whole enable more detailed study of the young star-disk
interaction in the infrared for a wider range of ages and masses than has ever
been accomplished before. Early results suggest a wide variety of sources of
variability, including dust clouds in the disk, disk warps, star spots, and
accretion. This contribution will review some of the most recent results from
these programs.
","[{""version"":""v1"",""created"":""Sat, 29 Jan 2011 00:35:09 GMT""}]","2015-03-18"
"1101.5648","Misak Sargsian","Misak M Sargsian","Light Cone Dynamics and EMC Effects in the Extraction of F_{2n} at Large
  Bjorken x","7 pages and 3 eps figures, presented at 3rd International Workshop on
  Nucleon Structure at Large Bjorken x October 13-15, 2010",,"10.1063/1.3631521",,"hep-ph nucl-ex nucl-th","http://arxiv.org/licenses/nonexclusive-distrib/1.0/","  We discuss theoretical issues related to the extraction of deep
inelastic~(DIS) structure function of neutron from inclusive DIS scattering off
the deuteron at large Bjorken x. Theoretical justification is given to the
consideration of only $pn$ component of the deuteron wave function and
consistency with both the baryonic number and light-cone momentum conservation
sum rules. Next we discuss the EMC type effects and argue that in all cases
relevant to the nuclear DIS reactions at large x the main issue is the medium
modification of the properties of bound nucleon rather than the non-nucleonic
components like pions. We give brief description of the color screening model
of EMC and within this model we estimate uncertainties in the extraction of the
neutron DIS structure function at large x. We emphasize also that these
uncertainties are rather ""model independent"" since any theoretical framework
accounting for the medium modification is proportional to the magnitude of the
virtuality of bound nucleon which increases with an increase of x.
","[{""version"":""v1"",""created"":""Sat, 29 Jan 2011 01:19:47 GMT""}]","2015-05-27"
"1101.5649","Robert Smith","Robert X. Smith, Philip L. Kuhns, Arneil P. Reyes, and Gregory S.
  Boebinger","Two distinct electronic sites in the Cu-O plane of the (La,Sr)CuO(4)
  pseudogap state","4 pages, 4 figures, submitted to Physical Review Letters",,,,"cond-mat.supr-con cond-mat.str-el","http://arxiv.org/licenses/nonexclusive-distrib/1.0/","  The pseudogap state is widely regarded as a precursor to high-temperature
superconductivity yet remains poorly understood. Using high field (30 T) NMR,
we report two electronically distinct oxygen sites within the copper-oxygen
(Cu-O) planes of an underdoped cuprate in the pseudogap state. At temperatures
well above the bulk superconducting transition, roughly 25% of the oxygen sites
evidence superconducting pair formation, the remaining evidence
antiferromagnetic ordering on the nearest neighbor Cu sites. Any
superconducting fluctuations are slower than the microsecond timescales of the
NMR probe, a confirmation that the (nearly) static bimodality of electronic
sites in the Cu-O plane - first reported using scanning tunneling microscopy on
surfaces - extends throughout the bulk pseudogap state.
","[{""version"":""v1"",""created"":""Sat, 29 Jan 2011 01:26:31 GMT""}]","2011-02-01"
"1101.5650","E. F. Milone","Michael D. Williams and E. F. Milone","First results from the RAO Variable Star Search Program: I. Background,
  Procedure, and Results from RAO Field 1","62 pages, 21 figures, 5 tables",,,"Publications of the RAO No. 76","astro-ph.GA astro-ph.IM","http://arxiv.org/licenses/nonexclusive-distrib/1.0/","  We describe an ongoing variable star search program and present the first
reduced results of a search in a 19 square degree (4.4\circle x 4.4\circle)
field centered on J2000 {\alpha} = 22:03:24, {\delta} = +18:54:32. The search
was carried out with the Baker-Nunn Patrol Camera located at the Rothney
Astrophysical Observatory in the foothills of the Canadian Rockies. A total of
26,271 stars were detected in the field, over a range of about 11-15
(instrumental) magnitudes. Our image processing made use of the IRAF version of
the DAOPHOT aperture photometry routine and we used the ANOVA method to search
for periodic variations in the light curves. We formally detected periodic
variability in 35 stars, that we tentatively classify according to light curve
characteristics: 6 EA (Algol), 5 EB ({\beta} Lyrae), 19 EW (W UMa), and 5 RR
(RR Lyrae) stars. Eleven of the detected variable stars have been reported
previously in the literature. The eclipsing binary light curves have been
analyzed with a package of light curve modeling programs and 25 have yielded
converged solutions. Nine of these systems are detached, 3 semi0detached, 10
over-contact, and 2 appear to be in marginal contact. We discuss these results
as well as the advantages and disadvantages of the instrument and of the
program.
","[{""version"":""v1"",""created"":""Sat, 29 Jan 2011 01:27:37 GMT""}]","2011-02-01"
"1101.5651","Ching-Wa Yip","Ching-Wa Yip, Alex S. Szalay, Samuel Carliles and Tamas Budavari","Effect of Inclination of Galaxies on Photometric Redshift","Accepted for publication in ApJ",,"10.1088/0004-637X/730/1/54",,"astro-ph.CO","http://arxiv.org/licenses/nonexclusive-distrib/1.0/","  The inclination of galaxies induces both reddening and extinction to their
observed spectral energy distribution, which in turn impact the derived
properties of the galaxies. Here we report a significant dependence of the
error in photometric redshift (photo-z) on the inclination of disk galaxies
from the Sloan Digital Sky Survey. The bias in the photo-z based on the
template-fitting approach increases from -0.015 in face-on to 0.021 in edge-on
galaxies. A Principal Component Analysis on the full sample of photometry
reveals the inclination of the galaxies to be represented by the 2nd mode. The
corresponding eigenspectrum resembles an extinction curve. The isolation of the
inclination effect in a low-order mode demonstrates the significant reddening
induced on the observed colors, leading to the over-estimated photo-z in
galaxies of high inclinations. We present approaches to correct the photo-z and
the other properties of the disk galaxies against the inclination effect.
","[{""version"":""v1"",""created"":""Sat, 29 Jan 2011 01:39:10 GMT""}]","2015-05-27"
"1101.5652","James Hall","James Forsythe Hall","Completeness of Ordered Fields",,,,,"math.LO","http://arxiv.org/licenses/nonexclusive-distrib/1.0/","  The main goal of this project is to prove the equivalency of several
characterizations of completeness of Archimedean ordered fields; some of which
appear in most modern literature as theorems following from the Dedekind
completeness of the real numbers, while a couple are not as well known and have
to do with other areas of mathematics, such as nonstandard analysis.
  Continuing, we study the completeness of non-Archimedean fields, and provide
several examples of such fields with varying degrees of properties, using
nonstandard analysis to produce some relatively ""nice"" (in particular, they are
Cantor complete) final examples.
  As a small detour, we present a short construction of the real numbers using
methods from nonstandard analysis.
","[{""version"":""v1"",""created"":""Sat, 29 Jan 2011 01:47:44 GMT""}]","2011-02-01"
"1101.5653","J. A. Lopez","J. A. L\'opez, Ma. T. Garc\'ia D\'iaz, M. G. Richer, M. Lloyd, J.
  Meaburn","The Kinematics and Morphology of PNe with close binary nuclei","3 pages, 1 figure, Asymmetrical Planetary Nebulae V, Ebrary, 2010, in
  press",,,,"astro-ph.GA","http://arxiv.org/licenses/nonexclusive-distrib/1.0/","  We have obtained images and long-slit, spatially resolved echelle spectra for
twenty four planetary nebulae (PNe) that have confirmed close binary nuclei.
The sample shows a variety of morphologies, however toroids or dense equatorial
density enhancements are identified, both in the imagery and the spectra, as
the common structural component. These toroids are thought to be the remnant
fingerprints of the post common envelope phase. Based on the characteristics of
the present sample we suggest a list of additional PNe that are likely to host
close binary nuclei
","[{""version"":""v1"",""created"":""Sat, 29 Jan 2011 01:50:48 GMT""}]","2011-02-01"
"1101.5654","Charles M. Marcus","I. van Weperen, B. D. Armstrong, E. A. Laird, J. Medford, C. M.
  Marcus, M. P. Hanson, and A. C. Gossard","Conditional operation of a spin qubit","related papers here: http://marcuslab.harvard.edu","Phys. Rev. Lett. 107 030506 (2011)","10.1103/PhysRevLett.107.030506",,"cond-mat.mes-hall quant-ph","http://arxiv.org/licenses/nonexclusive-distrib/1.0/","  We report coherent operation of a singlet-triplet qubit controlled by the
arrangement of two electrons in an adjacent double quantum dot. The system we
investigate consists of two pairs of capacitively coupled double quantum dots
fabricated by electrostatic gates on the surface of a GaAs heterostructure. We
extract the strength of the capacitive coupling between qubit and double
quantum dot and show that the present geometry allows fast conditional gate
operation, opening pathways to multi-qubit control and implementation of
quantum algorithms with spin qubits.
","[{""version"":""v1"",""created"":""Sat, 29 Jan 2011 02:31:58 GMT""},{""version"":""v2"",""created"":""Tue, 1 Feb 2011 19:24:39 GMT""},{""version"":""v3"",""created"":""Wed, 9 Feb 2011 15:42:48 GMT""}]","2011-07-20"
"1101.5655","Jie-Qiao Liao","Jie-Qiao Liao, C. K. Law","Parametric generation of quadrature squeezing of mirrors in cavity
  optomechanics","4 pages, 2 figures","Phys. Rev. A 83, 033820 (2011)","10.1103/PhysRevA.83.033820",,"quant-ph","http://arxiv.org/licenses/nonexclusive-distrib/1.0/","  We propose a method to generate quadrature squeezed states of a moving mirror
in a Fabry-Perot cavity. This is achieved by exploiting the fact that when the
cavity is driven by an external field with a large detuning, the moving mirror
behaves as a parametric oscillator. We show that parametric resonance can be
reached approximately by modulating the driving field amplitude at a frequency
matching the frequency shift of the mirror. The parametric resonance leads to
an efficient generation of squeezing, which is limited by the thermal noise of
the environment.
","[{""version"":""v1"",""created"":""Sat, 29 Jan 2011 02:43:44 GMT""},{""version"":""v2"",""created"":""Thu, 24 Mar 2011 05:24:09 GMT""}]","2013-08-30"
"1101.5656","Jun-Hwan Choi","Jun-Hwan Choi (UNLV, UKY), Kentaro Nagamine (UNLV)","On the inconsistency between the estimates of cosmic star formation rate
  and stellar mass density of high redshift galaxies","6 pages, 1 table, and 2 figures, accepted for publication in MNRAS","2012, MNRAS, 419, 1280","10.1111/j.1365-2966.2011.19788.x",,"astro-ph.CO","http://arxiv.org/licenses/nonexclusive-distrib/1.0/","  There are mainly two different approaches to measure the cosmic star
formation history: direct star formation rate density (SFRD) and stellar mass
density rhostar as functions of redshift. Compilations of current observations
seem to show a disparity in the two quantities, in the sense that the integral
of SFRD is higher than the observed rhostar (after considering gas recycling).
Using cosmological smoothed particle hydrodynamics simulations based on the
concordance Lambda cold dark matter model, we show that the two quantities
become more consistent with each other when we consider the observed galaxy
mass limit. The comparison between simulations and (dust corrected) observed
cosmic SFRD shows a good agreement, while the observed rhostar is significantly
lower than the simulation results. This can be reconciled if the current
high-$z$ galaxy surveys are missing faint low-mass galaxies due to their flux
limit. Our simulated GSMFs have steep low-mass end slopes of alpha < -2 at z>3,
and when these numerous low-mass galaxies are included, the total rhostar
matches with the integral of SFRD.
","[{""version"":""v1"",""created"":""Sat, 29 Jan 2011 02:57:30 GMT""},{""version"":""v2"",""created"":""Mon, 25 Jul 2011 16:01:57 GMT""},{""version"":""v3"",""created"":""Mon, 12 Sep 2011 15:29:04 GMT""}]","2012-01-13"
"1101.5657","Christopher J. Conselice","Christopher J. Conselice","How do galaxies get their baryons?","Review for proceedings of ""Tracing the Ancestry of Galaxies on the
  Land of our Ancestors"", Eds Carignan, Freeman & Combes",,"10.1017/S1743921311022927",,"astro-ph.CO astro-ph.GA","http://arxiv.org/licenses/nonexclusive-distrib/1.0/","  Understanding how galaxies obtain baryons, their stars and gas, over cosmic
time is traditionally approached in two different ways - theoretically and
observationally. In general, observational approaches to galaxy formation
include measuring basic galaxy properties, such as luminosities, stellar
masses, rotation speeds, star formation rates and how these features evolve
through time. Theoretically, cosmologically based models collate the physical
effects driving galaxy assembly - mergers of galaxies, accretion of gas, star
formation, and feedback, amongst others, to form predictions which are matched
to galaxy observables. An alternative approach is to examine directly, in an
observational way, the processes driving galaxy assembly, including the effects
of feedback. This is a new `third way' towards understanding how galaxies are
forming from gas accretion and mergers, and directly probes these effects
instead of relying on simulations designed to reproduce observations. This
empirical approach towards understanding galaxy formation, including the
acquisition history of baryons, displays some significant differences with the
latest galaxy formation models, in addition to directly demonstrating the
mechanisms by which galaxies form most of their baryonic mass.
","[{""version"":""v1"",""created"":""Sat, 29 Jan 2011 02:57:49 GMT""}]","2015-05-27"
