"1101.5658","Chris Arettines","Chris Arettines","A combinatorial algorithm for visualizing representatives with minimal
  self-intersection","14 pages, 11 figures. The algorithm described in the paper is
  implemented at http://www.math.sunysb.edu/~moira/applets/chrisApplet.html",,,,"math.GT","http://arxiv.org/licenses/nonexclusive-distrib/1.0/","  Given an orientable surface with boundary and a free homotopy class, we
present a purely combinatorial algorithm which produces a representative of
that homotopy class with minimal self intersection.
","[{""version"":""v1"",""created"":""Sat, 29 Jan 2011 03:00:15 GMT""}]","2011-02-01"
"1101.5659","Michael Engel","Michael Engel","Entropic Stabilization of Tunable Planar Modulated Superstructures","4 pages, 5 figures plus 7 pages of supplementary figures","Phys. Rev. Lett. 106, 095504 (2011)","10.1103/PhysRevLett.106.095504",,"cond-mat.soft","http://arxiv.org/licenses/nonexclusive-distrib/1.0/","  Self-assembling novel ordered structures with nanoparticles has recently
received much attention. Here we use computer simulations to study a
two-dimensional model system characterized by a simple isotropic interaction
that could be realized with building blocks on the nanoscale. We find that the
particles arrange themselves into hexagonal superstructures of twin boundaries
whose superlattice vector can be tuned reversibly by changing the temperature.
Thermodynamic stability is confirmed by calculating the free energy with a
combination of thermodynamic integration and the Frenkel-Ladd method. Different
contributions to the free energy difference are discussed.
","[{""version"":""v1"",""created"":""Sat, 29 Jan 2011 03:03:58 GMT""}]","2015-03-18"
"1101.5660","Toshiyasu Arai","Toshiyasu Arai","Lifting up the proof theory to the countables : Zermelo-Fraenkel set
  theory",,,,,"math.LO","http://arxiv.org/licenses/nonexclusive-distrib/1.0/","  We describe the countable ordinals in terms of iterations of Mostowski
collapsings. This gives a proof-theoretic bound of definable countable ordinals
in the Zermelo-Fraenkel's set theory ZF.
","[{""version"":""v1"",""created"":""Sat, 29 Jan 2011 03:23:41 GMT""},{""version"":""v2"",""created"":""Wed, 2 Feb 2011 07:45:06 GMT""},{""version"":""v3"",""created"":""Sat, 14 Apr 2012 03:24:11 GMT""},{""version"":""v4"",""created"":""Wed, 12 Sep 2012 04:42:53 GMT""},{""version"":""v5"",""created"":""Mon, 11 Mar 2013 03:20:35 GMT""}]","2013-03-12"
"1101.5661","Qingfeng Li","Qingfeng Li, Caiwan Shen, Chenchen Guo, Yongjia Wang, Zhuxia Li, J.
  Lukasik, W. Trautmann","Non-equilibrium dynamics in heavy ion collisions at low SIS energies","28 pages,8 figures, 3 tables",,,,"nucl-th nucl-ex","http://arxiv.org/licenses/nonexclusive-distrib/1.0/","  The Ultrarelativistic Quantum Molecular Dynamics (UrQMD) model, a microscopic
transport model, is used to study the directed and elliptic collective flows
and the nuclear stopping in Au+Au collisions at incident energies covered by
INDRA and lower-energy FOPI experiments. It is seen clearly that these
observables are sensitive to both, the potential terms (including iso-scalar
and iso-vector parts as well as the momentum dependent term) in the equation of
state (EoS) and the collision term (including the Pauli-blocking and the
medium-modified nucleon-nucleon elastic cross section (NNECS)). The momentum
modifications of both, the mean-field potentials and the density dependent
NNECS, are found to be sensitive to the collectivity of heavy-ion collisions.
At INDRA energies ($\le 150$~MeV/nucleon), the dynamic transport with a soft
EoS with momentum dependence and with the momentum-modified density-dependent
NNECS describes the directed flow exhibited by hydrogen isotopes ($Z=1$)
emitted at mid-rapidity fairly well.
","[{""version"":""v1"",""created"":""Sat, 29 Jan 2011 03:28:35 GMT""}]","2011-02-01"
"1101.5662","Noam D. Elkies","Noam D. Elkies, Daniel M. Kane, Scott D. Kominers","Minimal S-universality criteria may vary in size","5 pages",,,,"math.NT","http://arxiv.org/licenses/nonexclusive-distrib/1.0/","  In this note, we give simple examples of sets S of quadratic forms that have
minimal S-universality criteria of multiple cardinalities. This answers a
question of Kim, Kim, and Oh in the negative.
","[{""version"":""v1"",""created"":""Sat, 29 Jan 2011 03:28:40 GMT""}]","2011-02-01"
"1101.5663","Alexander Rubass","T. Fadeyeva, C. Alexeyev, B. Sokolenko, M. Kudryavtseva and A. Volyar","Non-canonical propagation of high-order elliptic vortex-beams in a
  uniaxial crystal","19 pages, 9 figures",,"10.3116/16091833/12/2/62/2011",,"physics.optics","http://arxiv.org/licenses/nonexclusive-distrib/1.0/","  We have derived the corresponding equations and found their solutions both
for nonparaxial and paraxial beams. The paraxial solutions we have presented in
the form of the generalized Hermite-Gaussian beams propagating perpendicular to
the optical axis of a uniaxial crystal. We have also constructed the
generalized Laguerre-Gaussian beams at the z=0 plane and analyzed their
evolution in a homogeneous isotropic medium. Comparing it with the evolution of
the standard Laguerre-Gaussian beams with and in the crystal we have revealed
that the additional elliptic deformation of the extraordinary beam results in
topological reactions that essentially distorts field structure for the account
of different rotation rates of the vortex row originated from the centered
degenerate optical vortex and the conoscopic pattern. We have predicted
conversion of the vortex topological charge at the beam axis similar to that in
astigmatic lenses and analyzed the radical differences with this process. We
have revealed the synchronic oscillations of the spin angular momentum and the
sign of the vortex topological charge at the beam axis.
","[{""version"":""v1"",""created"":""Sat, 29 Jan 2011 03:44:45 GMT""}]","2015-05-27"
"1101.5664","Changgan Zeng","Zhancheng Li, Ping Wu, Chenxi Wang, Xiaodong Fan, Wenhua Zhang,
  Xiaofang Zhai, Changgan Zeng, Zhenyu Li, Jinlong Yang, and J. G. Hou","Chemical Vapor Deposition Growth of Graphene using Other Hydrocarbon
  Sources","This paper has been withdrawn by the authors",,,,"cond-mat.mtrl-sci","http://creativecommons.org/licenses/by/3.0/","  Graphene has attracted a lot of research interests due to its exotic
properties and a wide spectrum of potential applications. Chemical vapor
deposition (CVD) from gaseous hydrocarbon sources has shown great promises for
large-scale graphene growth. However, high growth temperature, typically
1000{\deg}C, is required for such growth. Here we demonstrate a revised CVD
route to grow graphene on Cu foils at low temperature, adopting solid and
liquid hydrocarbon feedstocks. For solid PMMA and polystyrene precursors,
centimeter-scale monolayer graphene films are synthesized at a growth
temperature down to 400{\deg}C. When benzene is used as the hydrocarbon source,
monolayer graphene flakes with excellent quality are achieved at a growth
temperature as low as 300{\deg}C. The successful low-temperature growth can be
qualitatively understood from the first principles calculations. Our work might
pave a way to undemanding route for economical and convenient graphene growth.
","[{""version"":""v1"",""created"":""Sat, 29 Jan 2011 03:51:24 GMT""},{""version"":""v2"",""created"":""Mon, 28 Feb 2011 10:24:24 GMT""}]","2011-03-01"
"1101.5665","Robert Ducharme","Robert J. Ducharme","Integral Transforms in Relativistic Quantum Constraint Mechanics","10 pages",,,,"quant-ph","http://arxiv.org/licenses/nonexclusive-distrib/1.0/","  In relativistic quantum constraint mechanics the state of a physical system
is constrained to a 3-dimensional subspace of Minkowski 4-space. Fourier
transformation can be used to relate this state between constraint spaces in
4-position and 4-momentum space. It is shown that integral transforms of this
nature can be carried out using Lorentz-invariant 3-dimensional constraint
space coordinates such that a complete equivalence class of 4-space
representations can be constructed from the transform. This method is further
applied to develop a relativistic generalization of the Segal-Bargmann
transformation that leads to the representation of quantum systems in a
three-dimensional subspace of Bargmann 4-space.
","[{""version"":""v1"",""created"":""Sat, 29 Jan 2011 03:55:15 GMT""}]","2011-02-01"
"1101.5666","Andreas M{\o}gelh{\o}j","Andreas M{\o}gelh{\o}j, Andr\'e Kelkkanen, K. Thor Wikfeldt, Jakob
  Schi{\o}tz, Jens J{\o}rgen Mortensen, Lars G.M. Pettersson, Bengt I.
  Lundqvist, Karsten W. Jacobsen, Anders Nilsson and Jens K. N{\o}rskov","Ab initio van der Waals interactions in simulations of water alter
  structure from mainly tetrahedral to high-density-like",,,,,"cond-mat.mtrl-sci physics.chem-ph physics.comp-ph","http://arxiv.org/licenses/nonexclusive-distrib/1.0/","  The structure of liquid water at ambient conditions is studied in ab initio
molecular dynamics simulations using van der Waals (vdW) density-functional
theory, i.e. using the new exchange-correlation functionals optPBE-vdW and
vdW-DF2. Inclusion of the more isotropic vdW interactions counteracts highly
directional hydrogen-bonds, which are enhanced by standard functionals. This
brings about a softening of the microscopic structure of water, as seen from
the broadening of angular distribution functions and, in particular, from the
much lower and broader first peak in the oxygen-oxygen pair-correlation
function (PCF), indicating loss of structure in the outer solvation shells. In
combination with softer non-local correlation terms, as in the new
parameterization of vdW-DF, inclusion of vdW interactions is shown to shift the
balance of resulting structures from open tetrahedral to more close-packed. The
resulting O-O PCF shows some resemblance with experiment for high-density water
(A. K. Soper and M. A. Ricci, Phys. Rev. Lett., 84:2881, 2000), but not
directly with experiment for ambient water. However, an O-O PCF consisting of a
linear combination of 70% from vdW-DF2 and 30% from experiment on low-density
liquid water reproduces near-quantitatively the experimental O-O PCF for
ambient water, indicating consistency with a two-liquid model with fluctuations
between high- and low-density regions.
","[{""version"":""v1"",""created"":""Sat, 29 Jan 2011 04:19:20 GMT""},{""version"":""v2"",""created"":""Tue, 1 Feb 2011 03:13:36 GMT""},{""version"":""v3"",""created"":""Tue, 3 May 2011 17:23:55 GMT""}]","2011-05-04"
"1101.5667","Denis Konstantinov","Denis Konstantinov, A. D. Chepelianskii, Kimitoshi Kono","Resonant Photovoltaic Effect in Surface-State Electrons on Liquid Helium","4 figures; free access at http://jpsj.ipap.jp/link?JPSJ/81/093601","J. Phys. Soc. Jpn. 81, 093601 (2012)","10.1143/JPSJ.81.093601",,"cond-mat.mes-hall","http://arxiv.org/licenses/nonexclusive-distrib/1.0/","  We observed an ultra-strong photovoltaic effect induced by resonant
intersubband absorption of microwaves in a two-dimensional electrons system on
the surface of liquid helium. The effect emerges in the regime of
microwave-induced vanishing of dissipative conductance reported previously [D.
Konstantinov and K. Kono: Phys. Rev. Lett. 105 (2010) 226801)] and is
characterized by a nonequilibrium spatial distribution of electrons in the
confining electrostatic potential. The electrostatic energy acquired by an
electron exceeds other relevant energies by several orders of magnitude.
","[{""version"":""v1"",""created"":""Sat, 29 Jan 2011 04:39:12 GMT""},{""version"":""v2"",""created"":""Sun, 12 Aug 2012 04:58:05 GMT""}]","2015-05-27"
"1101.5668","Joshila Grace jebin","L.K. Joshila Grace, V.Maheswari, Dhinaharan Nagamalai","Analysis of Web Logs and Web User in Web Mining","12 pages,6 figures,CCSIT 2011","International Journal of Network Security & Its Applications
  (IJNSA), Vol.3, No.1, January 2011",,,"cs.DB","http://arxiv.org/licenses/nonexclusive-distrib/1.0/","  Log files contain information about User Name, IP Address, Time Stamp, Access
Request, number of Bytes Transferred, Result Status, URL that Referred and User
Agent. The log files are maintained by the web servers. By analysing these log
files gives a neat idea about the user. This paper gives a detailed discussion
about these log files, their formats, their creation, access procedures, their
uses, various algorithms used and the additional parameters that can be used in
the log files which in turn gives way to an effective mining. It also provides
the idea of creating an extended log file and learning the user behaviour.
","[{""version"":""v1"",""created"":""Sat, 29 Jan 2011 05:09:20 GMT""}]","2011-02-01"
"1101.5669","Matthew Klimek","Matthew D. Klimek, S. D. Points, R. C. Smith, R. L. Shelton, R.
  Williams","An X-ray Investigation of Three Supernova Remnants in the Large
  Magellanic Cloud",,"ApJ, 725, 2281-2289 (2010)","10.1088/0004-637X/725/2/2281",,"astro-ph.CO","http://arxiv.org/licenses/nonexclusive-distrib/1.0/","  We have investigated three SNRs in the LMC using multi-wavelength data. These
SNRs are generally fainter than the known sample and may represent a previously
missed population. One of our SNRs is the second LMC remnant analyzed which is
larger than any Galactic remnant for which a definite size has been
established. The analysis of such a large remnant contributes to the
understanding of the population of highly evolved SNRs. We have obtained X-ray
images and spectra of three of these recently identified SNRs using the
XMM-Newton observatory. These data, in conjunction with pre-existing optical
emission-line images and spectra, were used to determine the physical
conditions of the optical- and X-ray-emitting gas in the SNRs. We have compared
the morphologies of the SNRs in the different wavebands. The physical
properties of the warm ionized shell were determined from the H-alpha surface
brightness and the SNR expansion velocity. The X-ray spectra were fit with a
thermal plasma model and the physical conditions of the hot gas were derived
from the model fits. Finally, we have compared our observations with
simulations of SNR evolution.
","[{""version"":""v1"",""created"":""Sat, 29 Jan 2011 05:21:53 GMT""}]","2011-02-01"
"1101.5670","X. H. Chen","X. G. Luo, X. F. Wang, J. J. Ying, Y. J. Yan, Z. Y. Li, M. Zhang, A.
  F. Wang, P. Cheng, Z. J. Xiang, G. J. Ye, R. H. Liu and X. H. Chen","Crystal structure, physical properties and superconductivity in
  $A_{x}$Fe$_2$Se$_2$ single crystals","7 pages, 8 figures","New J. Phys. 13 (2011) 053011","10.1088/1367-2630/13/5/053011",,"cond-mat.supr-con cond-mat.mtrl-sci","http://arxiv.org/licenses/nonexclusive-distrib/1.0/","  We studied the correlation among structure and transport properties and
superconductivity in the different $A_x$Fe$_2$Se$_2$ single crystals ($A$ = K,
Rb, and Cs). Two sets of (00$l$) reflections are observed in the X-ray single
crystal diffraction patterns, and arise from the intrinsic inhomogeneous
distribution of the intercalated alkali atoms. The occurrence of
superconductivity is closely related to the {\sl c}-axis lattice constant, and
the $A$ content is crucial to superconductivity. The hump observed in
resistivity seems to be irrelevant to superconductivity. There exist many
deficiencies within the FeSe layers in $A_x$Fe$_2$Se$_2$, while their $T_{\rm
c}$ does not change so much. In this sense, superconductivity is robust to the
Fe and Se vacancies. Very high resistivity in the normal state should arise
from such defects in the conducting FeSe layers. $A_x$Fe$_2$Se$_2$ ($A$ = K,
Rb, and Cs) single crystals show the same susceptibility behavior in the normal
state, and no anomaly is observed in susceptibility at the hump temperature in
resistivity. The clear jump in specific heat for Rb$_x$Fe$_2$Se$_2$ and
K$_x$Fe$_2$Se$_2$ single crystals shows the good bulk superconductivity in
these crystals.
","[{""version"":""v1"",""created"":""Sat, 29 Jan 2011 05:55:35 GMT""}]","2011-07-26"
"1101.5671","Joshua E. Barnes","Joshua E. Barnes","Identikit 2: An Algorithm for Reconstructing Galactic Collisions","14 pages, 8 figures. Accepted for publication in MNRAS. To get a copy
  with high-resolution figures, use the web interface, or download the
  Identikit software, visit
  http://www.ifa.hawaii.edu/faculty/barnes/research/identikit/",,"10.1111/j.1365-2966.2011.18358.x",,"astro-ph.CO","http://arxiv.org/licenses/nonexclusive-distrib/1.0/","  Using a combination of self-consistent and test-particle techniques,
Identikit 1 provided a way to vary the initial geometry of a galactic collision
and instantly visualize the outcome. Identikit 2 uses the same techniques to
define a mapping from the current morphology and kinematics of a tidal
encounter back to the initial conditions. By requiring that various regions
along a tidal feature all originate from a single disc with a unique
orientation, this mapping can be used to derive the initial collision geometry.
In addition, Identikit 2 offers a robust way to measure how well a particular
model reproduces the morphology and kinematics of a pair of interacting
galaxies. A set of eight self-consistent simulations is used to demonstrate the
algorithm's ability to search a ten-dimensional parameter space and find
near-optimal matches; all eight systems are successfully reconstructed.
","[{""version"":""v1"",""created"":""Sat, 29 Jan 2011 06:04:35 GMT""}]","2015-05-27"
"1101.5672","John Wright","Quan Geng and Huan Wang and John Wright","On the Local Correctness of L^1 Minimization for Dictionary Learning","37 pages, 1 figure",,,,"cs.IT cs.LG math.IT","http://arxiv.org/licenses/nonexclusive-distrib/1.0/","  The idea that many important classes of signals can be well-represented by
linear combinations of a small set of atoms selected from a given dictionary
has had dramatic impact on the theory and practice of signal processing. For
practical problems in which an appropriate sparsifying dictionary is not known
ahead of time, a very popular and successful heuristic is to search for a
dictionary that minimizes an appropriate sparsity surrogate over a given set of
sample data. While this idea is appealing, the behavior of these algorithms is
largely a mystery; although there is a body of empirical evidence suggesting
they do learn very effective representations, there is little theory to
guarantee when they will behave correctly, or when the learned dictionary can
be expected to generalize. In this paper, we take a step towards such a theory.
We show that under mild hypotheses, the dictionary learning problem is locally
well-posed: the desired solution is indeed a local minimum of the $\ell^1$
norm. Namely, if $\mb A \in \Re^{m \times n}$ is an incoherent (and possibly
overcomplete) dictionary, and the coefficients $\mb X \in \Re^{n \times p}$
follow a random sparse model, then with high probability $(\mb A,\mb X)$ is a
local minimum of the $\ell^1$ norm over the manifold of factorizations $(\mb
A',\mb X')$ satisfying $\mb A' \mb X' = \mb Y$, provided the number of samples
$p = \Omega(n^3 k)$. For overcomplete $\mb A$, this is the first result showing
that the dictionary learning problem is locally solvable. Our analysis draws on
tools developed for the problem of completing a low-rank matrix from a small
subset of its entries, which allow us to overcome a number of technical
obstacles; in particular, the absence of the restricted isometry property.
","[{""version"":""v1"",""created"":""Sat, 29 Jan 2011 06:06:56 GMT""}]","2015-03-18"
"1101.5673","Masashi Kimura","Hiroshi Tsunemi, Hiroshi Tomida, Haruyoshi Katayama, Masashi Kimura,
  Arata Daikyuji, Kazuhisa Miyaguchi, Kentaro Maeda (and MAXI Team)","In Orbit Performance of the MAXI/SSC onboard the ISS","15 pages 11 figures",,"10.1093/pasj/62.6.1371",,"astro-ph.IM","http://arxiv.org/licenses/nonexclusive-distrib/1.0/","  We report here the in orbit performance of the CCD camera (MAXI/SSC) onboard
the International Space Station (ISS). It was commissioned in August, 2009.
This is the first all-sky survey mission employing X-ray CCDs. It consists of
32 CCDs each of which is 1 inch square. It is a slit camera with a field of
view of 1deg.5x 90deg and scans the sky as the rotation of the ISS. The CCD on
the SSC is cooled down to the working temperature around -60degC by the
combination of the peltier cooler, a loop heat pipe and a radiator. The
standard observation mode of the CCD is in a parallel sum mode (64-binning).
The CCD functions properly although it suffers an edge glow when the Sun is
near the field of view (FOV) which reduces the observation efficiency of the
SSC down to about 30%. The performance of the CCD is continuously monitored
both by the Mn-K X-rays and by the Cu-K X-rays. There are many sources
detected, not only point sources but extended sources. Due to the lack of the
effective observation time, we need more observation time to obtain an extended
emission analysis extraction process.
","[{""version"":""v1"",""created"":""Sat, 29 Jan 2011 06:33:13 GMT""}]","2015-05-27"
"1101.5674","Mohsen Nejad-Asghar","Mohsen Nejad-Asghar","Formation of low-mass condensations in the molecular cloud cores via
  thermal instability","24 pages, 6 figures, accepted by MNRAS",,"10.1111/j.1365-2966.2011.18412.x",,"astro-ph.GA","http://arxiv.org/licenses/nonexclusive-distrib/1.0/","  The low-mass condensations (LMCs) have been observed within the molecular
cloud cores. In this research, we investigate the effect of isobaric thermal
instability (TI) applied for forming these LMCs. For this purpose, at first we
investigate the occurrence of TI in the molecular clouds. Then, for studying
the significance of linear isobaric TI, we use a contracting axisymmetric
cylindrical core with axial magnetic field. Consideration to cooling and
heating mechanisms in the molecular clouds shows that including the heating due
to ambipolar diffusion can lead to the occurrence of TI in a time-scale smaller
than dynamical time-scale. Application of linear perturbation analysis shows
that isobaric TI can take place in outer region of the molecular cloud cores.
Furthermore, the results showthat perturbations with wavelengths greater than
few astronomical units are protected from destabilization property of thermal
conduction, so they can grow to form LMCs. Thus, the results show that the
mechanism of TI can be used to explain the formation of LMCs as the progenitors
of collapsing proto-stellar entities, brown dwarfs, or proto-planets.
","[{""version"":""v1"",""created"":""Sat, 29 Jan 2011 06:41:44 GMT""}]","2015-05-27"
"1101.5675","Imdadullah Khan","Imdadullah Khan","Perfect Matchings in 4-uniform hypergraphs",,,,,"cs.DM math.CO","http://arxiv.org/licenses/nonexclusive-distrib/1.0/","  A perfect matching in a 4-uniform hypergraph is a subset of
$\lfloor\frac{n}{4}\rfloor$ disjoint edges. We prove that if $H$ is a
sufficiently large 4-uniform hypergraph on $n=4k$ vertices such that every
vertex belongs to more than ${n-1\choose 3} - {3n/4 \choose 3}$ edges then $H$
contains a perfect matching. This bound is tight and settles a conjecture of
H{\'a}n, Person and Schacht.
","[{""version"":""v1"",""created"":""Sat, 29 Jan 2011 07:02:52 GMT""},{""version"":""v2"",""created"":""Tue, 1 Feb 2011 10:38:29 GMT""}]","2015-03-18"
"1101.5676","P C Vinodkumar","Kaushal Thakkar, Ajay Majethiya and P. C. Vinodkumar","Electromagnetic transition properties of $\Delta \rightarrow N\gamma$ in
  a hypercentral scheme",,"Chinese Physics C 36(5): 385-389 (2012)","10.1088/1674-1137/36/5/001",,"hep-ph","http://arxiv.org/licenses/nonexclusive-distrib/1.0/","  The electromagnetic transition properties of the decuplet to octet baryon
($\Delta \rightarrow N\gamma$) is studied within the frame work of a
hypercentral quark model. The confinement potential is assumed as hypercentral
coloumb plus linear potential. The transition magnetic moment and transition
amplitude $f_{M_1}$ for the $\Delta \rightarrow N\gamma$ are in agreement with
other theoretical predictions. The present result of the radiative decay width
is found to be in excellent agreement with the experimental values reported by
the particle data group over other theoretical model predictions.
","[{""version"":""v1"",""created"":""Sat, 29 Jan 2011 07:07:25 GMT""},{""version"":""v2"",""created"":""Sat, 28 Jul 2012 11:26:11 GMT""}]","2012-07-31"
"1101.5677","Thomas J. Weiler","D.J. Wagner and T.J. Weiler","Neutrino Oscillations form Cosmic Sources: a Nu Window to Cosmology","We (the authors) occasionally get requests for this 5 page essay from
  1997, so on the arXiv it goes","Mod. Phys. Lett. A12, 2497 (1997)","10.1142/S0217732397002624",,"astro-ph.CO gr-qc hep-ph","http://arxiv.org/licenses/nonexclusive-distrib/1.0/","  In this essay we extend the standard discussion of neutrino oscillations to
astrophysical neutrinos propagating through expanding space. This extension
introduces a new cosmological parameter $I$ into the oscillation phase. The new
parameter records cosmic history in much the same manner as the redshift z or
the apparent luminosity D_L. Measuring $I$ through neutrino oscillations could
help determine cosmological parameters and discriminate among different
cosmologies.
","[{""version"":""v1"",""created"":""Sat, 29 Jan 2011 07:22:05 GMT""}]","2015-05-27"
