"1101.5603","Volodymyr Nekrashevych","Volodymyr Nekrashevych","Hyperbolic groupoids and duality","120 pages, 28 figures",,,,"math.DS","http://arxiv.org/licenses/nonexclusive-distrib/1.0/","  We define hyperbolic groupoids, generalizing the notion of a Gromov
hyperbolic group. Examples of hyperbolic groupoids include actions of Gromov
hyperbolic groups on their boundaries, pseudogroups generated by expanding
self-coverings, natural pseudogroups acting on leaves of stable (or unstable)
foliation of an Anosov diffeomorphism, e.t.c.. We show that for every
hyperbolic groupoid G there is a naturally defined dual groupoid G' acting on
the Gromov boundary of a Cayley graph of G, which is also hyperbolic and such
that (G')' is equivalent to G.
","[{""version"":""v1"",""created"":""Fri, 28 Jan 2011 18:38:17 GMT""},{""version"":""v2"",""created"":""Mon, 22 Aug 2011 22:48:52 GMT""},{""version"":""v3"",""created"":""Thu, 15 Nov 2012 21:37:54 GMT""},{""version"":""v4"",""created"":""Thu, 19 Dec 2013 17:14:32 GMT""}]","2013-12-20"
"1101.5604","Gustavo Gil da Silveira G.G. Silveira","M.B. Gay Ducati and G.G. Silveira","Higgs boson photoproduction at the LHC","To appear in the proceedings of Diffraction 2010: International
  Workshop on Diffraction in High Energy Physics, Otranto, Italy, 10-15 Sep
  2010",,"10.1063/1.3601392",,"hep-ph","http://arxiv.org/licenses/nonexclusive-distrib/1.0/","  We present the current development of the photoproduction approach for the
Higgs boson with its application to $pp$ and $pA$ collisions at the LHC. We
perform a different analysis for the Gap Survival Probability, where we
consider a probability of 3% and also a more optimistic value of 10% based on
the HERA data for dijet production. As a result, the cross section for the
exclusive Higgs boson production is about 2 fb and 6 fb in $pp$ collisions and
617 and 2056 fb for $p$Pb collisions, considering the gap survival factor of 3%
and 10%, respectively.
","[{""version"":""v1"",""created"":""Fri, 28 Jan 2011 18:45:24 GMT""}]","2015-05-27"
"1101.5605","Gustavo Gil da Silveira G.G. Silveira","M.B. Gay Ducati, M.M. Machado and G.G. Silveira","Single and Central Diffractive Higgs Production at the LHC","To appear in the proceedings of Diffraction 2010: International
  Workshop on Diffraction in High Energy Physics, Otranto, Italy, 10-15 Sep
  2010",,"10.1063/1.3601391",,"hep-ph","http://arxiv.org/licenses/nonexclusive-distrib/1.0/","  The single and central diffractive production of the Standard Model Higgs
boson is computed using the diffractive factorization formalism, taking into
account a parametrization for the Pomeron structure function provided by the H1
Collaboration. We compute the cross sections at NLO accuracy for the gluon
fusion process, since it is the leading mechanism for the Higgs boson
production. The gap survival probability is also introduced to include the
rescattering corrections due to spectator particles present in the interaction.
The diffractive ratios are predicted for proton-proton collisions at the LHC,
since the beam luminosity is favorable to the Higgs boson detection. These
results provide updated estimations for the fraction of single and central
diffractive events in the LHC kinematical regime.
","[{""version"":""v1"",""created"":""Fri, 28 Jan 2011 18:49:45 GMT""}]","2015-05-27"
"1101.5606","Fridolin Weber","F. Weber (SDSU) and R. Negreiros (FIAS)","QCD in neutron stars and strange stars","7 pages, 2 figures; presented at the T(R)OPICAL QCD Workshop,
  September 26 - October 2, 2010, Cairns, Australia",,"10.1063/1.3587579",,"astro-ph.HE hep-ph nucl-th","http://arxiv.org/licenses/nonexclusive-distrib/1.0/","  This paper provides an overview of the possible role of Quantum Chromo
Dynamics (QDC) for neutron stars and strange stars. The fundamental degrees of
freedom of QCD are quarks, which may exist as unconfined (color
superconducting) particles in the cores of neutron stars. There is also the
theoretical possibility that a significantly large number of up, down, and
strange quarks may settle down in a new state of matter known as strange quark
matter, which, by hypothesis, could be more stable than atomic nuclei. In the
latter case new classes of self-bound, color superconducting objects, ranging
from strange quark nuggets to strange quark stars, should exist. The properties
of such objects will be reviewed along with the possible existence of
deconfined quarks in neutron stars. Implications for observational astrophysics
are pointed out.
","[{""version"":""v1"",""created"":""Fri, 28 Jan 2011 18:52:30 GMT""}]","2015-05-27"
"1101.5607","Alexander Shumakovitch","Alexander N. Shumakovitch","Patterns in odd Khovanov homology","17 pages, 12 figures; v.3: Journal reference is added, references are
  updated","J. Knot Th. and Ramif. 20 (2011) no. 1, 203--222",,,"math.GT math.QA math.SG","http://arxiv.org/licenses/nonexclusive-distrib/1.0/","  We investigate properties of the odd Khovanov homology, compare and contrast
them with those of the original (even) Khovanov homology, and discuss
applications of the odd Khovanov homology to other areas of knot theory and
low-dimensional topology. We show that it provides an effective upper bound on
the Thurston-Bennequin number of Legendrian links and can be used to detect
quasi-alternating knots. A potential application to detecting transversely
non-simple knots is also mentioned.
","[{""version"":""v1"",""created"":""Fri, 28 Jan 2011 19:00:21 GMT""},{""version"":""v2"",""created"":""Tue, 1 Feb 2011 17:32:36 GMT""},{""version"":""v3"",""created"":""Tue, 19 Jun 2018 17:37:56 GMT""}]","2018-06-20"
"1101.5608","Matthieu Josuat-Verg\`es","Matthieu Josuat-Verg\`es and Jang Soo Kim","Touchard-Riordan formulas, T-fractions, and Jacobi's triple product
  identity","29 pages","Ramanujan Journal 30(3) (2013), 341--378",,,"math.CO","http://arxiv.org/licenses/nonexclusive-distrib/1.0/","  Touchard-Riordan-like formulas are some expressions appearing in enumeration
problems and as moments of orthogonal polynomials. We begin this article with a
new combinatorial approach to prove these kind of formulas, related with
integer partitions. This gives a new perspective on the original result of
Touchard and Riordan. But the main goal is to give a combinatorial proof of a
Touchard-Riordan--like formula for q-secant numbers discovered by the first
author. An interesting limit case of these objects can be directly interpreted
in terms of partitions, so that we obtain a connection between the formula for
q-secant numbers, and a particular case of Jacobi's triple product identity.
  Building on this particular case, we obtain a ""finite version"" of the triple
product identity. It is in the form of a finite sum which is given a
combinatorial meaning, so that the triple product identity can be obtained by
taking the limit. Here the proof is non-combinatorial and relies on a
functional equation satisfied by a T-fraction. Then from this result on the
triple product identity, we derive a whole new family of Touchard-Riordan--like
formulas whose combinatorics is not yet understood. Eventually, we prove a
Touchard-Riordan--like formula for a q-analog of Genocchi numbers, which is
related with Jacobi's identity for (q;q)^3 rather than the triple product
identity.
","[{""version"":""v1"",""created"":""Fri, 28 Jan 2011 19:10:13 GMT""}]","2017-09-13"
"1101.5609","S. I. Kruglov","S. I. Kruglov","A note on generalized electrodynamics","17 pages, typos corrected, extended version, references added","Electronic Journal of Theoretical Physics - Zacatecas Proc. II
  (2011) 107-120",,,"hep-th gr-qc hep-ph","http://arxiv.org/licenses/nonexclusive-distrib/1.0/","  The generalized Maxwell equations with arbitrary gauge parameter are
considered in the $11\times 11$-matrix form. The gauge invariance of such a
model is broken due to the presence of a scalar field. The canonical and
symmetrical Belinfante energy-momentum tensors are found. The dilatation
current is obtained and we demonstrate that the theory possesses the dilatation
symmetry. The matrix Schr\""{o}dinger form of equations is derived. The
non-minimal interaction in curved space-time is introduced and equations are
considered in Friedmann - Robertson - Walker background. We obtain some
solutions of equations for the vector field.
","[{""version"":""v1"",""created"":""Fri, 28 Jan 2011 19:12:07 GMT""},{""version"":""v2"",""created"":""Fri, 8 Apr 2011 13:54:25 GMT""}]","2012-02-22"
"1101.5610","Benjamin B\'eri","B. B\'eri, N. R. Cooper","Local tensor network for strongly correlated projective states","4 pages","Phys. Rev. Lett. 106, 156401 (2011)","10.1103/PhysRevLett.106.156401",,"cond-mat.str-el","http://arxiv.org/licenses/nonexclusive-distrib/1.0/","  The success of tensor network approaches in simulating strongly correlated
quantum systems crucially depends on whether the many body states that are
relevant for the problem can be encoded in a local tensor network. Despite
numerous efforts, strongly correlated projective states, fractional quantum
Hall states in particular, have not yet found a local tensor network
representation. Here we show that one can encode the calculation of averages of
local operators in a Grassmann tensor network which is local. Our construction
is explicit, and allows the use of physically motivated trial wavefunctions as
starting points in tensor network variational calculations.
","[{""version"":""v1"",""created"":""Fri, 28 Jan 2011 19:15:07 GMT""}]","2011-04-14"
"1101.5611","Ilya Lvovich Shapiro","C. Farina, W. J. M. Kort-Kamp, Sebastiao Mauro Filho and Ilya L.
  Shapiro","Dynamics of the Laplace-Runge-Lenz vector in the quantum-corrected
  Newton gravity","A few misprints corrected in the new version. 12 pages","Phys.Rev.D83:124037,2011","10.1103/PhysRevD.83.124037",,"gr-qc astro-ph.EP","http://arxiv.org/licenses/nonexclusive-distrib/1.0/","  Recently it was shown that quantum corrections to the Newton potential can
explain the rotation curves in spiral galaxies without introducing the Dark
Matter halo. The unique phenomenological parameter $\al\nu$ of the theory grows
with the mass of the galaxy. In order to better investigate the mass-dependence
of $\al\nu$ one needs to check the upper bound for $\al\nu$ at a smaller scale.
Here we perform the corresponding calculation by analyzing the dynamics of the
Laplace-Runge-Lenz vector. The resulting limitation on quantum corrections is
quite severe, suggesting a strong mass-dependence of $\al\nu$.
","[{""version"":""v1"",""created"":""Fri, 28 Jan 2011 19:34:05 GMT""},{""version"":""v2"",""created"":""Wed, 2 Feb 2011 11:10:02 GMT""}]","2011-07-08"
"1101.5612","Carlo Luciano Bianco","Gustavo De Barros, Lorenzo Amati, Maria Grazia Bernardini, Carlo
  Luciano Bianco, Letizia Caito, Luca Izzo, Barbara Patricelli, Remo Ruffini","On the nature of GRB 050509b: a disguised short GRB","6 pages, 6 figures, to appear in A&A. New version with some typo
  mistakes fixed and updated references","Astron.Astrophys. 529 (2011) A130","10.1051/0004-6361/201116659",,"astro-ph.HE astro-ph.CO","http://arxiv.org/licenses/nonexclusive-distrib/1.0/","  (shortened) Context: GRB GRB 050509b, detected by the \emph{Swift} satellite,
is the first case where an X-ray afterglow has been observed associated with a
short gamma-ray burst (GRB). Within the fireshell model, the canonical GRB
light curve presents two different components: the proper-GRB (P-GRB) and the
extended afterglow. [...] In particular, the traditionally called short GRBs
can be either ""genuine"" short GRBs [...] or ""disguised"" short GRBs [...]. AIMS:
We verify whether GRB 050509b can be classified as a ""genuine"" short or a
""disguised"" short GRB, in the fireshell model. Methods: We investigate two
alternative scenarios. In the first, we start from the assumption that this GRB
is a ""genuine"" short burst. In the second attempt, we assume that this GRB is a
""disguised"" burst. Results: If GRB 050509b were a genuine short GRB, there
should initially be very hard emission which is ruled out by the observations.
The analysis that assumes that this is a disguised short GRB is compatible with
the observations. The theoretical model predicts a value of the extended
afterglow energy peak that is consistent with the Amati relation. Conclusions:
GRB 050509b cannot be classified as a ""genuine"" short GRB. The observational
data are consistent with a ""disguised"" short GRB classification, i.e., a long
burst with a weak extended afterglow ""deflated"" by the low density of the CBM.
We expect that all short GRBs with measured redshifts are disguised short GRBs
because of a selection effect: if there is enough energy in the afterglow to
measure the redshift, then the proper GRB must be less energetic than the
afterglow. The Amati relation is found to be fulfilled only by the extended
afterglow excluding the P-GRB.
","[{""version"":""v1"",""created"":""Fri, 28 Jan 2011 19:45:20 GMT""},{""version"":""v2"",""created"":""Fri, 4 Feb 2011 18:37:46 GMT""},{""version"":""v3"",""created"":""Tue, 15 Mar 2011 13:31:32 GMT""},{""version"":""v4"",""created"":""Wed, 30 Mar 2011 15:22:58 GMT""},{""version"":""v5"",""created"":""Mon, 11 Apr 2011 11:32:16 GMT""}]","2011-04-19"
"1101.5613","Syed (Shawon) Rahman","Anthony Bisong and Syed (Shawon) M. Rahman","An Overview of the Security Concerns in Enterprise Cloud Computing",,"International Journal of Network Security & Its Applications
  (IJNSA), Vol.3, No.1, January 2011","10.5121/ijnsa.2011.3103",,"cs.CR cs.CY cs.NI cs.SE","http://arxiv.org/licenses/nonexclusive-distrib/1.0/","  Deploying cloud computing in an enterprise infrastructure bring significant
security concerns. Successful implementation of cloud computing in an
enterprise requires proper planning and understanding of emerging risks,
threats, vulnerabilities, and possible countermeasures. We believe enterprise
should analyze the company/organization security risks, threats, and available
countermeasures before adopting this technology. In this paper, we have
discussed security risks and concerns in cloud computing and enlightened steps
that an enterprise can take to reduce security risks and protect their
resources. We have also explained cloud computing strengths/benefits,
weaknesses, and applicable areas in information risk management.
","[{""version"":""v1"",""created"":""Fri, 28 Jan 2011 19:49:30 GMT""}]","2011-01-31"
"1101.5614","Alexander Shumakovitch","Alexander Shumakovitch","Khovanov homology theories and their applications","24 pages, 15 figures; to appear in the Proceeding of ""Perspectives in
  Analysis, Geometry and Topology"", Progress in Mathematics,
  Springer/Birkhauser",,,,"math.GT","http://arxiv.org/licenses/nonexclusive-distrib/1.0/","  This is an expository paper discussing various versions of Khovanov homology
theories, interrelations between them, their properties, and their applications
to other areas of knot theory and low-dimensional topology.
","[{""version"":""v1"",""created"":""Fri, 28 Jan 2011 20:06:38 GMT""}]","2011-01-31"
"1101.5615","Tonica Valla","Z.-H. Pan, E. Vescovo, A. V. Fedorov, D. Gardner, Y.S. Lee, S. Chu, G.
  D. Gu and T. Valla","Electronic Structure of the Topological Insulator Bi2Se3 Using
  Angle-Resolved Photoemission Spectroscopy: Evidence for a Nearly Full Surface
  Spin Polarization","published version, 4 pages, 4 figures","Phys. Rev. Lett. 106, 257004 (2011)","10.1103/PhysRevLett.106.257004",,"cond-mat.str-el cond-mat.mtrl-sci cond-mat.quant-gas","http://arxiv.org/licenses/nonexclusive-distrib/1.0/","  We performed high-resolution spin- and angle-resolved photoemission
spectroscopy studies of the electronic structure and the spin texture on the
surface of Bi$_2$Se$_3$, a model topological insulator. By tuning the photon
energy, we found that the topological surface state is well separated from the
bulk states in the vicinity of $k_z=Z$ plane of the bulk Brillouin zone. The
spin-resolved measurements in that region indicate a very high degree of spin
polarization of the surface state, $\sim 0.75$, much higher than previously
reported. Our results demonstrate that the topological surface state on
Bi$_2$Se$_3$ is highly spin polarized and that the dominant factors limiting
the polarization are mainly extrinsic.
","[{""version"":""v1"",""created"":""Fri, 28 Jan 2011 20:23:18 GMT""},{""version"":""v2"",""created"":""Tue, 27 Sep 2011 19:39:01 GMT""}]","2011-09-28"
"1101.5616","Hechang Lei","Hechang Lei, Milinda Abeykoon, Emil S. Bozin, and C. Petrovic","Spin glass behavior of insulating K0.8Fe2-xS2","4 pages, 4 figures","Phys. Rev. B 83 180503(R) (2011)","10.1103/PhysRevB.83.180503",,"cond-mat.supr-con cond-mat.mtrl-sci cond-mat.str-el","http://arxiv.org/licenses/nonexclusive-distrib/1.0/","  We report the discovery of KxFe2-yS2 single crystals, isostructural to
KxFe2-ySe2 superconductors. The sulfide compound is a small gap semiconductor
and shows spin-glass behavior below 32 K. Our results indicate that
stoichiometry, defects, and the local environment of FeCh (Ch = S,Se)
tetrahedra have important effects on the physical properties of isostructural
and isoelectronic KxFe2-yCh2 compounds.
","[{""version"":""v1"",""created"":""Fri, 28 Jan 2011 20:30:46 GMT""},{""version"":""v2"",""created"":""Mon, 16 May 2011 22:29:57 GMT""}]","2011-05-18"
"1101.5617","Ozan Candogan","Ozan Candogan, Kostas Bimpikis, Asuman Ozdaglar","Optimal Pricing in Networks with Externalities","29 pages",,,"LIDS pub# 2854","cs.GT cs.NI","http://arxiv.org/licenses/nonexclusive-distrib/1.0/","  We study the optimal pricing strategies of a monopolist selling a divisible
good (service) to consumers that are embedded in a social network. A key
feature of our model is that consumers experience a (positive) local network
effect. In particular, each consumer's usage level depends directly on the
usage of her neighbors in the social network structure. Thus, the monopolist's
optimal pricing strategy may involve offering discounts to certain agents, who
have a central position in the underlying network.
  First, we consider a setting where the monopolist can offer individualized
prices and derive an explicit characterization of the optimal price for each
consumer as a function of her network position. In particular, we show that it
is optimal for the monopolist to charge each agent a price that is proportional
to her Bonacich centrality in the social network. In the second part of the
paper, we discuss the optimal strategy of a monopolist that can only choose a
single uniform price for the good and derive an algorithm polynomial in the
number of agents to compute such a price. Thirdly, we assume that the
monopolist can offer the good in two prices, full and discounted, and study the
problem of determining which set of consumers should be given the discount. We
show that the problem is NP-hard, however we provide an explicit
characterization of the set of agents that should be offered the discounted
price. Next, we describe an approximation algorithm for finding the optimal set
of agents. We show that if the profit is nonnegative under any feasible price
allocation, the algorithm guarantees at least 88% of the optimal profit.
Finally, we highlight the value of network information by comparing the profits
of a monopolist that does not take into account the network effects when
choosing her pricing policy to those of a monopolist that uses this information
optimally.
","[{""version"":""v1"",""created"":""Fri, 28 Jan 2011 20:31:42 GMT""}]","2011-01-31"
"1101.5618","Yinan Zhang","Yinan Zhang, Irfan Bulu, Wai-Ming Tam, Ben Levitt, Jagdish Shah,
  Tancredi Botto, Marko Loncar","High-Q/V air-mode photonic crystal cavities at microwave frequencies","10 pages, 4 figures",,"10.1364/OE.19.009371",,"physics.optics","http://arxiv.org/licenses/nonexclusive-distrib/1.0/","  We present results for a photonic microwave resonator designed and fabricated
at 17.4GHz with a record high Quality factor (Q = 26,400) at room temperature
over a mode volume smaller than one cubic wavelength. The cavity is uniquely
designed to have its electric field concentrated in air, which allows for
efficient coupling to free space and facilitates interactions with gaseous
atomic systems and fluids.
","[{""version"":""v1"",""created"":""Fri, 28 Jan 2011 20:43:30 GMT""}]","2015-05-27"
"1101.5619","Noah Forman","Noah Forman, Chris Haulk, Jim Pitman","A representation of exchangeable hierarchies by sampling from real trees","29 pages, 6 figures",,,,"math.PR","http://arxiv.org/licenses/nonexclusive-distrib/1.0/","  A hierarchy on a set $S$, also called a total partition of $S$, is a
collection $\mathcal{H}$ of subsets of $S$ such that $S \in \mathcal{H}$, each
singleton subset of $S$ belongs to $\mathcal{H}$, and if $A, B \in \mathcal{H}$
then $A \cap B$ equals either $A$ or $B$ or $\varnothing$. Every exchangeable
random hierarchy of positive integers has the same distribution as a random
hierarchy $\mathcal{H}$ associated as follows with a random real tree
$\mathcal{T}$ equipped with root element $0$ and a random probability
distribution $p$ on the Borel subsets of $\mathcal{T}$: given
$(\mathcal{T},p)$, let $t_1,t_2, ...$ be independent and identically
distributed according to $p$, and let $\mathcal{H}$ comprise all singleton
subsets of $\mathbb{N}$, and every subset of the form $\{j: t_j \in F_x\}$ as
$x$ ranges over $\mathcal{T}$, where $F_x$ is the fringe subtree of
$\mathcal{T}$ rooted at $x$. There is also the alternative characterization:
every exchangeable random hierarchy of positive integers has the same
distribution as a random hierarchy $\mathcal{H}$ derived as follows from a
random hierarchy $\mathscr{H}$ on $[0,1]$ and a family $(U_j)$ of IID uniform
[0,1] random variables independent of $\mathscr{H}$: let $\mathcal{H}$ comprise
all sets of the form $\{j: U_j \in B\}$ as $B$ ranges over the members of
$\mathscr{H}$.
","[{""version"":""v1"",""created"":""Fri, 28 Jan 2011 20:45:07 GMT""},{""version"":""v2"",""created"":""Sun, 29 Nov 2015 16:36:12 GMT""},{""version"":""v3"",""created"":""Wed, 22 Feb 2017 22:44:16 GMT""},{""version"":""v4"",""created"":""Wed, 13 Sep 2017 00:43:29 GMT""}]","2017-09-14"
"1101.5620","David Anderson","D. R. Anderson, A. M. S. Smith, A. A. Lanotte, T. S. Barman, C. J.
  Campo, A. Collier Cameron, M. Gillon, J. Harrington, C. Hellier, P. F. L.
  Maxted, D. Queloz, A. H. M. J. Triaud, P. J. Wheatley","Thermal emission at 4.5 and 8 micron of WASP-17b, an extremely large
  planet in a slightly eccentric orbit","Accepted for publication in MNRAS (16 pages, 12 figures, 6 tables)",,"10.1111/j.1365-2966.2011.19182.x",,"astro-ph.EP","http://arxiv.org/licenses/nonexclusive-distrib/1.0/","  We report the detection of thermal emission at 4.5 and 8 micron from the
planet WASP-17b. We used Spitzer to measure the system brightness at each
wavelength during two occultations of the planet by its host star. By combining
the resulting light curves with existing transit light curves and radial
velocity measurements in a simultaneous analysis, we find the radius of
WASP-17b to be 2.0 Rjup, which is 0.2 Rjup larger than any other known planet
and 0.7 Rjup larger than predicted by the standard cooling theory of irradiated
gas giant planets. We find the retrograde orbit of WASP-17b to be slightly
eccentric, with 0.0012 < e < 0.070 (3 sigma). Such a low eccentricity suggests
that, under current models, tidal heating alone could not have bloated the
planet to its current size, so the radius of WASP-17b is currently unexplained.
From the measured planet-star flux-density ratios we infer 4.5 and 8 micron
brightness temperatures of 1881 +/- 50 K and 1580 +/- 150 K, respectively,
consistent with a low-albedo planet that efficiently redistributes heat from
its day side to its night side.
","[{""version"":""v1"",""created"":""Fri, 28 Jan 2011 20:45:36 GMT""},{""version"":""v2"",""created"":""Fri, 3 Jun 2011 16:43:00 GMT""}]","2015-05-27"
"1101.5621","Henning Bruhn","Henning Bruhn and Paul Wollan","Finite connectivity in infinite matroids","16 pages",,,,"math.CO","http://arxiv.org/licenses/nonexclusive-distrib/1.0/","  We introduce a connectivity function for infinite matroids with properties
similar to the connectivity function of a finite matroid, such as submodularity
and invariance under duality. As an application we use it to extend Tutte's
linking theorem to finitary and to co-finitary matroids.
","[{""version"":""v1"",""created"":""Fri, 28 Jan 2011 20:52:59 GMT""}]","2011-01-31"
