"1101.5748","Wonwoo Lee","Bogeun Gwak, Bum-Hoon Lee, Wonwoo Lee, and Masato Minamitsuji","Creation of a black hole pair with a domain wall","23 pages, 11 figures, Some typos corrected and references added with
  respect to the published version","Phys.Rev.D84:045020,2011","10.1103/PhysRevD.84.045020","CQUeST-2011-0422","gr-qc hep-th","http://arxiv.org/licenses/nonexclusive-distrib/1.0/","  We study the creation of a black hole (BH) pair separated by a domain wall,
in the presence of a cosmological constant. We construct the solution
representing a BH pair with a domain wall and compute the Euclidean action to
evaluate the probability of the pair creation in the background with a
preexisting domain wall. The BHs can be either neutral or magnetically charged
ones. We compare the results of the charged case with those of the neutral case
with the same cosmological constant. We find that the production rate of a
charged BH pair is always suppressed in comparison with that of the neutral one
in both four and five dimensions, irrespective of the sign of the cosmological
constant. The Euclidean action is equal to the minus of the entropy. Since the
horizon area of a BH is decreased as the magnitude of its charge is increased
in general, the decreasing creation rate can be understood in terms of the
increasing charge. We obtain the explicit confirmation on the relation between
the pair creation rate of the charged BHs and the area of horizons in both the
four- and five-dimensional cases in the presence of a cosmological constant.
The singularity of the domain wall universe with charged BHs, as distinct from
that with neutral BHs, can be avoided.
","[{""version"":""v1"",""created"":""Sun, 30 Jan 2011 06:41:38 GMT""},{""version"":""v2"",""created"":""Tue, 23 Aug 2011 05:31:57 GMT""}]","2011-09-12"
"1101.5749","Iv\'an Mart\'i-Vidal Dr.","I. Marti-Vidal, J.M. Marcaide, A. Quirrenbach, K. Ohnaka, J.C.
  Guirado, M. Wittkowski","AMBER observations of the AGB star RS Cap: extended atmosphere and
  comparison with stellar models","8 pages, 6 figures. Accepted for publication in A&A",,"10.1051/0004-6361/201016120",,"astro-ph.SR","http://arxiv.org/licenses/nonexclusive-distrib/1.0/","  We report on K-band VLTI/AMBER observations at medium spectral resolution
($\sim$1500) of RS Capricorni, an M6/M7III semi-regular AGB star. From the
spectrally-dispersed visibilities, we measure the star diameter as a function
of observing wavelength from 2.13 to 2.47 microns. We derive a Rosseland
angular diameter of $7.95 \pm 0.07$ mas, which corresponds to an effective
temperature of $3160 \pm 160$ K. We detect size variations of around 10% in the
CO band heads, indicating strong opacity effects of CO in the stellar
photosphere. We also detect a linear increase of the size as a function of
wavelength, beginning at 2.29 microns. Models of the stellar atmosphere, based
on the mass of the star as estimated from stellar-evolution models, predict
CO-size effects about half of those observed, and cannot reproduce the linear
size increase with wavelength, redward of 2.29 microns. We are able to model
this linear size increase with the addition of an extended water-vapor envelope
around the star. However, we are not able to fit the data in the CO bandheads.
Either the mass of the star is overestimated by the stellar-evolution models
and/or there is an additional extended CO envelope in the outer part of the
atmosphere. In any case, neither the water-vapor envelope, nor the CO envelope,
can be explained using the current models.
","[{""version"":""v1"",""created"":""Sun, 30 Jan 2011 08:24:57 GMT""},{""version"":""v2"",""created"":""Wed, 2 Feb 2011 14:15:12 GMT""},{""version"":""v3"",""created"":""Thu, 24 Mar 2011 12:34:47 GMT""}]","2015-05-27"
"1101.5750","Anna Shahinyan Ms","T. V. Gevorgyan, A. R. Shahinyan, G. Yu. Kryuchkyan","Dissipative Chaos in Quantum Distributions","17 pages, 3 figures, proceeding of Modern Optics And Photonics",,"10.1142/9789814313278_0005",,"quant-ph","http://arxiv.org/licenses/nonexclusive-distrib/1.0/","  We discuss some problems of dissipative chaos for open quantum systems in the
framework of semiclassical and quantum distributions. For this goal, we propose
a driven nonlinear oscillator with time-dependent coefficients, i.e. with
time-dependent Kerr-nonlinearity and time-modulated driving field. This model
showing both regular and chaotic dynamics in the classical limit is realized in
several experimental schemes. Quantum dissipative chaos is analyzed on the base
of numerical method of quantum trajectories. Three quantities are studied: the
Wigner function of oscillatory mode from the point of view of quantum-assemble
theory and both semiclassical Poincare section and quantum Poincare section
calculated on a single quantum trajectory. The comparatively analysis of these
distributions for various operational chaotic regimes of the models is
performed, as well as scaling invariance in dissipative chaos and quantum
interference effects assisted by chaos are discussed.
","[{""version"":""v1"",""created"":""Sun, 30 Jan 2011 08:35:40 GMT""}]","2017-08-23"
"1101.5751","Mingting Kuo david","David M.-T. Kuo (1), Shiue-Yuan (2), and Yia-chung Chang (2)","Theory of spin blockade, charge ratchet effect, and thermoelectrical
  behavior in serially coupled quantum-dot system","11 pages, 9 figures. Revised argument, results unchanged, added
  references",,"10.1103/PhysRevB.84.245303",,"cond-mat.mes-hall","http://arxiv.org/licenses/nonexclusive-distrib/1.0/","  The charge transport of a serially coupled quantum dots (SCQD) connected to
the metallic electrodes is theoretically investigated in the Coulomb blockade
regime. A closed-form expression for the tunneling current of SCQD in the
{\color{red} weak interdot hopping} limit is obtained by solving an extended
two-site Hubbard model via the Green's function method. We use this expression
to investigate spin current rectification, negative differential conductance,
and coherent tunneling in the nonlinear response regime. The current
rectification arising from the space symmetry breaking of SCQD is suppressed by
increasing temperature. The calculation of SCQD is extended to the case of
multiple parallel SCQDs for studying the charge ratchet effect and SCQD with
multiple levels. In the linear response regime, the functionalities of spin
filter and low-temperature current filter are demonstrated to coexist in this
system. It is further demonstrated that two-electron spin singlet and triplet
states can be readily resolved from the measurement of Seebeck coefficient
rather than that of electrical conductance.
","[{""version"":""v1"",""created"":""Sun, 30 Jan 2011 08:47:00 GMT""},{""version"":""v2"",""created"":""Sat, 12 Mar 2011 00:17:48 GMT""},{""version"":""v3"",""created"":""Sat, 4 Jun 2011 22:58:37 GMT""},{""version"":""v4"",""created"":""Sun, 30 Oct 2011 03:29:52 GMT""}]","2015-05-27"
"1101.5752","Yuri Kifer I","Yuri Kifer","A Nonconventional Invariance Principle for Random Fields","corrected version",,,,"math.PR","http://arxiv.org/licenses/nonexclusive-distrib/1.0/","  We prove a nonconventional invariance principle (functional central limit
theorem) for random fields.
","[{""version"":""v1"",""created"":""Sun, 30 Jan 2011 08:50:07 GMT""},{""version"":""v2"",""created"":""Mon, 23 Jan 2012 09:20:32 GMT""}]","2012-01-24"
"1101.5753","Michael Dinitz","Michael Dinitz and Robert Krauthgamer","Fault-Tolerant Spanners: Better and Simpler","17 pages",,,,"cs.DS math.CO","http://arxiv.org/licenses/nonexclusive-distrib/1.0/","  A natural requirement of many distributed structures is fault-tolerance:
after some failures, whatever remains from the structure should still be
effective for whatever remains from the network. In this paper we examine
spanners of general graphs that are tolerant to vertex failures, and
significantly improve their dependence on the number of faults $r$, for all
stretch bounds.
  For stretch $k \geq 3$ we design a simple transformation that converts every
$k$-spanner construction with at most $f(n)$ edges into an $r$-fault-tolerant
$k$-spanner construction with at most $O(r^3 \log n) \cdot f(2n/r)$ edges.
Applying this to standard greedy spanner constructions gives $r$-fault tolerant
$k$-spanners with $\tilde O(r^{2} n^{1+\frac{2}{k+1}})$ edges. The previous
construction by Chechik, Langberg, Peleg, and Roddity [STOC 2009] depends
similarly on $n$ but exponentially on $r$ (approximately like $k^r$).
  For the case $k=2$ and unit-length edges, an $O(r \log n)$-approximation
algorithm is known from recent work of Dinitz and Krauthgamer [arXiv 2010],
where several spanner results are obtained using a common approach of rounding
a natural flow-based linear programming relaxation. Here we use a different
(stronger) LP relaxation and improve the approximation ratio to $O(\log n)$,
which is, notably, independent of the number of faults $r$. We further
strengthen this bound in terms of the maximum degree by using the \Lovasz Local
Lemma.
  Finally, we show that most of our constructions are inherently local by
designing equivalent distributed algorithms in the LOCAL model of distributed
computation.
","[{""version"":""v1"",""created"":""Sun, 30 Jan 2011 09:35:13 GMT""}]","2011-02-01"
"1101.5754","Dariusz Chruscinski","Dariusz Chru\'sci\'nski, Adam Rutkowski","A family of generalized Horodecki-like entangled states","8 pages","Phys. Lett. A 375, 2793 (2011)","10.1016/j.physleta.2011.06.013",,"quant-ph","http://arxiv.org/licenses/nonexclusive-distrib/1.0/","  We provide a multi-parameter family of 2-qudit PPT entangled states which
generalizes the celebrated Horodecki state in 3 x 3. The entanglement of this
family is identified via semidefinite programming based on ""PPT symmetric
extensions"" by Doherty et al.
","[{""version"":""v1"",""created"":""Sun, 30 Jan 2011 09:45:30 GMT""}]","2011-08-03"
"1101.5755","Yong Fang","Yong Fang, Bormin Huang, and Jiaji Wu","2D Sparse Signal Recovery via 2D Orthogonal Matching Pursuit",,,,,"cs.IT cs.MM math.IT","http://arxiv.org/licenses/nonexclusive-distrib/1.0/","  Recovery algorithms play a key role in compressive sampling (CS). Most of
current CS recovery algorithms are originally designed for one-dimensional (1D)
signal, while many practical signals are two-dimensional (2D). By utilizing 2D
separable sampling, 2D signal recovery problem can be converted into 1D signal
recovery problem so that ordinary 1D recovery algorithms, e.g. orthogonal
matching pursuit (OMP), can be applied directly. However, even with 2D
separable sampling, the memory usage and complexity at the decoder is still
high. This paper develops a novel recovery algorithm called 2D-OMP, which is an
extension of 1D-OMP. In the 2D-OMP, each atom in the dictionary is a matrix. At
each iteration, the decoder projects the sample matrix onto 2D atoms to select
the best matched atom, and then renews the weights for all the already selected
atoms via the least squares. We show that 2D-OMP is in fact equivalent to
1D-OMP, but it reduces recovery complexity and memory usage significantly.
What's more important, by utilizing the same methodology used in this paper,
one can even obtain higher dimensional OMP (say 3D-OMP, etc.) with ease.
","[{""version"":""v1"",""created"":""Sun, 30 Jan 2011 10:02:06 GMT""},{""version"":""v2"",""created"":""Tue, 26 Apr 2011 12:09:57 GMT""}]","2011-04-27"
"1101.5756","Vjacheslav Dorofeev","V. Yu. Dorofeev","Model of the electro-weak, gravitational and strong interactions in the
  O-theory","21 pages",,,,"gr-qc nucl-th","http://arxiv.org/licenses/nonexclusive-distrib/1.0/","  Based on the matrix representation of octonion algebra, supplied with
specific multiplication rule, the model of electroweak and gravitational
interactions is built up. While electroweak interaction in this model is
induced by charged W-bosons, other two forces appear to have slightly more
complicated nature. Gravitational interaction coincides in the model with
dipole interaction of a pair of charged bosons. The dipole consists of a
charged vector bosons pair from the major octonion algebra fields. When the
charged dipole pair interacts with the neutral bosons pair from the major
octonion algebra fields, the charged bosons pair misses its mass. The drop in
mass leads to appearance of far-ranging forces of gravitational interaction.
Finally, strong interaction appears in the model as internal gravitational
solution of 'black whole' type with the peculiar 'gravitational' constant. The
solution is a product of interaction of major vector fields pair with charged
W-bosons pair. It is inferred from the model that the state space is
ten-dimensional. The space is built as a module of the matrix representation of
octonion algebra over the particles field (O-module). Similarly to the Standard
Weinberg-Salam theory, the particle mass here appears as the product of
interaction of massless spinor fields and Higgs field from O-module
representation.
","[{""version"":""v1"",""created"":""Sun, 30 Jan 2011 10:04:34 GMT""}]","2011-02-01"
"1101.5757","Arno Bastenhof","Arno Bastenhof","Polarized Montagovian Semantics for the Lambek-Grishin calculus","To appear in the proceedings of the 15th conference on Formal
  Grammar, Copenhagen, 2010",,,,"cs.CL","http://arxiv.org/licenses/nonexclusive-distrib/1.0/","  Grishin proposed enriching the Lambek calculus with multiplicative
disjunction (par) and coresiduals. Applications to linguistics were discussed
by Moortgat, who spoke of the Lambek-Grishin calculus (LG). In this paper, we
adapt Girard's polarity-sensitive double negation embedding for classical logic
to extract a compositional Montagovian semantics from a display calculus for
focused proof search in LG. We seize the opportunity to illustrate our approach
alongside an analysis of extraction, providing linguistic motivation for linear
distributivity of tensor over par, thus answering a question of
Kurtonina&Moortgat. We conclude by comparing our proposal to the continuation
semantics of Bernardi&Moortgat, corresponding to call-by- name and
call-by-value evaluation strategies.
","[{""version"":""v1"",""created"":""Sun, 30 Jan 2011 10:41:46 GMT""}]","2011-02-01"
"1101.5758","Bernd Kniehl","Andrea A. Almasy, Bernd A. Kniehl, Alberto Sirlin","Quark mixing renormalization effects in the determination of |V_{tq}|","10 pages, 3 tables","Phys.Rev.D83:096004,2011","10.1103/PhysRevD.83.096004","DESY 11-01, LTH 904","hep-ph","http://arxiv.org/licenses/nonexclusive-distrib/1.0/","  We study the numerical effects of several renormalization schemes of the
Cabibbo-Kobayashi-Maskawa (CKM) quark mixing matrix on the top-quark decay
widths. We then employ these results to infer the relative shifts in the CKM
parameters |V_{tq}|^2 due to the quark mixing renormalization corrections,
assuming that they are determined directly from the top-quark partial decay
widths, without imposing unitarity constraints. We also discuss the
implications of these effects on the ratio R = Gamma(t -> Wb) / Gamma_t and the
determination of |V_{tb}|^2.
","[{""version"":""v1"",""created"":""Sun, 30 Jan 2011 10:50:42 GMT""}]","2011-05-19"
"1101.5759","Alexander Hillaris","A.Hillaris, O. Malandraki, K.-L Klein, P. Preka-Papadema, X. Moussas,
  C. Bouratzis, E. Mitsakou, P. Tsitsipis, A. Kontogeorgos","The 17 January 2005 Complex Solar Radio Event Associated with
  Interacting Fast Coronal Mass Ejections","20 pages 7 Figures, Accepted for publication to Solar Physics,
  Topical Issue 'Radio Observations and Modelling'",,"10.1007/s11207-011-9872-9",,"astro-ph.SR","http://arxiv.org/licenses/nonexclusive-distrib/1.0/","  On 17 January 2005 two fast coronal mass ejections were recorded in close
succession during two distinct episodes of a 3B/X3.8 flare. Both were
accompanied by metre-to-kilometre type-III groups tracing energetic electrons
that escape into the interplanetary space and by decametre-to-hectometre type-
II bursts attributed to CME-driven shock waves. A peculiar type-III burst group
was observed below 600 kHz 1.5 hours after the second type III group. It
occurred without any simultaneous activity at higher frequencies, around the
time when the two CMEs were expected to interact. We associate this emission
with the interaction of the CMEs at heliocentric distances of about 25 R\odot.
Near-relativistic electrons observed by the EPAM experiment onboard ACE near 1
AU revealed successive particle releases that can be associated with the two
flare/CME events and the low-frequency type-III burst at the time of CME
interaction. We compare the pros and cons of shock acceleration and
acceleration in the course of magnetic reconnection for the escaping electron
beams revealed by the type III bursts and for the electrons measured in situ.
","[{""version"":""v1"",""created"":""Sun, 30 Jan 2011 10:57:37 GMT""},{""version"":""v2"",""created"":""Sat, 16 Apr 2011 17:24:27 GMT""},{""version"":""v3"",""created"":""Thu, 30 Jun 2011 15:41:43 GMT""},{""version"":""v4"",""created"":""Sun, 14 Aug 2011 10:14:00 GMT""},{""version"":""v5"",""created"":""Fri, 23 Sep 2011 11:57:10 GMT""},{""version"":""v6"",""created"":""Thu, 13 Oct 2011 04:38:28 GMT""},{""version"":""v7"",""created"":""Sat, 15 Oct 2011 12:56:13 GMT""}]","2015-03-18"
"1101.5760","Ali Naji","Hoda Boroudjerdi, Ali Naji, Roland R. Netz","Salt Modulated Structure of Polyelectrolyte-Macroion Complex Fibers","18 pages, 15 figures","Eur. Phys. J. E 34, 72 (2011)",,,"cond-mat.soft cond-mat.stat-mech q-bio.BM","http://arxiv.org/licenses/nonexclusive-distrib/1.0/","  The structure and stability of strongly charged complex fibers formed by
complexation of a single long semi-flexible polyelectrolyte (PE) chain and many
oppositely charged spherical macroions are investigated numerically at the
ground-state level using a chain-sphere cell model. The model takes into
account chain elasticity as well as electrostatic interactions between charged
spheres and chain segments. Using a numerical optimization method based on a
periodically repeated unit cell, we obtain fiber configurations that minimize
the total energy. The optimal configurations exhibit a variety of helical
structures for the arrangement of macroions including zig-zag, solenoidal and
beads-on-a-string patterns. These structures are determined by a competition
between attraction between spheres and the PE chain (which favors chain
wrapping around the spheres), chain bending and electrostatic repulsion between
chain segments (which favor unwrapping of the chain), and the interactions
between neighboring sphere-chain complexes which can be attractive or repulsive
depending on the system parameters such as medium salt concentration, macroion
charge and chain length per macroion (linker size). At about physiological salt
concentration, dense zig-zag patterns are found to be energetically most stable
when parameters appropriate for the DNA-histone system in a chromatin fiber are
adopted. In fact, the predicted fiber diameter in this regime is found to be
around 30nm, which appears to agree with the thickness observed in in vitro
experiments on chromatin. We also find a macroion density of 5-6 per 11nm which
agrees with the zig-zag or cross-linker models of chromatin. Since our study
deals primarily with a generic model, these findings suggest that
chromatin-like structures should also be observable for PE-macroion complexes
formed in solutions of DNA and synthetic nano-colloids of opposite charge.
","[{""version"":""v1"",""created"":""Sun, 30 Jan 2011 11:11:44 GMT""}]","2015-03-18"
"1101.5761","Jounghun Lee","Marco Baldi (1), Jounghun Lee (2), Andrea V. Maccio (3) ((1)
  Excellence Cluster Universe, Garching, (2) Seoul National University, (3)
  Max-Planck-Institut fuer Astronomie)","The Effect of Coupled Dark Energy on the Alignment between Dark Matter
  and Galaxy Distributions in Clusters","Accepted for publication in ApJ, published version, all minor typos
  corrected, 5 figures","Astrophys.J. 732 (2011) 112","10.1088/0004-637X/732/2/112",,"astro-ph.CO gr-qc","http://arxiv.org/licenses/nonexclusive-distrib/1.0/","  We investigate the effects of a coupled Dark Energy (cDE) scalar field on the
alignment between satellites and matter distributions in galaxy clusters. Using
high-resolution N-body simulations for LCDM and cDE cosmological models, we
compute the probability density distribution for the alignment angle between
the satellite galaxies and underlying matter distributions, finding a
difference between the two scenarios. With respect to LCDM, in cDE cosmologies
the satellite galaxies are less preferentially located along the major axis of
the matter distribution, possibly reducing the tension with obersevational
data. A physical explanation is that the coupling between dark matter and dark
energy acts as an additional tidal force on the satellite galaxies diminishing
the alignments between their distribution and the matter one. Through a Wald
test based on the generalized chi-square statistics, the null hypothesis that
the two probability distributions come from the same parent population is
rejected at the 99 % confidence level. It is concluded that the galaxy-matter
alignment in clusters may provide a unique probe of dark sector interactions as
well as the nature of dark energy.
","[{""version"":""v1"",""created"":""Sun, 30 Jan 2011 11:13:09 GMT""},{""version"":""v2"",""created"":""Mon, 14 Mar 2011 03:22:18 GMT""},{""version"":""v3"",""created"":""Wed, 30 Mar 2011 22:35:26 GMT""}]","2015-05-27"
"1101.5762","Sebastian Hidalgo","Sebastian L. Hidalgo, Antonio Aparicio, Evan Skillman, Matteo Monelli,
  Carme Gallart, Andrew Cole, Andrew Dolphin, Daniel Weisz, Edouard Bernard,
  Santi Cassisi, Lucio Mayer, Peter Stetson, Eline Tolstoy, Henry Ferguson","The ACS LCID project. V. The Star Formation History of the Dwarf Galaxy
  \objectname[]{LGS-3}: Clues for Cosmic Reionization and Feedback","accepted to be published at ApJ",,"10.1088/0004-637X/730/1/14",,"astro-ph.CO","http://arxiv.org/licenses/nonexclusive-distrib/1.0/","  We present an analysis of the star formation history (SFH) of the
transition-type (dIrr/dSph) Local Group galaxy \objectname[]{LGS-3} (Pisces)
based on deep photometry obtained with the {\it Advanced Camera for Surveys}
onboard the {\it Hubble Space Telescope}. Our analysis shows that the SFH of
\objectname[]{LGS-3} is dominated by a main episode $\sim 11.7$ Gyr ago with a
duration of $\sim$ 1.4 Gyr which formed $\sim 90%$ of the stars. Subsequently,
\objectname[]{LGS-3} continued forming stars until the present, although at a
much lower rate. The lack of early chemical enrichment is in contrast to that
observed in the isolated dSph galaxies of comparable luminosity, implying that
the dSphs were more massive and subjected to more tidal stripping.
  We compare the SFH of \objectname[]{LGS-3} with expectations from
cosmological models. Most or all the star formation was produced in
\objectname[]{LGS-3} after the reionization epoch, assumed to be completed at
$z\sim6$ or $\sim 12.7$ Gyr ago. The total mass of the galaxy is estimated to
be between 2 and $4\times 10^8$ M$_\odot$, corresponding to circular velocities
between 28 km\ s$^{-1}$ to 36 km\ s$^{-1}$. These values are close to but
somewhat above the limit of 30 km\ s$^{-1}$ below which the UV background is
expected to prevent any star formation after reionization. Feedback from SNe
associated with the initial episode of star formation (mechanical luminosity
from SNe $L_w=5.3\times 10^{38}$ erg s$^{-1}$) is probably inadequate to
completely blow away the gas. However, the combined effects of SN feedback and
UV background heating might be expected to completely halt star formation at
the reionization epoch for the low mass of \objectname[]{LGS-3}; this suggests
that self-shielding is important to the early evolution of galaxies in this
mass range.
","[{""version"":""v1"",""created"":""Sun, 30 Jan 2011 11:16:19 GMT""}]","2015-05-27"
"1101.5763","Debajyoti Mukhopadhyay Prof.","Debajyoti Mukhopadhyay, Chandrima Chakrabarti, Sounak Chakravorty","A New Semantic Web Approach for Constructing, Searching and Modifying
  Ontology Dynamically","6 pages, 14 figures",,,"WiDiCoReL/2011/03","cs.IR","http://arxiv.org/licenses/nonexclusive-distrib/1.0/","  Semantic web is the next generation web, which concerns the meaning of web
documents It has the immense power to pull out the most relevant information
from the web pages, which is also meaningful to any user, using software
agents. In today's world, agent communication is not possible if concerned
ontology is changed a little. We have pointed out this very problem and
developed an Ontology Purification System to help agent communication. In our
system you can send queries and view the search results. If it can't meet the
criteria then it finds out the mismatched elements. Modification is done within
a second and you can see the difference. That's why we emphasis on the word
dynamic. When Administrator is updating the system, at the same time that
updation is visible to the user.
","[{""version"":""v1"",""created"":""Sun, 30 Jan 2011 11:33:51 GMT""}]","2011-02-01"
