"1101.5764","Sarah Kendall","S. Kendall, R. C. Kennicutt, C. Clarke","Spiral structure in nearby galaxies I. Sample, data analysis, and
  overview of results","28 pages, 56 figures. Accepted for publication in MNRAS",,"10.1111/j.1365-2966.2011.18422.x",,"astro-ph.GA","http://arxiv.org/licenses/nonexclusive-distrib/1.0/","  This paper, the first of two, introduces an observational study of spiral
structure in galaxies chosen from the SINGS survey. Near infrared (NIR) and
optical data are used to produce mass surface density maps, and from these the
morphology of the disc is examined. The aim of this work is to characterise the
prevalence of spiral structure in this sample and, in the cases where a clear
spiral pattern is found, include the findings in a comparative study (reported
in paper II). A two-armed (`grand design') spiral pattern is found in
approximately half the galaxies studied, including all those that are
designated as grand design in the optical, but also including some, but not
all, optically flocculent galaxies. It is found that the level of
non-axisymmetric structure in the galaxies' mass distributions is only modestly
higher in those galaxies that are classified as `grand design' compared with
those that are not, implying that non-grand design galaxies possess significant
power in higher order modes. There is no evidence that bars preferentially
trigger the spirals, but they do appear to stir up non-axisymmetric structure
in the disc. In contrast, there is evidence that strong/close tidal
interactions with companion galaxies are associated with strong two-armed
spiral structure in the infrared, though there are a number of galaxies with
relatively weak infrared spiral structure that do not possess such companions.
","[{""version"":""v1"",""created"":""Sun, 30 Jan 2011 11:42:49 GMT""}]","2015-05-27"
"1101.5765","Arata Yamamoto","Arata Yamamoto, (Kyoto U.)","Lattice QCD Anatomy via the Energy-Momentum Component of Gluons","Ph.D. thesis",,,,"hep-lat","http://arxiv.org/licenses/nonexclusive-distrib/1.0/","  In this thesis, we perform the lattice QCD analysis via the energy-momentum
component of gluons. By introducing the momentum cutoff to the link variable,
we investigate which energy-momentum components of gluons induce each QCD
phenomenon. We use the Landau gauge for the most part of the lattice QCD
analysis. In lattice QCD, we analyze color confinement, spontaneous chiral
symmetry breaking, topological charge, and the related topics. We also discuss
several comparisons with effective theories. As for color confinement, we
calculate the quark-antiquark potential, the color flux tube, and meson masses.
From quantitative analysis, we find that color confinement is induced by the
low-momentum component below 1.5 GeV. As for spontaneous chiral symmetry
breaking, we calculate the chiral condensate and the Dirac spectrum.
Spontaneous chiral symmetry breaking is induced by the broad low-momentum
component which ranges even above 1.5 GeV. The present result suggests that
color confinement and spontaneous chiral symmetry breaking are induced by
somehow different energy-momentum components of gluons. As for topological
charge, we calculate the topological charge density and the Dirac zero mode.
Topological charge is induced by the broad energy-momentum component, which is
similar to spontaneous chiral symmetry breaking.
","[{""version"":""v1"",""created"":""Sun, 30 Jan 2011 11:54:45 GMT""},{""version"":""v2"",""created"":""Tue, 1 Feb 2011 03:05:13 GMT""},{""version"":""v3"",""created"":""Mon, 14 Feb 2011 19:18:01 GMT""}]","2011-02-15"
"1101.5766","Joan Bruna","Joan Bruna and St\'ephane Mallat","Geometric Models with Co-occurrence Groups","6 pages, ESANN 2010",,,,"cs.CV cs.IT math.IT","http://arxiv.org/licenses/nonexclusive-distrib/1.0/","  A geometric model of sparse signal representations is introduced for classes
of signals. It is computed by optimizing co-occurrence groups with a maximum
likelihood estimate calculated with a Bernoulli mixture model. Applications to
face image compression and MNIST digit classification illustrate the
applicability of this model.
","[{""version"":""v1"",""created"":""Sun, 30 Jan 2011 12:05:12 GMT""}]","2011-02-01"
"1101.5767","S{\o}ren Kj{\ae}rgaard Boldsen","S{\o}ren K. Boldsen and Mia Hauge Dollerup","Towards representation stability for the second homology of the Torelli
  group","36 pages",,,,"math.AT math.RT","http://arxiv.org/licenses/nonexclusive-distrib/1.0/","  We show for g > 6 that the second homology group of the Torelli group of a
surface of genus g and 1 boundary component is generated as an Sp(2g,Z)-module
by the image under the stabilization map of the second homology group of the
Torelli group of a surface of genus 6 and 1 boundary component. In the process
we also show that the quotient of the complex of arcs with identity permutation
by the Torelli group is (g-2)-connected, for one or two boundary components.
","[{""version"":""v1"",""created"":""Sun, 30 Jan 2011 13:17:29 GMT""},{""version"":""v2"",""created"":""Wed, 2 Feb 2011 09:02:01 GMT""}]","2011-02-03"
"1101.5768","Jerrold Franklin","Jerrold Franklin","Comment on [arXiv:1009.5250] ""Electromagnetic mass differences of SU(3)
  baryons within a chiral soliton model""","Comment on arXiv:1009.5250 by Yang, Kim, Polyakov",,,,"hep-ph","http://arxiv.org/licenses/nonexclusive-distrib/1.0/","  In a recent letter, several electromagnetic mass difference formulae for
baryons were presented. However, because the derivation did not include
important colormagnetic terms, the mass relations do not correctly give isospin
mass splittings for the baryons. Correct mass formulae were published some time
ago in a model independent approach that was more general and correct than the
approach in this letter. In this Comment, the errors in the letter are pointed
out and some correct formulae presented.
","[{""version"":""v1"",""created"":""Sun, 30 Jan 2011 13:21:52 GMT""}]","2011-02-01"
"1101.5769","Andronikos Paliathanasis","Michael Tsamparlis and Andronikos Paliathanasis","Lie and Noether symmetries of geodesic equations and collineations","19 pages","General Relativity and Gravitation Volume 42, Number 12,
  2957-2980, 2010","10.1007/s10714-010-1054-9",,"gr-qc","http://arxiv.org/licenses/nonexclusive-distrib/1.0/","  The Lie symmetries of the geodesic equations in a Riemannian space are
computed in terms of the special projective group and its degenerates (affine
vectors, homothetic vector and Killing vectors) of the metric. The Noether
symmetries of the same equations are given in terms of the homothetic and the
Killing vectors of the metric. It is shown that the geodesic equations in a
Riemannian space admit three linear first integrals and two quadratic first
integrals. We apply the results in the case of Einstein spaces, the
Schwarzschild spacetime and the Friedman Robertson Walker spacetime. In each
case the Lie and the Noether symmetries are computed explicitly together with
the corresponding linear and quadratic first integrals.
","[{""version"":""v1"",""created"":""Sun, 30 Jan 2011 13:35:25 GMT""}]","2011-02-01"
"1101.5770","Martina Kubitzke","Myrto Kallipoliti, Martina Kubitzke","A poset fiber theorem for doubly Cohen-Macaulay posets and its
  applications to non-crossing partitions and injective words","16 pages, 3 figures",,,,"math.CO","http://arxiv.org/licenses/nonexclusive-distrib/1.0/","  This paper studies topological properties of the lattices of non-crossing
partitions of types A and B and of the poset of injective words. Specifically,
it is shown that after the removal of the bottom and top elements (if existent)
these posets are doubly Cohen-Macaulay. This strengthens the well-known facts
that these posets are Cohen-Macaulay. Our results rely on a new poset fiber
theorem which turns out to be a useful tool to prove double (homotopy)
Cohen-Macaulayness of a poset. Applications to complexes of injective words are
also included.
","[{""version"":""v1"",""created"":""Sun, 30 Jan 2011 13:37:05 GMT""},{""version"":""v2"",""created"":""Tue, 12 Apr 2011 16:09:12 GMT""}]","2011-04-13"
"1101.5771","Andronikos Paliathanasis","Michael Tsamparlis and Andronikos Paliathanasis","Two dimensional dynamical systems which admit Lie and Noether symmetries","25 pages, 17 tables","J.Phys.A44:175202,2011","10.1088/1751-8113/44/17/175202",,"math-ph gr-qc math.MP","http://arxiv.org/licenses/nonexclusive-distrib/1.0/","  We prove two theorems which relate the Lie point symmetries and the Noether
symmetries of a dynamical system moving in a Riemannian space with the special
projective group and the homothetic group of the space respectively. The
theorems are applied to classify the two dimensional Newtonian dynamical
systems, which admit a Lie point/Noether symmetry. Two cases are considered,
the non-conservative and the conservative forces. The use of the results is
demonstrated for the Kepler - Ermakov system, which in general is
non-conservative and for potentials similar to the H\`enon Heiles potential.
Finally it is shown that in a FRW background with no matter present, the only
scalar cosmological model which is integrable is the one for which 3-space is
flat and the potential function of the scalar field is exponential. It is
important to note that in all applications the generators of the symmetry
vectors are found by reading the appropriate entry in the relevant tables.
","[{""version"":""v1"",""created"":""Sun, 30 Jan 2011 13:50:45 GMT""},{""version"":""v2"",""created"":""Sat, 2 Apr 2011 10:42:57 GMT""}]","2011-04-05"
"1101.5772","Boris Malomed","Lior Shabtay and Boris A. Malomed (Department of Physical Electronics,
  Faculty of Engineering, Tel Aviv University)","A nonpolynomial Schroedinger equation for resonantly absorbing gratings","Physical Review A, in press",,"10.1103/PhysRevA.83.023807",,"physics.optics nlin.PS","http://arxiv.org/licenses/nonexclusive-distrib/1.0/","  We derive a nonlinear Schroedinger equation with a radical term, in the form
of the square root of (1-|V|^2), as an asymptotic model of the optical medium
built as a periodic set of thin layers of two-level atoms, resonantly
interacting with the electromagnetic field and inducing the Bragg reflection. A
family of bright solitons is found, which splits into stable and unstable
parts, exactly obeying the Vakhitov-Kolokolov criterion. The soliton with the
largest amplitude, which is |V| = 1, is found in an explicit analytical form.
It is a ""quasi-peakon"", with a discontinuity of the third derivative at the
center. Families of exact cnoidal waves, built as periodic chains of
quasi-peakons, are found too. The ultimate solution belonging to the family of
dark solitons, with the background level |V| = 1, is a dark compacton, also
obtained in an explicit analytical form. Those bright solitons which are
unstable destroy themselves (if perturbed) attaining the critical amplitude,
|V| = 1. The dynamics of the wave field around this critical point is studied
analytically, revealing a switch of the system into an unstable phase.
Collisions between bright solitons are investigated too. The collisions between
fast solitons are quasi-elastic, while slowly moving ones merge into breathers,
which may persist or perish (in the latter case, also by attaining |V| = 1).
","[{""version"":""v1"",""created"":""Sun, 30 Jan 2011 14:30:18 GMT""}]","2015-05-27"
"1101.5773","Miguel Manna","R. Kraenkel, H. Leblond and M. A. Manna","An integrable evolution equation for surface waves in deep water",,,,,"nlin.SI math-ph math.MP","http://arxiv.org/licenses/nonexclusive-distrib/1.0/","  In order to describe the dynamics of monochromatic surface waves in deep
water, we derive a nonlinear and dispersive system of equations for the free
surface elevation and the free surface velocity from the Euler equations in
infinite depth. From it, and using a multiscale perturbative methods, an
asymptotic model for small-aspect-ratio waves is derived. The model is shown to
be completely integrable. The Lax pair, the first conserved quantities as well
as the symmetries are exhibited. Theoretical and numerical studies reveal that
it supports periodic progressive Stokes waves which peak and break in finite
time. Comparison between the limiting wave solution of the asymptotic model and
classical irrotational results is performed.
","[{""version"":""v1"",""created"":""Sun, 30 Jan 2011 14:37:25 GMT""}]","2015-03-18"
"1101.5774","Ilja Schmelzer","I. Schmelzer","An answer to the Wallstrom objection against Nelsonian stochastics","Considerations about the relevance and rejection of Smolin's attempt
  added",,,,"quant-ph","http://arxiv.org/licenses/nonexclusive-distrib/1.0/","  A serious objection made by Wallstrom against quantum interpretations based
flow variables, in particular Nelsonian stochastics, is their empirical
inequivalence with quantum theory: They are unable to obtain a quantization
condition for flows around zeros which is automatically fulfilled by the wave
function.
  It is found that the quantization condition follows from a simple additional
postulate: The Laplace operator of the density has to be finite and positive at
zeros of the density. This postulate is a quite natural consequence of
subquantum theories, as far as they conform to a simple principle of minimal
distortion of the quantum solutions.
","[{""version"":""v1"",""created"":""Sun, 30 Jan 2011 14:40:48 GMT""},{""version"":""v2"",""created"":""Thu, 10 Feb 2011 18:34:51 GMT""},{""version"":""v3"",""created"":""Sat, 16 Apr 2011 13:47:45 GMT""}]","2011-04-19"
"1101.5775","Agnieszka Werpachowska","Agnieszka Werpachowska","Loewdin calculus for multiband Hamiltonians","8 + epsilon pages, no figures, one column (corrected)",,,,"cond-mat.mtrl-sci","http://arxiv.org/licenses/nonexclusive-distrib/1.0/","  This appendix to the paper by Werpachowska and Dietl ""Theory of spin waves in
ferromagnetic (Ga,Mn)As"" (DOI: 10.1103/PhysRevB.82.085204) is a response to
inquiries about the derivation of the Loewdin calculus and its numerical
implementation. It presents the detailed version of the Loewdin calculus for
the multiband Hamiltonian taking into account both the p-d and s-d exchange
couplings. This should explain how to implement the sp-d exchange interaction
in the tight-binding computational scheme. I also include the complete
procedure of the Bogoliubov transform for systems with spatial inversion
asymmetry.
","[{""version"":""v1"",""created"":""Sun, 30 Jan 2011 14:50:56 GMT""},{""version"":""v2"",""created"":""Sat, 12 Mar 2011 19:06:56 GMT""}]","2011-03-15"
"1101.5776","Yen Chin Ong","Yen Chin Ong","Stringy Stability of Dilaton Black Holes in 5-Dimensional Anti-de Sitter
  Space","Published in Proceedings of the Conference in Honor of Murray
  Gell-Mann's 80th Birthday, p.583-590, World Scientific, 2010, Singapore",,"10.1142/9789814335614_0061",,"hep-th gr-qc","http://arxiv.org/licenses/nonexclusive-distrib/1.0/","  Flat electrical charged black holes in 5-dimensional anti-de Sitter space
have been applied to the study of the phase diagram of quark matter via AdS/CFT
correspondence. In such application it is argued that since the temperature of
the quark gluon plasma is bounded away from zero, the dual black hole cannot be
arbitrarily cold, but becomes unstable due to stringy instability once it
reaches sufficiently low temperature. We study the stringy stability of flat
dilaton black holes with dilaton coupling $\alpha=1$ in asymptotically anti-de
Sitter space and show that unlike the purely electrically charged black hole,
these dilaton black holes do not suffer from stringy instability.
","[{""version"":""v1"",""created"":""Sun, 30 Jan 2011 15:03:16 GMT""}]","2017-08-23"
"1101.5777","Matteo G. A. Paris","Marco G. Genoni, Paolo Giorda, Matteo G. A. Paris","Geometry of perturbed Gaussian states and quantum estimation","7 pages, 1 figure, revised version","J. Phys. A 44, 152001 (2011)","10.1088/1751-8113/44/15/152001",,"quant-ph","http://arxiv.org/licenses/nonexclusive-distrib/1.0/","  We address the nonGaussianity (nG) of states obtained by weakly perturbing a
Gaussian state and investigate the relationships with quantum estimation. For
classical perturbations, i.e. perturbations to eigenvalues, we found that nG of
the perturbed state may be written as the quantum Fisher information (QFI)
distance minus a term depending on the infinitesimal energy change, i.e. it
provides a lower bound to statistical distinguishability. Upon moving on
isoenergetic surfaces in a neighbourhood of a Gaussian state, nG thus coincides
with a proper distance in the Hilbert space and exactly quantifies the
statistical distinguishability of the perturbations. On the other hand, for
perturbations leaving the covariance matrix unperturbed we show that nG
provides an upper bound to the QFI. Our results show that the geometry of
nonGaussian states in the neighbourhood of a Gaussian state is definitely not
trivial and cannot be subsumed by a differential structure. Nevertheless, the
analysis of perturbations to a Gaussian state reveals that nG may be a resource
for quantum estimation. The nG of specific families of perturbed Gaussian
states is analyzed in some details with the aim of finding the maximally non
Gaussian state obtainable from a given Gaussian one.
","[{""version"":""v1"",""created"":""Sun, 30 Jan 2011 15:21:20 GMT""},{""version"":""v2"",""created"":""Tue, 1 Mar 2011 14:12:39 GMT""}]","2015-03-18"
"1101.5778","Emiliano Molinaro","A. Ibarra, E. Molinaro, S.T. Petcov","Lepton Number Violation in TeV Scale See-Saw Extensions of the Standard
  Model","Contribution to the Proceedings of DISCRETE 2010- Symposium on
  Prospects in the Physics of Discrete Symmetries, 8 pages",,"10.1088/1742-6596/335/1/012048","CFTP/11-021","hep-ph hep-ex","http://arxiv.org/licenses/nonexclusive-distrib/1.0/","  The low-energy neutrino physics constraints on the TeV scale type I see-saw
scenarios of neutrino mass generation are revisited. It is shown that lepton
charge (L) violation, associated to the production and decays of heavy Majorana
neutrinos N_{j} having masses in the range of M_j \sim (100 \div 1000) GeV and
present in such scenarios, is hardly to be observed at ongoing and future
particle accelerator experiments, LHC included, because of very strong
constraints on the parameters and couplings responsible for the corresponding
|\Delta L| = 2 processes. If the heavy Majorana neutrinos N_j are observed and
they are associated only with the type I mechanism, they will behave
effectively like pseudo-Dirac fermions. Conversely, the observation of effects
proving the Majorana nature of N_j would imply that these heavy neutrinos have
additional relatively strong couplings to the Standard Model particles or that
light neutrino masses compatible with the observations are generated by a
mechanism other than see-saw (e.g., radiatively at one or two loop level) in
which the heavy Majorana neutrinos N_j are nevertheless involved.
","[{""version"":""v1"",""created"":""Sun, 30 Jan 2011 15:22:07 GMT""},{""version"":""v2"",""created"":""Wed, 2 Feb 2011 10:44:02 GMT""}]","2015-05-27"
"1101.5779","Jason Cloud","Jason Cloud, Linda Zeger, Muriel M\'edard","Co-Designing Multi-Packet Reception, Network Coding, and MAC Using a
  Simple Predictive Model","8 Pages, 10 Figures, Submitted to WiOpt 2011",,,,"cs.NI","http://arxiv.org/licenses/nonexclusive-distrib/1.0/","  We design a cross-layer approach to optimize the joint use of multi-packet
reception and network coding, in order to relieve congestion. We construct a
model for the behavior of the 802.11 MAC and apply it to several key canonical
topology components and their extensions to any number of nodes. The results
obtained from this model match the available experimental results, which are
for routing and opportunistic network coding, with fidelity. Using this model,
we show that fairness allocation by the MAC can seriously impact performance;
hence, we devise a new MAC that not only substantially improves throughput
relative to the current 802.11 MAC, but also provides fairness to flows of
information rather than to nodes. We show that the proper combination of
network coding, multi-packet reception, and our new MAC protocol achieves
super-additive throughput gains of up to 6.3 times that of routing alone with
the use of the standard 802.11 MAC. Finally, we extend the model to analyze the
asymptotic behavior of our new MAC as the number of nodes increases.
","[{""version"":""v1"",""created"":""Sun, 30 Jan 2011 15:49:26 GMT""}]","2011-02-01"
"1101.5780","Franco Ferrari","Franco Ferrari and Maciej Pyrka","Dynamical aspects of inextensible chains","15 pages, LaTeX 2e + various packages, 3 figures. The title has been
  changed and three references have been added. A large part of the manuscript
  has been rewritten to improve readability. Chapter 4 has been added. It
  contains the construction of the generating functional without the
  shish-kebab approximation and a new derivation of the continuous limit of the
  freely jointed bar chain",,"10.1142/S0217979211102204","NSF-KITP-11-092","cond-mat.stat-mech hep-th","http://arxiv.org/licenses/nonexclusive-distrib/1.0/","  In the present work the dynamics of a continuous inextensible chain is
studied. The chain is regarded as a system of small particles subjected to
constraints on their reciprocal distances. It is proposed a treatment of
systems of this kind based on a set Langevin equations in which the noise is
characterized by a non-gaussian probability distribution. The method is
explained in the case of a freely hinged chain. In particular, the generating
functional of the correlation functions of the relevant degrees of freedom
which describe the conformations of this chain is derived. It is shown that in
the continuous limit this generating functional coincides with a model of an
inextensible chain previously discussed by one of the authors of this work.
Next, the approach developed here is applied to a inextensible chain, called
the freely jointed bar chain, in which the basic units are small extended
objects. The generating functional of the freely jointed bar chain is
constructed. It is shown that it differs profoundly from that of the freely
hinged chain. Despite the differences, it is verified that in the continuous
limit both generating functionals coincide as it is expected.
","[{""version"":""v1"",""created"":""Sun, 30 Jan 2011 15:57:45 GMT""},{""version"":""v2"",""created"":""Thu, 26 May 2011 06:43:46 GMT""}]","2015-05-27"
