"1101.5704","Anders Bj\""orner","Anders Bj\""orner","A cell complex in number theory","16 pages","Adv. in Appl. Math.. Available online 20 October 2010.
  doi:10.1016/j.aam.2010.09.007","10.1016/j.aam.2010.09.007",,"math.NT math.CO","http://arxiv.org/licenses/nonexclusive-distrib/1.0/","  Let De_n be the simplicial complex of squarefree positive integers less than
or equal to n ordered by divisibility. It is known that the asymptotic rate of
growth of its Euler characteristic (the Mertens function) is closely related to
deep properties of the prime number system.
  In this paper we study the asymptotic behavior of the individual Betti
numbers and of their sum. We show that De_n has the homotopy type of a wedge of
spheres, and that as n tends to infinity: $$\sum \be_k(\De_n) =
\frac{2n}{\pi^2} + O(n^{\theta}),\;\; \mbox{for all} \theta > \frac{17}{54}.$$
  We also study a CW complex tDe_n that extends the previous simplicial
complex. In tDe_n all numbers up to n correspond to cells and its Euler
characteristic is the summatory Liouville function. This cell complex is shown
to be homotopy equivalent to a wedge of spheres, and as n tends to infinity:
$$\sum \be_k(\tDe_n) = \frac{n}{3} + O(n^{\theta}),\;\; \mbox{for all} \theta >
\frac{22}{27}.$$
","[{""version"":""v1"",""created"":""Sat, 29 Jan 2011 16:09:28 GMT""}]","2011-02-01"
"1101.5705","Anand Pillay","Annalisa Conversano and Anand Pillay","Connected components of definable groups and o-minimality I","26 pages. This paper corrects the paper ""Groups definable in
  o-minimal structures: structure theorem, G^000, definable amenability, and
  bounded orbits"" by the first author which was posted in December
  (1012.4540v1) and later withdrawn",,,,"math.LO math.GR","http://arxiv.org/licenses/nonexclusive-distrib/1.0/","  We give examples of groups G such that G^00 is different from G^000. We also
prove that for groups G definable in an o-minimal structure, G has a ""bounded
orbit"" iff G is definably amenable. These results answer questions of
Gismatullin, Newelski, Petrykovski. The examples also give new non G-compact
first order theories.
","[{""version"":""v1"",""created"":""Sat, 29 Jan 2011 16:14:35 GMT""}]","2011-02-01"
"1101.5706","Kacper Zalewski","A. Bialas and K. Zalewski","Longitudinal hydrodynamic expansion and long rangle correlations","LateX, nine pages, no figures, final version as published","Physics LettersB698:416, 2011","10.1016/j.physletb.2011.03.036",,"hep-ph","http://arxiv.org/licenses/nonexclusive-distrib/1.0/","  It is shown that the recently proposed method of studying the long-range
correlations in multiparticle production can be effectively used to verify the
hydrodynamic nature of the longitudinal expansion of the partonic system
created in the collision. The case of ALICE detector is explicitly considered.
","[{""version"":""v1"",""created"":""Sat, 29 Jan 2011 16:25:00 GMT""},{""version"":""v2"",""created"":""Mon, 25 Apr 2011 08:02:35 GMT""}]","2015-05-27"
"1101.5707","Terence C. Tao","Terence Tao, Van Vu","The Wigner-Dyson-Mehta bulk universality conjecture for Wigner matrices","16 pages, no figures, to appear, EJP. This is the final version,
  incorporating the referee's suggestions",,,,"math.PR","http://arxiv.org/licenses/nonexclusive-distrib/1.0/","  A well known conjecture of Wigner, Dyson, and Mehta asserts that the
(appropriately normalized) $k$-point correlation functions of the eigenvalues
of random $n \times n$ Wigner matrices in the bulk of the spectrum converge (in
various senses) to the $k$-point correlation function of the Dyson sine process
in the asymptotic limit $n \to \infty$. There has been much recent progress on
this conjecture, in particular it has been established under a wide variety of
decay, regularity, and moment hypotheses on the underlying atom distribution of
the Wigner ensemble, and using various notions of convergence. Building upon
these previous results, we establish new instances of this conjecture with
weaker hypotheses on the atom distribution and stronger notions of convergence.
In particular, assuming only a finite moment condition on the atom
distribution, we can obtain convergence in the vague sense, and assuming an
additional regularity condition, we can upgrade this convergence to locally
$L^1$ convergence.
","[{""version"":""v1"",""created"":""Sat, 29 Jan 2011 16:54:04 GMT""},{""version"":""v2"",""created"":""Tue, 1 Feb 2011 21:25:38 GMT""},{""version"":""v3"",""created"":""Fri, 8 Apr 2011 04:36:34 GMT""},{""version"":""v4"",""created"":""Sat, 17 Sep 2011 21:53:22 GMT""}]","2011-09-20"
"1101.5708","Betti Hartmann","Yves Brihaye (Universite de Mons, Belgium) and Betti Hartmann (Jacobs
  University Bremen, Germany)","Holographic superfluid/fluid/insulator phase transitions in 2+1
  dimensions","18 pages including 9 figures","Phys.Rev.D83:126008,2011","10.1103/PhysRevD.83.126008",,"hep-th gr-qc","http://arxiv.org/licenses/nonexclusive-distrib/1.0/","  We study the breaking of an Abelian symmetry close to the horizon of a black
string as well as close to the tip of a solitonic, cigar-shaped solution in
(3+1)-dimensional Anti-de Sitter space-time. We use these solutions to describe
holographic superfluids away from the probe limit, i.e. taking backreaction
into account. We observe that up to four phases exist in this model
representing the duals of black string solutions with and without scalar hair
and solitonic, cigar-shaped solutions with and without scalar hair,
respectively. We construct the full phase diagram that describes the phase
transitions between fluids and superfluids, between insulators and superfluids
as well as between insulators and fluids. In the probe limit the phase
transition from fluids to black string superfluids changes from being second
order to first order for sufficiently large values of the superfluid velocity
and/or the angular momentum of the dual black string. We find that if we take
backreaction into account phase transitions that are first order for weak
backreaction become again second order for sufficiently strong backreaction.
Moreover, we find a new type of insulator/superfluid phase transition for
strong backreaction and vanishing superfluid velocity as well as a new type of
fluid/superfluid phase transition that exists only for non-vanishing superfluid
velocity.
","[{""version"":""v1"",""created"":""Sat, 29 Jan 2011 17:28:11 GMT""}]","2015-03-18"
"1101.5709","Jo\~ao Ara\'ujo Mr","Jo\~ao Ara\'ujo","On idempotent generated semigroups","three pages","Semigroup Forum Vol. 65 (2002) 138-140","10.1007/s002330010089",,"math.GR","http://arxiv.org/licenses/nonexclusive-distrib/1.0/","  We provide short and direct proofs for some classical theorems proved by
Howie, Levi and McFadden concerning idempotent generated semigroups of
transformations on a finite set.
","[{""version"":""v1"",""created"":""Sat, 29 Jan 2011 17:34:04 GMT""}]","2011-02-01"
"1101.5710","Jo\~ao Ara\'ujo Mr","Jo\~ao Ara\'ujo","Idempotent Generated Endomorphisms of an Independence Algebra","4 pages","Semigroup Forum Vol. 67 (2003) 464-467","10.1007/s00233-002-0020-6",,"math.GR","http://arxiv.org/licenses/nonexclusive-distrib/1.0/","  The aim of this note is to give a direct proof for the following result
proved by Fountain and Lewin: {\em Let $\alg$ be an independence algebra of
finite rank and let $a$ be a singular endomorphism of $\alg $. Then $a=e_1...
e_n$ where $e^2_i=e_i$ and $rank(a)=rank(e_i)$.}
","[{""version"":""v1"",""created"":""Sat, 29 Jan 2011 17:50:17 GMT""}]","2011-02-01"
"1101.5711","Tal Orenshtein","Tal Orenshtein and Igor Shinkar","Greedy Random Walk",,"Combinator. Probab. Comp. 23 (2014) 269-289","10.1017/S0963548313000552",,"math.PR cs.DS","http://arxiv.org/licenses/nonexclusive-distrib/1.0/","  We study a discrete time self interacting random process on graphs, which we
call Greedy Random Walk. The walker is located initially at some vertex. As
time evolves, each vertex maintains the set of adjacent edges touching it that
have not been crossed yet by the walker. At each step, the walker being at some
vertex, picks an adjacent edge among the edges that have not traversed thus far
according to some (deterministic or randomized) rule. If all the adjacent edges
have already been traversed, then an adjacent edge is chosen uniformly at
random. After picking an edge the walk jumps along it to the neighboring
vertex. We show that the expected edge cover time of the greedy random walk is
linear in the number of edges for certain natural families of graphs. Examples
of such graphs include the complete graph, even degree expanders of logarithmic
girth, and the hypercube graph. We also show that GRW is transient in $\Z^d$
for all $d \geq 3$.
","[{""version"":""v1"",""created"":""Sat, 29 Jan 2011 17:50:37 GMT""},{""version"":""v2"",""created"":""Mon, 28 Feb 2011 12:22:57 GMT""},{""version"":""v3"",""created"":""Sun, 25 Sep 2011 16:20:52 GMT""},{""version"":""v4"",""created"":""Thu, 7 Jun 2012 07:06:55 GMT""}]","2019-02-20"
"1101.5712","Ho-Seok Nam","Ho-Seok Nam and David J. Srolovitz","Molecular dynamics simulation of Ga penetration along Al grain
  boundaries under a constant strain rate condition",,,,,"cond-mat.mtrl-sci","http://arxiv.org/licenses/nonexclusive-distrib/1.0/","  While diverse fracture characteristics have been observed in liquid metal
embrittlement (LME) depending on the solid-liquid metal pairs, the penetration
of nanometer-thick liquid metal films along the grain boundary has been
identified as one of the key mechanisms for embrittlement in many classical LME
systems, such as Al-Ga, Cu-Bi and Ni-Bi. For example, liquid Ga quickly
penetrates deep into grain boundaries in Al, leading to intergranular fracture
under very small stresses. We report on a series of molecular dynamics
simulations of liquid Ga in contact with an Al bicrystal under a constant
strain rate. We identify the grain boundary dislocations that are nucleated at
the grain boundary groove tip and climb down along the grain boundary during Ga
penetration and characterize their atomic structures based on topological
method.
","[{""version"":""v1"",""created"":""Sat, 29 Jan 2011 18:00:17 GMT""}]","2011-02-01"
"1101.5713","Takashi Shimomura","Shinya Kanemura, Osamu Seto and Takashi Shimomura","Masses of dark matter and neutrino from TeV scale spontaneous
  $U(1)_{B-L}$ breaking","5 pages, 4 figures, 1 table; v2: Some discussions added. 2 figures
  and references added. Typos corrected. Final version to be published","Phys.Rev.D84:016004,2011","10.1103/PhysRevD.84.016004","UT-HET 049, HGU-CAP 008, YITP-11-10","hep-ph","http://arxiv.org/licenses/nonexclusive-distrib/1.0/","  We propose a simple testable model with mass generation mechanisms for dark
matter and neutrino based on the gauged $U(1)_{B-L}$ symmetry and an exact
$Z_2$ parity. The $U(1)_{B-L}$ symmetry is spontaneously broken at the TeV
scale, by which $Z_2$-odd right-handed neutrinos receive Majorana masses of the
electroweak scale. The lightest one is a dark matter candidate, whose stability
is guaranteed by the $Z_2$ parity. Resulting lepton number violation is
transmitted to the left-handed neutrinos $\nu_L^i$ via the loop-induced
dimension-six operator. Consequently, the tiny masses of $\nu_L^i$ can be
generated without excessive fine tuning. The observed dark matter abundance can
be reproduced by the pair annihilation via the s-channel scalar exchange due to
mixing of neutral components of $\Phi$ and $S$, where $\Phi$ and $S$
respectively represent the Higgs doublet and the additional scalar singlet with
the $B-L$ charge. The model can be tested at collider experiments as well as
flavor experiments through the discriminative predictions such as two light
neutral Higgs bosons with large mixing, invisible decays of the Higgs bosons as
well as the $B-L$ gauge boson, and lepton flavor violation.
","[{""version"":""v1"",""created"":""Sat, 29 Jan 2011 18:09:18 GMT""},{""version"":""v2"",""created"":""Wed, 27 Jul 2011 19:03:14 GMT""}]","2011-08-08"
"1101.5714","Suyoung Choi","Suyoung Choi","Torus actions on cohomology complex generalized Bott manifolds","This paper has been withdrawn by the author due to error in the final
  section",,,,"math.AT","http://arxiv.org/licenses/nonexclusive-distrib/1.0/","  A torus manifold is a closed smooth manifold of dimension $2n$ having an
effective smooth $T^n = (S^1)^n$-action with non-empty fixed points. Petrie
\cite{petrie:1973} has shown that any homotopy equivalence between a complex
projective space $\CP^n$ and a torus manifold homotopy equivalent to $\CP^n$
preserves their Pontrjagin classes. A \emph{generalized Bott manifold} is a
closed smooth manifold obtained as the total space of an iterated complex
projective space bundles over a point, where each fibration is a
projectivization of the Whitney sum of a finite many complex line bundles. For
instance, we obtain a product of complex projective spaces if all fibrations
are trivial. If each fiber is $\CP^1$, then we call it an (ordinary) \emph{Bott
manifold}. In this paper, we investigate the invariance of Pontrjagin classes
for torus manifolds whose cohomology ring is isomorphic to that of generalized
Bott manifolds. We show that any cohomology ring isomorphism between two torus
manifolds whose cohomology ring is isomorphic to that of a product of
projective spaces preserves their Pontrjagin classes, which generalizes the
Petrie's theorem. In addition, we show that any cohomology ring isomorphism
between two torus cohomology Bott manifolds preserves their Pontrjagin classes.
As a corollary, there are at most a finite number of torus manifolds homotopy
equivalent to either a given product of complex projective space or a given
Bott manifold.
","[{""version"":""v1"",""created"":""Sat, 29 Jan 2011 18:28:10 GMT""},{""version"":""v2"",""created"":""Fri, 31 Aug 2012 11:20:34 GMT""}]","2012-09-03"
"1101.5715","Benjamin Jourdain","Benjamin Jourdain (CERMICS), Sylvie M\'el\'eard (CMAP), Wojbor
  Woyczynski","L\'evy flights in ecology",,,,,"math.PR","http://arxiv.org/licenses/nonexclusive-distrib/1.0/","  We are interested in modeling Darwinian evolution resulting from the
interplay of phenotypic variation and natural selection through ecological
interactions. The population is modeled as a stochastic point process whose
generator captures the probabilistic dynamics over continuous time of birth,
mutation, and death, as influenced by each individual's trait values, and
interactions between individuals. An offspring usually inherits the trait
values of her progenitor, except when a random mutation causes the offspring to
take an instantaneous mutation step at birth to new trait values. In the case
we are interested in, the probability distribution of mutations has a heavy
tail and belongs to the domain of attraction of a stable law. We investigate
the large-population limit with allometric demographies: larger populations
made up of smaller individuals which reproduce and die faster, as is typical
for micro-organisms. We show that depending on the allometry coefficient the
limit behavior of the population process can be approximated by nonlinear
L\'evy flights of different nature: either deterministic, in the form of
nonlocal fractional reaction-diffusion equations, or stochastic, as nonlinear
super-processes with the underlying reaction and a fractional diffusion
operator. These approximation results demonstrate the existence of such
nontrivial fractional objects; their uniqueness is also proved.
","[{""version"":""v1"",""created"":""Sat, 29 Jan 2011 18:37:41 GMT""}]","2011-02-01"
"1101.5716","P{\aa}l Anders  Floor Dr","Paal Anders Floor, Anna N. Kim, Niklas Wernersson, Tor A. Ramstad,
  Mikael Skoglund, Ilangko Balasingham","Zero-Delay Joint Source-Channel Coding for a Bivariate Gaussian on a
  Gaussian MAC","27 page draft",,,,"cs.IT math.IT","http://arxiv.org/licenses/nonexclusive-distrib/1.0/","  In this paper, delay-free, low complexity, joint source-channel coding (JSCC)
for transmission of two correlated Gaussian memoryless sources over a Gaussian
Multiple Access Channel (GMAC) is considered. The main contributions of the
paper are two distributed JSCC schemes: one discrete scheme based on nested
scalar quantization, and one hybrid discrete-analog scheme based on a scalar
quantizer and a linear continuous mapping. The proposed schemes show promising
performance which improve with increasing correlation and are robust against
variations in noise level. Both schemes exhibit a constant gap to the
performance upper bound when the channel signal-to-noise ratio gets large.
","[{""version"":""v1"",""created"":""Sat, 29 Jan 2011 18:51:09 GMT""},{""version"":""v2"",""created"":""Wed, 4 Apr 2012 00:06:52 GMT""}]","2015-03-18"
"1101.5717","Fatima Soomro","Fatima Soomro","$B \to X_{s} \gamma$ and $B \to X_{s} l^{+} l^{-}$ decays at LHCb","Proceedings of CKM2010, the 6th International Workshop on the CKM
  Unitarity Triangle, University of Warwick, UK, 6-10 September 2010",,,"LHCb-PROC-2011-003","hep-ex","http://arxiv.org/licenses/nonexclusive-distrib/1.0/","  \lhcb is one of the four major experiments at the Large Hadron Collider
(\lhc) at CERN. It is custom built to look for CP violation and New Physics in
rare decays of heavy flavour hadrons, like the B and D systems. Rare decays
that occur via loop diagrams provide a way to probe New Physics at energy
scales much higher than can be probed by direct production in experiments. In
this article, the \lhcb prospects for such measurements with exclusive decays
of the type $B \to \Xs \gamma$ and $B \to X_{s} l^{+} l^{-}$ are presented.
","[{""version"":""v1"",""created"":""Sat, 29 Jan 2011 19:08:32 GMT""},{""version"":""v2"",""created"":""Tue, 1 Feb 2011 20:09:05 GMT""}]","2015-03-18"
"1101.5718","Andrea Dziubek","Andrea Dziubek","Reduced Effective Model for Condensation in Slender Tubes with
  Rotational Symmetry, Obtained by Generalized Dimensional Analysis",,,,,"physics.flu-dyn","http://arxiv.org/licenses/nonexclusive-distrib/1.0/","  Experimental results for condensation in compact heat exchangers show that
the heat transfer due to condensation is significantly better compared to
classical heat exchangers, especially when using R134a instead of water as the
refrigerant. This suggests that surface tension plays a role. Using generalized
dimensional analysis we derive reduced model equations and jump conditions for
condensation in a vertical tube with cylindrical cross section. Based on this
model we derive a single ordinary differential equation for the thickness of
the condensate film as function of the tube axis. Our model agrees well with
commonly used models from existing literature. It is based on the physical
dimensions of the problem and has greater geometrical flexibility.
","[{""version"":""v1"",""created"":""Sat, 29 Jan 2011 19:17:26 GMT""}]","2015-03-18"
"1101.5719","Arjan Verhoeff","A.P. Verhoeff, M. Min, E. Pantin, L.B.F.M. Waters, A.G.G.M. Tielens,
  M. Honda, H. Fujiwara, J. Bouwman, R. van Boekel, S.M. Dougherty, A. de
  Koter, C. Dominik, and G.D. Mulders","The complex circumstellar environment of HD142527","13 pages, 17 figures. Accepted by A&A 14 January 2011",,"10.1051/0004-6361/201014952",,"astro-ph.SR","http://arxiv.org/licenses/nonexclusive-distrib/1.0/","  The recent findings of gas giant planets around young A-type stars suggest
that disks surrounding Herbig Ae/Be stars will develop planetary systems. An
interesting case is HD142527, for which previous observations revealed a
complex circumstellar environment and an unusually high ratio of infrared to
stellar luminosity. Its properties differ considerably from other Herbig Ae/Be
stars. This suggests that the disk surrounding HD142527 is in an uncommon
evolutionary stage. We aim for a better understanding of the geometry and
evolutionary status of the circumstellar material around the Herbig Ae/Be star
HD142527. We map the composition and spatial distribution of the dust around
HD142527. We analyze SEST and ATCA millimeter data, VISIR N and Q-band imaging
and spectroscopy. We gather additional relevant data from the literature. We
use the radiative transfer code MCMax to construct a model of the geometry and
density structure of the circumstellar matter, which fits all of the
observables satisfactorily. We find that the disk of HD142527 has three
geometrically distinct components separated by a disk gap running from 30 to
130 AU. There is a geometrically flat inner disk running from 0.3 AU up to 30
AU; an optically thin halo-like component of dust in the inner disk regions;
and a massive self-shadowed outer disk running from 130 AU up to 200 AU. We
derived a total dust mass in small grains of 10^-3 M0 and a vertical height of
the inner wall of the outer disk of h = 60 AU. ....
","[{""version"":""v1"",""created"":""Sat, 29 Jan 2011 20:20:05 GMT""}]","2015-05-27"
"1101.5720","Aron Walsh","Aron Walsh, Juarez L. F. Da Silva and Su-Huai Wei","Multi-component Transparent Conducting Oxides: Progress in Materials
  Modelling","Part of a themed issue of Journal of Physics: Condensed Matter on
  ""Semiconducting Oxides"". In Press (2011)","Journal of Physics: Condensed Matter 23, 334210 (2011)","10.1088/0953-8984/23/33/334210",,"cond-mat.mtrl-sci","http://arxiv.org/licenses/nonexclusive-distrib/1.0/","  Transparent conducting oxides (TCOs) play an essential role in modern
optoelectronic devices through their combination of electrical conductivity and
optical transparency. We review recent progress in our understanding of
multi-component TCOs formed from solid-solutions of ZnO, In2O3, Ga2O3 and
Al2O3, with a particular emphasis on the contributions of materials modelling,
primarily based on Density Functional Theory. In particular, we highlight three
major results from our work: (i) the fundamental principles governing the
crystal structures of multi-component oxide structures including (In2O3)(ZnO)n,
named IZO, and (In2O3)m(Ga2O3)l(ZnO)n, named IGZO; (ii) the relationship
between elemental composition and optical and electrical behaviour, including
valence band alignments; (iii) the high-performance of amorphous oxide
semiconductors. From these advances, the challenge of the rational design of
novel electroceramic materials is discussed.
","[{""version"":""v1"",""created"":""Sat, 29 Jan 2011 20:45:20 GMT""}]","2013-09-18"
"1101.5721","Mohammad Jamall","Mohammad Shoaib Jamall","A Coloring Algorithm for Triangle-Free Graphs","22 pages",,,,"math.CO","http://arxiv.org/licenses/nonexclusive-distrib/1.0/","  We give a randomized algorithm that properly colors the vertices of a
triangle-free graph G on n vertices using O(\Delta(G)/ log \Delta(G)) colors,
where \Delta(G) is the maximum degree of G. The algorithm takes
O(n\Delta2(G)log\Delta(G)) time and succeeds with high probability, provided
\Delta(G) is greater than log^{1+{\epsilon}}n for a positive constant
{\epsilon}. The number of colors is best possible up to a constant factor for
triangle-free graphs. As a result this gives an algorithmic proof for a sharp
upper bound of the chromatic number of a triangle-free graph, the existence of
which was previously established by Kim and Johansson respectively.
","[{""version"":""v1"",""created"":""Sat, 29 Jan 2011 20:46:25 GMT""}]","2011-02-01"
"1101.5722","Mark Coffey","Mark W. Coffey","Evaluation of some second moment and other integrals for the Riemann,
  Hurwitz, and Lerch zeta functions","30 pages, no figures",,,,"math-ph math.MP","http://arxiv.org/licenses/nonexclusive-distrib/1.0/","  Several second moment and other integral evaluations for the Riemann zeta
function $\zeta(s)$, Hurwitz zeta function $\zeta(s,a)$, and Lerch zeta
function $\Phi(z,s,a)$ are presented. Additional corollaries that are obtained
include previously known special cases for the Riemann zeta function
$\zeta(s)=\zeta(s,1)=\Phi(1,s,1)$. An example special case is: $$\int_R
{{|\zeta(1/2+it)|^2} \over {t^2+1/4}}dt=2\pi[\ln(2\pi)-\gamma],$$ with $\gamma$
the Euler constant. The asymptotic forms of certain fractional part integrals,
with and without logarithmic factors in the integrand, are presented.
Extensions and other approaches are mentioned.
","[{""version"":""v1"",""created"":""Sat, 29 Jan 2011 20:47:25 GMT""}]","2011-02-01"
"1101.5723","Tarek Khalil","Tarek Khalil, Jean Richert","Study of the spectral properties of spin ladders in different
  representations via a renormalization procedure","to be published in Physica B","Physica B406:1395-1402, 2011","10.1016/j.physb.2011.01.036",,"quant-ph cond-mat.str-el nucl-th","http://arxiv.org/licenses/nonexclusive-distrib/1.0/","  We implement an algorithm which is aimed to reduce the dimensions of the
Hilbert space of quantum many-body systems by means of a renormalization
procedure. We test the role and importance of different representations on the
reduction process by working out and analyzing the spectral properties of
strongly interacting frustrated quantum spin systems.
","[{""version"":""v1"",""created"":""Sat, 29 Jan 2011 20:53:06 GMT""}]","2015-05-27"
"1101.5724","Carlos Prieto","Marcelo A. Aguilar and Carlos Prieto","Equivariant Dold-Thom topological groups",,,,,"math.AT","http://arxiv.org/licenses/nonexclusive-distrib/1.0/","  Let $M$ be a covariant coefficient system for a finite group $G$. In this
paper we analyze several topological abelian groups, some of them new, whose
homotopy groups are isomorphic to the Bredon-Illman $G$-equivariant homology
theory with coefficients in $M$. We call these groups equivariant Dold-Thom
topological groups and we show that they are unique up to homotopy. We use one
of the new groups to prove that the Bredon-Illman homology satisfies the
infinite-wedge axiom and to make some calculations of the 0th equivariant
homology.
","[{""version"":""v1"",""created"":""Sat, 29 Jan 2011 21:00:10 GMT""}]","2011-02-01"
