"1101.5725","Daniel Davis","Daniel Davis","Function spectra and continuous G-spectra","submitted for publication",,"10.1112/blms/bdr049",,"math.AT","http://arxiv.org/licenses/nonexclusive-distrib/1.0/","  Let G be a profinite group, {X_alpha}_alpha a cofiltered diagram of discrete
G-spectra, and Z a spectrum with trivial G-action. We show how to define the
homotopy fixed point spectrum F(Z, holim_alpha X_alpha)^{hG} and that when G
has finite virtual cohomological dimension (vcd), it is equivalent to F(Z,
holim_alpha (X_alpha)^{hG}). With these tools, we show that the K(n)-local
Spanier-Whitehead dual is always a homotopy fixed point spectrum, a well-known
Adams-type spectral sequence is actually a descent spectral sequence, and, for
a sufficiently nice k-local profinite G-Galois extension E, with K a closed
normal subgroup of G, the equivalence (E^{h_kK})^{h_kG/K} \simeq E^{h_kG} (due
to Behrens and the author), where (-)^{h_k(-)} denotes k-local homotopy fixed
points, can be upgraded to an equivalence that just uses ordinary (non-local)
homotopy fixed points, when G/K has finite vcd.
","[{""version"":""v1"",""created"":""Sat, 29 Jan 2011 21:41:51 GMT""}]","2014-02-26"
"1101.5726","Khan W. Mahmud","K. W. Mahmud, E. N. Duchon, Y. Kato, N. Kawashima, R. T. Scalettar,
  and N. Trivedi","Finite temperature study of bosons in a two dimensional optical lattice","13 pages, 9 figures","Phys. Rev. B 84, 054302 (2011)","10.1103/PhysRevB.84.054302",,"cond-mat.quant-gas cond-mat.stat-mech","http://arxiv.org/licenses/nonexclusive-distrib/1.0/","  We use quantum Monte Carlo (QMC) simulations to study the combined effects of
harmonic confinement and temperature for bosons in a two dimensional optical
lattice. The scale invariant, finite temperature, state diagram is presented
for the Bose-Hubbard model in terms of experimental parameters -- the particle
number, confining potential and interaction strength. To distinguish the nature
of the spatially separated superfluid, Mott Insulator and normal Bose liquid
phases, we examine the local density, compressibility, superfluid density and
Green's function. In the annular superfluid rings, as the width of the ring
decreases, the long range superfluid correlations start to deviate from an
equivalent homogeneous 2D system. At zero temperature, the correlation decay is
intermediate between 1D and 2D, while at finite temperature, the decay is
similar to that in 1D at a much lower temperature. The calculations reveal
shortcomings of the local density approximation (LDA) in describing superfluid
properties of trapped bosons. We also present the finite temperature phase
diagram for the homogeneous two dimensional Bose-Hubbard model. We compare our
state diagram with the results of a recent experiment at NIST on a harmonically
trapped 2D lattice [Phys. Rev. Lett. 105, 110401 (2010)], and identify a finite
temperature effect in the experiment.
","[{""version"":""v1"",""created"":""Sat, 29 Jan 2011 21:49:21 GMT""}]","2015-03-18"
"1101.5727","Arman Cingoz","A. Cingoz, D. C. Yost, T. K. Allison, A. Ruehl, M. E. Fermann, I.
  Hartl, J. Ye","Broadband Phase-Noise Suppression in a Yb-Fiber Frequency Comb","4 pages, 3 figures","Optics Letters, Vol. 36, Issue 5, pp. 743-745 (2011)","10.1364/OL.36.000743",,"physics.optics","http://arxiv.org/licenses/nonexclusive-distrib/1.0/","  We report a simple technique to suppress high frequency phase noise of a
Yb-based fiber optical frequency comb using an active intensity noise servo.
Out-of-loop measurements of the phase noise using an optical heterodyne beat
with a continuous wave (cw) laser show suppression of phase noise by \geq7 dB
out to Fourier frequencies of 100 kHz with a unity-gain crossing of -700 kHz.
These results are enabled by the strong correlation between the intensity and
phase noise of the laser. Detailed measurements of intensity and phase noise
spectra, as well as transfer functions, reveal that the dominant phase and
intensity noise contribution above -100 kHz is due to amplified spontaneous
emission (ASE) or other quantum noise sources.
","[{""version"":""v1"",""created"":""Sat, 29 Jan 2011 22:17:24 GMT""}]","2015-03-18"
"1101.5728","Daniel Whiteson","The CDF Collaboration","Search for heavy bottom-like quarks decaying to an electron or muon and
  jets in $p\bar{p}$ collisions at $\sqrt{s}=1.96$ TeV","For submission to PRL","Phys.Rev.Lett.106:141803,2011","10.1103/PhysRevLett.106.141803",,"hep-ex","http://arxiv.org/licenses/nonexclusive-distrib/1.0/","  We report the most sensitive direct search for pair production of
fourth-generation bottom-like chiral quarks ($b'$) each decaying promptly to
$tW$. We search for an excess of events with an electron or muon, at least five
jets (one indentified as due to a $b$ or $c$ quark) and an imbalance of
transverse momentum using data from $p\bar{p}$ collisions collected by the CDF
II detector at Fermilab with an integrated luminosity of 4.8 fb$^{-1}$. We
observe events consistent with background expectation and calculate upper
limits on the $b'$ pair production cross section ($\sigma_{b\bar{b'}}\lesssim
30$ fb for $m_{b'}>$375 GeV/$c^2$) and exclude $m_{b'}<372$ \gevcc at 95%
confidence level.
","[{""version"":""v1"",""created"":""Sat, 29 Jan 2011 22:36:58 GMT""}]","2015-03-18"
"1101.5729","Andrii Sofiienko","V.Ya. Degoda and A.O. Sofienko","Specific features of the luminescence and conductivity of zinc selenide
  on exposure to X-ray and optical excitation","7 pages, 7 figures, published in Fizika i Tekhnika Poluprovodnikov,
  2010, Vol. 44, No. 5, pp. 594-599","Semiconductors, Vol. 44, N. 5, 2010, P. 568-574","10.1134/S1063782610050040",,"cond-mat.mtrl-sci","http://creativecommons.org/licenses/by/3.0/","  The set of experimental data on the X-ray-excited luminescence and X-ray
induced conductivity of ZnSe are compared to the data on the photoluminescence
and photoconductivity. It is experimentally established that the
current-voltage characteristics and the kinetics of phosphorescence and current
relaxation depend on the type of excitation. It is found that the external
electric field influences the intensity and shape of bands in the luminescence
spectra. It is shown that the character of excitation defines the kinetics of
recombination, charge carrier trapping, and conductivity in wide-gap
semiconductors.
","[{""version"":""v1"",""created"":""Sat, 29 Jan 2011 22:41:47 GMT""}]","2011-02-01"
"1101.5730","Andr\'e Gomes","Andr\'e Gomes","Foliations on double-twisted products",,,,,"math.DG","http://arxiv.org/licenses/nonexclusive-distrib/1.0/","  In this paper we present a certain class of geodesic vector fields of the
double-twisted product R X R. Some examples of totally geodesic foliations are
given.
","[{""version"":""v1"",""created"":""Sat, 29 Jan 2011 22:46:47 GMT""}]","2011-02-01"
"1101.5731","Daniel Bliss","Daniel W. Bliss and Siddhartan Govindasamy","Minimizing Hidden-Node Network Interference by Optimizing SISO and MIMO
  Spectral Efficiency","12 pages, 6 figures, contributed to the 2010 IEEE Asilomar Conference
  on Signals, Systems and Computers",,,,"cs.IT math.IT","http://arxiv.org/licenses/nonexclusive-distrib/1.0/","  In this paper, the optimal spectral efficiency (data rate divided by the
message bandwidth) that minimizes the probability of causing disruptive
interference for ad hoc wireless networks or cognitive radios is investigated.
Two basic problem constraints are considered: a given message size, or fixed
data rate. Implicitly, the trade being optimized is between longer transmit
duration and wider bandwidth versus higher transmit power. Both single-input
single-output (SISO) and multiple-input multiple-output (MIMO) links are
considered. Here, a link optimizes its spectral efficiency to be a ""good
neighbor."" The probability of interference is characterized by the probability
that the signal power received by a hidden node in a wireless network exceeds
some threshold. The optimized spectral efficiency is a function of the
transmitter-to-hidden-node channel exponent, exclusively. It is shown that for
typical channel exponents a spectral efficiency of slightly greater than
1~b/s/Hz per antenna is optimal. It is also shown that the optimal spectral
efficiency is valid in the environment with multiple hidden nodes. Also
explicit evaluations of the probability of collisions is presented as a
function of spectral efficiency.
","[{""version"":""v1"",""created"":""Sat, 29 Jan 2011 23:04:33 GMT""}]","2015-03-18"
"1101.5732","Andrea Dziubek","Andrea Dziubek","Equations for two-phase flows: a primer",,,,,"physics.flu-dyn","http://arxiv.org/licenses/nonexclusive-distrib/1.0/","  The main goal of these notes is to give a review of the equations for two
phase flow problems with an interface between the two phases in a
self-contained way, and, in particular, to properly include surface tension
into the interface balance equations.
","[{""version"":""v1"",""created"":""Sat, 29 Jan 2011 23:22:02 GMT""}]","2011-02-01"
"1101.5733","Alexander Philippov","V. S. Beskin, A. A. Philippov","On the radio wave propagation in the pulsar magnetosphere","5 pages, 2 figures, 2 tables, short version of the paper for MNRAS
  (in preparation)",,,,"astro-ph.HE","http://arxiv.org/licenses/nonexclusive-distrib/1.0/","  The key properties of the wave propagation theory in the magntosphere of
radio pulsars based on the Kravtsov-Orlov equation are presented. It is shown
that for radio pulsars with known circular polarization and the swing of the
linear polarization position angle one can determine which mode, ordinary or
extraordinary one, forms mainly the mean profile of the radio emission. The
comparison of the observational data with the theory predictions demonstrates
their good agreement.
","[{""version"":""v1"",""created"":""Sat, 29 Jan 2011 23:26:45 GMT""},{""version"":""v2"",""created"":""Mon, 6 Jun 2011 12:39:12 GMT""}]","2015-03-18"
"1101.5734","Yilun Chen","Yilun Chen, Alfred O. Hero III","Recursive $\ell_{1,\infty}$ Group lasso","8 pages, double column, 6 figures",,"10.1109/TSP.2012.2192924",,"stat.ME stat.ML","http://arxiv.org/licenses/nonexclusive-distrib/1.0/","  We introduce a recursive adaptive group lasso algorithm for real-time
penalized least squares prediction that produces a time sequence of optimal
sparse predictor coefficient vectors. At each time index the proposed algorithm
computes an exact update of the optimal $\ell_{1,\infty}$-penalized recursive
least squares (RLS) predictor. Each update minimizes a convex but
nondifferentiable function optimization problem. We develop an online homotopy
method to reduce the computational complexity. Numerical simulations
demonstrate that the proposed algorithm outperforms the $\ell_1$ regularized
RLS algorithm for a group sparse system identification problem and has lower
implementation complexity than direct group lasso solvers.
","[{""version"":""v1"",""created"":""Sat, 29 Jan 2011 23:55:49 GMT""}]","2015-05-27"
"1101.5735","Lawrence Rudnick","Lawrence Rudnick, Shea Brown, Damon Farnsworth","Shocking news outside of cluster cores","7 pages, 8 figures, to appear in the proceedings of the conference
  ""Non-thermal Phenomena in Colliding Galaxy Clusters"" (Nice, 15-18 November,
  2010), Memorie della Societa Astronomica Italiana",,,,"astro-ph.CO","http://arxiv.org/licenses/nonexclusive-distrib/1.0/","  With magnetic fields below one microgauss, the minimum pressures of
synchrotron plasmas start to approach those in the thermal gas in cluster
outskirts and the more diffuse WHIM in large-scale structure filaments. We
summarize some of our techniques to find the corresponding low surface
brightness radio sources and what we have uncovered. We identify cluster-like
sources in poor environments, likely requiring very efficient relativistic
particle acceleration, as well as very diffuse radio galaxies with no
indications of current activity. More detailed observations of Coma and a new
radio-identified cluster highlight some emerging issues in cluster-related
shocks: Coma has a shock on the border of its halo, suggesting a connection
between the two; the Coma relic appears to be an ""infall"" shock, associated
with a 500 km/s infalling column of galaxies; the new cluster has filamentary
pieces in addition to its more classical halo and peripheral relics, suggesting
that we are beginning to see relic emission face on. Finally, a different kind
of shock comes from our recent finding of ambiguities in the determination of
rotation measures which will influence cluster magnetic field studies.
","[{""version"":""v1"",""created"":""Sun, 30 Jan 2011 00:11:56 GMT""}]","2011-02-01"
"1101.5736","Zhi-Xi Wang","Zhen Wang, He-Ping Wang, Zhi-Xi Wang and Shao-Ming Fei","Local unitary equivalent consistence for n-party states and their
  (n-1)-party reduced density matrices","6 pages, no figures","CHIN. PHYS. LETT. Vol. 28, No. 2 (2011) 020302","10.1088/0256-307X/28/2/020302",,"quant-ph","http://arxiv.org/licenses/nonexclusive-distrib/1.0/","  We present that the local unitary equivalence of n-party pure states is
consistent with the one of their (n-1)-party reduced density matrices. As an
application, we obtain the local invariants for a class of tripartite pure
qudits.
","[{""version"":""v1"",""created"":""Sun, 30 Jan 2011 00:48:25 GMT""}]","2011-02-01"
"1101.5737","Mark Simon","V. G. Karpov, M. Nardone, and M. Simon","Thermodynamics of second phase conductive filaments",,,"10.1063/1.3592983",,"cond-mat.mtrl-sci","http://arxiv.org/licenses/nonexclusive-distrib/1.0/","  We present a theory of second phase conductive filaments in phase
transformable systems; applications include threshold switches, phase change
memory, and shunting in thin film structures. We show that the average filament
parameters can be described thermodynamically. In agreement with the published
data, the predicted filament current voltage characteristics exhibit negative
differential resistance vanishing at high currents where the current density
becomes a bulk material property. Our description is extendible to filament
transients and allows for efficient numerical simulation.
","[{""version"":""v1"",""created"":""Sun, 30 Jan 2011 01:17:26 GMT""},{""version"":""v2"",""created"":""Sun, 27 Feb 2011 23:44:13 GMT""}]","2015-05-27"
"1101.5738","Sunil Chebolu","Sunil K. Chebolu","A small quotient of the big absolute Galois group (joint work with Ido
  Efrat and J\'{a}n Min\'{a}\v{c})","to appear in Oberwolfach Report","Oberwolfach Report 32 (2010) 14-17",,,"math.NT","http://arxiv.org/licenses/nonexclusive-distrib/1.0/","  This is a report of a talk given at the Oberwolfach workshop on ""cohomology
of finite groups: Interactions and applications"" which was held during July
25th - July 31st, 2010. It is an announcement of some of the results (with
motivation) and their applications from the paper ""Quotients of absolute Galois
groups which determine the entire Galois cohomology""; see arXiv:0905.1364.
","[{""version"":""v1"",""created"":""Sun, 30 Jan 2011 01:40:13 GMT""}]","2011-11-08"
"1101.5739","Dongchan Jeong","Dongchan Jeong, Jae-Hyun Choi, Gil-Ho Lee, Sanghyun Jo, Yong-Joo Doh,
  Hu-Jong Lee","Observation of Supercurrent in PbIn-Graphene-PbIn Josephson Junction","8 pages, 7 figures, accepted in PRB",,"10.1103/PhysRevB.83.094503",,"cond-mat.mes-hall cond-mat.supr-con","http://arxiv.org/licenses/nonexclusive-distrib/1.0/","  Superconductor-graphene-superconductor (SGS) junction provides a unique
platform to study relativistic electrodynamics of Dirac fermions combined with
proximity-induced superconductivity. We report observation of the Josephson
effect in proximity-coupled superconducting junctions of graphene in contact
with Pb1-xInx (x=0.07) electrodes for temperatures as high as T = 4.8K, with a
large IcRn (~ 255 microV). This demonstrates that Pb1-xInx SGS junction would
facilitate the development of the superconducting quantum information devices
and superconductor-enhanced phase-coherent transport of graphene.
","[{""version"":""v1"",""created"":""Sun, 30 Jan 2011 02:13:07 GMT""}]","2015-05-27"
"1101.5740","Todor Todorov D.","Todor D. Todorov","An axiomatic approach to the non-linear theory of generalized functions
  and consistency of Laplace transforms","23 pages","Integral Transforms and Special Functions, Volume 22, Issue 9,
  2011, Pages 695-708",,,"math.FA","http://arxiv.org/licenses/nonexclusive-distrib/1.0/","  We offer an axiomatic definition of a differential algebra of generalized
functions over an algebraically closed non-Archimedean field. This algebra is
of Colombeau type in the sense that it contains a copy of the space of Schwartz
distributions. We study the uniqueness of the objects we define and the
consistency of our axioms. Next, we identify an inconsistency in the
conventional Laplace transform theory. As an application we offer a free of
contradictions alternative in the framework of our algebra of generalized
functions. The article is aimed at mathematicians, physicists and engineers who
are interested in the non-linear theory of generalized functions, but who are
not necessarily familiar with the original Colombeau theory. We assume,
however, some basic familiarity with the Schwartz theory of distributions.
","[{""version"":""v1"",""created"":""Sun, 30 Jan 2011 02:34:02 GMT""},{""version"":""v2"",""created"":""Mon, 4 Jul 2011 05:06:42 GMT""},{""version"":""v3"",""created"":""Wed, 20 Jul 2011 20:37:28 GMT""},{""version"":""v4"",""created"":""Mon, 25 Jul 2011 17:34:45 GMT""},{""version"":""v5"",""created"":""Mon, 12 Sep 2011 17:40:18 GMT""}]","2015-03-18"
"1101.5741","George  Kerchev G","George Kerchev","On the filtration of a free algebra by its associative lower central
  series",,,,,"math.RA","http://arxiv.org/licenses/nonexclusive-distrib/1.0/","  This paper concerns the associative lower central series ideals $M_i$ of the
free algebra $A_n$ on $n$ generators. Namely, we study the successive quotients
$N_i=M_i/M_{i+1}$, which admit an action of the Lie algebra $W_n$ of vector
fields on $\Bbb C^n$. We bound the degree $|\lambda|$ of tensor field modules
$F_\lambda$ appearing in the Jordan-H\""older series of each $N_i$, confirming a
recent conjecture of Arbesfeld and Jordan. As an application, we compute these
decompositions for small $n$ and $i$.
","[{""version"":""v1"",""created"":""Sun, 30 Jan 2011 03:00:39 GMT""},{""version"":""v2"",""created"":""Wed, 19 Dec 2012 08:17:17 GMT""},{""version"":""v3"",""created"":""Thu, 3 Jan 2013 19:41:27 GMT""}]","2013-01-04"
"1101.5742","Zhijun Qiao","Zhaqilaoa and Zhijun Qiao","N-soliton solutions of an integrable equation studied by Qiao","some errors",,,,"nlin.SI math-ph math.MP nlin.PS","http://arxiv.org/licenses/nonexclusive-distrib/1.0/","  In this paper, we studied N-soliton solutions of an integrable equation.
","[{""version"":""v1"",""created"":""Sun, 30 Jan 2011 03:02:24 GMT""},{""version"":""v2"",""created"":""Mon, 28 Feb 2011 22:16:32 GMT""},{""version"":""v3"",""created"":""Tue, 28 Feb 2023 14:20:11 GMT""}]","2023-03-01"
"1101.5743","Amir Dembo","Amir Dembo and Fuchang Gao","Persistence of iterated partial sums",,,,,"math.PR","http://arxiv.org/licenses/nonexclusive-distrib/1.0/","  Let p_n denote the persistence probability that the first n iterated partial
sums of integrable, zero-mean, i.i.d. random variables X_k, are negative. We
show that p_n is bounded above up to universal constant by the square root of
the expected absolute value of the empirical average of {X_k}. A converse bound
holds whenever P(-X_1>t) is up to constant exp(-b t) for some b>0 or when
P(-X_1>t) decays super-exponentially in t. Consequently, for such random
variables we have that p_n decays as n^{-1/4} if X_1 has finite second moment.
In contrast, we show that for any 0 < c < 1/4 there exist integrable, zero-mean
random variables for which the rate of decay of p_n is n^{-c}.
","[{""version"":""v1"",""created"":""Sun, 30 Jan 2011 03:03:31 GMT""}]","2011-02-01"
"1101.5744","Sinu Mathew","S. Mathew, T.K. Chan, D. Zhan, K. Gopinadhan, A.R. Barman, M.B.H.
  Breese, S. Dhar, Z.X. Shen, T. Venkatesan and John TL Thong","The effect of layer number and substrate on the stability of graphene
  under MeV proton beam irradiation","20 pages, 5 figures","CARBON (2011)","10.1016/j.carbon.2010.12.057",,"cond-mat.mes-hall","http://arxiv.org/licenses/nonexclusive-distrib/1.0/","  The use of graphene electronics in space will depend on the radiation
hardness of graphene. The damage threshold of graphene samples, subjected to 2
MeV proton irradiation, was found to increase with layer number and also when
the graphene layer was supported by a substrate. The thermal properties of
graphene as a function of the number of layers or as influenced by the
substrate argue against a thermal model for the production of damage by the ion
beam. We propose a model of intense electronically-stimulated surface
desorption of the atoms as the most likely process for this damage mechanism.
","[{""version"":""v1"",""created"":""Sun, 30 Jan 2011 04:20:55 GMT""}]","2011-02-01"
"1101.5745","Jan Mandel","Jan Mandel, Jonathan D. Beezley, and Adam K. Kochanski","An overview of the coupled atmosphere-wildland fire model WRF-Fire","91st American Meteorological Society Annual Meeting, Seattle, WA,
  January 2011",,,"UCD CCM Report 294","physics.ao-ph","http://arxiv.org/licenses/nonexclusive-distrib/1.0/","  We describe the coupled atmosphere-wildfire model WRF-Fire, which is
distributed as a part of WRF. The fire module is based on a fire-spread model,
implemented by the level-set method. In each time step, the fire module takes
the wind as input and returns the latent and sensible heat fluxes. We report on
the software architecture and features of the software.
","[{""version"":""v1"",""created"":""Sun, 30 Jan 2011 05:44:34 GMT""}]","2011-02-01"
"1101.5746","Hiroaki Kouno","Hiroaki Kouno, Yuji Sakai, Takahiro Sasaki, Kouji Kashiwa and Masanobu
  Yahiro","Violations of parity and charge conjugation in the theta vacuum with
  imaginary chemical potential","Twelve pages, 26 figures. Figure 7, 11 and 12 have been added. Figure
  13(a) has been revised. Some sentences and references have been added. Typos
  have been corrected","Phys.Rev.D83:076009,2011","10.1103/PhysRevD.83.076009","SAGA-HE-267","hep-ph hep-lat hep-th math-ph math.MP nucl-th","http://arxiv.org/licenses/nonexclusive-distrib/1.0/","  Charge conjugation (C) and Parity (P) are exact symmetries at theta =pi and
Theta = mu/(iT)=pi, where theta is the parameter of the so-called theta-vacuum,
mu is the imaginary quark-number chemical potential and T is the temperature.
Spontaneous breakings of these discrete symmetries are investigated by the the
Polyakov-loop extended Nambu--Jona-Lasinio (PNJL) model. At zero T, P symmetry
is spontaneously broken while C symmetry is conserved. As T increases, P
symmetry is restored just after C symmetry is spontaneously broken, so that
either P or C symmetry or both the symmetries are spontaneously broken for any
T. The chiral-symmetry restoration and the deconfinement transition at theta
=Theta =0 are remnants of the P restoration and the C breaking at theta =Theta
=pi, respectively.
","[{""version"":""v1"",""created"":""Sun, 30 Jan 2011 06:06:36 GMT""},{""version"":""v2"",""created"":""Mon, 14 Mar 2011 11:27:45 GMT""}]","2011-07-19"
"1101.5747","Xueliang Li","Xueliang Li, Yuefang Sun","Rainbow connections of graphs -- A survey","34 pages",,,,"math.CO cs.DM","http://arxiv.org/licenses/nonexclusive-distrib/1.0/","  The concept of rainbow connection was introduced by Chartrand et al. in 2008.
It is fairly interesting and recently quite a lot papers have been published
about it. In this survey we attempt to bring together most of the results and
papers that dealt with it. We begin with an introduction, and then try to
organize the work into five categories, including (strong) rainbow connection
number, rainbow $k$-connectivity, $k$-rainbow index, rainbow vertex-connection
number, algorithms and computational complexity. This survey also contains some
conjectures, open problems or questions.
","[{""version"":""v1"",""created"":""Sun, 30 Jan 2011 06:18:22 GMT""},{""version"":""v2"",""created"":""Tue, 1 Feb 2011 08:32:04 GMT""}]","2011-02-02"
