"1108.0805","Guillem Aumatell","Guillem Aumatell and Gerhard Wurm","Breaking the Ice: Planetesimal Formation at the Snowline","6 pages, 9 figures",,"10.1111/j.1745-3933.2011.01126.x",,"astro-ph.EP","http://arxiv.org/licenses/nonexclusive-distrib/1.0/","  Recently Saito & Sirono (2011) proposed that large ice aggregates which drift
in- wards in protoplanetary disks break up during sublimation, ejecting
embedded silicate particles. This would lead to a concentration of small solid
particles close to the snow- line. In view of this model we carried out
laboratory experiments where we observed freely levitating ice aggregates
sublimating. We find that frequent break up is indeed very common. Scaled to a
10 cm aggregate about 2x10^4 small silicate aggregates might result. This
supports the idea that sublimation of drifting ice aggregates might locally
increase the density of small dust (silicate) particles which might more easily
be swept up by larger dust aggregates or trigger gravitational instability.
Either way this might locally boost the formation of planetesimals at the
snowline.
","[{""version"":""v1"",""created"":""Wed, 3 Aug 2011 09:53:41 GMT""}]","2016-11-25"
"1108.0806","Marina Prokhorova Dr.","Marina Prokhorova","The spectral flow for Dirac operators on compact planar domains with
  local boundary conditions","33 pages, 4 figures; section 9 added","Communications in Mathematical Physics, 322 (2013), 385-414","10.1007/s00220-013-1701-6",,"math-ph math.AP math.MP math.SP","http://arxiv.org/licenses/nonexclusive-distrib/1.0/","  Let $D_t$, $t \in [0,1]$ be an arbitrary 1-parameter family of Dirac type
operators on a two-dimensional disk with $m-1$ holes. Suppose that all
operators $D_t$ have the same symbol, and that $D_1$ is conjugate to $D_0$ by a
scalar gauge transformation. Suppose that all operators $D_t$ are considered
with the same locally elliptic boundary condition, given by a vector bundle
over the boundary. Our main result is a computation of the spectral flow for
such a family of operators. The answer is obtained up to multiplication by an
integer constant depending only on the number of the holes in the disk. This
constant is calculated explicitly for the case of the annulus ($m=2$).
","[{""version"":""v1"",""created"":""Wed, 3 Aug 2011 09:56:29 GMT""},{""version"":""v2"",""created"":""Thu, 8 Mar 2012 12:58:56 GMT""},{""version"":""v3"",""created"":""Sat, 12 May 2012 15:15:10 GMT""}]","2013-07-17"
"1108.0807","Vitalii Dugaev","M. Taillefumier, V. K. Dugaev, B. Canals, C. Lacroix, and P. Bruno","Graphene in periodically alternating magnetic field: unusual
  quantization of the anomalous Hall effect","6 pages, 5 figures",,"10.1103/PhysRevB.84.085427",,"cond-mat.mtrl-sci","http://arxiv.org/licenses/nonexclusive-distrib/1.0/","  We study the energy spectrum and electronic properties of graphene in a
periodic magnetic field of zero average with a symmetry of triangular lattice.
The periodic field leads to formation of a set of minibands separated by gaps,
which can be manipulated by external field. The Berry phase, related to the
motion of electrons in $k$ space, and the corresponding Chern numbers
characterizing topology of the energy bands are calculated analytically and
numerically. In this connection, we discuss the anomalous Hall effect in the
insulating state, when the Fermi level is located in the minigap. The results
of calculations show that in the model of gapless Dirac spectrum of graphene
the anomalous Hall effect can be treated as a sum of fractional quantum
numbers, related to the nonequivalent Dirac points.
","[{""version"":""v1"",""created"":""Wed, 3 Aug 2011 10:00:23 GMT""}]","2015-05-30"
"1108.0808","Jean-Francois Dat","Jean-Francois Dat","A geometric interpretation of the nilpotent part of local Langlands
  correspondence modulo l","28 p",,,,"math.NT math.AG math.RT","http://arxiv.org/licenses/nonexclusive-distrib/1.0/","  Let p and l be two distinct primes. We show how, under a certain congruence
hypothesis, the mod l cohomology of the Lubin-Tate tower together with a
certain Lefschetz operator provides a geometric interpretation of Vigneras'
Langlands correspondence for a p-adic field with mod l coefficients.
","[{""version"":""v1"",""created"":""Wed, 3 Aug 2011 10:05:33 GMT""}]","2011-08-04"
"1108.0809","Peter Robinson","John Augustine, Gopal Pandurangan, Peter Robinson, Eli Upfal","Distributed Agreement in Dynamic Peer-to-Peer Networks","to appear at the Journal of Computer and System Sciences; preliminary
  version appeared at SODA 2012",,,,"cs.DS cs.DC","http://arxiv.org/licenses/nonexclusive-distrib/1.0/","  Motivated by the need for robust and fast distributed computation in highly
dynamic Peer-to-Peer (P2P) networks, we study algorithms for the fundamental
distributed agreement problem. P2P networks are highly dynamic networks that
experience heavy node {\em churn}. Our goal is to design fast algorithms
(running in a small number of rounds) that guarantee, despite high node churn
rate, that almost all nodes reach a stable agreement. Our main contributions
are randomized distributed algorithms that guarantee {\em stable
almost-everywhere agreement} with high probability even under high adversarial
churn in a polylogarithmic number of rounds:
  1. An $O(\log^2 n)$-round ($n$ is the stable network size) randomized
algorithm that achieves almost-everywhere agreement with high probability under
up to {\em linear} churn {\em per round} (i.e., $\epsilon n$, for some small
constant $\epsilon > 0$), assuming that the churn is controlled by an oblivious
adversary (that has complete knowledge and control of what nodes join and leave
and at what time and has unlimited computational power, but is oblivious to the
random choices made by the algorithm). Our algorithm requires only
polylogarithmic in $n$ bits to be processed and sent (per round) by each node.
  2. An $O(\log m\log^3 n)$-round randomized algorithm that achieves
almost-everywhere agreement with high probability under up to $\epsilon
\sqrt{n}$ churn per round (for some small $\epsilon > 0$), where $m$ is the
size of the input value domain, that works even under an adaptive adversary
(that also knows the past random choices made by the algorithm). This algorithm
requires up to polynomial in $n$ bits (and up to $O(\log m)$ bits) to be
processed and sent (per round) by each node.
","[{""version"":""v1"",""created"":""Wed, 3 Aug 2011 10:09:45 GMT""},{""version"":""v2"",""created"":""Wed, 10 Sep 2014 08:38:38 GMT""}]","2015-03-19"
"1108.0810","Marcin Pilipczuk","Marek Cygan and Marcin Pilipczuk and Micha{\l} Pilipczuk and Jakub
  Onufry Wojtaszczyk","Scheduling partially ordered jobs faster than 2^n","full version of a paper accepted for ESA'11",,,,"cs.DS","http://arxiv.org/licenses/nonexclusive-distrib/1.0/","  In the SCHED problem we are given a set of n jobs, together with their
processing times and precedence constraints. The task is to order the jobs so
that their total completion time is minimized. SCHED is a special case of the
Traveling Repairman Problem with precedences. A natural dynamic programming
algorithm solves both these problems in 2^n n^O(1) time, and whether there
exists an algorithms solving SCHED in O(c^n) time for some constant c < 2 was
an open problem posted in 2004 by Woeginger. In this paper we answer this
question positively.
","[{""version"":""v1"",""created"":""Wed, 3 Aug 2011 10:12:03 GMT""},{""version"":""v2"",""created"":""Fri, 29 Jun 2012 11:59:56 GMT""}]","2012-07-02"
"1108.0811","Igor O. Cherednikov","I.O. Cherednikov, N.G. Stefanis","Transverse-momentum-dependent parton distributions at the edge of the
  lightcone","10 pages, 2 figures; needs ws-ijmpcs.cls (supplied). Invited talk
  presented at Workshop ""QCD evolution of parton distributions: from collinear
  to non-collinear case"", 8 - 9 Apr 2011, Thomas Jefferson National Accelerator
  Facility, Newport News (VA), USA","Int. J. Mod. Phys. Conf. Ser. 4 (2011) 135-145","10.1142/S2010194511001644","RUB-TPII-03/2011","hep-ph","http://arxiv.org/licenses/nonexclusive-distrib/1.0/","  We present a completely gauge-invariant operator definition of
transverse-momentum-dependent parton densities (TMD), supplied with
longitudinal lightlike gauge links as well as transverse gauge links at
lightcone infinity. Within this framework, we consider the consistent treatment
of specific divergences, emerging in the ""unsubtracted"" TMD beyond the tree
approximation, and construct the soft factors to cancel unphysical
singularities. We confront this approach with factorization schemes, which make
use of covariant gauges with off-the-lightcone gauge links, and discuss their
mutual connection.
","[{""version"":""v1"",""created"":""Wed, 3 Aug 2011 10:12:08 GMT""}]","2011-11-30"
"1108.0812","Stefan Oslowski","Stefan Oslowski, Willem van Straten, George Hobbs, Matthew Bailes,
  Paul Demorest","High signal-to-noise ratio observations and the ultimate limits of
  precision pulsar timing","16 pages, 9 figures, accepted for publication in MNRAS. Updated
  version: added DOI and changed manuscript to reflect changes in the final
  published version",,"10.1111/j.1365-2966.2011.19578.x",,"astro-ph.GA astro-ph.IM","http://arxiv.org/licenses/nonexclusive-distrib/1.0/","  We demonstrate that the sensitivity of high-precision pulsar timing
experiments will be ultimately limited by the broadband intensity modulation
that is intrinsic to the pulsar's stochastic radio signal. That is, as the peak
flux of the pulsar approaches that of the system equivalent flux density,
neither greater antenna gain nor increased instrumental bandwidth will improve
timing precision. These conclusions proceed from an analysis of the covariance
matrix used to characterise residual pulse profile fluctuations following the
template matching procedure for arrival time estimation. We perform such an
analysis on 25 hours of high-precision timing observations of the closest and
brightest millisecond pulsar, PSR J0437-4715. In these data, the standard
deviation of the post-fit arrival time residuals is approximately four times
greater than that predicted by considering the system equivalent flux density,
mean pulsar flux and the effective width of the pulsed emission. We develop a
technique based on principal component analysis to mitigate the effects of
shape variations on arrival time estimation and demonstrate its validity using
a number of illustrative simulations. When applied to our observations, the
method reduces arrival time residual noise by approximately 20%. We conclude
that, owing primarily to the intrinsic variability of the radio emission from
PSR J0437-4715 at 20 cm, timing precision in this observing band better than 30
- 40 ns in one hour is highly unlikely, regardless of future improvements in
antenna gain or instrumental bandwidth. We describe the intrinsic variability
of the pulsar signal as stochastic wideband impulse modulated self-noise
(SWIMS) and argue that SWIMS will likely limit the timing precision of every
millisecond pulsar currently observed by Pulsar Timing Array projects as larger
and more sensitive antennae are built in the coming decades.
","[{""version"":""v1"",""created"":""Wed, 3 Aug 2011 10:12:22 GMT""},{""version"":""v2"",""created"":""Thu, 22 Sep 2011 02:46:03 GMT""}]","2011-09-23"
"1108.0813","Jameel-Un Nabi","Jameel-Un Nabi, Muneeb-Ur Rahman","Gamow-Teller transitions from 24Mg and its impact on the electron
  capture rates in the O + Ne + Mg cores of stars","13 pages, 3 figures","Phys. Rev. C 75, 035803 (2007)","10.1103/PhysRevC.75.035803",,"nucl-th astro-ph.HE astro-ph.SR","http://arxiv.org/licenses/nonexclusive-distrib/1.0/","  Electron captures on nuclei play an important role in the collapse of stellar
core in the stages leading to a type-II supernova. Recent observations of
subluminous Type II-P supernovae (e.g. 2005cs, 2003gd, 1999br) were able to
rekindle the interest in 8 - 10 which develop O+Ne+Mg cores. We used the
proton-neutron quasiparticle random phase approximation (pn-QRPA) theory to
calculate the B(GT) strength for 24Mg \rightarrow 24Na and its associated
electron capture rates for incorporation in simulation calculations. The
calculated rates, in this letter, have differences with the earlier reported
shell model and Fuller, Fowler, Newman (hereafter F2N) rates. We compared
Gamow-Teller strength distribution functions and found fairly good agreement
with experiment and shell model. However, the GT centroid and the total GT
strength, which are useful in the calculation of electron capture rates in the
core of massive pre-supernova stars, lead to the enhancement of our rate up to
a factor of four compared to the shell model rates at high temperatures and
densities.
","[{""version"":""v1"",""created"":""Wed, 3 Aug 2011 10:23:20 GMT""}]","2011-08-04"
"1108.0814","Abdullah Yar","Abdullah Yar, Andrea Donarini, Sonja Koller, and Milena Grifoni","Dynamical symmetry breaking in vibration-assisted transport through
  nanostructures","Withdraw because of erroneous double submission. The paper is the
  same as version 2 of arXiv:1101.3892",,,,"cond-mat.mes-hall cond-mat.str-el","http://arxiv.org/licenses/nonexclusive-distrib/1.0/","  A theoretical model of a single molecule coupled to many vibronic modes is
presented. At low energies, transport is dominated by electron-vibron processes
where transfer of an electron through the dot is accompanied by the
excitation/emission of quanta (vibrons). Because the frequency of the $n$th
mode is taken as an $n$th multiple of the frequency of the fundamental mode,
several energetically degenerate or quasi-degenerate vibronic configurations
can contribute to transport. We investigate the consequences of strong
electron-vibron coupling in a fully \emph{symmetric} set-up. Several striking
features are predicted. In particular, a gate-asymmetry and pronounced negative
differential conductance features are observed. We attribute these features to
the presence of slow channels originating from the interplay of Franck-Condon
suppression of transport channels and spin/orbital degeneracies.
","[{""version"":""v1"",""created"":""Wed, 3 Aug 2011 10:34:14 GMT""},{""version"":""v2"",""created"":""Thu, 18 Aug 2011 16:13:48 GMT""}]","2011-08-19"
"1108.0815","Osamu Narikiyo","O. Narikiyo","Ward Identities for Cooper Pairs",,,,,"cond-mat.supr-con","http://arxiv.org/licenses/nonexclusive-distrib/1.0/","  Ward identities for Cooper pairs are derived. These give consistent
description of electronic curent vertex and thermal current vertex.
","[{""version"":""v1"",""created"":""Wed, 3 Aug 2011 10:39:34 GMT""},{""version"":""v2"",""created"":""Wed, 17 Aug 2011 04:13:44 GMT""}]","2011-08-18"
"1108.0816","Laura Bethke","Laura Bethke, Joao Magueijo","Chirality of tensor perturbations for complex values of the Immirzi
  parameter","6 pages, 1 figure",,"10.1088/0264-9381/29/5/052001",,"gr-qc astro-ph.CO hep-th","http://arxiv.org/licenses/nonexclusive-distrib/1.0/","  In this paper we generalise previous work on tensor perturbations in a de
Sitter background in terms of Ashtekar variables to cover all complex values of
the Immirzi parameter gamma (previous work was restricted to imaginary gamma).
Particular attention is paid to the case of real gamma. Following the same
approach as in the imaginary case, we can obtain physical graviton states by
invoking reality and torsion free conditions. The Hamiltonian in terms of
graviton states has the same form whether gamma has a real part or not; however
changes occur for the vacuum energy and fluctuations. Specifically, we observe
a gamma dependent chiral asymmetry in the vacuum fluctuations only if gamma has
an imaginary part. Ordering prescriptions also change this asymmetry. We thus
present a measurable result for CMB polarisation experiments that could shed
light on the workings of quantum gravity.
","[{""version"":""v1"",""created"":""Wed, 3 Aug 2011 10:45:22 GMT""}]","2015-05-30"
"1108.0817","Markus Lange-Hegermann","Thomas B\""achler, Vladimir Gerdt, Markus Lange-Hegermann, Daniel
  Robertz","Algorithmic Thomas Decomposition of Algebraic and Differential Systems","arXiv admin note: substantial text overlap with arXiv:1008.3767",,,,"math.AC","http://arxiv.org/licenses/nonexclusive-distrib/1.0/","  In this paper, we consider systems of algebraic and non-linear partial
differential equations and inequations. We decompose these systems into
so-called simple subsystems and thereby partition the set of solutions. For
algebraic systems, simplicity means triangularity, square-freeness and
non-vanishing initials. Differential simplicity extends algebraic simplicity
with involutivity. We build upon the constructive ideas of J. M. Thomas and
develop them into a new algorithm for disjoint decomposition. The given paper
is a revised version of a previous paper and includes the proofs of correctness
and termination of our decomposition algorithm. In addition, we illustrate the
algorithm with further instructive examples and describe its Maple
implementation together with an experimental comparison to some other
triangular decomposition algorithms.
","[{""version"":""v1"",""created"":""Wed, 3 Aug 2011 10:48:49 GMT""}]","2012-04-01"
"1108.0818","Yoshitaka Hatta","Yoshitaka Hatta and Akihiro Nishiyama","Towards thermalization in heavy-ion collisions: CGC meets the 2PI
  formalism","23 pages, 4 figures; v2: Version to appear in Nuclear Physics A",,"10.1016/j.nuclphysa.2011.10.007",,"hep-ph","http://arxiv.org/licenses/nonexclusive-distrib/1.0/","  We propose to apply the two-particle irreducible (2PI) formalism to the
problem of thermalization in heavy-ion collisions in the Color Glass Condensate
(CGC) picture. We consider the 2PI effective action to three loops and derive a
set of coupled equations for the classical Yang-Mills field and the quantum
fluctuations in the boost invariant coordinate system. The initial condition
and the relation to previous works are also discussed.
","[{""version"":""v1"",""created"":""Wed, 3 Aug 2011 11:00:42 GMT""},{""version"":""v2"",""created"":""Wed, 19 Oct 2011 05:20:26 GMT""}]","2015-05-30"
"1108.0819","Jameel-Un Nabi","Jameel-Un Nabi, Muhammad Sajjad","Comparative study of Gamow-Teller strength distributions in the odd-odd
  nucleus 50V and its impact on electron capture rates in astrophysical
  environments","16 pages, 5 figures","Phys. Rev. C 76, 055803 (2007)","10.1103/PhysRevC.76.055803",,"nucl-th astro-ph.HE astro-ph.SR","http://arxiv.org/licenses/nonexclusive-distrib/1.0/","  Gamow-Teller (GT) strength transitions are an ideal probe for testing nuclear
structure models. In addition to nuclear structure, GT transitions in nuclei
directly affect the early phases of Type Ia and Type-II supernovae core
collapse since the electron capture rates are partly determined by these GT
transitions. In astrophysics, GT transitions provide an important input for
model calculations and element formation during the explosive phase of a
massive star at the end of its life-time. Recent nucleosynthesis calculations
show that odd-odd and odd-A nuclei cause the largest contribution in the rate
of change of lepton-to-baryon ratio. In the present manuscript, we have
calculated the GT strength distributions and electron capture rates for odd-odd
nucleus 50V by using the pn-QRPA theory. At present 50V is the first
experimentally available odd-odd nucleus in fp-shell nuclei. We also compare
our GT strength distribution with the recently measured results of a
50V(d,2He)50Ti experiment, with the earlier work of Fuller, Fowler, and Newman
(referred to as FFN) and subsequently with the large-scale shell model
calculations. One curious finding of the paper is that the Brink's hypothesis,
usually employed in large-scale shell model calculations, is not a good
approximation to use at least in the case of 50V. SNe Ia model calculations
performed using FFN rates result in overproduction of 50Ti, and were brought to
a much acceptable value by employing shell model results. It might be
interesting to study how the composition of the ejecta using presently reported
QRPA rates compare with the observed abundances.
","[{""version"":""v1"",""created"":""Wed, 3 Aug 2011 11:02:36 GMT""}]","2011-08-04"
"1108.0820","{\L}ukasz K{\l}opotowski","Krzysztof Kukli\'nski, {\L}ukasz K{\l}opotowski, Krzysztof Fronc,
  Maciej Wiater, Piotr Wojnar, Pawe{\l} Rutkowski, Valia Voliotis, Roger
  Grousson, Grzegorz Karczewski, Jacek Kossut, Tomasz Wojtowicz","Tuning the inter-shell splitting in self-assembled CdTe quantum dots","submitted to Applied Physics Letters","Appl. Phys. Lett 99, 141906 (2011)","10.1063/1.3643476",,"cond-mat.mes-hall","http://arxiv.org/licenses/nonexclusive-distrib/1.0/","  We present photoluminescence studies of highly excited single self--assembled
CdTe quantum dots under continuous--wave and pulsed excitations. We observe
appearance of emission bands related to sequential filling of s--, p-- and
d--shells. We analyze the inter-shell splitting for five samples, in which the
dots were formed from a strained CdTe layer of different width. We find that
with increasing the CdTe layer width the inter-shell splitting increases. In a
time resolved measurement, we observe a radiative cascade between transitions
involving one, two, and more than two excitons.
","[{""version"":""v1"",""created"":""Wed, 3 Aug 2011 11:06:33 GMT""}]","2011-11-17"
"1108.0821","Francesco Baldassarri","Francesco Baldassarri","Appendix: proof of the Uniformity Conjecture","This article has been withdrawn. It has been renamed ""Radius of
  convergence of p-adic differential connections: an application to the p-adic
  Rolle theorem"", and is posted as arXiv:1108.1633v1 [math.NT]. It has not yet
  been decided whether or not it will become an appendix to Faber's paper",,,,"math.NT math.AG","http://arxiv.org/licenses/nonexclusive-distrib/1.0/","  This paper originated as an appendix to the paper ""Topology and Geometry of
the Berkovich Ramification Locus for Rational Functions, II"" by Xander Faber
arXiv:1104.0943v2 [math.NT]. It may however be read independently. We prove a
variant of Alain Robert's p-adic Rolle theorem, via the theory of the radius of
convergence of p-adic connections and the theory of semistable reduction of
p-adic curves. We carefully compare the present author's notion [Inv. Math. 182
(2010)] of radius of convergence, of a connection on a p-adic curve X,
normalized by the choice of a semistable model of X, with Kedlaya's intrinsic
generic radius of convergence of a differential module [Def. 9.4.7 in p-adic
Differential Equations, Cambridge Studies in Adv. Math., vol. 125 (2010)].
","[{""version"":""v1"",""created"":""Wed, 3 Aug 2011 11:12:50 GMT""},{""version"":""v2"",""created"":""Thu, 4 Aug 2011 22:16:50 GMT""},{""version"":""v3"",""created"":""Thu, 18 Aug 2011 14:11:40 GMT""}]","2011-08-19"
"1108.0822","Xu Han","Xu Han, Dylan S. Small, Dean P. Foster, Vishal Patel","The effect of winning an Oscar Award on survival: Correcting for healthy
  performer survivor bias with a rank preserving structural accelerated failure
  time model","Published in at http://dx.doi.org/10.1214/10-AOAS424 the Annals of
  Applied Statistics (http://www.imstat.org/aoas/) by the Institute of
  Mathematical Statistics (http://www.imstat.org)","Annals of Applied Statistics 2011, Vol. 5, No. 2A, 746-772","10.1214/10-AOAS424","IMS-AOAS-AOAS424","stat.AP","http://arxiv.org/licenses/nonexclusive-distrib/1.0/","  We study the causal effect of winning an Oscar Award on an actor or actress's
survival. Does the increase in social rank from a performer winning an Oscar
increase the performer's life expectancy? Previous studies of this issue have
suffered from healthy performer survivor bias, that is, candidates who are
healthier will be able to act in more films and have more chance to win Oscar
Awards. To correct this bias, we adapt Robins' rank preserving structural
accelerated failure time model and $g$-estimation method. We show in simulation
studies that this approach corrects the bias contained in previous studies. We
estimate that the effect of winning an Oscar Award on survival is 4.2 years,
with a 95% confidence interval of $[-0.4,8.4]$ years. There is not strong
evidence that winning an Oscar increases life expectancy.
","[{""version"":""v1"",""created"":""Wed, 3 Aug 2011 11:20:34 GMT""}]","2011-08-04"
"1108.0823","Jason F. Ralph","Jason F. Ralph and Neil P. Oxtoby","Quantum filtering one bit at a time","5 pages, 3 figures","Phys. Rev. Lett. 107, 260503 (2011)","10.1103/PhysRevLett.107.260503",,"quant-ph","http://arxiv.org/licenses/nonexclusive-distrib/1.0/","  In this paper we consider the purification of a quantum state using the
information obtained from a continuous measurement record, where the classical
measurement record is digitized to a single bit per measurement after the
measurements have been made. Analysis indicates that efficient and reliable
state purification is achievable for one- and two-qubit systems. We also
consider quantum feedback control based on the discrete one-bit measurement
sequences.
","[{""version"":""v1"",""created"":""Wed, 3 Aug 2011 11:21:29 GMT""},{""version"":""v2"",""created"":""Mon, 28 Nov 2011 16:29:55 GMT""}]","2012-01-05"
