"1108.0673","Mois\'es Santill\'an Dr.","Eder Zavala-L\'opez, Mois\'es Santill\'an","Oscillation arrest in the mouse somitogenesis clock presumably takes
  place via an infinite period bifurcation","13 pages, 2 figures",,,,"q-bio.CB physics.bio-ph","http://arxiv.org/licenses/nonexclusive-distrib/1.0/","  In this work we address the question of how oscillations are arrested in the
mouse somitogenesis clock when the determination front reaches presomitic
cells. Based upon available experimental evidence we hypothesize that the
mechanism underlying such a phenomenon involves the interaction between a limit
cycle (originated by a delayed negative feedback loop) and a bistable switch
(originated by a positive feedback loop). With this hypothesis in mind we
construct the simplest possible model comprising both negative and positive
feedback loops and show that (with a suitable choice of paremeters): 1) it can
show an oscillatory behavior, 2) oscillations are arrested via an
infinite-period bifurcation whenever the different gene-expression
regulator-inputs act together in an additive rather than in a multiplicative
fashion, and 3) this mechanism for oscillation arrest is compatible whit
plentiful experimental observations.
","[{""version"":""v1"",""created"":""Tue, 2 Aug 2011 20:05:23 GMT""}]","2015-03-13"
"1108.0674","Thomas  Kr\""uhler","T. Kr\""uhler, J. Greiner, P. Schady, S. Savaglio, P. M. J. Afonso, C.
  Clemens, J. Elliott, R. Filgas, D. Gruber, D. A. Kann, S. Klose, A.
  K\""upc\""u-Yoldas, S. McBreen, E. F. Olivares, D. Pierini, A. Rau, A. Rossi,
  M. Nardini, A. Nicuesa Guelbenzu, V. Sudilovsky, A. C. Updike","The SEDs and Host Galaxies of the dustiest GRB afterglows","17 pages, 13 figures, resubmitted to A&A after referee report","Astronomy & Astrophysics 534 (2011), A108","10.1051/0004-6361/201117428",,"astro-ph.CO","http://arxiv.org/licenses/nonexclusive-distrib/1.0/","  (Abridged) Until recently the information inferred from gamma-ray burst
follow-up observations was mostly limited to optically bright afterglows,
biasing all demographic studies against sight-lines that contain large amounts
of dust. Here, we present GRB afterglow and host observations for a sample of
bursts that are exemplary of previously missed ones because of high visual
extinction along the sight-line. This facilitates an investigation of the
properties, geometry and location of the absorbing dust of these
poorly-explored host galaxies, and a comparison to hosts from
optically-selected samples. The hosts of the dustiest afterglows are diverse in
their properties, but on average redder, more luminous and massive than the
hosts of optically-bright events. We hence probe a different galaxy population,
suggesting that previous host samples miss most of the massive,
chemically-evolved and metal-rich members. This also indicates that the dust
along the sight-line is often related to host properties, and thus probably
located in the diffuse ISM or interstellar clouds and not in the immediate GRB
environment. Some of the hosts in our sample, are blue, young or of small
stellar mass illustrating that even apparently non-extinguished galaxies
possess very dusty sight-lines due to a patchy dust distribution. The presented
observations establish a population of luminous, massive and correspondingly
chemically-evolved GRB hosts. This suggests that GRBs trace the global
star-formation rate better than studies based on optically-selected host
samples indicate, and the previously-claimed deficiency of high-mass host
galaxies was at least partially a selection effect.
","[{""version"":""v1"",""created"":""Tue, 2 Aug 2011 20:08:07 GMT""}]","2012-09-11"
"1108.0675","Funda Bostanci","Z. F. Bostanci","Cloud Modeling of a Network Region in H-alpha","6 pages, 5 figures, accepted for publication in Astronomische
  Nachrichten - Astronomical Notes",,"10.1002/asna.201111578",,"astro-ph.SR","http://arxiv.org/licenses/nonexclusive-distrib/1.0/","  In this paper, we analyze the physical properties of dark mottles in the
chromospheric network using two dimensional spectroscopic observations in
H-alpha obtained with the Gottingen Fabry-Perot Spectrometer in the Vacuum
Tower Telescope at the Observatory del Teide, Tenerife. Cloud modeling was
applied to measure the mottles' optical thickness, source function, Doppler
width, and line of sight velocity. Using these measurements, the number density
of hydrogen atoms in levels 1 and 2, total particle density, electron density,
temperature, gas pressure, and mass density parameters were determined with the
method of Tsiropoula & Schmieder (1997). We also analyzed the temporal
behaviour of a mottle using cloud parameters. Our result shows that it is
dominated by 3 minute signals in source function, and 5 minutes or more in
velocity.
","[{""version"":""v1"",""created"":""Tue, 2 Aug 2011 20:11:12 GMT""}]","2015-05-30"
"1108.0676","Michael D\""oring","M. D\""oring, J. Haidenbauer, U.-G. Mei{\ss}ner, A. Rusetsky","Dynamical coupled-channel approaches on a momentum lattice","7 pages, 4 figures",,"10.1140/epja/i2011-11163-7",,"hep-lat hep-ph nucl-th","http://arxiv.org/licenses/nonexclusive-distrib/1.0/","  Dynamical coupled-channel approaches are a widely used tool in hadronic
physics that allow to analyze different reactions and partial waves in a
consistent way. In such approaches the basic interactions are derived within an
effective Lagrangian framework and the resulting pseudo-potentials are then
unitarized in a coupled-channel scattering equation. We propose a scheme that
allows for a solution of the arising integral equation in discretized momentum
space for periodic as well as twisted boundary conditions. This permits to
study finite size effects as they appear in lattice QCD simulations. The new
formalism, at this stage with a restriction to S-waves, is applied to
coupled-channel models for the sigma(600), f0(980), and a0(980) mesons, and
also for the Lambda(1405) baryon. Lattice spectra are predicted.
","[{""version"":""v1"",""created"":""Tue, 2 Aug 2011 20:12:33 GMT""},{""version"":""v2"",""created"":""Wed, 30 Nov 2011 15:07:23 GMT""}]","2015-05-30"
"1108.0677","Sera Cremonini","Sera Cremonini","The Shear Viscosity to Entropy Ratio: A Status Report","29 pages. Invited review for Modern Physics Letters B. References and
  minor comments added","Mod. Phys. Lett.B, Volume: 25, Issue: 23(2011) pp. 1867-1888","10.1142/S0217984911027315",,"hep-th gr-qc hep-ph nucl-th","http://arxiv.org/licenses/nonexclusive-distrib/1.0/","  This review highlights some of the lessons that the holographic gauge/gravity
duality has taught us regarding the behavior of the shear viscosity to entropy
density in strongly coupled field theories. The viscosity to entropy ratio has
been shown to take on a very simple universal value in all gauge theories with
an Einstein gravity dual. Here we describe the origin of this universal ratio,
and focus on how it is modified by generic higher derivative corrections
corresponding to curvature corrections on the gravity side of the duality. In
particular, certain curvature corrections are known to push the viscosity to
entropy ratio below its universal value. This disproves a longstanding
conjecture that such a universal value represents a strict lower bound for any
fluid in nature. We discuss the main developments that have led to insight into
the violation of this bound, and consider whether the consistency of the theory
is responsible for setting a fundamental lower bound on the viscosity to
entropy ratio.
","[{""version"":""v1"",""created"":""Tue, 2 Aug 2011 20:13:10 GMT""},{""version"":""v2"",""created"":""Tue, 23 Aug 2011 17:33:01 GMT""}]","2015-03-19"
"1108.0678","Claudio Grillo","C. Grillo and L. Christensen","Dark matter-rich early-type galaxies in the CASSOWARY 5 strong lensing
  system","9 pages, 6 figures; accepted for publication in MNRAS",,"10.1111/j.1365-2966.2011.19544.x",,"astro-ph.CO","http://arxiv.org/licenses/nonexclusive-distrib/1.0/","  We study the strong gravitational lensing system number 5 identified by the
CASSOWARY survey. In this system, a source at redshift 1.069 is lensed into
four detected images by two early-type galaxies at redshift 0.388. The observed
positions of the multiple images are well reproduced by a model in which the
total mass distribution of the deflector is described in terms of two singular
isothermal sphere profiles. By modelling the lens galaxy spectral energy
distributions, we measure the lens luminous masses and stellar mass-to-light
ratios. These values are used to disentangle the luminous and dark matter
components in the vicinity of the multiple images. We estimate that the dark
over total mass ratio projected within a cylinder centred on the primary lens
and with a radius of 12.6 kpc is 0.8 +/- 0.1. We contrast these measurements
with the typical values found at similar distances (in units of the effective
radius) in isolated lens galaxies and show that the amount of dark matter
present in these lens galaxies is almost a factor four larger than in field
lens galaxies with comparable luminous masses. Data and models are therefore
consistent with interpreting the lens of this system as a galaxy group. We
infer that the overdense environment and dark matter concentration in these
galaxies must have affected the assembly of the lens luminous mass components.
We conclude that further multi-diagnostics analyses on the internal properties
of galaxy groups have the potential of providing us a unique insight into the
complex baryonic and dark-matter physics interplay that rules the formation of
cosmological structures.
","[{""version"":""v1"",""created"":""Tue, 2 Aug 2011 20:18:58 GMT""}]","2015-05-30"
"1108.0679","Yuichiro Fujiwara","Yuichiro Fujiwara and Vladimir D. Tonchev","A characterization of entanglement-assisted quantum low-density
  parity-check codes","7 pages, no figures, final accepted version for publication in the
  IEEE Transactions on Information Theory","IEEE Transactions on Information Theory 59 (2013) 3347-3353","10.1109/TIT.2013.2247461",,"cs.IT math.CO math.IT quant-ph","http://arxiv.org/licenses/nonexclusive-distrib/1.0/","  As in classical coding theory, quantum analogues of low-density parity-check
(LDPC) codes have offered good error correction performance and low decoding
complexity by employing the Calderbank-Shor-Steane (CSS) construction. However,
special requirements in the quantum setting severely limit the structures such
quantum codes can have. While the entanglement-assisted stabilizer formalism
overcomes this limitation by exploiting maximally entangled states (ebits),
excessive reliance on ebits is a substantial obstacle to implementation. This
paper gives necessary and sufficient conditions for the existence of quantum
LDPC codes which are obtainable from pairs of identical LDPC codes and consume
only one ebit, and studies the spectrum of attainable code parameters.
","[{""version"":""v1"",""created"":""Tue, 2 Aug 2011 20:21:59 GMT""},{""version"":""v2"",""created"":""Sun, 7 Aug 2011 06:04:03 GMT""},{""version"":""v3"",""created"":""Wed, 13 Jun 2012 03:48:13 GMT""},{""version"":""v4"",""created"":""Sun, 7 Oct 2012 12:59:31 GMT""}]","2013-05-21"
"1108.0680","Ivan Favero","C. Baker, C. Belacel, A. Andronico, P. Senellart, A. Lemaitre, E.
  Galopin, S. Ducci, G. Leo and I. Favero","Critical optical coupling between a GaAs disk and a nanowaveguide
  suspended on the chip","14 pages, 4 figures",,"10.1063/1.3651493",,"physics.optics","http://arxiv.org/licenses/nonexclusive-distrib/1.0/","  We report on an integrated GaAs disk/waveguide system. A millimeter-long
waveguide is suspended and tapered on the chip over a length of 25 {\mu}m to
evanescently couple to high Q optical whispering gallery modes of a GaAs disk.
The critical coupling regime is obtained both by varying the disk/guide gap
distance and the width of the suspended nanoscale taper. The experimental
results are in good agreement with predictions from the coupled mode theory.
","[{""version"":""v1"",""created"":""Tue, 2 Aug 2011 20:22:04 GMT""}]","2015-05-30"
"1108.0681","Tyrone Woods","T.E. Woods, N. Ivanova, M. van der Sluys, and S. Chaichenets","On The Formation of Double White Dwarfs: Reevaluating How We Parametrize
  the Common Envelope Phase","6 pages, 2 figures. Proceedings for the ESO Conference, the workshop
  'Evolution of Compact Binaries', 6-11 March 2011, Vi\~na del Mar, Chile,
  edited by L. Schmidtobreick, M. R. Schreiber, C. Tappert, ASP conference
  series",,,,"astro-ph.SR","http://arxiv.org/licenses/nonexclusive-distrib/1.0/","  One class of compact binaries of special interest is that of double white
dwarfs (DWDs). For many of these systems, the exact nature of the evolutionary
channels by which they form remains uncertain. The canonical explanation calls
for the progenitor binary system to undergo two subsequent mass-transfer
events, both of which are unstable and lead to a common envelope (CE) phase.
However, it has been shown that if both CE events obey the standard alpha
prescription, it is not possible to reproduce all of the observed systems. As
an alternative prescription, the gamma-formalism was proposed, which
parametrizes the fraction of angular momentum carried away with mass loss, in
contrast to the alpha prescription, which parametrizes energy loss. We
demonstrate that the gamma-prescription is also inadequate in describing the
evolution of an arbitrary DWD binary; clearly we require a deeper understanding
of the physical mechanisms underlying their formation. We then present a
detailed model for the evolution of Red Giant -- Main Sequence binaries during
the first episode of mass transfer, and demonstrate that their evolution into
DWDs need not arise through two phases of dynamical mass loss. Instead, the
first episode of dramatic mass loss may be stable, non-conservative mass
transfer. The second phase is then well described by the alpha prescription. We
find that the considered progenitors can reproduce the properties of the
observed helium DWDs in which the younger component is the more massive.
","[{""version"":""v1"",""created"":""Tue, 2 Aug 2011 20:27:44 GMT""}]","2011-08-04"
"1108.0682","Farhad Darabi","F. Darabi and S. Jalalzadeh","Cosmological quantum tunneling and holographic principle","9 pages, Title changed, major revision","Theoretical and Mathematical Physics, 175(2), 710-716 (2013)",,,"gr-qc","http://arxiv.org/licenses/nonexclusive-distrib/1.0/","  The probable trajectory of the ground state wave function of the universe
arises through a quantum tunneling by gravitational instantons. We calculate
the quantum tunneling rate for a $n>2$ dimensional closed
Friedmann-Robertson-Walker universe with a positive cosmological constant. In
four dimensions, by using of the holographic principle, the tunneling rate is
related to the maximal entropy of the early universe after quantum tunneling.
","[{""version"":""v1"",""created"":""Tue, 2 Aug 2011 20:31:26 GMT""},{""version"":""v2"",""created"":""Wed, 15 May 2013 18:19:08 GMT""}]","2013-05-16"
"1108.0683","Jesper Romers","F. A. Bais and J. C. Romers","The modular S-matrix as order parameter for topological phase
  transitions","37 pages","2012 New J. Phys. 14, 035024","10.1088/1367-2630/14/3/035024",,"cond-mat.mes-hall hep-lat hep-th","http://arxiv.org/licenses/nonexclusive-distrib/1.0/","  We study topological phase transitions in discrete gauge theories in two
spatial dimensions induced by the formation of a Bose condensate. We analyse a
general class of euclidean lattice actions for these theories which contain one
coupling constant for each conjugacy class of the gauge group. To probe the
phase structure we use a complete set of open and closed anyonic string
operators. The open strings allow one to determine the particle content of the
condensate, whereas the closed strings enable us to determine the matrix
elements of the modular $S$-matrix, also in the broken phase. From the measured
broken $S$-matrix we may read off the sectors that split or get identified in
the broken phase, as well as the sectors that are confined. In this sense the
modular $S$-matrix can be employed as a matrix valued non-local order parameter
from which the low-energy effective theories that occur in different regions of
parameter space can be fully determined.
  To verify our predictions we studied a non-abelian anyon model based on the
quaternion group $H=\bar{D_2}$ of order eight by Monte Carlo simulation. We
probe part of the phase diagram for the pure gauge theory and find a variety of
phases with magnetic condensates leading to various forms of (partial)
confinement in complete agreement with the algebraic breaking analysis. Also
the order of various transitions is established.
","[{""version"":""v1"",""created"":""Tue, 2 Aug 2011 20:32:56 GMT""},{""version"":""v2"",""created"":""Wed, 9 May 2012 10:12:48 GMT""}]","2012-05-10"
"1108.0684","Keshav Dasgupta","Mohammed Mia, Keshav Dasgupta, Charles Gale, Sangyong Jeon","A holographic model for large N thermal QCD","LaTex, 27 pages, 5 figures; v2: Acknowledgements added, some typos
  and references corrected",,"10.1088/0954-3899/39/5/054004",,"hep-th hep-ph nucl-th","http://arxiv.org/licenses/nonexclusive-distrib/1.0/","  We summarize the dual gravity description for a thermal gauge theory,
reviewing the key features of our holographic model of large N QCD and
elaborating on some new results.The theory has matter in the fundamental
representation and the gauge coupling runs logarithmically with energy scale at
low energies. At the highest energies the theory becomes approximately scale
invariant, much like what we would expect for large N QCD although not with
asymptotic freedom. In this limit the theory has a gravity dual captured by an
almost classical supergravity description with a controlled quantum behavior,
such that by renormalizing the supergravity action, we can compute the stress
tensor of the dual gauge theory. From the stress tensor we obtain the shear
viscosity and the entropy of the medium at a temperature T, and the violation
of the bound for the viscosity to the entropy ratio is then investigated. By
considering dynamics of open strings in curved spacetime described by the
supergravity limit, we compute the drag and diffusion coefficients for a heavy
parton traversing the thermal medium. It is shown that both coefficients have a
logarithmic dependence on momentum, consistent with pQCD expectations. Finally,
we study the confinement/deconfinement mechanism for quarks by analyzing open
strings in the presence of the flavor seven branes. We find linear confinement
of quarks at low temperatures, while at high temperatures the quarkonium states
melt, a behavior consistent with the existence of a deconfined phase.
","[{""version"":""v1"",""created"":""Tue, 2 Aug 2011 20:35:53 GMT""},{""version"":""v2"",""created"":""Fri, 5 Aug 2011 03:22:13 GMT""}]","2015-05-30"
"1108.0685","Jens Erler","Jens Erler, Paul Langacker, Shoaib Munir and Eduardo Rojas","Z' Bosons from E(6): Collider and Electroweak Constraints","5 pages, 8 figures, presented at the XIX International Workshop on
  Deep-Inelastic Scattering and Related Subjects (DIS 2011), April 11-15, 2011,
  Newport News, VA, USA",,,,"hep-ph hep-ex","http://arxiv.org/licenses/nonexclusive-distrib/1.0/","  Many models beyond the Standard Electroweak Theory, top-down or bottom-up,
contain extensions of the gauge symmetry group by extra U(1)' factors which can
be understood or treated as subgroups of E(6). A brief overview of such models
is followed by a sketch of a systematic classification. We then describe how
the resulting extra massive neutral gauge bosons can be searched for and in
case of positive evidence diagnosed using electroweak and collider data.
","[{""version"":""v1"",""created"":""Tue, 2 Aug 2011 20:41:00 GMT""}]","2011-08-04"
"1108.0686","Sivan Leviyang","Sivan Leviyang","The Coalescence of Intrahost HIV Lineages Under Symmetric CTL Attack",,,,,"q-bio.PE math.PR","http://arxiv.org/licenses/nonexclusive-distrib/1.0/","  Cytotoxic T lymphocytes (CTLs) are immune system cells that are thought to
play an important role in controlling HIV infection. We develop a stochastic
ODE model of HIV-CTL interaction that extends current deterministic ODE models.
Based on this stochastic model, we consider the effect of CTL attack on
intrahost HIV lineages assuming CTLs attack several epitopes with equal
strength. In this setting, we introduce a limiting version of our stochastic
ODE under which we show that the coalescence of HIV lineages can be described
by a simple paintbox construction. Through numerical experiments, we show that
our results under the limiting stochastic ODE accurately reflect HIV lineages
under CTL attack when the HIV population size is on the low end of its
hypothesized range. Current techniques of HIV lineage construction depend on
the Kingman coalescent. Our results give an explicit connection between CTL
attack and HIV lineages.
","[{""version"":""v1"",""created"":""Tue, 2 Aug 2011 20:41:42 GMT""}]","2011-08-04"
"1108.0687","Robin Pemantle","Robin Pemantle and Yuval Peres","Concentration of Lipschitz functionals of determinantal and other strong
  Rayleigh measures",,,,,"math.PR","http://arxiv.org/licenses/nonexclusive-distrib/1.0/","  Let X_1 ,..., X_n be a collection of binary valued random variables and let f
: {0,1}^n -> R be a Lipschitz function. Under a negative dependence hypothesis
known as the {\em strong Rayleigh} condition, we show that f - E f satisfies a
concentration inequality generalizing the classical Gaussian concentration
inequality for sums of independent Bernoullis: P (S_n - E S_n > a) < exp (-2
a^2 / n). The class of strong Rayleigh measures includes determinantal
measures, weighted uniform matroids and exclusion measures; some familiar
examples from these classes are generalized negative binomials and spanning
tree measures. For instance, the number of vertices of odd degree in a uniform
random spanning tree of a graph satisfies a Gaussian concentration inequality
with n replaced by |V|, the number of vertices. We also prove a continuous
version for concentration of Lipschitz functionals of a determinantal point
process.
","[{""version"":""v1"",""created"":""Tue, 2 Aug 2011 20:45:24 GMT""},{""version"":""v2"",""created"":""Fri, 10 May 2013 22:28:58 GMT""},{""version"":""v3"",""created"":""Sun, 28 Jul 2013 02:03:58 GMT""}]","2013-07-30"
"1108.0688","Maria Letizia Pumo","M.L. Pumo and L. Zampieri","Radiation-hydrodynamical modelling of Core-Collapse Supernovae: light
  curves and the evolution of photospheric velocity and temperature","Accepted for publication in ApJ (16 pages, 22 figures)",,"10.1088/0004-637X/741/1/41",,"astro-ph.SR astro-ph.HE","http://arxiv.org/licenses/nonexclusive-distrib/1.0/","  We have developed a relativistic, radiation-hydrodynamics Lagrangian code,
specifically tailored to simulate the evolution of the main observables (light
curve, evolution of photospheric velocity and temperature) in core-collapse
supernova (CC-SN) events. The distinctive features of the code are an accurate
treatment of radiative transfer coupled to relativistic hydrodynamics, a
self-consistent treatment of the evolution of the innermost ejecta taking into
account the gravitational effects of the central compact remnant, and a fully
implicit Lagrangian approach to the solution of the coupled non-linear finite
difference system of equations. Our aim is to use it as numerical tool to
perform calculations of grid of models to be compared with observation of
CC-SNe. In this paper we present some testcase simulations and a comparison
with observations of SN 1987A, as well as with the results obtained with other
numerical codes. We also briefly discuss the influence of the main physical
parameters (ejected mass, progenitor radius, explosion energy, amount of
\chem{56}{Ni}) on the evolution of the ejecta, and the implications of our
results in connection with the possibility to ""standardize"" hydrogen-rich
CC-SNe for using them as candles to measure cosmological distances.
","[{""version"":""v1"",""created"":""Tue, 2 Aug 2011 20:45:52 GMT""}]","2015-05-30"
"1108.0689","Siddharth Parameswaran","S. A. Parameswaran, S. A. Kivelson, E. H. Rezayi, S. H. Simon, S. L.
  Sondhi and B. Z. Spivak","A Typology for Quantum Hall Liquids","4 +epsilon pages, 1 figure; v2 has added references and minor
  changes, version published in Phys. Rev. B. (Rapid Communications)","Phys. Rev. B 85, 241307(R) (2012)","10.1103/PhysRevB.85.241307",,"cond-mat.mes-hall cond-mat.str-el","http://arxiv.org/licenses/nonexclusive-distrib/1.0/","  There is a close analogy between the response of a quantum Hall liquid (QHL)
to a small change in the electron density and the response of a superconductor
to an externally applied magnetic flux - an analogy which is made concrete in
the Chern-Simons Landau-Ginzburg (CSLG) formulation of the problem. As the
Types of superconductor are distinguished by this response, so too for QHLs: a
typology can be introduced which is, however, richer than that in
superconductors owing to the lack of any time-reversal symmetry relating
positive and negative fluxes. At the boundary between Type I and Type II
behavior, the CSLG action has a ""Bogomol'nyi point,"" where the quasi-holes
(vortices) are non-interacting - at the microscopic level, this corresponds to
the behavior of systems governed by a set of model Hamiltonians which have been
constructed to render exact a large class of QHL wavefunctions. All Types of
QHLs are capable of giving rise to quantized Hall plateaux.
","[{""version"":""v1"",""created"":""Tue, 2 Aug 2011 20:46:36 GMT""},{""version"":""v2"",""created"":""Mon, 25 Jun 2012 16:30:22 GMT""}]","2012-06-26"
