"1108.0748","Rathipriya R","R. Rathipriya, K. Thangavel, J. Bagyamani","Binary Particle Swarm Optimization based Biclustering of Web usage Data",,,"10.5120/3001-4036",,"cs.IR cs.SY","http://arxiv.org/licenses/nonexclusive-distrib/1.0/","  Web mining is the nontrivial process to discover valid, novel, potentially
useful knowledge from web data using the data mining techniques or methods. It
may give information that is useful for improving the services offered by web
portals and information access and retrieval tools. With the rapid development
of biclustering, more researchers have applied the biclustering technique to
different fields in recent years. When biclustering approach is applied to the
web usage data it automatically captures the hidden browsing patterns from it
in the form of biclusters. In this work, swarm intelligent technique is
combined with biclustering approach to propose an algorithm called Binary
Particle Swarm Optimization (BPSO) based Biclustering for Web Usage Data. The
main objective of this algorithm is to retrieve the global optimal bicluster
from the web usage data. These biclusters contain relationships between web
users and web pages which are useful for the E-Commerce applications like web
advertising and marketing. Experiments are conducted on real dataset to prove
the efficiency of the proposed algorithms.
","[{""version"":""v1"",""created"":""Wed, 3 Aug 2011 05:54:26 GMT""},{""version"":""v2"",""created"":""Fri, 30 Sep 2011 06:42:45 GMT""}]","2011-10-03"
"1108.0749","Sparisoma Viridi","Siti Nurul Khotimah, Sparisoma Viridi, Widayani, Abdul Waris","Energy of one-dimensional diatomic elastic granular gas: Theory and
  molecular dynamics Simulation","6 pages, 3 figures, submitted to Indonesian Journal of Physics","Indonesian Journal of Physics 22 (3), 103-106 (2011)",,"Hibah Kapasitas FMIPA.PN-6-18-2010","physics.chem-ph physics.class-ph","http://creativecommons.org/licenses/by-nc-sa/3.0/","  One-dimensional ideal diatomic gas is simulated through possible types of
motion of a molecule. Energy of each type of its motion is calculated from
theory and numerical method. Calculation of kinetic energy of an atom in
translational-vibrational motion is not analytically simple, but it can be
solved by numerical method of molecular dynamic simulation. This paper
justifies that kinetic energy of a diatomic molecule can be determined by two
different approaches. The first is the sum of kinetic energy of each atom and
second is the sum of kinetic energy of translational motion and vibrational
motion.
","[{""version"":""v1"",""created"":""Wed, 3 Aug 2011 05:55:27 GMT""}]","2014-02-11"
"1108.0750","Jose Magpantay","Jose A. Magpantay","Geodesics, Mass and the Uncertainty Principle in a Warped de Sitter
  Space-time","8 pages",,,,"gr-qc","http://arxiv.org/licenses/nonexclusive-distrib/1.0/","  We present the explicit solution to the geodesic equations in a warped de
Sitter space-time proposed by Randall-Sundrum. We find that a test particle
moves in the bulk and is not restricted on a 3-brane (to be taken as our
universe). On the 3-brane, the test particle moves with uniform velocity,
giving the appearance that it is not subject to a force. But computing the
particle's energy using the energy-momentum tensor yields a time-dependent
energy that suggests a time-dependent mass. Thus, the extra force, which is the
effect of the warped extra dimension on the particle's motion on the 3-brane,
does not change the velocity but the mass of the particle. The particle's
motion in the bulk also results in a time-dependent modification of the
Heisenberg uncertainty principle as viewed on the 3-brane. These two results
show that the classical physics along the extra dimension results in the
time-dependence of particle masses and the uncertainty principle. If the
particle masses are time-independent and the Heisenberg's uncertainty principle
is to remain unchanged, then there must be a non-gravitational force that will
restrict all particles on the 3-brane. Finally, we just note that although
classically, these time-dependent corrections on the 3-brane can be removed,
quantum mechanical corrections along the extra dimension will restore back the
problem.
","[{""version"":""v1"",""created"":""Wed, 3 Aug 2011 06:07:22 GMT""}]","2011-08-04"
"1108.0751","Ryuji Higashinaka","Ryuji Higashinaka, Takuya Maruyama, Akihiro Nakama, Ryoichi Miyazaki,
  Yuji Aoki and Hideyuki Sato","Unusual Field-Insensitive Phase Transition and Kondo Behavior in
  SmTi$_2$Al$_{20}$","4 pages, 3 figures, to be published in J. Phys. Soc. Jpn. 80 (2011)",,"10.1143/JPSJ.80.093703",,"cond-mat.str-el","http://arxiv.org/licenses/nonexclusive-distrib/1.0/","  Magnetization, electrical resistivity and specific heat measurements were
performed on high-quality single crystalline SmTi$_2$Al$_{20}$ (residual
resistivity ratio $\sim$ 40) grown by Al self-flux method. A Kondo-like $\log
T$ dependence in the resistivity is observed below 50 K. We discovered a
field-insensitive phase transition at $T_{x}$ = 6.5 K and a field-insensitive
heavy fermion behavior with the electronic specific heat coefficient $\gamma$ =
150 mJ/(K$^{2}$ mol). Specific heat analysis reveals that the ground state is a
$\Gamma_{8}$ quartet state and the Sm magnetic dipole moment $m_{{\rm Sm}}$
($\sim 0.5 \mu_{{\rm B}}$ at $T \simeq$ 0) orders below $T_{x}$ in spite of the
field-insensitive behavior. Possible reasons for the field insensitiveness will
be discussed.
","[{""version"":""v1"",""created"":""Wed, 3 Aug 2011 06:08:31 GMT""}]","2011-08-24"
"1108.0752","Adetunmise Dada","Adetunmise C. Dada and Erika Andersson","On Bell inequality violations with high-dimensional systems",,"Internal Journal of Quantum Information (IJQI) Special Issue 9,
  (07n08) 1807-1823 (2011)","10.1142/S021974991100843X",,"quant-ph","http://arxiv.org/licenses/nonexclusive-distrib/1.0/","  Quantum correlations resulting in violations of Bell inequalities have
generated a lot of interest in quantum information science and fundamental
physics. In this paper, we address some questions that become relevant in
Bell-type tests involving systems with local dimension greater than 2. For
CHSH-Bell tests within 2-dimensional subspaces of such high-dimensional
systems, it has been suggested that experimental violation of Tsirelson's bound
indicates that more than 2-dimensional entanglement was present. We explain
that the overstepping of Tsirelson's bound is due to violation of fair
sampling, and can in general be reproduced by a separable state, if fair
sampling is violated. For a class of Bell-type inequalities generalized to
d-dimensional systems, we then consider what level of violation is required to
guarantee d-dimensional entanglement of the tested state, when fair sampling is
satisfied. We find that this can be used as an experimentally feasible test of
d-dimensional entanglement for up to quite high values of d.
","[{""version"":""v1"",""created"":""Wed, 3 Aug 2011 06:22:30 GMT""},{""version"":""v2"",""created"":""Mon, 19 Dec 2011 15:23:56 GMT""}]","2016-01-11"
"1108.0753","Makoto Katori","Yasuyuki Yamada, Makoto Katori","Velocity correlations of a discrete-time totally asymmetric
  simple-exclusion process in stationary state on a circle","v2:REVTeX4, 17 pages, 3 figures, minor corrections made for
  publication in Phys. Rev. E","Phys. Rev. E 84 (2011) 041141","10.1103/PhysRevE.84.041141",,"cond-mat.stat-mech math-ph math.MP","http://arxiv.org/licenses/nonexclusive-distrib/1.0/","  The discrete-time version of totally asymmetric simple-exclusion process
(TASEP) on a finite one-dimensional lattice is studied with the periodic
boundary condition. Each particle at a site hops to the next site with
probability $0 \leq p \leq 1$, if the next site is empty. This condition can be
rephrased by the condition that the number $n$ of vacant sites between the
particle and the next particle is positive. Then the average velocity is given
by a product of the hopping probability $p$ and the probability that $n \geq
1$. By mapping the TASEP to another driven diffusive system called the
zero-range process, it is proved that the distribution function of vacant sites
in the stationary state is exactly given by a factorized form. We define
$k$-particle velocity correlation function as the expectation value of a
product of velocities of $k$ particles in the stationary distribution. It is
shown that it does not depend on positions of $k$ particles on a circle but
depends only on the number $k$. We give explicit expressions for all velocity
correlation functions using the Gauss hypergeometric functions. Covariance of
velocities of two particles is studied in detail and we show that velocities
become independent asymptotically in the thermodynamic limit.
","[{""version"":""v1"",""created"":""Wed, 3 Aug 2011 06:24:40 GMT""},{""version"":""v2"",""created"":""Tue, 11 Oct 2011 01:18:43 GMT""}]","2011-11-03"
"1108.0754","Haiyong Xu","Haiyong Xu, Frederic Paik Schoenberg","Point process modeling of wildfire hazard in Los Angeles County,
  California","Published in at http://dx.doi.org/10.1214/10-AOAS401 the Annals of
  Applied Statistics (http://www.imstat.org/aoas/) by the Institute of
  Mathematical Statistics (http://www.imstat.org)","Annals of Applied Statistics 2011, Vol. 5, No. 2A, 684-704","10.1214/10-AOAS401","IMS-AOAS-AOAS401","stat.AP","http://arxiv.org/licenses/nonexclusive-distrib/1.0/","  The Burning Index (BI) produced daily by the United States government's
National Fire Danger Rating System is commonly used in forecasting the hazard
of wildfire activity in the United States. However, recent evaluations have
shown the BI to be less effective at predicting wildfires in Los Angeles
County, compared to simple point process models incorporating similar
meteorological information. Here, we explore the forecasting power of a suite
of more complex point process models that use seasonal wildfire trends, daily
and lagged weather variables, and historical spatial burn patterns as
covariates, and that interpolate the records from different weather stations.
Results are compared with models using only the BI. The performance of each
model is compared by Akaike Information Criterion (AIC), as well as by the
power in predicting wildfires in the historical data set and residual analysis.
We find that multiplicative models that directly use weather variables offer
substantial improvement in fit compared to models using only the BI, and, in
particular, models where a distinct spatial bandwidth parameter is estimated
for each weather station appear to offer substantially improved fit.
","[{""version"":""v1"",""created"":""Wed, 3 Aug 2011 06:27:21 GMT""}]","2011-08-04"
"1108.0755","Yazhen Wang","Yazhen Wang","Quantum Monte Carlo simulation","Published in at http://dx.doi.org/10.1214/10-AOAS406 the Annals of
  Applied Statistics (http://www.imstat.org/aoas/) by the Institute of
  Mathematical Statistics (http://www.imstat.org)","Annals of Applied Statistics 2011, Vol. 5, No. 2A, 669-683","10.1214/10-AOAS406","IMS-AOAS-AOAS406","stat.AP","http://arxiv.org/licenses/nonexclusive-distrib/1.0/","  Contemporary scientific studies often rely on the understanding of complex
quantum systems via computer simulation. This paper initiates the statistical
study of quantum simulation and proposes a Monte Carlo method for estimating
analytically intractable quantities. We derive the bias and variance for the
proposed Monte Carlo quantum simulation estimator and establish the asymptotic
theory for the estimator. The theory is used to design a computational scheme
for minimizing the mean square error of the estimator.
","[{""version"":""v1"",""created"":""Wed, 3 Aug 2011 06:33:14 GMT""}]","2011-08-04"
"1108.0756","Bryan J. Dalton","B J Dalton","Relative Phase States in Quantum-Atom Optics","22 pages plus 11 page Appendix. 11 figures. Submitted for
  publication. Figures revised",,,,"cond-mat.quant-gas quant-ph","http://arxiv.org/licenses/nonexclusive-distrib/1.0/","  Relative phase is treated as a physical quantity for two mode systems in
quantum atom optics, adapting the Pegg-Barnett treatment of quantum optical
phase to define a linear Hermitian relative phase operator via first
introducing a complete orthonormal set of relative phase eigenstates. These
states are contrasted with other so-called phase states. Other approaches to
treating phase and previous attempts to find a Hermitian phase operator are
discussed. The relative phase eigenstate has maximal two mode entanglement, it
is a fragmented state with its Bloch vector lying inside the Bloch sphere and
is highly spin squeezed. The relative phase states are applied to describing
interferometry experiments with Bose-Einstein condensates (BEC), particularly
in the context of a proposed Heisenberg limited interferometry experiment. For
a relative phase eigenstate the fractional fluctuation in one spin operator
component perpendicular to the Bloch vector is essentially only of order 1/N,
so if such a highly spin squeezed state could be prepared it may be useful for
Heisenberg limited interferometry. An approach for preparing a BEC in a state
close to a relative phase state is suggested, based on adiabatically changing
parameters in the Josephson Hamiltonian starting from a suitable energy
eigenstate in the Rabi regime.
","[{""version"":""v1"",""created"":""Wed, 3 Aug 2011 06:34:46 GMT""},{""version"":""v2"",""created"":""Mon, 22 Aug 2011 20:04:36 GMT""}]","2011-08-24"
"1108.0757","Servane Gey","Servane Gey (MAP5), Tristan Mary-Huard (AgroParisTech)","Risk Bounds for Embedded Variable Selection in Classification Trees",,,,"MAP5 2011-40","math.ST stat.TH","http://arxiv.org/licenses/nonexclusive-distrib/1.0/","  The problems of model and variable selections for classification trees are
jointly considered. A penalized criterion is proposed which explicitly takes
into account the number of variables, and a risk bound inequality is provided
for the tree classifier minimizing this criterion. This penalized criterion is
compared to the one used during the pruning step of the CART algorithm. It is
shown that the two criteria are similar under some specific margin assumptions.
In practice, the tuning parameter of the CART penalty has to be calibrated by
hold-out. Simulation studies are performed which confirm that the hold-out
procedure mimics the form of the proposed penalized criterion.
","[{""version"":""v1"",""created"":""Wed, 3 Aug 2011 06:39:59 GMT""},{""version"":""v2"",""created"":""Sat, 23 Jun 2012 19:21:43 GMT""}]","2012-06-27"
"1108.0758","Molin Liu","Molin Liu, Junwang Lu, Jianbo Lu","Fermions Analysis of IR modified Horava-Lifshitz gravity: Tunneling and
  Perturbation Perspectives","16 pages, 3 figures, revtex4","Class.Quant.Grav.28:125024,2011","10.1088/0264-9381/28/12/125024",,"hep-th gr-qc","http://arxiv.org/licenses/nonexclusive-distrib/1.0/","  In this paper, we investigate the fermions Hawking radiation and quasinormal
modes in infra-red modified Ho$\check{r}$ava-Lifshitz gravity under tunneling
and perturbation perspectives.Firstly, through the fermions tunneling in IR
modified Ho$\check{r}$ava-Lifshitz gravity,we obtain the Hawking radiation
emission rate, tunneling temperature and entropy for the Kehagias-Sfetsos black
hole. It is found that the results of fermions tunneling are in consistence
with the thermodynamics results obtained by calculating surface
gravity.Secondly, we numerically calculate the lowing quasinormal modes
frequencies of fermions perturbations by using WKB formulas including the third
orders and the sixth orders approximations simultaneously. It turns out that
the actual frequency of fermions perturbation is larger than in the
Schwarzschild case, and the damping rate is smaller than for the pure
Schwarzschild. The resluts of fermions perturbation suggest the quasinormal
modes could be lived more longer in Ho$\check{r}$ava-Lifshitz gravity.
","[{""version"":""v1"",""created"":""Wed, 3 Aug 2011 06:45:21 GMT""}]","2011-08-05"
"1108.0759","Federico Ricci-Tersenghi","Giorgio Parisi and Federico Ricci-Tersenghi","A numerical study of the overlap probability distribution and its
  sample-to-sample fluctuations in a mean-field model","13 pages, 11 figures","Phil. Mag. B 92, 341 (2012)","10.1080/14786435.2011.634843",,"cond-mat.dis-nn","http://arxiv.org/licenses/nonexclusive-distrib/1.0/","  In this paper we study the fluctuations of the probability distributions of
the overlap in mean field spin glasses in the presence of a magnetic field on
the De Almeida-Thouless line. We find that there is a large tail in the left
part of the distribution that is dominated by the contributions of rare
samples. Different techniques are used to examine the data and to stress on
different aspects of the contribution of rare samples.
","[{""version"":""v1"",""created"":""Wed, 3 Aug 2011 06:49:55 GMT""}]","2012-02-28"
"1108.0760","Vera Roshchina","Javier Pe\~na and Vera Roshchina","A Complementarity Partition Theorem for Multifold Conic Systems","12 pages, 2 figures",,,,"math.OC","http://arxiv.org/licenses/nonexclusive-distrib/1.0/","  Consider a homogeneous multifold convex conic system $$ Ax = 0, \; x\in
K_1\times...\times K_r $$ and its alternative system $$ A\transp y \in
K_1^*\times...\times K_r^*, $$ where $K_1,..., K_r$ are regular closed convex
cones. We show that there is canonical partition of the index set ${1,...,r}$
determined by certain complementarity sets associated to the most interior
solutions to the two systems. Our results are inspired by and extend the
Goldman-Tucker Theorem for linear programming.
","[{""version"":""v1"",""created"":""Wed, 3 Aug 2011 06:52:10 GMT""}]","2011-08-04"
"1108.0761","Qin Chang","Qin Chang, Lin Han and Ya-Dong Yang","Implications of the Anomalies in B_s^0-\bar{B}_s^0 Mixing for Anomalous
  Tensor Couplings","14pages, 2 figures, 3tables","Chin.Phys.Lett. 29 (2012) 031302","10.1088/0256-307X/29/3/031302",,"hep-ph hep-ex","http://arxiv.org/licenses/nonexclusive-distrib/1.0/","  Motivated by the recently observed anomalous large dimuon charge asymmetry in
neutral B decays and the unexpected large CP phase in the mixing-induced CP
asymmetry for B_s-->J/\psi\phi decay, we study the effects of the anomalous
tensor couplings to pursue possible solution. With the constraints from the
obsevables \phi^{J/\psi\phi}_s, a_{sl}^s and \Delta M_s, the parameter spaces
are severely restricted. Numerically, we find the anomalies in
B_s^0-\bar{B}_s^0 mixing system could be moderated simultaneously by the
contributions induced by the color-singlet or color-octet tensor operators with
their respective nontrivial new weak phase \phi_{T1}\approx28.0(15.6) degree or
\phi_{T8}\approx-62.1(-74.2) degree and relevant strength parameters
g_{T1}\approx6.7(8.5)\times10^{-2} or g_{T8}\approx1.9(2.4)\times10^{-2} for
the CP-violating phase
\phi^{J/\psi\phi}_s=-0.77(+0.29,-0.37)(-2.36(+0.37,-0.29)), respectively.
","[{""version"":""v1"",""created"":""Wed, 3 Aug 2011 06:52:59 GMT""}]","2012-05-18"
"1108.0762","Dipak Debnath","Dipak Debnath","X-ray properties of the Sun and some compact objects of our Galaxy","173 pages, 57 figures and 13 tables. Ph.D. Thesis",,,,"astro-ph.HE","http://arxiv.org/licenses/nonexclusive-distrib/1.0/","  In the Thesis, I study the X-ray properties of the two major stages of the
life cycle of the stars: one is the normal life of a lighter mass star (Sun)
and another is the collapsed state (black hole) of a star (black hole
candidates GRO J1655-40, GX 339-4 and GRBs). I am lucky to be a team member for
developing X-ray solar space instruments RT-2 (S, G and CZT) which observed
both the Sun and Gamma-Ray Bursts (GRBs) from space. A part of my Thesis
contains development of RT-2 instruments, characterization of CZT & CMOS
imaging detectors (used in RT-2/CZT instrument), some observational results of
solar flares and GRBs. My Thesis also contains the detailed timing & spectral
properties of the 2005 outburst of the well known Galactic black hole candidate
GRO J1655-40 and initial rising phase of 2010 outburst of the transient
Galactic stellar mass black hole candidate GX 339-4.
","[{""version"":""v1"",""created"":""Wed, 3 Aug 2011 07:03:23 GMT""}]","2013-09-19"
"1108.0763","Ramya Sethuram","S. Ramya, T. P. Prabhu, M. Das (Indian Institute of Astrophysics,
  Bangalore)","AGN Activity and Black Hole Masses in Low Surface Brightness Galaxies","27 pages, 8 figures, 4 tables, accepted for publication in MNRAS
  journal",,"10.1111/j.1365-2966.2011.19530.x",,"astro-ph.CO","http://arxiv.org/licenses/nonexclusive-distrib/1.0/","  We present medium resolution optical spectroscopy of a sample of nine Low
Surface Brightness (LSB) galaxies. For those that show clear signatures of AGN
emission, we have disentangled the AGN component from stellar light and any Fe
I and Fe II contribution. We have decomposed the H_alpha line into narrow and
broad components and determined the velocities of the broad components; typical
values lie between 900--2500 km/s. Of the galaxies in our study, UGC 6614, UGC
1922, UGC 6968 and LSBC F568-6 (Malin~2) show clear signatures of AGN activity.
We have calculated the approximate black hole masses for these galaxies from
the H_alpha line emission using the virial approximation. The black hole masses
are ~3x10^{5} M_sun for three galaxies and lie in the intermediate mass black
holes domain rather than the supermassive range. UGC 6614 harbors a BH of mass
3.8x10^{6} M_sun; it also shows an interesting feature blueward of H_alpha and
H_beta implying outflow of gas or a one-sided jet streaming towards us. We have
also measured the bulge stellar velocity dispersions using the Ca II Triplet
lines and plotted these galaxies on the M-sigma plot. We find that all the
three galaxies UGC 6614, UGC 6968 and F568-6 lie below the M-sigma relation for
nearby galaxies. Thus we find that although the bulges of LSB galaxies may be
well evolved, their nuclear black hole masses are lower than those found in
bright galaxies and lie offset from the M-sigma correlation.
","[{""version"":""v1"",""created"":""Wed, 3 Aug 2011 07:07:33 GMT""}]","2015-05-30"
"1108.0764","Ke Deng","Bo Li, Ke Deng, and Heping Zhao","Acoustic guiding and subwavelength imaging with sharp bending by sonic
  crystal","8 pages, 5 figures","Appl. Phys. Lett. 99, 051908 (2011)","10.1063/1.3622652",,"physics.class-ph cond-mat.mtrl-sci","http://arxiv.org/licenses/nonexclusive-distrib/1.0/","  A sharp bending scheme for the self-collimation of acoustic waves is proposed
by simply truncating the sonic crystals. An all-angle and wide-band
90{\deg}-bending wave guide is demonstrated with nearly perfect transmissions
for Gaussian beams at a wide range of incident angles. A 90{\deg}-bended
imaging for a point source with a subwavelength resolution of 0 0.37{\lambda}
is also realized by the proposed structure. These results will find
applicability in the manipulation of acoustic waves by sonic crystals.
","[{""version"":""v1"",""created"":""Wed, 3 Aug 2011 07:11:42 GMT""},{""version"":""v2"",""created"":""Thu, 4 Aug 2011 01:18:40 GMT""}]","2011-08-05"
"1108.0765","W. Prellier","R.V.K. Mangalam, Z. Zhang, T.Wu, and W. Prellier","Switching magnetoresistance in vertically interfaced Pr0.5Ca0.5MnO3
  grown on ZnO nanowires","7 pages, 4 figures, to be published in Applied Physics Letters","Appl. Phys. Lett. 99, 103102 (2011)","10.1063/1.3627182",,"cond-mat.mtrl-sci","http://arxiv.org/licenses/nonexclusive-distrib/1.0/","  The synthesis, morphology and magneto-transport properties of
nanostructure-engineered charge-ordered Pr0.5Ca0.5MnO3 grown on ZnO nanowires
are reported. The stability of the charge-ordering can be tuned, but more
interestingly the sign of the magnetoresistance is inverted at low
temperatures. Coexistence of ferromagnetic clusters on the surface and
antiferromagnetic phase in the core of the grains were considered in order to
understand these features. This work suggests that such a process of growing on
nanowires network can be readily extended to other transition metal oxides and
open doors towards tailoring their functionalities.
","[{""version"":""v1"",""created"":""Wed, 3 Aug 2011 07:18:08 GMT""}]","2011-09-09"
"1108.0766","Valeria D'Amato","Valeria D'Amato, Gabriella Piscopo, Maria Russolillo","The mortality of the Italian population: Smoothing techniques on the
  Lee--Carter model","Published in at http://dx.doi.org/10.1214/10-AOAS394 the Annals of
  Applied Statistics (http://www.imstat.org/aoas/) by the Institute of
  Mathematical Statistics (http://www.imstat.org)","Annals of Applied Statistics 2011, Vol. 5, No. 2A, 705-724","10.1214/10-AOAS394","IMS-AOAS-AOAS394","stat.AP","http://arxiv.org/licenses/nonexclusive-distrib/1.0/","  Several approaches have been developed for forecasting mortality using the
stochastic model. In particular, the Lee-Carter model has become widely used
and there have been various extensions and modifications proposed to attain a
broader interpretation and to capture the main features of the dynamics of the
mortality intensity. Hyndman-Ullah show a particular version of the Lee-Carter
methodology, the so-called Functional Demographic Model, which is one of the
most accurate approaches as regards some mortality data, particularly for
longer forecast horizons where the benefit of a damped trend forecast is
greater. The paper objective is properly to single out the most suitable model
between the basic Lee-Carter and the Functional Demographic Model to the
Italian mortality data. A comparative assessment is made and the empirical
results are presented using a range of graphical analyses.
","[{""version"":""v1"",""created"":""Wed, 3 Aug 2011 07:28:38 GMT""}]","2011-08-04"
